source,section,rank,headline,link,collected_at_iso
India Today,trending,23,"Pakistan launches fresh strikes on Kabul, bombs fuel depot near Kandahar airport",https://www.indiatoday.in/world/story/pakistan-airstrikes-afghanistan-kabul-kandahar-taliban-civilian-deaths-fuel-depot-2881286-2026-03-13,2026-03-13T05:16:00+00:00
India Today,most_read,1,IND vs SA: Deepak Chahar likely to be ruled out of last 2 ODIs due to injury,https://www.indiatoday.in/sports/cricket/story/india-vs-south-africa-deepak-chahar-likely-to-be-ruled-out-of-last-2-odis-due-to-injury-2009550-2022-10-07,2026-03-13T05:16:00+00:00
India Today,most_read,2,Manchester City fined over pitch invasion to celebrate Premier League title win,https://www.indiatoday.in/sports/football/story/manchester-city-fined-by-fa-over-pitch-invasion-to-celebrate-premier-league-title-win-2009534-2022-10-07,2026-03-13T05:16:00+00:00
India Today,most_read,3,Chelsea manager Potter on first month in charge: We have made little bit of progress,https://www.indiatoday.in/sports/football/story/chelsea-manager-graham-potter-on-first-month-in-charge-we-have-made-little-bit-of-progress-2009531-2022-10-07,2026-03-13T05:16:00+00:00
India Today,most_read,4,'Travesty of justice’: Experts criticise errors in UN report on forced disappearances in Bangladesh,https://www.indiatoday.in/world/story/experts-criticise-error-un-report-on-forced-disappearances-in-bangladesh-2007495-2022-10-02,2026-03-13T05:16:00+00:00
India Today,most_read,5,"Fact Check: No alcohol, homosexuality? Conservative guidelines for FIFA World Cup NOT issued by Qatar govt",https://www.indiatoday.in/fact-check/story/fifa-world-cup-guidelines-fact-check-no-alcohol-homosexuality-conservative-guidelines-for-football-world-cup-not-issued-by-qatar-govt-2009495-2022-10-07,2026-03-13T05:16:00+00:00
India Today,most_read,6,"KGF star Yash meets F1 legend Lewis Hamilton, See pic",https://www.indiatoday.in/movies/regional-cinema/story/kgf-star-yash-meets-f1-legend-lewis-hamilton-see-pic-2009525-2022-10-07,2026-03-13T05:16:00+00:00
India Today,most_read,7,"IND vs PAK: Match against India brings out the best in Nida Dar, says Sana Mir",https://www.indiatoday.in/sports/cricket/story/india-vs-pakistan-match-against-india-brings-out-the-best-in-nida-dar-says-sana-mir-2009523-2022-10-07,2026-03-13T05:16:00+00:00
India Today,most_read,8,Women's Asia Cup: India coach Powar defends batting-order reshuffle in Pakistan loss,https://www.indiatoday.in/sports/cricket/story/women-s-asia-cup-india-coach-ramesh-powar-defends-batting-order-reshuffle-in-pakistan-defeat-2009522-2022-10-07,2026-03-13T05:16:00+00:00
India Today,most_read,9,"Gauri Sawant reacts to Sushmita Sen playing her in Taali, recalls their first meeting",https://www.indiatoday.in/entertainment/ott/story/gauri-sawant-reacts-to-sushmita-sen-playing-her-in-taali-recalls-their-first-meeting-2009520-2022-10-07,2026-03-13T05:16:00+00:00
India Today,most_read,10,"'We're all shattered': Loved ones, community hold vigil for slain Sikh family in US",https://www.indiatoday.in/india/story/community-loved-ones-hold-vigil-sikh-family-murder-us-merced-city-2009515-2022-10-07,2026-03-13T05:16:00+00:00
India Today,most_read,11,Richa Chadha wears dainty Bvlgari mangalsutra in stunning pics with husband Ali Fazal. Here’s the price,https://www.indiatoday.in/lifestyle/fashion/story/richa-chadha-wears-dainty-bvlgari-mangalsutra-in-stunning-pics-with-husband-ali-fazal-here-s-the-price-2009509-2022-10-07,2026-03-13T05:16:00+00:00
India Today,most_read,12,"What to watch on Netflix, Disney+ Hotstar and Amazon Prime Video this weekend",https://www.indiatoday.in/entertainment/ott/story/what-to-watch-on-netflix-disney-hotstar-and-amazon-prime-video-this-weekend-2009510-2022-10-07,2026-03-13T05:16:00+00:00
India Today,most_read,13,Karnataka govt to hike SC/ST reservation,https://www.indiatoday.in/india/story/karnataka-hike-sc-st-reservation-quota-justice-nagamohan-das-committee-report-2009505-2022-10-07,2026-03-13T05:16:00+00:00
India Today,most_read,14,"Delhi civic body identifies 250 mosquito breeding hotspots, launches drive",https://www.indiatoday.in/cities/delhi/story/delhi-civic-body-identifies-mosquito-breeding-hotspots-launches-drive-2009508-2022-10-07,2026-03-13T05:16:00+00:00
India Today,most_read,15,"Your weekly news quiz, October 7 | Play on",https://www.indiatoday.in/india/story/your-weekly-news-quiz-october-7-play-on-2009506-2022-10-07,2026-03-13T05:16:00+00:00
India Today,most_read,16,"Salman Khan was on Mohali RPG attacker's hitlist, says Delhi Police",https://www.indiatoday.in/india/story/delhi-police-arrest-mohali-rpg-attacker-salman-khan-was-on-hit-list-2009502-2022-10-07,2026-03-13T05:16:00+00:00
India Today,most_read,17,"Iran denies security forces killed 16-year-old, says she fell off roof",https://www.indiatoday.in/world/story/iran-security-forces-16-year-old-killed-protest-on-death-of-woman-in-police-custody-2009503-2022-10-07,2026-03-13T05:16:00+00:00
India Today,most_read,18,"Vande Bharat Express rams into cattle, suffers minor damage; 2nd incident in 2 days",https://www.indiatoday.in/india/story/vande-bharat-express-hits-cattle-suffers-minor-damage-gujarat-2009490-2022-10-07,2026-03-13T05:16:00+00:00
India Today,most_read,19,2 Madhya Pradesh Congress MLAs booked for harassing woman on train,https://www.indiatoday.in/crime/story/2-madhya-pradesh-congress-mlas-booked-for-harassing-woman-on-train-2009441-2022-10-07,2026-03-13T05:16:00+00:00
India Today,most_read,20,Rashmika Mandanna has no regrets for not being able to spend time with her sister. Here's why,https://www.indiatoday.in/movies/regional-cinema/story/rashmika-mandanna-has-no-regrets-for-not-being-able-to-spend-time-with-her-sister-here-s-why-2009492-2022-10-07,2026-03-13T05:16:00+00:00
India Today,most_read,21,"CISCE cancels ICSE, ISC board exams in UAE for thousands of Indian students",https://www.indiatoday.in/education-today/news/story/cisce-cancels-icse-isc-board-exams-in-uae-for-thousands-of-indian-students-2881273-2026-03-13,2026-03-13T05:16:00+00:00
India Today,most_read,22,"Suit, stocks and squash: Ramit Tandon now eyes the Olympic dream for India",https://www.indiatoday.in/sports/other-sports/story/ramit-tandon-finance-job-squash-olympics-journey-indian-open-2026-2881272-2026-03-13,2026-03-13T05:16:00+00:00
India Today,most_read,23,Kapoor family copyrights Rishi Kapoor’s name posthumously to prevent misuse,https://www.indiatoday.in/movies/celebrities/story/kapoor-family-copyrights-rishi-kapoors-name-posthumously-to-prevent-misuse-2881251-2026-03-13,2026-03-13T05:16:00+00:00
India Today,most_read,24,"Who is Ali Jafari, the mastermind who made Iran's defeat impossible?",https://www.indiatoday.in/world/story/iran-us-israel-war-tehran-resilience-general-ali-jafari-mosaic-defence-doctrine-irgc-2880458-2026-03-13,2026-03-13T05:16:00+00:00
India Today,most_read,25,"Iran's new Supreme Leader Mojtaba Khamenei lost a leg, is in coma: Report",https://www.indiatoday.in/world/story/irans-new-supreme-leader-mojtaba-khamenei-lost-a-leg-is-in-coma-after-strike-report-2881209-2026-03-13,2026-03-13T05:16:00+00:00
India Today,most_read,26,Indian-origin man may face deportation over viral dance video at WW2 Memorial in US,https://www.indiatoday.in/world/story/indian-origin-man-madhu-raju-face-deportation-viral-video-tik-tok-dance-world-war-two-memorial-washington-dc-us-2878879-2026-03-08,2026-03-13T05:16:00+00:00
India Today,most_read,27,Sanju Samson's my dear pondatti message melts hearts after T20 World Cup heroics,https://www.indiatoday.in/sports/cricket/story/t20-world-cup-final-sanju-samson-wife-instagram-message-reaches-thiruvananthapuram-parents-2879524-2026-03-09,2026-03-13T05:16:00+00:00
India Today,most_read,28,"Daughter shares video of mother marrying her soulmate, internet emotional",https://www.indiatoday.in/trending-news/story/daughter-shares-heartwarming-video-of-mother-marrying-her-soulmate-internet-emotional-2878206-2026-03-06,2026-03-13T05:16:00+00:00
India Today,most_read,29,"Woman removed from flight for playing video aloud, meltdown caught on camera",https://www.indiatoday.in/trending-news/story/woman-removed-from-american-airlines-flight-for-playing-video-aloud-meltdown-caught-on-camera-2880192-2026-03-11,2026-03-13T05:16:00+00:00
India Today,most_read,30,Andhra student punches teacher as classroom dispute turns violent. Video goes viral,https://www.indiatoday.in/trending-news/story/andhra-class-10-student-punches-teacher-as-classroom-dispute-turns-violent-video-goes-viral-2878362-2026-03-06,2026-03-13T05:16:00+00:00
