source,section,rank,headline,link,collected_at_iso
India Today,trending,3,"Dogs tied to poles, cats left behind: Expats flee Dubai without pets amid war",https://www.indiatoday.in/trending-news/story/dogs-tied-to-poles-cats-left-behind-expats-flee-dubai-without-pets-amid-us-israel-iran-crisis-2879986-2026-03-10,2026-03-10T17:01:33+00:00
India Today,trending,4,Mumbai boy's dangerous stunt inside metro coach sparks parenting debate,https://www.indiatoday.in/trending-news/story/mumbai-boys-dangerous-stunt-inside-metro-coach-sparks-parenting-debate-2879959-2026-03-10,2026-03-10T17:01:33+00:00
India Today,trending,5,"Indian man replies to work email during the weekend, here's what his German boss did",https://www.indiatoday.in/trending-news/story/indian-man-replies-to-work-email-during-the-weekend-heres-what-his-german-boss-did-2879945-2026-03-10,2026-03-10T17:01:33+00:00
India Today,trending,6,"UK man celebrates India's T20 World Cup win in Delhi with locals, shares video",https://www.indiatoday.in/trending-news/story/uk-man-celebrates-indias-t20-world-cup-win-in-delhi-with-locals-shares-video-2879883-2026-03-10,2026-03-10T17:01:33+00:00
India Today,trending,7,Bengali woman shares 4 signs her British husband is living the true Bong life,https://www.indiatoday.in/trending-news/story/bengali-woman-shares-4-signs-her-british-husband-is-living-the-true-bong-life-2879915-2026-03-10,2026-03-10T17:01:33+00:00
India Today,trending,8,70-year-old 'Insta uncle' who started making vlogs celebrates new YouTube milestone,https://www.indiatoday.in/trending-news/story/70-year-old-insta-uncle-who-started-making-vlogs-celebrates-new-youtube-milestone-2879783-2026-03-10,2026-03-10T17:01:33+00:00
India Today,trending,9,"Bengaluru techie turns grandfather's rotary phone into AI assistant for Rs 2,000",https://www.indiatoday.in/trending-news/story/bengaluru-techie-turns-grandfather-rotary-phone-into-ai-assistant-kiri-for-rs-2000-2879784-2026-03-10,2026-03-10T17:01:33+00:00
India Today,trending,10,Bengaluru man's 3 observations about types of passengers in metro go viral,https://www.indiatoday.in/trending-news/story/bengaluru-mans-3-observations-about-types-of-passengers-in-metro-go-viral-2879766-2026-03-10,2026-03-10T17:01:33+00:00
India Today,trending,11,"NRI rants about family's lavish expectations, reveals his 'dal chawal' reality",https://www.indiatoday.in/trending-news/story/nri-rants-about-familys-lavish-expectations-reveals-his-dal-chawal-reality-2879656-2026-03-10,2026-03-10T17:01:33+00:00
India Today,trending,12,"Family turns Lucknow train coach into 'reel studio', passenger calls helpline",https://www.indiatoday.in/trending-news/story/garib-rath-express-family-turns-lucknow-train-coach-into-reel-studio-passenger-calls-helpline-2879699-2026-03-10,2026-03-10T17:01:33+00:00
India Today,trending,13,SBI employee's retirement video shows emotional farewell from colleagues at branch,https://www.indiatoday.in/trending-news/story/sbi-employee-retirement-video-shows-emotional-farewell-from-colleagues-at-kerala-branch-2879480-2026-03-09,2026-03-10T17:01:33+00:00
India Today,trending,14,"Woman spots two rare 'doomsday fish' on Mexico beach, records surreal moment",https://www.indiatoday.in/trending-news/story/woman-spots-two-rare-doomsday-fish-oarfish-on-mexico-beach-records-surreal-moment-2879388-2026-03-09,2026-03-10T17:01:33+00:00
India Today,trending,15,"The Big BOOM Theory: GOAT is dead, all hail the new king",https://www.indiatoday.in/trending-news/story/the-big-boom-theory-goat-is-dead-all-hail-new-king-jasprit-bumrah-india-vs-new-zealand-final-t20-world-cup-2879366-2026-03-09,2026-03-10T17:01:33+00:00
India Today,trending,16,"Delhi, UP Police's Bumrah banter after India's T20 World Cup win goes viral",https://www.indiatoday.in/trending-news/story/delhi-police-up-police-bumrah-banter-after-india-t20-world-cup-win-goes-viral-2879299-2026-03-09,2026-03-10T17:01:33+00:00
India Today,trending,17,Chennai doctor hands newborn to nervous father in video with 198 million views,https://www.indiatoday.in/trending-news/story/chennai-doctor-hands-newborn-to-nervous-father-in-adorable-video-with-198-million-views-2879247-2026-03-09,2026-03-10T17:01:33+00:00
India Today,trending,18,Reddit user moved to Delhi from Assam expecting it to be expensive. And then...,https://www.indiatoday.in/trending-news/story/reddit-user-moved-to-delhi-from-assam-expecting-it-to-be-expensive-and-then-2879049-2026-03-08,2026-03-10T17:01:33+00:00
India Today,trending,19,Bengaluru man shares post about Ahmedabad's late-night vibe. Internet weighs in,https://www.indiatoday.in/trending-news/story/bengaluru-man-shares-post-about-ahmedabads-late-night-vibe-internet-weighs-in-2879024-2026-03-08,2026-03-10T17:01:33+00:00
India Today,trending,20,Air India raises fuel surcharge as Iran war pushes up jet fuel prices,https://www.indiatoday.in/business/story/air-india-raises-fuel-surcharge-as-iran-war-pushes-up-jet-fuel-prices-travel-to-get-costlier-2880044-2026-03-10,2026-03-10T17:01:33+00:00
India Today,trending,21,"44 Tamil Nadu students hospitalised after lizard found in meal, BJP slams govt",https://www.indiatoday.in/india/story/44-students-hospitalised-after-lizard-found-in-tamil-nadu-school-midday-meal-2880038-2026-03-10,2026-03-10T17:01:33+00:00
India Today,trending,22,"Rajpal Yadav celebrates 20 years of Malamaal Weekly, thanks fans for love",https://www.indiatoday.in/movies/celebrities/story/rajpal-yadav-celebrates-20-years-of-malamaal-weekly-thanks-fans-for-love-2880039-2026-03-10,2026-03-10T17:01:33+00:00
India Today,trending,23,Virat Kohli's special message to 'chetta' Samson after Player of the Tournament award,https://www.indiatoday.in/sports/cricket/story/virat-kohlis-message-to-sanju-samson-player-of-the-tournament-award-ind-vs-nz-t20-world-cup-final-2879164-2026-03-09,2026-03-10T17:01:33+00:00
India Today,trending,24,India have ruined cricket: Salty Shoaib Akhtar reacts to one-sided T20 World Cup win,https://www.indiatoday.in/sports/cricket/story/ind-vs-nz-t20-world-cup-final-shoaib-akhtar-bizarre-claim-ruined-cricket-dominance-2879239-2026-03-09,2026-03-10T17:01:33+00:00
India Today,most_read,1,IND vs SA: Deepak Chahar likely to be ruled out of last 2 ODIs due to injury,https://www.indiatoday.in/sports/cricket/story/india-vs-south-africa-deepak-chahar-likely-to-be-ruled-out-of-last-2-odis-due-to-injury-2009550-2022-10-07,2026-03-10T17:01:33+00:00
India Today,most_read,2,Manchester City fined over pitch invasion to celebrate Premier League title win,https://www.indiatoday.in/sports/football/story/manchester-city-fined-by-fa-over-pitch-invasion-to-celebrate-premier-league-title-win-2009534-2022-10-07,2026-03-10T17:01:33+00:00
India Today,most_read,3,Chelsea manager Potter on first month in charge: We have made little bit of progress,https://www.indiatoday.in/sports/football/story/chelsea-manager-graham-potter-on-first-month-in-charge-we-have-made-little-bit-of-progress-2009531-2022-10-07,2026-03-10T17:01:33+00:00
India Today,most_read,4,'Travesty of justice’: Experts criticise errors in UN report on forced disappearances in Bangladesh,https://www.indiatoday.in/world/story/experts-criticise-error-un-report-on-forced-disappearances-in-bangladesh-2007495-2022-10-02,2026-03-10T17:01:33+00:00
India Today,most_read,5,"Fact Check: No alcohol, homosexuality? Conservative guidelines for FIFA World Cup NOT issued by Qatar govt",https://www.indiatoday.in/fact-check/story/fifa-world-cup-guidelines-fact-check-no-alcohol-homosexuality-conservative-guidelines-for-football-world-cup-not-issued-by-qatar-govt-2009495-2022-10-07,2026-03-10T17:01:33+00:00
India Today,most_read,6,"KGF star Yash meets F1 legend Lewis Hamilton, See pic",https://www.indiatoday.in/movies/regional-cinema/story/kgf-star-yash-meets-f1-legend-lewis-hamilton-see-pic-2009525-2022-10-07,2026-03-10T17:01:33+00:00
India Today,most_read,7,"IND vs PAK: Match against India brings out the best in Nida Dar, says Sana Mir",https://www.indiatoday.in/sports/cricket/story/india-vs-pakistan-match-against-india-brings-out-the-best-in-nida-dar-says-sana-mir-2009523-2022-10-07,2026-03-10T17:01:33+00:00
India Today,most_read,8,Women's Asia Cup: India coach Powar defends batting-order reshuffle in Pakistan loss,https://www.indiatoday.in/sports/cricket/story/women-s-asia-cup-india-coach-ramesh-powar-defends-batting-order-reshuffle-in-pakistan-defeat-2009522-2022-10-07,2026-03-10T17:01:33+00:00
India Today,most_read,9,"Gauri Sawant reacts to Sushmita Sen playing her in Taali, recalls their first meeting",https://www.indiatoday.in/entertainment/ott/story/gauri-sawant-reacts-to-sushmita-sen-playing-her-in-taali-recalls-their-first-meeting-2009520-2022-10-07,2026-03-10T17:01:33+00:00
India Today,most_read,10,"'We're all shattered': Loved ones, community hold vigil for slain Sikh family in US",https://www.indiatoday.in/india/story/community-loved-ones-hold-vigil-sikh-family-murder-us-merced-city-2009515-2022-10-07,2026-03-10T17:01:33+00:00
India Today,most_read,11,Richa Chadha wears dainty Bvlgari mangalsutra in stunning pics with husband Ali Fazal. Here’s the price,https://www.indiatoday.in/lifestyle/fashion/story/richa-chadha-wears-dainty-bvlgari-mangalsutra-in-stunning-pics-with-husband-ali-fazal-here-s-the-price-2009509-2022-10-07,2026-03-10T17:01:33+00:00
India Today,most_read,12,"What to watch on Netflix, Disney+ Hotstar and Amazon Prime Video this weekend",https://www.indiatoday.in/entertainment/ott/story/what-to-watch-on-netflix-disney-hotstar-and-amazon-prime-video-this-weekend-2009510-2022-10-07,2026-03-10T17:01:33+00:00
India Today,most_read,13,Karnataka govt to hike SC/ST reservation,https://www.indiatoday.in/india/story/karnataka-hike-sc-st-reservation-quota-justice-nagamohan-das-committee-report-2009505-2022-10-07,2026-03-10T17:01:33+00:00
India Today,most_read,14,"Delhi civic body identifies 250 mosquito breeding hotspots, launches drive",https://www.indiatoday.in/cities/delhi/story/delhi-civic-body-identifies-mosquito-breeding-hotspots-launches-drive-2009508-2022-10-07,2026-03-10T17:01:33+00:00
India Today,most_read,15,"Your weekly news quiz, October 7 | Play on",https://www.indiatoday.in/india/story/your-weekly-news-quiz-october-7-play-on-2009506-2022-10-07,2026-03-10T17:01:33+00:00
India Today,most_read,16,"Salman Khan was on Mohali RPG attacker's hitlist, says Delhi Police",https://www.indiatoday.in/india/story/delhi-police-arrest-mohali-rpg-attacker-salman-khan-was-on-hit-list-2009502-2022-10-07,2026-03-10T17:01:33+00:00
India Today,most_read,17,"Iran denies security forces killed 16-year-old, says she fell off roof",https://www.indiatoday.in/world/story/iran-security-forces-16-year-old-killed-protest-on-death-of-woman-in-police-custody-2009503-2022-10-07,2026-03-10T17:01:33+00:00
India Today,most_read,18,"Vande Bharat Express rams into cattle, suffers minor damage; 2nd incident in 2 days",https://www.indiatoday.in/india/story/vande-bharat-express-hits-cattle-suffers-minor-damage-gujarat-2009490-2022-10-07,2026-03-10T17:01:33+00:00
India Today,most_read,19,2 Madhya Pradesh Congress MLAs booked for harassing woman on train,https://www.indiatoday.in/crime/story/2-madhya-pradesh-congress-mlas-booked-for-harassing-woman-on-train-2009441-2022-10-07,2026-03-10T17:01:33+00:00
India Today,most_read,20,Rashmika Mandanna has no regrets for not being able to spend time with her sister. Here's why,https://www.indiatoday.in/movies/regional-cinema/story/rashmika-mandanna-has-no-regrets-for-not-being-able-to-spend-time-with-her-sister-here-s-why-2009492-2022-10-07,2026-03-10T17:01:33+00:00
India Today,most_read,21,"44 Tamil Nadu students hospitalised after lizard found in meal, BJP slams govt",https://www.indiatoday.in/india/story/44-students-hospitalised-after-lizard-found-in-tamil-nadu-school-midday-meal-2880038-2026-03-10,2026-03-10T17:01:33+00:00
India Today,most_read,22,"Rajpal Yadav celebrates 20 years of Malamaal Weekly, thanks fans for love",https://www.indiatoday.in/movies/celebrities/story/rajpal-yadav-celebrates-20-years-of-malamaal-weekly-thanks-fans-for-love-2880039-2026-03-10,2026-03-10T17:01:33+00:00
India Today,most_read,23,"G7 stops short of releasing oil reserves, asks IEA to assess market options",https://www.indiatoday.in/business/story/g7-stops-short-of-releasing-oil-reserve-asks-iea-to-assess-market-options-2880033-2026-03-10,2026-03-10T17:01:33+00:00
India Today,most_read,24,"Supreme Court notice to Kunal Kamra, others on Centre's plea over fact-check rules",https://www.indiatoday.in/india/law-news/story/supreme-court-notice-kunal-kamra-others-centre-plea-challenges-bombay-high-court-striking-down-fact-check-unit-rules-2880017-2026-03-10,2026-03-10T17:01:33+00:00
India Today,most_read,25,Bengaluru techie dies by suicide after dispute with mother-in-law over cooking,https://www.indiatoday.in/cities/bengaluru/story/software-engineer-suicide-dispute-mother-in-law-cooking-bengaluru-second-techie-suicide-in-city-week-2877299-2026-03-04,2026-03-10T17:01:33+00:00
India Today,most_read,26,Dutch bride's Rajasthani dance surprise delights Marwadi groom. Watch videos,https://www.indiatoday.in/trending-news/story/dutch-bride-rajasthani-dance-surprise-delights-marwadi-groom-watch-videos-2877782-2026-03-05,2026-03-10T17:01:33+00:00
India Today,most_read,27,Ravi Shastri slammed after ruining India's T20 World Cup-winning moment on commentary,https://www.indiatoday.in/sports/cricket/story/ravi-shastri-ninth-wicket-commentary-gaffe-india-t20-world-cup-win-2879296-2026-03-09,2026-03-10T17:01:33+00:00
India Today,most_read,28,"Man crashes into pole while leaning out of moving train to film reel, falls down",https://www.indiatoday.in/trending-news/story/man-crashes-into-pole-while-leaning-out-of-moving-train-to-film-reel-falls-down-2877838-2026-03-05,2026-03-10T17:01:33+00:00
India Today,most_read,29,Bengaluru Police traces auto rickshaw to recover UK tourist's lost bag,https://www.indiatoday.in/trending-news/story/bengaluru-police-traces-auto-rickshaw-to-recover-uk-tourists-lost-bag-2880008-2026-03-10,2026-03-10T17:01:33+00:00
India Today,most_read,30,Aishwarya-Abhishek Bachchan dazzle at Arjun Tendulkar-Saaniya's wedding. Watch,https://www.indiatoday.in/movies/celebrities/story/aishwarya-rai-abhishek-bachchan-arrive-arjun-tendulkar-saaniya-chandhok-wedding-2877692-2026-03-05,2026-03-10T17:01:33+00:00
