source,section,rank,headline,link,collected_at_iso
Times of India,trending,31,The Kerala Story 2,https://timesofindia.indiatimes.com/articleshow/129188287.cms,2026-03-09T07:11:37+00:00
Times of India,trending,32,Rihanna Net Worth,https://timesofindia.indiatimes.com/articleshow/129314378.cms,2026-03-09T07:11:37+00:00
Times of India,trending,33,Bollywood War Movies,https://timesofindia.indiatimes.com/articleshow/129203388.cms,2026-03-09T07:11:37+00:00
Times of India,trending,34,The Great Indian Kapil Show 4,https://timesofindia.indiatimes.com/articleshow/129125820.cms,2026-03-09T07:11:37+00:00
Times of India,trending,35,Maruti Brezza Facelift Spied,https://timesofindia.indiatimes.com/articleshow/129146065.cms,2026-03-09T07:11:37+00:00
Times of India,trending,36,Lab Grown Diamonds,https://timesofindia.indiatimes.com/articleshow/129090781.cms,2026-03-09T07:11:37+00:00
Times of India,trending,37,Social Media Ban,https://timesofindia.indiatimes.com/articleshow/129152683.cms,2026-03-09T07:11:37+00:00
Times of India,trending,38,Women’s Day AI Prompts,https://timesofindia.indiatimes.com/articleshow/129253033.cms,2026-03-09T07:11:37+00:00
Times of India,trending,39,Hyderabad Mall Hoarding Collapse,https://timesofindia.indiatimes.com/articleshow/129286460.cms,2026-03-09T07:11:37+00:00
Times of India,trending,40,Indian Cricket Team,https://timesofindia.indiatimes.com/articleshow/129304768.cms,2026-03-09T07:11:37+00:00
Times of India,trending,41,UPMSP Board Exam,https://timesofindia.indiatimes.com/articleshow/129310691.cms,2026-03-09T07:11:37+00:00
Times of India,trending,42,RRB Group D Recruitment,https://timesofindia.indiatimes.com/articleshow/129308267.cms,2026-03-09T07:11:37+00:00
Times of India,trending,43,NMMS Admit Card,https://timesofindia.indiatimes.com/articleshow/129304165.cms,2026-03-09T07:11:37+00:00
Times of India,trending,44,RRB Paramedical Admit Card,https://timesofindia.indiatimes.com/articleshow/129306262.cms,2026-03-09T07:11:37+00:00
Times of India,trending,45,Pune Spiritual School Closure,https://timesofindia.indiatimes.com/articleshow/129299407.cms,2026-03-09T07:11:37+00:00
Times of India,trending,46,Who is Mojtaba Khamenei,https://timesofindia.indiatimes.com/articleshow/129292991.cms,2026-03-09T07:11:37+00:00
Times of India,trending,47,Middle East News,https://timesofindia.indiatimes.com/articleshow/129309840.cms,2026-03-09T07:11:37+00:00
Times of India,trending,48,Tarun Khatik Murder,https://timesofindia.indiatimes.com/articleshow/129311729.cms,2026-03-09T07:11:37+00:00
Times of India,trending,49,Delhi Excise Policy Case,https://timesofindia.indiatimes.com/articleshow/129314045.cms,2026-03-09T07:11:37+00:00
Times of India,trending,50,Dubai travel update,https://timesofindia.indiatimes.com/articleshow/129257319.cms,2026-03-09T07:11:37+00:00
Times of India,trending,51,Junaid-Nasir murder case,https://timesofindia.indiatimes.com/articleshow/129256430.cms,2026-03-09T07:11:37+00:00
Times of India,trending,52,Vande Bharat Express,https://timesofindia.indiatimes.com/articleshow/129255542.cms,2026-03-09T07:11:37+00:00
Times of India,trending,53,Delhi Metro corridors,https://timesofindia.indiatimes.com/articleshow/129254569.cms,2026-03-09T07:11:37+00:00
Times of India,trending,54,MLB opening day,https://timesofindia.indiatimes.com/articleshow/129169077.cms,2026-03-09T07:11:37+00:00
Times of India,trending,55,Mumbai Indians New IPL Jersey,https://timesofindia.indiatimes.com/articleshow/129151315.cms,2026-03-09T07:11:37+00:00
Times of India,trending,56,Oppo Find N6,https://timesofindia.indiatimes.com/articleshow/129315468.cms,2026-03-09T07:11:37+00:00
Times of India,trending,57,Electric Cars Vs Petrol Cars,https://timesofindia.indiatimes.com/articleshow/129200029.cms,2026-03-09T07:11:37+00:00
Times of India,trending,58,Apple Macbook Air M5,https://timesofindia.indiatimes.com/articleshow/128978084.cms,2026-03-09T07:11:37+00:00
Times of India,trending,59,Anthropic Ceo Dario Amodei,https://timesofindia.indiatimes.com/articleshow/129137566.cms,2026-03-09T07:11:37+00:00
Times of India,trending,60,Iulia Vantur shares RARE photo with Salman Khan’s mother Salma Khan and Helen on Women’s Day: 'I'm a blessed daughter',https://timesofindia.indiatimes.com/articleshow/129316595.cms,2026-03-09T07:11:37+00:00
Times of India,trending,61,"Ryan Gosling’s on SNL: Harry Styles, Anoushka Shankar light up the set during his gig",https://timesofindia.indiatimes.com/articleshow/129316996.cms,2026-03-09T07:11:37+00:00
Times of India,trending,62,From London luxury homes to shell firms: The wealth network linked to Iran’s new supreme leader Mojtaba Khamenei,https://timesofindia.indiatimes.com/articleshow/129316903.cms,2026-03-09T07:11:37+00:00
Times of India,trending,63,Supriya Pathak reacts to Jaya Bachchan’s ‘gandi pants’ comment: 'Everything is momentary',https://timesofindia.indiatimes.com/articleshow/129316839.cms,2026-03-09T07:11:37+00:00
Times of India,trending,64,"Immigration expert sees sharp drop in H-1B visa filings, says: We are down about 50% filings compared to the previous year partly due to …",https://timesofindia.indiatimes.com/articleshow/129316731.cms,2026-03-09T07:11:37+00:00
Times of India,trending,65,Sara Arjun's father issues statement after fake post takes a dig at Yash's 'Toxic' ahead of 'Dhurandhar The Revenge' release,https://timesofindia.indiatimes.com/articleshow/129316000.cms,2026-03-09T07:11:37+00:00
Times of India,trending,66,'These games will define his career': Sunil Gavaskar hails India’s clutch hero Sanju Samson,https://timesofindia.indiatimes.com/articleshow/129316288.cms,2026-03-09T07:11:37+00:00
Times of India,trending,67,Why South India’s real estate market is set to surge on massive infrastructure investments,https://timesofindia.indiatimes.com/articleshow/129314884.cms,2026-03-09T07:11:37+00:00
Times of India,trending,68,'I just didn't understand…': Mohammad Amir slams New Zealand bowlers after T20 World Cup final loss to India,https://timesofindia.indiatimes.com/articleshow/129316454.cms,2026-03-09T07:11:37+00:00
Times of India,trending,69,SSC CGL 2025: Post preference submission window opens today for Tier-II candidates,https://timesofindia.indiatimes.com/articleshow/129315598.cms,2026-03-09T07:11:37+00:00
Times of India,trending,70,Basoda 2026: When is Sheetala Ashtami? check date and puja rituals,https://timesofindia.indiatimes.com/articleshow/129314558.cms,2026-03-09T07:11:37+00:00
Times of India,trending,71,"As the bombing intensifies, the debate about Iran is missing the real point",https://timesofindia.indiatimes.com/articleshow/129314678.cms,2026-03-09T07:11:37+00:00
Times of India,trending,72,Riddhi Kumar: Being a modern Indian woman is simply being an individual,https://timesofindia.indiatimes.com/articleshow/129316055.cms,2026-03-09T07:11:37+00:00
Times of India,trending,73,"‘Yeh Rishta Kya Kehlata Hai’ March 8 written update: Kaveri goes missing, Armaan and Abhira go look for them",https://timesofindia.indiatimes.com/articleshow/129315563.cms,2026-03-09T07:11:37+00:00
Times of India,trending,74,"Mahesh Babu, Jr NTR, Ram Charan, Allu Arjun and others celebrate Team India's T20 World Cup win",https://timesofindia.indiatimes.com/articleshow/129315416.cms,2026-03-09T07:11:37+00:00
Times of India,trending,75,Navya Naveli Nanda on the BEST advice from grandmother Jaya Bachchan: 'If we start looking at what people expect of us...',https://timesofindia.indiatimes.com/articleshow/129315717.cms,2026-03-09T07:11:37+00:00
Times of India,trending,76,"""Silicon Valley has always been a long shot"": Asana CEO Dan Rogers tells Gen Z to stop chasing shortcuts and build skills the hard way",https://timesofindia.indiatimes.com/articleshow/129315546.cms,2026-03-09T07:11:37+00:00
NDTV,most_read,1,"""Right Thing To Do"": S Jaishankar In Parliament On Iran Ship's Kochi Docking",https://www.ndtv.com/india-news/iran-israel-war-iris-lavan-right-thing-to-do-s-jaishankar-in-parliament-on-iran-ships-kochi-docking-11188718,2026-03-09T07:11:37+00:00
NDTV,most_read,2,"""Every Effort Being Made To Bring Back Stuck Indians"": S Jaishankar On Iran War",https://www.ndtv.com/india-news/iran-war-middle-east-war-s-jaishankar-dialogue-diplomacy-only-solution-s-jaishankar-on-iran-war-amid-house-chaos-11188558,2026-03-09T07:11:37+00:00
NDTV,most_read,3,"Iran War Wipes Off Rs 30 Lakh Crore, Rs 12 Lakh Crore Lost Just Today",https://www.ndtv.com/india-news/iran-war-wipes-over-rs-30-lakh-crore-off-investors-wealth-11188532,2026-03-09T07:11:37+00:00
NDTV,most_read,4,"Surat Women Use ChatGPT For Suicide In Temple Washroom, Elon Musk Reacts",https://www.ndtv.com/india-news/elon-musk-surat-chatgpt-suicide-surat-women-use-chatgpt-for-suicide-in-temple-washroom-elon-musk-reacts-11188445,2026-03-09T07:11:37+00:00
NDTV,most_read,5,"Who Was Vallabh Maheshwari, Shakun Group MD Killed In BMW Crash",https://www.ndtv.com/india-news/who-was-vallabh-maheshwari-shakun-group-md-killed-in-bmw-crash-on-delhi-mumbai-expressway-rajasthan-alwar-11188344,2026-03-09T07:11:37+00:00
NDTV,most_read,6,MH CET 2026: Last Chance To Correct Applications For Professional Courses,https://www.ndtv.com/education/maharashtra-state-common-entrance-test-2026-last-chance-to-correct-applications-for-professional-courses-11188711,2026-03-09T07:11:37+00:00
NDTV,most_read,7,Maharashtra Teachers Suspended For Using ChatGPT To Help Students Cheat,https://www.ndtv.com/education/maharashtra-teachers-suspended-for-using-chatgpt-to-help-students-cheat-in-board-exams-11188411,2026-03-09T07:11:37+00:00
NDTV,most_read,8,NEET UG 2026 Registration Deadline Extended To March 11: Check How To Apply,https://www.ndtv.com/education/nta-issues-notice-neet-ug-2026-registration-deadline-extended-to-march-11-check-how-to-apply-11188131,2026-03-09T07:11:37+00:00
NDTV,most_read,9,"JEE Advanced 2026 Date Announced: Exam On May 17, Registration From April 23",https://www.ndtv.com/education/iit-roorkee-announced-jee-advanced-2026-date-exam-on-may-17-registration-from-april-23-11187898,2026-03-09T07:11:37+00:00
NDTV,most_read,10,CBSE Board Exams 2026 Live Updates: Mathematics Exam Begins Amid Strict Monitoring,https://www.ndtv.com/education/cbse-board-exams-2026-live-updates-class-12-mathematics-paper-today-11187773,2026-03-09T07:11:37+00:00
NDTV,most_read,11,"'Iran School Struck By Tomahawk, Israel Not Known To Have It': Fact-Checker",https://www.ndtv.com/world-news/iran-israel-war-iran-school-attacked-by-us-tomahawk-missile-fact-checker-bellingcat-mehr-news-iran-school-strike-video-11188515,2026-03-09T07:11:37+00:00
NDTV,most_read,12,Who Will Trump Attack Next? Hint: Follow The Chinese Money Trail,https://www.ndtv.com/opinion/us-iran-israel-war-whats-common-to-iran-venezuela-cuba-3-different-deals-and-a-chinese-channel-11188274,2026-03-09T07:11:37+00:00
NDTV,most_read,13,"Stock Market LIVE: Bloodbath In Markets As Sensex Crashes, Nifty Down",https://www.ndtv.com/india-news/stock-marketlive-updates-sensex-nifty-likely-to-crash-as-oil-crosses-105-mark-11187870,2026-03-09T07:11:37+00:00
NDTV,most_read,14,"Iran Defies Trump, Names Khamenei's Son Mojtaba As New Supreme Leader",https://www.ndtv.com/world-news/iran-israel-us-war-news-live-khameneis-son-mojtaba-khamenei-named-irans-new-supreme-leader-11187447,2026-03-09T07:11:37+00:00
NDTV,most_read,15,BJP Fact-Checks Mamata Banerjee's 'President Standing' Photo Attack On PM,https://www.ndtv.com/india-news/president-droupadi-murmu-pm-narendra-modi-mamata-banerjee-president-row-spirals-mamata-banerjees-targets-pm-modi-with-photo-proof-11188113,2026-03-09T07:11:37+00:00
NDTV,most_read,16,The Hidden Power Network Behind Mojtaba Khamenei's Rise To Supreme Leader,https://www.ndtv.com/world-news/the-secret-power-network-that-made-mojtaba-khamenei-a-supreme-leader-11188594,2026-03-09T07:11:37+00:00
NDTV,most_read,17,Shakun Group MD Dies As BMW Crashes On Delhi-Mumbai Expressway,https://www.ndtv.com/india-news/shakun-group-md-vallabh-maheshwari-dies-as-bmw-crashes-on-delhi-mumbai-expressway-rajasthan-alwar-jaipur-based-buisnessman-11188285,2026-03-09T07:11:37+00:00
NDTV,most_read,18,LIVE: Saudi Warns Iran It Will Be Biggest Loser If It Continues Attacks,https://www.ndtv.com/world-news/iran-israel-war-live-updates-us-middle-east-crisis-news-mojtaba-khamenei-iran-new-supreme-leader-donald-trump-netanyahu-dubai-11187798,2026-03-09T07:11:37+00:00
NDTV,most_read,19,"Iran's New Leader Mojtaba Khamenei Fights Trump, Israel, Anger At Home",https://www.ndtv.com/world-news/irans-new-supreme-leader-mojtaba-khamenei-fights-donald-trump-israel-anger-at-home-middle-east-conflict-11188134,2026-03-09T07:11:37+00:00
NDTV,most_read,20,20 Million Barrels At Risk: Could Hormuz Trigger A Shock Bigger Than 1973?,https://www.ndtv.com/world-news/iran-israel-war-one-strait-20-million-barrels-could-hormuz-trigger-an-oil-shock-bigger-than-1973-11188433,2026-03-09T07:11:37+00:00
NDTV,most_read,21,How Iran Plotted To Assassinate Trump Before He Struck Back: Report,https://www.ndtv.com/world-news/iran-israel-war-live-updates-donald-trump-how-iran-plotted-to-assassinate-trump-before-he-struck-back-report-11188482,2026-03-09T07:11:37+00:00
NDTV,most_read,22,"Mumbai Woman Pays Rs 1 Lakh Rent For 2 BHK In Parel, Sparks Debate",https://www.ndtv.com/offbeat/mumbai-woman-pays-rs-1-lakh-rent-for-2bhk-in-parel-sparks-debate-11186810,2026-03-09T07:11:37+00:00
NDTV,most_read,23,Iranian Sailor Told Father Of US Ultimatum Before Torpedo Attack: Report,https://www.ndtv.com/world-news/iran-israel-war-iranian-sailor-told-father-of-us-ultimatum-before-torpedo-attack-report-11184910,2026-03-09T07:11:37+00:00
NDTV,most_read,24,"Parliament LIVE: S Jaishankar Speaks On Iran War, Says ""Concerned About Indians In Gulf""",https://www.ndtv.com/india-news/parliament-budget-session-live-updates-lok-sabha-pm-modi-speaker-om-birla-impeachment-middle-east-tension-s-jaishankar-address-iran-war-11188126,2026-03-09T07:11:37+00:00
NDTV,most_read,25,How Iran's New Supreme Leader Mojtaba Khamenei Built Global Property Empire,https://www.ndtv.com/world-news/iran-israel-us-war-how-irans-new-supreme-leader-mojtaba-khamenei-built-global-property-empire-middle-east-conflict-11188079,2026-03-09T07:11:37+00:00
NDTV,most_read,26,"Mojtaba Khamenei: Iran's New Supreme Leader, Often Seen As A 'Gatekeeper'",https://www.ndtv.com/world-news/mojtaba-khamenei-irans-new-supreme-leader-often-seen-as-a-gatekeeper-ayatollah-ali-khamenei-iran-war-iran-israel-war-11187888,2026-03-09T07:11:37+00:00
NDTV,most_read,27,"After Israeli Strikes, Tehran Residents Warn Of ""Acid Rain"", Toxic Smoke",https://www.ndtv.com/world-news/israel-iran-war-acid-rain-fears-in-tehran-as-israeli-strikes-on-oil-depots-send-toxic-smoke-over-city-11188485,2026-03-09T07:11:37+00:00
NDTV,most_read,28,"Mandana Karimi Is 'Leaving India' Due To Security Reasons: ""Doesn't Feel Like Home Anymore""",https://www.ndtv.com/entertainment/mandana-karimi-is-leaving-india-due-to-security-reasons-doesnt-feel-like-home-anymore-11163396,2026-03-09T07:11:37+00:00
NDTV,most_read,29,"Video Shows Moment Iranian Drone Struck Dubai Airport, Halting Ops",https://www.ndtv.com/world-news/iran-war-video-shows-moment-iranian-drone-struck-dubai-airport-halting-ops-11184832,2026-03-09T07:11:37+00:00
NDTV,most_read,30,What Iranian Actor Elnaaz Norouzi Told NDTV Days Before Mojtaba Khamenei Was Named Iran's New Supreme Leader,https://www.ndtv.com/entertainment/what-iranian-actor-elnaaz-norouzi-told-ndtv-days-before-mojtaba-khamenei-was-named-irans-new-supreme-leader-11188389,2026-03-09T07:11:37+00:00
NDTV,most_read,31,CBSE Class 12 Mathematics Board Exam Live,https://www.ndtv.com/education/cbse-board-exams-2026-live-updates-class-12-mathematics-paper-final-revision-plan-and-exam-day-guidelines-11187773,2026-03-09T07:11:37+00:00
NDTV,trending,1,"""Right Thing To Do"": S Jaishankar In Parliament On Iran Ship's Kochi Docking",https://www.ndtv.com/india-news/iran-israel-war-iris-lavan-right-thing-to-do-s-jaishankar-in-parliament-on-iran-ships-kochi-docking-11188718,2026-03-09T07:11:37+00:00
NDTV,trending,2,"""Every Effort Being Made To Bring Back Stuck Indians"": S Jaishankar On Iran War",https://www.ndtv.com/india-news/iran-war-middle-east-war-s-jaishankar-dialogue-diplomacy-only-solution-s-jaishankar-on-iran-war-amid-house-chaos-11188558,2026-03-09T07:11:37+00:00
NDTV,trending,3,"Iran War Wipes Off Rs 30 Lakh Crore, Rs 12 Lakh Crore Lost Just Today",https://www.ndtv.com/india-news/iran-war-wipes-over-rs-30-lakh-crore-off-investors-wealth-11188532,2026-03-09T07:11:37+00:00
NDTV,trending,4,"Surat Women Use ChatGPT For Suicide In Temple Washroom, Elon Musk Reacts",https://www.ndtv.com/india-news/elon-musk-surat-chatgpt-suicide-surat-women-use-chatgpt-for-suicide-in-temple-washroom-elon-musk-reacts-11188445,2026-03-09T07:11:37+00:00
NDTV,trending,5,"Who Was Vallabh Maheshwari, Shakun Group MD Killed In BMW Crash",https://www.ndtv.com/india-news/who-was-vallabh-maheshwari-shakun-group-md-killed-in-bmw-crash-on-delhi-mumbai-expressway-rajasthan-alwar-11188344,2026-03-09T07:11:37+00:00
NDTV,trending,6,MH CET 2026: Last Chance To Correct Applications For Professional Courses,https://www.ndtv.com/education/maharashtra-state-common-entrance-test-2026-last-chance-to-correct-applications-for-professional-courses-11188711,2026-03-09T07:11:37+00:00
NDTV,trending,7,Maharashtra Teachers Suspended For Using ChatGPT To Help Students Cheat,https://www.ndtv.com/education/maharashtra-teachers-suspended-for-using-chatgpt-to-help-students-cheat-in-board-exams-11188411,2026-03-09T07:11:37+00:00
NDTV,trending,8,NEET UG 2026 Registration Deadline Extended To March 11: Check How To Apply,https://www.ndtv.com/education/nta-issues-notice-neet-ug-2026-registration-deadline-extended-to-march-11-check-how-to-apply-11188131,2026-03-09T07:11:37+00:00
NDTV,trending,9,"JEE Advanced 2026 Date Announced: Exam On May 17, Registration From April 23",https://www.ndtv.com/education/iit-roorkee-announced-jee-advanced-2026-date-exam-on-may-17-registration-from-april-23-11187898,2026-03-09T07:11:37+00:00
NDTV,trending,10,CBSE Board Exams 2026 Live Updates: Mathematics Exam Begins Amid Strict Monitoring,https://www.ndtv.com/education/cbse-board-exams-2026-live-updates-class-12-mathematics-paper-today-11187773,2026-03-09T07:11:37+00:00
NDTV,trending,11,"Stock Market LIVE: Bloodbath In Markets As Sensex Crashes, Nifty Down",https://www.ndtv.com/india-news/stock-marketlive-updates-sensex-nifty-likely-to-crash-as-oil-crosses-105-mark-11187870,2026-03-09T07:11:37+00:00
NDTV,trending,12,Who Will Trump Attack Next? Hint: Follow The Chinese Money Trail,https://www.ndtv.com/opinion/us-iran-israel-war-whats-common-to-iran-venezuela-cuba-3-different-deals-and-a-chinese-channel-11188274,2026-03-09T07:11:37+00:00
NDTV,trending,13,"'Iran School Struck By Tomahawk, Israel Not Known To Have It': Fact-Checker",https://www.ndtv.com/world-news/iran-israel-war-iran-school-attacked-by-us-tomahawk-missile-fact-checker-bellingcat-mehr-news-iran-school-strike-video-11188515,2026-03-09T07:11:37+00:00
NDTV,trending,14,"Iran Defies Trump, Names Khamenei's Son Mojtaba As New Supreme Leader",https://www.ndtv.com/world-news/iran-israel-us-war-news-live-khameneis-son-mojtaba-khamenei-named-irans-new-supreme-leader-11187447,2026-03-09T07:11:37+00:00
NDTV,trending,15,BJP Fact-Checks Mamata Banerjee's 'President Standing' Photo Attack On PM,https://www.ndtv.com/india-news/president-droupadi-murmu-pm-narendra-modi-mamata-banerjee-president-row-spirals-mamata-banerjees-targets-pm-modi-with-photo-proof-11188113,2026-03-09T07:11:37+00:00
NDTV,trending,16,Shakun Group MD Dies As BMW Crashes On Delhi-Mumbai Expressway,https://www.ndtv.com/india-news/shakun-group-md-vallabh-maheshwari-dies-as-bmw-crashes-on-delhi-mumbai-expressway-rajasthan-alwar-jaipur-based-buisnessman-11188285,2026-03-09T07:11:37+00:00
NDTV,trending,17,"Iran's New Leader Mojtaba Khamenei Fights Trump, Israel, Anger At Home",https://www.ndtv.com/world-news/irans-new-supreme-leader-mojtaba-khamenei-fights-donald-trump-israel-anger-at-home-middle-east-conflict-11188134,2026-03-09T07:11:37+00:00
NDTV,trending,18,LIVE: Saudi Warns Iran It Will Be Biggest Loser If It Continues Attacks,https://www.ndtv.com/world-news/iran-israel-war-live-updates-us-middle-east-crisis-news-mojtaba-khamenei-iran-new-supreme-leader-donald-trump-netanyahu-dubai-11187798,2026-03-09T07:11:37+00:00
NDTV,trending,19,20 Million Barrels At Risk: Could Hormuz Trigger A Shock Bigger Than 1973?,https://www.ndtv.com/world-news/iran-israel-war-one-strait-20-million-barrels-could-hormuz-trigger-an-oil-shock-bigger-than-1973-11188433,2026-03-09T07:11:37+00:00
NDTV,trending,20,The Hidden Power Network Behind Mojtaba Khamenei's Rise To Supreme Leader,https://www.ndtv.com/world-news/the-secret-power-network-that-made-mojtaba-khamenei-a-supreme-leader-11188594,2026-03-09T07:11:37+00:00
NDTV,trending,21,How Iran Plotted To Assassinate Trump Before He Struck Back: Report,https://www.ndtv.com/world-news/iran-israel-war-live-updates-donald-trump-how-iran-plotted-to-assassinate-trump-before-he-struck-back-report-11188482,2026-03-09T07:11:37+00:00
NDTV,trending,22,"Mumbai Woman Pays Rs 1 Lakh Rent For 2 BHK In Parel, Sparks Debate",https://www.ndtv.com/offbeat/mumbai-woman-pays-rs-1-lakh-rent-for-2bhk-in-parel-sparks-debate-11186810,2026-03-09T07:11:37+00:00
NDTV,trending,23,"Video Shows Moment Iranian Drone Struck Dubai Airport, Halting Ops",https://www.ndtv.com/world-news/iran-war-video-shows-moment-iranian-drone-struck-dubai-airport-halting-ops-11184832,2026-03-09T07:11:37+00:00
NDTV,trending,24,CBSE Class 12 Mathematics Board Exam Live,https://www.ndtv.com/education/cbse-board-exams-2026-live-updates-class-12-mathematics-paper-final-revision-plan-and-exam-day-guidelines-11187773,2026-03-09T07:11:37+00:00
NDTV,trending,25,S Jaishankar Speaks On Iran War LIVE Updates,https://www.ndtv.com/india-news/parliament-budget-session-live-updates-lok-sabha-pm-modi-speaker-om-birla-impeachment-middle-east-tension-s-jaishankar-address-iran-war-11188126,2026-03-09T07:11:37+00:00
India Today,trending,1,Chennai doctor hands newborn to nervous father in video with 198 million views,https://www.indiatoday.in/trending-news/story/chennai-doctor-hands-newborn-to-nervous-father-in-adorable-video-with-198-million-views-2879247-2026-03-09,2026-03-09T07:11:37+00:00
India Today,trending,2,Reddit user moved to Delhi from Assam expecting it to be expensive. And then...,https://www.indiatoday.in/trending-news/story/reddit-user-moved-to-delhi-from-assam-expecting-it-to-be-expensive-and-then-2879049-2026-03-08,2026-03-09T07:11:37+00:00
India Today,trending,3,Bengaluru man shares post about Ahmedabad's late-night vibe. Internet weighs in,https://www.indiatoday.in/trending-news/story/bengaluru-man-shares-post-about-ahmedabads-late-night-vibe-internet-weighs-in-2879024-2026-03-08,2026-03-09T07:11:37+00:00
India Today,trending,4,Australian High Commission celebrates women diplomats in Dhurandhar style,https://www.indiatoday.in/trending-news/story/australian-high-commission-celebrates-women-diplomats-in-dhurandhar-style-womens-day-2026-2879010-2026-03-08,2026-03-09T07:11:37+00:00
India Today,trending,5,Tamil Nadu principal sponsors first flight for 20 government school students,https://www.indiatoday.in/trending-news/story/tamil-nadu-principal-sponsors-first-flight-for-20-government-school-students-2878980-2026-03-08,2026-03-09T07:11:37+00:00
India Today,trending,6,Woman's clever hack for getting a seat in crowded Mumbai local wows 3 million,https://www.indiatoday.in/trending-news/story/womans-clever-hack-for-getting-a-seat-in-crowded-mumbai-local-wows-3-million-2878965-2026-03-08,2026-03-09T07:11:37+00:00
India Today,trending,7,"Indian businessman offers free shelter, pickup to travellers stranded in UAE",https://www.indiatoday.in/trending-news/story/indian-businessman-dhiraj-jain-offers-free-shelter-rolls-royce-pickup-to-travellers-stranded-in-uae-2878915-2026-03-08,2026-03-09T07:11:37+00:00
India Today,trending,8,IndiGo air hostesses briefly babysit toddler at boarding gate. Wholesome video,https://www.indiatoday.in/trending-news/story/indigo-air-hostesses-briefly-babysit-toddler-at-boarding-gate-wholesome-video-2878901-2026-03-08,2026-03-09T07:11:37+00:00
India Today,trending,9,"YouTuber claims to be stranded amid Middle East crisis, internet says fly economy",https://www.indiatoday.in/trending-news/story/youtuber-nonstop-dan-stranded-claims-amid-middle-east-crisis-internet-says-fly-economy-2878894-2026-03-08,2026-03-09T07:11:37+00:00
India Today,trending,10,Man shares why he 'trusted his gut' and walked away from Rs 26 lakh job offer,https://www.indiatoday.in/trending-news/story/man-shares-why-he-trusted-his-gut-and-walked-away-from-rs-26-lakh-job-offer-2878716-2026-03-07,2026-03-09T07:11:37+00:00
India Today,trending,11,Foreigner gets Mumbai local train passengers to dance to 'Saddi Galli'. Watch video,https://www.indiatoday.in/trending-news/story/foreigner-gets-mumbai-local-train-passengers-to-dance-to-saddi-galli-watch-video-2878676-2026-03-07,2026-03-09T07:11:37+00:00
India Today,trending,12,Russian tourist gets custom flip-flops made in Sri Lanka shop. Here's how it's done,https://www.indiatoday.in/trending-news/story/russian-tourist-gets-custom-flip-flops-made-in-sri-lanka-shop-heres-how-its-done-2878619-2026-03-07,2026-03-09T07:11:37+00:00
India Today,trending,13,"Uzbekistan children dance to iconic Bollywood songs, videos delight internet",https://www.indiatoday.in/trending-news/story/uzbekistan-children-dance-to-iconic-bollywood-songs-videos-delight-internet-2878603-2026-03-07,2026-03-09T07:11:37+00:00
