source,section,rank,headline,link,collected_at_iso
Times of India,trending,38,Ustaad Bhagat Singh Review,https://timesofindia.indiatimes.com/articleshow/129668305.cms,2026-03-19T17:04:00+00:00
Times of India,trending,39,Dhurandhar 2 First Review,https://timesofindia.indiatimes.com/articleshow/129661176.cms,2026-03-19T17:04:00+00:00
Times of India,trending,40,Eid Mehndi Designs,https://timesofindia.indiatimes.com/articleshow/129631134.cms,2026-03-19T17:04:00+00:00
Times of India,trending,41,Youth Twitter Review,https://timesofindia.indiatimes.com/articleshow/129671694.cms,2026-03-19T17:04:00+00:00
Times of India,trending,42,Aishwarya Rai Parenting Lessons,https://timesofindia.indiatimes.com/articleshow/129670442.cms,2026-03-19T17:04:00+00:00
Times of India,trending,43,Eid 2026 Moon Sighting Timings,https://timesofindia.indiatimes.com/articleshow/129623899.cms,2026-03-19T17:04:00+00:00
Times of India,trending,44,Tata Sierra Bncap Crash Test,https://timesofindia.indiatimes.com/articleshow/129672493.cms,2026-03-19T17:04:00+00:00
Times of India,trending,45,Indian Cobra VS Egyptian Cobra,https://timesofindia.indiatimes.com/articleshow/129376134.cms,2026-03-19T17:04:00+00:00
Times of India,trending,46,Erika Kirk controversy,https://timesofindia.indiatimes.com/articleshow/129662549.cms,2026-03-19T17:04:00+00:00
Times of India,trending,47,Boston Celtics vs. Golden State Warriors,https://timesofindia.indiatimes.com/articleshow/129665683.cms,2026-03-19T17:04:00+00:00
Times of India,trending,48,Kenyon Martin wife,https://timesofindia.indiatimes.com/articleshow/129661900.cms,2026-03-19T17:04:00+00:00
Times of India,trending,49,MKBHD YouTube AI threat,https://timesofindia.indiatimes.com/articleshow/129662500.cms,2026-03-19T17:04:00+00:00
Times of India,trending,50,Marco Odermatt sister Alina,https://timesofindia.indiatimes.com/articleshow/129662946.cms,2026-03-19T17:04:00+00:00
Times of India,trending,51,Clavicular Kick earnings controversy,https://timesofindia.indiatimes.com/articleshow/129663977.cms,2026-03-19T17:04:00+00:00
Times of India,trending,52,Seth Jarvis NHL fine,https://timesofindia.indiatimes.com/articleshow/129662871.cms,2026-03-19T17:04:00+00:00
Times of India,trending,53,Travis Turner disappearance,https://timesofindia.indiatimes.com/articleshow/129664813.cms,2026-03-19T17:04:00+00:00
Times of India,trending,54,Rory McIlroy Masters menu,https://timesofindia.indiatimes.com/articleshow/129665356.cms,2026-03-19T17:04:00+00:00
Times of India,trending,55,YouTube Messaging Feature,https://timesofindia.indiatimes.com/articleshow/129664892.cms,2026-03-19T17:04:00+00:00
Times of India,trending,56,US Senator Elizabeth Warren,https://timesofindia.indiatimes.com/articleshow/129672596.cms,2026-03-19T17:04:00+00:00
Times of India,trending,57,Wanted Maoist Sukru considers surrender amid internal resistance,https://timesofindia.indiatimes.com/articleshow/129684268.cms,2026-03-19T17:04:00+00:00
Times of India,trending,58,"Sidharth Malhotra reviews Dhurandhar 2: The Revenge, calls Ranveer Singh ‘an absolute force’, praises Aditya Dhar’s vision",https://timesofindia.indiatimes.com/articleshow/129684140.cms,2026-03-19T17:04:00+00:00
Times of India,trending,59,State ready for public health challenges in summer: Min,https://timesofindia.indiatimes.com/articleshow/129684219.cms,2026-03-19T17:04:00+00:00
Times of India,trending,60,No moon sighting tonight: India confirms Eid-ul-Fitr on March 21 - Friday moon timings and other key details inside,https://timesofindia.indiatimes.com/articleshow/129684094.cms,2026-03-19T17:04:00+00:00
Times of India,trending,61,'Gukesh won title by chance': Former World Chess Champion Karpov sparks controversy,https://timesofindia.indiatimes.com/articleshow/129683687.cms,2026-03-19T17:04:00+00:00
Times of India,trending,62,Clean sweep for Ranchi: Ranchi's new mayor initiates cleanliness drive at historic Birsa Munda Jail Park; Aims to inspire civic duty and transform the city,https://timesofindia.indiatimes.com/articleshow/129683981.cms,2026-03-19T17:04:00+00:00
Times of India,trending,63,Thomson launches 3 models of fully automatic and semi-automatic washing machines in India,https://timesofindia.indiatimes.com/articleshow/129683955.cms,2026-03-19T17:04:00+00:00
Times of India,trending,64,Rescue mission for kitten: Power staffers save stranded kitten from electric pole; Their brave act praised by local councillor,https://timesofindia.indiatimes.com/articleshow/129683960.cms,2026-03-19T17:04:00+00:00
Times of India,trending,65,Fortnite Chapter 7 Season 2 Showdown update brings new battle pass and more: Everything that’s changing in the game,https://timesofindia.indiatimes.com/articleshow/129683361.cms,2026-03-19T17:04:00+00:00
Times of India,trending,66,"US stocks today: Wall Street falls as oil spikes, Fed rate hold and war jitters hit sentiment",https://timesofindia.indiatimes.com/articleshow/129683779.cms,2026-03-19T17:04:00+00:00
Times of India,trending,67,Demolition of Saw's residence: Former Congress minister Yogendra Saw's house demolished for NTPC project; Allegations of unfair compensation emerge,https://timesofindia.indiatimes.com/articleshow/129683854.cms,2026-03-19T17:04:00+00:00
Times of India,trending,68,EOW arrests C’garh bizman for Rs 9.56cr bank fraud,https://timesofindia.indiatimes.com/articleshow/129683858.cms,2026-03-19T17:04:00+00:00
Times of India,trending,69,Did Stefon Diggs get kicked out by Cardi B’s security? Viral arena drama explained,https://timesofindia.indiatimes.com/articleshow/129683849.cms,2026-03-19T17:04:00+00:00
Times of India,trending,70,Celebrating New Beginnings: Hindu Nav Varsh festivities mark Vikram Samvat's start; Communities unite in prayer and cultural celebrations,https://timesofindia.indiatimes.com/articleshow/129683808.cms,2026-03-19T17:04:00+00:00
Times of India,trending,71,Ongoing LPG booking woes: Ranchi consumers face delays in LPG cylinder bookings; Backlog persists despite some improvement in supply,https://timesofindia.indiatimes.com/articleshow/129683794.cms,2026-03-19T17:04:00+00:00
Times of India,trending,72,"OpenAI acquires Astral, the Python startup whose tools run on millions of developer machines",https://timesofindia.indiatimes.com/articleshow/129683748.cms,2026-03-19T17:04:00+00:00
NDTV,most_read,1,2 Arrested After Encounter In Chandigarh Realtor's Murder Case,https://www.ndtv.com/india-news/2-arrested-after-encounter-in-chandigarh-realtors-murder-case-11239940,2026-03-19T17:04:00+00:00
NDTV,most_read,2,"""People Deserve Clarity"": Pradyut Bordoloi's Son Returns Congress Ticket",https://www.ndtv.com/india-news/assam-elections-2026-pradyut-bordoloi-son-prateek-bordoloi-returns-congress-ticket-11239824,2026-03-19T17:04:00+00:00
NDTV,most_read,3,"Man Killed, 10-Year-Old Shot In Leg After 3 Attackers Open Fire In Delhi",https://www.ndtv.com/india-news/delhi-crime-news-man-killed-10-year-old-shot-at-in-suspected-gang-war-firing-in-delhis-bawana-11239645,2026-03-19T17:04:00+00:00
NDTV,most_read,4,"Vijay ""Surrounded By Toxic People,"" Says Ranjana Nachiyar After Joining DMK",https://www.ndtv.com/india-news/vijay-surrounded-by-toxic-people-says-ranjana-nachiyar-after-joining-dmk-11239480,2026-03-19T17:04:00+00:00
NDTV,most_read,5,"Drunk Woman Shouts, Screams, Brings Traffic To Halt Outside Gujarat Hospital",https://www.ndtv.com/india-news/drunk-woman-shouts-screams-brings-traffic-to-halt-outside-gujarat-hospital-11239385,2026-03-19T17:04:00+00:00
NDTV,most_read,6,"School Assembly News Headlines (March 20): Top National, World, Sports Updates",https://www.ndtv.com/education/school-assembly-news-headlines-march-20-top-national-world-sports-updates-11239687,2026-03-19T17:04:00+00:00
NDTV,most_read,7,IIT JAM Result Out 2026: Direct Link To Check Results And Download Scorecard,https://www.ndtv.com/education/iit-jam-result-out-2026-direct-link-to-check-results-and-download-scorecard-11239447,2026-03-19T17:04:00+00:00
NDTV,most_read,8,NCERT Issues Admit Cards for 2026 Non-Teaching Recruitment Exams,https://www.ndtv.com/education/ncert-issues-admit-cards-for-2026-non-teaching-recruitment-exams-11239232,2026-03-19T17:04:00+00:00
NDTV,most_read,9,Rajasthan Board 10th Result 2026 Not To Be Declared On March 20,https://www.ndtv.com/education/rajasthan-board-10th-result-2026-not-to-be-declared-on-march-20-11238421,2026-03-19T17:04:00+00:00
NDTV,most_read,10,"Bihar Board 10th Result 2026 Not To Be Released On March 20, Check Details",https://www.ndtv.com/education/bihar-board-10th-result-2026-not-to-be-released-on-march-20-heres-what-students-need-to-know-11238405,2026-03-19T17:04:00+00:00
NDTV,most_read,11,Kim Jong Un Wins 99.93% Votes In North Korea. Remaining 0.07% Went To...,https://www.ndtv.com/world-news/kim-jong-un-wins-99-93-votes-in-north-korea-parliamentary-elections-remaining-0-07-went-to-11236508,2026-03-19T17:04:00+00:00
NDTV,most_read,12,"In Big Step On Hormuz, UK, France Say Ready To ""Contribute"" To Safe Passage",https://www.ndtv.com/world-news/iran-israel-war-in-big-step-on-hormuz-uk-france-say-ready-to-contribute-to-safe-passage-11239597,2026-03-19T17:04:00+00:00
NDTV,most_read,13,"Hidden Cameras, 58 Women: Nashik Astrologer And His Farmhouse Of Secrets",https://www.ndtv.com/india-news/ashok-karat-captain-influential-astrologer-67-arrested-for-repeatedly-raping-35-year-old-woman-11238108,2026-03-19T17:04:00+00:00
NDTV,most_read,14,Iran Attacks World's Biggest Gas Hub In Qatar. How It Affects India,https://www.ndtv.com/india-news/iran-attacks-worlds-biggest-gas-hub-ras-laffan-in-qatar-how-it-affects-india-11236997,2026-03-19T17:04:00+00:00
NDTV,most_read,15,"US F-35 Hit By Suspected Iranian Fire, Makes Emergency Landing: Report",https://www.ndtv.com/world-news/iran-war-live-us-f-35-hit-by-suspected-iranian-fire-makes-emergency-landing-report-11239907,2026-03-19T17:04:00+00:00
NDTV,most_read,16,"""He Lied to Me"": Woman In Coldplay Kiss-Cam Controversy Blames Former Boss",https://www.ndtv.com/feature/coldplay-kiss-cam-controversy-kirsten-cabot-says-andy-byron-lied-to-her-11238942,2026-03-19T17:04:00+00:00
NDTV,most_read,17,"Explained: World's Largest Gas Field Hit, Puts 20% Global LNG Supply At Risk",https://www.ndtv.com/world-news/middle-east-iran-israel-war-explained-worlds-largest-gas-field-hit-puts-20-global-lng-supply-at-risk-11236743,2026-03-19T17:04:00+00:00
NDTV,most_read,18,"Two Indian-Origin Men Spit Paan In UK, Fined Over Rs 3 Lakh",https://www.ndtv.com/world-news/spitting-paan-in-the-uk-costs-two-indian-origin-men-over-rs-3-lakh-in-fines-11237598,2026-03-19T17:04:00+00:00
NDTV,most_read,19,"""Pakistan Has A History"": India On US Intel Chief's Nuclear Threat Remark",https://www.ndtv.com/world-news/pakistan-has-a-history-india-on-us-intel-chiefs-nuclear-threat-remark-11238736,2026-03-19T17:04:00+00:00
NDTV,most_read,20,Iran War LIVE: Iran Intensifies Strikes On Middle East Energy Facilities,https://www.ndtv.com/world-news/us-israel-iran-war-live-updates-iran-strikes-qatar-ras-laffan-lng-gulf-energy-sites-south-pars-oil-prices-strait-hormuz-iran-targets-gulf-energy-sites-11235957,2026-03-19T17:04:00+00:00
NDTV,most_read,21,"HDFC Bank Chairman Quits Citing 'Ethical' Concerns, Shares Fall, RBI Reacts",https://www.ndtv.com/india-news/hdfc-bank-chairman-atanu-chakraborty-quits-citing-ethical-concerns-shares-plunge-11236076,2026-03-19T17:04:00+00:00
NDTV,most_read,22,"They Went To Dubai With A Dream, Now All They Want Is To Be Back In India",https://www.ndtv.com/india-news/iran-war-live-news-hyderabad-brothers-shoaib-sohail-went-to-dubai-with-a-dream-11239272,2026-03-19T17:04:00+00:00
NDTV,most_read,23,US Weighs Military Reinforcements As Iran War Enters Possible New Phase,https://www.ndtv.com/world-news/iran-war-us-weighs-more-troops-for-middle-east-as-iran-war-enters-possible-new-phase-11235795,2026-03-19T17:04:00+00:00
NDTV,most_read,24,Woman Says Bengaluru Metro Feels Like Luxury After Travelling In London Tube,https://www.ndtv.com/offbeat/woman-says-bengaluru-metro-feels-like-luxury-after-travelling-in-warm-and-crowded-london-tube-11235876,2026-03-19T17:04:00+00:00
NDTV,most_read,25,'Patience Is Limited': Saudi Threatens To Join Gulf War Amid Iran's Attacks,https://www.ndtv.com/world-news/iran-war-news-live-gulf-states-have-significant-capabilities-saudis-big-warning-to-iran-11236925,2026-03-19T17:04:00+00:00
NDTV,most_read,26,Nuke Site Or Empty Hall? UN Watchdog Clueless On Iran's Enrichment Facility,https://www.ndtv.com/world-news/iran-war-news-nuke-site-or-empty-hall-un-watchdog-clueless-on-irans-isfahan-enrichment-facility-11237633,2026-03-19T17:04:00+00:00
NDTV,most_read,27,"80 Years After Hiroshima Horror, Japan Drawn Into Iran Nuke Crisis By Trump",https://www.ndtv.com/world-news/iran-war-live-80-years-after-hiroshima-horror-japan-drawn-into-iran-nuclear-crisis-by-donald-trump-11239531,2026-03-19T17:04:00+00:00
NDTV,most_read,28,"""More Nations Should Step In"": Israel On What Can End Hormuz Chokehold",https://www.ndtv.com/world-news/us-iran-war-more-nations-should-step-in-israel-on-what-can-end-hormuz-chokehold-11239876,2026-03-19T17:04:00+00:00
NDTV,most_read,29,"After 4 Failed Attempts, Dawood Ibrahim's Plots In Maharashtra Find A Buyer",https://www.ndtv.com/india-news/after-4-failed-attempts-dawood-ibrahims-plots-in-maharashtra-find-a-buyer-11237091,2026-03-19T17:04:00+00:00
NDTV,most_read,30,Larijani's Visit To Daughter's House Sealed His Fate. How He Was Located,https://www.ndtv.com/world-news/iran-war-news-live-target-number-1-after-ali-khamenei-how-irans-ali-larijani-was-detected-killed-11233321,2026-03-19T17:04:00+00:00
NDTV,most_read,31,"On Dhurandhar 2 Release Day, 'Very Excited' Yami Gautam Kicks Off Nayyi Navelli",https://www.ndtv.com/entertainment/on-dhurandhar-2-release-day-very-excited-yami-gautam-kicks-off-nayyi-navelli-11238444,2026-03-19T17:04:00+00:00
NDTV,most_read,32,"8 Bullets, 10 Seconds: Chandigarh Realtor Shot Dead Outside Gym",https://www.ndtv.com/chandigarh-news/8-bullets-10-seconds-chandigarh-realtor-shot-dead-outside-gym-11237197,2026-03-19T17:04:00+00:00
NDTV,most_read,33,"Dhurandhar 2 Release, Review LIVE Updates",https://www.ndtv.com/entertainment/dhurandhar-2-review-release-live-updates-reactions-ranveer-singh-aditya-dhar-r-madhavan-11235082,2026-03-19T17:04:00+00:00
NDTV,most_read,34,Stock Market LIVE Updates,https://www.ndtv.com/india-news/sensex-today-stock-market-live-updates-share-market-nifty-crash-19-march-crude-oil-11236169,2026-03-19T17:04:00+00:00
NDTV,trending,1,2 Arrested After Encounter In Chandigarh Realtor's Murder Case,https://www.ndtv.com/india-news/2-arrested-after-encounter-in-chandigarh-realtors-murder-case-11239940,2026-03-19T17:04:00+00:00
NDTV,trending,2,"""People Deserve Clarity"": Pradyut Bordoloi's Son Returns Congress Ticket",https://www.ndtv.com/india-news/assam-elections-2026-pradyut-bordoloi-son-prateek-bordoloi-returns-congress-ticket-11239824,2026-03-19T17:04:00+00:00
NDTV,trending,3,"Man Killed, 10-Year-Old Shot In Leg After 3 Attackers Open Fire In Delhi",https://www.ndtv.com/india-news/delhi-crime-news-man-killed-10-year-old-shot-at-in-suspected-gang-war-firing-in-delhis-bawana-11239645,2026-03-19T17:04:00+00:00
NDTV,trending,4,"Vijay ""Surrounded By Toxic People,"" Says Ranjana Nachiyar After Joining DMK",https://www.ndtv.com/india-news/vijay-surrounded-by-toxic-people-says-ranjana-nachiyar-after-joining-dmk-11239480,2026-03-19T17:04:00+00:00
NDTV,trending,5,"Drunk Woman Shouts, Screams, Brings Traffic To Halt Outside Gujarat Hospital",https://www.ndtv.com/india-news/drunk-woman-shouts-screams-brings-traffic-to-halt-outside-gujarat-hospital-11239385,2026-03-19T17:04:00+00:00
NDTV,trending,6,"School Assembly News Headlines (March 20): Top National, World, Sports Updates",https://www.ndtv.com/education/school-assembly-news-headlines-march-20-top-national-world-sports-updates-11239687,2026-03-19T17:04:00+00:00
NDTV,trending,7,IIT JAM Result Out 2026: Direct Link To Check Results And Download Scorecard,https://www.ndtv.com/education/iit-jam-result-out-2026-direct-link-to-check-results-and-download-scorecard-11239447,2026-03-19T17:04:00+00:00
NDTV,trending,8,NCERT Issues Admit Cards for 2026 Non-Teaching Recruitment Exams,https://www.ndtv.com/education/ncert-issues-admit-cards-for-2026-non-teaching-recruitment-exams-11239232,2026-03-19T17:04:00+00:00
NDTV,trending,9,Rajasthan Board 10th Result 2026 Not To Be Declared On March 20,https://www.ndtv.com/education/rajasthan-board-10th-result-2026-not-to-be-declared-on-march-20-11238421,2026-03-19T17:04:00+00:00
NDTV,trending,10,"Bihar Board 10th Result 2026 Not To Be Released On March 20, Check Details",https://www.ndtv.com/education/bihar-board-10th-result-2026-not-to-be-released-on-march-20-heres-what-students-need-to-know-11238405,2026-03-19T17:04:00+00:00
NDTV,trending,11,Kim Jong Un Wins 99.93% Votes In North Korea. Remaining 0.07% Went To...,https://www.ndtv.com/world-news/kim-jong-un-wins-99-93-votes-in-north-korea-parliamentary-elections-remaining-0-07-went-to-11236508,2026-03-19T17:04:00+00:00
NDTV,trending,12,"In Big Step On Hormuz, UK, France Say Ready To ""Contribute"" To Safe Passage",https://www.ndtv.com/world-news/iran-israel-war-in-big-step-on-hormuz-uk-france-say-ready-to-contribute-to-safe-passage-11239597,2026-03-19T17:04:00+00:00
NDTV,trending,13,"Hidden Cameras, 58 Women: Nashik Astrologer And His Farmhouse Of Secrets",https://www.ndtv.com/india-news/ashok-karat-captain-influential-astrologer-67-arrested-for-repeatedly-raping-35-year-old-woman-11238108,2026-03-19T17:04:00+00:00
NDTV,trending,14,"""He Lied to Me"": Woman In Coldplay Kiss-Cam Controversy Blames Former Boss",https://www.ndtv.com/feature/coldplay-kiss-cam-controversy-kirsten-cabot-says-andy-byron-lied-to-her-11238942,2026-03-19T17:04:00+00:00
NDTV,trending,15,Iran Attacks World's Biggest Gas Hub In Qatar. How It Affects India,https://www.ndtv.com/india-news/iran-attacks-worlds-biggest-gas-hub-ras-laffan-in-qatar-how-it-affects-india-11236997,2026-03-19T17:04:00+00:00
NDTV,trending,16,Ranveer Said Rakesh Deserves Rs 500 Crore For Dhurandhar 2 (Condition Applied),https://www.ndtv.com/entertainment/ranveer-singh-said-rakesh-bedi-deserves-rs-500-crore-if-dhurandhar-2-makes-rs-1-000-crore-11237876,2026-03-19T17:04:00+00:00
NDTV,trending,17,"US F-35 Hit By Suspected Iranian Fire, Makes Emergency Landing: Report",https://www.ndtv.com/world-news/iran-war-live-us-f-35-hit-by-suspected-iranian-fire-makes-emergency-landing-report-11239907,2026-03-19T17:04:00+00:00
NDTV,trending,18,"Explained: World's Largest Gas Field Hit, Puts 20% Global LNG Supply At Risk",https://www.ndtv.com/world-news/middle-east-iran-israel-war-explained-worlds-largest-gas-field-hit-puts-20-global-lng-supply-at-risk-11236743,2026-03-19T17:04:00+00:00
NDTV,trending,19,"Two Indian-Origin Men Spit Paan In UK, Fined Over Rs 3 Lakh",https://www.ndtv.com/world-news/spitting-paan-in-the-uk-costs-two-indian-origin-men-over-rs-3-lakh-in-fines-11237598,2026-03-19T17:04:00+00:00
NDTV,trending,20,"Dhurandhar 2 Review: Ranveer Singh Goes To Pakistan, Gifts India A Blockbuster",https://www.ndtv.com/entertainment/dhurandhar-2-review-ranveer-singh-goes-to-karachi-gifts-india-a-blockbuster-3-stars-11235302,2026-03-19T17:04:00+00:00
NDTV,trending,21,"""Pakistan Has A History"": India On US Intel Chief's Nuclear Threat Remark",https://www.ndtv.com/world-news/pakistan-has-a-history-india-on-us-intel-chiefs-nuclear-threat-remark-11238736,2026-03-19T17:04:00+00:00
NDTV,trending,22,Exclusive: Rakesh Bedi's 'Verdict' Counter To Dhurandhar 2 'Propaganda' Attack,https://www.ndtv.com/entertainment/rakesh-bedi-to-ndtv-about-dhurandhar-2-being-called-propaganda-verdict-is-out-11239396,2026-03-19T17:04:00+00:00
NDTV,trending,23,Iran War LIVE: Iran Intensifies Strikes On Middle East Energy Facilities,https://www.ndtv.com/world-news/us-israel-iran-war-live-updates-iran-strikes-qatar-ras-laffan-lng-gulf-energy-sites-south-pars-oil-prices-strait-hormuz-iran-targets-gulf-energy-sites-11235957,2026-03-19T17:04:00+00:00
NDTV,trending,24,"They Went To Dubai With A Dream, Now All They Want Is To Be Back In India",https://www.ndtv.com/india-news/iran-war-live-news-hyderabad-brothers-shoaib-sohail-went-to-dubai-with-a-dream-11239272,2026-03-19T17:04:00+00:00
NDTV,trending,25,"HDFC Bank Chairman Quits Citing 'Ethical' Concerns, Shares Fall, RBI Reacts",https://www.ndtv.com/india-news/hdfc-bank-chairman-atanu-chakraborty-quits-citing-ethical-concerns-shares-plunge-11236076,2026-03-19T17:04:00+00:00
NDTV,trending,26,"80 Years After Hiroshima Horror, Japan Drawn Into Iran Nuke Crisis By Trump",https://www.ndtv.com/world-news/iran-war-live-80-years-after-hiroshima-horror-japan-drawn-into-iran-nuclear-crisis-by-donald-trump-11239531,2026-03-19T17:04:00+00:00
NDTV,trending,27,"Aamir Khan Celebrates 61st Birthday With Girlfriend Gauri Spratt, Ex-Wives Reena Dutta And Kiran Rao",https://www.ndtv.com/entertainment/aamir-khan-celebrates-61st-birthday-with-girlfriend-gauri-spratt-ex-wives-reena-dutta-and-kiran-rao-11217483,2026-03-19T17:04:00+00:00
NDTV,trending,28,"Sneha Ullal Recalls Meeting Aishwarya Rai, Speaks About Salman Khan's Behaviour On Lucky Set",https://www.ndtv.com/entertainment/sneha-ullal-recalls-meeting-aishwarya-rai-speaks-about-salman-khans-behaviour-on-lucky-set-11226149,2026-03-19T17:04:00+00:00
NDTV,trending,29,'Patriotic Naagins' Saluting India's Rocket Launch In Naagin 7 Leaves Internet In Stitches,https://www.ndtv.com/entertainment/patriotic-naagins-saluting-indias-rocket-launch-in-naagin-7-leaves-internet-in-stitches-11231636,2026-03-19T17:04:00+00:00
NDTV,trending,30,Ajith Kumar Buys Mahindra BE 6 Formula E SUV. Here's How Much It Costs,https://www.ndtv.com/entertainment/ajith-kumar-buys-mahindra-be-6-formula-e-suv-heres-how-much-it-costs-11213771,2026-03-19T17:04:00+00:00
NDTV,trending,31,"Giant Python Cluster Spotted In Himachal's Kangra, Video Sparks Panic",https://www.ndtv.com/offbeat/giant-python-cluster-spotted-in-himachals-kangra-video-sparks-panic-11237065,2026-03-19T17:04:00+00:00
NDTV,trending,32,"Kangana Ranaut Reacts To Sara Ali Khan's Badrinath, Kedarnath Row: ""Why Does She Have A Problem?""",https://www.ndtv.com/entertainment/kangana-ranaut-reacts-to-sara-ali-khans-badrinath-kedarnath-row-why-does-she-have-a-problem-11233172,2026-03-19T17:04:00+00:00
NDTV,trending,33,"Dhurandhar 2 Release, Review LIVE Updates",https://www.ndtv.com/entertainment/dhurandhar-2-review-release-live-updates-reactions-ranveer-singh-aditya-dhar-r-madhavan-11235082,2026-03-19T17:04:00+00:00
NDTV,trending,34,Stock Market LIVE Updates,https://www.ndtv.com/india-news/sensex-today-stock-market-live-updates-share-market-nifty-crash-19-march-crude-oil-11236169,2026-03-19T17:04:00+00:00
India Today,trending,1,"North Korea's Kim Jong Un scores near-perfect election win, memes follow",https://www.indiatoday.in/trending-news/story/north-koreas-kim-jong-un-scores-near-perfect-election-win-memes-follow-2884372-2026-03-19,2026-03-19T17:04:00+00:00
India Today,trending,2,"Lebanese artist plays the cello in war-torn Beirut, internet calls it haunting",https://www.indiatoday.in/trending-news/story/lebanese-artist-plays-the-cello-in-war-torn-beirut-amid-iranian-missile-strikes-internet-calls-it-haunting-2884359-2026-03-19,2026-03-19T17:04:00+00:00
India Today,trending,3,US woman gets ready to celebrate her 96th birthday with viral 'I feel 26' video,https://www.indiatoday.in/trending-news/story/us-woman-gets-ready-to-celebrate-her-96th-birthday-with-viral-i-feel-26-video-2884195-2026-03-19,2026-03-19T17:04:00+00:00
India Today,trending,4,"Delhi man catches woman stealing red-handed, confronts her in crowded market",https://www.indiatoday.in/trending-news/story/delhi-man-catches-woman-stealing-red-handed-confronts-her-in-crowded-market-2884153-2026-03-19,2026-03-19T17:04:00+00:00
India Today,trending,5,This Mumbai woman said she's a 'stay-at-home daughter'. Here's what she means,https://www.indiatoday.in/trending-news/story/this-mumbai-woman-said-shes-a-stay-at-home-daughter-heres-what-she-means-2884123-2026-03-19,2026-03-19T17:04:00+00:00
India Today,trending,6,"Viewers think this 'bird orchestra' from Tamil Nadu is AI. But, it's super real",https://www.indiatoday.in/trending-news/story/viewers-think-this-bird-orchestra-video-from-tamil-nadu-is-ai-but-it-is-super-real-2884105-2026-03-19,2026-03-19T17:04:00+00:00
India Today,trending,7,"This 'futuristic' Maharashtra village has water ATMs, clean streets and even a gym",https://www.indiatoday.in/trending-news/story/adachiwadi-futuristicmaharashtra-village-has-water-atms-clean-streets-and-even-a-gym-2884073-2026-03-19,2026-03-19T17:04:00+00:00
India Today,trending,8,Woman's London Tube ride leads to a Bengaluru Metro realisation. See post,https://www.indiatoday.in/trending-news/story/woman-london-tube-ride-leads-to-a-bengaluru-metro-realisation-see-post-2884047-2026-03-19,2026-03-19T17:04:00+00:00
India Today,trending,9,"Techie's 'Gas gone, heat rod on' hack to cook food goes viral amid LPG crisis",https://www.indiatoday.in/trending-news/story/techies-gas-gone-heat-rod-on-hack-to-cook-food-goes-viral-amid-lpg-crisis-2884021-2026-03-19,2026-03-19T17:04:00+00:00
India Today,trending,10,Man shares 'flight-like' services in Vande Bharat sleeper train. Video goes viral,https://www.indiatoday.in/trending-news/story/man-shares-flight-like-services-in-vande-bharat-sleeper-train-video-goes-viral-2883873-2026-03-18,2026-03-19T17:04:00+00:00
India Today,trending,11,"Passenger finds AC vents sealed with tape in Mumbai-Ujjain train, records video",https://www.indiatoday.in/trending-news/story/passenger-finds-ac-vents-sealed-with-tape-in-mumbai-ujjain-train-records-video-2883859-2026-03-18,2026-03-19T17:04:00+00:00
