source,section,rank,headline,link,collected_at_iso
Times of India,trending,32,Taunton house explosion,https://timesofindia.indiatimes.com/articleshow/129342556.cms,2026-03-09T19:02:14+00:00
Times of India,trending,33,LPG refill rule,https://timesofindia.indiatimes.com/articleshow/129334881.cms,2026-03-09T19:02:14+00:00
Times of India,trending,34,US stock market today,https://timesofindia.indiatimes.com/articleshow/129339862.cms,2026-03-09T19:02:14+00:00
Times of India,trending,35,Dhurandhar 2 OTT Release,https://timesofindia.indiatimes.com/articleshow/129319979.cms,2026-03-09T19:02:14+00:00
Times of India,trending,36,SS Rajamouli House,https://timesofindia.indiatimes.com/articleshow/129307437.cms,2026-03-09T19:02:14+00:00
Times of India,trending,37,Dhurandhar 2 Advance Booking,https://timesofindia.indiatimes.com/articleshow/129312149.cms,2026-03-09T19:02:14+00:00
Times of India,trending,38,Shah Rukh Khan,https://timesofindia.indiatimes.com/articleshow/129118674.cms,2026-03-09T19:02:14+00:00
Times of India,trending,39,Ahmedabad Police Traffic advisory,https://timesofindia.indiatimes.com/articleshow/129221351.cms,2026-03-09T19:02:14+00:00
Times of India,trending,40,The Kerala Story 2,https://timesofindia.indiatimes.com/articleshow/129298466.cms,2026-03-09T19:02:14+00:00
Times of India,trending,41,South India Real Estate,https://timesofindia.indiatimes.com/articleshow/129314884.cms,2026-03-09T19:02:14+00:00
Times of India,trending,42,Open Source WiFi Tool,https://timesofindia.indiatimes.com/articleshow/129295520.cms,2026-03-09T19:02:14+00:00
Times of India,trending,43,Maruti Brezza Facelift Spied,https://timesofindia.indiatimes.com/articleshow/129146065.cms,2026-03-09T19:02:14+00:00
Times of India,trending,44,Lab Grown Diamonds,https://timesofindia.indiatimes.com/articleshow/129090781.cms,2026-03-09T19:02:14+00:00
Times of India,trending,45,Social Media Ban,https://timesofindia.indiatimes.com/articleshow/129152683.cms,2026-03-09T19:02:14+00:00
Times of India,trending,46,Women’s Day AI Prompts,https://timesofindia.indiatimes.com/articleshow/129253033.cms,2026-03-09T19:02:14+00:00
Times of India,trending,47,Hyderabad Mall Hoarding Collapse,https://timesofindia.indiatimes.com/articleshow/129286460.cms,2026-03-09T19:02:14+00:00
Times of India,trending,48,Indian Cricket Team,https://timesofindia.indiatimes.com/articleshow/129304768.cms,2026-03-09T19:02:14+00:00
Times of India,trending,49,UPMSP Board Exam,https://timesofindia.indiatimes.com/articleshow/129310691.cms,2026-03-09T19:02:14+00:00
Times of India,trending,50,RRB Group D Recruitment,https://timesofindia.indiatimes.com/articleshow/129308267.cms,2026-03-09T19:02:14+00:00
Times of India,trending,51,NMMS Admit Card,https://timesofindia.indiatimes.com/articleshow/129304165.cms,2026-03-09T19:02:14+00:00
Times of India,trending,52,RRB Paramedical Admit Card,https://timesofindia.indiatimes.com/articleshow/129306262.cms,2026-03-09T19:02:14+00:00
Times of India,trending,53,Pune Spiritual School Closure,https://timesofindia.indiatimes.com/articleshow/129299407.cms,2026-03-09T19:02:14+00:00
Times of India,trending,54,Who is Mojtaba Khamenei,https://timesofindia.indiatimes.com/articleshow/129292991.cms,2026-03-09T19:02:14+00:00
Times of India,trending,55,Middle East News,https://timesofindia.indiatimes.com/articleshow/129309840.cms,2026-03-09T19:02:14+00:00
Times of India,trending,56,Tarun Khatik Murder,https://timesofindia.indiatimes.com/articleshow/129311729.cms,2026-03-09T19:02:14+00:00
Times of India,trending,57,Vallabh Maheshwari Accident,https://timesofindia.indiatimes.com/articleshow/129312441.cms,2026-03-09T19:02:14+00:00
Times of India,trending,58,Delhi Excise Policy Case,https://timesofindia.indiatimes.com/articleshow/129314045.cms,2026-03-09T19:02:14+00:00
Times of India,trending,59,Gurgaon Scrap Yard Fire,https://timesofindia.indiatimes.com/articleshow/129317885.cms,2026-03-09T19:02:14+00:00
Times of India,trending,60,Manipuri Woman Assault,https://timesofindia.indiatimes.com/articleshow/129286480.cms,2026-03-09T19:02:14+00:00
Times of India,trending,61,DTC Bus Accident,https://timesofindia.indiatimes.com/articleshow/129317246.cms,2026-03-09T19:02:14+00:00
Times of India,trending,62,Karnataka Elephant Overpass,https://timesofindia.indiatimes.com/articleshow/129285616.cms,2026-03-09T19:02:14+00:00
Times of India,trending,63,Bengaluru Illegal Mortgage,https://timesofindia.indiatimes.com/articleshow/129285440.cms,2026-03-09T19:02:14+00:00
Times of India,trending,64,Air India Dented Bag Compensation,https://timesofindia.indiatimes.com/articleshow/129285653.cms,2026-03-09T19:02:14+00:00
Times of India,trending,65,Nashik Bribery Case,https://timesofindia.indiatimes.com/articleshow/129170597.cms,2026-03-09T19:02:14+00:00
Times of India,trending,66,Oppo Find N6,https://timesofindia.indiatimes.com/articleshow/129315468.cms,2026-03-09T19:02:14+00:00
Times of India,trending,67,Anthropic Ceo Dario Amodei,https://timesofindia.indiatimes.com/articleshow/129137566.cms,2026-03-09T19:02:14+00:00
Times of India,trending,68,Tejashwi urges PM to take free stand on energy security,https://timesofindia.indiatimes.com/articleshow/129351257.cms,2026-03-09T19:02:14+00:00
Times of India,trending,69,Odisha teacher vacancies: Aspirants demand recruitment for thousands of posts,https://timesofindia.indiatimes.com/articleshow/129348464.cms,2026-03-09T19:02:14+00:00
Times of India,trending,70,Written test proposed for asst professor recruitment; upper age limit likely 45 yrs,https://timesofindia.indiatimes.com/articleshow/129351241.cms,2026-03-09T19:02:14+00:00
Times of India,trending,71,Prince Raj appointed RLJP national working chief,https://timesofindia.indiatimes.com/articleshow/129351172.cms,2026-03-09T19:02:14+00:00
Times of India,trending,72,Govt to bring incentive policy to promote sugar industry: Deputy CM,https://timesofindia.indiatimes.com/articleshow/129351142.cms,2026-03-09T19:02:14+00:00
Times of India,trending,73,"COs’ strike paralyses land-related work, deputy CM warns of action",https://timesofindia.indiatimes.com/articleshow/129351118.cms,2026-03-09T19:02:14+00:00
Times of India,trending,74,Jarren Duran's net worth vs his $7.7 million contract: How much the Boston Red Sox outfielder has earned in MLB,https://timesofindia.indiatimes.com/articleshow/129350574.cms,2026-03-09T19:02:14+00:00
Times of India,trending,75,UltraPOD transit proposed to link key govt offices,https://timesofindia.indiatimes.com/articleshow/129351090.cms,2026-03-09T19:02:14+00:00
Times of India,trending,76,"Buxar truck drivers protest, seek pension scheme and welfare fund",https://timesofindia.indiatimes.com/articleshow/129351078.cms,2026-03-09T19:02:14+00:00
Times of India,trending,77,2 from Punjab arrested with 146.3kg of ganja,https://timesofindia.indiatimes.com/articleshow/129351113.cms,2026-03-09T19:02:14+00:00
Times of India,trending,78,Gaya administration to submit Bodh Gaya monasteries probe report in HC,https://timesofindia.indiatimes.com/articleshow/129351020.cms,2026-03-09T19:02:14+00:00
Times of India,trending,79,India count on speed to overcome Chinese Taipei,https://timesofindia.indiatimes.com/articleshow/129351088.cms,2026-03-09T19:02:14+00:00
Times of India,trending,80,Speech-impaired teen beaten to death during T20 final in Vaishali over ‘wrong cheer’,https://timesofindia.indiatimes.com/articleshow/129351000.cms,2026-03-09T19:02:14+00:00
Times of India,trending,81,Nishant’s entry into politics has enthused workers: Minister,https://timesofindia.indiatimes.com/articleshow/129350965.cms,2026-03-09T19:02:14+00:00
Times of India,trending,82,"UPSC clarifies rank 301 holder is from Ghazipur, not Ara",https://timesofindia.indiatimes.com/articleshow/129350922.cms,2026-03-09T19:02:14+00:00
Times of India,trending,83,Three civil courts in Bihar get bomb threats,https://timesofindia.indiatimes.com/articleshow/129350742.cms,2026-03-09T19:02:14+00:00
Times of India,trending,84,Nishant says he will soon tour all 38 districts,https://timesofindia.indiatimes.com/articleshow/129350878.cms,2026-03-09T19:02:14+00:00
Times of India,trending,85,Posters across city pitch Chirag as Bihar CM,https://timesofindia.indiatimes.com/articleshow/129350833.cms,2026-03-09T19:02:14+00:00
NDTV,most_read,1,"Kuki Students' Body Questions Manipur Congress MP's Comments On Land, ST",https://www.ndtv.com/india-news/top-kuki-students-body-kso-questions-manipur-congress-mps-comments-on-land-st-11191946,2026-03-09T19:02:14+00:00
NDTV,most_read,2,Row In Madhya Pradesh As Congress Seeks Separate Religion Code For Tribals,https://www.ndtv.com/india-news/row-in-madhya-pradesh-as-congress-seeks-separate-religion-code-for-tribals-11191924,2026-03-09T19:02:14+00:00
NDTV,most_read,3,Raghav Chadha Urges Expansion of 'Udaan Yatri Cafes' Across All Airports,https://www.ndtv.com/india-news/raghav-chadha-urges-expansion-of-udaan-yatri-cafes-across-all-airports-11191825,2026-03-09T19:02:14+00:00
NDTV,most_read,4,"Kashmiri Leaders Meet Iranian Ambassador, Express Support For Iran",https://www.ndtv.com/india-news/kashmiri-leaders-meet-iranian-ambassador-express-support-for-iran-11191660,2026-03-09T19:02:14+00:00
NDTV,most_read,5,"""India-Nepal Ties Will Scale New Heights"": PM Modi Congratulates Balen Shah",https://www.ndtv.com/india-news/nepal-election-results-india-nepal-ties-will-scale-new-heights-pm-narendra-modi-congratulates-balen-shah-11191435,2026-03-09T19:02:14+00:00
NDTV,most_read,6,"Two Candidates, One Rank: UPSC Clears Confusion Over Rank 301 Claim",https://www.ndtv.com/education/upsc-issues-clarification-as-two-akanksha-singhs-claim-rank-301-in-civil-services-exam-11190819,2026-03-09T19:02:14+00:00
NDTV,most_read,7,"Punjab State Teacher Eligibility Test 2026: Admit Card Out, Download Link Here",https://www.ndtv.com/education/punjab-state-teacher-eligibility-test-2026-admit-card-out-download-link-here-11189693,2026-03-09T19:02:14+00:00
NDTV,most_read,8,"CBSE Class 12 Mathematics Exam: Check Paper Analysis, Student Reactions Here",https://www.ndtv.com/education/cbse-class-12-mathematics-exam-check-paper-analysis-student-reactions-here-11189498,2026-03-09T19:02:14+00:00
NDTV,most_read,9,"RRB NTPC Graduate Level Exam 2025: City Slip Out, Download Link Here",https://www.ndtv.com/education/rrb-ntpc-graduate-level-exam-2025-city-slip-out-download-link-here-11189156,2026-03-09T19:02:14+00:00
NDTV,most_read,10,Delhi Private School Removes Students From Class 12 Session Over Pending Fees,https://www.ndtv.com/education/east-delhi-mayur-vihar-school-strikes-off-4-class-12-students-over-unpaid-fees-11189079,2026-03-09T19:02:14+00:00
NDTV,most_read,11,The Beast Of Kandahar: How One Captured Drone Changed Modern Warfare,https://www.ndtv.com/world-news/iran-israel-war-live-updates-drones-middle-east-in-iran-us-israel-war-the-multiverse-of-copycat-drones-11190879,2026-03-09T19:02:14+00:00
NDTV,most_read,12,"""One Phone Call From PM Modi To Israel And Iran Can End Issue"": UAE Envoy",https://www.ndtv.com/world-news/iran-israel-war-pm-narendra-modi-can-speak-to-iran-and-israel-to-end-war-uae-envoy-hussain-hassan-mirza-to-ndtv-11190307,2026-03-09T19:02:14+00:00
NDTV,most_read,13,White House Sent 'WTF' Message To Israel After Iran Oil Field Strike,https://www.ndtv.com/world-news/iran-israel-war-us-wtf-message-israel-attacks-iran-oil-fields-oil-prices-rise-brent-crude-price-today-11188848,2026-03-09T19:02:14+00:00
NDTV,most_read,14,"Father, Mother, Wife, Son: Every Family Member Mojtaba Khamenei Lost In Iran War",https://www.ndtv.com/world-news/iran-israel-war-the-price-mojtaba-khamenei-paid-as-he-takes-over-as-iran-supreme-leader-11189998,2026-03-09T19:02:14+00:00
NDTV,most_read,15,"After Khamenei's Death, Iran Sent A Signal To Activate Sleeper Cells",https://www.ndtv.com/world-news/israel-iran-war-after-khameneis-death-iran-sent-a-signal-to-activate-sleeper-cells-report-11192094,2026-03-09T19:02:14+00:00
NDTV,most_read,16,"LIVE: ""We Have Many Surprises In Store"": Iran's Fresh Warning To US",https://www.ndtv.com/world-news/iran-israel-war-live-updates-us-middle-east-crisis-news-mojtaba-khamenei-iran-new-supreme-leader-donald-trump-netanyahu-dubai-11187798,2026-03-09T19:02:14+00:00
NDTV,most_read,17,'Will Stay Open Till Last Drop': Bengaluru Hotels' SOS Over Commercial Gas,https://www.ndtv.com/bangalore-news/will-stay-open-till-last-drop-bengaluru-hotels-sos-over-commercial-cooking-gas-and-lpg-11191539,2026-03-09T19:02:14+00:00
NDTV,most_read,18,"Iran War Creates A $35 Trillion 'Superpower', Bigger Than India and UK Combined",https://www.ndtv.com/india-news/iran-war-creates-a-35-trillion-superpower-bigger-than-india-and-uk-combined-11188957,2026-03-09T19:02:14+00:00
NDTV,most_read,19,"First-Time Father Holding Newborn Melts Hearts, Video Hits 207 Million Views",https://www.ndtv.com/offbeat/first-time-fathers-nervous-reaction-to-holding-newborn-melts-internet-video-hits-207-million-views-11191485,2026-03-09T19:02:14+00:00
NDTV,most_read,20,"Iran Defies Trump, Names Khamenei's Son Mojtaba As New Supreme Leader",https://www.ndtv.com/world-news/iran-israel-us-war-news-live-khameneis-son-mojtaba-khamenei-named-irans-new-supreme-leader-11187447,2026-03-09T19:02:14+00:00
NDTV,most_read,21,BJP Fact-Checks Mamata Banerjee's 'President Standing' Photo Attack On PM,https://www.ndtv.com/india-news/president-droupadi-murmu-pm-narendra-modi-mamata-banerjee-president-row-spirals-mamata-banerjees-targets-pm-modi-with-photo-proof-11188113,2026-03-09T19:02:14+00:00
NDTV,most_read,22,"""He's On It"": Trump's Update Over Iranian Women Footballers In Australia",https://www.ndtv.com/world-news/iran-war-mojtaba-khamenei-dont-do-it-trumps-message-for-australia-over-iranian-women-footballers-11191321,2026-03-09T19:02:14+00:00
NDTV,most_read,23,"Fuel Prices Up, Salaries Cut: Energy Shock To Pakistan Amid Iran War",https://www.ndtv.com/world-news/iran-war-live-fuel-prices-up-salaries-cut-energy-shock-to-pakistan-amid-iran-war-11192085,2026-03-09T19:02:14+00:00
NDTV,most_read,24,Many Americans Are Leaving US And Settling Abroad: Top Destinations Revealed,https://www.ndtv.com/world-news/growing-number-of-americans-are-leaving-us-and-settling-abroad-here-are-countries-they-are-heading-to-11191030,2026-03-09T19:02:14+00:00
NDTV,most_read,25,"High Court Cancels Congress MLA's Election, Declares BJP Ex-Minister Winner",https://www.ndtv.com/india-news/madhya-pradesh-high-court-cancels-congress-mla-mukesh-malhotras-election-declares-bjp-ex-minister-ramniwas-rawat-winner-11190192,2026-03-09T19:02:14+00:00
NDTV,most_read,26,"Mojtaba Khamenei Takes Over, But Iran's Power Is No Longer In One Man's Hands",https://www.ndtv.com/world-news/iran-israel-war-live-mojtaba-khamenei-takes-over-but-irans-power-is-no-longer-in-one-mans-hands-11191078,2026-03-09T19:02:14+00:00
NDTV,most_read,27,"""We've Lost Contact"": Russian Workers Stuck At Iran Nuclear Plant Amid War",https://www.ndtv.com/world-news/iran-israel-war-weve-lost-contact-russian-workers-stuck-at-iran-nuclear-plant-amid-war-11189585,2026-03-09T19:02:14+00:00
NDTV,most_read,28,"Surat Women Use ChatGPT For Suicide In Temple Washroom, Elon Musk Reacts",https://www.ndtv.com/india-news/elon-musk-surat-chatgpt-suicide-surat-women-use-chatgpt-for-suicide-in-temple-washroom-elon-musk-reacts-11188445,2026-03-09T19:02:14+00:00
NDTV,most_read,29,"No-Confidence Motion Against Speaker On, Opposition Plans Next Step",https://www.ndtv.com/india-news/no0confidence-motion-against-speaker-om-birla-on-opposition-plans-next-step-target-poll-panel-chief-gyanesh-kumar-11190695,2026-03-09T19:02:14+00:00
NDTV,most_read,30,How Iran Plotted To Assassinate Trump Before He Struck Back: Report,https://www.ndtv.com/world-news/iran-israel-war-live-updates-donald-trump-how-iran-plotted-to-assassinate-trump-before-he-struck-back-report-11188482,2026-03-09T19:02:14+00:00
NDTV,most_read,31,Beloved US Teacher Dies After Prank By Students Goes Horribly Wrong,https://www.ndtv.com/world-news/beloved-us-teacher-dies-after-prank-by-students-goes-horribly-wrong-11188872,2026-03-09T19:02:14+00:00
NDTV,most_read,32,Rashmika Mandanna-Vijay Deverakonda Sangeet: The Night They 'Danced As One' Till 4 AM,https://www.ndtv.com/entertainment/rashmika-mandanna-vijay-deverakonda-sangeet-the-night-they-danced-as-one-till-4-am-11161772,2026-03-09T19:02:14+00:00
NDTV,most_read,33,CBSE Class 12 Mathematics Board Exam Live,https://www.ndtv.com/education/cbse-board-exams-2026-live-updates-class-12-mathematics-paper-final-revision-plan-and-exam-day-guidelines-11187773,2026-03-09T19:02:14+00:00
NDTV,most_read,34,"Sensex Today | Nifty 50, Share Market Live Updates",https://www.ndtv.com/india-news/stock-marketlive-updates-sensex-nifty-likely-to-crash-as-oil-crosses-105-mark-11187870,2026-03-09T19:02:14+00:00
NDTV,most_read,35,S Jaishankar Speaks On Iran War LIVE Updates,https://www.ndtv.com/india-news/parliament-budget-session-live-updates-lok-sabha-pm-modi-speaker-om-birla-impeachment-middle-east-tension-s-jaishankar-address-iran-war-11188126,2026-03-09T19:02:14+00:00
NDTV,trending,1,"Kuki Students' Body Questions Manipur Congress MP's Comments On Land, ST",https://www.ndtv.com/india-news/top-kuki-students-body-kso-questions-manipur-congress-mps-comments-on-land-st-11191946,2026-03-09T19:02:14+00:00
NDTV,trending,2,Row In Madhya Pradesh As Congress Seeks Separate Religion Code For Tribals,https://www.ndtv.com/india-news/row-in-madhya-pradesh-as-congress-seeks-separate-religion-code-for-tribals-11191924,2026-03-09T19:02:14+00:00
NDTV,trending,3,Raghav Chadha Urges Expansion of 'Udaan Yatri Cafes' Across All Airports,https://www.ndtv.com/india-news/raghav-chadha-urges-expansion-of-udaan-yatri-cafes-across-all-airports-11191825,2026-03-09T19:02:14+00:00
NDTV,trending,4,"Kashmiri Leaders Meet Iranian Ambassador, Express Support For Iran",https://www.ndtv.com/india-news/kashmiri-leaders-meet-iranian-ambassador-express-support-for-iran-11191660,2026-03-09T19:02:14+00:00
NDTV,trending,5,"""India-Nepal Ties Will Scale New Heights"": PM Modi Congratulates Balen Shah",https://www.ndtv.com/india-news/nepal-election-results-india-nepal-ties-will-scale-new-heights-pm-narendra-modi-congratulates-balen-shah-11191435,2026-03-09T19:02:14+00:00
NDTV,trending,6,"Two Candidates, One Rank: UPSC Clears Confusion Over Rank 301 Claim",https://www.ndtv.com/education/upsc-issues-clarification-as-two-akanksha-singhs-claim-rank-301-in-civil-services-exam-11190819,2026-03-09T19:02:14+00:00
NDTV,trending,7,"Punjab State Teacher Eligibility Test 2026: Admit Card Out, Download Link Here",https://www.ndtv.com/education/punjab-state-teacher-eligibility-test-2026-admit-card-out-download-link-here-11189693,2026-03-09T19:02:14+00:00
NDTV,trending,8,"CBSE Class 12 Mathematics Exam: Check Paper Analysis, Student Reactions Here",https://www.ndtv.com/education/cbse-class-12-mathematics-exam-check-paper-analysis-student-reactions-here-11189498,2026-03-09T19:02:14+00:00
NDTV,trending,9,"RRB NTPC Graduate Level Exam 2025: City Slip Out, Download Link Here",https://www.ndtv.com/education/rrb-ntpc-graduate-level-exam-2025-city-slip-out-download-link-here-11189156,2026-03-09T19:02:14+00:00
NDTV,trending,10,Delhi Private School Removes Students From Class 12 Session Over Pending Fees,https://www.ndtv.com/education/east-delhi-mayur-vihar-school-strikes-off-4-class-12-students-over-unpaid-fees-11189079,2026-03-09T19:02:14+00:00
NDTV,trending,11,The Beast Of Kandahar: How One Captured Drone Changed Modern Warfare,https://www.ndtv.com/world-news/iran-israel-war-live-updates-drones-middle-east-in-iran-us-israel-war-the-multiverse-of-copycat-drones-11190879,2026-03-09T19:02:14+00:00
NDTV,trending,12,"""One Phone Call From PM Modi To Israel And Iran Can End Issue"": UAE Envoy",https://www.ndtv.com/world-news/iran-israel-war-pm-narendra-modi-can-speak-to-iran-and-israel-to-end-war-uae-envoy-hussain-hassan-mirza-to-ndtv-11190307,2026-03-09T19:02:14+00:00
NDTV,trending,13,White House Sent 'WTF' Message To Israel After Iran Oil Field Strike,https://www.ndtv.com/world-news/iran-israel-war-us-wtf-message-israel-attacks-iran-oil-fields-oil-prices-rise-brent-crude-price-today-11188848,2026-03-09T19:02:14+00:00
NDTV,trending,14,"Father, Mother, Wife, Son: Every Family Member Mojtaba Khamenei Lost In Iran War",https://www.ndtv.com/world-news/iran-israel-war-the-price-mojtaba-khamenei-paid-as-he-takes-over-as-iran-supreme-leader-11189998,2026-03-09T19:02:14+00:00
NDTV,trending,15,"After Khamenei's Death, Iran Sent A Signal To Activate Sleeper Cells",https://www.ndtv.com/world-news/israel-iran-war-after-khameneis-death-iran-sent-a-signal-to-activate-sleeper-cells-report-11192094,2026-03-09T19:02:14+00:00
NDTV,trending,16,"LIVE: ""We Have Many Surprises In Store"": Iran's Fresh Warning To US",https://www.ndtv.com/world-news/iran-israel-war-live-updates-us-middle-east-crisis-news-mojtaba-khamenei-iran-new-supreme-leader-donald-trump-netanyahu-dubai-11187798,2026-03-09T19:02:14+00:00
NDTV,trending,17,'Will Stay Open Till Last Drop': Bengaluru Hotels' SOS Over Commercial Gas,https://www.ndtv.com/bangalore-news/will-stay-open-till-last-drop-bengaluru-hotels-sos-over-commercial-cooking-gas-and-lpg-11191539,2026-03-09T19:02:14+00:00
NDTV,trending,18,"Iran War Creates A $35 Trillion 'Superpower', Bigger Than India and UK Combined",https://www.ndtv.com/india-news/iran-war-creates-a-35-trillion-superpower-bigger-than-india-and-uk-combined-11188957,2026-03-09T19:02:14+00:00
NDTV,trending,19,"First-Time Father Holding Newborn Melts Hearts, Video Hits 207 Million Views",https://www.ndtv.com/offbeat/first-time-fathers-nervous-reaction-to-holding-newborn-melts-internet-video-hits-207-million-views-11191485,2026-03-09T19:02:14+00:00
NDTV,trending,20,"Iran Defies Trump, Names Khamenei's Son Mojtaba As New Supreme Leader",https://www.ndtv.com/world-news/iran-israel-us-war-news-live-khameneis-son-mojtaba-khamenei-named-irans-new-supreme-leader-11187447,2026-03-09T19:02:14+00:00
NDTV,trending,21,BJP Fact-Checks Mamata Banerjee's 'President Standing' Photo Attack On PM,https://www.ndtv.com/india-news/president-droupadi-murmu-pm-narendra-modi-mamata-banerjee-president-row-spirals-mamata-banerjees-targets-pm-modi-with-photo-proof-11188113,2026-03-09T19:02:14+00:00
NDTV,trending,22,AI-Generated Fake Satellite Images Fuel Misinformation In US-Iran War,https://www.ndtv.com/world-news/iran-israel-us-war-ai-generated-fake-satellite-images-fuel-misinformation-in-us-iran-war-middle-east-conflict-11188221,2026-03-09T19:02:14+00:00
NDTV,trending,23,What Iranian Actor Elnaaz Norouzi Told NDTV After Reports Claim New Supreme Leader Chosen: 'Khamenei's Son Not People's Choice',https://www.ndtv.com/entertainment/iranian-actor-elnaaz-norouzi-to-ndtv-after-mojtaba-named-irans-new-supreme-leader-khameneis-son-not-chosen-by-people-11167593,2026-03-09T19:02:14+00:00
NDTV,trending,24,How Iran Plotted To Assassinate Trump Before He Struck Back: Report,https://www.ndtv.com/world-news/iran-israel-war-live-updates-donald-trump-how-iran-plotted-to-assassinate-trump-before-he-struck-back-report-11188482,2026-03-09T19:02:14+00:00
NDTV,trending,25,Beloved US Teacher Dies After Prank By Students Goes Horribly Wrong,https://www.ndtv.com/world-news/beloved-us-teacher-dies-after-prank-by-students-goes-horribly-wrong-11188872,2026-03-09T19:02:14+00:00
NDTV,trending,26,"Stopping Meals 3 Hours Before Bed May Improve Blood Pressure And Blood Sugar, Says New Study",https://www.ndtv.com/health/stopping-meals-3-hours-before-bed-may-improve-blood-pressure-and-blood-sugar-says-new-study-11191181,2026-03-09T19:02:14+00:00
NDTV,trending,27,CBSE Class 12 Mathematics Board Exam Live,https://www.ndtv.com/education/cbse-board-exams-2026-live-updates-class-12-mathematics-paper-final-revision-plan-and-exam-day-guidelines-11187773,2026-03-09T19:02:14+00:00
NDTV,trending,28,"Sensex Today | Nifty 50, Share Market Live Updates",https://www.ndtv.com/india-news/stock-marketlive-updates-sensex-nifty-likely-to-crash-as-oil-crosses-105-mark-11187870,2026-03-09T19:02:14+00:00
NDTV,trending,29,S Jaishankar Speaks On Iran War LIVE Updates,https://www.ndtv.com/india-news/parliament-budget-session-live-updates-lok-sabha-pm-modi-speaker-om-birla-impeachment-middle-east-tension-s-jaishankar-address-iran-war-11188126,2026-03-09T19:02:14+00:00
India Today,trending,1,SBI employee's retirement video shows emotional farewell from colleagues at branch,https://www.indiatoday.in/trending-news/story/sbi-employee-retirement-video-shows-emotional-farewell-from-colleagues-at-kerala-branch-2879480-2026-03-09,2026-03-09T19:02:14+00:00
India Today,trending,2,"Woman spots two rare 'doomsday fish' on Mexico beach, records surreal moment",https://www.indiatoday.in/trending-news/story/woman-spots-two-rare-doomsday-fish-oarfish-on-mexico-beach-records-surreal-moment-2879388-2026-03-09,2026-03-09T19:02:14+00:00
India Today,trending,3,"The Big BOOM Theory: GOAT is dead, all hail the new king",https://www.indiatoday.in/trending-news/story/the-big-boom-theory-goat-is-dead-all-hail-new-king-jasprit-bumrah-india-vs-new-zealand-final-t20-world-cup-2879366-2026-03-09,2026-03-09T19:02:14+00:00
India Today,trending,4,"Delhi, UP Police's Bumrah banter after India's T20 World Cup win goes viral",https://www.indiatoday.in/trending-news/story/delhi-police-up-police-bumrah-banter-after-india-t20-world-cup-win-goes-viral-2879299-2026-03-09,2026-03-09T19:02:14+00:00
India Today,trending,5,Chennai doctor hands newborn to nervous father in video with 198 million views,https://www.indiatoday.in/trending-news/story/chennai-doctor-hands-newborn-to-nervous-father-in-adorable-video-with-198-million-views-2879247-2026-03-09,2026-03-09T19:02:14+00:00
