source,section,rank,headline,link,collected_at_iso
Times of India,trending,34,BCCI Annual Award,https://timesofindia.indiatimes.com/articleshow/129386397.cms,2026-03-10T17:01:33+00:00
Times of India,trending,35,Pakistan Schools Closed,https://timesofindia.indiatimes.com/articleshow/129377206.cms,2026-03-10T17:01:33+00:00
Times of India,trending,36,Bangladesh Fuel Crisis,https://timesofindia.indiatimes.com/articleshow/129384226.cms,2026-03-10T17:01:33+00:00
Times of India,trending,37,Ram Gopal Varma,https://timesofindia.indiatimes.com/articleshow/129348069.cms,2026-03-10T17:01:33+00:00
Times of India,trending,38,Dhurandhar 2 Advance Booking,https://timesofindia.indiatimes.com/articleshow/129312149.cms,2026-03-10T17:01:33+00:00
Times of India,trending,39,Jr Ntr Watch Collection,https://timesofindia.indiatimes.com/articleshow/129369603.cms,2026-03-10T17:01:33+00:00
Times of India,trending,40,Sitaare Zameen Par OTT,https://timesofindia.indiatimes.com/articleshow/129350355.cms,2026-03-10T17:01:33+00:00
Times of India,trending,41,One Piece Season 2,https://timesofindia.indiatimes.com/articleshow/129367716.cms,2026-03-10T17:01:33+00:00
Times of India,trending,42,Dhurandhar The Revenge,https://timesofindia.indiatimes.com/articleshow/129368066.cms,2026-03-10T17:01:33+00:00
Times of India,trending,43,Cooked Chicken Storage Time,https://timesofindia.indiatimes.com/articleshow/129348795.cms,2026-03-10T17:01:33+00:00
Times of India,trending,44,Tommy DeCarlo Death,https://timesofindia.indiatimes.com/articleshow/129380690.cms,2026-03-10T17:01:33+00:00
Times of India,trending,45,Shivam Dube House,https://timesofindia.indiatimes.com/articleshow/129392063.cms,2026-03-10T17:01:33+00:00
Times of India,trending,46,Nasa Satellite Crash,https://timesofindia.indiatimes.com/articleshow/129379719.cms,2026-03-10T17:01:33+00:00
Times of India,trending,47,Indian Cobra VS Egyptian Cobra,https://timesofindia.indiatimes.com/articleshow/129376134.cms,2026-03-10T17:01:33+00:00
Times of India,trending,48,Ludhiana School Bomb Threat,https://timesofindia.indiatimes.com/articleshow/129373583.cms,2026-03-10T17:01:33+00:00
Times of India,trending,49,Delhi Uttam Nagar Murder Case,https://timesofindia.indiatimes.com/articleshow/129373737.cms,2026-03-10T17:01:33+00:00
Times of India,trending,50,CBSE Class 12 Mathematics Paper,https://timesofindia.indiatimes.com/articleshow/129375148.cms,2026-03-10T17:01:33+00:00
Times of India,trending,51,UP Gosaiganj Accident,https://timesofindia.indiatimes.com/articleshow/129377549.cms,2026-03-10T17:01:33+00:00
Times of India,trending,52,Bengaluru Realtor Murder,https://timesofindia.indiatimes.com/articleshow/129378308.cms,2026-03-10T17:01:33+00:00
Times of India,trending,53,Maharashtra E Bike Taxi Permits,https://timesofindia.indiatimes.com/articleshow/129371643.cms,2026-03-10T17:01:33+00:00
Times of India,trending,54,Mandya Couple Suicide,https://timesofindia.indiatimes.com/articleshow/129347868.cms,2026-03-10T17:01:33+00:00
Times of India,trending,55,Delhi Kolkata Flight Schedule,https://timesofindia.indiatimes.com/articleshow/129380688.cms,2026-03-10T17:01:33+00:00
Times of India,trending,56,Arunachal Pradesh Accident,https://timesofindia.indiatimes.com/articleshow/129377988.cms,2026-03-10T17:01:33+00:00
Times of India,trending,57,Bhiwandi Rape News,https://timesofindia.indiatimes.com/articleshow/129375960.cms,2026-03-10T17:01:33+00:00
Times of India,trending,58,CBSE Maths Exam QR Code,https://timesofindia.indiatimes.com/articleshow/129382834.cms,2026-03-10T17:01:33+00:00
Times of India,trending,59,Uniform Civil Code,https://timesofindia.indiatimes.com/articleshow/129377945.cms,2026-03-10T17:01:33+00:00
Times of India,trending,60,West Bengal SIR,https://timesofindia.indiatimes.com/articleshow/129386080.cms,2026-03-10T17:01:33+00:00
Times of India,trending,61,Who is Robert Griswold,https://timesofindia.indiatimes.com/articleshow/129392005.cms,2026-03-10T17:01:33+00:00
Times of India,trending,62,Shohei Ohtani Net Worth,https://timesofindia.indiatimes.com/articleshow/129391346.cms,2026-03-10T17:01:33+00:00
Times of India,trending,63,Sharjah Woman Harassment Case,https://timesofindia.indiatimes.com/articleshow/129389441.cms,2026-03-10T17:01:33+00:00
Times of India,trending,64,Hyundai Verna Facelift,https://timesofindia.indiatimes.com/articleshow/129374768.cms,2026-03-10T17:01:33+00:00
Times of India,trending,65,Anthropic Ceo Dario Amodei,https://timesofindia.indiatimes.com/articleshow/129137566.cms,2026-03-10T17:01:33+00:00
Times of India,trending,66,How robots found bases for humans on Mars,https://timesofindia.indiatimes.com/articleshow/129408386.cms,2026-03-10T17:01:33+00:00
Times of India,trending,67,HC urges MHA to frame uniform policy on freezing a/cs during criminal probe,https://timesofindia.indiatimes.com/articleshow/129408798.cms,2026-03-10T17:01:33+00:00
Times of India,trending,68,Nvidia CEO Jensen Huang to everyone: Here's what changed about AI in 2025 and what it mean in 2026,https://timesofindia.indiatimes.com/articleshow/129408750.cms,2026-03-10T17:01:33+00:00
Times of India,trending,69,State pays tribute to German historian Kulke,https://timesofindia.indiatimes.com/articleshow/129408723.cms,2026-03-10T17:01:33+00:00
Times of India,trending,70,Seven-member international cybercrime module busted in Ramanathapuram district; cop among those arrested,https://timesofindia.indiatimes.com/articleshow/129408566.cms,2026-03-10T17:01:33+00:00
Times of India,trending,71,BBMKU Students Injured in Chennai Youth Festival Gate Collapse,https://timesofindia.indiatimes.com/articleshow/129408555.cms,2026-03-10T17:01:33+00:00
Times of India,trending,72,Victor Wembanyama’s net worth: How the San Antonio Spurs sensation built a $10M fortune,https://timesofindia.indiatimes.com/articleshow/129408537.cms,2026-03-10T17:01:33+00:00
Times of India,trending,73,Naveen questions state govt role in evacuating Odias from West Asia; BJP hits back,https://timesofindia.indiatimes.com/articleshow/129408512.cms,2026-03-10T17:01:33+00:00
Times of India,trending,74,"Bokaro DC Withholds Salaries for Absent Officials, Directs Scheme Progress",https://timesofindia.indiatimes.com/articleshow/129408510.cms,2026-03-10T17:01:33+00:00
Times of India,trending,75,"RPF Rescues Minors from Trafficking at Ranchi, Hatia Stations",https://timesofindia.indiatimes.com/articleshow/129408449.cms,2026-03-10T17:01:33+00:00
Times of India,trending,76,Govt: No LPG shortage for consumers in twin cities,https://timesofindia.indiatimes.com/articleshow/129408433.cms,2026-03-10T17:01:33+00:00
Times of India,trending,77,"Brinda Karat: India's Sovereignty Compromised by US Oil Dictates, Iran Silence Isolates Nation",https://timesofindia.indiatimes.com/articleshow/129408411.cms,2026-03-10T17:01:33+00:00
Times of India,trending,78,Russell Wilson and Ciara’s $185 million net wealth: How the NFL power couple built a fortune through football and music,https://timesofindia.indiatimes.com/articleshow/129407968.cms,2026-03-10T17:01:33+00:00
Times of India,trending,79,"Bomb Threat Hoax: Ranchi Civil Court & Jamshedpur XLRI Receive Fake Threats, Police Investigate",https://timesofindia.indiatimes.com/articleshow/129408341.cms,2026-03-10T17:01:33+00:00
Times of India,trending,80,Odia Samaj in Bahrain seeks evacuation plan for Indians,https://timesofindia.indiatimes.com/articleshow/129408326.cms,2026-03-10T17:01:33+00:00
Times of India,trending,81,"Taapsee Pannu says Shah Rukh Khan, Akshay Kumar don't have big entourages, questions producers for giving work to 'delusional' actors with huge teams",https://timesofindia.indiatimes.com/articleshow/129408050.cms,2026-03-10T17:01:33+00:00
Times of India,trending,82,Trailer Truck Accident Kills Driver and Helper on NH-2 Hazaribag,https://timesofindia.indiatimes.com/articleshow/129408282.cms,2026-03-10T17:01:33+00:00
Times of India,trending,83,Tender called for waste to energy plant in Coimbatore,https://timesofindia.indiatimes.com/articleshow/129408016.cms,2026-03-10T17:01:33+00:00
NDTV,most_read,1,Air India Fares To Rise As It Imposes Fuel Surcharge Amid Iran War,https://www.ndtv.com/india-news/us-iran-war-air-india-fares-to-rise-as-it-imposes-fuel-surcharge-amid-iran-war-11196686,2026-03-10T17:01:33+00:00
NDTV,most_read,2,India Defines 4 Priority Sectors For Using Natural Gas Amid Iran-US War,https://www.ndtv.com/india-news/india-defines-4-priority-sectors-for-using-natural-gas-amid-iran-us-war-11196682,2026-03-10T17:01:33+00:00
NDTV,most_read,3,"Eye On China, Centre Eases Foreign Direct Investment Rules For Neighbours",https://www.ndtv.com/india-news/eyeing-china-centre-eases-foreign-direct-investment-rules-for-neighbours-11196452,2026-03-10T17:01:33+00:00
NDTV,most_read,4,Form Compensation Policy For Harm From Covid Shots: Top Court To Centre,https://www.ndtv.com/india-news/form-compensation-policy-for-harm-from-covid-shots-supreme-court-to-centre-11196215,2026-03-10T17:01:33+00:00
NDTV,most_read,5,Pieter Elbers: The Top Executive Who Headed IndiGo During Its Worst Crisis,https://www.ndtv.com/india-news/who-is-pieter-elbers-the-top-executive-who-headed-indigo-during-its-worst-crisis-11196025,2026-03-10T17:01:33+00:00
NDTV,most_read,6,"IITian Quits Startup Job, Studies From Home, Secures AIR 102 In UPSC Exam",https://www.ndtv.com/education/upsc-success-story-2026-iitian-quits-startup-job-studies-from-home-in-bihar-secures-air-102-in-upsc-exam-11196223,2026-03-10T17:01:33+00:00
NDTV,most_read,7,"UPSC CSE 2025 Topper Anuj Agnihotri Scores 52.88%, Check What Others Scored",https://www.ndtv.com/education/upsc-cse-2025-topper-anuj-agnihotri-scores-52-88-marks-check-what-others-scored-11195557,2026-03-10T17:01:33+00:00
NDTV,most_read,8,IIT (ISM) Dhanbad Invites Applications For Summer Research Internship,https://www.ndtv.com/education/iit-ism-dhanbad-invites-applications-for-summer-research-internship-2026-check-details-here-11195199,2026-03-10T17:01:33+00:00
NDTV,most_read,9,"Bihar Board Class 12 Result 2026: Expected Release Date, Steps To Check",https://www.ndtv.com/education/bihar-board-class-12-result-2026-expected-release-date-steps-to-check-11194854,2026-03-10T17:01:33+00:00
NDTV,most_read,10,SBI Clerk Mains Result 2026 To Be Out Today; Candidates Can Check Scorecard,https://www.ndtv.com/education/sbi-clerk-mains-result-2026-to-be-out-today-candidates-can-check-scorecard-response-sheet-11194431,2026-03-10T17:01:33+00:00
NDTV,most_read,11,China's Eyes In Space Exposed US War Machine Before 1st Bomb Fell In Iran War,https://www.ndtv.com/world-news/iran-israel-war-mizarvision-chinese-spies-iran-war-live-a-war-china-watches-from-space-tracking-us-military-assets-in-real-time-11194213,2026-03-10T17:01:33+00:00
NDTV,most_read,12,"After Trump's ""War Very Complete"" Remark, Iran Snaps Back, Sets Terms",https://www.ndtv.com/world-news/iran-israel-us-war-donald-trump-war-very-complete-remark-iran-on-mediation-ceasfire-11194531,2026-03-10T17:01:33+00:00
NDTV,most_read,13,Is The Gulf Now Questioning Its US Ties - And The American 'Guarantee'?,https://www.ndtv.com/opinion/is-the-gulf-now-questioning-its-us-ties-and-the-american-guarantee-11195107,2026-03-10T17:01:33+00:00
NDTV,most_read,14,Explained: Why Is Mumbai Already At 40 Degrees And How Long It Will Last,https://www.ndtv.com/mumbai-news/mumbai-weather-heatwave-explained-why-is-it-so-hot-in-mumbai-and-how-long-will-it-last-11194578,2026-03-10T17:01:33+00:00
NDTV,most_read,15,"Repairs Failed, Pak Demolishes Murid Air Base Building Hit During Op Sindoor",https://www.ndtv.com/world-news/failed-repairs-pakistan-demolishes-murid-air-base-building-hit-during-operation-sindoor-11193438,2026-03-10T17:01:33+00:00
NDTV,most_read,16,How China Could Stop American F-35 Jets Without Firing A Single Shot,https://www.ndtv.com/world-news/iran-war-inside-chinas-plan-that-could-stop-us-f-35-jets-without-firing-a-single-shot-11193088,2026-03-10T17:01:33+00:00
NDTV,most_read,17,The Country That Buys 90% Of Iran's Oil Is Still Not Panicking. Here's Why,https://www.ndtv.com/opinion/iran-israel-war-will-the-oil-field-attack-push-china-closer-to-russia-11193799,2026-03-10T17:01:33+00:00
NDTV,most_read,18,"""One Phone Call From PM Modi To Israel And Iran Can End Issue"": Ex-UAE Envoy",https://www.ndtv.com/world-news/iran-israel-war-pm-narendra-modi-can-speak-to-iran-and-israel-to-end-war-uae-envoy-hussain-hassan-mirza-to-ndtv-11190307,2026-03-10T17:01:33+00:00
NDTV,most_read,19,"""I Don't Believe He Can Live In Peace"": Trump's Warning For Mojtaba Khamenei",https://www.ndtv.com/world-news/us-iran-war-i-dont-believe-he-can-live-in-peace-trumps-warning-for-mojtaba-khamenei-11195256,2026-03-10T17:01:33+00:00
NDTV,most_read,20,"""Beware, Lest You Be Eliminated"": Iran Threatens Trump After He Warns Mojtaba",https://www.ndtv.com/world-news/us-iran-israel-war-beware-lest-you-be-eliminated-iran-threatens-trump-after-he-warns-mojtaba-11195463,2026-03-10T17:01:33+00:00
NDTV,most_read,21,"CEO Pieter Elbers Quits With ""Immediate Effect"" 3 Months After IndiGo Crisis",https://www.ndtv.com/india-news/indigo-ceo-pieter-elbers-resigns-airline-says-relieved-with-immediate-effect-11195566,2026-03-10T17:01:33+00:00
NDTV,most_read,22,"Iran Fires Drones At Saudi, Kuwait After Trump Says War Could Be Over Soon",https://www.ndtv.com/world-news/iran-fires-drones-at-saudi-arabia-kuwait-after-donald-trump-says-war-could-be-over-soon-middle-east-conflict-11193036,2026-03-10T17:01:33+00:00
NDTV,most_read,23,"Gurugram Techie Reveals Rs 89,500 Monthly Expense Breakdown, Internet Reacts",https://www.ndtv.com/offbeat/gurugram-techie-reveals-rs-89-500-monthly-expense-breakdown-internet-reacts-11195371,2026-03-10T17:01:33+00:00
NDTV,most_read,24,"""Skip Meal, Buy Silver"": Rich Dad, Poor Dad Author Urges As War Fears Rise",https://www.ndtv.com/offbeat/skip-a-meal-buy-silver-rich-dad-poor-dad-author-urges-as-war-fears-rise-11196357,2026-03-10T17:01:33+00:00
NDTV,most_read,25,What Is US' New 'WISA' Proposal That Can Help Indian H-1B Visa Holders,https://www.ndtv.com/world-news/what-is-us-new-wisa-proposal-that-can-help-indian-h-1b-visa-holders-11194001,2026-03-10T17:01:33+00:00
NDTV,most_read,26,Why Russia's Putin May Be The Biggest Winner Of Trump's Iran War,https://www.ndtv.com/world-news/why-russia-may-be-the-biggest-winner-of-trump-iran-war-11193552,2026-03-10T17:01:33+00:00
NDTV,most_read,27,"Bengaluru, Chennai, Mumbai Hotels Flag LPG Cylinder Shortage, Centre Responds",https://www.ndtv.com/india-news/iran-israel-war-bengaluru-chennai-mumbai-hotels-flag-lpg-cylinder-shortage-centre-responds-11192971,2026-03-10T17:01:33+00:00
NDTV,most_read,28,Nayanthara And Husband Vignesh Shivan Buy Rs 31.5 Crore Duplex Apartment In Chennai's Poes Garden: Report,https://www.ndtv.com/entertainment/nayanthara-purchases-31-5-crore-duplex-apartment-in-chennai-s-poes-garden-11175509,2026-03-10T17:01:33+00:00
NDTV,most_read,29,"Count The Stars In This Viral Pic: Ranbir Kapoor, Aryan Khan And Others",https://www.ndtv.com/entertainment/count-the-stars-in-this-viral-pic-ranbir-kapoor-aryan-khan-and-others-11167049,2026-03-10T17:01:33+00:00
NDTV,most_read,30,"""Fridge Mein Milegi"": Mumbai Dentist's Suicide, And Shraddha Walkar Warning",https://www.ndtv.com/india-news/fridge-mein-milegi-mumbai-dentists-suicide-and-shraddha-walkar-warning-11194971,2026-03-10T17:01:33+00:00
NDTV,most_read,31,Kanji For Gut Health: Why This Fermented Drink Holds The Key To Your Immunity In Summer,https://www.ndtv.com/health/kanji-for-gut-health-why-this-fermented-drink-holds-the-key-to-your-immunity-in-summer-11190038,2026-03-10T17:01:33+00:00
NDTV,most_read,32,CBSE Class 12 Mathematics Board Exam Live,https://www.ndtv.com/education/cbse-board-exams-2026-live-updates-class-12-mathematics-paper-final-revision-plan-and-exam-day-guidelines-11187773,2026-03-10T17:01:33+00:00
NDTV,most_read,33,US-Israel-Iran War Live Updates,https://www.ndtv.com/world-news/iran-israel-war-live-updates-us-middle-east-crisis-news-mojtaba-khamenei-iran-new-supreme-leader-donald-trump-netanyahu-dubai-11187798,2026-03-10T17:01:33+00:00
NDTV,most_read,34,"Sensex Today | Nifty 50, Share Market Live Updates",https://www.ndtv.com/india-news/stock-marketlive-updates-sensex-nifty-likely-to-crash-as-oil-crosses-105-mark-11187870,2026-03-10T17:01:33+00:00
NDTV,most_read,35,S Jaishankar Speaks On Iran War LIVE Updates,https://www.ndtv.com/india-news/parliament-budget-session-live-updates-lok-sabha-pm-modi-speaker-om-birla-impeachment-middle-east-tension-s-jaishankar-address-iran-war-11188126,2026-03-10T17:01:33+00:00
NDTV,trending,1,Air India Fares To Rise As It Imposes Fuel Surcharge Amid Iran War,https://www.ndtv.com/india-news/us-iran-war-air-india-fares-to-rise-as-it-imposes-fuel-surcharge-amid-iran-war-11196686,2026-03-10T17:01:33+00:00
NDTV,trending,2,India Defines 4 Priority Sectors For Using Natural Gas Amid Iran-US War,https://www.ndtv.com/india-news/india-defines-4-priority-sectors-for-using-natural-gas-amid-iran-us-war-11196682,2026-03-10T17:01:33+00:00
NDTV,trending,3,"Eye On China, Centre Eases Foreign Direct Investment Rules For Neighbours",https://www.ndtv.com/india-news/eyeing-china-centre-eases-foreign-direct-investment-rules-for-neighbours-11196452,2026-03-10T17:01:33+00:00
NDTV,trending,4,Form Compensation Policy For Harm From Covid Shots: Top Court To Centre,https://www.ndtv.com/india-news/form-compensation-policy-for-harm-from-covid-shots-supreme-court-to-centre-11196215,2026-03-10T17:01:33+00:00
NDTV,trending,5,Pieter Elbers: The Top Executive Who Headed IndiGo During Its Worst Crisis,https://www.ndtv.com/india-news/who-is-pieter-elbers-the-top-executive-who-headed-indigo-during-its-worst-crisis-11196025,2026-03-10T17:01:33+00:00
NDTV,trending,6,"IITian Quits Startup Job, Studies From Home, Secures AIR 102 In UPSC Exam",https://www.ndtv.com/education/upsc-success-story-2026-iitian-quits-startup-job-studies-from-home-in-bihar-secures-air-102-in-upsc-exam-11196223,2026-03-10T17:01:33+00:00
NDTV,trending,7,"UPSC CSE 2025 Topper Anuj Agnihotri Scores 52.88%, Check What Others Scored",https://www.ndtv.com/education/upsc-cse-2025-topper-anuj-agnihotri-scores-52-88-marks-check-what-others-scored-11195557,2026-03-10T17:01:33+00:00
NDTV,trending,8,IIT (ISM) Dhanbad Invites Applications For Summer Research Internship,https://www.ndtv.com/education/iit-ism-dhanbad-invites-applications-for-summer-research-internship-2026-check-details-here-11195199,2026-03-10T17:01:33+00:00
NDTV,trending,9,"Bihar Board Class 12 Result 2026: Expected Release Date, Steps To Check",https://www.ndtv.com/education/bihar-board-class-12-result-2026-expected-release-date-steps-to-check-11194854,2026-03-10T17:01:33+00:00
NDTV,trending,10,SBI Clerk Mains Result 2026 To Be Out Today; Candidates Can Check Scorecard,https://www.ndtv.com/education/sbi-clerk-mains-result-2026-to-be-out-today-candidates-can-check-scorecard-response-sheet-11194431,2026-03-10T17:01:33+00:00
NDTV,trending,11,China's Eyes In Space Exposed US War Machine Before 1st Bomb Fell In Iran War,https://www.ndtv.com/world-news/iran-israel-war-mizarvision-chinese-spies-iran-war-live-a-war-china-watches-from-space-tracking-us-military-assets-in-real-time-11194213,2026-03-10T17:01:33+00:00
NDTV,trending,12,"After Trump's ""War Very Complete"" Remark, Iran Snaps Back, Sets Terms",https://www.ndtv.com/world-news/iran-israel-us-war-donald-trump-war-very-complete-remark-iran-on-mediation-ceasfire-11194531,2026-03-10T17:01:33+00:00
NDTV,trending,13,"""I Don't Believe He Can Live In Peace"": Trump's Warning For Mojtaba Khamenei",https://www.ndtv.com/world-news/us-iran-war-i-dont-believe-he-can-live-in-peace-trumps-warning-for-mojtaba-khamenei-11195256,2026-03-10T17:01:33+00:00
NDTV,trending,14,"Repairs Failed, Pak Demolishes Murid Air Base Building Hit During Op Sindoor",https://www.ndtv.com/world-news/failed-repairs-pakistan-demolishes-murid-air-base-building-hit-during-operation-sindoor-11193438,2026-03-10T17:01:33+00:00
NDTV,trending,15,Explained: Why Is Mumbai Already At 40 Degrees And How Long It Will Last,https://www.ndtv.com/mumbai-news/mumbai-weather-heatwave-explained-why-is-it-so-hot-in-mumbai-and-how-long-will-it-last-11194578,2026-03-10T17:01:33+00:00
NDTV,trending,16,Is The Gulf Now Questioning Its US Ties - And The American 'Guarantee'?,https://www.ndtv.com/opinion/is-the-gulf-now-questioning-its-us-ties-and-the-american-guarantee-11195107,2026-03-10T17:01:33+00:00
NDTV,trending,17,"""Vijay 1st, His Wife 2nd"": Parthiban Hits Back At Trisha In Divorce Row",https://www.ndtv.com/entertainment/vijay-1st-person-wife-2nd-trisha-3rd-in-controversy-actor-parthiban-hits-back-at-actress-in-new-video-11195970,2026-03-10T17:01:33+00:00
NDTV,trending,18,How China Could Stop American F-35 Jets Without Firing A Single Shot,https://www.ndtv.com/world-news/iran-war-inside-chinas-plan-that-could-stop-us-f-35-jets-without-firing-a-single-shot-11193088,2026-03-10T17:01:33+00:00
NDTV,trending,19,"CEO Pieter Elbers Quits With ""Immediate Effect"" 3 Months After IndiGo Crisis",https://www.ndtv.com/india-news/indigo-ceo-pieter-elbers-resigns-airline-says-relieved-with-immediate-effect-11195566,2026-03-10T17:01:33+00:00
NDTV,trending,20,The Country That Buys 90% Of Iran's Oil Is Still Not Panicking. Here's Why,https://www.ndtv.com/opinion/iran-israel-war-will-the-oil-field-attack-push-china-closer-to-russia-11193799,2026-03-10T17:01:33+00:00
NDTV,trending,21,"""One Phone Call From PM Modi To Israel And Iran Can End Issue"": Ex-UAE Envoy",https://www.ndtv.com/world-news/iran-israel-war-pm-narendra-modi-can-speak-to-iran-and-israel-to-end-war-uae-envoy-hussain-hassan-mirza-to-ndtv-11190307,2026-03-10T17:01:33+00:00
NDTV,trending,22,"""Beware, Lest You Be Eliminated"": Iran Threatens Trump After He Warns Mojtaba",https://www.ndtv.com/world-news/us-iran-israel-war-beware-lest-you-be-eliminated-iran-threatens-trump-after-he-warns-mojtaba-11195463,2026-03-10T17:01:33+00:00
NDTV,trending,23,Nayanthara And Husband Vignesh Shivan Buy Rs 31.5 Crore Duplex Apartment In Chennai's Poes Garden: Report,https://www.ndtv.com/entertainment/nayanthara-purchases-31-5-crore-duplex-apartment-in-chennai-s-poes-garden-11175509,2026-03-10T17:01:33+00:00
NDTV,trending,24,"""Don't Dare"": Supreme Court Fumes As Bengal, Poll Body Spar Over Voter List",https://www.ndtv.com/india-news/dont-dare-supreme-court-fumes-as-bengal-government-poll-body-spar-over-voter-list-mamata-banerjee-11194566,2026-03-10T17:01:33+00:00
NDTV,trending,25,What Iranian Actor Elnaaz Norouzi Told NDTV Days Before Mojtaba Khamenei Was Named Iran's New Supreme Leader,https://www.ndtv.com/entertainment/what-iranian-actor-elnaaz-norouzi-told-ndtv-days-before-mojtaba-khamenei-was-named-irans-new-supreme-leader-11188389,2026-03-10T17:01:33+00:00
NDTV,trending,26,Shreya Ghoshal On Chikni Chameli: 'Not Embarrassed But Won't Sing Songs Like That Now',https://www.ndtv.com/entertainment/shreya-ghoshal-on-chikni-chameli-not-embarrassed-but-wont-sing-songs-like-that-now-11167870,2026-03-10T17:01:33+00:00
NDTV,trending,27,What Iranian Actor Elnaaz Norouzi Told NDTV After Reports Claim New Supreme Leader Chosen: 'Khamenei's Son Not People's Choice',https://www.ndtv.com/entertainment/iranian-actor-elnaaz-norouzi-to-ndtv-after-mojtaba-named-irans-new-supreme-leader-khameneis-son-not-chosen-by-people-11167593,2026-03-10T17:01:33+00:00
NDTV,trending,28,Indian Businessman In Dubai Opens His 64-Unit Apartment For Stranded Indians,https://www.ndtv.com/world-news/iran-war-indian-businessman-in-dubai-opens-64-apartment-building-for-stranded-indians-11192749,2026-03-10T17:01:33+00:00
NDTV,trending,29,"""Fridge Mein Milegi"": Mumbai Dentist's Suicide, And Shraddha Walkar Warning",https://www.ndtv.com/india-news/fridge-mein-milegi-mumbai-dentists-suicide-and-shraddha-walkar-warning-11194971,2026-03-10T17:01:33+00:00
NDTV,trending,30,"Khushboo Sundar Reacts To Vijay And Trisha's Affair Rumours: ""Why Are People Making It A Big Deal?""",https://www.ndtv.com/entertainment/khushboo-sundar-reacts-to-vijay-and-trishas-affair-rumours-why-are-people-making-it-a-big-deal-11194545,2026-03-10T17:01:33+00:00
NDTV,trending,31,CBSE Class 12 Mathematics Board Exam Live,https://www.ndtv.com/education/cbse-board-exams-2026-live-updates-class-12-mathematics-paper-final-revision-plan-and-exam-day-guidelines-11187773,2026-03-10T17:01:33+00:00
NDTV,trending,32,US-Israel-Iran War Live Updates,https://www.ndtv.com/world-news/iran-israel-war-live-updates-us-middle-east-crisis-news-mojtaba-khamenei-iran-new-supreme-leader-donald-trump-netanyahu-dubai-11187798,2026-03-10T17:01:33+00:00
NDTV,trending,33,"Sensex Today | Nifty 50, Share Market Live Updates",https://www.ndtv.com/india-news/stock-marketlive-updates-sensex-nifty-likely-to-crash-as-oil-crosses-105-mark-11187870,2026-03-10T17:01:33+00:00
NDTV,trending,34,S Jaishankar Speaks On Iran War LIVE Updates,https://www.ndtv.com/india-news/parliament-budget-session-live-updates-lok-sabha-pm-modi-speaker-om-birla-impeachment-middle-east-tension-s-jaishankar-address-iran-war-11188126,2026-03-10T17:01:33+00:00
India Today,trending,1,"Vikas Khanna hosts Zohran Mamdani for Iftar, remembers meeting him as a child",https://www.indiatoday.in/trending-news/story/vikas-khanna-hosts-nyc-mayor-zohran-mamdani-for-iftar-remembers-meeting-him-as-an-8-year-old-2880025-2026-03-10,2026-03-10T17:01:33+00:00
India Today,trending,2,Bengaluru Police traces auto rickshaw to recover UK tourist's lost bag,https://www.indiatoday.in/trending-news/story/bengaluru-police-traces-auto-rickshaw-to-recover-uk-tourists-lost-bag-2880008-2026-03-10,2026-03-10T17:01:33+00:00
