source,section,rank,headline,link,collected_at_iso
India Today,trending,14,Bengaluru man attacked by residents after dog urinates in apartment complex,https://www.indiatoday.in/trending-news/story/bengaluru-man-attacked-by-residents-after-dog-urinates-in-apartment-complex-2878573-2026-03-07,2026-03-09T07:11:37+00:00
India Today,trending,15,Women dressed in sarees bring traditional fashion to snowboarding. Video goes viral,https://www.indiatoday.in/trending-news/story/women-dressed-in-sarees-bring-traditional-fashion-to-snowboarding-video-goes-viral-2878547-2026-03-07,2026-03-09T07:11:37+00:00
India Today,trending,16,UP headmistress makes primary school students give her body massage in class,https://www.indiatoday.in/trending-news/story/up-headmistress-makes-primary-school-students-give-her-body-massage-in-class-video-viral-2878411-2026-03-06,2026-03-09T07:11:37+00:00
India Today,trending,17,"Man returns to Delhi from Dubai amid Iran war, internet gushes over his 'face card'",https://www.indiatoday.in/trending-news/story/man-interviewed-at-delhi-airport-leaves-internet-gushing-over-his-lethal-face-card-2878367-2026-03-06,2026-03-09T07:11:37+00:00
India Today,trending,18,Andhra student punches teacher as classroom dispute turns violent. Video goes viral,https://www.indiatoday.in/trending-news/story/andhra-class-10-student-punches-teacher-as-classroom-dispute-turns-violent-video-goes-viral-2878362-2026-03-06,2026-03-09T07:11:37+00:00
India Today,trending,19,"Indian tourists prank Bangkok hotel staff with AI monkey pic, see their reactions",https://www.indiatoday.in/trending-news/story/indian-content-creators-prank-bangkok-hotel-staff-ai-monkey-image-2878259-2026-03-06,2026-03-09T07:11:37+00:00
India Today,trending,20,Odisha officials use Archimedes' principle to rescue elephant trapped in well,https://www.indiatoday.in/trending-news/story/odisha-officials-use-archimedes-principle-to-rescue-elephant-trapped-in-well-2878283-2026-03-06,2026-03-09T07:11:37+00:00
India Today,trending,21,Ravi Shastri slammed after ruining India's T20 World Cup-winning moment on commentary,https://www.indiatoday.in/sports/cricket/story/ravi-shastri-ninth-wicket-commentary-gaffe-india-t20-world-cup-win-2879296-2026-03-09,2026-03-09T07:11:37+00:00
India Today,trending,22,"3 IPOs opening this week: Rajputana Stainless, Innovision, Raajmarg Infra InvIT",https://www.indiatoday.in/business/ipo/story/3-ipos-opening-this-week-rajputana-stainless-innovision-raajmarg-infra-invit-2879294-2026-03-09,2026-03-09T07:11:37+00:00
India Today,trending,23,"Meet Abhay Bhushan, the IIT Kanpur engineer who made digital file transfers possible",https://www.indiatoday.in/education-today/gk-current-affairs/story/abhay-bhushan-the-iit-kanpur-engineer-who-developed-ftp-or-digital-file-transfers-2879293-2026-03-09,2026-03-09T07:11:37+00:00
India Today,trending,24,"YouTuber UK07 Rider Anurag Dobhal remains in ICU after crash, wife visits hospital",https://www.indiatoday.in/movies/celebrities/story/youtuber-uk07-rider-anurag-dobhal-remains-in-icu-after-crash-wife-visits-hospital-2879259-2026-03-09,2026-03-09T07:11:37+00:00
India Today,trending,25,Not just God's plan: Gautam Gambhir credits Indian fans for T20 World Cup triumph,https://www.indiatoday.in/sports/cricket/story/gautam-gambhir-credits-1-4-billion-indians-t20-world-cup-triumph-2879245-2026-03-09,2026-03-09T07:11:37+00:00
India Today,trending,26,"This bird flew 13,000 km without stopping for 11 days. Here's how",https://www.indiatoday.in/science/story/bird-migration-flew-thousands-kilometres-amur-falcon-migratory-species-how-do-birds-fly-science-adaptation-long-flights-2879236-2026-03-09,2026-03-09T07:11:37+00:00
India Today,trending,27,Video shows US Tomahawk missile striking base near Iran school: NYT,https://www.indiatoday.in/world/story/us-tomahawk-missile-likely-struck-base-near-iran-school-video-shows-nyt-report-2879221-2026-03-09,2026-03-09T07:11:37+00:00
India Today,trending,28,"Iran war disrupts LPG supply, Pune's largest crematorium faces crunch",https://www.indiatoday.in/india/story/middle-east-war-lpg-shortage-pune-vaikunth-dham-crematorium-electric-cremations-fuel-supply-issues-2879186-2026-03-09,2026-03-09T07:11:37+00:00
India Today,most_read,1,IND vs SA: Deepak Chahar likely to be ruled out of last 2 ODIs due to injury,https://www.indiatoday.in/sports/cricket/story/india-vs-south-africa-deepak-chahar-likely-to-be-ruled-out-of-last-2-odis-due-to-injury-2009550-2022-10-07,2026-03-09T07:11:37+00:00
India Today,most_read,2,Manchester City fined over pitch invasion to celebrate Premier League title win,https://www.indiatoday.in/sports/football/story/manchester-city-fined-by-fa-over-pitch-invasion-to-celebrate-premier-league-title-win-2009534-2022-10-07,2026-03-09T07:11:37+00:00
India Today,most_read,3,Chelsea manager Potter on first month in charge: We have made little bit of progress,https://www.indiatoday.in/sports/football/story/chelsea-manager-graham-potter-on-first-month-in-charge-we-have-made-little-bit-of-progress-2009531-2022-10-07,2026-03-09T07:11:37+00:00
India Today,most_read,4,'Travesty of justice’: Experts criticise errors in UN report on forced disappearances in Bangladesh,https://www.indiatoday.in/world/story/experts-criticise-error-un-report-on-forced-disappearances-in-bangladesh-2007495-2022-10-02,2026-03-09T07:11:37+00:00
India Today,most_read,5,"Fact Check: No alcohol, homosexuality? Conservative guidelines for FIFA World Cup NOT issued by Qatar govt",https://www.indiatoday.in/fact-check/story/fifa-world-cup-guidelines-fact-check-no-alcohol-homosexuality-conservative-guidelines-for-football-world-cup-not-issued-by-qatar-govt-2009495-2022-10-07,2026-03-09T07:11:37+00:00
India Today,most_read,6,"KGF star Yash meets F1 legend Lewis Hamilton, See pic",https://www.indiatoday.in/movies/regional-cinema/story/kgf-star-yash-meets-f1-legend-lewis-hamilton-see-pic-2009525-2022-10-07,2026-03-09T07:11:37+00:00
India Today,most_read,7,"IND vs PAK: Match against India brings out the best in Nida Dar, says Sana Mir",https://www.indiatoday.in/sports/cricket/story/india-vs-pakistan-match-against-india-brings-out-the-best-in-nida-dar-says-sana-mir-2009523-2022-10-07,2026-03-09T07:11:37+00:00
India Today,most_read,8,Women's Asia Cup: India coach Powar defends batting-order reshuffle in Pakistan loss,https://www.indiatoday.in/sports/cricket/story/women-s-asia-cup-india-coach-ramesh-powar-defends-batting-order-reshuffle-in-pakistan-defeat-2009522-2022-10-07,2026-03-09T07:11:37+00:00
India Today,most_read,9,"Gauri Sawant reacts to Sushmita Sen playing her in Taali, recalls their first meeting",https://www.indiatoday.in/entertainment/ott/story/gauri-sawant-reacts-to-sushmita-sen-playing-her-in-taali-recalls-their-first-meeting-2009520-2022-10-07,2026-03-09T07:11:37+00:00
India Today,most_read,10,"'We're all shattered': Loved ones, community hold vigil for slain Sikh family in US",https://www.indiatoday.in/india/story/community-loved-ones-hold-vigil-sikh-family-murder-us-merced-city-2009515-2022-10-07,2026-03-09T07:11:37+00:00
India Today,most_read,11,Richa Chadha wears dainty Bvlgari mangalsutra in stunning pics with husband Ali Fazal. Here’s the price,https://www.indiatoday.in/lifestyle/fashion/story/richa-chadha-wears-dainty-bvlgari-mangalsutra-in-stunning-pics-with-husband-ali-fazal-here-s-the-price-2009509-2022-10-07,2026-03-09T07:11:37+00:00
India Today,most_read,12,"What to watch on Netflix, Disney+ Hotstar and Amazon Prime Video this weekend",https://www.indiatoday.in/entertainment/ott/story/what-to-watch-on-netflix-disney-hotstar-and-amazon-prime-video-this-weekend-2009510-2022-10-07,2026-03-09T07:11:37+00:00
India Today,most_read,13,Karnataka govt to hike SC/ST reservation,https://www.indiatoday.in/india/story/karnataka-hike-sc-st-reservation-quota-justice-nagamohan-das-committee-report-2009505-2022-10-07,2026-03-09T07:11:37+00:00
India Today,most_read,14,"Delhi civic body identifies 250 mosquito breeding hotspots, launches drive",https://www.indiatoday.in/cities/delhi/story/delhi-civic-body-identifies-mosquito-breeding-hotspots-launches-drive-2009508-2022-10-07,2026-03-09T07:11:37+00:00
India Today,most_read,15,"Your weekly news quiz, October 7 | Play on",https://www.indiatoday.in/india/story/your-weekly-news-quiz-october-7-play-on-2009506-2022-10-07,2026-03-09T07:11:37+00:00
India Today,most_read,16,"Salman Khan was on Mohali RPG attacker's hitlist, says Delhi Police",https://www.indiatoday.in/india/story/delhi-police-arrest-mohali-rpg-attacker-salman-khan-was-on-hit-list-2009502-2022-10-07,2026-03-09T07:11:37+00:00
India Today,most_read,17,"Iran denies security forces killed 16-year-old, says she fell off roof",https://www.indiatoday.in/world/story/iran-security-forces-16-year-old-killed-protest-on-death-of-woman-in-police-custody-2009503-2022-10-07,2026-03-09T07:11:37+00:00
India Today,most_read,18,"Vande Bharat Express rams into cattle, suffers minor damage; 2nd incident in 2 days",https://www.indiatoday.in/india/story/vande-bharat-express-hits-cattle-suffers-minor-damage-gujarat-2009490-2022-10-07,2026-03-09T07:11:37+00:00
India Today,most_read,19,2 Madhya Pradesh Congress MLAs booked for harassing woman on train,https://www.indiatoday.in/crime/story/2-madhya-pradesh-congress-mlas-booked-for-harassing-woman-on-train-2009441-2022-10-07,2026-03-09T07:11:37+00:00
India Today,most_read,20,Rashmika Mandanna has no regrets for not being able to spend time with her sister. Here's why,https://www.indiatoday.in/movies/regional-cinema/story/rashmika-mandanna-has-no-regrets-for-not-being-able-to-spend-time-with-her-sister-here-s-why-2009492-2022-10-07,2026-03-09T07:11:37+00:00
India Today,most_read,21,Ravi Shastri slammed after ruining India's T20 World Cup-winning moment on commentary,https://www.indiatoday.in/sports/cricket/story/ravi-shastri-ninth-wicket-commentary-gaffe-india-t20-world-cup-win-2879296-2026-03-09,2026-03-09T07:11:37+00:00
India Today,most_read,22,"3 IPOs opening this week: Rajputana Stainless, Innovision, Raajmarg Infra InvIT",https://www.indiatoday.in/business/ipo/story/3-ipos-opening-this-week-rajputana-stainless-innovision-raajmarg-infra-invit-2879294-2026-03-09,2026-03-09T07:11:37+00:00
India Today,most_read,23,"Meet Abhay Bhushan, the IIT Kanpur engineer who made digital file transfers possible",https://www.indiatoday.in/education-today/gk-current-affairs/story/abhay-bhushan-the-iit-kanpur-engineer-who-developed-ftp-or-digital-file-transfers-2879293-2026-03-09,2026-03-09T07:11:37+00:00
India Today,most_read,24,Basil Joseph turns ultimate fanboy for Sanju Samson at T20 World Cup Final. Watch,https://www.indiatoday.in/movies/regional-cinema/story/basil-joseph-turns-ultimate-fanboy-for-sanju-samson-at-t20-world-cup-final-watch-2879211-2026-03-09,2026-03-09T07:11:37+00:00
India Today,most_read,25,Can't save your party: EPS warns Stalin days after O Panneerselvam joined DMK,https://www.indiatoday.in/elections/assembly/story/edapaddi-k-palaniswami-mk-stalin-o-panneerselvam-dmk-aiadmk-tamil-nadu-assembly-elections-2026-2879206-2026-03-09,2026-03-09T07:11:37+00:00
India Today,most_read,26,"Stock market crash: IndiGo, SBI, Maruti among worst hit amid ongoing sell-off",https://www.indiatoday.in/business/market/story/indigo-sbi-maruti-tata-steel-worst-hit-stocks-sensex-nifty-crash-2879234-2026-03-09,2026-03-09T07:11:37+00:00
India Today,most_read,27,Chennai doctor hands newborn to nervous father in video with 198 million views,https://www.indiatoday.in/trending-news/story/chennai-doctor-hands-newborn-to-nervous-father-in-adorable-video-with-198-million-views-2879247-2026-03-09,2026-03-09T07:11:37+00:00
India Today,most_read,28,Another prediction backfires: Amir reacts angrily as India win T20 World Cup,https://www.indiatoday.in/sports/cricket/story/t20-world-cup-2026-mohammad-amir-angry-reaction-india-win-final-2879252-2026-03-09,2026-03-09T07:11:37+00:00
