source,section,rank,headline,link,collected_at_iso
India Today,trending,6,Reddit user moved to Delhi from Assam expecting it to be expensive. And then...,https://www.indiatoday.in/trending-news/story/reddit-user-moved-to-delhi-from-assam-expecting-it-to-be-expensive-and-then-2879049-2026-03-08,2026-03-09T19:02:14+00:00
India Today,trending,7,Bengaluru man shares post about Ahmedabad's late-night vibe. Internet weighs in,https://www.indiatoday.in/trending-news/story/bengaluru-man-shares-post-about-ahmedabads-late-night-vibe-internet-weighs-in-2879024-2026-03-08,2026-03-09T19:02:14+00:00
India Today,trending,8,Australian High Commission celebrates women diplomats in Dhurandhar style,https://www.indiatoday.in/trending-news/story/australian-high-commission-celebrates-women-diplomats-in-dhurandhar-style-womens-day-2026-2879010-2026-03-08,2026-03-09T19:02:14+00:00
India Today,trending,9,Tamil Nadu principal sponsors first flight for 20 government school students,https://www.indiatoday.in/trending-news/story/tamil-nadu-principal-sponsors-first-flight-for-20-government-school-students-2878980-2026-03-08,2026-03-09T19:02:14+00:00
India Today,trending,10,Woman's clever hack for getting a seat in crowded Mumbai local wows 3 million,https://www.indiatoday.in/trending-news/story/womans-clever-hack-for-getting-a-seat-in-crowded-mumbai-local-wows-3-million-2878965-2026-03-08,2026-03-09T19:02:14+00:00
India Today,trending,11,"Indian businessman offers free shelter, pickup to travellers stranded in UAE",https://www.indiatoday.in/trending-news/story/indian-businessman-dhiraj-jain-offers-free-shelter-rolls-royce-pickup-to-travellers-stranded-in-uae-2878915-2026-03-08,2026-03-09T19:02:14+00:00
India Today,trending,12,IndiGo air hostesses briefly babysit toddler at boarding gate. Wholesome video,https://www.indiatoday.in/trending-news/story/indigo-air-hostesses-briefly-babysit-toddler-at-boarding-gate-wholesome-video-2878901-2026-03-08,2026-03-09T19:02:14+00:00
India Today,trending,13,"YouTuber claims to be stranded amid Middle East crisis, internet says fly economy",https://www.indiatoday.in/trending-news/story/youtuber-nonstop-dan-stranded-claims-amid-middle-east-crisis-internet-says-fly-economy-2878894-2026-03-08,2026-03-09T19:02:14+00:00
India Today,trending,14,Man shares why he 'trusted his gut' and walked away from Rs 26 lakh job offer,https://www.indiatoday.in/trending-news/story/man-shares-why-he-trusted-his-gut-and-walked-away-from-rs-26-lakh-job-offer-2878716-2026-03-07,2026-03-09T19:02:14+00:00
India Today,trending,15,Foreigner gets Mumbai local train passengers to dance to 'Saddi Galli'. Watch video,https://www.indiatoday.in/trending-news/story/foreigner-gets-mumbai-local-train-passengers-to-dance-to-saddi-galli-watch-video-2878676-2026-03-07,2026-03-09T19:02:14+00:00
India Today,trending,16,Russian tourist gets custom flip-flops made in Sri Lanka shop. Here's how it's done,https://www.indiatoday.in/trending-news/story/russian-tourist-gets-custom-flip-flops-made-in-sri-lanka-shop-heres-how-its-done-2878619-2026-03-07,2026-03-09T19:02:14+00:00
India Today,trending,17,"Uzbekistan children dance to iconic Bollywood songs, videos delight internet",https://www.indiatoday.in/trending-news/story/uzbekistan-children-dance-to-iconic-bollywood-songs-videos-delight-internet-2878603-2026-03-07,2026-03-09T19:02:14+00:00
India Today,trending,18,Bengaluru man attacked by residents after dog urinates in apartment complex,https://www.indiatoday.in/trending-news/story/bengaluru-man-attacked-by-residents-after-dog-urinates-in-apartment-complex-2878573-2026-03-07,2026-03-09T19:02:14+00:00
India Today,trending,19,Women dressed in sarees bring traditional fashion to snowboarding. Video goes viral,https://www.indiatoday.in/trending-news/story/women-dressed-in-sarees-bring-traditional-fashion-to-snowboarding-video-goes-viral-2878547-2026-03-07,2026-03-09T19:02:14+00:00
India Today,trending,20,UP headmistress makes primary school students give her body massage in class,https://www.indiatoday.in/trending-news/story/up-headmistress-makes-primary-school-students-give-her-body-massage-in-class-video-viral-2878411-2026-03-06,2026-03-09T19:02:14+00:00
India Today,trending,21,He's on it: Trump says Australia PM agreed to give asylum to Iran women footballers,https://www.indiatoday.in/world/story/donald-trump-australia-pm-agreed-to-give-asylum-to-iran-women-footballers-middle-east-conflict-2879595-2026-03-10,2026-03-09T19:02:14+00:00
India Today,trending,22,"One call from PM Modi to Israel, Iran can stop war: Ex-UAE envoy to India",https://www.indiatoday.in/india/story/hussain-hassan-mirza-uae-envoy-pm-modi-can-stop-israel-iran-war-phone-call-2879589-2026-03-10,2026-03-09T19:02:14+00:00
India Today,trending,23,"Stranded West Indies, South Africa to leave India on March 10",https://www.indiatoday.in/sports/cricket/story/israel-iran-war-south-africa-west-indies-to-leave-for-home-2879588-2026-03-09,2026-03-09T19:02:14+00:00
India Today,trending,24,Why Sanju Samson was T20 World Cup's Most Valuable Player,https://www.indiatoday.in/india-today-insight/story/why-sanju-samson-was-t20-world-cups-most-valuable-player-2879481-2026-03-09,2026-03-09T19:02:14+00:00
India Today,trending,25,Has India quietly chosen a side in US-Israel's war with Iran?,https://www.indiatoday.in/india/story/india-pm-modi-choses-side-us-israel-iran-war-middle-east-strategy-2876887-2026-03-03,2026-03-09T19:02:14+00:00
India Today,most_read,1,IND vs SA: Deepak Chahar likely to be ruled out of last 2 ODIs due to injury,https://www.indiatoday.in/sports/cricket/story/india-vs-south-africa-deepak-chahar-likely-to-be-ruled-out-of-last-2-odis-due-to-injury-2009550-2022-10-07,2026-03-09T19:02:14+00:00
India Today,most_read,2,Manchester City fined over pitch invasion to celebrate Premier League title win,https://www.indiatoday.in/sports/football/story/manchester-city-fined-by-fa-over-pitch-invasion-to-celebrate-premier-league-title-win-2009534-2022-10-07,2026-03-09T19:02:14+00:00
India Today,most_read,3,Chelsea manager Potter on first month in charge: We have made little bit of progress,https://www.indiatoday.in/sports/football/story/chelsea-manager-graham-potter-on-first-month-in-charge-we-have-made-little-bit-of-progress-2009531-2022-10-07,2026-03-09T19:02:14+00:00
India Today,most_read,4,'Travesty of justice’: Experts criticise errors in UN report on forced disappearances in Bangladesh,https://www.indiatoday.in/world/story/experts-criticise-error-un-report-on-forced-disappearances-in-bangladesh-2007495-2022-10-02,2026-03-09T19:02:14+00:00
India Today,most_read,5,"Fact Check: No alcohol, homosexuality? Conservative guidelines for FIFA World Cup NOT issued by Qatar govt",https://www.indiatoday.in/fact-check/story/fifa-world-cup-guidelines-fact-check-no-alcohol-homosexuality-conservative-guidelines-for-football-world-cup-not-issued-by-qatar-govt-2009495-2022-10-07,2026-03-09T19:02:14+00:00
India Today,most_read,6,"KGF star Yash meets F1 legend Lewis Hamilton, See pic",https://www.indiatoday.in/movies/regional-cinema/story/kgf-star-yash-meets-f1-legend-lewis-hamilton-see-pic-2009525-2022-10-07,2026-03-09T19:02:14+00:00
India Today,most_read,7,"IND vs PAK: Match against India brings out the best in Nida Dar, says Sana Mir",https://www.indiatoday.in/sports/cricket/story/india-vs-pakistan-match-against-india-brings-out-the-best-in-nida-dar-says-sana-mir-2009523-2022-10-07,2026-03-09T19:02:14+00:00
India Today,most_read,8,Women's Asia Cup: India coach Powar defends batting-order reshuffle in Pakistan loss,https://www.indiatoday.in/sports/cricket/story/women-s-asia-cup-india-coach-ramesh-powar-defends-batting-order-reshuffle-in-pakistan-defeat-2009522-2022-10-07,2026-03-09T19:02:14+00:00
India Today,most_read,9,"Gauri Sawant reacts to Sushmita Sen playing her in Taali, recalls their first meeting",https://www.indiatoday.in/entertainment/ott/story/gauri-sawant-reacts-to-sushmita-sen-playing-her-in-taali-recalls-their-first-meeting-2009520-2022-10-07,2026-03-09T19:02:14+00:00
India Today,most_read,10,"'We're all shattered': Loved ones, community hold vigil for slain Sikh family in US",https://www.indiatoday.in/india/story/community-loved-ones-hold-vigil-sikh-family-murder-us-merced-city-2009515-2022-10-07,2026-03-09T19:02:14+00:00
India Today,most_read,11,Richa Chadha wears dainty Bvlgari mangalsutra in stunning pics with husband Ali Fazal. Here’s the price,https://www.indiatoday.in/lifestyle/fashion/story/richa-chadha-wears-dainty-bvlgari-mangalsutra-in-stunning-pics-with-husband-ali-fazal-here-s-the-price-2009509-2022-10-07,2026-03-09T19:02:14+00:00
India Today,most_read,12,"What to watch on Netflix, Disney+ Hotstar and Amazon Prime Video this weekend",https://www.indiatoday.in/entertainment/ott/story/what-to-watch-on-netflix-disney-hotstar-and-amazon-prime-video-this-weekend-2009510-2022-10-07,2026-03-09T19:02:14+00:00
India Today,most_read,13,Karnataka govt to hike SC/ST reservation,https://www.indiatoday.in/india/story/karnataka-hike-sc-st-reservation-quota-justice-nagamohan-das-committee-report-2009505-2022-10-07,2026-03-09T19:02:14+00:00
India Today,most_read,14,"Delhi civic body identifies 250 mosquito breeding hotspots, launches drive",https://www.indiatoday.in/cities/delhi/story/delhi-civic-body-identifies-mosquito-breeding-hotspots-launches-drive-2009508-2022-10-07,2026-03-09T19:02:14+00:00
India Today,most_read,15,"Your weekly news quiz, October 7 | Play on",https://www.indiatoday.in/india/story/your-weekly-news-quiz-october-7-play-on-2009506-2022-10-07,2026-03-09T19:02:14+00:00
India Today,most_read,16,"Salman Khan was on Mohali RPG attacker's hitlist, says Delhi Police",https://www.indiatoday.in/india/story/delhi-police-arrest-mohali-rpg-attacker-salman-khan-was-on-hit-list-2009502-2022-10-07,2026-03-09T19:02:14+00:00
India Today,most_read,17,"Iran denies security forces killed 16-year-old, says she fell off roof",https://www.indiatoday.in/world/story/iran-security-forces-16-year-old-killed-protest-on-death-of-woman-in-police-custody-2009503-2022-10-07,2026-03-09T19:02:14+00:00
India Today,most_read,18,"Vande Bharat Express rams into cattle, suffers minor damage; 2nd incident in 2 days",https://www.indiatoday.in/india/story/vande-bharat-express-hits-cattle-suffers-minor-damage-gujarat-2009490-2022-10-07,2026-03-09T19:02:14+00:00
India Today,most_read,19,2 Madhya Pradesh Congress MLAs booked for harassing woman on train,https://www.indiatoday.in/crime/story/2-madhya-pradesh-congress-mlas-booked-for-harassing-woman-on-train-2009441-2022-10-07,2026-03-09T19:02:14+00:00
India Today,most_read,20,Rashmika Mandanna has no regrets for not being able to spend time with her sister. Here's why,https://www.indiatoday.in/movies/regional-cinema/story/rashmika-mandanna-has-no-regrets-for-not-being-able-to-spend-time-with-her-sister-here-s-why-2009492-2022-10-07,2026-03-09T19:02:14+00:00
India Today,most_read,21,"Stop conspiracy theories, accept India is a top side: Pakistan cricket greats",https://www.indiatoday.in/sports/cricket/story/t20-world-cup-pakistan-cricketers-reaction-conspiracy-theories-2879582-2026-03-09,2026-03-09T19:02:14+00:00
India Today,most_read,22,"Sirens, shelters and sleepless nights in Tel Aviv: India Today at Ground Zero",https://www.indiatoday.in/world/story/exclusive-india-today-at-ground-zero-on-ground-report-from-israel-reveals-life-under-constant-air-raid-alerts-amid-west-asia-middle-east-conflict-2879574-2026-03-09,2026-03-09T19:02:14+00:00
India Today,most_read,23,"LPG cylinder shortage hits Mumbai, Bengaluru eateries; government responds",https://www.indiatoday.in/india/story/commercial-lpg-shortage-threatens-restaurant-shutdowns-in-maharashtra-and-karnataka-amid-global-supply-disruptions-2879571-2026-03-09,2026-03-09T19:02:14+00:00
India Today,most_read,24,Another prediction backfires: Amir reacts angrily as India win T20 World Cup,https://www.indiatoday.in/sports/cricket/story/t20-world-cup-2026-mohammad-amir-angry-reaction-india-win-final-2879252-2026-03-09,2026-03-09T19:02:14+00:00
India Today,most_read,25,Dutch bride's Rajasthani dance surprise delights Marwadi groom. Watch videos,https://www.indiatoday.in/trending-news/story/dutch-bride-rajasthani-dance-surprise-delights-marwadi-groom-watch-videos-2877782-2026-03-05,2026-03-09T19:02:14+00:00
India Today,most_read,26,"Lucknow woman orders milk and bread, delivery rider gets unusual request from her",https://www.indiatoday.in/trending-news/story/lucknow-woman-orders-milk-and-bread-delivery-rider-gets-unusual-request-from-her-2878154-2026-03-06,2026-03-09T19:02:14+00:00
India Today,most_read,27,Andhra student punches teacher as classroom dispute turns violent. Video goes viral,https://www.indiatoday.in/trending-news/story/andhra-class-10-student-punches-teacher-as-classroom-dispute-turns-violent-video-goes-viral-2878362-2026-03-06,2026-03-09T19:02:14+00:00
India Today,most_read,28,"Daughter shares video of mother marrying her soulmate, internet emotional",https://www.indiatoday.in/trending-news/story/daughter-shares-heartwarming-video-of-mother-marrying-her-soulmate-internet-emotional-2878206-2026-03-06,2026-03-09T19:02:14+00:00
India Today,most_read,29,"Man crashes into pole while leaning out of moving train to film reel, falls down",https://www.indiatoday.in/trending-news/story/man-crashes-into-pole-while-leaning-out-of-moving-train-to-film-reel-falls-down-2877838-2026-03-05,2026-03-09T19:02:14+00:00
India Today,most_read,30,Suryakumar Yadav finally responds on the viral petrol pump photo in 2014,https://www.indiatoday.in/sports/cricket/story/suryakumar-yadav-viral-petrol-pump-photo-ahmedabad-calling-reaction-2879451-2026-03-09,2026-03-09T19:02:14+00:00
