source,section,rank,headline,link,collected_at_iso
Times of India,trending,38,JEE Main Session 2 City Intimation Slip,https://timesofindia.indiatimes.com/articleshow/129495267.cms,2026-03-12T17:03:35+00:00
Times of India,trending,39,US Reliance Oil Refinery,https://timesofindia.indiatimes.com/articleshow/129499055.cms,2026-03-12T17:03:35+00:00
Times of India,trending,40,Dhurandhar The Revenge,https://timesofindia.indiatimes.com/articleshow/129492826.cms,2026-03-12T17:03:35+00:00
Times of India,trending,41,Archana Puran Singh,https://timesofindia.indiatimes.com/articleshow/129465477.cms,2026-03-12T17:03:35+00:00
Times of India,trending,42,Dubai Airports Update,https://timesofindia.indiatimes.com/articleshow/129492779.cms,2026-03-12T17:03:35+00:00
Times of India,trending,43,Bhooth Bangla Teaser,https://timesofindia.indiatimes.com/articleshow/129495135.cms,2026-03-12T17:03:35+00:00
Times of India,trending,44,Hari Murali Death News,https://timesofindia.indiatimes.com/articleshow/129495367.cms,2026-03-12T17:03:35+00:00
Times of India,trending,45,Cooked Chicken Shelf Life,https://timesofindia.indiatimes.com/articleshow/129348795.cms,2026-03-12T17:03:35+00:00
Times of India,trending,46,Lpg Cylinder Shortage,https://timesofindia.indiatimes.com/articleshow/129500537.cms,2026-03-12T17:03:35+00:00
Times of India,trending,47,Nasa Satellite Crash,https://timesofindia.indiatimes.com/articleshow/129379719.cms,2026-03-12T17:03:35+00:00
Times of India,trending,48,Indian Cobra VS Egyptian Cobra,https://timesofindia.indiatimes.com/articleshow/129376134.cms,2026-03-12T17:03:35+00:00
Times of India,trending,49,CTET Answer Key 2026,https://timesofindia.indiatimes.com/articleshow/129508509.cms,2026-03-12T17:03:35+00:00
Times of India,trending,50,UPPSC APO Admit Card,https://timesofindia.indiatimes.com/articleshow/129510033.cms,2026-03-12T17:03:35+00:00
Times of India,trending,51,RRB NTPC admit card 2026,https://timesofindia.indiatimes.com/articleshow/129489043.cms,2026-03-12T17:03:35+00:00
Times of India,trending,52,NBEMS GPAT 2026 answer key,https://timesofindia.indiatimes.com/articleshow/129512563.cms,2026-03-12T17:03:35+00:00
Times of India,trending,53,CBSE Class 10th exam,https://timesofindia.indiatimes.com/articleshow/129513435.cms,2026-03-12T17:03:35+00:00
Times of India,trending,54,RTE Rajasthan Lottery result,https://timesofindia.indiatimes.com/articleshow/129511934.cms,2026-03-12T17:03:35+00:00
Times of India,trending,55,Strait of Hormuz,https://timesofindia.indiatimes.com/articleshow/129511873.cms,2026-03-12T17:03:35+00:00
Times of India,trending,56,Iran Warns US Tech Firms,https://timesofindia.indiatimes.com/articleshow/129458745.cms,2026-03-12T17:03:35+00:00
Times of India,trending,57,Royal Enfield Meteor 350 Vs Jawa 42 FJ,https://timesofindia.indiatimes.com/articleshow/129494130.cms,2026-03-12T17:03:35+00:00
Times of India,trending,58,5 Red flags with your periods,https://timesofindia.indiatimes.com/articleshow/129516569.cms,2026-03-12T17:03:35+00:00
Times of India,trending,59,"Ja’Marr Chase got his $161 million bag, but is the $69 million receiver gamble why they'll never win a Super Bowl?",https://timesofindia.indiatimes.com/articleshow/129516823.cms,2026-03-12T17:03:35+00:00
Times of India,trending,60,Jamshedpur Hotels Switch to Electric & Charcoal Amidst LPG Crisis,https://timesofindia.indiatimes.com/articleshow/129516886.cms,2026-03-12T17:03:35+00:00
Times of India,trending,61,"Ranchi Hospitals Turn to Alternative Fuels Amidst LPG Crisis, Impacting Patient Meal Services",https://timesofindia.indiatimes.com/articleshow/129516853.cms,2026-03-12T17:03:35+00:00
Times of India,trending,62,1400 Kg Adulterated Paneer Seized in Dhanbad Bus Raid,https://timesofindia.indiatimes.com/articleshow/129516820.cms,2026-03-12T17:03:35+00:00
Times of India,trending,63,White House mulls suspending 'Jones Act' to curb soaring oil prices amid Iran conflict - key maritime law explained,https://timesofindia.indiatimes.com/articleshow/129515402.cms,2026-03-12T17:03:35+00:00
Times of India,trending,64,Apple to celebrate 50th anniversary on April 1: Read CEO Tim Cook's 'Thank You' letter,https://timesofindia.indiatimes.com/articleshow/129516799.cms,2026-03-12T17:03:35+00:00
Times of India,trending,65,"Celebrity chef René Redzepu resigns from Noma over abuse allegations, says 'an apology is not enough'",https://timesofindia.indiatimes.com/articleshow/129516700.cms,2026-03-12T17:03:35+00:00
Times of India,trending,66,Ranchi Collectorate Elevators Inaugurated: Improved Accessibility for Visitors,https://timesofindia.indiatimes.com/articleshow/129516783.cms,2026-03-12T17:03:35+00:00
Times of India,trending,67,NHL Trade Update: Calgary Flames sign NCAA free agent Tyson Gross to entry-level contract,https://timesofindia.indiatimes.com/articleshow/129515338.cms,2026-03-12T17:03:35+00:00
Times of India,trending,68,"Ranchi LPG Cylinder Shortage: Women's Cafes Use Home Cylinders, Traditional Stoves",https://timesofindia.indiatimes.com/articleshow/129516750.cms,2026-03-12T17:03:35+00:00
Times of India,trending,69,When is Cristiano Ronaldo returning? Injury update reveals Al Nassr star using $6K Cryo Sport device as possible comeback date emerges,https://timesofindia.indiatimes.com/articleshow/129516729.cms,2026-03-12T17:03:35+00:00
Times of India,trending,70,"Jharkhand Cabinet Approves Tourist Tax Rules 2025, Scholarship Amendments, and Infrastructure Projects",https://timesofindia.indiatimes.com/articleshow/129516711.cms,2026-03-12T17:03:35+00:00
Times of India,trending,71,Congress Delegation Meets Jharkhand CM Hemant Soren Amid Assam Poll Alliance Talks,https://timesofindia.indiatimes.com/articleshow/129516649.cms,2026-03-12T17:03:35+00:00
Times of India,trending,72,Ranchi Airfares Skyrocket: Jet Fuel Costs & West Asia War Impact Summer Travel,https://timesofindia.indiatimes.com/articleshow/129516619.cms,2026-03-12T17:03:35+00:00
Times of India,trending,73,"Chhattisgarh: Two elephants died of electrocution in Raigarh river, two held",https://timesofindia.indiatimes.com/articleshow/129516346.cms,2026-03-12T17:03:35+00:00
Times of India,trending,74,"Rajesh Jha, Microsoft head of experiences and devices unit, to retire after 35 years: Read his complete message to employees",https://timesofindia.indiatimes.com/articleshow/129516325.cms,2026-03-12T17:03:35+00:00
Times of India,trending,75,Theatres vs OTT debate intensifies: South exhibitors demand 8-week release window,https://timesofindia.indiatimes.com/articleshow/129516247.cms,2026-03-12T17:03:35+00:00
NDTV,most_read,1,How A Family Dispute Is Shadowing Jaswant Singh Legacy In Rajasthan,https://www.ndtv.com/india-news/how-a-family-dispute-is-shadowing-jaswant-singh-legacy-in-rajasthan-11207038,2026-03-12T17:03:35+00:00
NDTV,most_read,2,1 Lakh Women In Maharashtra To Join Swabhimaan Initiative: Priti Adani,https://www.ndtv.com/india-news/adani-foundation-to-connect-10-lakh-women-under-swambhimaan-initiative-priti-adani-11206936,2026-03-12T17:03:35+00:00
NDTV,most_read,3,Get Cylinders Or Cut Menu: Family's Tough Choice As Iran War Hits Weddings,https://www.ndtv.com/india-news/iran-war-hormuz-lpg-india-get-cylinders-or-cut-menu-familys-tough-choice-as-iran-war-hits-weddings-11206735,2026-03-12T17:03:35+00:00
NDTV,most_read,4,"What Happened When Rahul Gandhi Darted From LPG To ""Anything"" In Parliament",https://www.ndtv.com/india-news/what-happened-when-rahul-gandhi-darted-from-lpg-to-anything-in-parliament-11206715,2026-03-12T17:03:35+00:00
NDTV,most_read,5,Srinagar Court's Warrant Against Farooq Abdullah In J&K Cricket Body Case,https://www.ndtv.com/india-news/srinagar-courts-warrant-against-farooq-abdullah-in-j-k-cricket-body-case-11206433,2026-03-12T17:03:35+00:00
NDTV,most_read,6,Rajasthan RTE Lottery 2026 Result Out: Check District-Wise School Allotment,https://www.ndtv.com/education/rajasthan-rte-lottery-2026-27-result-out-6-34-lakh-applications-check-district-wise-school-allotment-11206629,2026-03-12T17:03:35+00:00
NDTV,most_read,7,"CTET 2026 Provisional Answer Key Released, Here's Direct Link To Check",https://www.ndtv.com/education/ctet-2026-answer-key-out-live-direct-link-to-check-steps-to-raise-objections-11206486,2026-03-12T17:03:35+00:00
NDTV,most_read,8,"School Assembly News Headlines (March 13): Top National, World, Sports News",https://www.ndtv.com/education/school-assembly-news-headlines-march-13-top-national-world-sports-updates-11206012,2026-03-12T17:03:35+00:00
NDTV,most_read,9,RBSE Class 10 Result Likely By March 20; Board Plans Biannual Exams From 2027,https://www.ndtv.com/education/rbse-class-10-result-2026-likely-by-march-20-board-secretary-says-11204886,2026-03-12T17:03:35+00:00
NDTV,most_read,10,Science vs Commerce vs Humanities - Decision Framework For 2026,https://www.ndtv.com/education/cbse-class-10-stream-selection-guide-science-vs-commerce-vs-humanities-decision-framework-for-2026-11204523,2026-03-12T17:03:35+00:00
NDTV,most_read,11,Iran's New Supreme Leader's Hormuz Mention And A Warning In First Remarks,https://www.ndtv.com/world-news/iran-war-latest-news-strait-of-hormuz-must-remain-closed-mojtaba-khameneis-first-remark-as-irans-supreme-leader-11206166,2026-03-12T17:03:35+00:00
NDTV,most_read,12,"Iran Outlines 3 Conditions To End War With US, Israel",https://www.ndtv.com/world-news/iran-israel-us-war-iran-outlines-3-conditions-to-end-war-with-us-israel-11203516,2026-03-12T17:03:35+00:00
NDTV,most_read,13,"Indian-Origin Brothers Found Guilty In US Fraud, Face 400 Years In Prison",https://www.ndtv.com/world-news/indian-origin-brothers-convicted-of-h-1b-visa-and-healthcare-fraud-in-us-could-face-400-years-in-prison-11205446,2026-03-12T17:03:35+00:00
NDTV,most_read,14,A Dark Night: India-Bound Oil Tanker's Daring Dash Through Strait Of Hormuz,https://www.ndtv.com/world-news/iran-war-news-how-india-bound-oil-tanker-crossed-war-hit-strait-of-hormuz-a-dark-tale-11204597,2026-03-12T17:03:35+00:00
NDTV,most_read,15,"Iran's ""Hunt Down US Servicemen"" Warning If Trump Attacks Electricity",https://www.ndtv.com/world-news/iran-war-live-irans-hunt-down-us-servicemen-warning-if-trump-attacks-electricity-11206789,2026-03-12T17:03:35+00:00
NDTV,most_read,16,How 17-Year-Old Mojtaba Khamenei Built Network That Made Him Supreme Leader,https://www.ndtv.com/world-news/iran-war-latest-news-habib-battalion-iran-supreme-leader-mojtaba-khameneis-days-as-teenage-soldier-laid-foundation-for-his-accession-11207098,2026-03-12T17:03:35+00:00
NDTV,most_read,17,Is Trump Starting To Regret Backing Netanyahu's Iran Gameplan?,https://www.ndtv.com/opinion/iran-israel-war-is-trump-starting-to-regret-backing-netanyahu-this-far-11204998,2026-03-12T17:03:35+00:00
NDTV,most_read,18,"Report Claims India-Flagged Tankers Pass Through Hormuz, Iran Reacts",https://www.ndtv.com/world-news/iran-israel-us-war-report-claims-india-flagged-tankers-pass-through-hormuz-iran-reacts-11203593,2026-03-12T17:03:35+00:00
NDTV,most_read,19,Indian Killed In Underwater Drone Attack By Iran On US-Owned Oil Tanker,https://www.ndtv.com/world-news/iran-war-news-live-us-owned-ship-among-2-vessels-hit-by-iran-in-the-gulf-1-dead-11203453,2026-03-12T17:03:35+00:00
NDTV,most_read,20,"'S Jaishankar, Iran Minister Spoke': Foreign Ministry After Oil Tanker Arrives",https://www.ndtv.com/world-news/iran-israel-us-war-oil-tanker-shenlong-suezmax-arrives-in-mumbai-from-saudia-arabia-iran-foreign-minister-abbas-araghci-11205100,2026-03-12T17:03:35+00:00
NDTV,most_read,21,"""1 + 1 = 1"": Escapee Reveals North Korea's Distorted School Curriculum",https://www.ndtv.com/world-news/charles-ryu-escapee-reveals-north-koreas-distorted-school-curriculum-kim-jong-un-11206620,2026-03-12T17:03:35+00:00
NDTV,most_read,22,"Live: Centre Prioritises Household LPG Use, Induction Stoves Go Out Of Stock",https://www.ndtv.com/india-news/india-lpg-cylinder-shortage-live-updates-middle-east-iran-israel-war-centre-household-use-induction-cooktops-out-of-stock-11203389,2026-03-12T17:03:35+00:00
NDTV,most_read,23,An Open Letter To Mani Shankar Aiyar - By Shashi Tharoor,https://www.ndtv.com/opinion/an-open-letter-to-mani-shankar-aiyar-by-shashi-tharoor-11203918,2026-03-12T17:03:35+00:00
NDTV,most_read,24,"Explosions In Downtown Dubai, Clouds Of Smoke Seen As Iran Strikes",https://www.ndtv.com/world-news/us-israel-iran-war-dubai-downtown-explosion-live-explosions-in-dubai-small-clouds-of-smoke-seen-as-iran-continues-to-strike-11204501,2026-03-12T17:03:35+00:00
NDTV,most_read,25,"""We Are Not Ready"" To Escort Tankers Through Strait Of Hormuz, Says US",https://www.ndtv.com/world-news/iran-israel-war-us-says-military-not-ready-to-escort-tankers-through-strait-of-hormuz-11206189,2026-03-12T17:03:35+00:00
NDTV,most_read,26,"Fired By IITian Employer In 3 Days, Techie Says She Now Earns 8 Times More",https://www.ndtv.com/feature/fired-by-iitian-employer-in-3-days-ai-engineer-claims-she-now-earns-8-times-more-11202332,2026-03-12T17:03:35+00:00
NDTV,most_read,27,Video: Moment Iran Struck US-Owned Ship With Indian Sailors On Board,https://www.ndtv.com/world-news/us-iran-war-video-moment-iran-struck-us-owned-ship-with-indian-sailors-on-board-11205351,2026-03-12T17:03:35+00:00
NDTV,most_read,28,"Private Chat About Rashmika Mandanna's Breakup Leaked Days After Wedding, Actress Threatens Legal Action",https://www.ndtv.com/entertainment/private-chat-about-rashmika-mandannas-breakup-leaked-days-after-wedding-actress-threatens-legal-action-11205551,2026-03-12T17:03:35+00:00
NDTV,most_read,29,"Abhishek Bachchan, Aishwarya, Aaradhya's Wholesome Pics From A Mumbai Pre-Wedding Party. Courtesy, Shalini Passi",https://www.ndtv.com/entertainment/abhishek-bachchan-aishwarya-aaradhyas-wholesome-pics-from-a-mumbai-pre-wedding-party-courtesy-shalini-passi-11205140,2026-03-12T17:03:35+00:00
NDTV,most_read,30,"""Wanted To Kill Him For 20 Years"": Farooq Abdullah Attacker Shows No Remorse",https://www.ndtv.com/india-news/jammu-and-kashmir-farooq-abdullah-survives-attack-shooter-wanted-to-kill-him-for-20-years-11203139,2026-03-12T17:03:35+00:00
NDTV,most_read,31,US-Israel-Iran War Live Updates,https://www.ndtv.com/world-news/iran-israel-war-live-updates-us-middle-east-crisis-news-mojtaba-khamenei-iran-new-supreme-leader-donald-trump-netanyahu-dubai-11187798,2026-03-12T17:03:35+00:00
NDTV,most_read,32,Stock Market Live Updates,https://www.ndtv.com/india-news/stock-market-live-updates-sensex-today-nifty-share-market-sensex-nifty-set-for-further-pressure-as-oil-prices-rally-11203268,2026-03-12T17:03:35+00:00
NDTV,most_read,33,LPG Cylinder Shortage,https://www.ndtv.com/india-news/iran-war-latest-news-centre-reviews-lpg-supply-situation-at-high-level-meet-with-states-11202574,2026-03-12T17:03:35+00:00
NDTV,trending,1,How A Family Dispute Is Shadowing Jaswant Singh Legacy In Rajasthan,https://www.ndtv.com/india-news/how-a-family-dispute-is-shadowing-jaswant-singh-legacy-in-rajasthan-11207038,2026-03-12T17:03:35+00:00
NDTV,trending,2,1 Lakh Women In Maharashtra To Join Swabhimaan Initiative: Priti Adani,https://www.ndtv.com/india-news/adani-foundation-to-connect-10-lakh-women-under-swambhimaan-initiative-priti-adani-11206936,2026-03-12T17:03:35+00:00
NDTV,trending,3,Get Cylinders Or Cut Menu: Family's Tough Choice As Iran War Hits Weddings,https://www.ndtv.com/india-news/iran-war-hormuz-lpg-india-get-cylinders-or-cut-menu-familys-tough-choice-as-iran-war-hits-weddings-11206735,2026-03-12T17:03:35+00:00
NDTV,trending,4,"What Happened When Rahul Gandhi Darted From LPG To ""Anything"" In Parliament",https://www.ndtv.com/india-news/what-happened-when-rahul-gandhi-darted-from-lpg-to-anything-in-parliament-11206715,2026-03-12T17:03:35+00:00
NDTV,trending,5,Srinagar Court's Warrant Against Farooq Abdullah In J&K Cricket Body Case,https://www.ndtv.com/india-news/srinagar-courts-warrant-against-farooq-abdullah-in-j-k-cricket-body-case-11206433,2026-03-12T17:03:35+00:00
NDTV,trending,6,Rajasthan RTE Lottery 2026 Result Out: Check District-Wise School Allotment,https://www.ndtv.com/education/rajasthan-rte-lottery-2026-27-result-out-6-34-lakh-applications-check-district-wise-school-allotment-11206629,2026-03-12T17:03:35+00:00
NDTV,trending,7,"CTET 2026 Provisional Answer Key Released, Here's Direct Link To Check",https://www.ndtv.com/education/ctet-2026-answer-key-out-live-direct-link-to-check-steps-to-raise-objections-11206486,2026-03-12T17:03:35+00:00
NDTV,trending,8,"School Assembly News Headlines (March 13): Top National, World, Sports News",https://www.ndtv.com/education/school-assembly-news-headlines-march-13-top-national-world-sports-updates-11206012,2026-03-12T17:03:35+00:00
NDTV,trending,9,RBSE Class 10 Result Likely By March 20; Board Plans Biannual Exams From 2027,https://www.ndtv.com/education/rbse-class-10-result-2026-likely-by-march-20-board-secretary-says-11204886,2026-03-12T17:03:35+00:00
NDTV,trending,10,Science vs Commerce vs Humanities - Decision Framework For 2026,https://www.ndtv.com/education/cbse-class-10-stream-selection-guide-science-vs-commerce-vs-humanities-decision-framework-for-2026-11204523,2026-03-12T17:03:35+00:00
NDTV,trending,11,"Private Breakup Chat Leaked, Rashmika Mandanna Threatens Legal Action",https://www.ndtv.com/entertainment/private-chat-about-rashmika-mandannas-breakup-leaked-days-after-wedding-actress-threatens-legal-action-11205551,2026-03-12T17:03:35+00:00
NDTV,trending,12,Iran's New Supreme Leader's Hormuz Mention And A Warning In First Remarks,https://www.ndtv.com/world-news/iran-war-latest-news-strait-of-hormuz-must-remain-closed-mojtaba-khameneis-first-remark-as-irans-supreme-leader-11206166,2026-03-12T17:03:35+00:00
NDTV,trending,13,"Iran Outlines 3 Conditions To End War With US, Israel",https://www.ndtv.com/world-news/iran-israel-us-war-iran-outlines-3-conditions-to-end-war-with-us-israel-11203516,2026-03-12T17:03:35+00:00
NDTV,trending,14,A Dark Night: India-Bound Oil Tanker's Daring Dash Through Strait Of Hormuz,https://www.ndtv.com/world-news/iran-war-news-how-india-bound-oil-tanker-crossed-war-hit-strait-of-hormuz-a-dark-tale-11204597,2026-03-12T17:03:35+00:00
NDTV,trending,15,"Indian-Origin Brothers Found Guilty In US Fraud, Face 400 Years In Prison",https://www.ndtv.com/world-news/indian-origin-brothers-convicted-of-h-1b-visa-and-healthcare-fraud-in-us-could-face-400-years-in-prison-11205446,2026-03-12T17:03:35+00:00
NDTV,trending,16,"Iran's ""Hunt Down US Servicemen"" Warning If Trump Attacks Electricity",https://www.ndtv.com/world-news/iran-war-live-irans-hunt-down-us-servicemen-warning-if-trump-attacks-electricity-11206789,2026-03-12T17:03:35+00:00
NDTV,trending,17,How 17-Year-Old Mojtaba Khamenei Built Network That Made Him Supreme Leader,https://www.ndtv.com/world-news/iran-war-latest-news-habib-battalion-iran-supreme-leader-mojtaba-khameneis-days-as-teenage-soldier-laid-foundation-for-his-accession-11207098,2026-03-12T17:03:35+00:00
NDTV,trending,18,Is Trump Starting To Regret Backing Netanyahu's Iran Gameplan?,https://www.ndtv.com/opinion/iran-israel-war-is-trump-starting-to-regret-backing-netanyahu-this-far-11204998,2026-03-12T17:03:35+00:00
NDTV,trending,19,"Report Claims India-Flagged Tankers Pass Through Hormuz, Iran Reacts",https://www.ndtv.com/world-news/iran-israel-us-war-report-claims-india-flagged-tankers-pass-through-hormuz-iran-reacts-11203593,2026-03-12T17:03:35+00:00
NDTV,trending,20,"""1 + 1 = 1"": Escapee Reveals North Korea's Distorted School Curriculum",https://www.ndtv.com/world-news/charles-ryu-escapee-reveals-north-koreas-distorted-school-curriculum-kim-jong-un-11206620,2026-03-12T17:03:35+00:00
NDTV,trending,21,"Live: Centre Prioritises Household LPG Use, Induction Stoves Go Out Of Stock",https://www.ndtv.com/india-news/india-lpg-cylinder-shortage-live-updates-middle-east-iran-israel-war-centre-household-use-induction-cooktops-out-of-stock-11203389,2026-03-12T17:03:35+00:00
NDTV,trending,22,"'S Jaishankar, Iran Minister Spoke': Foreign Ministry After Oil Tanker Arrives",https://www.ndtv.com/world-news/iran-israel-us-war-oil-tanker-shenlong-suezmax-arrives-in-mumbai-from-saudia-arabia-iran-foreign-minister-abbas-araghci-11205100,2026-03-12T17:03:35+00:00
NDTV,trending,23,An Open Letter To Mani Shankar Aiyar - By Shashi Tharoor,https://www.ndtv.com/opinion/an-open-letter-to-mani-shankar-aiyar-by-shashi-tharoor-11203918,2026-03-12T17:03:35+00:00
NDTV,trending,24,Sara Tendulkar Shares Unseen Pics From Brother Arjun Tendulkar's Wedding With Saaniya Chandhok,https://www.ndtv.com/lifestyle/sara-tendulkar-shares-unseen-pics-from-brother-arjun-tendulkars-wedding-with-saaniya-chandhok-11207108,2026-03-12T17:03:35+00:00
NDTV,trending,25,"Abhishek Bachchan, Aishwarya, Aaradhya's Wholesome Pics From A Mumbai Pre-Wedding Party. Courtesy, Shalini Passi",https://www.ndtv.com/entertainment/abhishek-bachchan-aishwarya-aaradhyas-wholesome-pics-from-a-mumbai-pre-wedding-party-courtesy-shalini-passi-11205140,2026-03-12T17:03:35+00:00
NDTV,trending,26,US-Israel-Iran War Live Updates,https://www.ndtv.com/world-news/iran-israel-war-live-updates-us-middle-east-crisis-news-mojtaba-khamenei-iran-new-supreme-leader-donald-trump-netanyahu-dubai-11187798,2026-03-12T17:03:35+00:00
NDTV,trending,27,Stock Market Live Updates,https://www.ndtv.com/india-news/stock-market-live-updates-sensex-today-nifty-share-market-sensex-nifty-set-for-further-pressure-as-oil-prices-rally-11203268,2026-03-12T17:03:35+00:00
NDTV,trending,28,Farooq Abdullah Firing Case,https://www.ndtv.com/india-news/jammu-and-kashmir-farooq-abdullah-survives-attack-shooter-wanted-to-kill-him-for-20-years-11203139,2026-03-12T17:03:35+00:00
NDTV,trending,29,LPG Cylinder Shortage,https://www.ndtv.com/india-news/iran-war-latest-news-centre-reviews-lpg-supply-situation-at-high-level-meet-with-states-11202574,2026-03-12T17:03:35+00:00
India Today,trending,1,Child stuffed inside scooter for viral video. Account's other clips spark alarm,https://www.indiatoday.in/trending-news/story/child-stuffed-inside-scooter-for-viral-video-accounts-other-clips-spark-alarm-2881111-2026-03-12,2026-03-12T17:03:35+00:00
India Today,trending,2,Brothers go full Dhurandhar with Shararat dance performance at sister's sangeet,https://www.indiatoday.in/trending-news/story/shararat-dance-video-viral-brothers-at-sister-sangeet-ranveer-singh-dhurandhar-song-2881097-2026-03-12,2026-03-12T17:03:35+00:00
India Today,trending,3,Woman clerk refuses to issue ticket over exact change dispute. Railways reacts,https://www.indiatoday.in/trending-news/story/punjab-woman-clerk-refuses-to-issue-train-ticket-over-exact-change-dispute-railways-reacts-2881095-2026-03-12,2026-03-12T17:03:35+00:00
India Today,trending,4,"Fired in 3 days by IITian founder, AI engineer says she now earns 8 times more",https://www.indiatoday.in/trending-news/story/iit-founder-fired-her-in-3-days-ai-engineer-earns-8-time-more-now-2881087-2026-03-12,2026-03-12T17:03:35+00:00
India Today,trending,5,Elderly woman finds joy in swinging from train handles in Mumbai local. Watch video,https://www.indiatoday.in/trending-news/story/elderly-woman-finds-joy-in-swinging-from-train-handles-in-mumbai-local-watch-video-2881048-2026-03-12,2026-03-12T17:03:35+00:00
India Today,trending,6,Bengaluru eatery opened a month ago shuts down due to LPG shortage amid war,https://www.indiatoday.in/trending-news/story/bengaluru-eatery-run-by-gurgaon-man-opened-a-month-ago-shuts-down-due-to-lpg-shortage-amid-war-2881038-2026-03-12,2026-03-12T17:03:35+00:00
India Today,trending,7,"Man quietly waters plants on road divider every day, internet salutes his effort",https://www.indiatoday.in/trending-news/story/man-quietly-waters-plants-on-road-divider-every-day-internet-salutes-his-effort-2880963-2026-03-12,2026-03-12T17:03:35+00:00
India Today,trending,8,"Pakistani man plays Kal Ho Naa Ho on rubab in mountains, what happens next is magical",https://www.indiatoday.in/trending-news/story/pakistani-man-plays-kal-ho-naa-ho-on-rubab-in-mountains-what-happens-next-is-magical-2880916-2026-03-12,2026-03-12T17:03:35+00:00
India Today,trending,9,Man thrown off bike after colliding with car. His thumbs up to driver goes viral,https://www.indiatoday.in/trending-news/story/man-thrown-off-bike-after-colliding-with-car-his-thumbs-up-to-driver-goes-viral-2880817-2026-03-12,2026-03-12T17:03:35+00:00
India Today,trending,10,Why influencer beating man who brushed past her in Bangladesh has people arguing,https://www.indiatoday.in/trending-news/story/why-influencer-beating-man-who-brushed-past-her-in-bangladesh-has-people-arguing-2880800-2026-03-12,2026-03-12T17:03:35+00:00
India Today,trending,11,Inside Elon Musk's modest Texas home: His mother reveals surprising details,https://www.indiatoday.in/trending-news/story/inside-elon-musk-modest-texas-home-his-mother-maye-musk-reveals-surprising-details-2880779-2026-03-12,2026-03-12T17:03:35+00:00
India Today,trending,12,DigiYatra queue moves slower than regular line at Bengaluru airport? Internet weighs in,https://www.indiatoday.in/trending-news/story/digiyatra-queue-moves-slower-than-regular-line-at-bengaluru-airport-internet-weighs-in-2880758-2026-03-12,2026-03-12T17:03:35+00:00
India Today,trending,13,Russian woman enjoys 'private jet' experience as the only passenger on flight to Dubai,https://www.indiatoday.in/trending-news/story/russian-woman-enjoys-private-jet-experience-as-the-only-passenger-on-flight-to-dubai-2880709-2026-03-12,2026-03-12T17:03:35+00:00
India Today,trending,14,Gurgaon CEO calls out techie who asked Rs 36 LPA after accepting Rs 28 LPA offer,https://www.indiatoday.in/trending-news/story/gurgaon-ceo-calls-out-techie-who-asked-rs-36-lpa-after-accepting-rs-28-lpa-offer-2880505-2026-03-11,2026-03-12T17:03:35+00:00
