source,section,rank,headline,link,collected_at_iso
India Today,trending,21,Rupee sinks to record low of Rs 92.36 against US dollar,https://www.indiatoday.in/business/market/story/rupee-sinks-to-record-low-of-rs-9236-against-us-dollar-2880738-2026-03-12,2026-03-12T05:18:33+00:00
India Today,trending,22,Bought an induction cooker? These common kitchen utensils won’t work,https://www.indiatoday.in/information/story/bought-an-induction-cooker-these-common-kitchen-utensils-wont-work-2880736-2026-03-12,2026-03-12T05:18:33+00:00
India Today,trending,23,Iran war isn't ending soon. And it could threaten Trump's presidency,https://www.indiatoday.in/world/story/iran-israel-us-war-not-ending-six-months-deployment-threaten-trump-presidency-middle-east-crisis-2878180-2026-03-06,2026-03-12T05:18:33+00:00
India Today,trending,24,Aishwarya-Abhishek Bachchan dazzle at Arjun Tendulkar-Saaniya's wedding. Watch,https://www.indiatoday.in/movies/celebrities/story/aishwarya-rai-abhishek-bachchan-arrive-arjun-tendulkar-saaniya-chandhok-wedding-2877692-2026-03-05,2026-03-12T05:18:33+00:00
India Today,trending,25,Ravi Shastri slammed after ruining India's T20 World Cup-winning moment on commentary,https://www.indiatoday.in/sports/cricket/story/ravi-shastri-ninth-wicket-commentary-gaffe-india-t20-world-cup-win-2879296-2026-03-09,2026-03-12T05:18:33+00:00
India Today,trending,26,Sanju Samson's my dear pondatti message melts hearts after T20 World Cup heroics,https://www.indiatoday.in/sports/cricket/story/t20-world-cup-final-sanju-samson-wife-instagram-message-reaches-thiruvananthapuram-parents-2879524-2026-03-09,2026-03-12T05:18:33+00:00
India Today,trending,27,"Trisha shares photos after attending wedding with Vijay, thanks 'go-to people'",https://www.indiatoday.in/movies/regional-cinema/story/trisha-shares-photos-after-attending-wedding-with-vijay-thanks-go-to-people-2878291-2026-03-06,2026-03-12T05:18:33+00:00
India Today,most_read,1,IND vs SA: Deepak Chahar likely to be ruled out of last 2 ODIs due to injury,https://www.indiatoday.in/sports/cricket/story/india-vs-south-africa-deepak-chahar-likely-to-be-ruled-out-of-last-2-odis-due-to-injury-2009550-2022-10-07,2026-03-12T05:18:33+00:00
India Today,most_read,2,Manchester City fined over pitch invasion to celebrate Premier League title win,https://www.indiatoday.in/sports/football/story/manchester-city-fined-by-fa-over-pitch-invasion-to-celebrate-premier-league-title-win-2009534-2022-10-07,2026-03-12T05:18:33+00:00
India Today,most_read,3,Chelsea manager Potter on first month in charge: We have made little bit of progress,https://www.indiatoday.in/sports/football/story/chelsea-manager-graham-potter-on-first-month-in-charge-we-have-made-little-bit-of-progress-2009531-2022-10-07,2026-03-12T05:18:33+00:00
India Today,most_read,4,'Travesty of justice’: Experts criticise errors in UN report on forced disappearances in Bangladesh,https://www.indiatoday.in/world/story/experts-criticise-error-un-report-on-forced-disappearances-in-bangladesh-2007495-2022-10-02,2026-03-12T05:18:33+00:00
India Today,most_read,5,"Fact Check: No alcohol, homosexuality? Conservative guidelines for FIFA World Cup NOT issued by Qatar govt",https://www.indiatoday.in/fact-check/story/fifa-world-cup-guidelines-fact-check-no-alcohol-homosexuality-conservative-guidelines-for-football-world-cup-not-issued-by-qatar-govt-2009495-2022-10-07,2026-03-12T05:18:33+00:00
India Today,most_read,6,"KGF star Yash meets F1 legend Lewis Hamilton, See pic",https://www.indiatoday.in/movies/regional-cinema/story/kgf-star-yash-meets-f1-legend-lewis-hamilton-see-pic-2009525-2022-10-07,2026-03-12T05:18:33+00:00
India Today,most_read,7,"IND vs PAK: Match against India brings out the best in Nida Dar, says Sana Mir",https://www.indiatoday.in/sports/cricket/story/india-vs-pakistan-match-against-india-brings-out-the-best-in-nida-dar-says-sana-mir-2009523-2022-10-07,2026-03-12T05:18:33+00:00
India Today,most_read,8,Women's Asia Cup: India coach Powar defends batting-order reshuffle in Pakistan loss,https://www.indiatoday.in/sports/cricket/story/women-s-asia-cup-india-coach-ramesh-powar-defends-batting-order-reshuffle-in-pakistan-defeat-2009522-2022-10-07,2026-03-12T05:18:33+00:00
India Today,most_read,9,"Gauri Sawant reacts to Sushmita Sen playing her in Taali, recalls their first meeting",https://www.indiatoday.in/entertainment/ott/story/gauri-sawant-reacts-to-sushmita-sen-playing-her-in-taali-recalls-their-first-meeting-2009520-2022-10-07,2026-03-12T05:18:33+00:00
India Today,most_read,10,"'We're all shattered': Loved ones, community hold vigil for slain Sikh family in US",https://www.indiatoday.in/india/story/community-loved-ones-hold-vigil-sikh-family-murder-us-merced-city-2009515-2022-10-07,2026-03-12T05:18:33+00:00
India Today,most_read,11,Richa Chadha wears dainty Bvlgari mangalsutra in stunning pics with husband Ali Fazal. Here’s the price,https://www.indiatoday.in/lifestyle/fashion/story/richa-chadha-wears-dainty-bvlgari-mangalsutra-in-stunning-pics-with-husband-ali-fazal-here-s-the-price-2009509-2022-10-07,2026-03-12T05:18:33+00:00
India Today,most_read,12,"What to watch on Netflix, Disney+ Hotstar and Amazon Prime Video this weekend",https://www.indiatoday.in/entertainment/ott/story/what-to-watch-on-netflix-disney-hotstar-and-amazon-prime-video-this-weekend-2009510-2022-10-07,2026-03-12T05:18:33+00:00
India Today,most_read,13,Karnataka govt to hike SC/ST reservation,https://www.indiatoday.in/india/story/karnataka-hike-sc-st-reservation-quota-justice-nagamohan-das-committee-report-2009505-2022-10-07,2026-03-12T05:18:33+00:00
India Today,most_read,14,"Delhi civic body identifies 250 mosquito breeding hotspots, launches drive",https://www.indiatoday.in/cities/delhi/story/delhi-civic-body-identifies-mosquito-breeding-hotspots-launches-drive-2009508-2022-10-07,2026-03-12T05:18:33+00:00
India Today,most_read,15,"Your weekly news quiz, October 7 | Play on",https://www.indiatoday.in/india/story/your-weekly-news-quiz-october-7-play-on-2009506-2022-10-07,2026-03-12T05:18:33+00:00
India Today,most_read,16,"Salman Khan was on Mohali RPG attacker's hitlist, says Delhi Police",https://www.indiatoday.in/india/story/delhi-police-arrest-mohali-rpg-attacker-salman-khan-was-on-hit-list-2009502-2022-10-07,2026-03-12T05:18:33+00:00
India Today,most_read,17,"Iran denies security forces killed 16-year-old, says she fell off roof",https://www.indiatoday.in/world/story/iran-security-forces-16-year-old-killed-protest-on-death-of-woman-in-police-custody-2009503-2022-10-07,2026-03-12T05:18:33+00:00
India Today,most_read,18,"Vande Bharat Express rams into cattle, suffers minor damage; 2nd incident in 2 days",https://www.indiatoday.in/india/story/vande-bharat-express-hits-cattle-suffers-minor-damage-gujarat-2009490-2022-10-07,2026-03-12T05:18:33+00:00
India Today,most_read,19,2 Madhya Pradesh Congress MLAs booked for harassing woman on train,https://www.indiatoday.in/crime/story/2-madhya-pradesh-congress-mlas-booked-for-harassing-woman-on-train-2009441-2022-10-07,2026-03-12T05:18:33+00:00
India Today,most_read,20,Rashmika Mandanna has no regrets for not being able to spend time with her sister. Here's why,https://www.indiatoday.in/movies/regional-cinema/story/rashmika-mandanna-has-no-regrets-for-not-being-able-to-spend-time-with-her-sister-here-s-why-2009492-2022-10-07,2026-03-12T05:18:33+00:00
India Today,most_read,21,Vande Bharat Sleeper train fare details out: Check prices here,https://www.indiatoday.in/information/story/indian-railways-passenger-fares-transparency-subsidy-details-2024-25-2880722-2026-03-12,2026-03-12T05:18:33+00:00
India Today,most_read,22,LPG cylinder shortage? 6 easy alternatives to cooking food at home,https://www.indiatoday.in/information/story/lpg-cylinder-shortages-india-induction-cooktops-alternative-cooking-solutions-2880442-2026-03-12,2026-03-12T05:18:33+00:00
India Today,most_read,23,Air strikes cause black rain in Tehran; WHO warns of serious health risks,https://www.indiatoday.in/health/story/air-strikes-cause-black-rain-in-tehran-who-warns-of-serious-health-risks-2880721-2026-03-12,2026-03-12T05:18:33+00:00
India Today,most_read,24,"Aquarius Tarot Horoscope Today, March 12, 2026: Aquarius natives may face serious allegations, will have to deal with changed behaviour",https://www.indiatoday.in/horoscopes/tarot-card-reading/story/aquarius-horoscope-tarot-cards-reading-prediction-today-march-12-2026-aquarius-natives-may-face-serious-allegations-will-have-to-deal-with-changed-behaviour-2880539-2026-03-12,2026-03-12T05:18:33+00:00
India Today,most_read,25,"Sagittarius Tarot Horoscope Today, March 12, 2026: Sagittarius will find support from colleagues, family atmosphere may be tense",https://www.indiatoday.in/horoscopes/tarot-card-reading/story/sagittarius-horoscope-tarot-cards-reading-prediction-today-march-12-2026-sagittarius-will-find-support-from-colleagues-family-atmosphere-may-be-tense-2880535-2026-03-12,2026-03-12T05:18:33+00:00
India Today,most_read,26,Sanju Samson's my dear pondatti message melts hearts after T20 World Cup heroics,https://www.indiatoday.in/sports/cricket/story/t20-world-cup-final-sanju-samson-wife-instagram-message-reaches-thiruvananthapuram-parents-2879524-2026-03-09,2026-03-12T05:18:33+00:00
India Today,most_read,27,"Actor Hansika Motwani, businessman husband Sohael Khaturiya granted divorce",https://www.indiatoday.in/movies/regional-cinema/story/hansika-motwani-sohail-khaturiya-end-4-year-marriage-with-mutual-consent-2880328-2026-03-11,2026-03-12T05:18:33+00:00
India Today,most_read,28,Dutch bride's Rajasthani dance surprise delights Marwadi groom. Watch videos,https://www.indiatoday.in/trending-news/story/dutch-bride-rajasthani-dance-surprise-delights-marwadi-groom-watch-videos-2877782-2026-03-05,2026-03-12T05:18:33+00:00
India Today,most_read,29,Dhurandhar 2 brings the Ari Ari era back: 2-decade-old Punjabi banger powers trailer,https://www.indiatoday.in/movies/bollywood/story/dhurandhar-the-revenge-brings-the-ari-ari-era-back-2-decade-old-punjabi-banger-powers-trailer-2880417-2026-03-12,2026-03-12T05:18:33+00:00
