source,section,rank,headline,link,collected_at_iso
Times of India,most_read,1,"'I am leaving Pakistan cricket': 24-year-old quits game, alleges corruption",https://timesofindia.indiatimes.com/articleshow/129324478.cms,2026-03-09T19:02:14+00:00
Times of India,most_read,2,'India have ruined cricket': Shoaib Akhtar slams India after historic T20 World Cup win,https://timesofindia.indiatimes.com/articleshow/129315213.cms,2026-03-09T19:02:14+00:00
Times of India,most_read,3,"South Delhi home horror: Woman 'kills' 2 daughters, tries suicide; bandage, crushed naphthalene balls found at scene",https://timesofindia.indiatimes.com/articleshow/129186389.cms,2026-03-09T19:02:14+00:00
Times of India,most_read,4,"'Easy to make choices with someone else's money,' says Kunal Kemmu amidst Deepika Padukone's eight-hour shift row: 'You plan motherhood'",https://timesofindia.indiatimes.com/articleshow/129150091.cms,2026-03-09T19:02:14+00:00
Times of India,most_read,5,From Shahed drones to B-2 bombers: 10 weapons shaping the US-Iran war,https://timesofindia.indiatimes.com/articleshow/129338175.cms,2026-03-09T19:02:14+00:00
Times of India,most_read,6,Could your 'sex span' last into your 70s or 80s? Doctors say it's possible,https://timesofindia.indiatimes.com/articleshow/129256111.cms,2026-03-09T19:02:14+00:00
Times of India,most_read,7,"Fuel shortage fear grips Pakistan: Sharif orders school shutdown, four-day workweek",https://timesofindia.indiatimes.com/articleshow/129324362.cms,2026-03-09T19:02:14+00:00
Times of India,most_read,8,"PM Modi speaks with Nepal's newly elected youth leader Balendra Shah, Rabi Lamichhane",https://timesofindia.indiatimes.com/articleshow/129342006.cms,2026-03-09T19:02:14+00:00
Times of India,most_read,9,"After oil, war of water? Why desalination plants are turning into targets in Middle East",https://timesofindia.indiatimes.com/articleshow/129334653.cms,2026-03-09T19:02:14+00:00
Times of India,most_read,10,Pakistan praised Trump as a peacemaker. Now it could be dragged into his war,https://timesofindia.indiatimes.com/articleshow/129258671.cms,2026-03-09T19:02:14+00:00
Times of India,most_read,11,Anthropic sues Trump administration over Pentagon blacklist: All details,https://timesofindia.indiatimes.com/articleshow/129344800.cms,2026-03-09T19:02:14+00:00
Times of India,most_read,12,'I was facing a lot of difficulties personally': Hardik Pandya opens up on tough phase,https://timesofindia.indiatimes.com/articleshow/129337516.cms,2026-03-09T19:02:14+00:00
Times of India,most_read,13,From apology to choosing Mojtaba Khamenei: The growing rift between Iranian leadership,https://timesofindia.indiatimes.com/articleshow/129340736.cms,2026-03-09T19:02:14+00:00
Times of India,most_read,14,Amazon sends letter to FCC - Here's what it read,https://timesofindia.indiatimes.com/articleshow/129229812.cms,2026-03-09T19:02:14+00:00
Times of India,most_read,15,Battle of the rolls: How Mamata vs EC over SIR has set stage for 2026 Bengal assembly elections,https://timesofindia.indiatimes.com/articleshow/129274600.cms,2026-03-09T19:02:14+00:00
Times of India,most_read,16,"Midnight missiles: Japan quietly deploys 1,000 km Type-12 launchers, China now within reach",https://timesofindia.indiatimes.com/articleshow/129343642.cms,2026-03-09T19:02:14+00:00
Times of India,most_read,17,"Google CEO Sundar Pichai says ‘chose the wrong match…’, Microsoft's Satya Nadella wishes team as India win ICC Men's T20 World Cup",https://timesofindia.indiatimes.com/articleshow/129284951.cms,2026-03-09T19:02:14+00:00
Times of India,most_read,18,How Ishan Kishan fought personal grief to rise on the biggest night of his career,https://timesofindia.indiatimes.com/articleshow/129280860.cms,2026-03-09T19:02:14+00:00
Times of India,most_read,19,Threemendous: T20 kings keep the crown,https://timesofindia.indiatimes.com/articleshow/129288767.cms,2026-03-09T19:02:14+00:00
Times of India,most_read,20,T20 World Cup final: India bury ghost of November 19; pummel New Zealand by 96 runs,https://timesofindia.indiatimes.com/articleshow/129280696.cms,2026-03-09T19:02:14+00:00
Times of India,most_read,21,"Mamata absent, no water in President Murmu's washroom, garbage on road: Centre, Bengal govt spar over 'lapses' at Santal event",https://timesofindia.indiatimes.com/articleshow/129256807.cms,2026-03-09T19:02:14+00:00
Times of India,most_read,22,'If he is composer of 'Ramayana' then I don't think there is any problem': Salim Merchant on AR Rahman’s ‘communal bias’ row,https://timesofindia.indiatimes.com/articleshow/129269093.cms,2026-03-09T19:02:14+00:00
Times of India,most_read,23,'I was broken after the NZ series': Sanju Samson wins Player of the Tournament after historic T20 World Cup run,https://timesofindia.indiatimes.com/articleshow/129283232.cms,2026-03-09T19:02:14+00:00
Times of India,most_read,24,US embassy in UAE issues security alert: Americans urged to consider leaving as consular services shut,https://timesofindia.indiatimes.com/articleshow/129257179.cms,2026-03-09T19:02:14+00:00
Times of India,most_read,25,"Sanju Samson scripts history, breaks multiple records in T20 World Cup final vs New Zealand",https://timesofindia.indiatimes.com/articleshow/129276280.cms,2026-03-09T19:02:14+00:00
Times of India,most_read,26,Murder in Delhi's Uttam Nagar: MCD demolishes 'illegal portions' of accused's house,https://timesofindia.indiatimes.com/articleshow/129258695.cms,2026-03-09T19:02:14+00:00
Times of India,most_read,27,"Distant war, a regional shockwave: How Middle East crisis is making life difficult in Bangladesh and Pakistan",https://timesofindia.indiatimes.com/articleshow/129274256.cms,2026-03-09T19:02:14+00:00
Times of India,most_read,28,The drug paradox of Queen Victoria: New book says she ‘loved’ drugs while empire sold opium worldwide,https://timesofindia.indiatimes.com/articleshow/129278125.cms,2026-03-09T19:02:14+00:00
Times of India,most_read,29,‘Kundavai should be kept at home’: Did R Parthiban take a swipe at Vijay and Trisha Krishnan's public appearance?,https://timesofindia.indiatimes.com/articleshow/129264099.cms,2026-03-09T19:02:14+00:00
Times of India,most_read,30,"A 35-year-old who has railed against India, China and the US may soon run Nepal",https://timesofindia.indiatimes.com/articleshow/129264054.cms,2026-03-09T19:02:14+00:00
Times of India,most_read,31,Failed Israeli mission to recover pilot’s remains leaves 41 dead in Lebanon,https://timesofindia.indiatimes.com/articleshow/129255789.cms,2026-03-09T19:02:14+00:00
Times of India,most_read,32,IND vs NZ Final Match Timings: What time is India vs New Zealand T20 World Cup match?,https://timesofindia.indiatimes.com/articleshow/129255315.cms,2026-03-09T19:02:14+00:00
Times of India,most_read,33,'Mitchell ko sorry bolne gya tha': Arshdeep Singh after on-field spat with Daryl Mitchell,https://timesofindia.indiatimes.com/articleshow/129283193.cms,2026-03-09T19:02:14+00:00
Times of India,most_read,34,‘Apocalyptic’ scenes in Tehran: Massive inferno erupts after explosions – video,https://timesofindia.indiatimes.com/articleshow/129269565.cms,2026-03-09T19:02:14+00:00
Times of India,most_read,35,"Who is Mojtaba Khamenei, the new Iranian Supreme Leader facing US and Israel",https://timesofindia.indiatimes.com/articleshow/129292991.cms,2026-03-09T19:02:14+00:00
Times of India,most_read,36,PM Modi inaugurates two new Delhi Metro corridors: Key routes and how they will help commuters,https://timesofindia.indiatimes.com/articleshow/129254488.cms,2026-03-09T19:02:14+00:00
Times of India,most_read,37,'I can feel pulse of the player': Rohit Sharma reveals emotional reason behind Sanju Samson pep talk,https://timesofindia.indiatimes.com/articleshow/129263294.cms,2026-03-09T19:02:14+00:00
Times of India,most_read,38,"Weekly Career Horoscope, March 08 to March 14, 2026: Success, challenges, and breakthroughs; Know about your Career",https://timesofindia.indiatimes.com/articleshow/129259906.cms,2026-03-09T19:02:14+00:00
Times of India,most_read,39,Meet Anjali Sardana: Indian entrepreneur who built $100 million startup after studying in US,https://timesofindia.indiatimes.com/articleshow/129267439.cms,2026-03-09T19:02:14+00:00
Times of India,most_read,40,Trisha Krishnan hits back after R Parthiban takes a dig at her post her viral video with Vijay from a wedding: 'It makes stupidity..',https://timesofindia.indiatimes.com/articleshow/129278241.cms,2026-03-09T19:02:14+00:00
Times of India,most_read,41,"MH370 still missing: Latest search after scanning 15,000 sq km ends with no clues to 239 people onboard",https://timesofindia.indiatimes.com/articleshow/129265069.cms,2026-03-09T19:02:14+00:00
Times of India,most_read,42,Watch: First cricketer in 254 years! New Zealand bowler sets jaw-dropping world record,https://timesofindia.indiatimes.com/articleshow/129253812.cms,2026-03-09T19:02:14+00:00
Times of India,most_read,43,"CHAMPION STUFF! High risk, high reward: How ‘Total T20’ fuelled India’s march to World Cup glory",https://timesofindia.indiatimes.com/articleshow/129305416.cms,2026-03-09T19:02:14+00:00
Times of India,most_read,44,‘Iran won’t leave him alone for killing Khamenei’: Ayatollah’s top aide warns; Trump says ‘I couldn’t care less’,https://timesofindia.indiatimes.com/articleshow/129262149.cms,2026-03-09T19:02:14+00:00
Times of India,most_read,45,Gulf tensions: Dumping of goods by ships at ports worries exporters,https://timesofindia.indiatimes.com/articleshow/129290619.cms,2026-03-09T19:02:14+00:00
Times of India,most_read,46,Nuclear stockpile to Kharg Island: Why Trump wants to send special forces to Iran,https://timesofindia.indiatimes.com/articleshow/129273869.cms,2026-03-09T19:02:14+00:00
Times of India,most_read,47,Gautam Gambhir Reply to MS Dhoni,https://timesofindia.indiatimes.com/articleshow/129322247.cms,2026-03-09T19:02:14+00:00
Times of India,most_read,48,CBSE Class 12th Maths Exam Analysis,https://timesofindia.indiatimes.com/articleshow/129319670.cms,2026-03-09T19:02:14+00:00
Times of India,most_read,49,Delhi Uttam Nagar Murder,https://timesofindia.indiatimes.com/articleshow/129297640.cms,2026-03-09T19:02:14+00:00
Times of India,most_read,50,Shohei Ohtani Tea Bottle,https://timesofindia.indiatimes.com/articleshow/129333044.cms,2026-03-09T19:02:14+00:00
Times of India,most_read,51,Novak Djokovic net worth,https://timesofindia.indiatimes.com/articleshow/129338891.cms,2026-03-09T19:02:14+00:00
Times of India,most_read,52,Honkai: Star Rail 4.1,https://timesofindia.indiatimes.com/articleshow/129341738.cms,2026-03-09T19:02:14+00:00
Times of India,most_read,53,Highest-paid MLB players,https://timesofindia.indiatimes.com/articleshow/129342700.cms,2026-03-09T19:02:14+00:00
Times of India,most_read,54,Richest NFL player,https://timesofindia.indiatimes.com/articleshow/129343335.cms,2026-03-09T19:02:14+00:00
Times of India,most_read,55,Sarah Jane Ramos,https://timesofindia.indiatimes.com/articleshow/129345819.cms,2026-03-09T19:02:14+00:00
Times of India,most_read,56,Taunton house explosion,https://timesofindia.indiatimes.com/articleshow/129342556.cms,2026-03-09T19:02:14+00:00
Times of India,most_read,57,LPG refill rule,https://timesofindia.indiatimes.com/articleshow/129334881.cms,2026-03-09T19:02:14+00:00
Times of India,most_read,58,US stock market today,https://timesofindia.indiatimes.com/articleshow/129339862.cms,2026-03-09T19:02:14+00:00
Times of India,most_read,59,Dhurandhar 2 OTT Release,https://timesofindia.indiatimes.com/articleshow/129319979.cms,2026-03-09T19:02:14+00:00
Times of India,most_read,60,SS Rajamouli House,https://timesofindia.indiatimes.com/articleshow/129307437.cms,2026-03-09T19:02:14+00:00
Times of India,most_read,61,Dhurandhar 2 Advance Booking,https://timesofindia.indiatimes.com/articleshow/129312149.cms,2026-03-09T19:02:14+00:00
Times of India,most_read,62,Shah Rukh Khan,https://timesofindia.indiatimes.com/articleshow/129118674.cms,2026-03-09T19:02:14+00:00
Times of India,most_read,63,Ahmedabad Police Traffic advisory,https://timesofindia.indiatimes.com/articleshow/129221351.cms,2026-03-09T19:02:14+00:00
Times of India,most_read,64,The Kerala Story 2,https://timesofindia.indiatimes.com/articleshow/129298466.cms,2026-03-09T19:02:14+00:00
Times of India,most_read,65,South India Real Estate,https://timesofindia.indiatimes.com/articleshow/129314884.cms,2026-03-09T19:02:14+00:00
Times of India,most_read,66,Open Source WiFi Tool,https://timesofindia.indiatimes.com/articleshow/129295520.cms,2026-03-09T19:02:14+00:00
Times of India,most_read,67,Maruti Brezza Facelift Spied,https://timesofindia.indiatimes.com/articleshow/129146065.cms,2026-03-09T19:02:14+00:00
Times of India,most_read,68,Lab Grown Diamonds,https://timesofindia.indiatimes.com/articleshow/129090781.cms,2026-03-09T19:02:14+00:00
Times of India,most_read,69,Social Media Ban,https://timesofindia.indiatimes.com/articleshow/129152683.cms,2026-03-09T19:02:14+00:00
Times of India,most_read,70,Women’s Day AI Prompts,https://timesofindia.indiatimes.com/articleshow/129253033.cms,2026-03-09T19:02:14+00:00
Times of India,most_read,71,Hyderabad Mall Hoarding Collapse,https://timesofindia.indiatimes.com/articleshow/129286460.cms,2026-03-09T19:02:14+00:00
Times of India,most_read,72,Indian Cricket Team,https://timesofindia.indiatimes.com/articleshow/129304768.cms,2026-03-09T19:02:14+00:00
Times of India,most_read,73,UPMSP Board Exam,https://timesofindia.indiatimes.com/articleshow/129310691.cms,2026-03-09T19:02:14+00:00
Times of India,most_read,74,RRB Group D Recruitment,https://timesofindia.indiatimes.com/articleshow/129308267.cms,2026-03-09T19:02:14+00:00
Times of India,most_read,75,NMMS Admit Card,https://timesofindia.indiatimes.com/articleshow/129304165.cms,2026-03-09T19:02:14+00:00
Times of India,most_read,76,RRB Paramedical Admit Card,https://timesofindia.indiatimes.com/articleshow/129306262.cms,2026-03-09T19:02:14+00:00
Times of India,most_read,77,Pune Spiritual School Closure,https://timesofindia.indiatimes.com/articleshow/129299407.cms,2026-03-09T19:02:14+00:00
Times of India,most_read,78,Middle East News,https://timesofindia.indiatimes.com/articleshow/129309840.cms,2026-03-09T19:02:14+00:00
Times of India,most_read,79,Tarun Khatik Murder,https://timesofindia.indiatimes.com/articleshow/129311729.cms,2026-03-09T19:02:14+00:00
Times of India,most_read,80,Vallabh Maheshwari Accident,https://timesofindia.indiatimes.com/articleshow/129312441.cms,2026-03-09T19:02:14+00:00
Times of India,most_read,81,Delhi Excise Policy Case,https://timesofindia.indiatimes.com/articleshow/129314045.cms,2026-03-09T19:02:14+00:00
Times of India,most_read,82,Gurgaon Scrap Yard Fire,https://timesofindia.indiatimes.com/articleshow/129317885.cms,2026-03-09T19:02:14+00:00
Times of India,most_read,83,Manipuri Woman Assault,https://timesofindia.indiatimes.com/articleshow/129286480.cms,2026-03-09T19:02:14+00:00
Times of India,most_read,84,DTC Bus Accident,https://timesofindia.indiatimes.com/articleshow/129317246.cms,2026-03-09T19:02:14+00:00
Times of India,most_read,85,Karnataka Elephant Overpass,https://timesofindia.indiatimes.com/articleshow/129285616.cms,2026-03-09T19:02:14+00:00
Times of India,most_read,86,Bengaluru Illegal Mortgage,https://timesofindia.indiatimes.com/articleshow/129285440.cms,2026-03-09T19:02:14+00:00
Times of India,most_read,87,Air India Dented Bag Compensation,https://timesofindia.indiatimes.com/articleshow/129285653.cms,2026-03-09T19:02:14+00:00
Times of India,most_read,88,Nashik Bribery Case,https://timesofindia.indiatimes.com/articleshow/129170597.cms,2026-03-09T19:02:14+00:00
Times of India,most_read,89,Oppo Find N6,https://timesofindia.indiatimes.com/articleshow/129315468.cms,2026-03-09T19:02:14+00:00
Times of India,most_read,90,Anthropic Ceo Dario Amodei,https://timesofindia.indiatimes.com/articleshow/129137566.cms,2026-03-09T19:02:14+00:00
Times of India,most_read,91,Inappropriate relationship with someone: Ohio State University president Ted Carter's mysterious resignation,https://timesofindia.indiatimes.com/articleshow/129346477.cms,2026-03-09T19:02:14+00:00
Times of India,most_read,92,'Indian cricket in golden phase': BCCI after T20 World Cup 2026 triumph,https://timesofindia.indiatimes.com/articleshow/129346723.cms,2026-03-09T19:02:14+00:00
Times of India,most_read,93,West Asia war disrupts TN coir exports; Rs 200crore worth coir piths and fibres stagnated in Pollachi,https://timesofindia.indiatimes.com/articleshow/129346645.cms,2026-03-09T19:02:14+00:00
Times of India,most_read,94,Meet new F1 WAG Lauren Fitzsimmons: Isack Hadjar’s girlfriend who supported him at his Red Bull debut at Australian Grand Prix,https://timesofindia.indiatimes.com/articleshow/129346113.cms,2026-03-09T19:02:14+00:00
Times of India,most_read,95,The Rise Of Bihar’s Cricket Prodigies,https://timesofindia.indiatimes.com/articleshow/129344643.cms,2026-03-09T19:02:14+00:00
Times of India,most_read,96,Plastic from milk? Scientists create eco-friendly plastic that decomposes in just 13 weeks,https://timesofindia.indiatimes.com/articleshow/129346010.cms,2026-03-09T19:02:14+00:00
Times of India,most_read,97,Exorcists warn AI is a ‘great power’ that could be exploited by satanic groups,https://timesofindia.indiatimes.com/articleshow/129345241.cms,2026-03-09T19:02:14+00:00
Times of India,most_read,98,Warburg to list housing finance company purchased from Shriram,https://timesofindia.indiatimes.com/articleshow/129346018.cms,2026-03-09T19:02:14+00:00
Times of India,most_read,99,What are the mysterious red sprites and blue jets astronauts spot swishing over Earth from the ISS?,https://timesofindia.indiatimes.com/articleshow/129345551.cms,2026-03-09T19:02:14+00:00
Times of India,most_read,100,Disabled Coimbatore youth clears civil services exam,https://timesofindia.indiatimes.com/articleshow/129345833.cms,2026-03-09T19:02:14+00:00
Times of India,most_read,101,"US judge blocks former employees from poaching and uses Palantir’s data for AI startup, says: The company would suffer….",https://timesofindia.indiatimes.com/articleshow/129345631.cms,2026-03-09T19:02:14+00:00
Times of India,most_read,102,Demi Moore and Bruce Willis: A love story that survived divorce and thrives through friendship,https://timesofindia.indiatimes.com/articleshow/129335030.cms,2026-03-09T19:02:14+00:00
Times of India,most_read,103,Did Emmanuel Acho just predict Travis Kelce's future? The tight end's 2026 decision gave that debate a clear ending,https://timesofindia.indiatimes.com/articleshow/129345317.cms,2026-03-09T19:02:14+00:00
Times of India,most_read,104,"How Shohei Ohtani, Juan Soto, and Aaron Judge built their massive MLB fortunes",https://timesofindia.indiatimes.com/articleshow/129344561.cms,2026-03-09T19:02:14+00:00
Times of India,most_read,105,Justice topmost priority: Rekha Gupta to kin of man killed in Holi brawl,https://timesofindia.indiatimes.com/articleshow/129344031.cms,2026-03-09T19:02:14+00:00
Times of India,trending,1,"etimesNo pink panthers or green dogs? Why are mammals not as brightly coloured as birds and fishMammals primarily exhibit muted earth tones due to their reliance on melanin and a lack of structural color complexity in fur. This drab coloration evolved as a survival mechanism to hide from predatory dinosaurs. Even after the dinosaurs' extinction, mammals retained these colors, partly due to their dichromatic vision, which limits their perception of vibrant hues.",https://timesofindia.indiatimes.com/articleshow/129350340.cms,2026-03-09T19:02:14+00:00
Times of India,trending,2,etimesWhales in the Egyptian desert? Why is Egypt's Wadi al-Hitan desert called the 'Valley of the Whales'?,https://timesofindia.indiatimes.com/articleshow/129349955.cms,2026-03-09T19:02:14+00:00
Times of India,trending,3,etimesFrom alien invasion to glacier transportation theories: Who moved the Stonehenge stones?,https://timesofindia.indiatimes.com/articleshow/129347849.cms,2026-03-09T19:02:14+00:00
Times of India,trending,4,"etimesWhat are the mysterious red sprites and blue jets astronauts spot swishing over Earth from the ISS?Astronauts aboard the ISS frequently capture Transient Luminous Events (TLEs), mysterious colorful bursts like red sprites and blue jets occurring high above thunderstorms. These upper-atmosphere sparks, detected by instruments like ASIM, can disrupt radio communications, pose risks to aircraft, and influence atmospheric chemistry.",https://timesofindia.indiatimes.com/articleshow/129345551.cms,2026-03-09T19:02:14+00:00
Times of India,trending,5,"etimesMeet Ron Garan: NASA astronaut who saw humanity's 'lie' on Earth after 178 days in spaceFormer NASA astronaut Ron Garan experienced the ""Overview Effect"" during his time on the International Space Station, witnessing Earth's fragility and the interconnectedness of all life. This profound shift in perspective revealed that human-made systems often prioritize profit over planetary health, leading him to advocate for a world that values ""planet, society, economy"" for lasting peace.",https://timesofindia.indiatimes.com/articleshow/129342723.cms,2026-03-09T19:02:14+00:00
Times of India,trending,6,CBSE Class 12th Maths Exam,https://timesofindia.indiatimes.com/articleshow/129319670.cms,2026-03-09T19:02:14+00:00
Times of India,trending,7,Sheikh Mohammed Bin Rashid,https://timesofindia.indiatimes.com/articleshow/129295088.cms,2026-03-09T19:02:14+00:00
Times of India,trending,8,Daylight saving time: Why Americans lose an hour of sleep every year from March to November?,https://timesofindia.indiatimes.com/articleshow/129339173.cms,2026-03-09T19:02:14+00:00
Times of India,trending,9,From Gautam Gambhir's grin to Hardik Pandya-Maheika's dance: 5 trending social media moments from T20 World Cup celebrations,https://timesofindia.indiatimes.com/articleshow/129334521.cms,2026-03-09T19:02:14+00:00
Times of India,trending,10,Meet Sanjana Ganesan: All about the woman behind India’s star cricketer Jasprit Bumrah,https://timesofindia.indiatimes.com/articleshow/129307875.cms,2026-03-09T19:02:14+00:00
Times of India,trending,11,Meet Dhiraj Jain: Dubai businessman who opened his farmhouse to 300 stranded tourists and became a lifeline during the UAE crisis,https://timesofindia.indiatimes.com/articleshow/129348363.cms,2026-03-09T19:02:14+00:00
Times of India,trending,12,Children rushed to hospital after teacher allegedly gave them weed gummies to celebrate birthday,https://timesofindia.indiatimes.com/articleshow/129335088.cms,2026-03-09T19:02:14+00:00
Times of India,trending,13,Exorcists warn AI is a ‘great power’ that could be exploited by satanic groups,https://timesofindia.indiatimes.com/articleshow/129345241.cms,2026-03-09T19:02:14+00:00
Times of India,trending,14,Was Britain’s Queen Charlotte black? Netflix’s Bridgerton star insists ‘she was a woman of colour’,https://timesofindia.indiatimes.com/articleshow/129332164.cms,2026-03-09T19:02:14+00:00
Times of India,trending,15,"'Because of H1B visas': MAGA enraged at 35,000 Indian-Americans dominating schools and offices in Forsyth County",https://timesofindia.indiatimes.com/articleshow/129334739.cms,2026-03-09T19:02:14+00:00
Times of India,trending,16,The drug paradox of Queen Victoria: New book says she ‘loved’ drugs while empire sold opium worldwide,https://timesofindia.indiatimes.com/articleshow/129278125.cms,2026-03-09T19:02:14+00:00
Times of India,trending,17,Six hours through Oman’s desert: How a British father and daughter fled the Middle East crisis,https://timesofindia.indiatimes.com/articleshow/129330970.cms,2026-03-09T19:02:14+00:00
Times of India,trending,18,Government working to ‘optimise’ gas supply as Gulf war hits LNG flow,https://timesofindia.indiatimes.com/articleshow/129350675.cms,2026-03-09T19:02:14+00:00
Times of India,trending,19,From Shahed drones to B-2 bombers: 10 weapons shaping the US-Iran war,https://timesofindia.indiatimes.com/articleshow/129338175.cms,2026-03-09T19:02:14+00:00
Times of India,trending,20,"PM Modi speaks with Nepal's newly elected youth leader Balendra Shah, Rabi Lamichhane",https://timesofindia.indiatimes.com/articleshow/129342006.cms,2026-03-09T19:02:14+00:00
Times of India,trending,21,"After oil, war of water? Why desalination plants are turning into targets in Middle East",https://timesofindia.indiatimes.com/articleshow/129334653.cms,2026-03-09T19:02:14+00:00
Times of India,trending,22,Richest Tennis Players,https://timesofindia.indiatimes.com/articleshow/129349338.cms,2026-03-09T19:02:14+00:00
Times of India,trending,23,Mitch Marner's net worth,https://timesofindia.indiatimes.com/articleshow/129345714.cms,2026-03-09T19:02:14+00:00
Times of India,trending,24,Ted Carter resigns,https://timesofindia.indiatimes.com/articleshow/129346477.cms,2026-03-09T19:02:14+00:00
Times of India,trending,25,Rangers vs Flyers,https://timesofindia.indiatimes.com/articleshow/129337213.cms,2026-03-09T19:02:14+00:00
Times of India,trending,26,Fortnite Chapter 7,https://timesofindia.indiatimes.com/articleshow/129339937.cms,2026-03-09T19:02:14+00:00
Times of India,trending,27,Novak Djokovic net worth,https://timesofindia.indiatimes.com/articleshow/129338891.cms,2026-03-09T19:02:14+00:00
Times of India,trending,28,Honkai: Star Rail 4.1,https://timesofindia.indiatimes.com/articleshow/129341738.cms,2026-03-09T19:02:14+00:00
Times of India,trending,29,Highest-paid MLB players,https://timesofindia.indiatimes.com/articleshow/129342700.cms,2026-03-09T19:02:14+00:00
Times of India,trending,30,Richest NFL player,https://timesofindia.indiatimes.com/articleshow/129343335.cms,2026-03-09T19:02:14+00:00
Times of India,trending,31,Sarah Jane Ramos,https://timesofindia.indiatimes.com/articleshow/129345819.cms,2026-03-09T19:02:14+00:00
