source,section,rank,headline,link,collected_at_iso
India Today,trending,12,Delhi metro turns workplace for man after manager's call. Post goes viral,https://www.indiatoday.in/trending-news/story/delhi-metro-turns-workplace-for-man-after-managers-call-post-goes-viral-2883839-2026-03-18,2026-03-19T17:04:00+00:00
India Today,trending,13,Parents wave at CCTV camera every day to check on daughter living away from home,https://www.indiatoday.in/trending-news/story/parents-wave-at-cctv-camera-every-day-to-check-on-daughter-living-away-from-home-2883813-2026-03-18,2026-03-19T17:04:00+00:00
India Today,trending,14,Indian man's video of 'F1 car pooja' is where speed meets sanskaar,https://www.indiatoday.in/trending-news/story/indian-mans-video-of-f1-car-pooja-is-where-speed-meets-sanskaar-2883810-2026-03-18,2026-03-19T17:04:00+00:00
India Today,trending,15,"Indian couple in UK meets at station due to opposite shifts, shows tough reality",https://www.indiatoday.in/trending-news/story/indian-couple-in-uk-meets-at-station-due-to-opposite-shifts-shows-tough-reality-work-life-balance-2883731-2026-03-18,2026-03-19T17:04:00+00:00
India Today,trending,16,Australian man films 'India's most expensive vehicle' in Gurgaon amid LPG crisis,https://www.indiatoday.in/trending-news/story/australian-man-films-indias-most-expensive-vehicle-in-gurgaon-amid-lpg-crisis-2883719-2026-03-18,2026-03-19T17:04:00+00:00
India Today,trending,17,"Dhurandhar 2 runtime sparks memes as fans apply for leave, pack suitcase, pillows",https://www.indiatoday.in/trending-news/story/dhurandhar-2-runtime-sparks-memes-as-fans-apply-leave-pack-suitcase-and-pillows-2883692-2026-03-18,2026-03-19T17:04:00+00:00
India Today,trending,18,"Odisha man gets trampled by angry elephant, stands up, walks away. Video is viral",https://www.indiatoday.in/trending-news/story/odisha-man-gets-trampled-by-angry-elephant-stands-up-walks-away-video-is-viral-2883680-2026-03-18,2026-03-19T17:04:00+00:00
India Today,trending,19,"Couple's 'cinematic' pond pre-wedding shoot goes viral, gets brutally trolled",https://www.indiatoday.in/trending-news/story/couples-cinematic-pond-pre-wedding-shoot-goes-viral-gets-brutally-trolled-2883642-2026-03-18,2026-03-19T17:04:00+00:00
India Today,trending,20,Shillong school choir's Legends performance leaves internet grooving to the beat,https://www.indiatoday.in/trending-news/story/shillong-school-choirs-legends-performance-leaves-internet-grooving-to-the-beat-2883624-2026-03-18,2026-03-19T17:04:00+00:00
India Today,trending,21,Mondo Duplantis in India? Bhubaneshwar set to host World Indoor Champs' 2028,https://www.indiatoday.in/sports/athletics/story/india-world-indoor-athletics-championships-2884397-2026-03-19,2026-03-19T17:04:00+00:00
India Today,trending,22,"Khoya Mahal: Aditi Rao, Barun Sobti lead Konkona Sensharma’s directorial, teaser out",https://www.indiatoday.in/entertainment/ott/story/welcome-to-khoya-mahal-aditi-rao-barun-sobti-lead-konkona-sensharmas-directorial-teaser-out-2884392-2026-03-19,2026-03-19T17:04:00+00:00
India Today,trending,23,Is Israel using America as its own personal army to fight its war against Iran?,https://www.indiatoday.in/world/story/is-israel-using-america-as-its-own-personal-army-to-fight-its-war-against-iran-2884396-2026-03-19,2026-03-19T17:04:00+00:00
India Today,trending,24,"BJP offers Deputy CM post to Vijay, 80 seats to TVK for Tamil Nadu polls: Sources",https://www.indiatoday.in/elections/assembly/story/bjp-offers-tamil-nadu-deputy-cm-post-to-vijay-80-seats-to-tvk-for-upcoming-assembly-polls-say-sources-2882206-2026-03-15,2026-03-19T17:04:00+00:00
India Today,trending,25,Influencer gets scolded by Bengaluru woman for her clothes. Internet is not happy,https://www.indiatoday.in/trending-news/story/influencer-gets-scolded-by-bengaluru-woman-for-her-clothes-internet-is-not-happy-2882319-2026-03-15,2026-03-19T17:04:00+00:00
India Today,trending,26,"Kuldeep, Vanshika look gorgeous in wedding ceremony, best-mate Chahal steals the show",https://www.indiatoday.in/sports/cricket/story/kuldeep-yadav-vanshika-pre-wedding-ceremony-yuzvendra-chahal-dance-2881657-2026-03-13,2026-03-19T17:04:00+00:00
India Today,trending,27,"West Bengal polls: From defection to victory, the numbers favour turncoats",https://www.indiatoday.in/diu/story/west-bengal-polls-from-defection-to-victory-the-numbers-favour-turncoats-2882728-2026-03-16,2026-03-19T17:04:00+00:00
India Today,trending,28,Vijay's TVK dismisses talks of joining NDA in Tamil Nadu,https://www.indiatoday.in/india/story/vijay-tvk-dismisses-talks-of-joining-nda-in-tamil-nadu-2882125-2026-03-14,2026-03-19T17:04:00+00:00
India Today,most_read,1,IND vs SA: Deepak Chahar likely to be ruled out of last 2 ODIs due to injury,https://www.indiatoday.in/sports/cricket/story/india-vs-south-africa-deepak-chahar-likely-to-be-ruled-out-of-last-2-odis-due-to-injury-2009550-2022-10-07,2026-03-19T17:04:00+00:00
India Today,most_read,2,Manchester City fined over pitch invasion to celebrate Premier League title win,https://www.indiatoday.in/sports/football/story/manchester-city-fined-by-fa-over-pitch-invasion-to-celebrate-premier-league-title-win-2009534-2022-10-07,2026-03-19T17:04:00+00:00
India Today,most_read,3,Chelsea manager Potter on first month in charge: We have made little bit of progress,https://www.indiatoday.in/sports/football/story/chelsea-manager-graham-potter-on-first-month-in-charge-we-have-made-little-bit-of-progress-2009531-2022-10-07,2026-03-19T17:04:00+00:00
India Today,most_read,4,'Travesty of justice’: Experts criticise errors in UN report on forced disappearances in Bangladesh,https://www.indiatoday.in/world/story/experts-criticise-error-un-report-on-forced-disappearances-in-bangladesh-2007495-2022-10-02,2026-03-19T17:04:00+00:00
India Today,most_read,5,"Fact Check: No alcohol, homosexuality? Conservative guidelines for FIFA World Cup NOT issued by Qatar govt",https://www.indiatoday.in/fact-check/story/fifa-world-cup-guidelines-fact-check-no-alcohol-homosexuality-conservative-guidelines-for-football-world-cup-not-issued-by-qatar-govt-2009495-2022-10-07,2026-03-19T17:04:00+00:00
India Today,most_read,6,"KGF star Yash meets F1 legend Lewis Hamilton, See pic",https://www.indiatoday.in/movies/regional-cinema/story/kgf-star-yash-meets-f1-legend-lewis-hamilton-see-pic-2009525-2022-10-07,2026-03-19T17:04:00+00:00
India Today,most_read,7,"IND vs PAK: Match against India brings out the best in Nida Dar, says Sana Mir",https://www.indiatoday.in/sports/cricket/story/india-vs-pakistan-match-against-india-brings-out-the-best-in-nida-dar-says-sana-mir-2009523-2022-10-07,2026-03-19T17:04:00+00:00
India Today,most_read,8,Women's Asia Cup: India coach Powar defends batting-order reshuffle in Pakistan loss,https://www.indiatoday.in/sports/cricket/story/women-s-asia-cup-india-coach-ramesh-powar-defends-batting-order-reshuffle-in-pakistan-defeat-2009522-2022-10-07,2026-03-19T17:04:00+00:00
India Today,most_read,9,"Gauri Sawant reacts to Sushmita Sen playing her in Taali, recalls their first meeting",https://www.indiatoday.in/entertainment/ott/story/gauri-sawant-reacts-to-sushmita-sen-playing-her-in-taali-recalls-their-first-meeting-2009520-2022-10-07,2026-03-19T17:04:00+00:00
India Today,most_read,10,"'We're all shattered': Loved ones, community hold vigil for slain Sikh family in US",https://www.indiatoday.in/india/story/community-loved-ones-hold-vigil-sikh-family-murder-us-merced-city-2009515-2022-10-07,2026-03-19T17:04:00+00:00
India Today,most_read,11,Richa Chadha wears dainty Bvlgari mangalsutra in stunning pics with husband Ali Fazal. Here’s the price,https://www.indiatoday.in/lifestyle/fashion/story/richa-chadha-wears-dainty-bvlgari-mangalsutra-in-stunning-pics-with-husband-ali-fazal-here-s-the-price-2009509-2022-10-07,2026-03-19T17:04:00+00:00
India Today,most_read,12,"What to watch on Netflix, Disney+ Hotstar and Amazon Prime Video this weekend",https://www.indiatoday.in/entertainment/ott/story/what-to-watch-on-netflix-disney-hotstar-and-amazon-prime-video-this-weekend-2009510-2022-10-07,2026-03-19T17:04:00+00:00
India Today,most_read,13,Karnataka govt to hike SC/ST reservation,https://www.indiatoday.in/india/story/karnataka-hike-sc-st-reservation-quota-justice-nagamohan-das-committee-report-2009505-2022-10-07,2026-03-19T17:04:00+00:00
India Today,most_read,14,"Delhi civic body identifies 250 mosquito breeding hotspots, launches drive",https://www.indiatoday.in/cities/delhi/story/delhi-civic-body-identifies-mosquito-breeding-hotspots-launches-drive-2009508-2022-10-07,2026-03-19T17:04:00+00:00
India Today,most_read,15,"Your weekly news quiz, October 7 | Play on",https://www.indiatoday.in/india/story/your-weekly-news-quiz-october-7-play-on-2009506-2022-10-07,2026-03-19T17:04:00+00:00
India Today,most_read,16,"Salman Khan was on Mohali RPG attacker's hitlist, says Delhi Police",https://www.indiatoday.in/india/story/delhi-police-arrest-mohali-rpg-attacker-salman-khan-was-on-hit-list-2009502-2022-10-07,2026-03-19T17:04:00+00:00
India Today,most_read,17,"Iran denies security forces killed 16-year-old, says she fell off roof",https://www.indiatoday.in/world/story/iran-security-forces-16-year-old-killed-protest-on-death-of-woman-in-police-custody-2009503-2022-10-07,2026-03-19T17:04:00+00:00
India Today,most_read,18,"Vande Bharat Express rams into cattle, suffers minor damage; 2nd incident in 2 days",https://www.indiatoday.in/india/story/vande-bharat-express-hits-cattle-suffers-minor-damage-gujarat-2009490-2022-10-07,2026-03-19T17:04:00+00:00
India Today,most_read,19,2 Madhya Pradesh Congress MLAs booked for harassing woman on train,https://www.indiatoday.in/crime/story/2-madhya-pradesh-congress-mlas-booked-for-harassing-woman-on-train-2009441-2022-10-07,2026-03-19T17:04:00+00:00
India Today,most_read,20,Rashmika Mandanna has no regrets for not being able to spend time with her sister. Here's why,https://www.indiatoday.in/movies/regional-cinema/story/rashmika-mandanna-has-no-regrets-for-not-being-able-to-spend-time-with-her-sister-here-s-why-2009492-2022-10-07,2026-03-19T17:04:00+00:00
India Today,most_read,21,Mondo Duplantis in India? Bhubaneshwar set to host World Indoor Champs' 2028,https://www.indiatoday.in/sports/athletics/story/india-world-indoor-athletics-championships-2884397-2026-03-19,2026-03-19T17:04:00+00:00
India Today,most_read,22,"Khoya Mahal: Aditi Rao, Barun Sobti lead Konkona Sensharma’s directorial, teaser out",https://www.indiatoday.in/entertainment/ott/story/welcome-to-khoya-mahal-aditi-rao-barun-sobti-lead-konkona-sensharmas-directorial-teaser-out-2884392-2026-03-19,2026-03-19T17:04:00+00:00
India Today,most_read,23,Is Israel using America as its own personal army to fight its war against Iran?,https://www.indiatoday.in/world/story/is-israel-using-america-as-its-own-personal-army-to-fight-its-war-against-iran-2884396-2026-03-19,2026-03-19T17:04:00+00:00
India Today,most_read,24,"Kuldeep, Vanshika look gorgeous in wedding ceremony, best-mate Chahal steals the show",https://www.indiatoday.in/sports/cricket/story/kuldeep-yadav-vanshika-pre-wedding-ceremony-yuzvendra-chahal-dance-2881657-2026-03-13,2026-03-19T17:04:00+00:00
India Today,most_read,25,Decoding Congress's Assam crisis: How BJP's strategic poaching deepens electoral woes,https://www.indiatoday.in/elections/assembly/story/bjp-strategic-poaching-congress-leaders-pradyut-bordoloi-bhupen-borah-crisis-assam-assembly-elections-2884355-2026-03-19,2026-03-19T17:04:00+00:00
India Today,most_read,26,Neena Gupta's Badhai Ho moment at 66? Actor reacts to rumours,https://www.indiatoday.in/movies/celebrities/story/neena-gupta-pregnancy-rumours-clarified-actress-denies-speculation-66-hyderabad-wedding-2881240-2026-03-13,2026-03-19T17:04:00+00:00
India Today,most_read,27,Fears of Iran strike on US soil? 'Doomsday' plane spotted over California,https://www.indiatoday.in/world/story/fears-of-iran-strike-on-us-soil-doomsday-plane-spotted-over-california-middle-east-conflict-2881153-2026-03-12,2026-03-19T17:04:00+00:00
India Today,most_read,28,"Iran's new Supreme Leader Mojtaba Khamenei lost a leg, is in coma: Report",https://www.indiatoday.in/world/story/irans-new-supreme-leader-mojtaba-khamenei-lost-a-leg-is-in-coma-after-strike-report-2881209-2026-03-13,2026-03-19T17:04:00+00:00
India Today,most_read,29,"Nashik 'Godman' drugged, raped woman for 3 years under religious guise, arrested",https://www.indiatoday.in/india/story/nashik-godman-ashok-kharat-rape-case-obscene-clips-sit-probe-2884363-2026-03-19,2026-03-19T17:04:00+00:00
India Today,most_read,30,Oil prices before and after US-Israel-Iran war,https://www.indiatoday.in/information/story/oil-prices-before-and-after-the-war-country-wise-checklist-of-global-fuel-hike-2884136-2026-03-19,2026-03-19T17:04:00+00:00
India Today,most_read,31,"Dhurandhar 2 Review, Release Live",https://www.indiatoday.in/movies/bollywood/story/dhurandhar-2-movie-release-review-live-updates-box-office-prediction-ranveer-singh-advance-booking-aditya-dhar-audience-reaction-2883589-2026-03-18,2026-03-19T17:04:00+00:00
India Today,most_read,32,Eid 2026 Moon Sighting Live,https://www.indiatoday.in/information/story/eid-ul-fitr-2026-moon-sighting-live-updates-chand-raat-timings-in-india-city-wise-2884015-2026-03-19,2026-03-19T17:04:00+00:00
