source,section,rank,headline,link,collected_at_iso
India Today,trending,15,"From rent to SIPs, Gurugram techie shares how she spends Rs 89,500 a month",https://www.indiatoday.in/trending-news/story/from-rent-to-sips-gurugram-techie-shares-how-she-spends-rs-89500-a-month-2880503-2026-03-11,2026-03-12T17:03:35+00:00
India Today,trending,16,"Indian H-1B worker stranded after visiting sick mother, US job now at risk",https://www.indiatoday.in/trending-news/story/indian-h-1b-worker-stranded-after-visiting-sick-mother-us-job-now-at-risk-2880493-2026-03-11,2026-03-12T17:03:35+00:00
India Today,trending,17,Portuguese woman moved to 2AC after uncomfortable encounter with men in Indian train,https://www.indiatoday.in/trending-news/story/portuguese-woman-moved-to-2ac-after-uncomfortable-encounter-with-men-in-indian-train-2880409-2026-03-11,2026-03-12T17:03:35+00:00
India Today,trending,18,"Israel promotes bomb shelter dating app amid war, trolled",https://www.indiatoday.in/trending-news/story/israel-introduces-bomb-shelter-dating-app-amid-ongoing-war-trolled-2880299-2026-03-11,2026-03-12T17:03:35+00:00
India Today,trending,19,Butter chicken ice cream exists and the internet is absolutely not ready for it,https://www.indiatoday.in/trending-news/story/butter-chicken-ice-cream-exists-and-the-internet-is-absolutely-not-ready-for-it-2880279-2026-03-11,2026-03-12T17:03:35+00:00
India Today,trending,20,"Bengaluru Uber driver finds wallet, tracks man to return it. People share similar tales",https://www.indiatoday.in/trending-news/story/bengaluru-uber-driver-finds-wallet-tracks-mumbai-man-to-return-it-people-share-similar-honest-tales-2880226-2026-03-11,2026-03-12T17:03:35+00:00
India Today,trending,21,‘The Khoslas are back’: Khosla Ka Ghosla 2 gets a release date. See it here,https://www.indiatoday.in/movies/bollywood/story/khosla-ka-ghosla-2-release-date-raksha-bandhan-20-years-cast-reunion-anupam-kher-ranvir-shorey-ravi-kishan-2881149-2026-03-12,2026-03-12T17:03:35+00:00
India Today,trending,22,Indian Wells: Djokovic admits bitter feeling after losing pre-quarters to Draper,https://www.indiatoday.in/sports/tennis/story/indian-wells-2026-novak-djokovic-vs-jack-draper-reaction-2881146-2026-03-12,2026-03-12T17:03:35+00:00
India Today,trending,23,Boycott SRH in IPL: SunRisers face backlash for buying Pak spinner in Hundred,https://www.indiatoday.in/sports/cricket/story/the-hundred-auction-abrar-ahmed-sunrisers-leeds-criticism-2881155-2026-03-12,2026-03-12T17:03:35+00:00
India Today,trending,24,"Suryakumar, Shivam Dube felicitated by Maharashtra CM Fadnavis for T20 World Cup win",https://www.indiatoday.in/sports/cricket/story/suryakumar-yadav-shivam-dube-meet-maharashtra-cm-fadnavis-mumbai-t20-world-cup-2026-2880351-2026-03-11,2026-03-12T17:03:35+00:00
India Today,trending,25,"Mushfiqur Rahim congratulates India for T20 World Cup win, 10 years after infamous post",https://www.indiatoday.in/sports/cricket/story/t20-world-cup-india-vs-new-zealand-mushfiqur-rahim-congrtulates-infamous-post-2879316-2026-03-09,2026-03-12T17:03:35+00:00
India Today,trending,26,Reminiscent of Viv Richards: Gavaskar's glowing verdict on Samson's World Cup heroics,https://www.indiatoday.in/sports/cricket/story/sunil-gavaskar-sanju-samson-viv-richards-t20-world-cup-player-tournament-2879822-2026-03-10,2026-03-12T17:03:35+00:00
India Today,trending,27,Hardik Pandya's viral victory PDA with Mahieka raises one question: Read the room,https://www.indiatoday.in/lifestyle/what-s-hot/story/hardik-pandyas-viral-victory-pda-with-mahieka-raises-one-question-read-the-room-2880995-2026-03-12,2026-03-12T17:03:35+00:00
India Today,trending,28,Another prediction backfires: Amir reacts angrily as India win T20 World Cup,https://www.indiatoday.in/sports/cricket/story/t20-world-cup-2026-mohammad-amir-angry-reaction-india-win-final-2879252-2026-03-09,2026-03-12T17:03:35+00:00
India Today,most_read,1,IND vs SA: Deepak Chahar likely to be ruled out of last 2 ODIs due to injury,https://www.indiatoday.in/sports/cricket/story/india-vs-south-africa-deepak-chahar-likely-to-be-ruled-out-of-last-2-odis-due-to-injury-2009550-2022-10-07,2026-03-12T17:03:35+00:00
India Today,most_read,2,Manchester City fined over pitch invasion to celebrate Premier League title win,https://www.indiatoday.in/sports/football/story/manchester-city-fined-by-fa-over-pitch-invasion-to-celebrate-premier-league-title-win-2009534-2022-10-07,2026-03-12T17:03:35+00:00
India Today,most_read,3,Chelsea manager Potter on first month in charge: We have made little bit of progress,https://www.indiatoday.in/sports/football/story/chelsea-manager-graham-potter-on-first-month-in-charge-we-have-made-little-bit-of-progress-2009531-2022-10-07,2026-03-12T17:03:35+00:00
India Today,most_read,4,'Travesty of justice’: Experts criticise errors in UN report on forced disappearances in Bangladesh,https://www.indiatoday.in/world/story/experts-criticise-error-un-report-on-forced-disappearances-in-bangladesh-2007495-2022-10-02,2026-03-12T17:03:35+00:00
India Today,most_read,5,"Fact Check: No alcohol, homosexuality? Conservative guidelines for FIFA World Cup NOT issued by Qatar govt",https://www.indiatoday.in/fact-check/story/fifa-world-cup-guidelines-fact-check-no-alcohol-homosexuality-conservative-guidelines-for-football-world-cup-not-issued-by-qatar-govt-2009495-2022-10-07,2026-03-12T17:03:35+00:00
India Today,most_read,6,"KGF star Yash meets F1 legend Lewis Hamilton, See pic",https://www.indiatoday.in/movies/regional-cinema/story/kgf-star-yash-meets-f1-legend-lewis-hamilton-see-pic-2009525-2022-10-07,2026-03-12T17:03:35+00:00
India Today,most_read,7,"IND vs PAK: Match against India brings out the best in Nida Dar, says Sana Mir",https://www.indiatoday.in/sports/cricket/story/india-vs-pakistan-match-against-india-brings-out-the-best-in-nida-dar-says-sana-mir-2009523-2022-10-07,2026-03-12T17:03:35+00:00
India Today,most_read,8,Women's Asia Cup: India coach Powar defends batting-order reshuffle in Pakistan loss,https://www.indiatoday.in/sports/cricket/story/women-s-asia-cup-india-coach-ramesh-powar-defends-batting-order-reshuffle-in-pakistan-defeat-2009522-2022-10-07,2026-03-12T17:03:35+00:00
India Today,most_read,9,"Gauri Sawant reacts to Sushmita Sen playing her in Taali, recalls their first meeting",https://www.indiatoday.in/entertainment/ott/story/gauri-sawant-reacts-to-sushmita-sen-playing-her-in-taali-recalls-their-first-meeting-2009520-2022-10-07,2026-03-12T17:03:35+00:00
India Today,most_read,10,"'We're all shattered': Loved ones, community hold vigil for slain Sikh family in US",https://www.indiatoday.in/india/story/community-loved-ones-hold-vigil-sikh-family-murder-us-merced-city-2009515-2022-10-07,2026-03-12T17:03:35+00:00
India Today,most_read,11,Richa Chadha wears dainty Bvlgari mangalsutra in stunning pics with husband Ali Fazal. Here’s the price,https://www.indiatoday.in/lifestyle/fashion/story/richa-chadha-wears-dainty-bvlgari-mangalsutra-in-stunning-pics-with-husband-ali-fazal-here-s-the-price-2009509-2022-10-07,2026-03-12T17:03:35+00:00
India Today,most_read,12,"What to watch on Netflix, Disney+ Hotstar and Amazon Prime Video this weekend",https://www.indiatoday.in/entertainment/ott/story/what-to-watch-on-netflix-disney-hotstar-and-amazon-prime-video-this-weekend-2009510-2022-10-07,2026-03-12T17:03:35+00:00
India Today,most_read,13,Karnataka govt to hike SC/ST reservation,https://www.indiatoday.in/india/story/karnataka-hike-sc-st-reservation-quota-justice-nagamohan-das-committee-report-2009505-2022-10-07,2026-03-12T17:03:35+00:00
India Today,most_read,14,"Delhi civic body identifies 250 mosquito breeding hotspots, launches drive",https://www.indiatoday.in/cities/delhi/story/delhi-civic-body-identifies-mosquito-breeding-hotspots-launches-drive-2009508-2022-10-07,2026-03-12T17:03:35+00:00
India Today,most_read,15,"Your weekly news quiz, October 7 | Play on",https://www.indiatoday.in/india/story/your-weekly-news-quiz-october-7-play-on-2009506-2022-10-07,2026-03-12T17:03:35+00:00
India Today,most_read,16,"Salman Khan was on Mohali RPG attacker's hitlist, says Delhi Police",https://www.indiatoday.in/india/story/delhi-police-arrest-mohali-rpg-attacker-salman-khan-was-on-hit-list-2009502-2022-10-07,2026-03-12T17:03:35+00:00
India Today,most_read,17,"Iran denies security forces killed 16-year-old, says she fell off roof",https://www.indiatoday.in/world/story/iran-security-forces-16-year-old-killed-protest-on-death-of-woman-in-police-custody-2009503-2022-10-07,2026-03-12T17:03:35+00:00
India Today,most_read,18,"Vande Bharat Express rams into cattle, suffers minor damage; 2nd incident in 2 days",https://www.indiatoday.in/india/story/vande-bharat-express-hits-cattle-suffers-minor-damage-gujarat-2009490-2022-10-07,2026-03-12T17:03:35+00:00
India Today,most_read,19,2 Madhya Pradesh Congress MLAs booked for harassing woman on train,https://www.indiatoday.in/crime/story/2-madhya-pradesh-congress-mlas-booked-for-harassing-woman-on-train-2009441-2022-10-07,2026-03-12T17:03:35+00:00
India Today,most_read,20,Rashmika Mandanna has no regrets for not being able to spend time with her sister. Here's why,https://www.indiatoday.in/movies/regional-cinema/story/rashmika-mandanna-has-no-regrets-for-not-being-able-to-spend-time-with-her-sister-here-s-why-2009492-2022-10-07,2026-03-12T17:03:35+00:00
India Today,most_read,21,‘The Khoslas are back’: Khosla Ka Ghosla 2 gets a release date. See it here,https://www.indiatoday.in/movies/bollywood/story/khosla-ka-ghosla-2-release-date-raksha-bandhan-20-years-cast-reunion-anupam-kher-ranvir-shorey-ravi-kishan-2881149-2026-03-12,2026-03-12T17:03:35+00:00
India Today,most_read,22,Indian Wells: Djokovic admits bitter feeling after losing pre-quarters to Draper,https://www.indiatoday.in/sports/tennis/story/indian-wells-2026-novak-djokovic-vs-jack-draper-reaction-2881146-2026-03-12,2026-03-12T17:03:35+00:00
India Today,most_read,23,Boycott SRH in IPL: SunRisers face backlash for buying Pak spinner in Hundred,https://www.indiatoday.in/sports/cricket/story/the-hundred-auction-abrar-ahmed-sunrisers-leeds-criticism-2881155-2026-03-12,2026-03-12T17:03:35+00:00
India Today,most_read,24,Ravi Shastri slammed after ruining India's T20 World Cup-winning moment on commentary,https://www.indiatoday.in/sports/cricket/story/ravi-shastri-ninth-wicket-commentary-gaffe-india-t20-world-cup-win-2879296-2026-03-09,2026-03-12T17:03:35+00:00
India Today,most_read,25,Hardik Pandya's viral victory PDA with Mahieka raises one question: Read the room,https://www.indiatoday.in/lifestyle/what-s-hot/story/hardik-pandyas-viral-victory-pda-with-mahieka-raises-one-question-read-the-room-2880995-2026-03-12,2026-03-12T17:03:35+00:00
India Today,most_read,26,India have ruined cricket: Salty Shoaib Akhtar reacts to one-sided T20 World Cup win,https://www.indiatoday.in/sports/cricket/story/ind-vs-nz-t20-world-cup-final-shoaib-akhtar-bizarre-claim-ruined-cricket-dominance-2879239-2026-03-09,2026-03-12T17:03:35+00:00
India Today,most_read,27,Sanju Samson's my dear pondatti message melts hearts after T20 World Cup heroics,https://www.indiatoday.in/sports/cricket/story/t20-world-cup-final-sanju-samson-wife-instagram-message-reaches-thiruvananthapuram-parents-2879524-2026-03-09,2026-03-12T17:03:35+00:00
India Today,most_read,28,"Woman removed from flight for playing video aloud, meltdown caught on camera",https://www.indiatoday.in/trending-news/story/woman-removed-from-american-airlines-flight-for-playing-video-aloud-meltdown-caught-on-camera-2880192-2026-03-11,2026-03-12T17:03:35+00:00
India Today,most_read,29,"Kylie Jenner goes topless in bold photoshoot, talks fame, career and motherhood",https://www.indiatoday.in/movies/hollywood/story/kylie-jenner-vanity-fair-spring-2026-cover-fashion-acting-ambitions-2880760-2026-03-12,2026-03-12T17:03:35+00:00
India Today,most_read,30,Jasprit Bumrah's Test credentials questioned by Alastair Cook after World Cup heroics,https://www.indiatoday.in/sports/cricket/story/alastair-cook-statement-on-jasprit-bumrah-test-record-best-bowler-tag-2881086-2026-03-12,2026-03-12T17:03:35+00:00
