source,section,rank,headline,link,collected_at_iso
Times of India,most_read,1,Middle East crisis: Iran confirms strike on Thai vessel in Strait of Hormuz; 3 crew members missing,https://timesofindia.indiatimes.com/articleshow/129457644.cms,2026-03-12T05:18:33+00:00
Times of India,most_read,2,"'Constantly humiliated, caused mental trauma': Mumbai dentist's chilling death note shocks kin; how troubled relationship ended in tragedy",https://timesofindia.indiatimes.com/articleshow/129432457.cms,2026-03-12T05:18:33+00:00
Times of India,most_read,3,"Indian shops, restaurants in UK's Wembley vandalised in targeted attacks",https://timesofindia.indiatimes.com/articleshow/129412559.cms,2026-03-12T05:18:33+00:00
Times of India,most_read,4,SC allows withdrawal of life support in Harish Rana passive euthanasia case,https://timesofindia.indiatimes.com/articleshow/129439934.cms,2026-03-12T05:18:33+00:00
Times of India,most_read,5,"US launches probe into 'unfair' trade practices by countries, India on list",https://timesofindia.indiatimes.com/articleshow/129485246.cms,2026-03-12T05:18:33+00:00
Times of India,most_read,6,How US busted a Japanese gangster seeking to sell nuke material to Iran,https://timesofindia.indiatimes.com/articleshow/129468748.cms,2026-03-12T05:18:33+00:00
Times of India,most_read,7,US strike likely hit Iran school due to outdated intel: Report,https://timesofindia.indiatimes.com/articleshow/129480497.cms,2026-03-12T05:18:33+00:00
Times of India,most_read,8,Gulf crisis: US to release 172M barrels of oil from strategic reserve to reduce prices,https://timesofindia.indiatimes.com/articleshow/129484532.cms,2026-03-12T05:18:33+00:00
Times of India,most_read,9,'India bigger than Pakistan': Imad slams critics downplaying T20 WC win,https://timesofindia.indiatimes.com/articleshow/129470852.cms,2026-03-12T05:18:33+00:00
Times of India,most_read,10,Iran keeps the US tied down. So why is China now pushing for mediation?,https://timesofindia.indiatimes.com/articleshow/129468416.cms,2026-03-12T05:18:33+00:00
Times of India,most_read,11,"USCIS issues 'alert', shares details of the form it will reject starting April 1",https://timesofindia.indiatimes.com/articleshow/129438108.cms,2026-03-12T05:18:33+00:00
Times of India,most_read,12,"'No need to panic, we’ll navigate': PM Modi on LPG shortage",https://timesofindia.indiatimes.com/articleshow/129473414.cms,2026-03-12T05:18:33+00:00
Times of India,most_read,13,"LPG crunch: Roti, dosa go off menus; more eateries shut operations across cities",https://timesofindia.indiatimes.com/articleshow/129483858.cms,2026-03-12T05:18:33+00:00
Times of India,most_read,14,"Close shave for Farooq Abdullah: Man aims gun at ex-J&K CM, pinned down in time - CCTV footage",https://timesofindia.indiatimes.com/articleshow/129473771.cms,2026-03-12T05:18:33+00:00
Times of India,most_read,15,Amazon to FCC: Reject application of Musk's SpaceX for Space data centers,https://timesofindia.indiatimes.com/articleshow/129229812.cms,2026-03-12T05:18:33+00:00
Times of India,most_read,16,Reliance to fund oil refinery in US; Donald Trump calls it 'historic $300 billion deal',https://timesofindia.indiatimes.com/articleshow/129484156.cms,2026-03-12T05:18:33+00:00
Times of India,most_read,17,Indian man's daring desert escape to Riyadh to flee Doha amid Iran vs US-Israel war,https://timesofindia.indiatimes.com/articleshow/129479024.cms,2026-03-12T05:18:33+00:00
Times of India,most_read,18,Motion for Speaker's removal defeated after fiery debate in Parliament,https://timesofindia.indiatimes.com/articleshow/129479989.cms,2026-03-12T05:18:33+00:00
Times of India,most_read,19,'Historic $300 billion deal': US to get new oil refinery with Reliance backing; Trump calls it 'massive win',https://timesofindia.indiatimes.com/articleshow/129431864.cms,2026-03-12T05:18:33+00:00
Times of India,most_read,20,"'Legitimate targets': Iran issues warning to US tech firms including Google, Amazon, Microsoft, Nvidia",https://timesofindia.indiatimes.com/articleshow/129450749.cms,2026-03-12T05:18:33+00:00
Times of India,most_read,21,Khushboo Sundar on World Cup trophy being taken to temple: 'The trophy is for India',https://timesofindia.indiatimes.com/articleshow/129450609.cms,2026-03-12T05:18:33+00:00
Times of India,most_read,22,"Middle East war enters day 12 as US, Israel unleash 'heaviest strikes' on Iran as Tehran rules out ceasefire",https://timesofindia.indiatimes.com/articleshow/129426206.cms,2026-03-12T05:18:33+00:00
Times of India,most_read,23,INDIA bloc MPs back TMC's motion to remove CEC Gyanesh Kumar; notice likely in Parliament soon,https://timesofindia.indiatimes.com/articleshow/129455884.cms,2026-03-12T05:18:33+00:00
Times of India,most_read,24,'Wish we had 2–3 players like him in Pakistan': Ex-cricketer's blunt take on this Indian cricketer,https://timesofindia.indiatimes.com/articleshow/129404319.cms,2026-03-12T05:18:33+00:00
Times of India,most_read,25,Where is Iran’s Supreme Leader? Officials drop hint on Mojtaba Khamenei’s condition amid intense US-Israel strikes,https://timesofindia.indiatimes.com/articleshow/129446157.cms,2026-03-12T05:18:33+00:00
Times of India,most_read,26,No-confidence motion against Lok Sabha Speaker Om Birla defeated by voice vote amid opposition protest,https://timesofindia.indiatimes.com/articleshow/129464444.cms,2026-03-12T05:18:33+00:00
Times of India,most_read,27,"MEA condemns attack on India-bound Thai ship, says innocent lives lost in conflict 'unacceptable'",https://timesofindia.indiatimes.com/articleshow/129470542.cms,2026-03-12T05:18:33+00:00
Times of India,most_read,28,Why Shivam Dube had to travel by train after India's T20 World Cup glory,https://timesofindia.indiatimes.com/articleshow/129452880.cms,2026-03-12T05:18:33+00:00
Times of India,most_read,29,‘That was the turning point’: Gautam Gambhir reveals moment that changed India’s T20 World Cup 2026 campaign,https://timesofindia.indiatimes.com/articleshow/129433020.cms,2026-03-12T05:18:33+00:00
Times of India,most_read,30,'Shubman Gill can’t get T20I captaincy': Former India cricketer makes shocking remark,https://timesofindia.indiatimes.com/articleshow/129460097.cms,2026-03-12T05:18:33+00:00
Times of India,most_read,31,'Brain-dead' woman jolted back to life by pothole in UP,https://timesofindia.indiatimes.com/articleshow/129417915.cms,2026-03-12T05:18:33+00:00
Times of India,most_read,32,Man diagnosed with cancer during office health checkup forced to quit: Corporate manager shares shocking workplace experience,https://timesofindia.indiatimes.com/articleshow/129448715.cms,2026-03-12T05:18:33+00:00
Times of India,most_read,33,Watch: US destroys multiple Iranian minelayers in Strait of Hormuz,https://timesofindia.indiatimes.com/articleshow/129432058.cms,2026-03-12T05:18:33+00:00
Times of India,most_read,34,Hansika Motwani officially divorced from husband Sohael Khaturiya after four years of marriage; actress didn't seek alimony,https://timesofindia.indiatimes.com/articleshow/129454629.cms,2026-03-12T05:18:33+00:00
Times of India,most_read,35,Reset or continuity? Gambhir and Agarkar face big calls after T20 World Cup triumph,https://timesofindia.indiatimes.com/articleshow/129434963.cms,2026-03-12T05:18:33+00:00
Times of India,most_read,36,"Meet Hardik Pandya’s girlfriend Mahieka Sharma: Know about her education, modelling journey, and fashion spotlight",https://timesofindia.indiatimes.com/articleshow/129441976.cms,2026-03-12T05:18:33+00:00
Times of India,most_read,37,'Global order & security will be at risk if ...': Iran's message to Pakistan PM Shehbaz Sharif,https://timesofindia.indiatimes.com/articleshow/129447921.cms,2026-03-12T05:18:33+00:00
Times of India,most_read,38,Iran almost bought China’s supersonic ‘aircraft-carrier killer’: How it could have changed the Middle East war,https://timesofindia.indiatimes.com/articleshow/129447969.cms,2026-03-12T05:18:33+00:00
Times of India,most_read,39,"PAK vs BAN, 1st ODI: Pakistan humbled in Bangladesh; hosts chase down target in 15.1 overs",https://timesofindia.indiatimes.com/articleshow/129461443.cms,2026-03-12T05:18:33+00:00
Times of India,most_read,40,"Amazon orders 90-day reset, here’s what the new policy means for engineers as well as director and VP-level leaders",https://timesofindia.indiatimes.com/articleshow/129459891.cms,2026-03-12T05:18:33+00:00
Times of India,most_read,41,Iran launches fresh strike on UAE: Two drones hit near Dubai airport; Indian among 4 injured,https://timesofindia.indiatimes.com/articleshow/129450005.cms,2026-03-12T05:18:33+00:00
Times of India,most_read,42,Kumbh Mela girl Monalisa Bhosle marries boyfriend Farman Khan in Kerala after seeking police help amid family opposition,https://timesofindia.indiatimes.com/articleshow/129470603.cms,2026-03-12T05:18:33+00:00
Times of India,most_read,43,"North Korea backs Iran's supreme leader Mojtaba Khamenei, slams US-Israel for 'destroying regional peace'",https://timesofindia.indiatimes.com/articleshow/129439321.cms,2026-03-12T05:18:33+00:00
Times of India,most_read,44,IPL Team Wise Match Schedule,https://timesofindia.indiatimes.com/articleshow/129471792.cms,2026-03-12T05:18:33+00:00
Times of India,most_read,45,Roger Federer Net Worth 2026,https://timesofindia.indiatimes.com/articleshow/129461520.cms,2026-03-12T05:18:33+00:00
Times of India,most_read,46,IPL 2026 Full Schedule,https://timesofindia.indiatimes.com/articleshow/129463764.cms,2026-03-12T05:18:33+00:00
Times of India,most_read,47,Gas supply chain,https://timesofindia.indiatimes.com/articleshow/129467815.cms,2026-03-12T05:18:33+00:00
Times of India,most_read,48,Barrel oil release,https://timesofindia.indiatimes.com/articleshow/129467523.cms,2026-03-12T05:18:33+00:00
Times of India,most_read,49,US stock market today,https://timesofindia.indiatimes.com/articleshow/129465722.cms,2026-03-12T05:18:33+00:00
Times of India,most_read,50,Dubai shared housing rules,https://timesofindia.indiatimes.com/articleshow/129480800.cms,2026-03-12T05:18:33+00:00
Times of India,most_read,51,Ex-DOGE engineer data access,https://timesofindia.indiatimes.com/articleshow/129479945.cms,2026-03-12T05:18:33+00:00
Times of India,most_read,52,Donald Trump threat,https://timesofindia.indiatimes.com/articleshow/129479009.cms,2026-03-12T05:18:33+00:00
Times of India,most_read,53,ElonTradess Dubai rant,https://timesofindia.indiatimes.com/articleshow/129476878.cms,2026-03-12T05:18:33+00:00
Times of India,most_read,54,Russian oil sovereignty,https://timesofindia.indiatimes.com/articleshow/129479476.cms,2026-03-12T05:18:33+00:00
Times of India,most_read,55,NCERT corruption chapter row,https://timesofindia.indiatimes.com/articleshow/129478790.cms,2026-03-12T05:18:33+00:00
Times of India,most_read,56,Knicks vs Jazz injury report,https://timesofindia.indiatimes.com/articleshow/129480214.cms,2026-03-12T05:18:33+00:00
Times of India,most_read,57,Cleveland Cavaliers vs Orlando Magic injury report,https://timesofindia.indiatimes.com/articleshow/129479472.cms,2026-03-12T05:18:33+00:00
Times of India,most_read,58,Archana Puran Singh,https://timesofindia.indiatimes.com/articleshow/129465477.cms,2026-03-12T05:18:33+00:00
Times of India,most_read,59,Tamannaah Bhatia House,https://timesofindia.indiatimes.com/articleshow/129405460.cms,2026-03-12T05:18:33+00:00
Times of India,most_read,60,Highest Paid South Actresses,https://timesofindia.indiatimes.com/articleshow/129433657.cms,2026-03-12T05:18:33+00:00
Times of India,most_read,61,Gen Z President,https://timesofindia.indiatimes.com/articleshow/129356746.cms,2026-03-12T05:18:33+00:00
Times of India,most_read,62,Cooked Chicken Shelf Life,https://timesofindia.indiatimes.com/articleshow/129348795.cms,2026-03-12T05:18:33+00:00
Times of India,most_read,63,Shivam Dube House,https://timesofindia.indiatimes.com/articleshow/129392063.cms,2026-03-12T05:18:33+00:00
Times of India,most_read,64,Nasa Satellite Crash,https://timesofindia.indiatimes.com/articleshow/129379719.cms,2026-03-12T05:18:33+00:00
Times of India,most_read,65,Indian Cobra VS Egyptian Cobra,https://timesofindia.indiatimes.com/articleshow/129376134.cms,2026-03-12T05:18:33+00:00
Times of India,most_read,66,Taylor Swift wedding,https://timesofindia.indiatimes.com/articleshow/129457649.cms,2026-03-12T05:18:33+00:00
Times of India,most_read,67,Alejandro Kirk Wife,https://timesofindia.indiatimes.com/articleshow/129434655.cms,2026-03-12T05:18:33+00:00
Times of India,most_read,68,Bill Belichick Girlfriend,https://timesofindia.indiatimes.com/articleshow/129434492.cms,2026-03-12T05:18:33+00:00
Times of India,most_read,69,University of Kentucky,https://timesofindia.indiatimes.com/articleshow/129481214.cms,2026-03-12T05:18:33+00:00
Times of India,most_read,70,YouTube unskippable ads,https://timesofindia.indiatimes.com/articleshow/129478838.cms,2026-03-12T05:18:33+00:00
Times of India,most_read,71,MrBeast $200 million giveaways,https://timesofindia.indiatimes.com/articleshow/129477769.cms,2026-03-12T05:18:33+00:00
Times of India,most_read,72,Robert Griffin III,https://timesofindia.indiatimes.com/articleshow/129477562.cms,2026-03-12T05:18:33+00:00
Times of India,most_read,73,Deshaun Watson net worth 2026,https://timesofindia.indiatimes.com/articleshow/129470778.cms,2026-03-12T05:18:33+00:00
Times of India,most_read,74,Maxx Crosby net worth 2026,https://timesofindia.indiatimes.com/articleshow/129476738.cms,2026-03-12T05:18:33+00:00
Times of India,most_read,75,Fortnite v40.00 update,https://timesofindia.indiatimes.com/articleshow/129475896.cms,2026-03-12T05:18:33+00:00
Times of India,most_read,76,Iran women soccer asylum,https://timesofindia.indiatimes.com/articleshow/129479163.cms,2026-03-12T05:18:33+00:00
Times of India,most_read,77,Nikita Kucherov net worth,https://timesofindia.indiatimes.com/articleshow/129479455.cms,2026-03-12T05:18:33+00:00
Times of India,most_read,78,Sarah Jane Ramos,https://timesofindia.indiatimes.com/articleshow/129479352.cms,2026-03-12T05:18:33+00:00
Times of India,most_read,79,Xiaomi 17 Ultra,https://timesofindia.indiatimes.com/articleshow/129442987.cms,2026-03-12T05:18:33+00:00
Times of India,most_read,80,Anthropic Ceo Dario Amodei,https://timesofindia.indiatimes.com/articleshow/129137566.cms,2026-03-12T05:18:33+00:00
Times of India,most_read,81,"Minnesota Timberwolves vs Los Angeles Clippers injury report: Who's playing, injured and questionable players, head-to-head records, team stats, and more (March 11, 2026)",https://timesofindia.indiatimes.com/articleshow/129484824.cms,2026-03-12T05:18:33+00:00
Times of India,most_read,82,"Is LaMelo Ball playing tonight vs the Sacramento Kings? Latest update on the Charlotte Hornets star's injury report (March 11, 2026)",https://timesofindia.indiatimes.com/articleshow/129484681.cms,2026-03-12T05:18:33+00:00
Times of India,most_read,83,Taylor Swift runs into unexpected trouble just as Travis Kelce returns to the Chiefs spotlight,https://timesofindia.indiatimes.com/articleshow/129460211.cms,2026-03-12T05:18:33+00:00
Times of India,most_read,84,"Sagittarius Horoscope Today, March 12,2026: Energy stays good, but your mind may feel scattered",https://timesofindia.indiatimes.com/articleshow/129457737.cms,2026-03-12T05:18:33+00:00
Times of India,most_read,85,Tennis star Panna Udvardy reveals chilling threat to lose Megasaray Hotels Open match as police rush to protect family,https://timesofindia.indiatimes.com/articleshow/129482351.cms,2026-03-12T05:18:33+00:00
Times of India,most_read,86,"Charlotte Hornets vs Sacramento Kings injury report: Who's playing, injured and questionable players, head-to-head records, team stats, and more (March 11, 2026)",https://timesofindia.indiatimes.com/articleshow/129484163.cms,2026-03-12T05:18:33+00:00
Times of India,most_read,87,“Brady’s upgraded and Giselle downgraded”: Gisele Bündchen dragged into Tom Brady–Alix Earle dating buzz as fans erupt online,https://timesofindia.indiatimes.com/articleshow/129458920.cms,2026-03-12T05:18:33+00:00
Times of India,most_read,88,Piers Morgan attacks Megan Rapinoe’s silence while Iranian women’s soccer players request asylum in Australia after anthem controversy,https://timesofindia.indiatimes.com/articleshow/129483707.cms,2026-03-12T05:18:33+00:00
Times of India,most_read,89,“She’s a gold digger”: Dak Prescott cheating drama grows as fans accuse Sarah Jane Ramos of chasing money,https://timesofindia.indiatimes.com/articleshow/129458040.cms,2026-03-12T05:18:33+00:00
Times of India,most_read,90,"‘Things will go wrong, don’t stress’: Allu Arjun’s advice to brother Allu Sirish before wedding with Nayanika Reddy",https://timesofindia.indiatimes.com/articleshow/129483838.cms,2026-03-12T05:18:33+00:00
Times of India,most_read,91,Who is Celestium? Twitch bans pink haired VTuber streamer for hateful conduct as she claims mass reports and fights suspension,https://timesofindia.indiatimes.com/articleshow/129483519.cms,2026-03-12T05:18:33+00:00
Times of India,most_read,92,Why streamer Sneako called Kai Trump Erewhon shopping video with Secret Service the most tone deaf vlog on the internet,https://timesofindia.indiatimes.com/articleshow/129483394.cms,2026-03-12T05:18:33+00:00
Times of India,most_read,93,Frank Leboeuf slams Ronald Araujo for embarrassing Champions League moment as Barcelona survive tense Newcastle draw,https://timesofindia.indiatimes.com/articleshow/129481100.cms,2026-03-12T05:18:33+00:00
Times of India,most_read,94,"Libra Horoscope Today, March 12,2026: Students can achieve their goals easily today",https://timesofindia.indiatimes.com/articleshow/129457434.cms,2026-03-12T05:18:33+00:00
Times of India,most_read,95,"You turned us into terrorists, says TMC MP as opposition slams Birla",https://timesofindia.indiatimes.com/articleshow/129482849.cms,2026-03-12T05:18:33+00:00
Times of India,trending,1,"etimesMeet the 'Mango Man of India' who nurtures Modi, Aishwarya and 348+ other varieties of mango on a single 125-year-old tree!Kalimullah Khan, the 'Mango Man of India', has cultivated a remarkable 125-year-old tree bearing over 350 distinct mango varieties. This Padma Shri awardee, who left school early, mastered grafting to create unique hybrids, even naming some after prominent figures. His dedication showcases a blend of traditional knowledge and innovative horticultural skill.",https://timesofindia.indiatimes.com/articleshow/129491138.cms,2026-03-12T05:18:33+00:00
Times of India,trending,2,etimesLPG shortage fears? Smart kitchen hacks every Indian home should know right now,https://timesofindia.indiatimes.com/articleshow/129489517.cms,2026-03-12T05:18:33+00:00
Times of India,trending,3,etimesDelhi’s biggest Metro fan? This man boards the first train of every new line– here’s his surprising story,https://timesofindia.indiatimes.com/articleshow/129475353.cms,2026-03-12T05:18:33+00:00
Times of India,trending,4,"etimesViral audio reveals ‘wealth mantra,' claims most people are taught the wrong path to getting richA viral audio clip on X, exceeding one million views, challenges traditional career advice, suggesting that while stability is offered, the path of studying hard and securing a job doesn't always lead to wealth. The discussion highlights that wealthy individuals often question systems and take calculated risks, a stark contrast to societal norms.",https://timesofindia.indiatimes.com/articleshow/129471565.cms,2026-03-12T05:18:33+00:00
Times of India,trending,5,"etimes‘I have been hungry since morning’: Swiggy rider breaks down after customers offer him a meal; viral video sparks debateA Swiggy delivery rider's emotional reaction to customers offering him a meal has gone viral, highlighting the hardships faced by gig workers. While many found the gesture heartwarming, others questioned the ethics of filming and sharing such a private moment. The incident sparks debate on publicizing acts of kindness and the realities of daily struggles for many.",https://timesofindia.indiatimes.com/articleshow/129467144.cms,2026-03-12T05:18:33+00:00
Times of India,trending,6,MLB Trade Rumors,https://timesofindia.indiatimes.com/articleshow/129486520.cms,2026-03-12T05:18:33+00:00
Times of India,trending,7,Sanju Samson Wife,https://timesofindia.indiatimes.com/articleshow/129490066.cms,2026-03-12T05:18:33+00:00
Times of India,trending,8,Oil Price Today,https://timesofindia.indiatimes.com/articleshow/129487734.cms,2026-03-12T05:18:33+00:00
Times of India,trending,9,LPG Supply Shortage,https://timesofindia.indiatimes.com/articleshow/129434012.cms,2026-03-12T05:18:33+00:00
Times of India,trending,10,"Watch: “It’s delicious!” Woman made butter chicken ice cream, but the internet says it’s “cursed”",https://timesofindia.indiatimes.com/articleshow/129463389.cms,2026-03-12T05:18:33+00:00
Times of India,trending,11,"Video: Child hangs and swings inside Mumbai Metro coach; authorities issue warning, call it a punishable offence",https://timesofindia.indiatimes.com/articleshow/129462963.cms,2026-03-12T05:18:33+00:00
Times of India,trending,12,Portuguese traveller recalls uncomfortable train moment: “One of the boys followed me and tried to open the bathroom door”,https://timesofindia.indiatimes.com/articleshow/129462600.cms,2026-03-12T05:18:33+00:00
Times of India,trending,13,MP shocker: Chilling video shows woman putting baby in scooter’s 'diggi' and riding off; netizens raise safety concerns,https://timesofindia.indiatimes.com/articleshow/129461873.cms,2026-03-12T05:18:33+00:00
Times of India,trending,14,Indian expat turns overnight millionaire: Takes home $1 million prize after big win in Dubai Duty Free draw,https://timesofindia.indiatimes.com/articleshow/129481585.cms,2026-03-12T05:18:33+00:00
Times of India,trending,15,"Indian traveller flees Doha, drives across desert to Riyadh after Chennai to Barcelona flight stranded amid Iran vs US-Israel war",https://timesofindia.indiatimes.com/articleshow/129479024.cms,2026-03-12T05:18:33+00:00
Times of India,trending,16,‘Claude discovers the Kobayashi Maru test’: What is the benchmark safety test the AI chatbot outsmarted?,https://timesofindia.indiatimes.com/articleshow/129479347.cms,2026-03-12T05:18:33+00:00
Times of India,trending,17,ElonTrades’s Dubai rant goes viral: Why crypto trader says he was asked to get license to post online in the UAE emirate,https://timesofindia.indiatimes.com/articleshow/129476878.cms,2026-03-12T05:18:33+00:00
Times of India,trending,18,‘He’s in trouble’: Trump’s niece and sharpest family critic on the real motive behind his Iran war,https://timesofindia.indiatimes.com/articleshow/129476203.cms,2026-03-12T05:18:33+00:00
Times of India,trending,19,"24,000 anti-Indian posts viewed 300 million times: Is America witnessing a surge in online hostility toward Indians?",https://timesofindia.indiatimes.com/articleshow/129466298.cms,2026-03-12T05:18:33+00:00
Times of India,trending,20,"Iran war enters day 13: Missiles fly, tankers burn, oil prices soar; what’s happening in Middle East?",https://timesofindia.indiatimes.com/articleshow/129490828.cms,2026-03-12T05:18:33+00:00
Times of India,trending,21,"'For our son, death is a release’: Harish Rana's father thanks SC for passive euthanasia ruling",https://timesofindia.indiatimes.com/articleshow/129472832.cms,2026-03-12T05:18:33+00:00
Times of India,trending,22,"Dial S for solutions: How Sachin Tendulkar helped Sanju Samson, and many others",https://timesofindia.indiatimes.com/articleshow/129490694.cms,2026-03-12T05:18:33+00:00
Times of India,trending,23,'Had frequent disputes with techie wife': IAF wing commander dies by suicide at home,https://timesofindia.indiatimes.com/articleshow/129490068.cms,2026-03-12T05:18:33+00:00
Times of India,trending,24,LPG Shortage in Mumbai,https://timesofindia.indiatimes.com/articleshow/129474176.cms,2026-03-12T05:18:33+00:00
Times of India,trending,25,Ex-DOGE engineer data access,https://timesofindia.indiatimes.com/articleshow/129479945.cms,2026-03-12T05:18:33+00:00
Times of India,trending,26,RCB IPL 2026 Schedule,https://timesofindia.indiatimes.com/articleshow/129490096.cms,2026-03-12T05:18:33+00:00
Times of India,trending,27,UPSC CSE Marksheet 2025,https://timesofindia.indiatimes.com/articleshow/129491433.cms,2026-03-12T05:18:33+00:00
Times of India,trending,28,MI IPL 2026 Schedule,https://timesofindia.indiatimes.com/articleshow/129491755.cms,2026-03-12T05:18:33+00:00
Times of India,trending,29,Russian oil sovereignty,https://timesofindia.indiatimes.com/articleshow/129479476.cms,2026-03-12T05:18:33+00:00
Times of India,trending,30,Farooq Abdullah firing incident,https://timesofindia.indiatimes.com/articleshow/129473771.cms,2026-03-12T05:18:33+00:00
Times of India,trending,31,NCERT corruption chapter row,https://timesofindia.indiatimes.com/articleshow/129478790.cms,2026-03-12T05:18:33+00:00
Times of India,trending,32,Om Birla removal motion,https://timesofindia.indiatimes.com/articleshow/129479989.cms,2026-03-12T05:18:33+00:00
Times of India,trending,33,Knicks vs Jazz injury report,https://timesofindia.indiatimes.com/articleshow/129480214.cms,2026-03-12T05:18:33+00:00
Times of India,trending,34,Cleveland Cavaliers vs Orlando Magic injury report,https://timesofindia.indiatimes.com/articleshow/129479472.cms,2026-03-12T05:18:33+00:00
Times of India,trending,35,Hansika Motwani Divorce News,https://timesofindia.indiatimes.com/articleshow/129454629.cms,2026-03-12T05:18:33+00:00
Times of India,trending,36,Archana Puran Singh,https://timesofindia.indiatimes.com/articleshow/129465477.cms,2026-03-12T05:18:33+00:00
Times of India,trending,37,Tamannaah Bhatia House,https://timesofindia.indiatimes.com/articleshow/129405460.cms,2026-03-12T05:18:33+00:00
Times of India,trending,38,Highest Paid South Actresses,https://timesofindia.indiatimes.com/articleshow/129433657.cms,2026-03-12T05:18:33+00:00
