source,section,rank,headline,link,collected_at_iso
Times of India,trending,44,RRB Group D Recruitment,https://timesofindia.indiatimes.com/articleshow/129308267.cms,2026-03-09T13:20:01+00:00
Times of India,trending,45,NMMS Admit Card,https://timesofindia.indiatimes.com/articleshow/129304165.cms,2026-03-09T13:20:01+00:00
Times of India,trending,46,RRB Paramedical Admit Card,https://timesofindia.indiatimes.com/articleshow/129306262.cms,2026-03-09T13:20:01+00:00
Times of India,trending,47,Pune Spiritual School Closure,https://timesofindia.indiatimes.com/articleshow/129299407.cms,2026-03-09T13:20:01+00:00
Times of India,trending,48,Who is Mojtaba Khamenei,https://timesofindia.indiatimes.com/articleshow/129292991.cms,2026-03-09T13:20:01+00:00
Times of India,trending,49,Middle East News,https://timesofindia.indiatimes.com/articleshow/129309840.cms,2026-03-09T13:20:01+00:00
Times of India,trending,50,Tarun Khatik Murder,https://timesofindia.indiatimes.com/articleshow/129311729.cms,2026-03-09T13:20:01+00:00
Times of India,trending,51,Vallabh Maheshwari Accident,https://timesofindia.indiatimes.com/articleshow/129312441.cms,2026-03-09T13:20:01+00:00
Times of India,trending,52,Delhi Excise Policy Case,https://timesofindia.indiatimes.com/articleshow/129314045.cms,2026-03-09T13:20:01+00:00
Times of India,trending,53,Gurgaon Scrap Yard Fire,https://timesofindia.indiatimes.com/articleshow/129317885.cms,2026-03-09T13:20:01+00:00
Times of India,trending,54,Manipuri Woman Assault,https://timesofindia.indiatimes.com/articleshow/129286480.cms,2026-03-09T13:20:01+00:00
Times of India,trending,55,DTC Bus Accident,https://timesofindia.indiatimes.com/articleshow/129317246.cms,2026-03-09T13:20:01+00:00
Times of India,trending,56,Karnataka Elephant Overpass,https://timesofindia.indiatimes.com/articleshow/129285616.cms,2026-03-09T13:20:01+00:00
Times of India,trending,57,Bengaluru Illegal Mortgage,https://timesofindia.indiatimes.com/articleshow/129285440.cms,2026-03-09T13:20:01+00:00
Times of India,trending,58,Air India Dented Bag Compensation,https://timesofindia.indiatimes.com/articleshow/129285653.cms,2026-03-09T13:20:01+00:00
Times of India,trending,59,Nashik Bribery Case,https://timesofindia.indiatimes.com/articleshow/129170597.cms,2026-03-09T13:20:01+00:00
Times of India,trending,60,Oppo Find N6,https://timesofindia.indiatimes.com/articleshow/129315468.cms,2026-03-09T13:20:01+00:00
Times of India,trending,61,Anthropic Ceo Dario Amodei,https://timesofindia.indiatimes.com/articleshow/129137566.cms,2026-03-09T13:20:01+00:00
Times of India,trending,62,"WGA Awards 2026 winners: Ryan Coogler, Paul Thomas Anderson, and 'The Pitt' score big",https://timesofindia.indiatimes.com/articleshow/129331797.cms,2026-03-09T13:20:01+00:00
Times of India,trending,63,“Don’t come sweating me later”: Manny Machado blasts media for skipping Dominican Republic’s WBC practice,https://timesofindia.indiatimes.com/articleshow/129335704.cms,2026-03-09T13:20:01+00:00
Times of India,trending,64,Auston Matthews and Toronto Maple Leafs facing familiar NHL playoff struggles once experienced by Alex Ovechkin and Washington Capitals,https://timesofindia.indiatimes.com/articleshow/129332680.cms,2026-03-09T13:20:01+00:00
Times of India,trending,65,‘He loved them’: Wife of Georgia teacher hit by truck in prank gone wrong wants charges against students dropped,https://timesofindia.indiatimes.com/articleshow/129335275.cms,2026-03-09T13:20:01+00:00
Times of India,trending,66,UPSC CSE Rank 301 row clarified after competing claims by two candidates named Akanksha Singh,https://timesofindia.indiatimes.com/articleshow/129333647.cms,2026-03-09T13:20:01+00:00
Times of India,trending,67,"After oil, war of water? Why desalination plants are turning into targets in Middle East – explained",https://timesofindia.indiatimes.com/articleshow/129334653.cms,2026-03-09T13:20:01+00:00
Times of India,trending,68,"70-year-old Canadian citizen living in North Carolina voted illegally for decades in US, faces up to 10 years",https://timesofindia.indiatimes.com/articleshow/129331107.cms,2026-03-09T13:20:01+00:00
Times of India,trending,69,"Petrol, diesel prices unlikely to rise; India has adequate fuel stocks: Report",https://timesofindia.indiatimes.com/articleshow/129334989.cms,2026-03-09T13:20:01+00:00
Times of India,trending,70,"Massive brawl in Mineiro Championship final leads to players getting record-breaking 23 red cards, Brazilian forward Hulk opens up on being hit",https://timesofindia.indiatimes.com/articleshow/129333709.cms,2026-03-09T13:20:01+00:00
Times of India,trending,71,Oracle responds to reports of ending expansion of Texas data centre with OpenAI; says: We continuously evaluate sites around the world to…,https://timesofindia.indiatimes.com/articleshow/129334955.cms,2026-03-09T13:20:01+00:00
Times of India,trending,72,Breaking out of ‘smaller team or small town’ jinx,https://timesofindia.indiatimes.com/articleshow/129334656.cms,2026-03-09T13:20:01+00:00
Times of India,trending,73,"Branded witch, tribal woman killed in Chhattisgarh; accused of being reason for illness, childlessness, husband among 4 held",https://timesofindia.indiatimes.com/articleshow/129334862.cms,2026-03-09T13:20:01+00:00
Times of India,trending,74,Miami Dolphins dump Tua Tagovailoa and swallow record $99 million cap hit after nightmare season,https://timesofindia.indiatimes.com/articleshow/129335008.cms,2026-03-09T13:20:01+00:00
Times of India,trending,75,Who are Emir Balat and Ibrahim Kayumi? Suspects in New York City IED attack identified as sons of Turkish and Afghan immigrants,https://timesofindia.indiatimes.com/articleshow/129332412.cms,2026-03-09T13:20:01+00:00
Times of India,trending,76,"Nathan MacKinnon’s 43rd goal, shootout magic powers Colorado Avalanche past Minnesota Wild in thriller between NHL heavyweights",https://timesofindia.indiatimes.com/articleshow/129333399.cms,2026-03-09T13:20:01+00:00
NDTV,most_read,1,"Opposition Ditches Om Birla Trust Vote, Trains Guns Over Iran War, Oil Shock",https://www.ndtv.com/india-news/iran-israel-war-parliament-budget-session-second-half-opposition-ditches-om-birla-trust-vote-trains-guns-over-iran-war-oil-shock-11190379,2026-03-09T13:20:01+00:00
NDTV,most_read,2,"High Court Cancels Congress MLA's Election, Declares BJP Ex-Minister Winner",https://www.ndtv.com/india-news/madhya-pradesh-high-court-cancels-congress-mla-mukesh-malhotras-election-declares-bjp-ex-minister-ramniwas-rawat-winner-11190192,2026-03-09T13:20:01+00:00
NDTV,most_read,3,Viral Sensations to First-Timers: Meet Nepal's Gen Z Poll Stars - Beyond Balen Shah,https://www.ndtv.com/opinion/viral-sensations-to-first-timers-meet-nepals-gen-z-poll-stars-11189932,2026-03-09T13:20:01+00:00
NDTV,most_read,4,"Class 10 Boy Surprised With Mahindra Thar After Board Exams, Parents Clarify",https://www.ndtv.com/india-news/we-are-responsible-citizens-parents-respond-after-mahindra-thar-surprise-for-class-10-student-sparks-outrage-11189925,2026-03-09T13:20:01+00:00
NDTV,most_read,5,5 Reasons Why Markets Shed A Whopping 12 Lakh Crore Valuation Today,https://www.ndtv.com/india-news/sensex-tanks-1-300-points-nifty-down-420-points-5-reasons-why-indian-stock-markets-tanked-11189701,2026-03-09T13:20:01+00:00
NDTV,most_read,6,"Punjab State Teacher Eligibility Test 2026: Admit Card Out, Download Link Here",https://www.ndtv.com/education/punjab-state-teacher-eligibility-test-2026-admit-card-out-download-link-here-11189693,2026-03-09T13:20:01+00:00
NDTV,most_read,7,"CBSE Class 12 Mathematics Exam: Check Paper Analysis, Student Reactions Here",https://www.ndtv.com/education/cbse-class-12-mathematics-exam-check-paper-analysis-student-reactions-here-11189498,2026-03-09T13:20:01+00:00
NDTV,most_read,8,"RRB NTPC Graduate Level Exam 2025: City Slip Out, Download Link Here",https://www.ndtv.com/education/rrb-ntpc-graduate-level-exam-2025-city-slip-out-download-link-here-11189156,2026-03-09T13:20:01+00:00
NDTV,most_read,9,Delhi Private School Removes Students From Class 12 Session Over Pending Fees,https://www.ndtv.com/education/east-delhi-mayur-vihar-school-strikes-off-4-class-12-students-over-unpaid-fees-11189079,2026-03-09T13:20:01+00:00
NDTV,most_read,10,CTET February 2026 Exam: Provisional Answer Key Likely To Be Out Soon,https://www.ndtv.com/education/ctet-february-2026-exam-provisional-answer-key-likely-to-be-out-soon-details-here-11189017,2026-03-09T13:20:01+00:00
NDTV,most_read,11,White House Sent 'WTF' Message To Israel After Iran Oil Field Strike,https://www.ndtv.com/world-news/iran-israel-war-us-wtf-message-israel-attacks-iran-oil-fields-oil-prices-rise-brent-crude-price-today-11188848,2026-03-09T13:20:01+00:00
NDTV,most_read,12,"Father, Mother, Wife, Son: Every Family Member Mojtaba Khamenei Lost In Iran War",https://www.ndtv.com/world-news/iran-israel-war-the-price-mojtaba-khamenei-paid-as-he-takes-over-as-iran-supreme-leader-11189998,2026-03-09T13:20:01+00:00
NDTV,most_read,13,"""One Phone Call From PM Modi To Israel And Iran Can End Issue"": UAE Envoy",https://www.ndtv.com/world-news/iran-israel-war-pm-narendra-modi-can-speak-to-iran-and-israel-to-end-war-uae-envoy-hussain-hassan-mirza-to-ndtv-11190307,2026-03-09T13:20:01+00:00
NDTV,most_read,14,"Iran War Creates A $35 Trillion 'Superpower', Bigger Than India and UK Combined",https://www.ndtv.com/india-news/iran-war-creates-a-35-trillion-superpower-bigger-than-india-and-uk-combined-11188957,2026-03-09T13:20:01+00:00
NDTV,most_read,15,LIVE: 10 Explosions Heard In Tel Aviv After Iran Launches New Missile Strikes,https://www.ndtv.com/world-news/iran-israel-war-live-updates-us-middle-east-crisis-news-mojtaba-khamenei-iran-new-supreme-leader-donald-trump-netanyahu-dubai-11187798,2026-03-09T13:20:01+00:00
NDTV,most_read,16,Trump Says Iran Will Work Like Venezuela. Here's How Different 2 Nations Are,https://www.ndtv.com/world-news/iran-israel-war-live-updates-donald-trump-venezuela-maduro-khamenei-iran-military-capability-11190236,2026-03-09T13:20:01+00:00
NDTV,most_read,17,Beloved US Teacher Dies After Prank By Students Goes Horribly Wrong,https://www.ndtv.com/world-news/beloved-us-teacher-dies-after-prank-by-students-goes-horribly-wrong-11188872,2026-03-09T13:20:01+00:00
NDTV,most_read,18,"Iran Defies Trump, Names Khamenei's Son Mojtaba As New Supreme Leader",https://www.ndtv.com/world-news/iran-israel-us-war-news-live-khameneis-son-mojtaba-khamenei-named-irans-new-supreme-leader-11187447,2026-03-09T13:20:01+00:00
NDTV,most_read,19,"""Trump, Look Them In The Eyes"": Tehran Times Frontpage's Grim Reminder",https://www.ndtv.com/world-news/iran-israel-war-live-updates-trump-look-them-in-the-eyes-tehran-times-frontpages-grim-reminder-11189544,2026-03-09T13:20:01+00:00
NDTV,most_read,20,Saudi Arabia Starts Reducing Oil Production As Hormuz Closure Fills Storage,https://www.ndtv.com/world-news/saudi-arabia-starts-reducing-oil-production-as-hormuz-closure-fills-storage-11190193,2026-03-09T13:20:01+00:00
NDTV,most_read,21,"Woman Claims She Was ""Touched Inappropriately"" By Scuba Instructor In Egypt",https://www.ndtv.com/world-news/solo-traveller-claims-she-was-touched-inappropriately-by-scuba-diving-instructor-in-egypt-11190164,2026-03-09T13:20:01+00:00
NDTV,most_read,22,Delhi To Manchester IndiGo Flight Makes U-Turn After 7 Hours Amid Iran War,https://www.ndtv.com/india-news/delhi-to-manchester-indigo-flight-makes-u-turn-after-7-hours-amid-iran-war-11189436,2026-03-09T13:20:01+00:00
NDTV,most_read,23,"Mojtaba Khamenei: Iran's New Supreme Leader, Often Seen As A 'Gatekeeper'",https://www.ndtv.com/world-news/mojtaba-khamenei-irans-new-supreme-leader-often-seen-as-a-gatekeeper-ayatollah-ali-khamenei-iran-war-iran-israel-war-11187888,2026-03-09T13:20:01+00:00
NDTV,most_read,24,Who Will Trump Attack Next? Hint: Follow The Chinese Money Trail,https://www.ndtv.com/opinion/us-iran-israel-war-whats-common-to-iran-venezuela-cuba-3-different-deals-and-a-chinese-channel-11188274,2026-03-09T13:20:01+00:00
NDTV,most_read,25,BJP Fact-Checks Mamata Banerjee's 'President Standing' Photo Attack On PM,https://www.ndtv.com/india-news/president-droupadi-murmu-pm-narendra-modi-mamata-banerjee-president-row-spirals-mamata-banerjees-targets-pm-modi-with-photo-proof-11188113,2026-03-09T13:20:01+00:00
NDTV,most_read,26,"Putin Offers ""Unwavering Support"" To Iran's New Supreme Leader",https://www.ndtv.com/world-news/israel-iran-war-putin-offers-unwavering-support-to-irans-new-supreme-leader-mojtaba-khamenei-11189915,2026-03-09T13:20:01+00:00
NDTV,most_read,27,Israel's Wide-Scale Strikes On Iran As Thousands Pledge Allegiance To Mojtaba,https://www.ndtv.com/world-news/israels-wide-scale-strikes-on-iran-as-thousands-pledge-allegiance-to-mojtaba-khamenei-11190081,2026-03-09T13:20:01+00:00
NDTV,most_read,28,"Mumbai Woman Pays Rs 1 Lakh Rent For 2 BHK In Parel, Sparks Debate",https://www.ndtv.com/offbeat/mumbai-woman-pays-rs-1-lakh-rent-for-2bhk-in-parel-sparks-debate-11186810,2026-03-09T13:20:01+00:00
NDTV,most_read,29,Why US Sanctioned Iran's New Supreme Leader Mojtaba Khamenei In 2019,https://www.ndtv.com/world-news/mojtaba-khamenei-why-irans-new-supreme-leader-was-sanctioned-by-us-in-2019-11188679,2026-03-09T13:20:01+00:00
NDTV,most_read,30,Shakun Group MD Dies In Rajasthan Crash: Here's All About The BMW i7 Involved,https://www.ndtv.com/auto/shakun-group-md-dies-in-rajasthan-crash-heres-all-about-the-bmw-i7-involved-11188698,2026-03-09T13:20:01+00:00
NDTV,most_read,31,Trisha's First Post After Attending Wedding Reception With Vijay In Chennai Amid Affair Rumours,https://www.ndtv.com/entertainment/trishas-first-post-after-attending-wedding-reception-with-vijay-in-chennai-amid-affair-rumours-11177184,2026-03-09T13:20:01+00:00
NDTV,most_read,32,"Mandana Karimi Is 'Leaving India' Due To Security Reasons: ""Doesn't Feel Like Home Anymore""",https://www.ndtv.com/entertainment/mandana-karimi-is-leaving-india-due-to-security-reasons-doesnt-feel-like-home-anymore-11163396,2026-03-09T13:20:01+00:00
NDTV,most_read,33,CBSE Class 12 Mathematics Board Exam Live,https://www.ndtv.com/education/cbse-board-exams-2026-live-updates-class-12-mathematics-paper-final-revision-plan-and-exam-day-guidelines-11187773,2026-03-09T13:20:01+00:00
NDTV,most_read,34,"Sensex Today | Nifty 50, Share Market Live Updates",https://www.ndtv.com/india-news/stock-marketlive-updates-sensex-nifty-likely-to-crash-as-oil-crosses-105-mark-11187870,2026-03-09T13:20:01+00:00
NDTV,most_read,35,S Jaishankar Speaks On Iran War LIVE Updates,https://www.ndtv.com/india-news/parliament-budget-session-live-updates-lok-sabha-pm-modi-speaker-om-birla-impeachment-middle-east-tension-s-jaishankar-address-iran-war-11188126,2026-03-09T13:20:01+00:00
NDTV,trending,1,"Opposition Ditches Om Birla Trust Vote, Trains Guns Over Iran War, Oil Shock",https://www.ndtv.com/india-news/iran-israel-war-parliament-budget-session-second-half-opposition-ditches-om-birla-trust-vote-trains-guns-over-iran-war-oil-shock-11190379,2026-03-09T13:20:01+00:00
NDTV,trending,2,"High Court Cancels Congress MLA's Election, Declares BJP Ex-Minister Winner",https://www.ndtv.com/india-news/madhya-pradesh-high-court-cancels-congress-mla-mukesh-malhotras-election-declares-bjp-ex-minister-ramniwas-rawat-winner-11190192,2026-03-09T13:20:01+00:00
NDTV,trending,3,Viral Sensations to First-Timers: Meet Nepal's Gen Z Poll Stars - Beyond Balen Shah,https://www.ndtv.com/opinion/viral-sensations-to-first-timers-meet-nepals-gen-z-poll-stars-11189932,2026-03-09T13:20:01+00:00
NDTV,trending,4,"Class 10 Boy Surprised With Mahindra Thar After Board Exams, Parents Clarify",https://www.ndtv.com/india-news/we-are-responsible-citizens-parents-respond-after-mahindra-thar-surprise-for-class-10-student-sparks-outrage-11189925,2026-03-09T13:20:01+00:00
NDTV,trending,5,5 Reasons Why Markets Shed A Whopping 12 Lakh Crore Valuation Today,https://www.ndtv.com/india-news/sensex-tanks-1-300-points-nifty-down-420-points-5-reasons-why-indian-stock-markets-tanked-11189701,2026-03-09T13:20:01+00:00
NDTV,trending,6,"Punjab State Teacher Eligibility Test 2026: Admit Card Out, Download Link Here",https://www.ndtv.com/education/punjab-state-teacher-eligibility-test-2026-admit-card-out-download-link-here-11189693,2026-03-09T13:20:01+00:00
NDTV,trending,7,"CBSE Class 12 Mathematics Exam: Check Paper Analysis, Student Reactions Here",https://www.ndtv.com/education/cbse-class-12-mathematics-exam-check-paper-analysis-student-reactions-here-11189498,2026-03-09T13:20:01+00:00
NDTV,trending,8,"RRB NTPC Graduate Level Exam 2025: City Slip Out, Download Link Here",https://www.ndtv.com/education/rrb-ntpc-graduate-level-exam-2025-city-slip-out-download-link-here-11189156,2026-03-09T13:20:01+00:00
NDTV,trending,9,Delhi Private School Removes Students From Class 12 Session Over Pending Fees,https://www.ndtv.com/education/east-delhi-mayur-vihar-school-strikes-off-4-class-12-students-over-unpaid-fees-11189079,2026-03-09T13:20:01+00:00
NDTV,trending,10,CTET February 2026 Exam: Provisional Answer Key Likely To Be Out Soon,https://www.ndtv.com/education/ctet-february-2026-exam-provisional-answer-key-likely-to-be-out-soon-details-here-11189017,2026-03-09T13:20:01+00:00
NDTV,trending,11,White House Sent 'WTF' Message To Israel After Iran Oil Field Strike,https://www.ndtv.com/world-news/iran-israel-war-us-wtf-message-israel-attacks-iran-oil-fields-oil-prices-rise-brent-crude-price-today-11188848,2026-03-09T13:20:01+00:00
NDTV,trending,12,"Father, Mother, Wife, Son: Every Family Member Mojtaba Khamenei Lost In Iran War",https://www.ndtv.com/world-news/iran-israel-war-the-price-mojtaba-khamenei-paid-as-he-takes-over-as-iran-supreme-leader-11189998,2026-03-09T13:20:01+00:00
NDTV,trending,13,"""One Phone Call From PM Modi To Israel And Iran Can End Issue"": UAE Envoy",https://www.ndtv.com/world-news/iran-israel-war-pm-narendra-modi-can-speak-to-iran-and-israel-to-end-war-uae-envoy-hussain-hassan-mirza-to-ndtv-11190307,2026-03-09T13:20:01+00:00
NDTV,trending,14,"Iran War Creates A $35 Trillion 'Superpower', Bigger Than India and UK Combined",https://www.ndtv.com/india-news/iran-war-creates-a-35-trillion-superpower-bigger-than-india-and-uk-combined-11188957,2026-03-09T13:20:01+00:00
NDTV,trending,15,LIVE: 10 Explosions Heard In Tel Aviv After Iran Launches New Missile Strikes,https://www.ndtv.com/world-news/iran-israel-war-live-updates-us-middle-east-crisis-news-mojtaba-khamenei-iran-new-supreme-leader-donald-trump-netanyahu-dubai-11187798,2026-03-09T13:20:01+00:00
NDTV,trending,16,Trump Says Iran Will Work Like Venezuela. Here's How Different 2 Nations Are,https://www.ndtv.com/world-news/iran-israel-war-live-updates-donald-trump-venezuela-maduro-khamenei-iran-military-capability-11190236,2026-03-09T13:20:01+00:00
NDTV,trending,17,Beloved US Teacher Dies After Prank By Students Goes Horribly Wrong,https://www.ndtv.com/world-news/beloved-us-teacher-dies-after-prank-by-students-goes-horribly-wrong-11188872,2026-03-09T13:20:01+00:00
NDTV,trending,18,"Iran Defies Trump, Names Khamenei's Son Mojtaba As New Supreme Leader",https://www.ndtv.com/world-news/iran-israel-us-war-news-live-khameneis-son-mojtaba-khamenei-named-irans-new-supreme-leader-11187447,2026-03-09T13:20:01+00:00
NDTV,trending,19,"""Trump, Look Them In The Eyes"": Tehran Times Frontpage's Grim Reminder",https://www.ndtv.com/world-news/iran-israel-war-live-updates-trump-look-them-in-the-eyes-tehran-times-frontpages-grim-reminder-11189544,2026-03-09T13:20:01+00:00
NDTV,trending,20,Saudi Arabia Starts Reducing Oil Production As Hormuz Closure Fills Storage,https://www.ndtv.com/world-news/saudi-arabia-starts-reducing-oil-production-as-hormuz-closure-fills-storage-11190193,2026-03-09T13:20:01+00:00
NDTV,trending,21,"Solo Traveller Claims She Was ""Touched Inappropriately"" By Scuba Diving Instructor In Egypt",https://www.ndtv.com/world-news/solo-traveller-claims-she-was-touched-inappropriately-by-scuba-diving-instructor-in-egypt-11190164,2026-03-09T13:20:01+00:00
NDTV,trending,22,Why Did India Win Men's T20 World Cup For The Third Time? Ask Amitabh Bachchan,https://www.ndtv.com/entertainment/why-did-india-win-mens-t20-world-cup-for-the-third-time-ask-amitabh-bachchan-11189456,2026-03-09T13:20:01+00:00
NDTV,trending,23,Trisha's First Post After Attending Wedding Reception With Vijay In Chennai Amid Affair Rumours,https://www.ndtv.com/entertainment/trishas-first-post-after-attending-wedding-reception-with-vijay-in-chennai-amid-affair-rumours-11177184,2026-03-09T13:20:01+00:00
NDTV,trending,24,"Randeep Hooda And Lin Laishram Share Priceless Moments From Maternity Photoshoot, See Pics",https://www.ndtv.com/entertainment/randeep-hooda-and-lin-laishram-share-priceless-moments-from-their-maternity-photoshoot-see-pics-11189386,2026-03-09T13:20:01+00:00
NDTV,trending,25,CBSE Class 12 Mathematics Board Exam Live,https://www.ndtv.com/education/cbse-board-exams-2026-live-updates-class-12-mathematics-paper-final-revision-plan-and-exam-day-guidelines-11187773,2026-03-09T13:20:01+00:00
NDTV,trending,26,"Sensex Today | Nifty 50, Share Market Live Updates",https://www.ndtv.com/india-news/stock-marketlive-updates-sensex-nifty-likely-to-crash-as-oil-crosses-105-mark-11187870,2026-03-09T13:20:01+00:00
NDTV,trending,27,S Jaishankar Speaks On Iran War LIVE Updates,https://www.ndtv.com/india-news/parliament-budget-session-live-updates-lok-sabha-pm-modi-speaker-om-birla-impeachment-middle-east-tension-s-jaishankar-address-iran-war-11188126,2026-03-09T13:20:01+00:00
India Today,trending,1,"Woman spots two rare 'doomsday fish' on Mexico beach, records surreal moment",https://www.indiatoday.in/trending-news/story/woman-spots-two-rare-doomsday-fish-oarfish-on-mexico-beach-records-surreal-moment-2879388-2026-03-09,2026-03-09T13:20:01+00:00
India Today,trending,2,"The Big BOOM Theory: GOAT is dead, all hail the new king",https://www.indiatoday.in/trending-news/story/the-big-boom-theory-goat-is-dead-all-hail-new-king-jasprit-bumrah-india-vs-new-zealand-final-t20-world-cup-2879366-2026-03-09,2026-03-09T13:20:01+00:00
India Today,trending,3,"Delhi, UP Police's Bumrah banter after India's T20 World Cup win goes viral",https://www.indiatoday.in/trending-news/story/delhi-police-up-police-bumrah-banter-after-india-t20-world-cup-win-goes-viral-2879299-2026-03-09,2026-03-09T13:20:01+00:00
India Today,trending,4,Chennai doctor hands newborn to nervous father in video with 198 million views,https://www.indiatoday.in/trending-news/story/chennai-doctor-hands-newborn-to-nervous-father-in-adorable-video-with-198-million-views-2879247-2026-03-09,2026-03-09T13:20:01+00:00
India Today,trending,5,Reddit user moved to Delhi from Assam expecting it to be expensive. And then...,https://www.indiatoday.in/trending-news/story/reddit-user-moved-to-delhi-from-assam-expecting-it-to-be-expensive-and-then-2879049-2026-03-08,2026-03-09T13:20:01+00:00
India Today,trending,6,Bengaluru man shares post about Ahmedabad's late-night vibe. Internet weighs in,https://www.indiatoday.in/trending-news/story/bengaluru-man-shares-post-about-ahmedabads-late-night-vibe-internet-weighs-in-2879024-2026-03-08,2026-03-09T13:20:01+00:00
India Today,trending,7,Australian High Commission celebrates women diplomats in Dhurandhar style,https://www.indiatoday.in/trending-news/story/australian-high-commission-celebrates-women-diplomats-in-dhurandhar-style-womens-day-2026-2879010-2026-03-08,2026-03-09T13:20:01+00:00
India Today,trending,8,Tamil Nadu principal sponsors first flight for 20 government school students,https://www.indiatoday.in/trending-news/story/tamil-nadu-principal-sponsors-first-flight-for-20-government-school-students-2878980-2026-03-08,2026-03-09T13:20:01+00:00
India Today,trending,9,Woman's clever hack for getting a seat in crowded Mumbai local wows 3 million,https://www.indiatoday.in/trending-news/story/womans-clever-hack-for-getting-a-seat-in-crowded-mumbai-local-wows-3-million-2878965-2026-03-08,2026-03-09T13:20:01+00:00
India Today,trending,10,"Indian businessman offers free shelter, pickup to travellers stranded in UAE",https://www.indiatoday.in/trending-news/story/indian-businessman-dhiraj-jain-offers-free-shelter-rolls-royce-pickup-to-travellers-stranded-in-uae-2878915-2026-03-08,2026-03-09T13:20:01+00:00
India Today,trending,11,IndiGo air hostesses briefly babysit toddler at boarding gate. Wholesome video,https://www.indiatoday.in/trending-news/story/indigo-air-hostesses-briefly-babysit-toddler-at-boarding-gate-wholesome-video-2878901-2026-03-08,2026-03-09T13:20:01+00:00
India Today,trending,12,"YouTuber claims to be stranded amid Middle East crisis, internet says fly economy",https://www.indiatoday.in/trending-news/story/youtuber-nonstop-dan-stranded-claims-amid-middle-east-crisis-internet-says-fly-economy-2878894-2026-03-08,2026-03-09T13:20:01+00:00
India Today,trending,13,Man shares why he 'trusted his gut' and walked away from Rs 26 lakh job offer,https://www.indiatoday.in/trending-news/story/man-shares-why-he-trusted-his-gut-and-walked-away-from-rs-26-lakh-job-offer-2878716-2026-03-07,2026-03-09T13:20:01+00:00
India Today,trending,14,Foreigner gets Mumbai local train passengers to dance to 'Saddi Galli'. Watch video,https://www.indiatoday.in/trending-news/story/foreigner-gets-mumbai-local-train-passengers-to-dance-to-saddi-galli-watch-video-2878676-2026-03-07,2026-03-09T13:20:01+00:00
India Today,trending,15,Russian tourist gets custom flip-flops made in Sri Lanka shop. Here's how it's done,https://www.indiatoday.in/trending-news/story/russian-tourist-gets-custom-flip-flops-made-in-sri-lanka-shop-heres-how-its-done-2878619-2026-03-07,2026-03-09T13:20:01+00:00
