source,section,rank,headline,link,collected_at_iso
Times of India,most_read,1,Former NBA legend Dwight Howard’s wife Amy Luciani makes shocking revelation about her marriage involving kids and CPS,https://timesofindia.indiatimes.com/articleshow/129249236.cms,2026-03-08T16:38:09+00:00
Times of India,most_read,2,"‘Legs tied, mouth stuffed with clothes’: Arya Vaidya Pharmacy founder’s daughter found dead in Coimbatore",https://timesofindia.indiatimes.com/articleshow/129154415.cms,2026-03-08T16:38:09+00:00
Times of India,most_read,3,"Mamata absent, no water in President Murmu's washroom, garbage on road: Centre, Bengal govt spar over 'lapses' at Santal event",https://timesofindia.indiatimes.com/articleshow/129256807.cms,2026-03-08T16:38:09+00:00
Times of India,most_read,4,'He diverted onto another road': Delhi tourist spends night hiding in Nainital forest after rape bid by taxi driver,https://timesofindia.indiatimes.com/articleshow/129226985.cms,2026-03-08T16:38:09+00:00
Times of India,most_read,5,Chetan Bhagat column: Can Bangalore beat back the AI monster?,https://timesofindia.indiatimes.com/articleshow/129214754.cms,2026-03-08T16:38:09+00:00
Times of India,most_read,6,'Why? Why? Why?' Mamata questions timing of President venue row before Bengal polls,https://timesofindia.indiatimes.com/articleshow/129262543.cms,2026-03-08T16:38:09+00:00
Times of India,most_read,7,"Dhoni and Rohit bring out T20 WC trophy, Ahmedabad crowd roars - Watch",https://timesofindia.indiatimes.com/articleshow/129272384.cms,2026-03-08T16:38:09+00:00
Times of India,most_read,8,"Missiles, drones and geography: How Iran challenged the US-Israel billion-dollar war machine",https://timesofindia.indiatimes.com/articleshow/129265567.cms,2026-03-08T16:38:09+00:00
Times of India,most_read,9,The latest dating fad for men: finding their 'sexual market value',https://timesofindia.indiatimes.com/articleshow/129222939.cms,2026-03-08T16:38:09+00:00
Times of India,most_read,10,Amazon sends letter to FCC saying: Reject application of Elon Musk's Spacex for Space data centers,https://timesofindia.indiatimes.com/articleshow/129229812.cms,2026-03-08T16:38:09+00:00
Times of India,most_read,11,"T20 World Cup Final: India attempt to defend crown, script record third T20 title in Ahmedabad",https://timesofindia.indiatimes.com/articleshow/129249318.cms,2026-03-08T16:38:09+00:00
Times of India,most_read,12,‘Apocalyptic’ scenes in Tehran: Massive inferno erupts after explosions – video,https://timesofindia.indiatimes.com/articleshow/129269565.cms,2026-03-08T16:38:09+00:00
Times of India,most_read,13,'Supreme commander ignored': TMC's Abhishek Banerjee targets Centre over President Murmu’s ‘snub’,https://timesofindia.indiatimes.com/articleshow/129270698.cms,2026-03-08T16:38:09+00:00
Times of India,most_read,14,"Groups representing 700,000 Amazon, Google, Microsoft workers urge firms to ‘do right’",https://timesofindia.indiatimes.com/articleshow/129193292.cms,2026-03-08T16:38:09+00:00
Times of India,most_read,15,Sinking Of IRIS Dena: US Navy warned crew before torpedo strike; over 80 killed in Indian Ocean,https://timesofindia.indiatimes.com/articleshow/129266828.cms,2026-03-08T16:38:09+00:00
Times of India,most_read,16,'Will not sign other bills until Save America Act is passed': Donald Trump,https://timesofindia.indiatimes.com/articleshow/129270334.cms,2026-03-08T16:38:09+00:00
Times of India,most_read,17,The little-known Jaipur connection of the T20 World Cup trophy,https://timesofindia.indiatimes.com/articleshow/129267711.cms,2026-03-08T16:38:09+00:00
Times of India,most_read,18,"130+ Happy International Women's Day Messages, Greetings Card, Wishes Whatsapp Story and Quotes for 2026",https://timesofindia.indiatimes.com/articleshow/129161916.cms,2026-03-08T16:38:09+00:00
Times of India,most_read,19,"‘Xi’s world order died with Khamenei’: The good, the bad, and ugly of US-Iran war for China",https://timesofindia.indiatimes.com/articleshow/129216408.cms,2026-03-08T16:38:09+00:00
Times of India,most_read,20,Murmu-Mamata row escalates: PM Modi says 'TMC govt crossed all limits'; Bengal CM advises President 'don't indulge in politics',https://timesofindia.indiatimes.com/articleshow/129218648.cms,2026-03-08T16:38:09+00:00
Times of India,most_read,21,"President Murmu unhappy over venue change, PM Modi calls it an 'insult'; Mamata hits back — what triggered Santal conference row",https://timesofindia.indiatimes.com/articleshow/129249832.cms,2026-03-08T16:38:09+00:00
Times of India,most_read,22,'Jhooth bol raha hai': India skipper Suryakumar Yadav hits back at Mitchell Santner's claim ahead of IND vs NZ final,https://timesofindia.indiatimes.com/articleshow/129248760.cms,2026-03-08T16:38:09+00:00
Times of India,most_read,23,Iran launches new solid-fuel missiles in latest barrage: What are they and what makes them different,https://timesofindia.indiatimes.com/articleshow/129248957.cms,2026-03-08T16:38:09+00:00
Times of India,most_read,24,"England leave, WI and SA stuck in India; Former captain slams ICC over unequal treatment",https://timesofindia.indiatimes.com/articleshow/129220288.cms,2026-03-08T16:38:09+00:00
Times of India,most_read,25,"At over 140 km/h with 80,000 watching live: Watch moment YouTuber UK07 Rider Anurag Dobhal crashes Fortuner on Delhi–Meerut Expressway",https://timesofindia.indiatimes.com/articleshow/129246591.cms,2026-03-08T16:38:09+00:00
Times of India,most_read,26,'Gautam Gambhir fought everyone': Shoaib Akhtar's stunning reveal on Sanju Samson's comeback,https://timesofindia.indiatimes.com/articleshow/129208329.cms,2026-03-08T16:38:09+00:00
Times of India,most_read,27,Explosion scare in Dubai Marina: UAE emirate confirms tower hit by falling debris from aerial interception amid Iran and US-Israel clashes,https://timesofindia.indiatimes.com/articleshow/129241550.cms,2026-03-08T16:38:09+00:00
Times of India,most_read,28,"Misreading Iran? A week into war, strategic risks for Trump and US are growing",https://timesofindia.indiatimes.com/articleshow/129220849.cms,2026-03-08T16:38:09+00:00
Times of India,most_read,29,"'Just in the dark': Quinton de Kock slams ICC as England leave but SA, WI remain stuck",https://timesofindia.indiatimes.com/articleshow/129225250.cms,2026-03-08T16:38:09+00:00
Times of India,most_read,30,Failed Israeli mission to recover pilot’s remains leaves 41 dead in Lebanon,https://timesofindia.indiatimes.com/articleshow/129255789.cms,2026-03-08T16:38:09+00:00
Times of India,most_read,31,"Watch: Israel strikes several oil depots in Iran; towering smoke, massive blaze light up skyline",https://timesofindia.indiatimes.com/articleshow/129246835.cms,2026-03-08T16:38:09+00:00
Times of India,most_read,32,IND vs NZ Final Match Timings: What time is India vs New Zealand T20 World Cup match?,https://timesofindia.indiatimes.com/articleshow/129255315.cms,2026-03-08T16:38:09+00:00
Times of India,most_read,33,Watch: First cricketer in 254 years! New Zealand bowler sets jaw-dropping world record,https://timesofindia.indiatimes.com/articleshow/129253812.cms,2026-03-08T16:38:09+00:00
Times of India,most_read,34,‘To take a little pressure off’: Donald Trump on temporary waiver for India to buy Russian oil amid Gulf crisis,https://timesofindia.indiatimes.com/articleshow/129243885.cms,2026-03-08T16:38:09+00:00
Times of India,most_read,35,'Forgive us': UAE President Mohamed bin Zayed Al Nahyan sends emotional message amid Iran vs US-Israel war,https://timesofindia.indiatimes.com/articleshow/129245694.cms,2026-03-08T16:38:09+00:00
Times of India,most_read,36,PM Modi inaugurates two new Delhi Metro corridors: Key routes and how they will help commuters,https://timesofindia.indiatimes.com/articleshow/129254488.cms,2026-03-08T16:38:09+00:00
Times of India,most_read,37,"India doesn't need permission to buy Russian oil, say officials",https://timesofindia.indiatimes.com/articleshow/129233524.cms,2026-03-08T16:38:09+00:00
Times of India,most_read,38,"“When I get a job, I’ll ....”: How a Hyderabad man built a massive food distribution network while working 9-5 in a corporate",https://timesofindia.indiatimes.com/articleshow/129229443.cms,2026-03-08T16:38:09+00:00
Times of India,most_read,39,Murder in Delhi's Uttam Nagar: MCD demolishes 'illegal portions' of accused's house,https://timesofindia.indiatimes.com/articleshow/129258695.cms,2026-03-08T16:38:09+00:00
Times of India,most_read,40,‘Decimated their whole evil empire’: Is US responsible for Iran school bombing that killed 160? What Trump said,https://timesofindia.indiatimes.com/articleshow/129246729.cms,2026-03-08T16:38:09+00:00
Times of India,most_read,41,Bengaluru woman ends life after argument with husband over sambar,https://timesofindia.indiatimes.com/articleshow/129229329.cms,2026-03-08T16:38:09+00:00
Times of India,most_read,42,"‘Dhurandhar 2’ update: Preview tickets soar and reach Rs 2400, sales run rampant",https://timesofindia.indiatimes.com/articleshow/129245663.cms,2026-03-08T16:38:09+00:00
Times of India,most_read,43,The girl in the frame and an aunt in the shadows: Could North Korea get its first female supreme leader?,https://timesofindia.indiatimes.com/articleshow/129214480.cms,2026-03-08T16:38:09+00:00
Times of India,most_read,44,"Dubai: British trainer Antonia Bettridge, 25, faces life in prison, ‘devastated’ mum speaks out",https://timesofindia.indiatimes.com/articleshow/129221646.cms,2026-03-08T16:38:09+00:00
Times of India,most_read,45,Indian Women Cricket Team,https://timesofindia.indiatimes.com/articleshow/129262521.cms,2026-03-08T16:38:09+00:00
Times of India,most_read,46,IND vs NZ Live Streaming,https://timesofindia.indiatimes.com/articleshow/129204799.cms,2026-03-08T16:38:09+00:00
Times of India,most_read,47,Ahmedabad Match Weather Update,https://timesofindia.indiatimes.com/articleshow/129207732.cms,2026-03-08T16:38:09+00:00
Times of India,most_read,48,T20 World Cup 2026 Closing Ceremony,https://timesofindia.indiatimes.com/articleshow/129210458.cms,2026-03-08T16:38:09+00:00
Times of India,most_read,49,Indian National Cricket Team,https://timesofindia.indiatimes.com/articleshow/129255728.cms,2026-03-08T16:38:09+00:00
Times of India,most_read,50,South Africa Cricket Team,https://timesofindia.indiatimes.com/articleshow/129258507.cms,2026-03-08T16:38:09+00:00
Times of India,most_read,51,IND vs NZ Match Security,https://timesofindia.indiatimes.com/articleshow/129266125.cms,2026-03-08T16:38:09+00:00
Times of India,most_read,52,Uttam Nagar murder,https://timesofindia.indiatimes.com/articleshow/129201500.cms,2026-03-08T16:38:09+00:00
Times of India,most_read,53,Women's Day Wishes,https://timesofindia.indiatimes.com/articleshow/129154869.cms,2026-03-08T16:38:09+00:00
Times of India,most_read,54,Happy Women's Day Wishes,https://timesofindia.indiatimes.com/articleshow/129217192.cms,2026-03-08T16:38:09+00:00
Times of India,most_read,55,Shah Rukh Khan,https://timesofindia.indiatimes.com/articleshow/129118674.cms,2026-03-08T16:38:09+00:00
Times of India,most_read,56,Dhurandhar 2 Trailer,https://timesofindia.indiatimes.com/articleshow/129195700.cms,2026-03-08T16:38:09+00:00
Times of India,most_read,57,Ahmedabad Police Traffic advisory,https://timesofindia.indiatimes.com/articleshow/129221351.cms,2026-03-08T16:38:09+00:00
Times of India,most_read,58,The Kerala Story 2,https://timesofindia.indiatimes.com/articleshow/129188287.cms,2026-03-08T16:38:09+00:00
Times of India,most_read,59,War News Anxiety,https://timesofindia.indiatimes.com/articleshow/129196764.cms,2026-03-08T16:38:09+00:00
Times of India,most_read,60,Bollywood War Movies,https://timesofindia.indiatimes.com/articleshow/129203388.cms,2026-03-08T16:38:09+00:00
Times of India,most_read,61,Women's Day Quotes,https://timesofindia.indiatimes.com/articleshow/129199745.cms,2026-03-08T16:38:09+00:00
Times of India,most_read,62,The Great Indian Kapil Show 4,https://timesofindia.indiatimes.com/articleshow/129125820.cms,2026-03-08T16:38:09+00:00
Times of India,most_read,63,Maruti Brezza Facelift Spied,https://timesofindia.indiatimes.com/articleshow/129146065.cms,2026-03-08T16:38:09+00:00
Times of India,most_read,64,Lab Grown Diamonds,https://timesofindia.indiatimes.com/articleshow/129090781.cms,2026-03-08T16:38:09+00:00
Times of India,most_read,65,Social Media Ban,https://timesofindia.indiatimes.com/articleshow/129152683.cms,2026-03-08T16:38:09+00:00
Times of India,most_read,66,Women’s Day AI Prompts,https://timesofindia.indiatimes.com/articleshow/129253033.cms,2026-03-08T16:38:09+00:00
Times of India,most_read,67,Israeli Drone Strike,https://timesofindia.indiatimes.com/articleshow/129246917.cms,2026-03-08T16:38:09+00:00
Times of India,most_read,68,ICAI CA Foundation Result,https://timesofindia.indiatimes.com/articleshow/129249758.cms,2026-03-08T16:38:09+00:00
Times of India,most_read,69,CUET PG Admit Card,https://timesofindia.indiatimes.com/articleshow/129252208.cms,2026-03-08T16:38:09+00:00
Times of India,most_read,70,NOC Vehicle Transfer,https://timesofindia.indiatimes.com/articleshow/129235789.cms,2026-03-08T16:38:09+00:00
Times of India,most_read,71,AIIMS Robotic Surgeries,https://timesofindia.indiatimes.com/articleshow/129253751.cms,2026-03-08T16:38:09+00:00
Times of India,most_read,72,Iran vs US Israel war,https://timesofindia.indiatimes.com/articleshow/129244551.cms,2026-03-08T16:38:09+00:00
Times of India,most_read,73,NEET UG 2026 Registration,https://timesofindia.indiatimes.com/articleshow/129191444.cms,2026-03-08T16:38:09+00:00
Times of India,most_read,74,NBEMS GPAT Answer Key 2026,https://timesofindia.indiatimes.com/articleshow/129247929.cms,2026-03-08T16:38:09+00:00
Times of India,most_read,75,ICAI CA Intermediate Toppers List,https://timesofindia.indiatimes.com/articleshow/129255037.cms,2026-03-08T16:38:09+00:00
Times of India,most_read,76,US Embassy Blast,https://timesofindia.indiatimes.com/articleshow/129253762.cms,2026-03-08T16:38:09+00:00
Times of India,most_read,77,Bareilly Twin Sister Murder,https://timesofindia.indiatimes.com/articleshow/129228428.cms,2026-03-08T16:38:09+00:00
Times of India,most_read,78,Delhi Uttam Nagar Murder,https://timesofindia.indiatimes.com/articleshow/129245083.cms,2026-03-08T16:38:09+00:00
Times of India,most_read,79,Abu Dhabi Zayed International Airport,https://timesofindia.indiatimes.com/articleshow/129122230.cms,2026-03-08T16:38:09+00:00
Times of India,most_read,80,Dubai travel update,https://timesofindia.indiatimes.com/articleshow/129257319.cms,2026-03-08T16:38:09+00:00
Times of India,most_read,81,Junaid-Nasir murder case,https://timesofindia.indiatimes.com/articleshow/129256430.cms,2026-03-08T16:38:09+00:00
Times of India,most_read,82,Vande Bharat Express,https://timesofindia.indiatimes.com/articleshow/129255542.cms,2026-03-08T16:38:09+00:00
Times of India,most_read,83,Delhi Metro corridors,https://timesofindia.indiatimes.com/articleshow/129254569.cms,2026-03-08T16:38:09+00:00
Times of India,most_read,84,MLB opening day,https://timesofindia.indiatimes.com/articleshow/129169077.cms,2026-03-08T16:38:09+00:00
Times of India,most_read,85,Mumbai Indians New IPL Jersey,https://timesofindia.indiatimes.com/articleshow/129151315.cms,2026-03-08T16:38:09+00:00
Times of India,most_read,86,Daylight Saving Time 2026,https://timesofindia.indiatimes.com/articleshow/129199541.cms,2026-03-08T16:38:09+00:00
Times of India,most_read,87,Electric Cars Vs Petrol Cars,https://timesofindia.indiatimes.com/articleshow/129200029.cms,2026-03-08T16:38:09+00:00
Times of India,most_read,88,Apple Macbook Air M5,https://timesofindia.indiatimes.com/articleshow/128978084.cms,2026-03-08T16:38:09+00:00
Times of India,most_read,89,Anthropic Ceo Dario Amodei,https://timesofindia.indiatimes.com/articleshow/129137566.cms,2026-03-08T16:38:09+00:00
Times of India,most_read,90,Nvidia China Dream,https://timesofindia.indiatimes.com/articleshow/129144522.cms,2026-03-08T16:38:09+00:00
Times of India,most_read,91,Macbook Neo VSMacbook Air,https://timesofindia.indiatimes.com/articleshow/129140491.cms,2026-03-08T16:38:09+00:00
Times of India,most_read,92,Before the alarm clock: How did people in the past wake up on time?,https://timesofindia.indiatimes.com/articleshow/129273076.cms,2026-03-08T16:38:09+00:00
Times of India,most_read,93,“They don’t understand tennis at all”: Carlos Alcaraz takes a dig at chair umpires over shot clock rules after winning Indian Wells opener,https://timesofindia.indiatimes.com/articleshow/129272137.cms,2026-03-08T16:38:09+00:00
Times of India,most_read,94,"“Tennis players are kind of dull”: Andrea Petkovic shares surprising dating advice about Carlos Alcaraz, Jannik Sinner and tennis stars",https://timesofindia.indiatimes.com/articleshow/129273337.cms,2026-03-08T16:38:09+00:00
Times of India,most_read,95,‘Deeply disappointed’: Amazon on cancelling Paris book festival sponsorship,https://timesofindia.indiatimes.com/articleshow/129263125.cms,2026-03-08T16:38:09+00:00
Times of India,most_read,96,Who was Sorffly Davius? NYPD officer and US Army major who died in Kuwait during Operation Epic Fury,https://timesofindia.indiatimes.com/articleshow/129272383.cms,2026-03-08T16:38:09+00:00
Times of India,most_read,97,From lighting lives to powering livelihoods: TERI's LaBL 2.0 targets the next billion,https://timesofindia.indiatimes.com/articleshow/129272964.cms,2026-03-08T16:38:09+00:00
Times of India,most_read,98,Bo Horvat’s clutch OT winner lifts New York Islanders past San Jose Sharks as rookie Matthew Schaefer makes NHL history,https://timesofindia.indiatimes.com/articleshow/129272920.cms,2026-03-08T16:38:09+00:00
Times of India,most_read,99,"International Women's Day: Stereotypes Are History, They’re Creating Future",https://timesofindia.indiatimes.com/articleshow/129272448.cms,2026-03-08T16:38:09+00:00
Times of India,most_read,100,"Oliver Rowland fulfills promise to cheer for protege Arvid Lindblad at Australian GP, flies from Dubai to Melbourne amid Middle East tension",https://timesofindia.indiatimes.com/articleshow/129272356.cms,2026-03-08T16:38:09+00:00
Times of India,most_read,101,Gold braces for volatile week as Middle East tensions escalate: Analysts,https://timesofindia.indiatimes.com/articleshow/129272455.cms,2026-03-08T16:38:09+00:00
Times of India,most_read,102,"Jr NTR’s visit at KIMS Hospitals sparks chaos, fans gather in large numbers, mob the actor, break escalator",https://timesofindia.indiatimes.com/articleshow/129272268.cms,2026-03-08T16:38:09+00:00
Times of India,most_read,103,"Optical illusion personality test: Elephant, lion, ostrich, flying birds, tree, face? The animal you see first reveals how your nervous system learned to survive",https://timesofindia.indiatimes.com/articleshow/129269611.cms,2026-03-08T16:38:09+00:00
Times of India,most_read,104,"Columbia University scales back proposed undergraduate expansion after criticism from faculty, students",https://timesofindia.indiatimes.com/articleshow/129259232.cms,2026-03-08T16:38:09+00:00
Times of India,most_read,105,Meet Dak Prescott: NFL’s highest-paid QB who turned Cowboys contract into a 50% net worth jump,https://timesofindia.indiatimes.com/articleshow/129260811.cms,2026-03-08T16:38:09+00:00
Times of India,most_read,106,"RRB Group D Recruitment 2026: Registration closes tomorrow for 22,195 Level-1 posts, direct link here",https://timesofindia.indiatimes.com/articleshow/129272378.cms,2026-03-08T16:38:09+00:00
Times of India,most_read,107,"NHL mourns Troy Murray: Remembering the Blackhawks legend, Selke winner and beloved broadcaster",https://timesofindia.indiatimes.com/articleshow/129271248.cms,2026-03-08T16:38:09+00:00
Times of India,most_read,108,Who inspired Novak Djokovic to play tennis? The Serbian star reveals two Wimbledon champions he grew up watching,https://timesofindia.indiatimes.com/articleshow/129271034.cms,2026-03-08T16:38:09+00:00
Times of India,trending,1,"etimesCobra encounter? Here’s the step-by-step guide to staying safeEncountering a cobra in India demands calm, not panic. Experts advise controlling reactions, avoiding sudden movements, and maintaining a safe distance. Recognizing warning signs like hood-raising is crucial. For indoor or public space sightings, always call trained rescue teams. Awareness of surroundings and keeping pets secure are key preventative measures.",https://timesofindia.indiatimes.com/articleshow/129274063.cms,2026-03-08T16:38:09+00:00
Times of India,trending,2,etimesStunning reunion story: Man missing since 2001 finds biological father through DNA test,https://timesofindia.indiatimes.com/articleshow/129273830.cms,2026-03-08T16:38:09+00:00
Times of India,trending,3,etimesWoman’s innovative idea to get a seat in Mumbai local crosses 3 million views– watch here,https://timesofindia.indiatimes.com/articleshow/129269278.cms,2026-03-08T16:38:09+00:00
Times of India,trending,4,"etimesWho is Kyle Long? The Ohio man charged with wife’s murder after claiming she stabbed herself 17 times – what to know about the caseA husband in London, Ohio, faces murder charges. His wife's death, initially thought to be self-inflicted, is now considered a homicide. Investigators found inconsistencies in his account. Autopsy revealed defensive wounds. The case took a dramatic turn after a four-month probe. He is held on a substantial bond as legal proceedings begin.",https://timesofindia.indiatimes.com/articleshow/129266770.cms,2026-03-08T16:38:09+00:00
Times of India,trending,5,"etimesUPSC rank 301 turns into a mystery as two candidates named Akanksha Singh claim itA unique controversy has emerged from the UPSC Civil Services Examination results. Two candidates named Akanksha Singh are claiming the same rank, 301. One claimant is from Bihar, the granddaughter of Brahmeshwar Singh. The other claimant is from Uttar Pradesh, alleging impersonation. An admit card circulating online has added to the confusion.",https://timesofindia.indiatimes.com/articleshow/129262221.cms,2026-03-08T16:38:09+00:00
Times of India,trending,6,Highest T20 Score by Team,https://timesofindia.indiatimes.com/articleshow/129277293.cms,2026-03-08T16:38:09+00:00
Times of India,trending,7,LPG Price Hike,https://timesofindia.indiatimes.com/articleshow/129179249.cms,2026-03-08T16:38:09+00:00
Times of India,trending,8,ICAI Result 2026,https://timesofindia.indiatimes.com/articleshow/129254799.cms,2026-03-08T16:38:09+00:00
Times of India,trending,9,From superbikes to 8 crore garage: How rich is UK07 Rider? Inside YouTuber Anurag Dobhal’s net worth,https://timesofindia.indiatimes.com/articleshow/129259052.cms,2026-03-08T16:38:09+00:00
Times of India,trending,10,India vs New Zealand T20 World Cup final: Why is Ahmedabad’s cricket ground trending as ‘Panauti stadium’ online,https://timesofindia.indiatimes.com/articleshow/129253759.cms,2026-03-08T16:38:09+00:00
Times of India,trending,11,"75+ Happy International Women's Day Messages, Greetings, Wishes and Quotes for 2026",https://timesofindia.indiatimes.com/articleshow/129161916.cms,2026-03-08T16:38:09+00:00
Times of India,trending,12,Meet Anjali Sardana: Indian entrepreneur who built $100 million startup after studying in US,https://timesofindia.indiatimes.com/articleshow/129267439.cms,2026-03-08T16:38:09+00:00
Times of India,trending,13,Meet Krishna Lunch: The $5 meal food truck becoming a lifeline for hungry LA students,https://timesofindia.indiatimes.com/articleshow/129264408.cms,2026-03-08T16:38:09+00:00
Times of India,trending,14,SNL mocks Kristi Noem’s exit with ‘self-deported’ joke in sharp cold open,https://timesofindia.indiatimes.com/articleshow/129260791.cms,2026-03-08T16:38:09+00:00
Times of India,trending,15,Ralph Lauren ‘jhumka’ earrings spark viral cultural appropriation debate after Paris Fashion Week show,https://timesofindia.indiatimes.com/articleshow/129257736.cms,2026-03-08T16:38:09+00:00
Times of India,trending,16,"Nagpur cafe’s black dosa shocks the internet, dosa lovers aren’t happy",https://timesofindia.indiatimes.com/articleshow/129220195.cms,2026-03-08T16:38:09+00:00
Times of India,trending,17,Who is Anurag Dobhal's brother Kalam Ink? The person who accused YouTuber UK 07 aka 'Babu Bhaiya' of harassment?,https://timesofindia.indiatimes.com/articleshow/129163171.cms,2026-03-08T16:38:09+00:00
Times of India,trending,18,"'UK07 Rider' Anurag Dobhal family row: ‘No issue with Ritika,’ says mother in audio, but YouTuber claims he was thrown out after marriage - audio vs claims",https://timesofindia.indiatimes.com/articleshow/129194506.cms,2026-03-08T16:38:09+00:00
Times of India,trending,19,Nuclear stockpile to Kharg Island: Why Trump wants to send special forces to Iran,https://timesofindia.indiatimes.com/articleshow/129273869.cms,2026-03-08T16:38:09+00:00
Times of India,trending,20,"Sanju Samson scripts history, breaks multiple records in T20 World Cup final",https://timesofindia.indiatimes.com/articleshow/129276280.cms,2026-03-08T16:38:09+00:00
Times of India,trending,21,How Middle East crisis is making life difficult in Bangladesh and Pakistan,https://timesofindia.indiatimes.com/articleshow/129274256.cms,2026-03-08T16:38:09+00:00
Times of India,trending,22,China Iran relation,https://timesofindia.indiatimes.com/articleshow/129216408.cms,2026-03-08T16:38:09+00:00
Times of India,trending,23,ICC T20 World Cup Trophy,https://timesofindia.indiatimes.com/articleshow/129272384.cms,2026-03-08T16:38:09+00:00
Times of India,trending,24,Highest T20 World Cup Final Score,https://timesofindia.indiatimes.com/articleshow/129277369.cms,2026-03-08T16:38:09+00:00
Times of India,trending,25,T20 World Cup 2026 Closing Ceremony,https://timesofindia.indiatimes.com/articleshow/129210458.cms,2026-03-08T16:38:09+00:00
