source,section,rank,headline,link,collected_at_iso
Times of India,trending,41,Eid 2026 Moon Sighting Timings,https://timesofindia.indiatimes.com/articleshow/129623899.cms,2026-03-19T19:08:18+00:00
Times of India,trending,42,Tata Sierra Bncap Crash Test,https://timesofindia.indiatimes.com/articleshow/129672493.cms,2026-03-19T19:08:18+00:00
Times of India,trending,43,Indian Cobra VS Egyptian Cobra,https://timesofindia.indiatimes.com/articleshow/129376134.cms,2026-03-19T19:08:18+00:00
Times of India,trending,44,Erika Kirk controversy,https://timesofindia.indiatimes.com/articleshow/129662549.cms,2026-03-19T19:08:18+00:00
Times of India,trending,45,Boston Celtics vs. Golden State Warriors,https://timesofindia.indiatimes.com/articleshow/129665683.cms,2026-03-19T19:08:18+00:00
Times of India,trending,46,Kenyon Martin wife,https://timesofindia.indiatimes.com/articleshow/129661900.cms,2026-03-19T19:08:18+00:00
Times of India,trending,47,MKBHD YouTube AI threat,https://timesofindia.indiatimes.com/articleshow/129662500.cms,2026-03-19T19:08:18+00:00
Times of India,trending,48,Marco Odermatt sister Alina,https://timesofindia.indiatimes.com/articleshow/129662946.cms,2026-03-19T19:08:18+00:00
Times of India,trending,49,Clavicular Kick earnings controversy,https://timesofindia.indiatimes.com/articleshow/129663977.cms,2026-03-19T19:08:18+00:00
Times of India,trending,50,Seth Jarvis NHL fine,https://timesofindia.indiatimes.com/articleshow/129662871.cms,2026-03-19T19:08:18+00:00
Times of India,trending,51,Travis Turner disappearance,https://timesofindia.indiatimes.com/articleshow/129664813.cms,2026-03-19T19:08:18+00:00
Times of India,trending,52,Rory McIlroy Masters menu,https://timesofindia.indiatimes.com/articleshow/129665356.cms,2026-03-19T19:08:18+00:00
Times of India,trending,53,YouTube Messaging Feature,https://timesofindia.indiatimes.com/articleshow/129664892.cms,2026-03-19T19:08:18+00:00
Times of India,trending,54,US Senator Elizabeth Warren,https://timesofindia.indiatimes.com/articleshow/129672596.cms,2026-03-19T19:08:18+00:00
Times of India,trending,55,Arossim project stalled over missing technical clearance,https://timesofindia.indiatimes.com/articleshow/129686571.cms,2026-03-19T19:08:18+00:00
Times of India,trending,56,Raze structures in Arpora fields: HC to panchayat,https://timesofindia.indiatimes.com/articleshow/129686530.cms,2026-03-19T19:08:18+00:00
Times of India,trending,57,"Who are Kevin Durant’s siblings? Inside the lives of Tony, Brianna, and Rayvonne",https://timesofindia.indiatimes.com/articleshow/129686002.cms,2026-03-19T19:08:18+00:00
Times of India,trending,58,SC declines to interfere with HC’s rejection of bail to trainer,https://timesofindia.indiatimes.com/articleshow/129686456.cms,2026-03-19T19:08:18+00:00
Times of India,trending,59,"MDM cooks, helpers protest salary delay, demand increase in honorarium",https://timesofindia.indiatimes.com/articleshow/129686454.cms,2026-03-19T19:08:18+00:00
Times of India,trending,60,"Streamer Tectone banned from YouTube for a week, calls platforms “over sanitized”",https://timesofindia.indiatimes.com/articleshow/129686410.cms,2026-03-19T19:08:18+00:00
Times of India,trending,61,Diamond deposits found in Nuapada,https://timesofindia.indiatimes.com/articleshow/129686396.cms,2026-03-19T19:08:18+00:00
Times of India,trending,62,"Day after suspension of 4 officials, Odisha govt fact-finding panel re-visits SCB hospital in Cuttack",https://timesofindia.indiatimes.com/articleshow/129686388.cms,2026-03-19T19:08:18+00:00
Times of India,trending,63,SCB Cuttack upgrade project delayed by two years,https://timesofindia.indiatimes.com/articleshow/129686218.cms,2026-03-19T19:08:18+00:00
Times of India,trending,64,IFL: Dempo at full strength for Gokulam challenge,https://timesofindia.indiatimes.com/articleshow/129686174.cms,2026-03-19T19:08:18+00:00
Times of India,trending,65,Dubai souks buzz as gold prices crash over Dh50 in UAE: Eid ul Fitr 2026 shoppers rush to buy,https://timesofindia.indiatimes.com/articleshow/129685120.cms,2026-03-19T19:08:18+00:00
Times of India,trending,66,"BJD, Cong continue pressing for Odisha health minister’s resignation",https://timesofindia.indiatimes.com/articleshow/129686107.cms,2026-03-19T19:08:18+00:00
Times of India,trending,67,AIFF’s academy team punished for age manipulation,https://timesofindia.indiatimes.com/articleshow/129686106.cms,2026-03-19T19:08:18+00:00
Times of India,trending,68,22-year-old drowns in Chatra dam,https://timesofindia.indiatimes.com/articleshow/129686058.cms,2026-03-19T19:08:18+00:00
Times of India,trending,69,Girl’s body found at Dhurwa dam,https://timesofindia.indiatimes.com/articleshow/129686059.cms,2026-03-19T19:08:18+00:00
Times of India,trending,70,Situation improving in Garo Hills: Conrad,https://timesofindia.indiatimes.com/articleshow/129686081.cms,2026-03-19T19:08:18+00:00
Times of India,trending,71,BMC launches drive to collect statistics on feeding stray dogs,https://timesofindia.indiatimes.com/articleshow/129686024.cms,2026-03-19T19:08:18+00:00
NDTV,most_read,1,"On Camera, Car Rams Bike In Gujarat's Vadodara, Biker Falls 10 Feet Away",https://www.ndtv.com/india-news/on-camera-car-rams-bike-in-gujarats-vadodara-biker-falls-10-feet-away-11240390,2026-03-19T19:08:18+00:00
NDTV,most_read,2,"Congress, Raijor Dal Finalise Assam Polls Alliance After Several Deadlocks",https://www.ndtv.com/india-news/congress-raijor-dal-finalise-assam-polls-alliance-after-several-deadlocks-11240382,2026-03-19T19:08:18+00:00
NDTV,most_read,3,Ground Report: Bhabanipur Weighs 'Bengal's Daughter' Versus Calls For Change,https://www.ndtv.com/india-news/west-bengal-elections-2026-ground-report-bhabanipur-weighs-bengals-daughter-versus-calls-for-change-11240374,2026-03-19T19:08:18+00:00
NDTV,most_read,4,"""Crossed All Boundaries"": Mamata Banerjee To Poll Body On Officials' Transfer",https://www.ndtv.com/india-news/crossed-all-boundaries-mamata-banerjee-to-poll-body-on-officials-transfer-11240369,2026-03-19T19:08:18+00:00
NDTV,most_read,5,New York-Mumbai Air India Flight Diverted To Saudi After Fire Indication,https://www.ndtv.com/india-news/new-york-mumbai-air-india-flight-diverted-to-saudi-arabia-after-fire-indication-11240355,2026-03-19T19:08:18+00:00
NDTV,most_read,6,"School Assembly News Headlines (March 20): Top National, World, Sports Updates",https://www.ndtv.com/education/school-assembly-news-headlines-march-20-top-national-world-sports-updates-11239687,2026-03-19T19:08:18+00:00
NDTV,most_read,7,IIT JAM Result Out 2026: Direct Link To Check Results And Download Scorecard,https://www.ndtv.com/education/iit-jam-result-out-2026-direct-link-to-check-results-and-download-scorecard-11239447,2026-03-19T19:08:18+00:00
NDTV,most_read,8,NCERT Issues Admit Cards for 2026 Non-Teaching Recruitment Exams,https://www.ndtv.com/education/ncert-issues-admit-cards-for-2026-non-teaching-recruitment-exams-11239232,2026-03-19T19:08:18+00:00
NDTV,most_read,9,Rajasthan Board 10th Result 2026 Not To Be Declared On March 20,https://www.ndtv.com/education/rajasthan-board-10th-result-2026-not-to-be-declared-on-march-20-11238421,2026-03-19T19:08:18+00:00
NDTV,most_read,10,"Bihar Board 10th Result 2026 Not To Be Released On March 20, Check Details",https://www.ndtv.com/education/bihar-board-10th-result-2026-not-to-be-released-on-march-20-heres-what-students-need-to-know-11238405,2026-03-19T19:08:18+00:00
NDTV,most_read,11,Kim Jong Un Wins 99.93% Votes In North Korea. Remaining 0.07% Went To...,https://www.ndtv.com/world-news/kim-jong-un-wins-99-93-votes-in-north-korea-parliamentary-elections-remaining-0-07-went-to-11236508,2026-03-19T19:08:18+00:00
NDTV,most_read,12,"US F-35 Hit By Suspected Iranian Fire, Makes Emergency Landing: Report",https://www.ndtv.com/world-news/iran-war-live-us-f-35-hit-by-suspected-iranian-fire-makes-emergency-landing-report-11239907,2026-03-19T19:08:18+00:00
NDTV,most_read,13,"In Big Step On Hormuz, UK, France Say Ready To ""Contribute"" To Safe Passage",https://www.ndtv.com/world-news/iran-israel-war-in-big-step-on-hormuz-uk-france-say-ready-to-contribute-to-safe-passage-11239597,2026-03-19T19:08:18+00:00
NDTV,most_read,14,"Hidden Cameras, 58 Women: Nashik Astrologer And His Farmhouse Of Secrets",https://www.ndtv.com/india-news/ashok-karat-captain-influential-astrologer-67-arrested-for-repeatedly-raping-35-year-old-woman-11238108,2026-03-19T19:08:18+00:00
NDTV,most_read,15,Iran War LIVE: Israel Did Not Drag US Into War With Iran: Netanyahu,https://www.ndtv.com/world-news/us-israel-iran-war-live-updates-iran-strikes-qatar-ras-laffan-lng-gulf-energy-sites-south-pars-oil-prices-strait-hormuz-iran-targets-gulf-energy-sites-11235957,2026-03-19T19:08:18+00:00
NDTV,most_read,16,"""He Lied to Me"": Woman In Coldplay Kiss-Cam Controversy Blames Former Boss",https://www.ndtv.com/feature/coldplay-kiss-cam-controversy-kirsten-cabot-says-andy-byron-lied-to-her-11238942,2026-03-19T19:08:18+00:00
NDTV,most_read,17,Iran Attacks World's Biggest Gas Hub In Qatar. How It Affects India,https://www.ndtv.com/india-news/iran-attacks-worlds-biggest-gas-hub-ras-laffan-in-qatar-how-it-affects-india-11236997,2026-03-19T19:08:18+00:00
NDTV,most_read,18,Iran Missile Attack Hits Oil Refinery In Israel's Haifa: Report,https://www.ndtv.com/world-news/iran-missile-attack-hits-oil-refinery-in-israels-haifa-report-11240065,2026-03-19T19:08:18+00:00
NDTV,most_read,19,"Two Indian-Origin Men Spit Paan In UK, Fined Over Rs 3 Lakh",https://www.ndtv.com/world-news/spitting-paan-in-the-uk-costs-two-indian-origin-men-over-rs-3-lakh-in-fines-11237598,2026-03-19T19:08:18+00:00
NDTV,most_read,20,"Explained: World's Largest Gas Field Hit, Puts 20% Global LNG Supply At Risk",https://www.ndtv.com/world-news/middle-east-iran-israel-war-explained-worlds-largest-gas-field-hit-puts-20-global-lng-supply-at-risk-11236743,2026-03-19T19:08:18+00:00
NDTV,most_read,21,US' TikTok-Style Iran War Clips Spark Backlash For Trivialising Conflict,https://www.ndtv.com/world-news/iran-war-live-us-tiktok-style-iran-war-clips-spark-backlash-for-trivialising-conflict-11240347,2026-03-19T19:08:18+00:00
NDTV,most_read,22,"Elon Musk Picks His Winners In Global AI Race, And It's Not xAI Or ChatGPT",https://www.ndtv.com/offbeat/elon-musk-picks-his-winner-in-the-global-ai-race-and-its-not-xai-or-chatgpt-11237392,2026-03-19T19:08:18+00:00
NDTV,most_read,23,'Patience Is Limited': Saudi Threatens To Join Gulf War Amid Iran's Attacks,https://www.ndtv.com/world-news/iran-war-news-live-gulf-states-have-significant-capabilities-saudis-big-warning-to-iran-11236925,2026-03-19T19:08:18+00:00
NDTV,most_read,24,"They Went To Dubai With A Dream, Now All They Want Is To Be Back In India",https://www.ndtv.com/india-news/iran-war-live-news-hyderabad-brothers-shoaib-sohail-went-to-dubai-with-a-dream-11239272,2026-03-19T19:08:18+00:00
NDTV,most_read,25,"'Stay-At-Home Daughter' Pays Rs 1.2 Lakh For 3BHK In Mumbai, Internet Reacts",https://www.ndtv.com/offbeat/mumbai-woman-pays-rs-1-2-lakh-rent-for-3bhk-in-andheri-west-identifies-as-stay-at-home-daughter-11236767,2026-03-19T19:08:18+00:00
NDTV,most_read,26,"HDFC Bank Chairman Quits Citing 'Ethical' Concerns, Shares Fall, RBI Reacts",https://www.ndtv.com/india-news/hdfc-bank-chairman-atanu-chakraborty-quits-citing-ethical-concerns-shares-plunge-11236076,2026-03-19T19:08:18+00:00
NDTV,most_read,27,"""Pakistan Has A History"": India On US Intel Chief's Nuclear Threat Remark",https://www.ndtv.com/world-news/pakistan-has-a-history-india-on-us-intel-chiefs-nuclear-threat-remark-11238736,2026-03-19T19:08:18+00:00
NDTV,most_read,28,"Highlights: Rs 12 Trillion Wiped Out Today As Sensex Crashes 2,400 Points",https://www.ndtv.com/india-news/sensex-today-stock-market-live-updates-share-market-nifty-crash-19-march-crude-oil-11236169,2026-03-19T19:08:18+00:00
NDTV,most_read,29,Watch: Doctor Shares Emotional Reunion With Former Teacher At Her Clinic,https://www.ndtv.com/offbeat/watch-doctor-shares-emotional-reunion-with-former-teacher-at-her-clinic-internet-calls-it-special-11240094,2026-03-19T19:08:18+00:00
NDTV,most_read,30,"Death, Survival, And Miraculous Escape: Fate Of 5 Brothers In Delhi Fire",https://www.ndtv.com/india-news/delhi-fire-palam-fire-rajender-kashyap-death-survival-and-miraculous-escape-fate-of-5-brothers-in-delhi-fire-11238218,2026-03-19T19:08:18+00:00
NDTV,most_read,31,Pakistani Singer Says Dhurandhar Team Paid Him Rs 46 Lakh For His Song Hawa Hawa,https://www.ndtv.com/entertainment/pakistani-singer-says-dhurandhar-team-paid-him-rs-46-lakh-for-his-song-hawa-hawa-11227176,2026-03-19T19:08:18+00:00
NDTV,most_read,32,"Anurag Dobhal Is ""Fighting Hard For His Life"" After Being Moved Out Of ICU, Says Manager",https://www.ndtv.com/entertainment/anurag-dobhal-is-fighting-hard-for-his-life-after-being-moved-out-of-icu-says-manager-11218723,2026-03-19T19:08:18+00:00
NDTV,most_read,33,"Dhurandhar 2 Release, Review LIVE Updates",https://www.ndtv.com/entertainment/dhurandhar-2-review-release-live-updates-reactions-ranveer-singh-aditya-dhar-r-madhavan-11235082,2026-03-19T19:08:18+00:00
NDTV,trending,1,"On Camera, Car Rams Bike In Gujarat's Vadodara, Biker Falls 10 Feet Away",https://www.ndtv.com/india-news/on-camera-car-rams-bike-in-gujarats-vadodara-biker-falls-10-feet-away-11240390,2026-03-19T19:08:18+00:00
NDTV,trending,2,"Congress, Raijor Dal Finalise Assam Polls Alliance After Several Deadlocks",https://www.ndtv.com/india-news/congress-raijor-dal-finalise-assam-polls-alliance-after-several-deadlocks-11240382,2026-03-19T19:08:18+00:00
NDTV,trending,3,Ground Report: Bhabanipur Weighs 'Bengal's Daughter' Versus Calls For Change,https://www.ndtv.com/india-news/west-bengal-elections-2026-ground-report-bhabanipur-weighs-bengals-daughter-versus-calls-for-change-11240374,2026-03-19T19:08:18+00:00
NDTV,trending,4,"""Crossed All Boundaries"": Mamata Banerjee To Poll Body On Officials' Transfer",https://www.ndtv.com/india-news/crossed-all-boundaries-mamata-banerjee-to-poll-body-on-officials-transfer-11240369,2026-03-19T19:08:18+00:00
NDTV,trending,5,New York-Mumbai Air India Flight Diverted To Saudi After Fire Indication,https://www.ndtv.com/india-news/new-york-mumbai-air-india-flight-diverted-to-saudi-arabia-after-fire-indication-11240355,2026-03-19T19:08:18+00:00
NDTV,trending,6,"School Assembly News Headlines (March 20): Top National, World, Sports Updates",https://www.ndtv.com/education/school-assembly-news-headlines-march-20-top-national-world-sports-updates-11239687,2026-03-19T19:08:18+00:00
NDTV,trending,7,IIT JAM Result Out 2026: Direct Link To Check Results And Download Scorecard,https://www.ndtv.com/education/iit-jam-result-out-2026-direct-link-to-check-results-and-download-scorecard-11239447,2026-03-19T19:08:18+00:00
NDTV,trending,8,NCERT Issues Admit Cards for 2026 Non-Teaching Recruitment Exams,https://www.ndtv.com/education/ncert-issues-admit-cards-for-2026-non-teaching-recruitment-exams-11239232,2026-03-19T19:08:18+00:00
NDTV,trending,9,Rajasthan Board 10th Result 2026 Not To Be Declared On March 20,https://www.ndtv.com/education/rajasthan-board-10th-result-2026-not-to-be-declared-on-march-20-11238421,2026-03-19T19:08:18+00:00
NDTV,trending,10,"Bihar Board 10th Result 2026 Not To Be Released On March 20, Check Details",https://www.ndtv.com/education/bihar-board-10th-result-2026-not-to-be-released-on-march-20-heres-what-students-need-to-know-11238405,2026-03-19T19:08:18+00:00
NDTV,trending,11,Kim Jong Un Wins 99.93% Votes In North Korea. Remaining 0.07% Went To...,https://www.ndtv.com/world-news/kim-jong-un-wins-99-93-votes-in-north-korea-parliamentary-elections-remaining-0-07-went-to-11236508,2026-03-19T19:08:18+00:00
NDTV,trending,12,"US F-35 Hit By Suspected Iranian Fire, Makes Emergency Landing: Report",https://www.ndtv.com/world-news/iran-war-live-us-f-35-hit-by-suspected-iranian-fire-makes-emergency-landing-report-11239907,2026-03-19T19:08:18+00:00
NDTV,trending,13,"In Big Step On Hormuz, UK, France Say Ready To ""Contribute"" To Safe Passage",https://www.ndtv.com/world-news/iran-israel-war-in-big-step-on-hormuz-uk-france-say-ready-to-contribute-to-safe-passage-11239597,2026-03-19T19:08:18+00:00
NDTV,trending,14,Ranveer Said Rakesh Deserves Rs 500 Crore For Dhurandhar 2 (Condition Applied),https://www.ndtv.com/entertainment/ranveer-singh-said-rakesh-bedi-deserves-rs-500-crore-if-dhurandhar-2-makes-rs-1-000-crore-11237876,2026-03-19T19:08:18+00:00
NDTV,trending,15,"Hidden Cameras, 58 Women: Nashik Astrologer And His Farmhouse Of Secrets",https://www.ndtv.com/india-news/ashok-karat-captain-influential-astrologer-67-arrested-for-repeatedly-raping-35-year-old-woman-11238108,2026-03-19T19:08:18+00:00
NDTV,trending,16,Iran Attacks World's Biggest Gas Hub In Qatar. How It Affects India,https://www.ndtv.com/india-news/iran-attacks-worlds-biggest-gas-hub-ras-laffan-in-qatar-how-it-affects-india-11236997,2026-03-19T19:08:18+00:00
NDTV,trending,17,"""He Lied to Me"": Woman In Coldplay Kiss-Cam Controversy Blames Former Boss",https://www.ndtv.com/feature/coldplay-kiss-cam-controversy-kirsten-cabot-says-andy-byron-lied-to-her-11238942,2026-03-19T19:08:18+00:00
NDTV,trending,18,"Dhurandhar 2 Review: Ranveer Singh Goes To Pakistan, Gifts India A Blockbuster",https://www.ndtv.com/entertainment/dhurandhar-2-review-ranveer-singh-goes-to-karachi-gifts-india-a-blockbuster-3-stars-11235302,2026-03-19T19:08:18+00:00
NDTV,trending,19,Iran Missile Attack Hits Oil Refinery In Israel's Haifa: Report,https://www.ndtv.com/world-news/iran-missile-attack-hits-oil-refinery-in-israels-haifa-report-11240065,2026-03-19T19:08:18+00:00
NDTV,trending,20,Iran War LIVE: Iran Intensifies Strikes On Middle East Energy Facilities,https://www.ndtv.com/world-news/us-israel-iran-war-live-updates-iran-strikes-qatar-ras-laffan-lng-gulf-energy-sites-south-pars-oil-prices-strait-hormuz-iran-targets-gulf-energy-sites-11235957,2026-03-19T19:08:18+00:00
NDTV,trending,21,"Explained: World's Largest Gas Field Hit, Puts 20% Global LNG Supply At Risk",https://www.ndtv.com/world-news/middle-east-iran-israel-war-explained-worlds-largest-gas-field-hit-puts-20-global-lng-supply-at-risk-11236743,2026-03-19T19:08:18+00:00
NDTV,trending,22,"Two Indian-Origin Men Spit Paan In UK, Fined Over Rs 3 Lakh",https://www.ndtv.com/world-news/spitting-paan-in-the-uk-costs-two-indian-origin-men-over-rs-3-lakh-in-fines-11237598,2026-03-19T19:08:18+00:00
NDTV,trending,23,Exclusive: Rakesh Bedi's 'Verdict' Counter To Dhurandhar 2 'Propaganda' Attack,https://www.ndtv.com/entertainment/rakesh-bedi-to-ndtv-about-dhurandhar-2-being-called-propaganda-verdict-is-out-11239396,2026-03-19T19:08:18+00:00
NDTV,trending,24,Dhurandhar 2 Release Highlights: Aditya Dhar And Others Attend Screening,https://www.ndtv.com/entertainment/dhurandhar-2-review-release-live-updates-reactions-ranveer-singh-aditya-dhar-r-madhavan-11235082,2026-03-19T19:08:18+00:00
NDTV,trending,25,US' TikTok-Style Iran War Clips Spark Backlash For Trivialising Conflict,https://www.ndtv.com/world-news/iran-war-live-us-tiktok-style-iran-war-clips-spark-backlash-for-trivialising-conflict-11240347,2026-03-19T19:08:18+00:00
NDTV,trending,26,"HDFC Bank Chairman Quits Citing 'Ethical' Concerns, Shares Fall, RBI Reacts",https://www.ndtv.com/india-news/hdfc-bank-chairman-atanu-chakraborty-quits-citing-ethical-concerns-shares-plunge-11236076,2026-03-19T19:08:18+00:00
NDTV,trending,27,"Sneha Ullal Recalls Meeting Aishwarya Rai, Speaks About Salman Khan's Behaviour On Lucky Set",https://www.ndtv.com/entertainment/sneha-ullal-recalls-meeting-aishwarya-rai-speaks-about-salman-khans-behaviour-on-lucky-set-11226149,2026-03-19T19:08:18+00:00
NDTV,trending,28,"Sara Arjun's Father Recalls His Struggling Phase, Says Daughter 'Took Care Of Him Like A Dhurandhar'",https://www.ndtv.com/entertainment/sara-arjuns-father-recalls-his-struggling-phase-says-daughter-took-care-of-him-like-a-dhurandhar-11237852,2026-03-19T19:08:18+00:00
NDTV,trending,29,Stock Market LIVE Updates,https://www.ndtv.com/india-news/sensex-today-stock-market-live-updates-share-market-nifty-crash-19-march-crude-oil-11236169,2026-03-19T19:08:18+00:00
India Today,trending,1,"North Korea's Kim Jong Un scores near-perfect election win, memes follow",https://www.indiatoday.in/trending-news/story/north-koreas-kim-jong-un-scores-near-perfect-election-win-memes-follow-2884372-2026-03-19,2026-03-19T19:08:18+00:00
India Today,trending,2,"Lebanese artist plays the cello in war-torn Beirut, internet calls it haunting",https://www.indiatoday.in/trending-news/story/lebanese-artist-plays-the-cello-in-war-torn-beirut-amid-iranian-missile-strikes-internet-calls-it-haunting-2884359-2026-03-19,2026-03-19T19:08:18+00:00
India Today,trending,3,US woman gets ready to celebrate her 96th birthday with viral 'I feel 26' video,https://www.indiatoday.in/trending-news/story/us-woman-gets-ready-to-celebrate-her-96th-birthday-with-viral-i-feel-26-video-2884195-2026-03-19,2026-03-19T19:08:18+00:00
India Today,trending,4,"Delhi man catches woman stealing red-handed, confronts her in crowded market",https://www.indiatoday.in/trending-news/story/delhi-man-catches-woman-stealing-red-handed-confronts-her-in-crowded-market-2884153-2026-03-19,2026-03-19T19:08:18+00:00
India Today,trending,5,This Mumbai woman said she's a 'stay-at-home daughter'. Here's what she means,https://www.indiatoday.in/trending-news/story/this-mumbai-woman-said-shes-a-stay-at-home-daughter-heres-what-she-means-2884123-2026-03-19,2026-03-19T19:08:18+00:00
India Today,trending,6,"Viewers think this 'bird orchestra' from Tamil Nadu is AI. But, it's super real",https://www.indiatoday.in/trending-news/story/viewers-think-this-bird-orchestra-video-from-tamil-nadu-is-ai-but-it-is-super-real-2884105-2026-03-19,2026-03-19T19:08:18+00:00
India Today,trending,7,"This 'futuristic' Maharashtra village has water ATMs, clean streets and even a gym",https://www.indiatoday.in/trending-news/story/adachiwadi-futuristicmaharashtra-village-has-water-atms-clean-streets-and-even-a-gym-2884073-2026-03-19,2026-03-19T19:08:18+00:00
India Today,trending,8,Woman's London Tube ride leads to a Bengaluru Metro realisation. See post,https://www.indiatoday.in/trending-news/story/woman-london-tube-ride-leads-to-a-bengaluru-metro-realisation-see-post-2884047-2026-03-19,2026-03-19T19:08:18+00:00
India Today,trending,9,"Techie's 'Gas gone, heat rod on' hack to cook food goes viral amid LPG crisis",https://www.indiatoday.in/trending-news/story/techies-gas-gone-heat-rod-on-hack-to-cook-food-goes-viral-amid-lpg-crisis-2884021-2026-03-19,2026-03-19T19:08:18+00:00
India Today,trending,10,Man shares 'flight-like' services in Vande Bharat sleeper train. Video goes viral,https://www.indiatoday.in/trending-news/story/man-shares-flight-like-services-in-vande-bharat-sleeper-train-video-goes-viral-2883873-2026-03-18,2026-03-19T19:08:18+00:00
India Today,trending,11,"Passenger finds AC vents sealed with tape in Mumbai-Ujjain train, records video",https://www.indiatoday.in/trending-news/story/passenger-finds-ac-vents-sealed-with-tape-in-mumbai-ujjain-train-records-video-2883859-2026-03-18,2026-03-19T19:08:18+00:00
India Today,trending,12,Delhi metro turns workplace for man after manager's call. Post goes viral,https://www.indiatoday.in/trending-news/story/delhi-metro-turns-workplace-for-man-after-managers-call-post-goes-viral-2883839-2026-03-18,2026-03-19T19:08:18+00:00
India Today,trending,13,Parents wave at CCTV camera every day to check on daughter living away from home,https://www.indiatoday.in/trending-news/story/parents-wave-at-cctv-camera-every-day-to-check-on-daughter-living-away-from-home-2883813-2026-03-18,2026-03-19T19:08:18+00:00
India Today,trending,14,Indian man's video of 'F1 car pooja' is where speed meets sanskaar,https://www.indiatoday.in/trending-news/story/indian-mans-video-of-f1-car-pooja-is-where-speed-meets-sanskaar-2883810-2026-03-18,2026-03-19T19:08:18+00:00
India Today,trending,15,"Indian couple in UK meets at station due to opposite shifts, shows tough reality",https://www.indiatoday.in/trending-news/story/indian-couple-in-uk-meets-at-station-due-to-opposite-shifts-shows-tough-reality-work-life-balance-2883731-2026-03-18,2026-03-19T19:08:18+00:00
India Today,trending,16,Australian man films 'India's most expensive vehicle' in Gurgaon amid LPG crisis,https://www.indiatoday.in/trending-news/story/australian-man-films-indias-most-expensive-vehicle-in-gurgaon-amid-lpg-crisis-2883719-2026-03-18,2026-03-19T19:08:18+00:00
India Today,trending,17,"Dhurandhar 2 runtime sparks memes as fans apply for leave, pack suitcase, pillows",https://www.indiatoday.in/trending-news/story/dhurandhar-2-runtime-sparks-memes-as-fans-apply-leave-pack-suitcase-and-pillows-2883692-2026-03-18,2026-03-19T19:08:18+00:00
India Today,trending,18,"Odisha man gets trampled by angry elephant, stands up, walks away. Video is viral",https://www.indiatoday.in/trending-news/story/odisha-man-gets-trampled-by-angry-elephant-stands-up-walks-away-video-is-viral-2883680-2026-03-18,2026-03-19T19:08:18+00:00
India Today,trending,19,"Couple's 'cinematic' pond pre-wedding shoot goes viral, gets brutally trolled",https://www.indiatoday.in/trending-news/story/couples-cinematic-pond-pre-wedding-shoot-goes-viral-gets-brutally-trolled-2883642-2026-03-18,2026-03-19T19:08:18+00:00
India Today,trending,20,Shillong school choir's Legends performance leaves internet grooving to the beat,https://www.indiatoday.in/trending-news/story/shillong-school-choirs-legends-performance-leaves-internet-grooving-to-the-beat-2883624-2026-03-18,2026-03-19T19:08:18+00:00
India Today,trending,21,"Dhurandhar 2 wins praise from Jr NTR, Mahesh Babu: Finest version of Ranveer",https://www.indiatoday.in/movies/bollywood/story/dhurandhar-2-wins-praise-from-jr-ntr-mahesh-babu-finest-version-of-ranveer-singh-2884411-2026-03-20,2026-03-19T19:08:18+00:00
