source,section,rank,headline,link,collected_at_iso
India Today,trending,22,"Iran claims direct hit on US F-35 stealth jet, video shows damage midair",https://www.indiatoday.in/world/story/iran-claims-direct-hit-us-f-35-stealth-jet-emergency-landing-irgc-releases-video-2884437-2026-03-19,2026-03-19T19:08:18+00:00
India Today,trending,23,"3 friends, returning from Ladakh trip, die after car plunges 30 feet off flyover",https://www.indiatoday.in/india/story/pune-three-friends-returning-jammu-leh-ladakh-trip-toyota-fortuner-overturns-plunges-flyover-dead-2884424-2026-03-19,2026-03-19T19:08:18+00:00
India Today,trending,24,"Saba Azad, Alaya F in Hrithik Roshan-produced thriller series Storm. First look",https://www.indiatoday.in/entertainment/ott/story/saba-azad-alaya-f-in-hrithik-roshan-produced-thriller-series-storm-first-look-2884183-2026-03-19,2026-03-19T19:08:18+00:00
India Today,trending,25,Vikram Doraiswami appointed India's ambassador to China amid diplomatic reset,https://www.indiatoday.in/india/story/vikram-doraiswami-appointed-indias-ambassador-to-china-amid-diplomatic-reset-2884370-2026-03-19,2026-03-19T19:08:18+00:00
India Today,trending,26,Iran to face biggest strikes today: Trump aide says US to end Gulf war on its terms,https://www.indiatoday.in/world/story/iran-will-see-biggest-strikes-again-today-pete-hegseth-says-gulf-war-will-end-on-uss-terms-2884263-2026-03-19,2026-03-19T19:08:18+00:00
India Today,trending,27,Decoding Congress's Assam crisis: How BJP's strategic poaching deepens electoral woes,https://www.indiatoday.in/elections/assembly/story/bjp-strategic-poaching-congress-leaders-pradyut-bordoloi-bhupen-borah-crisis-assam-assembly-elections-2884355-2026-03-19,2026-03-19T19:08:18+00:00
India Today,trending,28,These 'journalists' claim Netanyahu's dead! Only catch — they have a history of peddling fake news,https://www.indiatoday.in/preview/story/2884137,2026-03-19T19:08:18+00:00
India Today,most_read,1,IND vs SA: Deepak Chahar likely to be ruled out of last 2 ODIs due to injury,https://www.indiatoday.in/sports/cricket/story/india-vs-south-africa-deepak-chahar-likely-to-be-ruled-out-of-last-2-odis-due-to-injury-2009550-2022-10-07,2026-03-19T19:08:18+00:00
India Today,most_read,2,Manchester City fined over pitch invasion to celebrate Premier League title win,https://www.indiatoday.in/sports/football/story/manchester-city-fined-by-fa-over-pitch-invasion-to-celebrate-premier-league-title-win-2009534-2022-10-07,2026-03-19T19:08:18+00:00
India Today,most_read,3,Chelsea manager Potter on first month in charge: We have made little bit of progress,https://www.indiatoday.in/sports/football/story/chelsea-manager-graham-potter-on-first-month-in-charge-we-have-made-little-bit-of-progress-2009531-2022-10-07,2026-03-19T19:08:18+00:00
India Today,most_read,4,'Travesty of justice’: Experts criticise errors in UN report on forced disappearances in Bangladesh,https://www.indiatoday.in/world/story/experts-criticise-error-un-report-on-forced-disappearances-in-bangladesh-2007495-2022-10-02,2026-03-19T19:08:18+00:00
India Today,most_read,5,"Fact Check: No alcohol, homosexuality? Conservative guidelines for FIFA World Cup NOT issued by Qatar govt",https://www.indiatoday.in/fact-check/story/fifa-world-cup-guidelines-fact-check-no-alcohol-homosexuality-conservative-guidelines-for-football-world-cup-not-issued-by-qatar-govt-2009495-2022-10-07,2026-03-19T19:08:18+00:00
India Today,most_read,6,"KGF star Yash meets F1 legend Lewis Hamilton, See pic",https://www.indiatoday.in/movies/regional-cinema/story/kgf-star-yash-meets-f1-legend-lewis-hamilton-see-pic-2009525-2022-10-07,2026-03-19T19:08:18+00:00
India Today,most_read,7,"IND vs PAK: Match against India brings out the best in Nida Dar, says Sana Mir",https://www.indiatoday.in/sports/cricket/story/india-vs-pakistan-match-against-india-brings-out-the-best-in-nida-dar-says-sana-mir-2009523-2022-10-07,2026-03-19T19:08:18+00:00
India Today,most_read,8,Women's Asia Cup: India coach Powar defends batting-order reshuffle in Pakistan loss,https://www.indiatoday.in/sports/cricket/story/women-s-asia-cup-india-coach-ramesh-powar-defends-batting-order-reshuffle-in-pakistan-defeat-2009522-2022-10-07,2026-03-19T19:08:18+00:00
India Today,most_read,9,"Gauri Sawant reacts to Sushmita Sen playing her in Taali, recalls their first meeting",https://www.indiatoday.in/entertainment/ott/story/gauri-sawant-reacts-to-sushmita-sen-playing-her-in-taali-recalls-their-first-meeting-2009520-2022-10-07,2026-03-19T19:08:18+00:00
India Today,most_read,10,"'We're all shattered': Loved ones, community hold vigil for slain Sikh family in US",https://www.indiatoday.in/india/story/community-loved-ones-hold-vigil-sikh-family-murder-us-merced-city-2009515-2022-10-07,2026-03-19T19:08:18+00:00
India Today,most_read,11,Richa Chadha wears dainty Bvlgari mangalsutra in stunning pics with husband Ali Fazal. Here’s the price,https://www.indiatoday.in/lifestyle/fashion/story/richa-chadha-wears-dainty-bvlgari-mangalsutra-in-stunning-pics-with-husband-ali-fazal-here-s-the-price-2009509-2022-10-07,2026-03-19T19:08:18+00:00
India Today,most_read,12,"What to watch on Netflix, Disney+ Hotstar and Amazon Prime Video this weekend",https://www.indiatoday.in/entertainment/ott/story/what-to-watch-on-netflix-disney-hotstar-and-amazon-prime-video-this-weekend-2009510-2022-10-07,2026-03-19T19:08:18+00:00
India Today,most_read,13,Karnataka govt to hike SC/ST reservation,https://www.indiatoday.in/india/story/karnataka-hike-sc-st-reservation-quota-justice-nagamohan-das-committee-report-2009505-2022-10-07,2026-03-19T19:08:18+00:00
India Today,most_read,14,"Delhi civic body identifies 250 mosquito breeding hotspots, launches drive",https://www.indiatoday.in/cities/delhi/story/delhi-civic-body-identifies-mosquito-breeding-hotspots-launches-drive-2009508-2022-10-07,2026-03-19T19:08:18+00:00
India Today,most_read,15,"Your weekly news quiz, October 7 | Play on",https://www.indiatoday.in/india/story/your-weekly-news-quiz-october-7-play-on-2009506-2022-10-07,2026-03-19T19:08:18+00:00
India Today,most_read,16,"Salman Khan was on Mohali RPG attacker's hitlist, says Delhi Police",https://www.indiatoday.in/india/story/delhi-police-arrest-mohali-rpg-attacker-salman-khan-was-on-hit-list-2009502-2022-10-07,2026-03-19T19:08:18+00:00
India Today,most_read,17,"Iran denies security forces killed 16-year-old, says she fell off roof",https://www.indiatoday.in/world/story/iran-security-forces-16-year-old-killed-protest-on-death-of-woman-in-police-custody-2009503-2022-10-07,2026-03-19T19:08:18+00:00
India Today,most_read,18,"Vande Bharat Express rams into cattle, suffers minor damage; 2nd incident in 2 days",https://www.indiatoday.in/india/story/vande-bharat-express-hits-cattle-suffers-minor-damage-gujarat-2009490-2022-10-07,2026-03-19T19:08:18+00:00
India Today,most_read,19,2 Madhya Pradesh Congress MLAs booked for harassing woman on train,https://www.indiatoday.in/crime/story/2-madhya-pradesh-congress-mlas-booked-for-harassing-woman-on-train-2009441-2022-10-07,2026-03-19T19:08:18+00:00
India Today,most_read,20,Rashmika Mandanna has no regrets for not being able to spend time with her sister. Here's why,https://www.indiatoday.in/movies/regional-cinema/story/rashmika-mandanna-has-no-regrets-for-not-being-able-to-spend-time-with-her-sister-here-s-why-2009492-2022-10-07,2026-03-19T19:08:18+00:00
India Today,most_read,21,"Dhurandhar 2 wins praise from Jr NTR, Mahesh Babu: Finest version of Ranveer",https://www.indiatoday.in/movies/bollywood/story/dhurandhar-2-wins-praise-from-jr-ntr-mahesh-babu-finest-version-of-ranveer-singh-2884411-2026-03-20,2026-03-19T19:08:18+00:00
India Today,most_read,22,"Iran claims direct hit on US F-35 stealth jet, video shows damage midair",https://www.indiatoday.in/world/story/iran-claims-direct-hit-us-f-35-stealth-jet-emergency-landing-irgc-releases-video-2884437-2026-03-19,2026-03-19T19:08:18+00:00
India Today,most_read,23,"3 friends, returning from Ladakh trip, die after car plunges 30 feet off flyover",https://www.indiatoday.in/india/story/pune-three-friends-returning-jammu-leh-ladakh-trip-toyota-fortuner-overturns-plunges-flyover-dead-2884424-2026-03-19,2026-03-19T19:08:18+00:00
India Today,most_read,24,Decoding Congress's Assam crisis: How BJP's strategic poaching deepens electoral woes,https://www.indiatoday.in/elections/assembly/story/bjp-strategic-poaching-congress-leaders-pradyut-bordoloi-bhupen-borah-crisis-assam-assembly-elections-2884355-2026-03-19,2026-03-19T19:08:18+00:00
India Today,most_read,25,"Ensure peaceful Eid, Ram Navami: Delhi High Court to police amid Uttam Nagar tension",https://www.indiatoday.in/india/delhi/story/ensure-peaceful-eid-ram-navami-delhi-high-court-to-police-amid-uttam-nagar-tension-2884316-2026-03-19,2026-03-19T19:08:18+00:00
India Today,most_read,26,Vikram Doraiswami appointed India's ambassador to China amid diplomatic reset,https://www.indiatoday.in/india/story/vikram-doraiswami-appointed-indias-ambassador-to-china-amid-diplomatic-reset-2884370-2026-03-19,2026-03-19T19:08:18+00:00
India Today,most_read,27,Dawood Ibrahim's Maharashtra plots finally auctioned after four failed attempts,https://www.indiatoday.in/india/story/dawood-ibrahim-ancestral-lands-auctioned-maharashtra-ratnagiri-safema-sale-2884194-2026-03-19,2026-03-19T19:08:18+00:00
India Today,most_read,28,"Iran's new Supreme Leader Mojtaba Khamenei lost a leg, is in coma: Report",https://www.indiatoday.in/world/story/irans-new-supreme-leader-mojtaba-khamenei-lost-a-leg-is-in-coma-after-strike-report-2881209-2026-03-13,2026-03-19T19:08:18+00:00
India Today,most_read,29,Oil prices before and after US-Israel-Iran war,https://www.indiatoday.in/information/story/oil-prices-before-and-after-the-war-country-wise-checklist-of-global-fuel-hike-2884136-2026-03-19,2026-03-19T19:08:18+00:00
India Today,most_read,30,"Dhurandhar 2 Review, Release Live",https://www.indiatoday.in/movies/bollywood/story/dhurandhar-2-movie-release-review-live-updates-box-office-prediction-ranveer-singh-advance-booking-aditya-dhar-audience-reaction-2883589-2026-03-18,2026-03-19T19:08:18+00:00
India Today,most_read,31,Eid 2026 Moon Sighting Live,https://www.indiatoday.in/information/story/eid-ul-fitr-2026-moon-sighting-live-updates-chand-raat-timings-in-india-city-wise-2884015-2026-03-19,2026-03-19T19:08:18+00:00
