source,section,rank,headline,link,collected_at_iso
Times of India,most_read,1,"Man, son die in accident; wife critical",https://timesofindia.indiatimes.com/articleshow/129350279.cms,2026-03-10T17:01:33+00:00
Times of India,most_read,2,IBM returns after 6 years; Capgemini plans permanent campus in Vizag,https://timesofindia.indiatimes.com/articleshow/129346853.cms,2026-03-10T17:01:33+00:00
Times of India,most_read,3,Woman’s innovative idea to get a seat in Mumbai local crosses 3 million views– watch here,https://timesofindia.indiatimes.com/articleshow/129269278.cms,2026-03-10T17:01:33+00:00
Times of India,most_read,4,"‘Legs tied, mouth stuffed with clothes’: Arya Vaidya Pharmacy founder’s daughter found dead in Coimbatore",https://timesofindia.indiatimes.com/articleshow/129154415.cms,2026-03-10T17:01:33+00:00
Times of India,most_read,5,IndiGo CEO resigns months after airline faced worst-ever operational ‌crisis,https://timesofindia.indiatimes.com/articleshow/129397239.cms,2026-03-10T17:01:33+00:00
Times of India,most_read,6,"Hello, Doctor. India’s top doctors here to answer your questions",https://timesofindia.indiatimes.com/articleshow/125440094.cms,2026-03-10T17:01:33+00:00
Times of India,most_read,7,"'Willing to talk to Iran', says Trump, but warns new leader won't 'live in peace'",https://timesofindia.indiatimes.com/articleshow/129395270.cms,2026-03-10T17:01:33+00:00
Times of India,most_read,8,"'Don't get eliminated yourself': Iran warns Trump, slaps down 'empty' threats",https://timesofindia.indiatimes.com/articleshow/129396446.cms,2026-03-10T17:01:33+00:00
Times of India,most_read,9,Eateries flag LPG shortage: Govt sets up 3-member panel,https://timesofindia.indiatimes.com/articleshow/129393940.cms,2026-03-10T17:01:33+00:00
Times of India,most_read,10,Will Pakistan join the Iran war with US and Israel to defend Saudi Arabia?,https://timesofindia.indiatimes.com/articleshow/129319939.cms,2026-03-10T17:01:33+00:00
Times of India,most_read,11,"Nvidia plans AI agent platform 'NemoClaw', will not make OpenAl’s million-dollar mistake",https://timesofindia.indiatimes.com/articleshow/129389418.cms,2026-03-10T17:01:33+00:00
Times of India,most_read,12,"One terrorist killed, operation under way along LoC in J&K's Nowshera",https://timesofindia.indiatimes.com/articleshow/129395629.cms,2026-03-10T17:01:33+00:00
Times of India,most_read,13,'How dare you?' CJI blasts pleas against judicial officers engaged in Bengal SIR,https://timesofindia.indiatimes.com/articleshow/129386080.cms,2026-03-10T17:01:33+00:00
Times of India,most_read,14,India slides down in 2026 GECI rankings: How can it be improved?,https://timesofindia.indiatimes.com/articleshow/129388064.cms,2026-03-10T17:01:33+00:00
Times of India,most_read,15,"Anthropic takes US govt to court; CFO says: After President Trump’s social media posts, a major ...",https://timesofindia.indiatimes.com/articleshow/129381273.cms,2026-03-10T17:01:33+00:00
Times of India,most_read,16,"Swift succession, fading reunion: Sunetra Pawar’s test in a fractured NCP",https://timesofindia.indiatimes.com/articleshow/129392513.cms,2026-03-10T17:01:33+00:00
Times of India,most_read,17,'Dream is to play senior World Cup': Yash Dhull opens up on heart surgery and comeback,https://timesofindia.indiatimes.com/articleshow/129339475.cms,2026-03-10T17:01:33+00:00
Times of India,most_read,18,Global fuel crisis looms: Gulf nations cut oil output; Hormuz disruptions choke supply,https://timesofindia.indiatimes.com/articleshow/129385865.cms,2026-03-10T17:01:33+00:00
Times of India,most_read,19,"'Iran war to end soon,' says Donald Trump, warns Tehran not to try 'anything cute'",https://timesofindia.indiatimes.com/articleshow/129363058.cms,2026-03-10T17:01:33+00:00
Times of India,most_read,20,Trump blames Iran for bombing school that killed 160; stumbles when asked about Tomahawk missile,https://timesofindia.indiatimes.com/articleshow/129370041.cms,2026-03-10T17:01:33+00:00
Times of India,most_read,21,BCCI announces Rs 131 crore reward for India after T20 World Cup 2026 triumph,https://timesofindia.indiatimes.com/articleshow/129378140.cms,2026-03-10T17:01:33+00:00
Times of India,most_read,22,Arshdeep Singh penalised by ICC following India's T20 World Cup triumph,https://timesofindia.indiatimes.com/articleshow/129390220.cms,2026-03-10T17:01:33+00:00
Times of India,most_read,23,"ICC breaks silence on bias claims after England exit leaves West Indies, South Africa stuck in India",https://timesofindia.indiatimes.com/articleshow/129334932.cms,2026-03-10T17:01:33+00:00
Times of India,most_read,24,"'Pani pilana, bat uthana': Mohammed Siraj's viral dig on his and Kuldeep Yadav's role in T20 World Cup triumph",https://timesofindia.indiatimes.com/articleshow/129342984.cms,2026-03-10T17:01:33+00:00
Times of India,most_read,25,Johny Lever's daughter Jamie recalls brother Jesse’s tumour battle and failed surgery: ‘We would never return to that lifestyle’,https://timesofindia.indiatimes.com/articleshow/129350006.cms,2026-03-10T17:01:33+00:00
Times of India,most_read,26,Iran war impact on India: LPG shortage concerns rise; which states may feel the heat?,https://timesofindia.indiatimes.com/articleshow/129383455.cms,2026-03-10T17:01:33+00:00
Times of India,most_read,27,"Fuel shortage fear grips Pakistan: Sharif orders school shutdown, four-day workweek amid Mideast conflict",https://timesofindia.indiatimes.com/articleshow/129324362.cms,2026-03-10T17:01:33+00:00
Times of India,most_read,28,'Will remove some oil sanctions': Donald Trump as crude prices soar amid Iran war,https://timesofindia.indiatimes.com/articleshow/129360629.cms,2026-03-10T17:01:33+00:00
Times of India,most_read,29,"PM Modi speaks with Nepal's newly elected youth leader Balendra Shah, Rabi Lamichhane",https://timesofindia.indiatimes.com/articleshow/129342006.cms,2026-03-10T17:01:33+00:00
Times of India,most_read,30,How many days can cooked chicken stay in the fridge before it becomes risky to eat,https://timesofindia.indiatimes.com/articleshow/129348795.cms,2026-03-10T17:01:33+00:00
Times of India,most_read,31,From Shahed drones to B-2 bombers: 10 weapons deciding the fate of US-Iran war,https://timesofindia.indiatimes.com/articleshow/129338175.cms,2026-03-10T17:01:33+00:00
Times of India,most_read,32,'Kar diya na kaam': BJP shares video of Rahul Gandhi praising Youth Congress' 'shirtless' protest at AI Summit,https://timesofindia.indiatimes.com/articleshow/129384408.cms,2026-03-10T17:01:33+00:00
Times of India,most_read,33,Tamannaah Bhatia’s fitness trainer Siddhartha Singh warns against eating these 3 foods before a workout; what to eat instead,https://timesofindia.indiatimes.com/articleshow/129344358.cms,2026-03-10T17:01:33+00:00
Times of India,most_read,34,Manchester-bound flight returns to Delhi after flying 13 hours; London-Mumbai diverted to Cairo,https://timesofindia.indiatimes.com/articleshow/129352875.cms,2026-03-10T17:01:33+00:00
Times of India,most_read,35,Strait of Hormuz crisis amid Iran war: Saudi's Aramco CEO warns of 'catastrophic consequences' for oil markets,https://timesofindia.indiatimes.com/articleshow/129381629.cms,2026-03-10T17:01:33+00:00
Times of India,most_read,36,Indonesia to procure BrahMos missiles from India: Report,https://timesofindia.indiatimes.com/articleshow/129334391.cms,2026-03-10T17:01:33+00:00
Times of India,most_read,37,"After oil, war of water? Why desalination plants are turning into targets in Middle East – explained",https://timesofindia.indiatimes.com/articleshow/129334653.cms,2026-03-10T17:01:33+00:00
Times of India,most_read,38,Is the Iran war already draining US weapons stockpiles? Billions spent in first 48 hours of operation,https://timesofindia.indiatimes.com/articleshow/129373464.cms,2026-03-10T17:01:33+00:00
Times of India,most_read,39,"Meet Anjum Khan: Shivam Dube’s wife, who is a successful model and voiceover artist",https://timesofindia.indiatimes.com/articleshow/129340053.cms,2026-03-10T17:01:33+00:00
Times of India,most_read,40,'Ispe mein kya bolun?': Ishan Kishan gets annoyed after winning T20 World Cup 2026 title - Watch,https://timesofindia.indiatimes.com/articleshow/129387115.cms,2026-03-10T17:01:33+00:00
Times of India,most_read,41,20-year-old declares himself first Gen Z president of new country after discovering unclaimed land,https://timesofindia.indiatimes.com/articleshow/129356746.cms,2026-03-10T17:01:33+00:00
Times of India,most_read,42,India once defied pressure to buy Russian oil. So why did it need a US waiver now?,https://timesofindia.indiatimes.com/articleshow/129326682.cms,2026-03-10T17:01:33+00:00
Times of India,most_read,43,'I was facing a lot of difficulties personally': Hardik Pandya opens up on tough phase,https://timesofindia.indiatimes.com/articleshow/129337516.cms,2026-03-10T17:01:33+00:00
Times of India,most_read,44,"Interfaith wedding drama in Thane: Nikah halted after girl alleges rape, conversion bid by tailor",https://timesofindia.indiatimes.com/articleshow/129375960.cms,2026-03-10T17:01:33+00:00
Times of India,most_read,45,"Ram Gopal Varma reviews 'Dhurandhar 2' trailer, calls it 'stratosphere level'",https://timesofindia.indiatimes.com/articleshow/129348069.cms,2026-03-10T17:01:33+00:00
Times of India,most_read,46,"Midnight missiles: Japan quietly deploys 1,000 km Type-12 launchers, China now within reach",https://timesofindia.indiatimes.com/articleshow/129343642.cms,2026-03-10T17:01:33+00:00
Times of India,most_read,47,"Two Akanksha Singhs, one UPSC rank: Ghazipur candidate confirmed at 301",https://timesofindia.indiatimes.com/articleshow/129338405.cms,2026-03-10T17:01:33+00:00
Times of India,most_read,48,Delhi LPG Cylinder Refill,https://timesofindia.indiatimes.com/articleshow/129367839.cms,2026-03-10T17:01:33+00:00
Times of India,most_read,49,Middle East Crisis,https://timesofindia.indiatimes.com/articleshow/129350791.cms,2026-03-10T17:01:33+00:00
Times of India,most_read,50,LPG Supply India,https://timesofindia.indiatimes.com/articleshow/129385278.cms,2026-03-10T17:01:33+00:00
Times of India,most_read,51,Indian Cricket Team Reoprt Card,https://timesofindia.indiatimes.com/articleshow/129369539.cms,2026-03-10T17:01:33+00:00
Times of India,most_read,52,Uttam Nagar Murder Case,https://timesofindia.indiatimes.com/articleshow/129388126.cms,2026-03-10T17:01:33+00:00
Times of India,most_read,53,PNRC GNM First Year Result,https://timesofindia.indiatimes.com/articleshow/129381067.cms,2026-03-10T17:01:33+00:00
Times of India,most_read,54,Hormuz Strait News,https://timesofindia.indiatimes.com/articleshow/129371459.cms,2026-03-10T17:01:33+00:00
Times of India,most_read,55,Rickrolled CBSE Class 12 Exam,https://timesofindia.indiatimes.com/articleshow/129375771.cms,2026-03-10T17:01:33+00:00
Times of India,most_read,56,BCCI Annual Award,https://timesofindia.indiatimes.com/articleshow/129386397.cms,2026-03-10T17:01:33+00:00
Times of India,most_read,57,Pakistan Schools Closed,https://timesofindia.indiatimes.com/articleshow/129377206.cms,2026-03-10T17:01:33+00:00
Times of India,most_read,58,Bangladesh Fuel Crisis,https://timesofindia.indiatimes.com/articleshow/129384226.cms,2026-03-10T17:01:33+00:00
Times of India,most_read,59,India Next Match,https://timesofindia.indiatimes.com/articleshow/129379879.cms,2026-03-10T17:01:33+00:00
Times of India,most_read,60,Dhurandhar 2 Advance Booking,https://timesofindia.indiatimes.com/articleshow/129312149.cms,2026-03-10T17:01:33+00:00
Times of India,most_read,61,Jr Ntr Watch Collection,https://timesofindia.indiatimes.com/articleshow/129369603.cms,2026-03-10T17:01:33+00:00
Times of India,most_read,62,Sitaare Zameen Par OTT,https://timesofindia.indiatimes.com/articleshow/129350355.cms,2026-03-10T17:01:33+00:00
Times of India,most_read,63,One Piece Season 2,https://timesofindia.indiatimes.com/articleshow/129367716.cms,2026-03-10T17:01:33+00:00
Times of India,most_read,64,Dhurandhar The Revenge,https://timesofindia.indiatimes.com/articleshow/129368066.cms,2026-03-10T17:01:33+00:00
Times of India,most_read,65,Tommy DeCarlo Death,https://timesofindia.indiatimes.com/articleshow/129380690.cms,2026-03-10T17:01:33+00:00
Times of India,most_read,66,Shivam Dube House,https://timesofindia.indiatimes.com/articleshow/129392063.cms,2026-03-10T17:01:33+00:00
Times of India,most_read,67,Nasa Satellite Crash,https://timesofindia.indiatimes.com/articleshow/129379719.cms,2026-03-10T17:01:33+00:00
Times of India,most_read,68,Indian Cobra VS Egyptian Cobra,https://timesofindia.indiatimes.com/articleshow/129376134.cms,2026-03-10T17:01:33+00:00
Times of India,most_read,69,Ludhiana School Bomb Threat,https://timesofindia.indiatimes.com/articleshow/129373583.cms,2026-03-10T17:01:33+00:00
Times of India,most_read,70,Delhi Uttam Nagar Murder Case,https://timesofindia.indiatimes.com/articleshow/129373737.cms,2026-03-10T17:01:33+00:00
Times of India,most_read,71,CBSE Class 12 Mathematics Paper,https://timesofindia.indiatimes.com/articleshow/129375148.cms,2026-03-10T17:01:33+00:00
Times of India,most_read,72,UP Gosaiganj Accident,https://timesofindia.indiatimes.com/articleshow/129377549.cms,2026-03-10T17:01:33+00:00
Times of India,most_read,73,Bengaluru Realtor Murder,https://timesofindia.indiatimes.com/articleshow/129378308.cms,2026-03-10T17:01:33+00:00
Times of India,most_read,74,Maharashtra E Bike Taxi Permits,https://timesofindia.indiatimes.com/articleshow/129371643.cms,2026-03-10T17:01:33+00:00
Times of India,most_read,75,Mandya Couple Suicide,https://timesofindia.indiatimes.com/articleshow/129347868.cms,2026-03-10T17:01:33+00:00
Times of India,most_read,76,Delhi Kolkata Flight Schedule,https://timesofindia.indiatimes.com/articleshow/129380688.cms,2026-03-10T17:01:33+00:00
Times of India,most_read,77,Arunachal Pradesh Accident,https://timesofindia.indiatimes.com/articleshow/129377988.cms,2026-03-10T17:01:33+00:00
Times of India,most_read,78,CBSE Maths Exam QR Code,https://timesofindia.indiatimes.com/articleshow/129382834.cms,2026-03-10T17:01:33+00:00
Times of India,most_read,79,Uniform Civil Code,https://timesofindia.indiatimes.com/articleshow/129377945.cms,2026-03-10T17:01:33+00:00
Times of India,most_read,80,Essential Commodities Act,https://timesofindia.indiatimes.com/articleshow/129380839.cms,2026-03-10T17:01:33+00:00
Times of India,most_read,81,Who is Robert Griswold,https://timesofindia.indiatimes.com/articleshow/129392005.cms,2026-03-10T17:01:33+00:00
Times of India,most_read,82,Shohei Ohtani Net Worth,https://timesofindia.indiatimes.com/articleshow/129391346.cms,2026-03-10T17:01:33+00:00
Times of India,most_read,83,Sharjah Woman Harassment Case,https://timesofindia.indiatimes.com/articleshow/129389441.cms,2026-03-10T17:01:33+00:00
Times of India,most_read,84,Hyundai Verna Facelift,https://timesofindia.indiatimes.com/articleshow/129374768.cms,2026-03-10T17:01:33+00:00
Times of India,most_read,85,Anthropic Ceo Dario Amodei,https://timesofindia.indiatimes.com/articleshow/129137566.cms,2026-03-10T17:01:33+00:00
Times of India,most_read,86,'Outrageous': Zohran Mamdani slammed for hosting Mahmoud Khalil and his family for breakfast,https://timesofindia.indiatimes.com/articleshow/129396884.cms,2026-03-10T17:01:33+00:00
Times of India,most_read,87,Lakshya Sen admits heightened self-expectations added to All England Open 'heartbreak',https://timesofindia.indiatimes.com/articleshow/129394212.cms,2026-03-10T17:01:33+00:00
Times of India,most_read,88,"""No one feels alone"": UAE developers offer free stays as flight cancellations strand travellers",https://timesofindia.indiatimes.com/articleshow/129396768.cms,2026-03-10T17:01:33+00:00
Times of India,most_read,89,Paramilitary personnel arrive in Namakkal district ahead of TN assembly election,https://timesofindia.indiatimes.com/articleshow/129397019.cms,2026-03-10T17:01:33+00:00
Times of India,most_read,90,NFL Trade Rumors: Dallas Cowboys could strike deal with Pittsburgh Steelers for veteran linebacker,https://timesofindia.indiatimes.com/articleshow/129382158.cms,2026-03-10T17:01:33+00:00
Times of India,most_read,91,Honor Forrest cause of death: Questions remain after influencer Sarah Green’s daughter dies at 23,https://timesofindia.indiatimes.com/articleshow/129396128.cms,2026-03-10T17:01:33+00:00
Times of India,most_read,92,Your sneakers look dirty? Try this simple washing machine trick to make them look new again,https://timesofindia.indiatimes.com/articleshow/129395733.cms,2026-03-10T17:01:33+00:00
Times of India,most_read,93,Evening news wrap: How has US-Iran war hit India? Pakistan announces crisis measures amid Middle East tension & more,https://timesofindia.indiatimes.com/articleshow/129394898.cms,2026-03-10T17:01:33+00:00
Times of India,most_read,94,Is Connor McDavid's future with Edmonton Oilers uncertain if team struggles during Stanley Cup playoffs?,https://timesofindia.indiatimes.com/articleshow/129395019.cms,2026-03-10T17:01:33+00:00
Times of India,most_read,95,"EXPLAINED | Why ICC penalised Arshdeep Singh: Rules, sanctions, punishment - All you need to know",https://timesofindia.indiatimes.com/articleshow/129396043.cms,2026-03-10T17:01:33+00:00
Times of India,most_read,96,Union cabinet approves proposal to declare Madurai airport as an international airport,https://timesofindia.indiatimes.com/articleshow/129395946.cms,2026-03-10T17:01:33+00:00
Times of India,most_read,97,"Oliver Rowland enjoys family time in Melbourne amid Middle East tension, praises Arvid Lindblad’s F1 debut",https://timesofindia.indiatimes.com/articleshow/129395763.cms,2026-03-10T17:01:33+00:00
Times of India,most_read,98,"8th Pay Commission: Fitment factor of 3, OPS revival, 11-year pension commutation among AITUC’s key demands",https://timesofindia.indiatimes.com/articleshow/129395670.cms,2026-03-10T17:01:33+00:00
Times of India,most_read,99,"Lionel Messi net worth vs his MLS contract: A look at Inter Miami salary, endorsements, and the soccer legend’s growing wealth",https://timesofindia.indiatimes.com/articleshow/129392133.cms,2026-03-10T17:01:33+00:00
Times of India,most_read,100,"Krupa Ravi elaborates how Bharatnatayam shaped her personality not just as an artist, but a leader and mother",https://timesofindia.indiatimes.com/articleshow/129394859.cms,2026-03-10T17:01:33+00:00
Times of India,most_read,101,Philadelphia Eagles quarterback Jalen Hurts answers hard hitting questions from innocent young fans,https://timesofindia.indiatimes.com/articleshow/129391888.cms,2026-03-10T17:01:33+00:00
Times of India,most_read,102,Jewar airport connectivity: Delhi–Mumbai Expressway link with Noida International Airport gets fresh push; check details,https://timesofindia.indiatimes.com/articleshow/129394690.cms,2026-03-10T17:01:33+00:00
Times of India,trending,1,"etimesWatch: Two men crash wedding, follow woman to hostel and throw letter onto balcony; viral video sparks fear and outrageA viral video shows two men attending a wedding uninvited, then stalking a woman they noticed there. They followed her after she left the function, even reaching her hostel and attempting to find her room. Social media users expressed outrage, highlighting how such behaviour contributes to women's safety concerns, though some debated if the video was staged.",https://timesofindia.indiatimes.com/articleshow/129401900.cms,2026-03-10T17:01:33+00:00
Times of India,trending,2,etimesYouTuber Anurag Dobhal's 150km/h car crash on Delhi-Meerut Expressway: Wife Ritika issues health update,https://timesofindia.indiatimes.com/articleshow/129372115.cms,2026-03-10T17:01:33+00:00
Times of India,trending,3,"etimesBengaluru startup’s ₹50 lakh job listing goes viral: CEO says, ‘27+ and under ₹2L? Don’t apply,’ seeks ‘healthy workaholic’",https://timesofindia.indiatimes.com/articleshow/129401433.cms,2026-03-10T17:01:33+00:00
Times of India,trending,4,"etimesWatch: Men target moving train with cow dung and coloured liquid; video sparks massive outrageA viral video shows men throwing colored liquid and cow dung at a moving train. This act has sparked widespread criticism online. Passengers' safety and public behavior are major concerns. Railway authorities have taken notice and are seeking details to take action. The National Crime Investigation Bureau, Bihar, also condemned the criminal behavior.",https://timesofindia.indiatimes.com/articleshow/129399642.cms,2026-03-10T17:01:33+00:00
Times of India,trending,5,"etimesVideo inside: American woman spent ₹54 lakh on a 10-day Jaipur trip – here’s where the money wentAn American designer's 10-day Jaipur sourcing trip, costing over ₹54 lakh, has gone viral. Her expenses included a $6,000 flight from New York, ₹3 lakh for accommodation and daily costs, and a staggering ₹45 lakh for gemstones, gold, silver, and fabrics. The post highlights the significant investment behind jewelry businesses and has garnered supportive social media reactions.",https://timesofindia.indiatimes.com/articleshow/129398752.cms,2026-03-10T17:01:33+00:00
Times of India,trending,6,India Upcoming Matches,https://timesofindia.indiatimes.com/articleshow/129379879.cms,2026-03-10T17:01:33+00:00
Times of India,trending,7,Indian Cricket Team Prize Money,https://timesofindia.indiatimes.com/articleshow/129378140.cms,2026-03-10T17:01:33+00:00
Times of India,trending,8,Middle East War,https://timesofindia.indiatimes.com/articleshow/129380839.cms,2026-03-10T17:01:33+00:00
Times of India,trending,9,Delhi uttam nagar murder,https://timesofindia.indiatimes.com/articleshow/129297640.cms,2026-03-10T17:01:33+00:00
Times of India,trending,10,Oil Price Today,https://timesofindia.indiatimes.com/articleshow/129370843.cms,2026-03-10T17:01:33+00:00
Times of India,trending,11,"Everyone thought it was a vintage phone, until it started ‘booking cabs and ordering Maggi’",https://timesofindia.indiatimes.com/articleshow/129398337.cms,2026-03-10T17:01:33+00:00
Times of India,trending,12,Video: Earthquake omen or ocean myth? ‘Doomsday fish’ spotted near shore in Cabo San Lucas,https://timesofindia.indiatimes.com/articleshow/129395263.cms,2026-03-10T17:01:33+00:00
Times of India,trending,13,‘Stop eating and buy silver’: Robert Kiyosaki warns of the biggest market crash and reveals how $10 could save you,https://timesofindia.indiatimes.com/articleshow/129397932.cms,2026-03-10T17:01:33+00:00
Times of India,trending,14,Green tech jackpot or eco disaster? Malaysia's forests hide rare earth metal 'goldmines',https://timesofindia.indiatimes.com/articleshow/129392122.cms,2026-03-10T17:01:33+00:00
Times of India,trending,15,Is Gold losing its control over markets? Copper and Uranium explode as 2026’s real safe haven,https://timesofindia.indiatimes.com/articleshow/129382128.cms,2026-03-10T17:01:33+00:00
Times of India,trending,16,"Sheetala Ashtami 2026 (Basoda 2026): When is it, significance, rituals, timing and how to observe it",https://timesofindia.indiatimes.com/articleshow/129385963.cms,2026-03-10T17:01:33+00:00
Times of India,trending,17,"Woman quit Google Photos for privacy, but the price of owning her memories shocked her",https://timesofindia.indiatimes.com/articleshow/129388484.cms,2026-03-10T17:01:33+00:00
Times of India,trending,18,Think US-based public schools are free? Indian Google techie reveals the real fee is hidden in your ZIP code,https://timesofindia.indiatimes.com/articleshow/129387090.cms,2026-03-10T17:01:33+00:00
Times of India,trending,19,Who is Ivanna Ortiz? Florida woman arrested for shootout at Rihanna's LA home,https://timesofindia.indiatimes.com/articleshow/129378532.cms,2026-03-10T17:01:33+00:00
Times of India,trending,20,Why your Women's Day celebration is a betrayal to all women out there,https://timesofindia.indiatimes.com/articleshow/129380801.cms,2026-03-10T17:01:33+00:00
Times of India,trending,21,US-Iran war: Air India flight ticket prices to rise! Fuel surcharge hiked,https://timesofindia.indiatimes.com/articleshow/129406988.cms,2026-03-10T17:01:33+00:00
Times of India,trending,22,India considering naval escort for ships in Strait of Hormuz amid Iran war: Report,https://timesofindia.indiatimes.com/articleshow/129405940.cms,2026-03-10T17:01:33+00:00
Times of India,trending,23,"Why ICC penalised Arshdeep Singh: Rules, sanctions, punishment - All you need to know",https://timesofindia.indiatimes.com/articleshow/129396043.cms,2026-03-10T17:01:33+00:00
Times of India,trending,24,The Iran war’s hidden crisis: Why water could matter more than oil,https://timesofindia.indiatimes.com/articleshow/129399422.cms,2026-03-10T17:01:33+00:00
Times of India,trending,25,Iran School Attack,https://timesofindia.indiatimes.com/articleshow/129370041.cms,2026-03-10T17:01:33+00:00
Times of India,trending,26,Delhi LPG Cylinder Refill,https://timesofindia.indiatimes.com/articleshow/129367839.cms,2026-03-10T17:01:33+00:00
Times of India,trending,27,Middle East Crisis,https://timesofindia.indiatimes.com/articleshow/129350791.cms,2026-03-10T17:01:33+00:00
Times of India,trending,28,LPG Supply India,https://timesofindia.indiatimes.com/articleshow/129385278.cms,2026-03-10T17:01:33+00:00
Times of India,trending,29,Indian Cricket Team Reoprt Card,https://timesofindia.indiatimes.com/articleshow/129369539.cms,2026-03-10T17:01:33+00:00
Times of India,trending,30,Uttam Nagar Murder Case,https://timesofindia.indiatimes.com/articleshow/129388126.cms,2026-03-10T17:01:33+00:00
Times of India,trending,31,PNRC GNM First Year Result,https://timesofindia.indiatimes.com/articleshow/129381067.cms,2026-03-10T17:01:33+00:00
Times of India,trending,32,Hormuz Strait News,https://timesofindia.indiatimes.com/articleshow/129371459.cms,2026-03-10T17:01:33+00:00
Times of India,trending,33,Rickrolled CBSE Class 12 Exam,https://timesofindia.indiatimes.com/articleshow/129375771.cms,2026-03-10T17:01:33+00:00
