source,section,rank,headline,link,collected_at_iso
Times of India,trending,40,Wuthering Waves 3.2,https://timesofindia.indiatimes.com/articleshow/129517709.cms,2026-03-13T05:16:00+00:00
Times of India,trending,41,CTET Answer Key 2026,https://timesofindia.indiatimes.com/articleshow/129508509.cms,2026-03-13T05:16:00+00:00
Times of India,trending,42,UPPSC APO Admit Card,https://timesofindia.indiatimes.com/articleshow/129510033.cms,2026-03-13T05:16:00+00:00
Times of India,trending,43,RRB NTPC admit card 2026,https://timesofindia.indiatimes.com/articleshow/129489043.cms,2026-03-13T05:16:00+00:00
Times of India,trending,44,NBEMS GPAT 2026 answer key,https://timesofindia.indiatimes.com/articleshow/129512563.cms,2026-03-13T05:16:00+00:00
Times of India,trending,45,RTE Rajasthan Lottery result,https://timesofindia.indiatimes.com/articleshow/129511934.cms,2026-03-13T05:16:00+00:00
Times of India,trending,46,LPG Shortage Delhi,https://timesofindia.indiatimes.com/articleshow/129502698.cms,2026-03-13T05:16:00+00:00
Times of India,trending,47,Strait of Hormuz,https://timesofindia.indiatimes.com/articleshow/129511873.cms,2026-03-13T05:16:00+00:00
Times of India,trending,48,Iran Warns US Tech Firms,https://timesofindia.indiatimes.com/articleshow/129458745.cms,2026-03-13T05:16:00+00:00
Times of India,trending,49,Royal Enfield Meteor 350 Vs Jawa 42 FJ,https://timesofindia.indiatimes.com/articleshow/129494130.cms,2026-03-13T05:16:00+00:00
Times of India,trending,50,"Numerology horoscope today, March 13, 2026: What your name's first letter reveals today",https://timesofindia.indiatimes.com/articleshow/129509358.cms,2026-03-13T05:16:00+00:00
Times of India,trending,51,UAE News: Police crack down on modified cars and bikes over loud ‘explosion’ sounds amid ongoing regional tensions,https://timesofindia.indiatimes.com/articleshow/129537903.cms,2026-03-13T05:16:00+00:00
Times of India,trending,52,"4 days after opening of Magenta Line corridor, cable theft hits services",https://timesofindia.indiatimes.com/articleshow/129537856.cms,2026-03-13T05:16:00+00:00
Times of India,trending,53,How to get Hoshimachi Suisei skin in Fortnite,https://timesofindia.indiatimes.com/articleshow/129537909.cms,2026-03-13T05:16:00+00:00
Times of India,trending,54,"Anurag Dobhal’s wife Ritika says, ‘everything you see on media is not true’ amid alleged domestic violence claims; see post",https://timesofindia.indiatimes.com/articleshow/129537913.cms,2026-03-13T05:16:00+00:00
Times of India,trending,55,World Sleep Day: 5 Powerful night rituals that can improve sleep naturally,https://timesofindia.indiatimes.com/articleshow/129537786.cms,2026-03-13T05:16:00+00:00
Times of India,trending,56,‘My baby brother now belongs to Saaniya’: Sara Tendulkar’s emotional post for brother Arjun melts hearts online,https://timesofindia.indiatimes.com/articleshow/129536985.cms,2026-03-13T05:16:00+00:00
Times of India,trending,57,'No life insurance': Netanyahu's stark warning to Iran's new supreme leader Mojtaba Khamenei & a 'puppet' dig,https://timesofindia.indiatimes.com/articleshow/129536715.cms,2026-03-13T05:16:00+00:00
Times of India,trending,58,25x increase in demand: Induction cooktops hit jackpot amid LPG shortage,https://timesofindia.indiatimes.com/articleshow/129536573.cms,2026-03-13T05:16:00+00:00
Times of India,trending,59,"Allu Sirish opens up about Nayanika Reddy’s brutal honesty after wedding: 'She's a sharp shooter, doesn't mince words'",https://timesofindia.indiatimes.com/articleshow/129536332.cms,2026-03-13T05:16:00+00:00
Times of India,trending,60,‘Acknowledging the obvious’: Russia reacts to US waiver on oil amid Iran war,https://timesofindia.indiatimes.com/articleshow/129535565.cms,2026-03-13T05:16:00+00:00
Times of India,trending,61,"India’s 50-over question: After T20 World Cup heroics, can Sanju Samson and Ishan Kishan break into India’s ODI plans?",https://timesofindia.indiatimes.com/articleshow/129534718.cms,2026-03-13T05:16:00+00:00
Times of India,trending,62,"Mother mixes pesticide in drink to threaten husband; 5-year-old drinks it, dies",https://timesofindia.indiatimes.com/articleshow/129534071.cms,2026-03-13T05:16:00+00:00
Times of India,trending,63,"21 abducted Nagas freed in Manipur, 2 missing Kuki tribesmen found dead",https://timesofindia.indiatimes.com/articleshow/129529988.cms,2026-03-13T05:16:00+00:00
Times of India,trending,64,Apple to celebrate 50th anniversary on April 1: Read CEO Tim Cook's 'Thank You' letter,https://timesofindia.indiatimes.com/articleshow/129516799.cms,2026-03-13T05:16:00+00:00
Times of India,trending,65,Doggerland: The lost land that once connected Britain to Europe before the sea swallowed it,https://timesofindia.indiatimes.com/articleshow/129508141.cms,2026-03-13T05:16:00+00:00
NDTV,most_read,1,"Gold, Silver Prices Rise Amid War Uncertainity: Check Rates In Your City",https://www.ndtv.com/india-news/gold-silver-prices-rise-amid-war-uncertainity-check-rates-in-your-city-on-march-13-11208979,2026-03-13T05:16:00+00:00
NDTV,most_read,2,"Video: Disguised As Doctor, Woman Enters Hospital, Steals Patient's Gold",https://www.ndtv.com/hyderabad-news/video-disguised-as-doctor-hyderabad-woman-enters-hospital-steals-patients-gold-11208813,2026-03-13T05:16:00+00:00
NDTV,most_read,3,'Paucity Of Time': President's Office Snubs Trinamool Outreach In Protocol Row,https://www.ndtv.com/india-news/president-droupadi-murmu-bengal-trinamool-congress-chief-minister-mamata-banerjee-prime-minister-narendra-modi-murmu-siliguri-tribal-welfare-event-11208812,2026-03-13T05:16:00+00:00
NDTV,most_read,4,"""Ring Roads A Big Flop"": Supreme Court Hikes Entry Fee For Trucks In Delhi",https://www.ndtv.com/india-news/supreme-court-hikes-entry-fee-for-trucks-in-delhi-ring-roads-a-big-flop-11208803,2026-03-13T05:16:00+00:00
NDTV,most_read,5,Adobe's Shantanu Narayen To Step Down As CEO After 18 Years,https://www.ndtv.com/india-news/adobes-shantanu-narayen-to-step-down-as-ceo-after-18-years-11208623,2026-03-13T05:16:00+00:00
NDTV,most_read,6,"Telangana Class 10 Exams Begin Tomorrow, Board Releases OMR Sheet Samples",https://www.ndtv.com/education/telangana-class-10-exams-begin-tomorrow-board-releases-omr-sheet-samples-for-students-11208792,2026-03-13T05:16:00+00:00
NDTV,most_read,7,"NBEMS GPAT 2026 Exam: Answer Key Out, Check Download Link Here",https://www.ndtv.com/education/nbems-gpat-2026-exam-answer-key-out-check-download-link-here-11208565,2026-03-13T05:16:00+00:00
NDTV,most_read,8,Rajasthan RTE Lottery 2026 Result Out: Check District-Wise School Allotment,https://www.ndtv.com/education/rajasthan-rte-lottery-2026-27-result-out-6-34-lakh-applications-check-district-wise-school-allotment-11206629,2026-03-13T05:16:00+00:00
NDTV,most_read,9,"CTET 2026 Provisional Answer Key Released, Here's Direct Link To Check",https://www.ndtv.com/education/ctet-2026-answer-key-out-live-direct-link-to-check-steps-to-raise-objections-11206486,2026-03-13T05:16:00+00:00
NDTV,most_read,10,"School Assembly News Headlines (March 13): Top National, World, Sports News",https://www.ndtv.com/education/school-assembly-news-headlines-march-13-top-national-world-sports-updates-11206012,2026-03-13T05:16:00+00:00
NDTV,most_read,11,"Dubai Hit Again: Video Shows Smoke Above Buildings, Burj Khalifa In Background",https://www.ndtv.com/world-news/iran-us-israel-war-video-fresh-explosions-in-central-dubai-black-smoke-seen-above-buildings-middle-east-conflict-11208742,2026-03-13T05:16:00+00:00
NDTV,most_read,12,US Warship Abraham Lincoln Hit By Iran Strike? Claim And Counter-Claim,https://www.ndtv.com/world-news/iran-war-news-live-us-warship-uss-abraham-lincoln-damaged-irans-big-claim-and-a-us-counter-11208715,2026-03-13T05:16:00+00:00
NDTV,most_read,13,Trump Says Mojtaba Khamenei Alive 'In Some Form' Amid War Injury Reports,https://www.ndtv.com/world-news/iran-was-news-live-trump-says-mojtaba-khamenei-alive-in-some-form-amid-war-injury-reports-11208612,2026-03-13T05:16:00+00:00
NDTV,most_read,14,"Indian-Origin Brothers Found Guilty In US Fraud, Face 400 Years In Prison",https://www.ndtv.com/world-news/indian-origin-brothers-convicted-of-h-1b-visa-and-healthcare-fraud-in-us-could-face-400-years-in-prison-11205446,2026-03-13T05:16:00+00:00
NDTV,most_read,15,"Trump Claims US Will Profit From Rising Oil Prices, Iran's Nuke Reply",https://www.ndtv.com/world-news/iran-war-news-live-donald-trump-claims-us-will-profit-from-rising-oil-prices-irans-nuke-reply-11208480,2026-03-13T05:16:00+00:00
NDTV,most_read,16,"Iran Outlines 3 Conditions To End War With US, Israel",https://www.ndtv.com/world-news/iran-israel-us-war-iran-outlines-3-conditions-to-end-war-with-us-israel-11203516,2026-03-13T05:16:00+00:00
NDTV,most_read,17,"US Military Aircraft Crashes In Iraq, 4th American Plane Lost During Iran War",https://www.ndtv.com/world-news/us-refueling-aircraft-kc-135-crashes-in-iraq-amid-iran-war-11208162,2026-03-13T05:16:00+00:00
NDTV,most_read,18,"Techie Jumps From Rs 3.5 Lakh To Rs 65 Lakh Salary In 4 Years, Shares Tips",https://www.ndtv.com/offbeat/software-engineer-jumps-from-rs-3-5-lakh-to-rs-65-lakh-salary-in-4-years-shares-key-tips-11208537,2026-03-13T05:16:00+00:00
NDTV,most_read,19,"At 17, Mojtaba Khamenei Built Network That Made Him Supreme Leader",https://www.ndtv.com/world-news/iran-war-latest-news-habib-battalion-iran-supreme-leader-mojtaba-khameneis-days-as-teenage-soldier-laid-foundation-for-his-accession-11207098,2026-03-13T05:16:00+00:00
NDTV,most_read,20,"What Happened When Rahul Gandhi Darted From LPG To ""Anything"" In Parliament",https://www.ndtv.com/india-news/what-happened-when-rahul-gandhi-darted-from-lpg-to-anything-in-parliament-11206715,2026-03-13T05:16:00+00:00
NDTV,most_read,21,"After 'Unfair Practice', India, US Trade Partners Face 'Forced Labour' Probe",https://www.ndtv.com/world-news/us-trade-representative-forced-labour-probe-india-and-59-other-nations-including-china-eu-bangladesh-11208993,2026-03-13T05:16:00+00:00
NDTV,most_read,22,Iran's New Supreme Leader's Hormuz Mention And A Warning In First Remarks,https://www.ndtv.com/world-news/iran-war-latest-news-strait-of-hormuz-must-remain-closed-mojtaba-khameneis-first-remark-as-irans-supreme-leader-11206166,2026-03-13T05:16:00+00:00
NDTV,most_read,23,"Iran-Backed Group Claims It Downed American Jet, Contradicts US Version",https://www.ndtv.com/world-news/iran-israel-us-war-iran-backed-group-claims-it-downed-us-aircraft-boeing-kc-135-stratotanker-in-iraq-contradicts-us-version-middle-east-conflict-11208599,2026-03-13T05:16:00+00:00
NDTV,most_read,24,"""Expressed Concern Over Loss Of Lives"": PM Holds Talks With Iran President",https://www.ndtv.com/india-news/iran-war-latest-news-expressed-deep-concern-pm-narendra-modi-discusses-middle-east-situation-with-iran-president-11207560,2026-03-13T05:16:00+00:00
NDTV,most_read,25,"Live: Centre Prioritises Household LPG Use, Induction Stoves Go Out Of Stock",https://www.ndtv.com/india-news/india-lpg-cylinder-shortage-live-updates-middle-east-iran-israel-war-centre-household-use-induction-cooktops-out-of-stock-11203389,2026-03-13T05:16:00+00:00
NDTV,most_read,26,Netanyahu Says Top Iranian Nuclear Scientist Killed In Israeli Strikes,https://www.ndtv.com/world-news/iran-war-benjamin-netanyahu-says-top-iranian-nuclear-scientists-killed-in-israeli-strikes-11207987,2026-03-13T05:16:00+00:00
NDTV,most_read,27,Nayanthara And Husband Vignesh Shivan Buy Rs 31.5 Crore Duplex Apartment In Chennai's Poes Garden: Report,https://www.ndtv.com/entertainment/nayanthara-purchases-31-5-crore-duplex-apartment-in-chennai-s-poes-garden-11175509,2026-03-13T05:16:00+00:00
NDTV,most_read,28,'Real Kerala Story': CPM Leaders After 'Mahakumbh Girl' Marries Farman Khan,https://www.ndtv.com/india-news/the-real-kerala-story-cpi-leaders-after-mahakumbh-fame-monalisa-marries-farman-khan-11204050,2026-03-13T05:16:00+00:00
NDTV,most_read,29,"""Nothing Will Happen To Me"": Ex-Chhattisgarh Minister's Son's Drunk Driving Rampage Sparks Outrage",https://www.ndtv.com/india-news/nothing-will-happen-to-me-ex-chhattisgarh-minister-nanki-ram-kanwars-son-sandeep-kanwar-drunk-driving-rampage-sparks-outrage-11203964,2026-03-13T05:16:00+00:00
NDTV,most_read,30,US-Israel-Iran War Live Updates,https://www.ndtv.com/world-news/iran-israel-war-live-updates-us-middle-east-crisis-news-mojtaba-khamenei-iran-new-supreme-leader-donald-trump-netanyahu-dubai-11187798,2026-03-13T05:16:00+00:00
NDTV,most_read,31,Delhi Fire Incident,https://www.ndtv.com/delhi-news/hundreds-homeless-as-massive-fire-burns-down-80-delhi-shanties-11208387,2026-03-13T05:16:00+00:00
NDTV,trending,1,"Video: Disguised As Doctor, Woman Enters Hospital, Steals Patient's Gold",https://www.ndtv.com/hyderabad-news/video-disguised-as-doctor-hyderabad-woman-enters-hospital-steals-patients-gold-11208813,2026-03-13T05:16:00+00:00
NDTV,trending,2,'Paucity Of Time': President's Office Snubs Trinamool Outreach In Protocol Row,https://www.ndtv.com/india-news/president-droupadi-murmu-bengal-trinamool-congress-chief-minister-mamata-banerjee-prime-minister-narendra-modi-murmu-siliguri-tribal-welfare-event-11208812,2026-03-13T05:16:00+00:00
NDTV,trending,3,"""Ring Roads A Big Flop"": Supreme Court Hikes Entry Fee For Trucks In Delhi",https://www.ndtv.com/india-news/supreme-court-hikes-entry-fee-for-trucks-in-delhi-ring-roads-a-big-flop-11208803,2026-03-13T05:16:00+00:00
NDTV,trending,4,"Stock Market LIVE: Markets Open Lower Again, Rupee Hits Fresh Low",https://www.ndtv.com/india-news/stock-market-live-updates-sensex-today-nifty-share-market-sensex-nifty-brace-for-another-negative-start-amid-oil-shock-11208570,2026-03-13T05:16:00+00:00
NDTV,trending,5,"Rupee Nears 93, Inflation At 10-Month High: What It Means For Your Money",https://www.ndtv.com/india-news/iran-war-impact-rupee-nears-93-inflation-at-10-month-high-how-it-hits-your-pocket-11208499,2026-03-13T05:16:00+00:00
NDTV,trending,6,"Telangana Class 10 Exams Begin Tomorrow, Board Releases OMR Sheet Samples",https://www.ndtv.com/education/telangana-class-10-exams-begin-tomorrow-board-releases-omr-sheet-samples-for-students-11208792,2026-03-13T05:16:00+00:00
NDTV,trending,7,"NBEMS GPAT 2026 Exam: Answer Key Out, Check Download Link Here",https://www.ndtv.com/education/nbems-gpat-2026-exam-answer-key-out-check-download-link-here-11208565,2026-03-13T05:16:00+00:00
NDTV,trending,8,Rajasthan RTE Lottery 2026 Result Out: Check District-Wise School Allotment,https://www.ndtv.com/education/rajasthan-rte-lottery-2026-27-result-out-6-34-lakh-applications-check-district-wise-school-allotment-11206629,2026-03-13T05:16:00+00:00
NDTV,trending,9,"CTET 2026 Provisional Answer Key Released, Here's Direct Link To Check",https://www.ndtv.com/education/ctet-2026-answer-key-out-live-direct-link-to-check-steps-to-raise-objections-11206486,2026-03-13T05:16:00+00:00
NDTV,trending,10,"School Assembly News Headlines (March 13): Top National, World, Sports News",https://www.ndtv.com/education/school-assembly-news-headlines-march-13-top-national-world-sports-updates-11206012,2026-03-13T05:16:00+00:00
NDTV,trending,11,"Dubai Hit Again: Video Shows Smoke Above Buildings, Burj Khalifa In Background",https://www.ndtv.com/world-news/iran-us-israel-war-video-fresh-explosions-in-central-dubai-black-smoke-seen-above-buildings-middle-east-conflict-11208742,2026-03-13T05:16:00+00:00
NDTV,trending,12,US Warship Abraham Lincoln Hit By Iran Strike? Claim And Counter-Claim,https://www.ndtv.com/world-news/iran-war-news-live-us-warship-uss-abraham-lincoln-damaged-irans-big-claim-and-a-us-counter-11208715,2026-03-13T05:16:00+00:00
NDTV,trending,13,"Private Breakup Chat Leaked, Rashmika Mandanna Threatens Legal Action",https://www.ndtv.com/entertainment/private-chat-about-rashmika-mandannas-breakup-leaked-days-after-wedding-actress-threatens-legal-action-11205551,2026-03-13T05:16:00+00:00
NDTV,trending,14,Trump Says Mojtaba Khamenei Alive 'In Some Form' Amid War Injury Reports,https://www.ndtv.com/world-news/iran-was-news-live-trump-says-mojtaba-khamenei-alive-in-some-form-amid-war-injury-reports-11208612,2026-03-13T05:16:00+00:00
NDTV,trending,15,"Indian-Origin Brothers Found Guilty In US Fraud, Face 400 Years In Prison",https://www.ndtv.com/world-news/indian-origin-brothers-convicted-of-h-1b-visa-and-healthcare-fraud-in-us-could-face-400-years-in-prison-11205446,2026-03-13T05:16:00+00:00
NDTV,trending,16,"Trump Claims US Will Profit From Rising Oil Prices, Iran's Nuke Reply",https://www.ndtv.com/world-news/iran-war-news-live-donald-trump-claims-us-will-profit-from-rising-oil-prices-irans-nuke-reply-11208480,2026-03-13T05:16:00+00:00
NDTV,trending,17,"Iran Outlines 3 Conditions To End War With US, Israel",https://www.ndtv.com/world-news/iran-israel-us-war-iran-outlines-3-conditions-to-end-war-with-us-israel-11203516,2026-03-13T05:16:00+00:00
NDTV,trending,18,Adobe's Shantanu Narayen To Step Down As CEO After 18 Years,https://www.ndtv.com/india-news/adobes-shantanu-narayen-to-step-down-as-ceo-after-18-years-11208623,2026-03-13T05:16:00+00:00
NDTV,trending,19,"At 17, Mojtaba Khamenei Built Network That Made Him Supreme Leader",https://www.ndtv.com/world-news/iran-war-latest-news-habib-battalion-iran-supreme-leader-mojtaba-khameneis-days-as-teenage-soldier-laid-foundation-for-his-accession-11207098,2026-03-13T05:16:00+00:00
NDTV,trending,20,"US Military Aircraft Crashes In Iraq, 4th American Plane Lost During Iran War",https://www.ndtv.com/world-news/us-refueling-aircraft-kc-135-crashes-in-iraq-amid-iran-war-11208162,2026-03-13T05:16:00+00:00
NDTV,trending,21,"Techie Jumps From Rs 3.5 Lakh To Rs 65 Lakh Salary In 4 Years, Shares Tips",https://www.ndtv.com/offbeat/software-engineer-jumps-from-rs-3-5-lakh-to-rs-65-lakh-salary-in-4-years-shares-key-tips-11208537,2026-03-13T05:16:00+00:00
NDTV,trending,22,"What Happened When Rahul Gandhi Darted From LPG To ""Anything"" In Parliament",https://www.ndtv.com/india-news/what-happened-when-rahul-gandhi-darted-from-lpg-to-anything-in-parliament-11206715,2026-03-13T05:16:00+00:00
NDTV,trending,23,"Iran-Backed Group Claims It Downed American Jet, Contradicts US Version",https://www.ndtv.com/world-news/iran-israel-us-war-iran-backed-group-claims-it-downed-us-aircraft-boeing-kc-135-stratotanker-in-iraq-contradicts-us-version-middle-east-conflict-11208599,2026-03-13T05:16:00+00:00
NDTV,trending,24,'Real Kerala Story': CPM Leaders After 'Mahakumbh Girl' Marries Farman Khan,https://www.ndtv.com/india-news/the-real-kerala-story-cpi-leaders-after-mahakumbh-fame-monalisa-marries-farman-khan-11204050,2026-03-13T05:16:00+00:00
NDTV,trending,25,"Watch: Anand Deverakonda's ""Chaotic"" Dance Video With Vijay And Rashmika Goes Viral",https://www.ndtv.com/entertainment/watch-anand-deverakondas-chaotic-dance-video-with-vijay-and-rashmika-goes-viral-11203660,2026-03-13T05:16:00+00:00
NDTV,trending,26,"""No Toxicity, Only Dhurandhar"": Sara Arjun's Post On X Goes Viral, Father Raj Arjun Clarifies",https://www.ndtv.com/entertainment/no-toxicity-only-dhurandhar-sara-arjuns-post-on-x-goes-viral-father-raj-arjun-clarifies-11191011,2026-03-13T05:16:00+00:00
NDTV,trending,27,"Khushboo Sundar Reacts To Vijay And Trisha's Affair Rumours: ""Why Are People Making It A Big Deal?""",https://www.ndtv.com/entertainment/khushboo-sundar-reacts-to-vijay-and-trishas-affair-rumours-why-are-people-making-it-a-big-deal-11194545,2026-03-13T05:16:00+00:00
NDTV,trending,28,US-Israel-Iran War Live Updates,https://www.ndtv.com/world-news/iran-israel-war-live-updates-us-middle-east-crisis-news-mojtaba-khamenei-iran-new-supreme-leader-donald-trump-netanyahu-dubai-11187798,2026-03-13T05:16:00+00:00
NDTV,trending,29,Delhi Fire Incident,https://www.ndtv.com/delhi-news/hundreds-homeless-as-massive-fire-burns-down-80-delhi-shanties-11208387,2026-03-13T05:16:00+00:00
India Today,trending,1,Child stuffed inside scooter for viral video. Account's other clips spark alarm,https://www.indiatoday.in/trending-news/story/child-stuffed-inside-scooter-for-viral-video-accounts-other-clips-spark-alarm-2881111-2026-03-12,2026-03-13T05:16:00+00:00
India Today,trending,2,Brothers go full Dhurandhar with Shararat dance performance at sister's sangeet,https://www.indiatoday.in/trending-news/story/shararat-dance-video-viral-brothers-at-sister-sangeet-ranveer-singh-dhurandhar-song-2881097-2026-03-12,2026-03-13T05:16:00+00:00
India Today,trending,3,Woman clerk refuses to issue ticket over exact change dispute. Railways reacts,https://www.indiatoday.in/trending-news/story/punjab-woman-clerk-refuses-to-issue-train-ticket-over-exact-change-dispute-railways-reacts-2881095-2026-03-12,2026-03-13T05:16:00+00:00
India Today,trending,4,"Fired in 3 days by IITian founder, AI engineer says she now earns 8 times more",https://www.indiatoday.in/trending-news/story/iit-founder-fired-her-in-3-days-ai-engineer-earns-8-time-more-now-2881087-2026-03-12,2026-03-13T05:16:00+00:00
India Today,trending,5,Elderly woman finds joy in swinging from train handles in Mumbai local. Watch video,https://www.indiatoday.in/trending-news/story/elderly-woman-finds-joy-in-swinging-from-train-handles-in-mumbai-local-watch-video-2881048-2026-03-12,2026-03-13T05:16:00+00:00
India Today,trending,6,Bengaluru eatery opened a month ago shuts down due to LPG shortage amid war,https://www.indiatoday.in/trending-news/story/bengaluru-eatery-run-by-gurgaon-man-opened-a-month-ago-shuts-down-due-to-lpg-shortage-amid-war-2881038-2026-03-12,2026-03-13T05:16:00+00:00
India Today,trending,7,"Man quietly waters plants on road divider every day, internet salutes his effort",https://www.indiatoday.in/trending-news/story/man-quietly-waters-plants-on-road-divider-every-day-internet-salutes-his-effort-2880963-2026-03-12,2026-03-13T05:16:00+00:00
India Today,trending,8,"Pakistani man plays Kal Ho Naa Ho on rubab in mountains, what happens next is magical",https://www.indiatoday.in/trending-news/story/pakistani-man-plays-kal-ho-naa-ho-on-rubab-in-mountains-what-happens-next-is-magical-2880916-2026-03-12,2026-03-13T05:16:00+00:00
India Today,trending,9,Man thrown off bike after colliding with car. His thumbs up to driver goes viral,https://www.indiatoday.in/trending-news/story/man-thrown-off-bike-after-colliding-with-car-his-thumbs-up-to-driver-goes-viral-2880817-2026-03-12,2026-03-13T05:16:00+00:00
India Today,trending,10,Why influencer beating man who brushed past her in Bangladesh has people arguing,https://www.indiatoday.in/trending-news/story/why-influencer-beating-man-who-brushed-past-her-in-bangladesh-has-people-arguing-2880800-2026-03-12,2026-03-13T05:16:00+00:00
India Today,trending,11,Inside Elon Musk's modest Texas home: His mother reveals surprising details,https://www.indiatoday.in/trending-news/story/inside-elon-musk-modest-texas-home-his-mother-maye-musk-reveals-surprising-details-2880779-2026-03-12,2026-03-13T05:16:00+00:00
India Today,trending,12,DigiYatra queue moves slower than regular line at Bengaluru airport? Internet weighs in,https://www.indiatoday.in/trending-news/story/digiyatra-queue-moves-slower-than-regular-line-at-bengaluru-airport-internet-weighs-in-2880758-2026-03-12,2026-03-13T05:16:00+00:00
India Today,trending,13,Russian woman enjoys 'private jet' experience as the only passenger on flight to Dubai,https://www.indiatoday.in/trending-news/story/russian-woman-enjoys-private-jet-experience-as-the-only-passenger-on-flight-to-dubai-2880709-2026-03-12,2026-03-13T05:16:00+00:00
India Today,trending,14,Gurgaon CEO calls out techie who asked Rs 36 LPA after accepting Rs 28 LPA offer,https://www.indiatoday.in/trending-news/story/gurgaon-ceo-calls-out-techie-who-asked-rs-36-lpa-after-accepting-rs-28-lpa-offer-2880505-2026-03-11,2026-03-13T05:16:00+00:00
India Today,trending,15,"From rent to SIPs, Gurugram techie shares how she spends Rs 89,500 a month",https://www.indiatoday.in/trending-news/story/from-rent-to-sips-gurugram-techie-shares-how-she-spends-rs-89500-a-month-2880503-2026-03-11,2026-03-13T05:16:00+00:00
India Today,trending,16,"Indian H-1B worker stranded after visiting sick mother, US job now at risk",https://www.indiatoday.in/trending-news/story/indian-h-1b-worker-stranded-after-visiting-sick-mother-us-job-now-at-risk-2880493-2026-03-11,2026-03-13T05:16:00+00:00
India Today,trending,17,Portuguese woman moved to 2AC after uncomfortable encounter with men in Indian train,https://www.indiatoday.in/trending-news/story/portuguese-woman-moved-to-2ac-after-uncomfortable-encounter-with-men-in-indian-train-2880409-2026-03-11,2026-03-13T05:16:00+00:00
India Today,trending,18,"Israel promotes bomb shelter dating app amid war, trolled",https://www.indiatoday.in/trending-news/story/israel-introduces-bomb-shelter-dating-app-amid-ongoing-war-trolled-2880299-2026-03-11,2026-03-13T05:16:00+00:00
India Today,trending,19,Butter chicken ice cream exists and the internet is absolutely not ready for it,https://www.indiatoday.in/trending-news/story/butter-chicken-ice-cream-exists-and-the-internet-is-absolutely-not-ready-for-it-2880279-2026-03-11,2026-03-13T05:16:00+00:00
India Today,trending,20,"Bengaluru Uber driver finds wallet, tracks man to return it. People share similar tales",https://www.indiatoday.in/trending-news/story/bengaluru-uber-driver-finds-wallet-tracks-mumbai-man-to-return-it-people-share-similar-honest-tales-2880226-2026-03-11,2026-03-13T05:16:00+00:00
India Today,trending,21,Meta delays AI model Avocado rollout after it fails to meet internal tests,https://www.indiatoday.in/technology/news/story/meta-delays-ai-model-avocado-rollout-after-it-fails-to-meet-internal-tests-2881279-2026-03-13,2026-03-13T05:16:00+00:00
India Today,trending,22,Delhi Traffic Advisory: Avoid DDU Marg today due to protest near BJP HQ,https://www.indiatoday.in/information/story/bjp-protest-march-march-13-causes-heavy-traffic-congestion-delays-delhi-2881284-2026-03-13,2026-03-13T05:16:00+00:00
