source,section,rank,headline,link,collected_at_iso
Times of India,trending,26,Highest T20 World Cup Final Run Chase,https://timesofindia.indiatimes.com/articleshow/129278774.cms,2026-03-08T16:38:09+00:00
Times of India,trending,27,Indian National Cricket Team,https://timesofindia.indiatimes.com/articleshow/129255728.cms,2026-03-08T16:38:09+00:00
Times of India,trending,28,South Africa Cricket Team,https://timesofindia.indiatimes.com/articleshow/129258507.cms,2026-03-08T16:38:09+00:00
Times of India,trending,29,IND vs NZ Match Security,https://timesofindia.indiatimes.com/articleshow/129266125.cms,2026-03-08T16:38:09+00:00
Times of India,trending,30,Uttam Nagar murder,https://timesofindia.indiatimes.com/articleshow/129201500.cms,2026-03-08T16:38:09+00:00
Times of India,trending,31,Where to Watch Ind vs Nz t20,https://timesofindia.indiatimes.com/articleshow/129204799.cms,2026-03-08T16:38:09+00:00
Times of India,trending,32,Women's Day Wishes,https://timesofindia.indiatimes.com/articleshow/129154869.cms,2026-03-08T16:38:09+00:00
Times of India,trending,33,Happy Women's Day Wishes,https://timesofindia.indiatimes.com/articleshow/129217192.cms,2026-03-08T16:38:09+00:00
Times of India,trending,34,Shah Rukh Khan,https://timesofindia.indiatimes.com/articleshow/129118674.cms,2026-03-08T16:38:09+00:00
Times of India,trending,35,Dhurandhar 2 Trailer,https://timesofindia.indiatimes.com/articleshow/129195700.cms,2026-03-08T16:38:09+00:00
Times of India,trending,36,Ahmedabad Police Traffic advisory,https://timesofindia.indiatimes.com/articleshow/129221351.cms,2026-03-08T16:38:09+00:00
Times of India,trending,37,The Kerala Story 2,https://timesofindia.indiatimes.com/articleshow/129188287.cms,2026-03-08T16:38:09+00:00
Times of India,trending,38,War News Anxiety,https://timesofindia.indiatimes.com/articleshow/129196764.cms,2026-03-08T16:38:09+00:00
Times of India,trending,39,Bollywood War Movies,https://timesofindia.indiatimes.com/articleshow/129203388.cms,2026-03-08T16:38:09+00:00
Times of India,trending,40,Women's Day Quotes,https://timesofindia.indiatimes.com/articleshow/129199745.cms,2026-03-08T16:38:09+00:00
Times of India,trending,41,The Great Indian Kapil Show 4,https://timesofindia.indiatimes.com/articleshow/129125820.cms,2026-03-08T16:38:09+00:00
Times of India,trending,42,Maruti Brezza Facelift Spied,https://timesofindia.indiatimes.com/articleshow/129146065.cms,2026-03-08T16:38:09+00:00
Times of India,trending,43,Lab Grown Diamonds,https://timesofindia.indiatimes.com/articleshow/129090781.cms,2026-03-08T16:38:09+00:00
Times of India,trending,44,Social Media Ban,https://timesofindia.indiatimes.com/articleshow/129152683.cms,2026-03-08T16:38:09+00:00
Times of India,trending,45,Women’s Day AI Prompts,https://timesofindia.indiatimes.com/articleshow/129253033.cms,2026-03-08T16:38:09+00:00
Times of India,trending,46,Zayed Al Nahyan,https://timesofindia.indiatimes.com/articleshow/129245694.cms,2026-03-08T16:38:09+00:00
Times of India,trending,47,Israeli Drone Strike,https://timesofindia.indiatimes.com/articleshow/129246917.cms,2026-03-08T16:38:09+00:00
Times of India,trending,48,ICAI CA Foundation Result,https://timesofindia.indiatimes.com/articleshow/129249758.cms,2026-03-08T16:38:09+00:00
Times of India,trending,49,CUET PG Admit Card,https://timesofindia.indiatimes.com/articleshow/129252208.cms,2026-03-08T16:38:09+00:00
Times of India,trending,50,NOC Vehicle Transfer,https://timesofindia.indiatimes.com/articleshow/129235789.cms,2026-03-08T16:38:09+00:00
Times of India,trending,51,AIIMS Robotic Surgeries,https://timesofindia.indiatimes.com/articleshow/129253751.cms,2026-03-08T16:38:09+00:00
Times of India,trending,52,Iran vs US Israel war,https://timesofindia.indiatimes.com/articleshow/129244551.cms,2026-03-08T16:38:09+00:00
Times of India,trending,53,NEET UG 2026 Registration,https://timesofindia.indiatimes.com/articleshow/129191444.cms,2026-03-08T16:38:09+00:00
Times of India,trending,54,NBEMS GPAT Answer Key 2026,https://timesofindia.indiatimes.com/articleshow/129247929.cms,2026-03-08T16:38:09+00:00
Times of India,trending,55,ICAI CA Intermediate Toppers List,https://timesofindia.indiatimes.com/articleshow/129255037.cms,2026-03-08T16:38:09+00:00
Times of India,trending,56,US Embassy Blast,https://timesofindia.indiatimes.com/articleshow/129253762.cms,2026-03-08T16:38:09+00:00
Times of India,trending,57,Bareilly Twin Sister Murder,https://timesofindia.indiatimes.com/articleshow/129228428.cms,2026-03-08T16:38:09+00:00
Times of India,trending,58,Delhi Meerut Expressway Accident,https://timesofindia.indiatimes.com/articleshow/129246591.cms,2026-03-08T16:38:09+00:00
Times of India,trending,59,Delhi Uttam Nagar Murder,https://timesofindia.indiatimes.com/articleshow/129245083.cms,2026-03-08T16:38:09+00:00
Times of India,trending,60,Abu Dhabi Zayed International Airport,https://timesofindia.indiatimes.com/articleshow/129122230.cms,2026-03-08T16:38:09+00:00
Times of India,trending,61,Dubai travel update,https://timesofindia.indiatimes.com/articleshow/129257319.cms,2026-03-08T16:38:09+00:00
Times of India,trending,62,Junaid-Nasir murder case,https://timesofindia.indiatimes.com/articleshow/129256430.cms,2026-03-08T16:38:09+00:00
Times of India,trending,63,Vande Bharat Express,https://timesofindia.indiatimes.com/articleshow/129255542.cms,2026-03-08T16:38:09+00:00
Times of India,trending,64,Delhi Metro corridors,https://timesofindia.indiatimes.com/articleshow/129254569.cms,2026-03-08T16:38:09+00:00
Times of India,trending,65,MLB opening day,https://timesofindia.indiatimes.com/articleshow/129169077.cms,2026-03-08T16:38:09+00:00
Times of India,trending,66,Mumbai Indians New IPL Jersey,https://timesofindia.indiatimes.com/articleshow/129151315.cms,2026-03-08T16:38:09+00:00
Times of India,trending,67,Daylight Saving Time 2026,https://timesofindia.indiatimes.com/articleshow/129199541.cms,2026-03-08T16:38:09+00:00
Times of India,trending,68,Electric Cars Vs Petrol Cars,https://timesofindia.indiatimes.com/articleshow/129200029.cms,2026-03-08T16:38:09+00:00
Times of India,trending,69,Apple Macbook Air M5,https://timesofindia.indiatimes.com/articleshow/128978084.cms,2026-03-08T16:38:09+00:00
Times of India,trending,70,Anthropic Ceo Dario Amodei,https://timesofindia.indiatimes.com/articleshow/129137566.cms,2026-03-08T16:38:09+00:00
Times of India,trending,71,Nvidia China Dream,https://timesofindia.indiatimes.com/articleshow/129144522.cms,2026-03-08T16:38:09+00:00
Times of India,trending,72,Macbook Neo VSMacbook Air,https://timesofindia.indiatimes.com/articleshow/129140491.cms,2026-03-08T16:38:09+00:00
Times of India,trending,73,Pia Sutaria: From the West End to Centre Stage in Bombay,https://timesofindia.indiatimes.com/articleshow/129279488.cms,2026-03-08T16:38:09+00:00
Times of India,trending,74,Meghan Murray: On bringing Broadway Home,https://timesofindia.indiatimes.com/articleshow/129279461.cms,2026-03-08T16:38:09+00:00
Times of India,trending,75,Love triangles in Football: Inside relationships of top 10 footballers who once dated the same woman ft Cristiano Ronaldo and Sergio Ramos,https://timesofindia.indiatimes.com/articleshow/129265507.cms,2026-03-08T16:38:09+00:00
Times of India,trending,76,Sciatica pain starts as a simple backache: Spine experts explain early warning signs and how timely treatment can prevent nerve damage,https://timesofindia.indiatimes.com/articleshow/129279198.cms,2026-03-08T16:38:09+00:00
Times of India,trending,77,"$1,000 fine, 90 days in jail: Non-English speaking truck drivers in Wyoming can now be penalised by police under new law",https://timesofindia.indiatimes.com/articleshow/129277634.cms,2026-03-08T16:38:09+00:00
Times of India,trending,78,"Tom Brady played key role in preventing Maxx Crosby trade to Patriots, per reports",https://timesofindia.indiatimes.com/articleshow/129279440.cms,2026-03-08T16:38:09+00:00
Times of India,trending,79,Krupa Ravi says Respectful Maternity Care is every woman's 'fundamental right' - Exclusive,https://timesofindia.indiatimes.com/articleshow/129278908.cms,2026-03-08T16:38:09+00:00
Times of India,trending,80,Can H-1Bs run a dance academy in the US? Dos and don'ts for H-1B visa holders,https://timesofindia.indiatimes.com/articleshow/129279311.cms,2026-03-08T16:38:09+00:00
Times of India,trending,81,"Why Nepal's vote count crawls: Each ballot paper lifted, shown to reps, okayed before next picked",https://timesofindia.indiatimes.com/articleshow/129279217.cms,2026-03-08T16:38:09+00:00
Times of India,trending,82,"Jal Mahotsav kicks off in Lucknow’s Gosainganj, to cover 22,000 villages across UP",https://timesofindia.indiatimes.com/articleshow/129279261.cms,2026-03-08T16:38:09+00:00
Times of India,trending,83,From Punch the Monkey to Penguin memes: How animals took over the internet in 2026,https://timesofindia.indiatimes.com/articleshow/129276609.cms,2026-03-08T16:38:09+00:00
Times of India,trending,84,Kiké Hernández’s bold Puerto Rico stance sparks MLB-wide debate about World Series glory,https://timesofindia.indiatimes.com/articleshow/129278790.cms,2026-03-08T16:38:09+00:00
Times of India,trending,85,Trisha Krishnan hits back after R Parthiban takes a dig at her post her viral video with Vijay from a wedding: 'It makes stupidity..',https://timesofindia.indiatimes.com/articleshow/129278241.cms,2026-03-08T16:38:09+00:00
Times of India,trending,86,"Realme C38 5G launched in India with 7,000mAh battery and 6.8-inch display: Price, offers and more",https://timesofindia.indiatimes.com/articleshow/129262541.cms,2026-03-08T16:38:09+00:00
Times of India,trending,87,Middle East crisis: EAM Jaishankar to make statement in Lok Sabha on Monday,https://timesofindia.indiatimes.com/articleshow/129277300.cms,2026-03-08T16:38:09+00:00
Times of India,trending,88,Google Play Store now warns you about apps that kill your battery,https://timesofindia.indiatimes.com/articleshow/129277506.cms,2026-03-08T16:38:09+00:00
NDTV,most_read,1,Over 500 From Andhra Pradesh Stranded In Middle East Return To India,https://www.ndtv.com/india-news/israel-iran-war-over-500-from-andhra-pradesh-stranded-in-middle-east-return-to-india-11186681,2026-03-08T16:38:09+00:00
NDTV,most_read,2,"Man, 21, Arrested For Stabbing Lover Over Suspected Affair In Dehradun: Cops",https://www.ndtv.com/india-news/man-21-arrested-for-stabbing-lover-over-suspected-affair-in-dehradun-cops-11186658,2026-03-08T16:38:09+00:00
NDTV,most_read,3,"Dalit Man Dies In Police Custody In Tamil Nadu, Family Alleges Torture",https://www.ndtv.com/india-news/dalit-man-dies-in-police-custody-in-tamil-nadu-family-alleges-torture-11186597,2026-03-08T16:38:09+00:00
NDTV,most_read,4,Man Arrested For Drowning 3 Minor Daughters In Lake In Telangana: Cops,https://www.ndtv.com/india-news/man-arrested-for-drowning-3-minor-daughters-in-lake-in-telangana-cops-11186481,2026-03-08T16:38:09+00:00
NDTV,most_read,5,"""Why Governor Resigned,"" Asks Mamata Banerjee. ""Confidential,"" Says CV Bose",https://www.ndtv.com/india-news/why-governor-resigned-asks-mamata-banerjee-confidential-says-cv-ananda-bose-11186379,2026-03-08T16:38:09+00:00
NDTV,most_read,6,"CBSE Class 12 Mathematics Exam On March 9, Check Last-Minute Tips From Educators",https://www.ndtv.com/education/cbse-class-12-mathematics-exam-on-march-9-check-last-minute-tips-from-educators-11186304,2026-03-08T16:38:09+00:00
NDTV,most_read,7,"School Assembly News Headlines (March 9): Top National, World, Other News",https://www.ndtv.com/education/school-assembly-news-headlines-march-9-top-national-world-sports-business-news-11186096,2026-03-08T16:38:09+00:00
NDTV,most_read,8,"SSC CGL 2025 Exam: Vacancies Increased To 15,130, Applications Invited For Post Preference",https://www.ndtv.com/education/ssc-cgl-2025-exam-vacancies-increased-to-15-130-applications-invited-for-post-department-preference-11185945,2026-03-08T16:38:09+00:00
NDTV,most_read,9,"PM Modi To Speak On Education, Skills And University Townships On March 9",https://www.ndtv.com/education/pm-modi-to-speak-on-education-skills-and-university-townships-on-march-9-during-post-budget-webinar-11185549,2026-03-08T16:38:09+00:00
NDTV,most_read,10,Vaishno Devi Medical College Seeks Fresh NMC Nod To Restart MBBS Course,https://www.ndtv.com/education/vaishno-devi-medical-college-seeks-fresh-nod-from-commission-to-restart-mbbs-course-11185455,2026-03-08T16:38:09+00:00
NDTV,most_read,11,Nepal Election Results,https://www.ndtv.com/world-news/nepal-election-2026-results-live-updates-balendra-shah-gagan-thapa-kp-sharma-oli-nepal-to-count-votes-shortly-for-first-polls-held-after-gen-z-protest-11175123,2026-03-08T16:38:09+00:00
NDTV,most_read,12,"Regime Change, Uranium Stockpile, And The US Dilemma To Invade Iran",https://www.ndtv.com/world-news/iran-war-news-iran-israel-us-war-live-news-the-suspense-around-us-boots-on-ground-in-iran-and-why-it-may-be-necessary-11186562,2026-03-08T16:38:09+00:00
NDTV,most_read,13,Iranian Sailor Told Father Of US Ultimatum Before Torpedo Attack: Report,https://www.ndtv.com/world-news/iran-israel-war-iranian-sailor-told-father-of-us-ultimatum-before-torpedo-attack-report-11184910,2026-03-08T16:38:09+00:00
NDTV,most_read,14,"""Enemy's Misconceptions"": Iran President's U-Turn After Apology To Neighbours",https://www.ndtv.com/world-news/iran-war-iran-israel-us-war-live-news-no-attacks-on-neighbours-iran-president-says-enemys-misconceptions-11185844,2026-03-08T16:38:09+00:00
NDTV,most_read,15,"""Chacha Idhar Dhyaan De"" : Viral Video Claims Iran Missile Onslaught On Qatar",https://www.ndtv.com/world-news/israel-iran-war-us-base-qatar-dubai-news-bhago-yahan-se-chacha-viral-video-claims-iran-missile-onslaught-on-qatar-11185849,2026-03-08T16:38:09+00:00
NDTV,most_read,16,"""Let's Go For Final Drive"": YouTuber Anurag Dobhal Livestreams Crash At 150kmph",https://www.ndtv.com/india-news/uk07-rider-bigg-boss-toyota-fortuner-desperately-needed-love-youtuber-anurag-dobhal-livestreams-crash-at-150kmph-11183633,2026-03-08T16:38:09+00:00
NDTV,most_read,17,"First Came Inferno, Then Darkness: Tehran 'Blacked Out' After Oil Depots Hit",https://www.ndtv.com/world-news/israel-iran-war-oil-depot-airstrikes-first-inferno-then-darkness-smoke-from-burning-oil-blots-out-sun-in-tehran-11186321,2026-03-08T16:38:09+00:00
NDTV,most_read,18,Iran's Shahed Missions Trigger Acceleration In India's Strike Drone Projects,https://www.ndtv.com/india-news/iran-israel-war-shahed-missions-trigger-acceleration-in-indias-strike-drone-projects-11185402,2026-03-08T16:38:09+00:00
NDTV,most_read,19,Khamenei's Top Aide Warns 'Won't Leave Trump Alone'. He Responds,https://www.ndtv.com/world-news/top-iran-official-ali-larijanis-warning-to-trump-as-war-escalates-over-ali-khamenei-killing-wont-leave-him-alone-11184773,2026-03-08T16:38:09+00:00
NDTV,most_read,20,PM Modi Inaugurates India's First 'Ring Metro' In Delhi,https://www.ndtv.com/india-news/pm-modi-inaugurates-indias-first-ring-metro-in-delhi-11185090,2026-03-08T16:38:09+00:00
NDTV,most_read,21,Video: Apocalyptic Inferno Lights Up Iranian Capital As Massive Fire Rages,https://www.ndtv.com/world-news/iran-israel-war-live-updates-tehran-video-apocalyptic-scenes-in-tehran-after-overnight-israeli-onslaught-11185517,2026-03-08T16:38:09+00:00
NDTV,most_read,22,"'No Water In Washroom, Garbage On Road': Centre vs Bengal Over President Trip",https://www.ndtv.com/india-news/president-droupadi-murmu-pm-narendra-modi-mamata-banerjee-bjp-misusing-countrys-highest-chair-mamata-banerjee-amid-president-row-11184307,2026-03-08T16:38:09+00:00
NDTV,most_read,23,"A Tale Of 2 Protests: Why Nepal Embraced Gen Z Impact, But Bangladesh Didn't",https://www.ndtv.com/world-news/nepal-elections-2026-gen-z-bangladesh-protests-tale-of-two-protests-how-balen-shah-trumped-in-nepal-but-bangladeshs-students-party-failed-11183414,2026-03-08T16:38:09+00:00
NDTV,most_read,24,"Hungary Seizes Millions In Cash And Gold From Ukrainian Convoy, Seven Detained",https://www.ndtv.com/world-news/hungary-seizes-millions-in-cash-and-gold-from-ukrainian-convoy-seven-detained-11181562,2026-03-08T16:38:09+00:00
NDTV,most_read,25,"Kuwait Airport Targeted, Saudi Intercepts Drones As Iran Continues Attacks",https://www.ndtv.com/world-news/us-iran-israel-war-middle-east-conflict-dubai-news-kuwait-airport-targeted-saudi-intercepts-drones-as-iran-continues-attacks-11184235,2026-03-08T16:38:09+00:00
NDTV,most_read,26,"""Please Mind Your Business"": Kamal Haasan Slams Trump Amid ""Permission"" Row",https://www.ndtv.com/india-news/donald-trump-russian-oil-kamal-haasan-please-mind-your-business-kamal-haasan-slams-trump-amid-permission-row-11184513,2026-03-08T16:38:09+00:00
NDTV,most_read,27,RM Nachammai Becomes 1st Woman At Helm Of Functional Nuclear Power Plant,https://www.ndtv.com/india-news/rm-nachammai-becomes-first-woman-at-helm-of-functional-nuclear-power-plant-11185034,2026-03-08T16:38:09+00:00
NDTV,most_read,28,"From 'Permitting' To 'Partnering', US Shifts Energy Lingo Amid Gulf Crisis",https://www.ndtv.com/world-news/iran-israel-war-from-permitting-to-partnering-us-shifts-energy-language-amid-gulf-crisis-11185095,2026-03-08T16:38:09+00:00
NDTV,most_read,29,"International Women's Day 2026: 20 Inspiring Wishes, Quotes And Messages",https://www.ndtv.com/offbeat/international-womens-day-2026-20-wishes-quotes-and-whatsapp-messages-to-celebrate-women-11183049,2026-03-08T16:38:09+00:00
NDTV,most_read,30,"Iran Says Can Fight ""Intense War"" For 6 Months As Israel, US Step Up Strikes",https://www.ndtv.com/world-news/iran-says-can-fight-intense-war-for-6-months-as-israel-us-step-up-strikes-11185203,2026-03-08T16:38:09+00:00
NDTV,most_read,31,Middle East Tensions LIVE Updates,https://www.ndtv.com/world-news/us-israel-iran-war-news-live-updates-donald-trump-netanyahu-iris-dena-middle-east-war-enters-day-7-11175202,2026-03-08T16:38:09+00:00
NDTV,trending,1,Over 500 From Andhra Pradesh Stranded In Middle East Return To India,https://www.ndtv.com/india-news/israel-iran-war-over-500-from-andhra-pradesh-stranded-in-middle-east-return-to-india-11186681,2026-03-08T16:38:09+00:00
NDTV,trending,2,"Man, 21, Arrested For Stabbing Lover Over Suspected Affair In Dehradun: Cops",https://www.ndtv.com/india-news/man-21-arrested-for-stabbing-lover-over-suspected-affair-in-dehradun-cops-11186658,2026-03-08T16:38:09+00:00
NDTV,trending,3,"Dalit Man Dies In Police Custody In Tamil Nadu, Family Alleges Torture",https://www.ndtv.com/india-news/dalit-man-dies-in-police-custody-in-tamil-nadu-family-alleges-torture-11186597,2026-03-08T16:38:09+00:00
NDTV,trending,4,Man Arrested For Drowning 3 Minor Daughters In Lake In Telangana: Cops,https://www.ndtv.com/india-news/man-arrested-for-drowning-3-minor-daughters-in-lake-in-telangana-cops-11186481,2026-03-08T16:38:09+00:00
NDTV,trending,5,"""Why Governor Resigned,"" Asks Mamata Banerjee. ""Confidential,"" Says CV Bose",https://www.ndtv.com/india-news/why-governor-resigned-asks-mamata-banerjee-confidential-says-cv-ananda-bose-11186379,2026-03-08T16:38:09+00:00
NDTV,trending,6,"CBSE Class 12 Mathematics Exam On March 9, Check Last-Minute Tips From Educators",https://www.ndtv.com/education/cbse-class-12-mathematics-exam-on-march-9-check-last-minute-tips-from-educators-11186304,2026-03-08T16:38:09+00:00
NDTV,trending,7,"School Assembly News Headlines (March 9): Top National, World, Other News",https://www.ndtv.com/education/school-assembly-news-headlines-march-9-top-national-world-sports-business-news-11186096,2026-03-08T16:38:09+00:00
NDTV,trending,8,"SSC CGL 2025 Exam: Vacancies Increased To 15,130, Applications Invited For Post Preference",https://www.ndtv.com/education/ssc-cgl-2025-exam-vacancies-increased-to-15-130-applications-invited-for-post-department-preference-11185945,2026-03-08T16:38:09+00:00
NDTV,trending,9,"PM Modi To Speak On Education, Skills And University Townships On March 9",https://www.ndtv.com/education/pm-modi-to-speak-on-education-skills-and-university-townships-on-march-9-during-post-budget-webinar-11185549,2026-03-08T16:38:09+00:00
NDTV,trending,10,Vaishno Devi Medical College Seeks Fresh NMC Nod To Restart MBBS Course,https://www.ndtv.com/education/vaishno-devi-medical-college-seeks-fresh-nod-from-commission-to-restart-mbbs-course-11185455,2026-03-08T16:38:09+00:00
NDTV,trending,11,Nepal Election Results,https://www.ndtv.com/world-news/nepal-election-2026-results-live-updates-balendra-shah-gagan-thapa-kp-sharma-oli-nepal-to-count-votes-shortly-for-first-polls-held-after-gen-z-protest-11175123,2026-03-08T16:38:09+00:00
NDTV,trending,12,"Regime Change, Uranium Stockpile, And The US Dilemma To Invade Iran",https://www.ndtv.com/world-news/iran-war-news-iran-israel-us-war-live-news-the-suspense-around-us-boots-on-ground-in-iran-and-why-it-may-be-necessary-11186562,2026-03-08T16:38:09+00:00
NDTV,trending,13,"""Enemy's Misconceptions"": Iran President's U-Turn After Apology To Neighbours",https://www.ndtv.com/world-news/iran-war-iran-israel-us-war-live-news-no-attacks-on-neighbours-iran-president-says-enemys-misconceptions-11185844,2026-03-08T16:38:09+00:00
NDTV,trending,14,Iranian Sailor Told Father Of US Ultimatum Before Torpedo Attack: Report,https://www.ndtv.com/world-news/iran-israel-war-iranian-sailor-told-father-of-us-ultimatum-before-torpedo-attack-report-11184910,2026-03-08T16:38:09+00:00
NDTV,trending,15,"""Chacha Idhar Dhyaan De"" : Viral Video Claims Iran Missile Onslaught On Qatar",https://www.ndtv.com/world-news/israel-iran-war-us-base-qatar-dubai-news-bhago-yahan-se-chacha-viral-video-claims-iran-missile-onslaught-on-qatar-11185849,2026-03-08T16:38:09+00:00
NDTV,trending,16,Iran's Shahed Missions Trigger Acceleration In India's Strike Drone Projects,https://www.ndtv.com/india-news/iran-israel-war-shahed-missions-trigger-acceleration-in-indias-strike-drone-projects-11185402,2026-03-08T16:38:09+00:00
NDTV,trending,17,Khamenei's Top Aide Warns 'Won't Leave Trump Alone'. He Responds,https://www.ndtv.com/world-news/top-iran-official-ali-larijanis-warning-to-trump-as-war-escalates-over-ali-khamenei-killing-wont-leave-him-alone-11184773,2026-03-08T16:38:09+00:00
NDTV,trending,18,"""Let's Go For Final Drive"": YouTuber Anurag Dobhal Livestreams Crash At 150kmph",https://www.ndtv.com/india-news/uk07-rider-bigg-boss-toyota-fortuner-desperately-needed-love-youtuber-anurag-dobhal-livestreams-crash-at-150kmph-11183633,2026-03-08T16:38:09+00:00
NDTV,trending,19,"First Came Inferno, Then Darkness: Tehran 'Blacked Out' After Oil Depots Hit",https://www.ndtv.com/world-news/israel-iran-war-oil-depot-airstrikes-first-inferno-then-darkness-smoke-from-burning-oil-blots-out-sun-in-tehran-11186321,2026-03-08T16:38:09+00:00
NDTV,trending,20,"'No Water In Washroom, Garbage On Road': Centre vs Bengal Over President Trip",https://www.ndtv.com/india-news/president-droupadi-murmu-pm-narendra-modi-mamata-banerjee-bjp-misusing-countrys-highest-chair-mamata-banerjee-amid-president-row-11184307,2026-03-08T16:38:09+00:00
NDTV,trending,21,Video: Apocalyptic Inferno Lights Up Iranian Capital As Massive Fire Rages,https://www.ndtv.com/world-news/iran-israel-war-live-updates-tehran-video-apocalyptic-scenes-in-tehran-after-overnight-israeli-onslaught-11185517,2026-03-08T16:38:09+00:00
NDTV,trending,22,PM Modi Inaugurates India's First 'Ring Metro' In Delhi,https://www.ndtv.com/india-news/pm-modi-inaugurates-indias-first-ring-metro-in-delhi-11185090,2026-03-08T16:38:09+00:00
NDTV,trending,23,Jeffrey Epstein's Prison Guard Searched Him On Google Minutes Before He Was Found Dead,https://www.ndtv.com/world-news/jeffrey-epsteins-prison-guard-tova-noel-searched-him-on-google-minutes-before-he-was-found-dead-11184948,2026-03-08T16:38:09+00:00
NDTV,trending,24,Actor Parthiban Takes An Indirect Dig At Trisha For Her Latest Public Appearance With Vijay: 'She Better Sit At Home',https://www.ndtv.com/entertainment/actor-parthiban-takes-an-indirect-dig-at-trisha-for-her-latest-public-appearance-with-vijay-she-better-sit-at-home-11185705,2026-03-08T16:38:09+00:00
NDTV,trending,25,RM Nachammai Becomes First Woman At Helm Of Functional Nuclear Power Plant,https://www.ndtv.com/india-news/rm-nachammai-becomes-first-woman-at-helm-of-functional-nuclear-power-plant-11185034,2026-03-08T16:38:09+00:00
NDTV,trending,26,Middle East Tensions LIVE Updates,https://www.ndtv.com/world-news/us-israel-iran-war-news-live-updates-donald-trump-netanyahu-iris-dena-middle-east-war-enters-day-7-11175202,2026-03-08T16:38:09+00:00
India Today,trending,1,Reddit user moved to Delhi from Assam expecting it to be expensive. And then...,https://www.indiatoday.in/trending-news/story/reddit-user-moved-to-delhi-from-assam-expecting-it-to-be-expensive-and-then-2879049-2026-03-08,2026-03-08T16:38:09+00:00
India Today,trending,2,Bengaluru man shares post about Ahmedabad's late-night vibe. Internet weighs in,https://www.indiatoday.in/trending-news/story/bengaluru-man-shares-post-about-ahmedabads-late-night-vibe-internet-weighs-in-2879024-2026-03-08,2026-03-08T16:38:09+00:00
India Today,trending,3,Australian High Commission celebrates women diplomats in Dhurandhar style,https://www.indiatoday.in/trending-news/story/australian-high-commission-celebrates-women-diplomats-in-dhurandhar-style-womens-day-2026-2879010-2026-03-08,2026-03-08T16:38:09+00:00
India Today,trending,4,Tamil Nadu principal sponsors first flight for 20 government school students,https://www.indiatoday.in/trending-news/story/tamil-nadu-principal-sponsors-first-flight-for-20-government-school-students-2878980-2026-03-08,2026-03-08T16:38:09+00:00
India Today,trending,5,Woman's clever hack for getting a seat in crowded Mumbai local wows 3 million,https://www.indiatoday.in/trending-news/story/womans-clever-hack-for-getting-a-seat-in-crowded-mumbai-local-wows-3-million-2878965-2026-03-08,2026-03-08T16:38:09+00:00
