source,section,rank,headline,link,collected_at_iso
Times of India,most_read,1,"Lucknow double murder: Man rapes, kills woman, strangles partially blind son who tried to save her",https://timesofindia.indiatimes.com/articleshow/129478808.cms,2026-03-13T05:16:00+00:00
Times of India,most_read,2,"'Constantly humiliated, caused mental trauma': Mumbai dentist's chilling death note shocks kin; how troubled relationship ended in tragedy",https://timesofindia.indiatimes.com/articleshow/129432457.cms,2026-03-13T05:16:00+00:00
Times of India,most_read,3,"Domestic LPG bookings soar, many say unable to book online",https://timesofindia.indiatimes.com/articleshow/129521073.cms,2026-03-13T05:16:00+00:00
Times of India,most_read,4,Karnataka horror: Couple ends lives after domestic dispute; toddler survives ‘murder’ bid by father,https://timesofindia.indiatimes.com/articleshow/129347868.cms,2026-03-13T05:16:00+00:00
Times of India,most_read,5,"Pakistan strikes Afghanistan again, killing 4; homes in Kabul hit in attack",https://timesofindia.indiatimes.com/articleshow/129534987.cms,2026-03-13T05:16:00+00:00
Times of India,most_read,6,Why Harish Rana's parents had to plead for his death for 13 long years,https://timesofindia.indiatimes.com/articleshow/129503926.cms,2026-03-13T05:16:00+00:00
Times of India,most_read,7,"US KC-135 Stratotanker crashes in Iraq: Watch midair refuelling in action, how the process works",https://timesofindia.indiatimes.com/articleshow/129533096.cms,2026-03-13T05:16:00+00:00
Times of India,most_read,8,"After T20 World Cup heroics, can Sanju and Ishan break into India’s ODI plans?",https://timesofindia.indiatimes.com/articleshow/129534718.cms,2026-03-13T05:16:00+00:00
Times of India,most_read,9,‘Acknowledging the obvious’: Russia reacts to US waiver on oil amid Iran war,https://timesofindia.indiatimes.com/articleshow/129535565.cms,2026-03-13T05:16:00+00:00
Times of India,most_read,10,What the SC got right with end-of-life care in India,https://timesofindia.indiatimes.com/articleshow/129515136.cms,2026-03-13T05:16:00+00:00
Times of India,most_read,11,Dell backs Sam Altman on Pentagon deal: Firms can’t control tech use by govt,https://timesofindia.indiatimes.com/articleshow/129519951.cms,2026-03-13T05:16:00+00:00
Times of India,most_read,12,Mustafizur lands Hundred deal as two Pakistan players also picked in auction,https://timesofindia.indiatimes.com/articleshow/129534039.cms,2026-03-13T05:16:00+00:00
Times of India,most_read,13,"Sacked vendor storms Hindustan Petroleum plant, kills manager & deputy manager",https://timesofindia.indiatimes.com/articleshow/129520268.cms,2026-03-13T05:16:00+00:00
Times of India,most_read,14,"H-1B visa employers database offline, key public records disappear; USCIS responds",https://timesofindia.indiatimes.com/articleshow/129506365.cms,2026-03-13T05:16:00+00:00
Times of India,most_read,15,"'They were going to take over Middle East': Trump says Iran had 1,200 missiles pointed at 4 nations",https://timesofindia.indiatimes.com/articleshow/129533119.cms,2026-03-13T05:16:00+00:00
Times of India,most_read,16,‘For their own life and safety’: Trump questions Iran’s participation at FIFA World Cup,https://timesofindia.indiatimes.com/articleshow/129534475.cms,2026-03-13T05:16:00+00:00
Times of India,most_read,17,IMD issues fresh heatwave alert for Mumbai on Friday and Saturday,https://timesofindia.indiatimes.com/articleshow/129513776.cms,2026-03-13T05:16:00+00:00
Times of India,most_read,18,Iran sets three conditions for talks with US as Middle East war rages on,https://timesofindia.indiatimes.com/articleshow/129494757.cms,2026-03-13T05:16:00+00:00
Times of India,most_read,19,India gets safe passage amid attack on tankers: Iran allows ships through Strait of Hormuz after Jaishankar speaks to counterpart,https://timesofindia.indiatimes.com/articleshow/129494866.cms,2026-03-13T05:16:00+00:00
Times of India,most_read,20,Lok Sabha showdown continues: Speaker stops Rahul Gandhi mid-speech after his remark on Hardeep Puri,https://timesofindia.indiatimes.com/articleshow/129509048.cms,2026-03-13T05:16:00+00:00
Times of India,most_read,21,"US launches probe into 'unfair' trade practices by countries, India on list",https://timesofindia.indiatimes.com/articleshow/129485246.cms,2026-03-13T05:16:00+00:00
Times of India,most_read,22,'We are simply not ready': US says its military cannot escort vessels in Strait of Hormuz right now,https://timesofindia.indiatimes.com/articleshow/129507767.cms,2026-03-13T05:16:00+00:00
Times of India,most_read,23,Pakistan cricketer Mohammad Rizwan's 'I don't watch India's matches' remark resurfaces after Bangladesh humiliation,https://timesofindia.indiatimes.com/articleshow/129469055.cms,2026-03-13T05:16:00+00:00
Times of India,most_read,24,"Shakti Mohan refused to be paid for 'Padmaavat' song, says Sanjay Leela Bhansali is very strict: 'Even if you breathe...'",https://timesofindia.indiatimes.com/articleshow/129499204.cms,2026-03-13T05:16:00+00:00
Times of India,most_read,25,‘He was very angry’: Suryakumar Yadav reveals he apologised to Axar Patel after T20 World Cup snub,https://timesofindia.indiatimes.com/articleshow/129496276.cms,2026-03-13T05:16:00+00:00
Times of India,most_read,26,Watch: Moment Iranian 'suicide boat' struck US-owned tanker,https://timesofindia.indiatimes.com/articleshow/129504916.cms,2026-03-13T05:16:00+00:00
Times of India,most_read,27,'Wanted to kill him for 20 years': What we know about assassination attempt on Farooq Abdullah,https://timesofindia.indiatimes.com/articleshow/129487851.cms,2026-03-13T05:16:00+00:00
Times of India,most_read,28,"Hundred Auction 2026: Pakistan's Haris Rauf goes unsold, Shaheen Afridi makes late withdrawal",https://timesofindia.indiatimes.com/articleshow/129504305.cms,2026-03-13T05:16:00+00:00
Times of India,most_read,29,"Hundred Auction 2026: Indian-owned SunRisers Leeds buy Pakistan player, Usman Tariq also picked",https://timesofindia.indiatimes.com/articleshow/129511774.cms,2026-03-13T05:16:00+00:00
Times of India,most_read,30,'Are you serious?': Sachin Tendulkar’s reaction after BCCI selectors told him it was time to move on,https://timesofindia.indiatimes.com/articleshow/129500994.cms,2026-03-13T05:16:00+00:00
Times of India,most_read,31,'Insult to national flag': Complaint filed against Hardik Pandya over T20 WC celebration,https://timesofindia.indiatimes.com/articleshow/129492203.cms,2026-03-13T05:16:00+00:00
Times of India,most_read,32,"Match-fixing storm: ICC charges West Indies player, two officials; all suspended from cricket with immediate effect",https://timesofindia.indiatimes.com/articleshow/129500603.cms,2026-03-13T05:16:00+00:00
Times of India,most_read,33,"'We make lot of money': Trump on rising oil prices, says stopping 'evil empire Iran' is of greater interest",https://timesofindia.indiatimes.com/articleshow/129510838.cms,2026-03-13T05:16:00+00:00
Times of India,most_read,34,IAF wing commander dies by suicide at home; had frequent disputes with Bengaluru techie wife,https://timesofindia.indiatimes.com/articleshow/129490068.cms,2026-03-13T05:16:00+00:00
Times of India,most_read,35,Farooq Abdullah's first reaction after assassination attempt: 'The killer always has an advantage',https://timesofindia.indiatimes.com/articleshow/129496820.cms,2026-03-13T05:16:00+00:00
Times of India,most_read,36,"Late Khamenei's wife alive, says report; son recalls seeing Iran leader's body after US-Israel strike",https://timesofindia.indiatimes.com/articleshow/129517077.cms,2026-03-13T05:16:00+00:00
Times of India,most_read,37,Liberia-flagged tanker ‘Shenlong’ carrying Saudi crude enters India via Strait of Hormuz,https://timesofindia.indiatimes.com/articleshow/129498755.cms,2026-03-13T05:16:00+00:00
Times of India,most_read,38,‘He doesn't need to say sorry’: Gautam Gambhir backs Arshdeep Singh after Daryl Mitchell incident in T20 World Cup final,https://timesofindia.indiatimes.com/articleshow/129488911.cms,2026-03-13T05:16:00+00:00
Times of India,most_read,39,"'Jaishankar spoke to Iran FM 3 times': India flags ships safety, energy security concerns",https://timesofindia.indiatimes.com/articleshow/129501928.cms,2026-03-13T05:16:00+00:00
Times of India,most_read,40,Kritika Kamra and Gaurav Kapur's wedding: FIRST INSIDE photos from their intimate ceremony at their Mumbai home go viral,https://timesofindia.indiatimes.com/articleshow/129485599.cms,2026-03-13T05:16:00+00:00
Times of India,most_read,41,"'Strait of Hormuz will stay closed to pressure enemies', says Khamenei amid global fuel crisis",https://timesofindia.indiatimes.com/articleshow/129512791.cms,2026-03-13T05:16:00+00:00
Times of India,most_read,42,Sanju Samson’s wife Charulatha’s sweet gesture with his Player of the Tournament trophy melts fans’ hearts – Watch,https://timesofindia.indiatimes.com/articleshow/129490066.cms,2026-03-13T05:16:00+00:00
Times of India,most_read,43,Why time is ripe for Suryakumar Yadav to follow in Rohit Sharma's footsteps,https://timesofindia.indiatimes.com/articleshow/129498243.cms,2026-03-13T05:16:00+00:00
Times of India,most_read,44,Explosions at Oman's Salalah port: Iran drones hit fuel storage oil tanks? Tehran denies role as war with US-Israel engulfs Middle East,https://timesofindia.indiatimes.com/articleshow/129485462.cms,2026-03-13T05:16:00+00:00
Times of India,most_read,45,Went dark on a shadow voyage: How India-bound vessel crossed Strait of Hormuz,https://timesofindia.indiatimes.com/articleshow/129502419.cms,2026-03-13T05:16:00+00:00
Times of India,most_read,46,'No hostile or friendly fire': US refueling aircraft crashes in western Iraq; rescue operations on,https://timesofindia.indiatimes.com/articleshow/129526087.cms,2026-03-13T05:16:00+00:00
Times of India,most_read,47,Devner Nuggets vs San Antonio Spurs Injury,https://timesofindia.indiatimes.com/articleshow/129528595.cms,2026-03-13T05:16:00+00:00
Times of India,most_read,48,Los Angeles Lakers vs Chicago Bulls Injury Report,https://timesofindia.indiatimes.com/articleshow/129530035.cms,2026-03-13T05:16:00+00:00
Times of India,most_read,49,MLB Trade Rumors,https://timesofindia.indiatimes.com/articleshow/129531775.cms,2026-03-13T05:16:00+00:00
Times of India,most_read,50,KKR IPL 2026 Schedule,https://timesofindia.indiatimes.com/articleshow/129493202.cms,2026-03-13T05:16:00+00:00
Times of India,most_read,51,LSG IPL 2026 Schedule,https://timesofindia.indiatimes.com/articleshow/129502931.cms,2026-03-13T05:16:00+00:00
Times of India,most_read,52,PBKS IPL 2026 Schedule,https://timesofindia.indiatimes.com/articleshow/129497890.cms,2026-03-13T05:16:00+00:00
Times of India,most_read,53,GT IPL 2026 Schedule,https://timesofindia.indiatimes.com/articleshow/129503594.cms,2026-03-13T05:16:00+00:00
Times of India,most_read,54,Old Dominion University shooting,https://timesofindia.indiatimes.com/articleshow/129518819.cms,2026-03-13T05:16:00+00:00
Times of India,most_read,55,US Stock Market News,https://timesofindia.indiatimes.com/articleshow/129513899.cms,2026-03-13T05:16:00+00:00
Times of India,most_read,56,Dubai Eid Holidays,https://timesofindia.indiatimes.com/articleshow/129497390.cms,2026-03-13T05:16:00+00:00
Times of India,most_read,57,New draft law,https://timesofindia.indiatimes.com/articleshow/129507472.cms,2026-03-13T05:16:00+00:00
Times of India,most_read,58,H‑1B visa job,https://timesofindia.indiatimes.com/articleshow/129514374.cms,2026-03-13T05:16:00+00:00
Times of India,most_read,59,US Reliance Oil Refinery,https://timesofindia.indiatimes.com/articleshow/129499055.cms,2026-03-13T05:16:00+00:00
Times of India,most_read,60,Dhurandhar The Revenge,https://timesofindia.indiatimes.com/articleshow/129492826.cms,2026-03-13T05:16:00+00:00
Times of India,most_read,61,Archana Puran Singh,https://timesofindia.indiatimes.com/articleshow/129465477.cms,2026-03-13T05:16:00+00:00
Times of India,most_read,62,Dubai Airports Update,https://timesofindia.indiatimes.com/articleshow/129492779.cms,2026-03-13T05:16:00+00:00
Times of India,most_read,63,Anurag Dobhal Wife,https://timesofindia.indiatimes.com/articleshow/129494827.cms,2026-03-13T05:16:00+00:00
Times of India,most_read,64,Bhooth Bangla Teaser,https://timesofindia.indiatimes.com/articleshow/129495135.cms,2026-03-13T05:16:00+00:00
Times of India,most_read,65,Hari Murali Death News,https://timesofindia.indiatimes.com/articleshow/129495367.cms,2026-03-13T05:16:00+00:00
Times of India,most_read,66,Cooked Chicken Shelf Life,https://timesofindia.indiatimes.com/articleshow/129348795.cms,2026-03-13T05:16:00+00:00
Times of India,most_read,67,Lpg Cylinder Shortage,https://timesofindia.indiatimes.com/articleshow/129500537.cms,2026-03-13T05:16:00+00:00
Times of India,most_read,68,Nasa Satellite Crash,https://timesofindia.indiatimes.com/articleshow/129379719.cms,2026-03-13T05:16:00+00:00
Times of India,most_read,69,Indian Cobra VS Egyptian Cobra,https://timesofindia.indiatimes.com/articleshow/129376134.cms,2026-03-13T05:16:00+00:00
Times of India,most_read,70,Wuthering Waves 3.2,https://timesofindia.indiatimes.com/articleshow/129517709.cms,2026-03-13T05:16:00+00:00
Times of India,most_read,71,CTET Answer Key 2026,https://timesofindia.indiatimes.com/articleshow/129508509.cms,2026-03-13T05:16:00+00:00
Times of India,most_read,72,UPPSC APO Admit Card,https://timesofindia.indiatimes.com/articleshow/129510033.cms,2026-03-13T05:16:00+00:00
Times of India,most_read,73,RRB NTPC admit card 2026,https://timesofindia.indiatimes.com/articleshow/129489043.cms,2026-03-13T05:16:00+00:00
Times of India,most_read,74,NBEMS GPAT 2026 answer key,https://timesofindia.indiatimes.com/articleshow/129512563.cms,2026-03-13T05:16:00+00:00
Times of India,most_read,75,RTE Rajasthan Lottery result,https://timesofindia.indiatimes.com/articleshow/129511934.cms,2026-03-13T05:16:00+00:00
Times of India,most_read,76,LPG Shortage Delhi,https://timesofindia.indiatimes.com/articleshow/129502698.cms,2026-03-13T05:16:00+00:00
Times of India,most_read,77,Strait of Hormuz,https://timesofindia.indiatimes.com/articleshow/129511873.cms,2026-03-13T05:16:00+00:00
Times of India,most_read,78,Iran Warns US Tech Firms,https://timesofindia.indiatimes.com/articleshow/129458745.cms,2026-03-13T05:16:00+00:00
Times of India,most_read,79,Royal Enfield Meteor 350 Vs Jawa 42 FJ,https://timesofindia.indiatimes.com/articleshow/129494130.cms,2026-03-13T05:16:00+00:00
Times of India,most_read,80,"Delhi high court questions Delhi University, police over blanket ban on protests",https://timesofindia.indiatimes.com/articleshow/129535735.cms,2026-03-13T05:16:00+00:00
Times of India,most_read,81,"TOI Exclusive | ‘Playing for India, mind becomes stronger than the body’: VVS Laxman recounts his epic Eden knock in 2001",https://timesofindia.indiatimes.com/articleshow/129535380.cms,2026-03-13T05:16:00+00:00
Times of India,most_read,82,Varalaxmi Sarathkumar's opinion on having kids only after financial stability; Netizens REACT,https://timesofindia.indiatimes.com/articleshow/129535371.cms,2026-03-13T05:16:00+00:00
Times of India,most_read,83,"HC stops transfer of ₹2,840cr in stakes from city-based firm",https://timesofindia.indiatimes.com/articleshow/129535455.cms,2026-03-13T05:16:00+00:00
Times of India,most_read,84,Ed Sheeran talks about 'the worst day' of his life,https://timesofindia.indiatimes.com/articleshow/129535248.cms,2026-03-13T05:16:00+00:00
Times of India,most_read,85,First crewed Moon mission in over 50 years: Nasa announces Artemis II launch 'as early as April 1',https://timesofindia.indiatimes.com/articleshow/129535032.cms,2026-03-13T05:16:00+00:00
Times of India,most_read,86,This giant boa hanging in Puerto Rico caves leaves scientists stunned; know what is it waiting for,https://timesofindia.indiatimes.com/articleshow/129516543.cms,2026-03-13T05:16:00+00:00
Times of India,most_read,87,"'Family Guy' spinoff series is titled 'Stewie', approved for two seasons - Report",https://timesofindia.indiatimes.com/articleshow/129534865.cms,2026-03-13T05:16:00+00:00
Times of India,most_read,88,"Days after breakup with Anamaria Goltes, Lakers celebrate Luka Doncic’s pride as father of two daughters",https://timesofindia.indiatimes.com/articleshow/129535143.cms,2026-03-13T05:16:00+00:00
Times of India,most_read,89,"March 13, 2026, Birthday Forecast: Discover what the next 12 months hold for you",https://timesofindia.indiatimes.com/articleshow/129509242.cms,2026-03-13T05:16:00+00:00
Times of India,most_read,90,Tommy Lee Jones joins ‘The Lowdown’ Season 2: Oscar winner to star alongside Ethan Hawke,https://timesofindia.indiatimes.com/articleshow/129510420.cms,2026-03-13T05:16:00+00:00
Times of India,most_read,91,Punjab Kings unveil new jersey ahead of IPL 2026,https://timesofindia.indiatimes.com/articleshow/129533603.cms,2026-03-13T05:16:00+00:00
Times of India,most_read,92,Jayasurya’s 'Aadu 3' release postponement rumours dismissed; Clash with 'Dhurandhar 2' still on,https://timesofindia.indiatimes.com/articleshow/129530748.cms,2026-03-13T05:16:00+00:00
Times of India,most_read,93,Middle East news: HSBC makes bold GCC prediction as Iran vs US-Israel war rattles markets and oil prices surge,https://timesofindia.indiatimes.com/articleshow/129523716.cms,2026-03-13T05:16:00+00:00
Times of India,most_read,94,"Leo Horoscope Today, March 13, 2026: Make one bold decision",https://timesofindia.indiatimes.com/articleshow/129500419.cms,2026-03-13T05:16:00+00:00
Times of India,most_read,95,"After going after Apple, Meta, Microsoft, Google; European Union’s antitrust chief now has warning for America's biggest chip companies Nvidia and AMD; says: We are looking at …",https://timesofindia.indiatimes.com/articleshow/129518308.cms,2026-03-13T05:16:00+00:00
Times of India,trending,1,"etimesYour old laptops might hide Gold! Swiss scientists pull pure Gold from scrapped computer parts using 'cheese waste'Researchers in Switzerland have developed an innovative method to extract pure gold from electronic waste using whey, a byproduct of cheese production. This eco-friendly process utilizes protein ""sponges"" to selectively capture gold ions from discarded computer parts, offering a sustainable and cost-effective alternative to traditional recycling methods.",https://timesofindia.indiatimes.com/articleshow/129537061.cms,2026-03-13T05:16:00+00:00
Times of India,trending,2,etimesThe Hundred Auction 2026 sparks controversy: Why Kavya Maran is facing online backlash over Abrar Ahmed signing,https://timesofindia.indiatimes.com/articleshow/129535900.cms,2026-03-13T05:16:00+00:00
Times of India,trending,3,etimes5 of the world’s most expensive food ingredients – some cost more than gold per gram,https://timesofindia.indiatimes.com/articleshow/129518210.cms,2026-03-13T05:16:00+00:00
Times of India,trending,4,"etimes“It hurts to close kitchens…”: Delhi restaurant shuts amid LPG crisis; owner claims ₹5,000 black market rateFood businesses across India face disruption due to an ongoing LPG shortage. In South Delhi, the North Indian restaurant Tadka Rani has temporarily ceased operations. Owner Gagandeep Singh Sapra cited the unavailability of LPG cylinders and exorbitant black market prices. He expressed distress over closing kitchens and taking the restaurant offline from delivery platforms.",https://timesofindia.indiatimes.com/articleshow/129521518.cms,2026-03-13T05:16:00+00:00
Times of India,trending,5,"etimesAre LPG delivery workers earning ₹30,000 a month? Viral post sparks debateA Varanasi investor's calculation of LPG delivery workers' daily earnings sparked online debate. While he estimated around Rs 1,000 daily based on Rs 25 per cylinder for 30-40 deliveries, social media users countered, highlighting the immense physical labor, long hours, and rising fuel costs involved. Many emphasized that the compensation is insufficient for such demanding work.",https://timesofindia.indiatimes.com/articleshow/129518768.cms,2026-03-13T05:16:00+00:00
Times of India,trending,6,US refueling aircraft crash,https://timesofindia.indiatimes.com/articleshow/129526087.cms,2026-03-13T05:16:00+00:00
Times of India,trending,7,Oil Price Today,https://timesofindia.indiatimes.com/articleshow/129533177.cms,2026-03-13T05:16:00+00:00
Times of India,trending,8,The Cookie Everyone in South Korea Is Chasing! Fans Queue for the ‘Dubai Chewy Cookie’,https://timesofindia.indiatimes.com/articleshow/129517848.cms,2026-03-13T05:16:00+00:00
Times of India,trending,9,Young girl’s viral video shows phone exploding in her face – but is it real? Here's all we know,https://timesofindia.indiatimes.com/articleshow/129515798.cms,2026-03-13T05:16:00+00:00
Times of India,trending,10,"LPG shortage hits restaurants: Bengaluru eatery shuts days after opening; owner says, “My heart is broken""",https://timesofindia.indiatimes.com/articleshow/129513362.cms,2026-03-13T05:16:00+00:00
Times of India,trending,11,‘The coolest McDonald’s’ has a real airplane inside — and people can eat there: Guess which country it’s in,https://timesofindia.indiatimes.com/articleshow/129511592.cms,2026-03-13T05:16:00+00:00
Times of India,trending,12,"Internet raises $280,000 for elderly DoorDash driver forced out of retirement after woman spots him on doorbell camera and shares his story",https://timesofindia.indiatimes.com/articleshow/129522236.cms,2026-03-13T05:16:00+00:00
Times of India,trending,13,Qatar news: Travel influencer shows escape route from Doha to Riyadh amid Iran vs US-Israel war,https://timesofindia.indiatimes.com/articleshow/129520932.cms,2026-03-13T05:16:00+00:00
Times of India,trending,14,"Dubai News: British tourist, 60, arrested for filming missiles amid Iran-US war; could face up to 2 years in prison",https://timesofindia.indiatimes.com/articleshow/129511547.cms,2026-03-13T05:16:00+00:00
Times of India,trending,15,LPG gas cylinder shortage: How to plan your family budget during the LPG crisis; smart and easy tips to make ends meet and cut gas usage,https://timesofindia.indiatimes.com/articleshow/129502557.cms,2026-03-13T05:16:00+00:00
Times of India,trending,16,Meet Asproulis: Greece's miracle dog who survived 9 days starving on a 1900m icy peak!,https://timesofindia.indiatimes.com/articleshow/129505071.cms,2026-03-13T05:16:00+00:00
Times of India,trending,17,"From Selling Rudraksh at Kumbh Mela to debut in movies: Who is Monalisa Bhosle, the 'viral Kumbh Girl'",https://timesofindia.indiatimes.com/articleshow/129502995.cms,2026-03-13T05:16:00+00:00
Times of India,trending,18,Dubai targeted again: Video shows thick black smoke after blasts; debris hits building,https://timesofindia.indiatimes.com/articleshow/129537033.cms,2026-03-13T05:16:00+00:00
Times of India,trending,19,"Pak bombs Kabul homes, Kandahar airport in renewed strikes; women, children killed - key details",https://timesofindia.indiatimes.com/articleshow/129534987.cms,2026-03-13T05:16:00+00:00
Times of India,trending,20,"Stock market today: Nifty50 goes below 23,400; BSE Sensex tumbles 900 points",https://timesofindia.indiatimes.com/articleshow/129534696.cms,2026-03-13T05:16:00+00:00
Times of India,trending,21,Murder masked as suicide? Woman burns husband alive in TN; CCTV footage exposes truth,https://timesofindia.indiatimes.com/articleshow/129519804.cms,2026-03-13T05:16:00+00:00
Times of India,trending,22,Devner Nuggets vs San Antonio Spurs Injury,https://timesofindia.indiatimes.com/articleshow/129528595.cms,2026-03-13T05:16:00+00:00
Times of India,trending,23,Los Angeles Lakers vs Chicago Bulls Injury Report,https://timesofindia.indiatimes.com/articleshow/129530035.cms,2026-03-13T05:16:00+00:00
Times of India,trending,24,MLB Trade Rumors,https://timesofindia.indiatimes.com/articleshow/129531775.cms,2026-03-13T05:16:00+00:00
Times of India,trending,25,Cricket Match Fixing,https://timesofindia.indiatimes.com/articleshow/129500603.cms,2026-03-13T05:16:00+00:00
Times of India,trending,26,US Stock Market News,https://timesofindia.indiatimes.com/articleshow/129513899.cms,2026-03-13T05:16:00+00:00
Times of India,trending,27,Dubai Eid Holidays,https://timesofindia.indiatimes.com/articleshow/129497390.cms,2026-03-13T05:16:00+00:00
Times of India,trending,28,New draft law,https://timesofindia.indiatimes.com/articleshow/129507472.cms,2026-03-13T05:16:00+00:00
Times of India,trending,29,H‑1B visa job,https://timesofindia.indiatimes.com/articleshow/129514374.cms,2026-03-13T05:16:00+00:00
Times of India,trending,30,US Reliance Oil Refinery,https://timesofindia.indiatimes.com/articleshow/129499055.cms,2026-03-13T05:16:00+00:00
Times of India,trending,31,Dhurandhar The Revenge,https://timesofindia.indiatimes.com/articleshow/129492826.cms,2026-03-13T05:16:00+00:00
Times of India,trending,32,Archana Puran Singh,https://timesofindia.indiatimes.com/articleshow/129465477.cms,2026-03-13T05:16:00+00:00
Times of India,trending,33,Dubai Airports Update,https://timesofindia.indiatimes.com/articleshow/129492779.cms,2026-03-13T05:16:00+00:00
Times of India,trending,34,Bhooth Bangla Teaser,https://timesofindia.indiatimes.com/articleshow/129495135.cms,2026-03-13T05:16:00+00:00
Times of India,trending,35,Hari Murali Death News,https://timesofindia.indiatimes.com/articleshow/129495367.cms,2026-03-13T05:16:00+00:00
Times of India,trending,36,Cooked Chicken Shelf Life,https://timesofindia.indiatimes.com/articleshow/129348795.cms,2026-03-13T05:16:00+00:00
Times of India,trending,37,Lpg Cylinder Shortage,https://timesofindia.indiatimes.com/articleshow/129500537.cms,2026-03-13T05:16:00+00:00
Times of India,trending,38,Nasa Satellite Crash,https://timesofindia.indiatimes.com/articleshow/129379719.cms,2026-03-13T05:16:00+00:00
Times of India,trending,39,Indian Cobra VS Egyptian Cobra,https://timesofindia.indiatimes.com/articleshow/129376134.cms,2026-03-13T05:16:00+00:00
