source,section,rank,headline,link,collected_at_iso
India Today,trending,16,"Uzbekistan children dance to iconic Bollywood songs, videos delight internet",https://www.indiatoday.in/trending-news/story/uzbekistan-children-dance-to-iconic-bollywood-songs-videos-delight-internet-2878603-2026-03-07,2026-03-09T13:20:01+00:00
India Today,trending,17,Bengaluru man attacked by residents after dog urinates in apartment complex,https://www.indiatoday.in/trending-news/story/bengaluru-man-attacked-by-residents-after-dog-urinates-in-apartment-complex-2878573-2026-03-07,2026-03-09T13:20:01+00:00
India Today,trending,18,Women dressed in sarees bring traditional fashion to snowboarding. Video goes viral,https://www.indiatoday.in/trending-news/story/women-dressed-in-sarees-bring-traditional-fashion-to-snowboarding-video-goes-viral-2878547-2026-03-07,2026-03-09T13:20:01+00:00
India Today,trending,19,UP headmistress makes primary school students give her body massage in class,https://www.indiatoday.in/trending-news/story/up-headmistress-makes-primary-school-students-give-her-body-massage-in-class-video-viral-2878411-2026-03-06,2026-03-09T13:20:01+00:00
India Today,trending,20,"Man returns to Delhi from Dubai amid Iran war, internet gushes over his 'face card'",https://www.indiatoday.in/trending-news/story/man-interviewed-at-delhi-airport-leaves-internet-gushing-over-his-lethal-face-card-2878367-2026-03-06,2026-03-09T13:20:01+00:00
India Today,trending,21,"7-year-old sexually assaulted in Tamil Nadu, found crying in blood-stained clothes",https://www.indiatoday.in/india/story/tamil-nadu-namakkal-aiadmk-bjp-dmk-government-over-sexual-abuse-of-minor-2879361-2026-03-09,2026-03-09T13:20:01+00:00
India Today,trending,22,"Will Sensex, Nifty recover tomorrow? 3 things stock market investors should know",https://www.indiatoday.in/business/market/story/sensex-nifty-crash-will-stock-markets-recover-3-things-investors-should-know-2879468-2026-03-09,2026-03-09T13:20:01+00:00
India Today,trending,23,"UPSC clarifies after Rank 301 confusion, Ghazipur’s Akanksha Singh's claim confirmed",https://www.indiatoday.in/education-today/news/story/upsc-clarifies-after-rank-301-confusion-ghazipurs-akanksha-singhs-claim-confirmed-2879466-2026-03-09,2026-03-09T13:20:01+00:00
India Today,trending,24,Ravi Shastri slammed after ruining India's T20 World Cup-winning moment on commentary,https://www.indiatoday.in/sports/cricket/story/ravi-shastri-ninth-wicket-commentary-gaffe-india-t20-world-cup-win-2879296-2026-03-09,2026-03-09T13:20:01+00:00
India Today,trending,25,Another prediction backfires: Amir reacts angrily as India win T20 World Cup,https://www.indiatoday.in/sports/cricket/story/t20-world-cup-2026-mohammad-amir-angry-reaction-india-win-final-2879252-2026-03-09,2026-03-09T13:20:01+00:00
India Today,trending,26,India's 2026 T20 champions the best ever? Harbhajan shuts Rohit-Dhoni era comparisons,https://www.indiatoday.in/sports/cricket/story/ind-vs-nz-t20-world-cup-best-team-harbhajan-singh-rohit-sharma-ms-dhoni-era-comparisons-2879258-2026-03-09,2026-03-09T13:20:01+00:00
India Today,trending,27,"Both you fossils: Dinesh Karthik's unmissable banter with Nasser Hussain, Michael Atheron",https://www.indiatoday.in/sports/cricket/story/dinesh-karthik-slams-michael-atherton-nasser-hussain-india-champions-trophy-criticism-2877434-2026-03-04,2026-03-09T13:20:01+00:00
India Today,most_read,1,IND vs SA: Deepak Chahar likely to be ruled out of last 2 ODIs due to injury,https://www.indiatoday.in/sports/cricket/story/india-vs-south-africa-deepak-chahar-likely-to-be-ruled-out-of-last-2-odis-due-to-injury-2009550-2022-10-07,2026-03-09T13:20:01+00:00
India Today,most_read,2,Manchester City fined over pitch invasion to celebrate Premier League title win,https://www.indiatoday.in/sports/football/story/manchester-city-fined-by-fa-over-pitch-invasion-to-celebrate-premier-league-title-win-2009534-2022-10-07,2026-03-09T13:20:01+00:00
India Today,most_read,3,Chelsea manager Potter on first month in charge: We have made little bit of progress,https://www.indiatoday.in/sports/football/story/chelsea-manager-graham-potter-on-first-month-in-charge-we-have-made-little-bit-of-progress-2009531-2022-10-07,2026-03-09T13:20:01+00:00
India Today,most_read,4,'Travesty of justice’: Experts criticise errors in UN report on forced disappearances in Bangladesh,https://www.indiatoday.in/world/story/experts-criticise-error-un-report-on-forced-disappearances-in-bangladesh-2007495-2022-10-02,2026-03-09T13:20:01+00:00
India Today,most_read,5,"Fact Check: No alcohol, homosexuality? Conservative guidelines for FIFA World Cup NOT issued by Qatar govt",https://www.indiatoday.in/fact-check/story/fifa-world-cup-guidelines-fact-check-no-alcohol-homosexuality-conservative-guidelines-for-football-world-cup-not-issued-by-qatar-govt-2009495-2022-10-07,2026-03-09T13:20:01+00:00
India Today,most_read,6,"KGF star Yash meets F1 legend Lewis Hamilton, See pic",https://www.indiatoday.in/movies/regional-cinema/story/kgf-star-yash-meets-f1-legend-lewis-hamilton-see-pic-2009525-2022-10-07,2026-03-09T13:20:01+00:00
India Today,most_read,7,"IND vs PAK: Match against India brings out the best in Nida Dar, says Sana Mir",https://www.indiatoday.in/sports/cricket/story/india-vs-pakistan-match-against-india-brings-out-the-best-in-nida-dar-says-sana-mir-2009523-2022-10-07,2026-03-09T13:20:01+00:00
India Today,most_read,8,Women's Asia Cup: India coach Powar defends batting-order reshuffle in Pakistan loss,https://www.indiatoday.in/sports/cricket/story/women-s-asia-cup-india-coach-ramesh-powar-defends-batting-order-reshuffle-in-pakistan-defeat-2009522-2022-10-07,2026-03-09T13:20:01+00:00
India Today,most_read,9,"Gauri Sawant reacts to Sushmita Sen playing her in Taali, recalls their first meeting",https://www.indiatoday.in/entertainment/ott/story/gauri-sawant-reacts-to-sushmita-sen-playing-her-in-taali-recalls-their-first-meeting-2009520-2022-10-07,2026-03-09T13:20:01+00:00
India Today,most_read,10,"'We're all shattered': Loved ones, community hold vigil for slain Sikh family in US",https://www.indiatoday.in/india/story/community-loved-ones-hold-vigil-sikh-family-murder-us-merced-city-2009515-2022-10-07,2026-03-09T13:20:01+00:00
India Today,most_read,11,Richa Chadha wears dainty Bvlgari mangalsutra in stunning pics with husband Ali Fazal. Here’s the price,https://www.indiatoday.in/lifestyle/fashion/story/richa-chadha-wears-dainty-bvlgari-mangalsutra-in-stunning-pics-with-husband-ali-fazal-here-s-the-price-2009509-2022-10-07,2026-03-09T13:20:01+00:00
India Today,most_read,12,"What to watch on Netflix, Disney+ Hotstar and Amazon Prime Video this weekend",https://www.indiatoday.in/entertainment/ott/story/what-to-watch-on-netflix-disney-hotstar-and-amazon-prime-video-this-weekend-2009510-2022-10-07,2026-03-09T13:20:01+00:00
India Today,most_read,13,Karnataka govt to hike SC/ST reservation,https://www.indiatoday.in/india/story/karnataka-hike-sc-st-reservation-quota-justice-nagamohan-das-committee-report-2009505-2022-10-07,2026-03-09T13:20:01+00:00
India Today,most_read,14,"Delhi civic body identifies 250 mosquito breeding hotspots, launches drive",https://www.indiatoday.in/cities/delhi/story/delhi-civic-body-identifies-mosquito-breeding-hotspots-launches-drive-2009508-2022-10-07,2026-03-09T13:20:01+00:00
India Today,most_read,15,"Your weekly news quiz, October 7 | Play on",https://www.indiatoday.in/india/story/your-weekly-news-quiz-october-7-play-on-2009506-2022-10-07,2026-03-09T13:20:01+00:00
India Today,most_read,16,"Salman Khan was on Mohali RPG attacker's hitlist, says Delhi Police",https://www.indiatoday.in/india/story/delhi-police-arrest-mohali-rpg-attacker-salman-khan-was-on-hit-list-2009502-2022-10-07,2026-03-09T13:20:01+00:00
India Today,most_read,17,"Iran denies security forces killed 16-year-old, says she fell off roof",https://www.indiatoday.in/world/story/iran-security-forces-16-year-old-killed-protest-on-death-of-woman-in-police-custody-2009503-2022-10-07,2026-03-09T13:20:01+00:00
India Today,most_read,18,"Vande Bharat Express rams into cattle, suffers minor damage; 2nd incident in 2 days",https://www.indiatoday.in/india/story/vande-bharat-express-hits-cattle-suffers-minor-damage-gujarat-2009490-2022-10-07,2026-03-09T13:20:01+00:00
India Today,most_read,19,2 Madhya Pradesh Congress MLAs booked for harassing woman on train,https://www.indiatoday.in/crime/story/2-madhya-pradesh-congress-mlas-booked-for-harassing-woman-on-train-2009441-2022-10-07,2026-03-09T13:20:01+00:00
India Today,most_read,20,Rashmika Mandanna has no regrets for not being able to spend time with her sister. Here's why,https://www.indiatoday.in/movies/regional-cinema/story/rashmika-mandanna-has-no-regrets-for-not-being-able-to-spend-time-with-her-sister-here-s-why-2009492-2022-10-07,2026-03-09T13:20:01+00:00
India Today,most_read,21,"7-year-old sexually assaulted in Tamil Nadu, found crying in blood-stained clothes",https://www.indiatoday.in/india/story/tamil-nadu-namakkal-aiadmk-bjp-dmk-government-over-sexual-abuse-of-minor-2879361-2026-03-09,2026-03-09T13:20:01+00:00
India Today,most_read,22,"Will Sensex, Nifty recover tomorrow? 3 things stock market investors should know",https://www.indiatoday.in/business/market/story/sensex-nifty-crash-will-stock-markets-recover-3-things-investors-should-know-2879468-2026-03-09,2026-03-09T13:20:01+00:00
India Today,most_read,23,"UPSC clarifies after Rank 301 confusion, Ghazipur’s Akanksha Singh's claim confirmed",https://www.indiatoday.in/education-today/news/story/upsc-clarifies-after-rank-301-confusion-ghazipurs-akanksha-singhs-claim-confirmed-2879466-2026-03-09,2026-03-09T13:20:01+00:00
India Today,most_read,24,"Both you fossils: Dinesh Karthik's unmissable banter with Nasser Hussain, Michael Atheron",https://www.indiatoday.in/sports/cricket/story/dinesh-karthik-slams-michael-atherton-nasser-hussain-india-champions-trophy-criticism-2877434-2026-03-04,2026-03-09T13:20:01+00:00
India Today,most_read,25,Another prediction backfires: Amir reacts angrily as India win T20 World Cup,https://www.indiatoday.in/sports/cricket/story/t20-world-cup-2026-mohammad-amir-angry-reaction-india-win-final-2879252-2026-03-09,2026-03-09T13:20:01+00:00
India Today,most_read,26,Ravi Shastri slammed after ruining India's T20 World Cup-winning moment on commentary,https://www.indiatoday.in/sports/cricket/story/ravi-shastri-ninth-wicket-commentary-gaffe-india-t20-world-cup-win-2879296-2026-03-09,2026-03-09T13:20:01+00:00
India Today,most_read,27,"Delhi, UP Police's Bumrah banter after India's T20 World Cup win goes viral",https://www.indiatoday.in/trending-news/story/delhi-police-up-police-bumrah-banter-after-india-t20-world-cup-win-goes-viral-2879299-2026-03-09,2026-03-09T13:20:01+00:00
