source,section,rank,headline,link,collected_at_iso
India Today,trending,6,"Indian businessman offers free shelter, pickup to travellers stranded in UAE",https://www.indiatoday.in/trending-news/story/indian-businessman-dhiraj-jain-offers-free-shelter-rolls-royce-pickup-to-travellers-stranded-in-uae-2878915-2026-03-08,2026-03-08T16:38:09+00:00
India Today,trending,7,IndiGo air hostesses briefly babysit toddler at boarding gate. Wholesome video,https://www.indiatoday.in/trending-news/story/indigo-air-hostesses-briefly-babysit-toddler-at-boarding-gate-wholesome-video-2878901-2026-03-08,2026-03-08T16:38:09+00:00
India Today,trending,8,"YouTuber claims to be stranded amid Middle East crisis, internet says fly economy",https://www.indiatoday.in/trending-news/story/youtuber-nonstop-dan-stranded-claims-amid-middle-east-crisis-internet-says-fly-economy-2878894-2026-03-08,2026-03-08T16:38:09+00:00
India Today,trending,9,Man shares why he 'trusted his gut' and walked away from Rs 26 lakh job offer,https://www.indiatoday.in/trending-news/story/man-shares-why-he-trusted-his-gut-and-walked-away-from-rs-26-lakh-job-offer-2878716-2026-03-07,2026-03-08T16:38:09+00:00
India Today,trending,10,Foreigner gets Mumbai local train passengers to dance to 'Saddi Galli'. Watch video,https://www.indiatoday.in/trending-news/story/foreigner-gets-mumbai-local-train-passengers-to-dance-to-saddi-galli-watch-video-2878676-2026-03-07,2026-03-08T16:38:09+00:00
India Today,trending,11,Russian tourist gets custom flip-flops made in Sri Lanka shop. Here's how it's done,https://www.indiatoday.in/trending-news/story/russian-tourist-gets-custom-flip-flops-made-in-sri-lanka-shop-heres-how-its-done-2878619-2026-03-07,2026-03-08T16:38:09+00:00
India Today,trending,12,"Uzbekistan children dance to iconic Bollywood songs, videos delight internet",https://www.indiatoday.in/trending-news/story/uzbekistan-children-dance-to-iconic-bollywood-songs-videos-delight-internet-2878603-2026-03-07,2026-03-08T16:38:09+00:00
India Today,trending,13,Bengaluru man attacked by residents after dog urinates in apartment complex,https://www.indiatoday.in/trending-news/story/bengaluru-man-attacked-by-residents-after-dog-urinates-in-apartment-complex-2878573-2026-03-07,2026-03-08T16:38:09+00:00
India Today,trending,14,Women dressed in sarees bring traditional fashion to snowboarding. Video goes viral,https://www.indiatoday.in/trending-news/story/women-dressed-in-sarees-bring-traditional-fashion-to-snowboarding-video-goes-viral-2878547-2026-03-07,2026-03-08T16:38:09+00:00
India Today,trending,15,UP headmistress makes primary school students give her body massage in class,https://www.indiatoday.in/trending-news/story/up-headmistress-makes-primary-school-students-give-her-body-massage-in-class-video-viral-2878411-2026-03-06,2026-03-08T16:38:09+00:00
India Today,trending,16,"Man returns to Delhi from Dubai amid Iran war, internet gushes over his 'face card'",https://www.indiatoday.in/trending-news/story/man-interviewed-at-delhi-airport-leaves-internet-gushing-over-his-lethal-face-card-2878367-2026-03-06,2026-03-08T16:38:09+00:00
India Today,trending,17,Andhra student punches teacher as classroom dispute turns violent. Video goes viral,https://www.indiatoday.in/trending-news/story/andhra-class-10-student-punches-teacher-as-classroom-dispute-turns-violent-video-goes-viral-2878362-2026-03-06,2026-03-08T16:38:09+00:00
India Today,trending,18,"Indian tourists prank Bangkok hotel staff with AI monkey pic, see their reactions",https://www.indiatoday.in/trending-news/story/indian-content-creators-prank-bangkok-hotel-staff-ai-monkey-image-2878259-2026-03-06,2026-03-08T16:38:09+00:00
India Today,trending,19,Odisha officials use Archimedes' principle to rescue elephant trapped in well,https://www.indiatoday.in/trending-news/story/odisha-officials-use-archimedes-principle-to-rescue-elephant-trapped-in-well-2878283-2026-03-06,2026-03-08T16:38:09+00:00
India Today,trending,20,"US man compares Ayurveda with Western healthcare, here's what he has to say",https://www.indiatoday.in/trending-news/story/us-man-in-india-compares-ayurveda-with-western-healthcare-heres-what-he-has-to-say-2878203-2026-03-06,2026-03-08T16:38:09+00:00
India Today,trending,21,Gautam Gambhir a proud coach after Abhishek Sharma lights up Ahmedabad: See pic,https://www.indiatoday.in/sports/cricket/story/ind-vs-nz-t20-world-cup-final-gautam-gambhir-ovation-abhishek-sharma-fifty-2879123-2026-03-08,2026-03-08T16:38:09+00:00
India Today,trending,22,"Tehran burns as oil depots hit, Israel warns it will target next supreme leader",https://www.indiatoday.in/world/story/israel-hit-tehran-oil-depots-iran-president-warns-of-expanded-attacks-glbs-2879120-2026-03-08,2026-03-08T16:38:09+00:00
India Today,trending,23,"AIADMK backs Vijay, accuses DMK of trying to tarnish TVK chief’s image",https://www.indiatoday.in/india/tamil-nadu/story/aiadmk-defends-vijay-amid-dmks-alleged-smear-campaign-ahead-of-tamil-nadu-elections-2024-2879118-2026-03-08,2026-03-08T16:38:09+00:00
India Today,trending,24,Aishwarya-Abhishek Bachchan dazzle at Arjun Tendulkar-Saaniya's wedding. Watch,https://www.indiatoday.in/movies/celebrities/story/aishwarya-rai-abhishek-bachchan-arrive-arjun-tendulkar-saaniya-chandhok-wedding-2877692-2026-03-05,2026-03-08T16:38:09+00:00
India Today,trending,25,"Mohammad Amir keeps vouching against India, predicts New Zealand to win T20 World Cup",https://www.indiatoday.in/sports/cricket/story/t20-world-cup-mohammad-amir-predicts-india-vs-new-zealand-final-2878984-2026-03-08,2026-03-08T16:38:09+00:00
India Today,trending,26,"Women's Day: Kangana, Kareena, Chiranjeevi, Ajay Devgn and others post wishes",https://www.indiatoday.in/movies/celebrities/story/women-day-celebrity-wishes-kareena-kapoor-khan-chiranjeevi-ajay-devgn-hema-malini-anupam-kher-tahira-kashyap-2879104-2026-03-08,2026-03-08T16:38:09+00:00
India Today,most_read,1,IND vs SA: Deepak Chahar likely to be ruled out of last 2 ODIs due to injury,https://www.indiatoday.in/sports/cricket/story/india-vs-south-africa-deepak-chahar-likely-to-be-ruled-out-of-last-2-odis-due-to-injury-2009550-2022-10-07,2026-03-08T16:38:09+00:00
India Today,most_read,2,Manchester City fined over pitch invasion to celebrate Premier League title win,https://www.indiatoday.in/sports/football/story/manchester-city-fined-by-fa-over-pitch-invasion-to-celebrate-premier-league-title-win-2009534-2022-10-07,2026-03-08T16:38:09+00:00
India Today,most_read,3,Chelsea manager Potter on first month in charge: We have made little bit of progress,https://www.indiatoday.in/sports/football/story/chelsea-manager-graham-potter-on-first-month-in-charge-we-have-made-little-bit-of-progress-2009531-2022-10-07,2026-03-08T16:38:09+00:00
India Today,most_read,4,'Travesty of justice’: Experts criticise errors in UN report on forced disappearances in Bangladesh,https://www.indiatoday.in/world/story/experts-criticise-error-un-report-on-forced-disappearances-in-bangladesh-2007495-2022-10-02,2026-03-08T16:38:09+00:00
India Today,most_read,5,"Fact Check: No alcohol, homosexuality? Conservative guidelines for FIFA World Cup NOT issued by Qatar govt",https://www.indiatoday.in/fact-check/story/fifa-world-cup-guidelines-fact-check-no-alcohol-homosexuality-conservative-guidelines-for-football-world-cup-not-issued-by-qatar-govt-2009495-2022-10-07,2026-03-08T16:38:09+00:00
India Today,most_read,6,"KGF star Yash meets F1 legend Lewis Hamilton, See pic",https://www.indiatoday.in/movies/regional-cinema/story/kgf-star-yash-meets-f1-legend-lewis-hamilton-see-pic-2009525-2022-10-07,2026-03-08T16:38:09+00:00
India Today,most_read,7,"IND vs PAK: Match against India brings out the best in Nida Dar, says Sana Mir",https://www.indiatoday.in/sports/cricket/story/india-vs-pakistan-match-against-india-brings-out-the-best-in-nida-dar-says-sana-mir-2009523-2022-10-07,2026-03-08T16:38:09+00:00
India Today,most_read,8,Women's Asia Cup: India coach Powar defends batting-order reshuffle in Pakistan loss,https://www.indiatoday.in/sports/cricket/story/women-s-asia-cup-india-coach-ramesh-powar-defends-batting-order-reshuffle-in-pakistan-defeat-2009522-2022-10-07,2026-03-08T16:38:09+00:00
India Today,most_read,9,"Gauri Sawant reacts to Sushmita Sen playing her in Taali, recalls their first meeting",https://www.indiatoday.in/entertainment/ott/story/gauri-sawant-reacts-to-sushmita-sen-playing-her-in-taali-recalls-their-first-meeting-2009520-2022-10-07,2026-03-08T16:38:09+00:00
India Today,most_read,10,"'We're all shattered': Loved ones, community hold vigil for slain Sikh family in US",https://www.indiatoday.in/india/story/community-loved-ones-hold-vigil-sikh-family-murder-us-merced-city-2009515-2022-10-07,2026-03-08T16:38:09+00:00
India Today,most_read,11,Richa Chadha wears dainty Bvlgari mangalsutra in stunning pics with husband Ali Fazal. Here’s the price,https://www.indiatoday.in/lifestyle/fashion/story/richa-chadha-wears-dainty-bvlgari-mangalsutra-in-stunning-pics-with-husband-ali-fazal-here-s-the-price-2009509-2022-10-07,2026-03-08T16:38:09+00:00
India Today,most_read,12,"What to watch on Netflix, Disney+ Hotstar and Amazon Prime Video this weekend",https://www.indiatoday.in/entertainment/ott/story/what-to-watch-on-netflix-disney-hotstar-and-amazon-prime-video-this-weekend-2009510-2022-10-07,2026-03-08T16:38:09+00:00
India Today,most_read,13,Karnataka govt to hike SC/ST reservation,https://www.indiatoday.in/india/story/karnataka-hike-sc-st-reservation-quota-justice-nagamohan-das-committee-report-2009505-2022-10-07,2026-03-08T16:38:09+00:00
India Today,most_read,14,"Delhi civic body identifies 250 mosquito breeding hotspots, launches drive",https://www.indiatoday.in/cities/delhi/story/delhi-civic-body-identifies-mosquito-breeding-hotspots-launches-drive-2009508-2022-10-07,2026-03-08T16:38:09+00:00
India Today,most_read,15,"Your weekly news quiz, October 7 | Play on",https://www.indiatoday.in/india/story/your-weekly-news-quiz-october-7-play-on-2009506-2022-10-07,2026-03-08T16:38:09+00:00
India Today,most_read,16,"Salman Khan was on Mohali RPG attacker's hitlist, says Delhi Police",https://www.indiatoday.in/india/story/delhi-police-arrest-mohali-rpg-attacker-salman-khan-was-on-hit-list-2009502-2022-10-07,2026-03-08T16:38:09+00:00
India Today,most_read,17,"Iran denies security forces killed 16-year-old, says she fell off roof",https://www.indiatoday.in/world/story/iran-security-forces-16-year-old-killed-protest-on-death-of-woman-in-police-custody-2009503-2022-10-07,2026-03-08T16:38:09+00:00
India Today,most_read,18,"Vande Bharat Express rams into cattle, suffers minor damage; 2nd incident in 2 days",https://www.indiatoday.in/india/story/vande-bharat-express-hits-cattle-suffers-minor-damage-gujarat-2009490-2022-10-07,2026-03-08T16:38:09+00:00
India Today,most_read,19,2 Madhya Pradesh Congress MLAs booked for harassing woman on train,https://www.indiatoday.in/crime/story/2-madhya-pradesh-congress-mlas-booked-for-harassing-woman-on-train-2009441-2022-10-07,2026-03-08T16:38:09+00:00
India Today,most_read,20,Rashmika Mandanna has no regrets for not being able to spend time with her sister. Here's why,https://www.indiatoday.in/movies/regional-cinema/story/rashmika-mandanna-has-no-regrets-for-not-being-able-to-spend-time-with-her-sister-here-s-why-2009492-2022-10-07,2026-03-08T16:38:09+00:00
India Today,most_read,21,"T20 WC final: Aparshakti Khurrana, Basil Joseph, Karan-Tejasswi cheer for India",https://www.indiatoday.in/movies/celebrities/story/t20-world-cup-final-aparshakti-khurrana-basil-joseph-karan-kundrra-tejasswi-prakash-cheer-for-india-2879119-2026-03-08,2026-03-08T16:38:09+00:00
India Today,most_read,22,Gautam Gambhir a proud coach after Abhishek Sharma lights up Ahmedabad: See pic,https://www.indiatoday.in/sports/cricket/story/ind-vs-nz-t20-world-cup-final-gautam-gambhir-ovation-abhishek-sharma-fifty-2879123-2026-03-08,2026-03-08T16:38:09+00:00
India Today,most_read,23,"Vijay, Trisha attend wedding reception together days after wife alleges affair with actor",https://www.indiatoday.in/movies/regional-cinema/story/actor-and-tvk-chief-vijay-attends-wedding-reception-with-trisha-watch-2877952-2026-03-05,2026-03-08T16:38:09+00:00
India Today,most_read,24,Grandmother pours boiling water on 4-year-old for splashing colour on her on Holi,https://www.indiatoday.in/india/story/nagpur-grandmother-pours-boiling-water-grandson-severe-burns-holi-celebrations-koradi-2877515-2026-03-05,2026-03-08T16:38:09+00:00
India Today,most_read,25,Rashmika-Vijay Deverakonda attend Sathyanarayana Puja at his hometown. Watch,https://www.indiatoday.in/movies/regional-cinema/story/rashmika-mandanna-vijay-deverakonda-traditional-puja-thummanpet-telangana-2876403-2026-03-02,2026-03-08T16:38:09+00:00
India Today,most_read,26,93-year-old US woman shares her secret to a long and happy life in India,https://www.indiatoday.in/trending-news/story/93-year-old-us-woman-shares-her-secret-to-a-long-and-happy-life-in-india-2876977-2026-03-03,2026-03-08T16:38:09+00:00
India Today,most_read,27,"Trisha shares photos after attending wedding with Vijay, thanks 'go-to people'",https://www.indiatoday.in/movies/regional-cinema/story/trisha-shares-photos-after-attending-wedding-with-vijay-thanks-go-to-people-2878291-2026-03-06,2026-03-08T16:38:09+00:00
India Today,most_read,28,Dutch bride's Rajasthani dance surprise delights Marwadi groom. Watch videos,https://www.indiatoday.in/trending-news/story/dutch-bride-rajasthani-dance-surprise-delights-marwadi-groom-watch-videos-2877782-2026-03-05,2026-03-08T16:38:09+00:00
India Today,most_read,29,Aishwarya-Abhishek Bachchan dazzle at Arjun Tendulkar-Saaniya's wedding. Watch,https://www.indiatoday.in/movies/celebrities/story/aishwarya-rai-abhishek-bachchan-arrive-arjun-tendulkar-saaniya-chandhok-wedding-2877692-2026-03-05,2026-03-08T16:38:09+00:00
