source,section,rank,headline,link,collected_at_iso
Times of India,most_read,1,"‘Legs tied, mouth stuffed with clothes’: Arya Vaidya Pharmacy founder’s daughter found dead in Coimbatore",https://timesofindia.indiatimes.com/articleshow/129154415.cms,2026-03-09T13:20:01+00:00
Times of India,most_read,2,"'Consistency over intensity': Lucknow boy, working with Google in US, cracks civil services exam",https://timesofindia.indiatimes.com/articleshow/129189480.cms,2026-03-09T13:20:01+00:00
Times of India,most_read,3,How Ishan Kishan fought personal grief to rise on the biggest night of his career,https://timesofindia.indiatimes.com/articleshow/129280860.cms,2026-03-09T13:20:01+00:00
Times of India,most_read,4,"Mother-in-law’s obsession with ‘good news’ drives woman to call for help; asked to give intimacy, menstrual cycle details",https://timesofindia.indiatimes.com/articleshow/129174062.cms,2026-03-09T13:20:01+00:00
Times of India,most_read,5,Did Israel surprise US with strikes on Iran oil depots? White House reportedly sent 'WTF' message,https://timesofindia.indiatimes.com/articleshow/129321167.cms,2026-03-09T13:20:01+00:00
Times of India,most_read,6,Pakistan praised Trump as a peacemaker. Now it could be dragged into his war,https://timesofindia.indiatimes.com/articleshow/129258671.cms,2026-03-09T13:20:01+00:00
Times of India,most_read,7,"Watch: Video challenges Trump’s claim, shows US Tomahawk missile near Iran school",https://timesofindia.indiatimes.com/articleshow/129317038.cms,2026-03-09T13:20:01+00:00
Times of India,most_read,8,From pooja to wild celebrations: How India welcomed the T20 World Cup title in Ahmedabad,https://timesofindia.indiatimes.com/articleshow/129322572.cms,2026-03-09T13:20:01+00:00
Times of India,most_read,9,"Shortage of LPG cooking gas in Mumbai, supply of commercial cylinders halted",https://timesofindia.indiatimes.com/articleshow/129323687.cms,2026-03-09T13:20:01+00:00
Times of India,most_read,10,A fake name was enough to make an AI agent hand over everything,https://timesofindia.indiatimes.com/articleshow/128811020.cms,2026-03-09T13:20:01+00:00
Times of India,most_read,11,Sam Altman responds to Jensen Huang’s ‘like mad’ remark on OpenAI demand,https://timesofindia.indiatimes.com/articleshow/129320603.cms,2026-03-09T13:20:01+00:00
Times of India,most_read,12,‘Team Kalki’: How 2 former Tihar inmates built a pan-India darknet drug network,https://timesofindia.indiatimes.com/articleshow/129321493.cms,2026-03-09T13:20:01+00:00
Times of India,most_read,13,Skyrocketing crude prices could push Pakistan's monthly oil import bill to $600 million,https://timesofindia.indiatimes.com/articleshow/129322466.cms,2026-03-09T13:20:01+00:00
Times of India,most_read,14,Bahrain's Bapco declares 'force majeure' after Iran strikes: What it means,https://timesofindia.indiatimes.com/articleshow/129316730.cms,2026-03-09T13:20:01+00:00
Times of India,most_read,15,Amazon sends letter to FCC - Here's what it read,https://timesofindia.indiatimes.com/articleshow/129229812.cms,2026-03-09T13:20:01+00:00
Times of India,most_read,16,‘Don’t remember any time we had an argument’: Surya on partnership with Gambhir,https://timesofindia.indiatimes.com/articleshow/129320795.cms,2026-03-09T13:20:01+00:00
Times of India,most_read,17,‘Stop celebrating milestones’: Gambhir’s strong message after India’s T20 WC triumph,https://timesofindia.indiatimes.com/articleshow/129311754.cms,2026-03-09T13:20:01+00:00
Times of India,most_read,18,"Nifty50 trades below 24,000, Sensex tumbles 2,000 points — reasons why stock market crashed",https://timesofindia.indiatimes.com/articleshow/129307271.cms,2026-03-09T13:20:01+00:00
Times of India,most_read,19,"Google CEO Sundar Pichai says ‘chose the wrong match…’, Microsoft's Satya Nadella wishes team as India win ICC Men's T20 World Cup",https://timesofindia.indiatimes.com/articleshow/129284951.cms,2026-03-09T13:20:01+00:00
Times of India,most_read,20,Threemendous: T20 kings keep the crown,https://timesofindia.indiatimes.com/articleshow/129288767.cms,2026-03-09T13:20:01+00:00
Times of India,most_read,21,T20 World Cup final: India bury ghost of November 19; pummel New Zealand by 96 runs,https://timesofindia.indiatimes.com/articleshow/129280696.cms,2026-03-09T13:20:01+00:00
Times of India,most_read,22,"Mamata absent, no water in President Murmu's washroom, garbage on road: Centre, Bengal govt spar over 'lapses' at Santal event",https://timesofindia.indiatimes.com/articleshow/129256807.cms,2026-03-09T13:20:01+00:00
Times of India,most_read,23,'If he is composer of 'Ramayana' then I don't think there is any problem': Salim Merchant on AR Rahman’s ‘communal bias’ row,https://timesofindia.indiatimes.com/articleshow/129269093.cms,2026-03-09T13:20:01+00:00
Times of India,most_read,24,'I was broken after the NZ series': Sanju Samson wins Player of the Tournament after historic T20 World Cup run,https://timesofindia.indiatimes.com/articleshow/129283232.cms,2026-03-09T13:20:01+00:00
Times of India,most_read,25,US embassy in UAE issues security alert: Americans urged to consider leaving as consular services shut,https://timesofindia.indiatimes.com/articleshow/129257179.cms,2026-03-09T13:20:01+00:00
Times of India,most_read,26,"Sanju Samson scripts history, breaks multiple records in T20 World Cup final vs New Zealand",https://timesofindia.indiatimes.com/articleshow/129276280.cms,2026-03-09T13:20:01+00:00
Times of India,most_read,27,Murder in Delhi's Uttam Nagar: MCD demolishes 'illegal portions' of accused's house,https://timesofindia.indiatimes.com/articleshow/129258695.cms,2026-03-09T13:20:01+00:00
Times of India,most_read,28,"Distant war, a regional shockwave: How Middle East crisis is making life difficult in Bangladesh and Pakistan",https://timesofindia.indiatimes.com/articleshow/129274256.cms,2026-03-09T13:20:01+00:00
Times of India,most_read,29,The drug paradox of Queen Victoria: New book says she ‘loved’ drugs while empire sold opium worldwide,https://timesofindia.indiatimes.com/articleshow/129278125.cms,2026-03-09T13:20:01+00:00
Times of India,most_read,30,‘Kundavai should be kept at home’: Did R Parthiban take a swipe at Vijay and Trisha Krishnan's public appearance?,https://timesofindia.indiatimes.com/articleshow/129264099.cms,2026-03-09T13:20:01+00:00
Times of India,most_read,31,"A 35-year-old who has railed against India, China and the US may soon run Nepal",https://timesofindia.indiatimes.com/articleshow/129264054.cms,2026-03-09T13:20:01+00:00
Times of India,most_read,32,Failed Israeli mission to recover pilot’s remains leaves 41 dead in Lebanon,https://timesofindia.indiatimes.com/articleshow/129255789.cms,2026-03-09T13:20:01+00:00
Times of India,most_read,33,IND vs NZ Final Match Timings: What time is India vs New Zealand T20 World Cup match?,https://timesofindia.indiatimes.com/articleshow/129255315.cms,2026-03-09T13:20:01+00:00
Times of India,most_read,34,'Mitchell ko sorry bolne gya tha': Arshdeep Singh after on-field spat with Daryl Mitchell,https://timesofindia.indiatimes.com/articleshow/129283193.cms,2026-03-09T13:20:01+00:00
Times of India,most_read,35,‘Apocalyptic’ scenes in Tehran: Massive inferno erupts after explosions – video,https://timesofindia.indiatimes.com/articleshow/129269565.cms,2026-03-09T13:20:01+00:00
Times of India,most_read,36,"Who is Mojtaba Khamenei, the new Iranian Supreme Leader facing US and Israel",https://timesofindia.indiatimes.com/articleshow/129292991.cms,2026-03-09T13:20:01+00:00
Times of India,most_read,37,PM Modi inaugurates two new Delhi Metro corridors: Key routes and how they will help commuters,https://timesofindia.indiatimes.com/articleshow/129254488.cms,2026-03-09T13:20:01+00:00
Times of India,most_read,38,'I can feel pulse of the player': Rohit Sharma reveals emotional reason behind Sanju Samson pep talk,https://timesofindia.indiatimes.com/articleshow/129263294.cms,2026-03-09T13:20:01+00:00
Times of India,most_read,39,"Weekly Career Horoscope, March 08 to March 14, 2026: Success, challenges, and breakthroughs; Know about your Career",https://timesofindia.indiatimes.com/articleshow/129259906.cms,2026-03-09T13:20:01+00:00
Times of India,most_read,40,Meet Anjali Sardana: Indian entrepreneur who built $100 million startup after studying in US,https://timesofindia.indiatimes.com/articleshow/129267439.cms,2026-03-09T13:20:01+00:00
Times of India,most_read,41,Trisha Krishnan hits back after R Parthiban takes a dig at her post her viral video with Vijay from a wedding: 'It makes stupidity..',https://timesofindia.indiatimes.com/articleshow/129278241.cms,2026-03-09T13:20:01+00:00
Times of India,most_read,42,"MH370 still missing: Latest search after scanning 15,000 sq km ends with no clues to 239 people onboard",https://timesofindia.indiatimes.com/articleshow/129265069.cms,2026-03-09T13:20:01+00:00
Times of India,most_read,43,Watch: First cricketer in 254 years! New Zealand bowler sets jaw-dropping world record,https://timesofindia.indiatimes.com/articleshow/129253812.cms,2026-03-09T13:20:01+00:00
Times of India,most_read,44,"CHAMPION STUFF! High risk, high reward: How ‘Total T20’ fuelled India’s march to World Cup glory",https://timesofindia.indiatimes.com/articleshow/129305416.cms,2026-03-09T13:20:01+00:00
Times of India,most_read,45,‘Iran won’t leave him alone for killing Khamenei’: Ayatollah’s top aide warns; Trump says ‘I couldn’t care less’,https://timesofindia.indiatimes.com/articleshow/129262149.cms,2026-03-09T13:20:01+00:00
Times of India,most_read,46,Gulf tensions: Dumping of goods by ships at ports worries exporters,https://timesofindia.indiatimes.com/articleshow/129290619.cms,2026-03-09T13:20:01+00:00
Times of India,most_read,47,Nuclear stockpile to Kharg Island: Why Trump wants to send special forces to Iran,https://timesofindia.indiatimes.com/articleshow/129273869.cms,2026-03-09T13:20:01+00:00
Times of India,most_read,48,Gautam Gambhir Reply to MS Dhoni,https://timesofindia.indiatimes.com/articleshow/129322247.cms,2026-03-09T13:20:01+00:00
Times of India,most_read,49,CBSE Class 12th Maths Exam Analysis,https://timesofindia.indiatimes.com/articleshow/129319670.cms,2026-03-09T13:20:01+00:00
Times of India,most_read,50,China Iran relation,https://timesofindia.indiatimes.com/articleshow/129216408.cms,2026-03-09T13:20:01+00:00
Times of India,most_read,51,Delhi Uttam Nagar Murder,https://timesofindia.indiatimes.com/articleshow/129297640.cms,2026-03-09T13:20:01+00:00
Times of India,most_read,52,CBSE Board 12th Maths Exam,https://timesofindia.indiatimes.com/articleshow/129320785.cms,2026-03-09T13:20:01+00:00
Times of India,most_read,53,IND vs NZ Match Security,https://timesofindia.indiatimes.com/articleshow/129266125.cms,2026-03-09T13:20:01+00:00
Times of India,most_read,54,SS Rajamouli House,https://timesofindia.indiatimes.com/articleshow/129307437.cms,2026-03-09T13:20:01+00:00
Times of India,most_read,55,Shah Rukh Khan,https://timesofindia.indiatimes.com/articleshow/129118674.cms,2026-03-09T13:20:01+00:00
Times of India,most_read,56,Ahmedabad Police Traffic advisory,https://timesofindia.indiatimes.com/articleshow/129221351.cms,2026-03-09T13:20:01+00:00
Times of India,most_read,57,Dhurandhar 2 Ott Release,https://timesofindia.indiatimes.com/articleshow/129319979.cms,2026-03-09T13:20:01+00:00
Times of India,most_read,58,The Kerala Story 2,https://timesofindia.indiatimes.com/articleshow/129188287.cms,2026-03-09T13:20:01+00:00
Times of India,most_read,59,Rihanna Net Worth,https://timesofindia.indiatimes.com/articleshow/129314378.cms,2026-03-09T13:20:01+00:00
Times of India,most_read,60,Bollywood War Movies,https://timesofindia.indiatimes.com/articleshow/129203388.cms,2026-03-09T13:20:01+00:00
Times of India,most_read,61,Hardik Pandya Girlfriend,https://timesofindia.indiatimes.com/articleshow/129313795.cms,2026-03-09T13:20:01+00:00
Times of India,most_read,62,The Great Indian Kapil Show 4,https://timesofindia.indiatimes.com/articleshow/129125820.cms,2026-03-09T13:20:01+00:00
Times of India,most_read,63,Maruti Brezza Facelift Spied,https://timesofindia.indiatimes.com/articleshow/129146065.cms,2026-03-09T13:20:01+00:00
Times of India,most_read,64,Lab Grown Diamonds,https://timesofindia.indiatimes.com/articleshow/129090781.cms,2026-03-09T13:20:01+00:00
Times of India,most_read,65,Social Media Ban,https://timesofindia.indiatimes.com/articleshow/129152683.cms,2026-03-09T13:20:01+00:00
Times of India,most_read,66,Women’s Day AI Prompts,https://timesofindia.indiatimes.com/articleshow/129253033.cms,2026-03-09T13:20:01+00:00
Times of India,most_read,67,Hyderabad Mall Hoarding Collapse,https://timesofindia.indiatimes.com/articleshow/129286460.cms,2026-03-09T13:20:01+00:00
Times of India,most_read,68,Indian Cricket Team,https://timesofindia.indiatimes.com/articleshow/129304768.cms,2026-03-09T13:20:01+00:00
Times of India,most_read,69,UPMSP Board Exam,https://timesofindia.indiatimes.com/articleshow/129310691.cms,2026-03-09T13:20:01+00:00
Times of India,most_read,70,RRB Group D Recruitment,https://timesofindia.indiatimes.com/articleshow/129308267.cms,2026-03-09T13:20:01+00:00
Times of India,most_read,71,NMMS Admit Card,https://timesofindia.indiatimes.com/articleshow/129304165.cms,2026-03-09T13:20:01+00:00
Times of India,most_read,72,RRB Paramedical Admit Card,https://timesofindia.indiatimes.com/articleshow/129306262.cms,2026-03-09T13:20:01+00:00
Times of India,most_read,73,Pune Spiritual School Closure,https://timesofindia.indiatimes.com/articleshow/129299407.cms,2026-03-09T13:20:01+00:00
Times of India,most_read,74,Middle East News,https://timesofindia.indiatimes.com/articleshow/129309840.cms,2026-03-09T13:20:01+00:00
Times of India,most_read,75,Tarun Khatik Murder,https://timesofindia.indiatimes.com/articleshow/129311729.cms,2026-03-09T13:20:01+00:00
Times of India,most_read,76,Vallabh Maheshwari Accident,https://timesofindia.indiatimes.com/articleshow/129312441.cms,2026-03-09T13:20:01+00:00
Times of India,most_read,77,Delhi Excise Policy Case,https://timesofindia.indiatimes.com/articleshow/129314045.cms,2026-03-09T13:20:01+00:00
Times of India,most_read,78,Gurgaon Scrap Yard Fire,https://timesofindia.indiatimes.com/articleshow/129317885.cms,2026-03-09T13:20:01+00:00
Times of India,most_read,79,Manipuri Woman Assault,https://timesofindia.indiatimes.com/articleshow/129286480.cms,2026-03-09T13:20:01+00:00
Times of India,most_read,80,DTC Bus Accident,https://timesofindia.indiatimes.com/articleshow/129317246.cms,2026-03-09T13:20:01+00:00
Times of India,most_read,81,Karnataka Elephant Overpass,https://timesofindia.indiatimes.com/articleshow/129285616.cms,2026-03-09T13:20:01+00:00
Times of India,most_read,82,Bengaluru Illegal Mortgage,https://timesofindia.indiatimes.com/articleshow/129285440.cms,2026-03-09T13:20:01+00:00
Times of India,most_read,83,Air India Dented Bag Compensation,https://timesofindia.indiatimes.com/articleshow/129285653.cms,2026-03-09T13:20:01+00:00
Times of India,most_read,84,Nashik Bribery Case,https://timesofindia.indiatimes.com/articleshow/129170597.cms,2026-03-09T13:20:01+00:00
Times of India,most_read,85,Mumbai Indians New IPL Jersey,https://timesofindia.indiatimes.com/articleshow/129151315.cms,2026-03-09T13:20:01+00:00
Times of India,most_read,86,Oppo Find N6,https://timesofindia.indiatimes.com/articleshow/129315468.cms,2026-03-09T13:20:01+00:00
Times of India,most_read,87,Anthropic Ceo Dario Amodei,https://timesofindia.indiatimes.com/articleshow/129137566.cms,2026-03-09T13:20:01+00:00
Times of India,most_read,88,"Dark side of internet fame: Murders, shootings and threats rock influencer world",https://timesofindia.indiatimes.com/articleshow/129322577.cms,2026-03-09T13:20:01+00:00
Times of India,most_read,89,What is the WISA Act? All about the new US bill that aims to roll back Trump’s H-1B restrictions,https://timesofindia.indiatimes.com/articleshow/129323461.cms,2026-03-09T13:20:01+00:00
Times of India,most_read,90,Raising confident children without creating pressure,https://timesofindia.indiatimes.com/articleshow/129323898.cms,2026-03-09T13:20:01+00:00
Times of India,most_read,91,Sourav Ganguly to host Bigg Boss Bangla,https://timesofindia.indiatimes.com/articleshow/129323001.cms,2026-03-09T13:20:01+00:00
Times of India,most_read,92,Lakshmipriya Devi reveals how Gugun Kipgen was cast in BAFTA-winning film ‘Boong’,https://timesofindia.indiatimes.com/articleshow/129323616.cms,2026-03-09T13:20:01+00:00
Times of India,most_read,93,Saturn Combust: The period that teaches life lessons,https://timesofindia.indiatimes.com/articleshow/129321020.cms,2026-03-09T13:20:01+00:00
Times of India,most_read,94,When Yash queued up to buy ‘Mungaru Male’ tickets for his ‘Preethi Illada Mele’ co-stars,https://timesofindia.indiatimes.com/articleshow/129319319.cms,2026-03-09T13:20:01+00:00
Times of India,most_read,95,From ‘Sadak Balak’ to PM Balen Shah,https://timesofindia.indiatimes.com/articleshow/129322921.cms,2026-03-09T13:20:01+00:00
Times of India,most_read,96,Parthiban-Trisha's controversy EXPLAINED: What went wrong between the 'Ponniyin Selvan' stars,https://timesofindia.indiatimes.com/articleshow/129323016.cms,2026-03-09T13:20:01+00:00
Times of India,most_read,97,Subedaar's ending explained: Does the ending hint at Anil Kapoor’s return?,https://timesofindia.indiatimes.com/articleshow/129322995.cms,2026-03-09T13:20:01+00:00
Times of India,most_read,98,Justice for Sanju: A true Kerala story,https://timesofindia.indiatimes.com/articleshow/129322484.cms,2026-03-09T13:20:01+00:00
Times of India,most_read,99,"He worked till 6:30 PM, then got fired on day one: Intern’s story shocks the internet",https://timesofindia.indiatimes.com/articleshow/129322956.cms,2026-03-09T13:20:01+00:00
Times of India,most_read,100,Iraq coach Graham Arnold calls for FIFA World Cup playoff postponement amid Middle East travel disruption,https://timesofindia.indiatimes.com/articleshow/129322480.cms,2026-03-09T13:20:01+00:00
Times of India,most_read,101,Jwala delivers 5 cubs at Kuno National Park; India’s cheetah population rises to 53,https://timesofindia.indiatimes.com/articleshow/129321751.cms,2026-03-09T13:20:01+00:00
Times of India,trending,1,etimesChildren rushed to hospital after teacher allegedly gave them weed gummies to celebrate birthday,https://timesofindia.indiatimes.com/articleshow/129335088.cms,2026-03-09T13:20:01+00:00
Times of India,trending,2,"world'Because of H1B visas': MAGA enraged at 35,000 Indian-Americans dominating schools and offices in Forsyth County",https://timesofindia.indiatimes.com/articleshow/129334739.cms,2026-03-09T13:20:01+00:00
Times of India,trending,3,etimesFrom Gautam Gambhir's grin to Hardik Pandya-Maheika's dance: 5 trending social media moments from T20 World Cup celebrations,https://timesofindia.indiatimes.com/articleshow/129334521.cms,2026-03-09T13:20:01+00:00
Times of India,trending,4,worldSix hours through Oman’s desert: How a British father and daughter fled the Middle East crisis,https://timesofindia.indiatimes.com/articleshow/129330970.cms,2026-03-09T13:20:01+00:00
Times of India,trending,5,"etimesHe worked till 6:30 PM, then got fired on day one: Intern’s story shocks the internetA student's first day as an intern at a coaching firm ended abruptly when they were fired for refusing to return to the office after hours. The intern had stayed late to complete tasks, only to be dismissed for not complying with a last-minute demand, highlighting concerns about intern treatment and low pay for high expectations.",https://timesofindia.indiatimes.com/articleshow/129322956.cms,2026-03-09T13:20:01+00:00
Times of India,trending,6,CBSE Class 12th Maths Exam,https://timesofindia.indiatimes.com/articleshow/129319670.cms,2026-03-09T13:20:01+00:00
Times of India,trending,7,Sheikh Mohammed Bin Rashid,https://timesofindia.indiatimes.com/articleshow/129295088.cms,2026-03-09T13:20:01+00:00
Times of India,trending,8,"World’s biggest maternity ward? Over 41,000 giant turtles found nesting together in the Amazon",https://timesofindia.indiatimes.com/articleshow/129319671.cms,2026-03-09T13:20:01+00:00
Times of India,trending,9,Visitor shares photos of Ahmedabad at 1 am; starts Ahmedabad vs Bengaluru debate,https://timesofindia.indiatimes.com/articleshow/129318491.cms,2026-03-09T13:20:01+00:00
Times of India,trending,10,24-year-old’s heart rate hit 212 after taking THIS one tablet: Here’s the jaw-dropping incident,https://timesofindia.indiatimes.com/articleshow/129319000.cms,2026-03-09T13:20:01+00:00
Times of India,trending,11,Trump's granddaughter Kai Trump trolled for 'tone deaf' joke on bankruptcy in grocery shopping video,https://timesofindia.indiatimes.com/articleshow/129317868.cms,2026-03-09T13:20:01+00:00
Times of India,trending,12,This Bengaluru woman took a 47 km route instead of 23 km to avoid city traffic - here's what happened,https://timesofindia.indiatimes.com/articleshow/129315531.cms,2026-03-09T13:20:01+00:00
Times of India,trending,13,Ever wondered why temples have red and white stripes? The meaning might surprise you,https://timesofindia.indiatimes.com/articleshow/129311830.cms,2026-03-09T13:20:01+00:00
Times of India,trending,14,Meet Sanjana Ganesan: All about the woman behind India’s star cricketer Jasprit Bumrah,https://timesofindia.indiatimes.com/articleshow/129307875.cms,2026-03-09T13:20:01+00:00
Times of India,trending,15,Cobra encounter? Here’s the step-by-step guide to staying safe,https://timesofindia.indiatimes.com/articleshow/129274063.cms,2026-03-09T13:20:01+00:00
Times of India,trending,16,Stunning reunion story: Man missing since 2001 finds biological father through DNA test,https://timesofindia.indiatimes.com/articleshow/129273830.cms,2026-03-09T13:20:01+00:00
Times of India,trending,17,Indonesia to procure BrahMos missiles from India: Report,https://timesofindia.indiatimes.com/articleshow/129334391.cms,2026-03-09T13:20:01+00:00
Times of India,trending,18,Trump's China visit to be confined to Beijing amid security concerns: Report,https://timesofindia.indiatimes.com/articleshow/129333335.cms,2026-03-09T13:20:01+00:00
Times of India,trending,19,LPG refill rule: Minimum waiting period raised to 25 days to curb hoarding,https://timesofindia.indiatimes.com/articleshow/129334881.cms,2026-03-09T13:20:01+00:00
Times of India,trending,20,'Career was on the line': Gambhir makes huge Samson admission after World Cup glory,https://timesofindia.indiatimes.com/articleshow/129325264.cms,2026-03-09T13:20:01+00:00
Times of India,trending,21,Gautam Gambhir Reply to MS Dhoni,https://timesofindia.indiatimes.com/articleshow/129322247.cms,2026-03-09T13:20:01+00:00
Times of India,trending,22,Delhi Uttam Nagar Murder,https://timesofindia.indiatimes.com/articleshow/129297640.cms,2026-03-09T13:20:01+00:00
Times of India,trending,23,Shohei Ohtani Tea Bottle,https://timesofindia.indiatimes.com/articleshow/129333044.cms,2026-03-09T13:20:01+00:00
Times of India,trending,24,Indian Cricket Team,https://timesofindia.indiatimes.com/articleshow/129305416.cms,2026-03-09T13:20:01+00:00
Times of India,trending,25,CBSE Board 12th Maths Exam,https://timesofindia.indiatimes.com/articleshow/129320785.cms,2026-03-09T13:20:01+00:00
Times of India,trending,26,KN Panikkar Death,https://timesofindia.indiatimes.com/articleshow/129326433.cms,2026-03-09T13:20:01+00:00
Times of India,trending,27,LPG Cooking Gas Shortage,https://timesofindia.indiatimes.com/articleshow/129323687.cms,2026-03-09T13:20:01+00:00
Times of India,trending,28,Indian Cheetah Population,https://timesofindia.indiatimes.com/articleshow/129321751.cms,2026-03-09T13:20:01+00:00
Times of India,trending,29,Dhurandhar 2 OTT Release,https://timesofindia.indiatimes.com/articleshow/129319979.cms,2026-03-09T13:20:01+00:00
Times of India,trending,30,SS Rajamouli House,https://timesofindia.indiatimes.com/articleshow/129307437.cms,2026-03-09T13:20:01+00:00
Times of India,trending,31,Dhurandhar 2 Advance Booking,https://timesofindia.indiatimes.com/articleshow/129312149.cms,2026-03-09T13:20:01+00:00
Times of India,trending,32,Shah Rukh Khan,https://timesofindia.indiatimes.com/articleshow/129118674.cms,2026-03-09T13:20:01+00:00
Times of India,trending,33,Ahmedabad Police Traffic advisory,https://timesofindia.indiatimes.com/articleshow/129221351.cms,2026-03-09T13:20:01+00:00
Times of India,trending,34,The Kerala Story 2,https://timesofindia.indiatimes.com/articleshow/129298466.cms,2026-03-09T13:20:01+00:00
Times of India,trending,35,South India Real Estate,https://timesofindia.indiatimes.com/articleshow/129314884.cms,2026-03-09T13:20:01+00:00
Times of India,trending,36,Open Source WiFi Tool,https://timesofindia.indiatimes.com/articleshow/129295520.cms,2026-03-09T13:20:01+00:00
Times of India,trending,37,Maruti Brezza Facelift Spied,https://timesofindia.indiatimes.com/articleshow/129146065.cms,2026-03-09T13:20:01+00:00
Times of India,trending,38,Lab Grown Diamonds,https://timesofindia.indiatimes.com/articleshow/129090781.cms,2026-03-09T13:20:01+00:00
Times of India,trending,39,Social Media Ban,https://timesofindia.indiatimes.com/articleshow/129152683.cms,2026-03-09T13:20:01+00:00
Times of India,trending,40,Women’s Day AI Prompts,https://timesofindia.indiatimes.com/articleshow/129253033.cms,2026-03-09T13:20:01+00:00
Times of India,trending,41,Hyderabad Mall Hoarding Collapse,https://timesofindia.indiatimes.com/articleshow/129286460.cms,2026-03-09T13:20:01+00:00
Times of India,trending,42,Indian Cricket Team,https://timesofindia.indiatimes.com/articleshow/129304768.cms,2026-03-09T13:20:01+00:00
Times of India,trending,43,UPMSP Board Exam,https://timesofindia.indiatimes.com/articleshow/129310691.cms,2026-03-09T13:20:01+00:00
