source,section,rank,headline,link,collected_at_iso
Times of India,most_read,1,"‘Legs tied, mouth stuffed with clothes’: Arya Vaidya Pharmacy founder’s daughter found dead in Coimbatore",https://timesofindia.indiatimes.com/articleshow/129154415.cms,2026-03-09T07:11:37+00:00
Times of India,most_read,2,"'Consistency over intensity': Lucknow boy, working with Google in US, cracks civil services exam",https://timesofindia.indiatimes.com/articleshow/129189480.cms,2026-03-09T07:11:37+00:00
Times of India,most_read,3,How Ishan Kishan fought personal grief to rise on the biggest night of his career,https://timesofindia.indiatimes.com/articleshow/129280860.cms,2026-03-09T07:11:37+00:00
Times of India,most_read,4,"Mother-in-law’s obsession with ‘good news’ drives woman to call for help; asked to give intimacy, menstrual cycle details",https://timesofindia.indiatimes.com/articleshow/129174062.cms,2026-03-09T07:11:37+00:00
Times of India,most_read,5,"Stock market today: Rs 12 lakh cr wiped out as Sensex plunges 2,000 points, Nifty below 24,000",https://timesofindia.indiatimes.com/articleshow/129307271.cms,2026-03-09T07:11:37+00:00
Times of India,most_read,6,One person makes 35x of what another does. Why do both get free electricity?,https://timesofindia.indiatimes.com/articleshow/128944353.cms,2026-03-09T07:11:37+00:00
Times of India,most_read,7,"Khamenei dead, son Mojtaba named Iran’s supreme leader: Where things stand on day 10 of war",https://timesofindia.indiatimes.com/articleshow/129303244.cms,2026-03-09T07:11:37+00:00
Times of India,most_read,8,When will the Iran war end? Trump hints at 'mutual' decision with Netanyahu,https://timesofindia.indiatimes.com/articleshow/129309840.cms,2026-03-09T07:11:37+00:00
Times of India,most_read,9,Many Indians are trying to get home. But is it safe to fly in the Gulf right now?,https://timesofindia.indiatimes.com/articleshow/129252330.cms,2026-03-09T07:11:37+00:00
Times of India,most_read,10,Sundar Pichai congratulates Team India on winning the ICC Men's T20 World Cup,https://timesofindia.indiatimes.com/articleshow/129284951.cms,2026-03-09T07:11:37+00:00
Times of India,most_read,11,"Firm ideas, flexible tactics: How Gambhir helped India tame T20’s fickle nature",https://timesofindia.indiatimes.com/articleshow/129307496.cms,2026-03-09T07:11:37+00:00
Times of India,most_read,12,"'President standing, you're sitting': Photo in hand, Mamata flags ‘proof of who shows respect’",https://timesofindia.indiatimes.com/articleshow/129295839.cms,2026-03-09T07:11:37+00:00
Times of India,most_read,13,"Groups representing 700,000 Amazon, Google, Microsoft workers urge firms to ‘do right’",https://timesofindia.indiatimes.com/articleshow/129193292.cms,2026-03-09T07:11:37+00:00
Times of India,most_read,14,I grew up in a family where women were bosses: Rahul Gandhi,https://timesofindia.indiatimes.com/articleshow/129297215.cms,2026-03-09T07:11:37+00:00
Times of India,most_read,15,"High risk, high reward: How ‘Total T20’ fuelled India’s march to World Cup glory",https://timesofindia.indiatimes.com/articleshow/129305416.cms,2026-03-09T07:11:37+00:00
Times of India,most_read,16,Rupee reaches 92.25 against US dollar as oil prices surpass $100,https://timesofindia.indiatimes.com/articleshow/129310049.cms,2026-03-09T07:11:37+00:00
Times of India,most_read,17,Threemendous: T20 kings keep the crown,https://timesofindia.indiatimes.com/articleshow/129288767.cms,2026-03-09T07:11:37+00:00
Times of India,most_read,18,T20 World Cup final: India bury ghost of November 19; pummel New Zealand by 96 runs,https://timesofindia.indiatimes.com/articleshow/129280696.cms,2026-03-09T07:11:37+00:00
Times of India,most_read,19,"Mamata absent, no water in President Murmu's washroom, garbage on road: Centre, Bengal govt spar over 'lapses' at Santal event",https://timesofindia.indiatimes.com/articleshow/129256807.cms,2026-03-09T07:11:37+00:00
Times of India,most_read,20,'If he is composer of 'Ramayana' then I don't think there is any problem': Salim Merchant on AR Rahman’s ‘communal bias’ row,https://timesofindia.indiatimes.com/articleshow/129269093.cms,2026-03-09T07:11:37+00:00
Times of India,most_read,21,'I was broken after the NZ series': Sanju Samson wins Player of the Tournament after historic T20 World Cup run,https://timesofindia.indiatimes.com/articleshow/129283232.cms,2026-03-09T07:11:37+00:00
Times of India,most_read,22,US embassy in UAE issues security alert: Americans urged to consider leaving as consular services shut,https://timesofindia.indiatimes.com/articleshow/129257179.cms,2026-03-09T07:11:37+00:00
Times of India,most_read,23,"Sanju Samson scripts history, breaks multiple records in T20 World Cup final vs New Zealand",https://timesofindia.indiatimes.com/articleshow/129276280.cms,2026-03-09T07:11:37+00:00
Times of India,most_read,24,Murder in Delhi's Uttam Nagar: MCD demolishes 'illegal portions' of accused's house,https://timesofindia.indiatimes.com/articleshow/129258695.cms,2026-03-09T07:11:37+00:00
Times of India,most_read,25,"Distant war, a regional shockwave: How Middle East crisis is making life difficult in Bangladesh and Pakistan",https://timesofindia.indiatimes.com/articleshow/129274256.cms,2026-03-09T07:11:37+00:00
Times of India,most_read,26,The drug paradox of Queen Victoria: New book says she ‘loved’ drugs while empire sold opium worldwide,https://timesofindia.indiatimes.com/articleshow/129278125.cms,2026-03-09T07:11:37+00:00
Times of India,most_read,27,‘Kundavai should be kept at home’: Did R Parthiban take a swipe at Vijay and Trisha Krishnan's public appearance?,https://timesofindia.indiatimes.com/articleshow/129264099.cms,2026-03-09T07:11:37+00:00
Times of India,most_read,28,"A 35-year-old who has railed against India, China and the US may soon run Nepal",https://timesofindia.indiatimes.com/articleshow/129264054.cms,2026-03-09T07:11:37+00:00
Times of India,most_read,29,Failed Israeli mission to recover pilot’s remains leaves 41 dead in Lebanon,https://timesofindia.indiatimes.com/articleshow/129255789.cms,2026-03-09T07:11:37+00:00
Times of India,most_read,30,IND vs NZ Final Match Timings: What time is India vs New Zealand T20 World Cup match?,https://timesofindia.indiatimes.com/articleshow/129255315.cms,2026-03-09T07:11:37+00:00
Times of India,most_read,31,'Mitchell ko sorry bolne gya tha': Arshdeep Singh after on-field spat with Daryl Mitchell,https://timesofindia.indiatimes.com/articleshow/129283193.cms,2026-03-09T07:11:37+00:00
Times of India,most_read,32,‘Apocalyptic’ scenes in Tehran: Massive inferno erupts after explosions – video,https://timesofindia.indiatimes.com/articleshow/129269565.cms,2026-03-09T07:11:37+00:00
Times of India,most_read,33,"Who is Mojtaba Khamenei, the new Iranian Supreme Leader facing US and Israel",https://timesofindia.indiatimes.com/articleshow/129292991.cms,2026-03-09T07:11:37+00:00
Times of India,most_read,34,PM Modi inaugurates two new Delhi Metro corridors: Key routes and how they will help commuters,https://timesofindia.indiatimes.com/articleshow/129254488.cms,2026-03-09T07:11:37+00:00
Times of India,most_read,35,'I can feel pulse of the player': Rohit Sharma reveals emotional reason behind Sanju Samson pep talk,https://timesofindia.indiatimes.com/articleshow/129263294.cms,2026-03-09T07:11:37+00:00
Times of India,most_read,36,"Weekly Career Horoscope, March 08 to March 14, 2026: Success, challenges, and breakthroughs; Know about your Career",https://timesofindia.indiatimes.com/articleshow/129259906.cms,2026-03-09T07:11:37+00:00
Times of India,most_read,37,Meet Anjali Sardana: Indian entrepreneur who built $100 million startup after studying in US,https://timesofindia.indiatimes.com/articleshow/129267439.cms,2026-03-09T07:11:37+00:00
Times of India,most_read,38,Trisha Krishnan hits back after R Parthiban takes a dig at her post her viral video with Vijay from a wedding: 'It makes stupidity..',https://timesofindia.indiatimes.com/articleshow/129278241.cms,2026-03-09T07:11:37+00:00
Times of India,most_read,39,"MH370 still missing: Latest search after scanning 15,000 sq km ends with no clues to 239 people onboard",https://timesofindia.indiatimes.com/articleshow/129265069.cms,2026-03-09T07:11:37+00:00
Times of India,most_read,40,Watch: First cricketer in 254 years! New Zealand bowler sets jaw-dropping world record,https://timesofindia.indiatimes.com/articleshow/129253812.cms,2026-03-09T07:11:37+00:00
Times of India,most_read,41,‘Iran won’t leave him alone for killing Khamenei’: Ayatollah’s top aide warns; Trump says ‘I couldn’t care less’,https://timesofindia.indiatimes.com/articleshow/129262149.cms,2026-03-09T07:11:37+00:00
Times of India,most_read,42,Gulf tensions: Dumping of goods by ships at ports worries exporters,https://timesofindia.indiatimes.com/articleshow/129290619.cms,2026-03-09T07:11:37+00:00
Times of India,most_read,43,Nuclear stockpile to Kharg Island: Why Trump wants to send special forces to Iran,https://timesofindia.indiatimes.com/articleshow/129273869.cms,2026-03-09T07:11:37+00:00
Times of India,most_read,44,T20 World Cup Prize Money,https://timesofindia.indiatimes.com/articleshow/129280930.cms,2026-03-09T07:11:37+00:00
Times of India,most_read,45,T20 World Cup Winners List,https://timesofindia.indiatimes.com/articleshow/129280095.cms,2026-03-09T07:11:37+00:00
Times of India,most_read,46,China Iran relation,https://timesofindia.indiatimes.com/articleshow/129216408.cms,2026-03-09T07:11:37+00:00
Times of India,most_read,47,Delhi Uttam Nagar Murder,https://timesofindia.indiatimes.com/articleshow/129297640.cms,2026-03-09T07:11:37+00:00
Times of India,most_read,48,Highest T20 World Cup Final Run Chase,https://timesofindia.indiatimes.com/articleshow/129278774.cms,2026-03-09T07:11:37+00:00
Times of India,most_read,49,Indian National Cricket Team,https://timesofindia.indiatimes.com/articleshow/129255728.cms,2026-03-09T07:11:37+00:00
Times of India,most_read,50,South Africa Cricket Team,https://timesofindia.indiatimes.com/articleshow/129258507.cms,2026-03-09T07:11:37+00:00
Times of India,most_read,51,IND vs NZ Match Security,https://timesofindia.indiatimes.com/articleshow/129266125.cms,2026-03-09T07:11:37+00:00
Times of India,most_read,52,Uttam Nagar murder,https://timesofindia.indiatimes.com/articleshow/129201500.cms,2026-03-09T07:11:37+00:00
Times of India,most_read,53,Where to Watch Ind vs Nz t20,https://timesofindia.indiatimes.com/articleshow/129204799.cms,2026-03-09T07:11:37+00:00
Times of India,most_read,54,SS Rajamouli House,https://timesofindia.indiatimes.com/articleshow/129307437.cms,2026-03-09T07:11:37+00:00
Times of India,most_read,55,Shah Rukh Khan,https://timesofindia.indiatimes.com/articleshow/129118674.cms,2026-03-09T07:11:37+00:00
Times of India,most_read,56,Ahmedabad Police Traffic advisory,https://timesofindia.indiatimes.com/articleshow/129221351.cms,2026-03-09T07:11:37+00:00
Times of India,most_read,57,The Kerala Story 2,https://timesofindia.indiatimes.com/articleshow/129188287.cms,2026-03-09T07:11:37+00:00
Times of India,most_read,58,War News Anxiety,https://timesofindia.indiatimes.com/articleshow/129196764.cms,2026-03-09T07:11:37+00:00
Times of India,most_read,59,Bollywood War Movies,https://timesofindia.indiatimes.com/articleshow/129203388.cms,2026-03-09T07:11:37+00:00
Times of India,most_read,60,Women's Day Quotes,https://timesofindia.indiatimes.com/articleshow/129199745.cms,2026-03-09T07:11:37+00:00
Times of India,most_read,61,The Great Indian Kapil Show 4,https://timesofindia.indiatimes.com/articleshow/129125820.cms,2026-03-09T07:11:37+00:00
Times of India,most_read,62,Maruti Brezza Facelift Spied,https://timesofindia.indiatimes.com/articleshow/129146065.cms,2026-03-09T07:11:37+00:00
Times of India,most_read,63,Lab Grown Diamonds,https://timesofindia.indiatimes.com/articleshow/129090781.cms,2026-03-09T07:11:37+00:00
Times of India,most_read,64,Social Media Ban,https://timesofindia.indiatimes.com/articleshow/129152683.cms,2026-03-09T07:11:37+00:00
Times of India,most_read,65,Women’s Day AI Prompts,https://timesofindia.indiatimes.com/articleshow/129253033.cms,2026-03-09T07:11:37+00:00
Times of India,most_read,66,Hyderabad Mall Hoarding Collapse,https://timesofindia.indiatimes.com/articleshow/129286460.cms,2026-03-09T07:11:37+00:00
Times of India,most_read,67,Indian Cricket Team,https://timesofindia.indiatimes.com/articleshow/129304768.cms,2026-03-09T07:11:37+00:00
Times of India,most_read,68,UPMSP Board Exam,https://timesofindia.indiatimes.com/articleshow/129310691.cms,2026-03-09T07:11:37+00:00
Times of India,most_read,69,RRB Group D Recruitment,https://timesofindia.indiatimes.com/articleshow/129308267.cms,2026-03-09T07:11:37+00:00
Times of India,most_read,70,NMMS Admit Card,https://timesofindia.indiatimes.com/articleshow/129304165.cms,2026-03-09T07:11:37+00:00
Times of India,most_read,71,RRB Paramedical Admit Card,https://timesofindia.indiatimes.com/articleshow/129306262.cms,2026-03-09T07:11:37+00:00
Times of India,most_read,72,Pune Spiritual School Closure,https://timesofindia.indiatimes.com/articleshow/129299407.cms,2026-03-09T07:11:37+00:00
Times of India,most_read,73,ICAI CA Intermediate Toppers List,https://timesofindia.indiatimes.com/articleshow/129255037.cms,2026-03-09T07:11:37+00:00
Times of India,most_read,74,US Embassy Blast,https://timesofindia.indiatimes.com/articleshow/129253762.cms,2026-03-09T07:11:37+00:00
Times of India,most_read,75,Bareilly Twin Sister Murder,https://timesofindia.indiatimes.com/articleshow/129228428.cms,2026-03-09T07:11:37+00:00
Times of India,most_read,76,Delhi Meerut Expressway Accident,https://timesofindia.indiatimes.com/articleshow/129246591.cms,2026-03-09T07:11:37+00:00
Times of India,most_read,77,Delhi Uttam Nagar Murder,https://timesofindia.indiatimes.com/articleshow/129245083.cms,2026-03-09T07:11:37+00:00
Times of India,most_read,78,Abu Dhabi Zayed International Airport,https://timesofindia.indiatimes.com/articleshow/129122230.cms,2026-03-09T07:11:37+00:00
Times of India,most_read,79,Dubai travel update,https://timesofindia.indiatimes.com/articleshow/129257319.cms,2026-03-09T07:11:37+00:00
Times of India,most_read,80,Junaid-Nasir murder case,https://timesofindia.indiatimes.com/articleshow/129256430.cms,2026-03-09T07:11:37+00:00
Times of India,most_read,81,Vande Bharat Express,https://timesofindia.indiatimes.com/articleshow/129255542.cms,2026-03-09T07:11:37+00:00
Times of India,most_read,82,Delhi Metro corridors,https://timesofindia.indiatimes.com/articleshow/129254569.cms,2026-03-09T07:11:37+00:00
Times of India,most_read,83,MLB opening day,https://timesofindia.indiatimes.com/articleshow/129169077.cms,2026-03-09T07:11:37+00:00
Times of India,most_read,84,Mumbai Indians New IPL Jersey,https://timesofindia.indiatimes.com/articleshow/129151315.cms,2026-03-09T07:11:37+00:00
Times of India,most_read,85,Daylight Saving Time 2026,https://timesofindia.indiatimes.com/articleshow/129199541.cms,2026-03-09T07:11:37+00:00
Times of India,most_read,86,Electric Cars Vs Petrol Cars,https://timesofindia.indiatimes.com/articleshow/129200029.cms,2026-03-09T07:11:37+00:00
Times of India,most_read,87,Apple Macbook Air M5,https://timesofindia.indiatimes.com/articleshow/128978084.cms,2026-03-09T07:11:37+00:00
Times of India,most_read,88,Anthropic Ceo Dario Amodei,https://timesofindia.indiatimes.com/articleshow/129137566.cms,2026-03-09T07:11:37+00:00
Times of India,most_read,89,Nvidia China Dream,https://timesofindia.indiatimes.com/articleshow/129144522.cms,2026-03-09T07:11:37+00:00
Times of India,most_read,90,2 men hacked to death in Tamil Nadu; police probe revenge angle linked to DMK functionary’s murder,https://timesofindia.indiatimes.com/articleshow/129311966.cms,2026-03-09T07:11:37+00:00
Times of India,most_read,91,Meenakshi Chaudhary joins Akshay Kumar's ‘Bhagam Bhag 2’; recalls seeing first part when she was 'younger': 'Perfect time',https://timesofindia.indiatimes.com/articleshow/129312810.cms,2026-03-09T07:11:37+00:00
Times of India,most_read,92,Australians turn to VPNs after adult website blocked under new age laws,https://timesofindia.indiatimes.com/articleshow/129312801.cms,2026-03-09T07:11:37+00:00
Times of India,most_read,93,"150-million-year-old intact dinosaur eggs found on Portugal’s Santa Cruz Beach, where a Jurassic predator left them",https://timesofindia.indiatimes.com/articleshow/129311871.cms,2026-03-09T07:11:37+00:00
Times of India,most_read,94,Devotion with comfort: A sacred journey redefined in the skies,https://timesofindia.indiatimes.com/articleshow/129312366.cms,2026-03-09T07:11:37+00:00
Times of India,most_read,95,"India win T20 World Cup: One triumph, many heroes",https://timesofindia.indiatimes.com/articleshow/129312437.cms,2026-03-09T07:11:37+00:00
Times of India,most_read,96,How spring has set Delhi ablaze,https://timesofindia.indiatimes.com/articleshow/129312314.cms,2026-03-09T07:11:37+00:00
Times of India,most_read,97,"Renault Bridger SUV reveal tomorrow: All about Nexon, Brezza rival",https://timesofindia.indiatimes.com/articleshow/129311873.cms,2026-03-09T07:11:37+00:00
Times of India,most_read,98,"Lakshya Sen puts up a valiant show despite running on empty, falls to Lin Chun-Yi in All England final",https://timesofindia.indiatimes.com/articleshow/129312120.cms,2026-03-09T07:11:37+00:00
Times of India,most_read,99,"‘Stop celebrating milestones, celebrate trophies’: Gautam Gambhir’s strong message after India’s T20 World Cup triumph",https://timesofindia.indiatimes.com/articleshow/129311754.cms,2026-03-09T07:11:37+00:00
Times of India,most_read,100,‘Resilience the biggest positive in his game this week’: Vimal Kumar on Lakshya Sen’s All England Open performance,https://timesofindia.indiatimes.com/articleshow/129311846.cms,2026-03-09T07:11:37+00:00
Times of India,most_read,101,'Good luck with spreading hate': Daisy Shah hits back at trolls after cooking malpua at an Iftar party,https://timesofindia.indiatimes.com/articleshow/129310244.cms,2026-03-09T07:11:37+00:00
Times of India,most_read,102,"Crude oil surpasses $100: WTI up 30%, brent crude reaches $118; what it means?",https://timesofindia.indiatimes.com/articleshow/129305473.cms,2026-03-09T07:11:37+00:00
Times of India,most_read,103,Transport corpn conducts survey of accident zones,https://timesofindia.indiatimes.com/articleshow/129311492.cms,2026-03-09T07:11:37+00:00
Times of India,most_read,104,India vs New Zealand: Sea of blue and wave of optimism at Motera,https://timesofindia.indiatimes.com/articleshow/129311522.cms,2026-03-09T07:11:37+00:00
Times of India,most_read,105,"For us, cooking is like therapy: MasterChef winners Vikram and Ajinkya Gandhe",https://timesofindia.indiatimes.com/articleshow/129311160.cms,2026-03-09T07:11:37+00:00
Times of India,most_read,106,Why toddlers wake up in the middle of the night,https://timesofindia.indiatimes.com/articleshow/129307577.cms,2026-03-09T07:11:37+00:00
Times of India,most_read,107,"Numerology horoscope today, March 09, 2026: What your name's first letter reveals today",https://timesofindia.indiatimes.com/articleshow/129281048.cms,2026-03-09T07:11:37+00:00
Times of India,trending,1,"etimesThis Bengaluru woman took a 47 km route instead of 23 km to avoid city traffic - here's what happenedBengaluru's notorious traffic has prompted a resident to take a nearly double-distance route to avoid congestion. Shravika Jain shared screenshots showing her opting for a 47 km journey over a 23 km one, highlighting how heavy traffic can make shorter paths impractical. This decision resonated with many city dwellers, sparking discussions about the daily commute.",https://timesofindia.indiatimes.com/articleshow/129315531.cms,2026-03-09T07:11:37+00:00
Times of India,trending,2,etimesEver wondered why temples have red and white stripes? The meaning might surprise you,https://timesofindia.indiatimes.com/articleshow/129311830.cms,2026-03-09T07:11:37+00:00
Times of India,trending,3,etimesMeet Sanjana Ganesan: All about the woman behind India’s star cricketer Jasprit Bumrah,https://timesofindia.indiatimes.com/articleshow/129307875.cms,2026-03-09T07:11:37+00:00
Times of India,trending,4,"etimesCobra encounter? Here’s the step-by-step guide to staying safeEncountering a cobra in India demands calm, not panic. Experts advise controlling reactions, avoiding sudden movements, and maintaining a safe distance. Recognizing warning signs like hood-raising is crucial. For indoor or public space sightings, always call trained rescue teams. Awareness of surroundings and keeping pets secure are key preventative measures.",https://timesofindia.indiatimes.com/articleshow/129274063.cms,2026-03-09T07:11:37+00:00
Times of India,trending,5,"etimesStunning reunion story: Man missing since 2001 finds biological father through DNA testA Chinese man, missing since childhood, has been reunited with his biological father after over two decades. Separated at a railway station in 2001, he was adopted by a Canadian family but faced a difficult upbringing. His search, aided by a volunteer organization, led to an emotional reunion in China, though his mother remains uncontacted.",https://timesofindia.indiatimes.com/articleshow/129273830.cms,2026-03-09T07:11:37+00:00
Times of India,trending,6,Shakun Group MD,https://timesofindia.indiatimes.com/articleshow/129312441.cms,2026-03-09T07:11:37+00:00
Times of India,trending,7,Indian National Cricket Team,https://timesofindia.indiatimes.com/articleshow/129305416.cms,2026-03-09T07:11:37+00:00
Times of India,trending,8,T20 World Cup 2026 Prize Money,https://timesofindia.indiatimes.com/articleshow/129280930.cms,2026-03-09T07:11:37+00:00
Times of India,trending,9,Sheikh Mohammed Bin Rashid,https://timesofindia.indiatimes.com/articleshow/129295088.cms,2026-03-09T07:11:37+00:00
Times of India,trending,10,Woman’s innovative idea to get a seat in Mumbai local crosses 3 million views– watch here,https://timesofindia.indiatimes.com/articleshow/129269278.cms,2026-03-09T07:11:37+00:00
Times of India,trending,11,Who is Kyle Long? The Ohio man charged with wife’s murder after claiming she stabbed herself 17 times – what to know about the case,https://timesofindia.indiatimes.com/articleshow/129266770.cms,2026-03-09T07:11:37+00:00
Times of India,trending,12,UPSC rank 301 turns into a mystery as two candidates named Akanksha Singh claim it,https://timesofindia.indiatimes.com/articleshow/129262221.cms,2026-03-09T07:11:37+00:00
Times of India,trending,13,From superbikes to 8 crore garage: How rich is UK07 Rider? Inside YouTuber Anurag Dobhal’s net worth,https://timesofindia.indiatimes.com/articleshow/129259052.cms,2026-03-09T07:11:37+00:00
Times of India,trending,14,India vs New Zealand T20 World Cup final: Why is Ahmedabad’s cricket ground trending as ‘Panauti stadium’ online,https://timesofindia.indiatimes.com/articleshow/129253759.cms,2026-03-09T07:11:37+00:00
Times of India,trending,15,Before the alarm clock: Shocking ways people used to wake up on time in the past,https://timesofindia.indiatimes.com/articleshow/129273076.cms,2026-03-09T07:11:37+00:00
Times of India,trending,16,‘Can see through walls’: Open-source WiFi tool detects human movement behind walls without cameras,https://timesofindia.indiatimes.com/articleshow/129295520.cms,2026-03-09T07:11:37+00:00
Times of India,trending,17,Explained: 5 things about secretive son Mojtaba Khamenei's rise from shadow power to Iran's new supreme leader after Khamenei’s killing,https://timesofindia.indiatimes.com/articleshow/129293413.cms,2026-03-09T07:11:37+00:00
Times of India,trending,18,"Nature’s greatest flight: Migratory bird flies 13,560 km non-stop from Alaska to Australia without landing once for 11 days",https://timesofindia.indiatimes.com/articleshow/129290748.cms,2026-03-09T07:11:37+00:00
Times of India,trending,19,From coding to brewing: IIT graduate sells tea in Los Angeles after tech layoff,https://timesofindia.indiatimes.com/articleshow/129289323.cms,2026-03-09T07:11:37+00:00
Times of India,trending,20,‘Contact with Iran leadership difficult’: Jaishankar spells out India’s position on Middle East war,https://timesofindia.indiatimes.com/articleshow/129315807.cms,2026-03-09T07:11:37+00:00
Times of India,trending,21,"Stock market today: Rs 12 lakh cr wiped out as Sensex plunges 2,000 points, Nifty below 24,000",https://timesofindia.indiatimes.com/articleshow/129307271.cms,2026-03-09T07:11:37+00:00
Times of India,trending,22,Video shows thick black smoke rising after Iran hits Bahrain's largest oil refinery — watch,https://timesofindia.indiatimes.com/articleshow/129314836.cms,2026-03-09T07:11:37+00:00
Times of India,trending,23,‘Samson is a combination of Kohli & Rohit’: Kumble after T20 WC masterclass,https://timesofindia.indiatimes.com/articleshow/129313183.cms,2026-03-09T07:11:37+00:00
Times of India,trending,24,T20 World Cup Winners List,https://timesofindia.indiatimes.com/articleshow/129280095.cms,2026-03-09T07:11:37+00:00
Times of India,trending,25,China Iran relation,https://timesofindia.indiatimes.com/articleshow/129216408.cms,2026-03-09T07:11:37+00:00
Times of India,trending,26,Delhi Uttam Nagar Murder,https://timesofindia.indiatimes.com/articleshow/129297640.cms,2026-03-09T07:11:37+00:00
Times of India,trending,27,IND vs NZ Match Security,https://timesofindia.indiatimes.com/articleshow/129266125.cms,2026-03-09T07:11:37+00:00
Times of India,trending,28,SS Rajamouli House,https://timesofindia.indiatimes.com/articleshow/129307437.cms,2026-03-09T07:11:37+00:00
Times of India,trending,29,Shah Rukh Khan,https://timesofindia.indiatimes.com/articleshow/129118674.cms,2026-03-09T07:11:37+00:00
Times of India,trending,30,Ahmedabad Police Traffic advisory,https://timesofindia.indiatimes.com/articleshow/129221351.cms,2026-03-09T07:11:37+00:00
