source,section,rank,headline,link,collected_at_iso
India Today,trending,6,"Employee says 'toxic workplace broke me,' shares WhatsApp chat with boss",https://www.indiatoday.in/trending-news/story/employee-says-toxic-workplace-broke-me-shares-whatsapp-chat-with-boss-2885785-2026-03-23,2026-03-23T15:03:30+00:00
India Today,trending,7,"Bengaluru man keeps cool after scooter crashes into his car, checks on rider",https://www.indiatoday.in/trending-news/story/bengaluru-man-keeps-cool-after-scooter-crashes-into-his-car-checks-on-rider-video-viral-2885743-2026-03-23,2026-03-23T15:03:30+00:00
India Today,trending,8,"Indian Railways steps in as toddler falls ill on train, mother shares viral video",https://www.indiatoday.in/trending-news/story/indian-railways-steps-in-as-toddler-falls-ill-on-train-mother-shares-viral-video-2885570-2026-03-22,2026-03-23T15:03:30+00:00
India Today,trending,9,Man calls out fellow Indian tourists for littering Kazakhstan airport,https://www.indiatoday.in/trending-news/story/man-calls-out-fellow-indian-tourists-for-littering-kazakhstan-airport-2885555-2026-03-22,2026-03-23T15:03:30+00:00
India Today,trending,10,"From studying at naani's home to flying her, IndiGo pilot's story goes viral",https://www.indiatoday.in/trending-news/story/indigo-pilot-flies-grandmother-from-pune-to-delhi-in-emotional-moment-viral-video-2885534-2026-03-22,2026-03-23T15:03:30+00:00
India Today,trending,11,Video of Himachal bus driver stopping mid-route to feed hungry puppies goes viral,https://www.indiatoday.in/trending-news/story/video-of-himachal-bus-driver-stopping-mid-route-to-feed-hungry-puppies-goes-viral-2885523-2026-03-22,2026-03-23T15:03:30+00:00
India Today,trending,12,"Techie uses AI to simplify house hunting woes in Bengaluru, and it works",https://www.indiatoday.in/trending-news/story/techie-uses-ai-to-simplify-house-hunting-woes-in-bengaluru-and-it-works-2885498-2026-03-22,2026-03-23T15:03:30+00:00
India Today,trending,13,"Punjab's Jalandhar gets its own Statue of Liberty, courtesy one NRI",https://www.indiatoday.in/trending-news/story/punjabs-jalandhar-gets-its-own-statue-of-liberty-courtesy-one-nri-2885482-2026-03-22,2026-03-23T15:03:30+00:00
India Today,trending,14,Need a fan or charger? This premium auto has a price menu for that,https://www.indiatoday.in/trending-news/story/need-a-fan-or-charger-this-premium-auto-has-a-price-menu-for-that-2885471-2026-03-22,2026-03-23T15:03:30+00:00
India Today,trending,15,Bengaluru police respond after video of Lamborghini doing stunts goes viral,https://www.indiatoday.in/trending-news/story/bengaluru-police-respond-after-video-of-lamborghini-doing-stunts-goes-viralg-2885434-2026-03-22,2026-03-23T15:03:30+00:00
India Today,trending,16,Indian man finds a piece of home in London traffic as auto rickshaw cruises through,https://www.indiatoday.in/trending-news/story/indian-man-finds-a-piece-of-home-in-london-traffic-as-auto-rickshaw-cruises-through-2885228-2026-03-21,2026-03-23T15:03:30+00:00
India Today,trending,17,"Son finds his mother playing Spider-Man 2, internet asks for a gaming tutorial",https://www.indiatoday.in/trending-news/story/son-finds-his-mother-playing-spider-man-2-internet-asks-for-a-gaming-tutorial-2885212-2026-03-21,2026-03-23T15:03:30+00:00
India Today,trending,18,Emirates flight attendant graduates with toddler in matching uniform by her side,https://www.indiatoday.in/trending-news/story/emirates-flight-attendant-graduates-with-toddler-in-matching-uniform-by-her-side-2885195-2026-03-21,2026-03-23T15:03:30+00:00
India Today,trending,19,"Security guard joins girls dancing to Baby Doll, steals the show in viral video",https://www.indiatoday.in/trending-news/story/security-guard-joins-girls-dancing-to-baby-doll-steals-the-show-in-viral-video-2885168-2026-03-21,2026-03-23T15:03:30+00:00
India Today,trending,20,Grandson celebrates his dadi's 1 million YouTube milestone with a wholesome surprise,https://www.indiatoday.in/trending-news/story/grandson-celebrates-his-dadis-1-million-youtube-milestone-with-a-wholesome-surprise-2885117-2026-03-21,2026-03-23T15:03:30+00:00
India Today,trending,21,What the long-awaited Uttarakhand cabinet expansion means for the BJP in the state,https://www.indiatoday.in/india-today-insight/story/what-the-long-awaited-uttarakhand-cabinet-expansion-means-for-the-bjp-in-the-state-2886031-2026-03-23,2026-03-23T15:03:30+00:00
India Today,trending,22,"CPM flags BJP seal on Election Commission's letter, EC calls it 'clerical error'",https://www.indiatoday.in/elections/assembly/story/bjp-seal-on-election-commission-letter-cpim-raises-concerns-clerical-error-2886010-2026-03-23,2026-03-23T15:03:30+00:00
India Today,trending,23,"Cristiano Ronaldo shares positive injury update, eases World Cup 2026 fears",https://www.indiatoday.in/sports/football/story/fifa-world-cup-2026-cristiano-ronaldo-injury-update-portugal-social-media-post-2886027-2026-03-23,2026-03-23T15:03:30+00:00
India Today,trending,24,"Oppo Find X9 Ultra is launching in few weeks, here is everything we know about it",https://www.indiatoday.in/technology/news/story/oppo-find-x9-ultra-is-launching-in-few-weeks-here-is-everything-we-know-about-it-2885831-2026-03-23,2026-03-23T15:03:30+00:00
India Today,trending,25,"World Meteorological Day 2026: Theme, history and why it matters",https://www.indiatoday.in/information/story/world-meteorological-day-2026-weather-science-climate-awareness-2885752-2026-03-23,2026-03-23T15:03:30+00:00
India Today,trending,26,PM Modi assures CBSE taking steps for students post exam cancellation in West Asia,https://www.indiatoday.in/education-today/story/cbse-cancels-exams-west-asia-student-safety-india-2885827-2026-03-23,2026-03-23T15:03:30+00:00
India Today,trending,27,"Salesforce CEO says engineers no longer required as AI takes over, company now making billions",https://www.indiatoday.in/jobs/story/salesforce-ceo-says-engineers-no-longer-required-as-ai-takes-over-helping-make-billions-tchc-2885794-2026-03-23,2026-03-23T15:03:30+00:00
India Today,trending,28,"Bihar Board Class 12 results at 1:30 pm today, check details",https://www.indiatoday.in/education-today/news/story/bseb-bihar-board-class-12-result-2026-intermediate-scores-at-130-pm-today-how-to-check-details-2885732-2026-03-23,2026-03-23T15:03:30+00:00
India Today,most_read,1,IND vs SA: Deepak Chahar likely to be ruled out of last 2 ODIs due to injury,https://www.indiatoday.in/sports/cricket/story/india-vs-south-africa-deepak-chahar-likely-to-be-ruled-out-of-last-2-odis-due-to-injury-2009550-2022-10-07,2026-03-23T15:03:30+00:00
India Today,most_read,2,Manchester City fined over pitch invasion to celebrate Premier League title win,https://www.indiatoday.in/sports/football/story/manchester-city-fined-by-fa-over-pitch-invasion-to-celebrate-premier-league-title-win-2009534-2022-10-07,2026-03-23T15:03:30+00:00
India Today,most_read,3,Chelsea manager Potter on first month in charge: We have made little bit of progress,https://www.indiatoday.in/sports/football/story/chelsea-manager-graham-potter-on-first-month-in-charge-we-have-made-little-bit-of-progress-2009531-2022-10-07,2026-03-23T15:03:30+00:00
India Today,most_read,4,'Travesty of justice’: Experts criticise errors in UN report on forced disappearances in Bangladesh,https://www.indiatoday.in/world/story/experts-criticise-error-un-report-on-forced-disappearances-in-bangladesh-2007495-2022-10-02,2026-03-23T15:03:30+00:00
India Today,most_read,5,"Fact Check: No alcohol, homosexuality? Conservative guidelines for FIFA World Cup NOT issued by Qatar govt",https://www.indiatoday.in/fact-check/story/fifa-world-cup-guidelines-fact-check-no-alcohol-homosexuality-conservative-guidelines-for-football-world-cup-not-issued-by-qatar-govt-2009495-2022-10-07,2026-03-23T15:03:30+00:00
India Today,most_read,6,"KGF star Yash meets F1 legend Lewis Hamilton, See pic",https://www.indiatoday.in/movies/regional-cinema/story/kgf-star-yash-meets-f1-legend-lewis-hamilton-see-pic-2009525-2022-10-07,2026-03-23T15:03:30+00:00
India Today,most_read,7,"IND vs PAK: Match against India brings out the best in Nida Dar, says Sana Mir",https://www.indiatoday.in/sports/cricket/story/india-vs-pakistan-match-against-india-brings-out-the-best-in-nida-dar-says-sana-mir-2009523-2022-10-07,2026-03-23T15:03:30+00:00
India Today,most_read,8,Women's Asia Cup: India coach Powar defends batting-order reshuffle in Pakistan loss,https://www.indiatoday.in/sports/cricket/story/women-s-asia-cup-india-coach-ramesh-powar-defends-batting-order-reshuffle-in-pakistan-defeat-2009522-2022-10-07,2026-03-23T15:03:30+00:00
India Today,most_read,9,"Gauri Sawant reacts to Sushmita Sen playing her in Taali, recalls their first meeting",https://www.indiatoday.in/entertainment/ott/story/gauri-sawant-reacts-to-sushmita-sen-playing-her-in-taali-recalls-their-first-meeting-2009520-2022-10-07,2026-03-23T15:03:30+00:00
India Today,most_read,10,"'We're all shattered': Loved ones, community hold vigil for slain Sikh family in US",https://www.indiatoday.in/india/story/community-loved-ones-hold-vigil-sikh-family-murder-us-merced-city-2009515-2022-10-07,2026-03-23T15:03:30+00:00
India Today,most_read,11,Richa Chadha wears dainty Bvlgari mangalsutra in stunning pics with husband Ali Fazal. Here’s the price,https://www.indiatoday.in/lifestyle/fashion/story/richa-chadha-wears-dainty-bvlgari-mangalsutra-in-stunning-pics-with-husband-ali-fazal-here-s-the-price-2009509-2022-10-07,2026-03-23T15:03:30+00:00
India Today,most_read,12,"What to watch on Netflix, Disney+ Hotstar and Amazon Prime Video this weekend",https://www.indiatoday.in/entertainment/ott/story/what-to-watch-on-netflix-disney-hotstar-and-amazon-prime-video-this-weekend-2009510-2022-10-07,2026-03-23T15:03:30+00:00
India Today,most_read,13,Karnataka govt to hike SC/ST reservation,https://www.indiatoday.in/india/story/karnataka-hike-sc-st-reservation-quota-justice-nagamohan-das-committee-report-2009505-2022-10-07,2026-03-23T15:03:30+00:00
India Today,most_read,14,"Delhi civic body identifies 250 mosquito breeding hotspots, launches drive",https://www.indiatoday.in/cities/delhi/story/delhi-civic-body-identifies-mosquito-breeding-hotspots-launches-drive-2009508-2022-10-07,2026-03-23T15:03:30+00:00
India Today,most_read,15,"Your weekly news quiz, October 7 | Play on",https://www.indiatoday.in/india/story/your-weekly-news-quiz-october-7-play-on-2009506-2022-10-07,2026-03-23T15:03:30+00:00
India Today,most_read,16,"Salman Khan was on Mohali RPG attacker's hitlist, says Delhi Police",https://www.indiatoday.in/india/story/delhi-police-arrest-mohali-rpg-attacker-salman-khan-was-on-hit-list-2009502-2022-10-07,2026-03-23T15:03:30+00:00
India Today,most_read,17,"Iran denies security forces killed 16-year-old, says she fell off roof",https://www.indiatoday.in/world/story/iran-security-forces-16-year-old-killed-protest-on-death-of-woman-in-police-custody-2009503-2022-10-07,2026-03-23T15:03:30+00:00
India Today,most_read,18,"Vande Bharat Express rams into cattle, suffers minor damage; 2nd incident in 2 days",https://www.indiatoday.in/india/story/vande-bharat-express-hits-cattle-suffers-minor-damage-gujarat-2009490-2022-10-07,2026-03-23T15:03:30+00:00
India Today,most_read,19,2 Madhya Pradesh Congress MLAs booked for harassing woman on train,https://www.indiatoday.in/crime/story/2-madhya-pradesh-congress-mlas-booked-for-harassing-woman-on-train-2009441-2022-10-07,2026-03-23T15:03:30+00:00
India Today,most_read,20,Rashmika Mandanna has no regrets for not being able to spend time with her sister. Here's why,https://www.indiatoday.in/movies/regional-cinema/story/rashmika-mandanna-has-no-regrets-for-not-being-able-to-spend-time-with-her-sister-here-s-why-2009492-2022-10-07,2026-03-23T15:03:30+00:00
India Today,most_read,21,"CPM flags BJP seal on Election Commission's letter, EC calls it 'clerical error'",https://www.indiatoday.in/elections/assembly/story/bjp-seal-on-election-commission-letter-cpim-raises-concerns-clerical-error-2886010-2026-03-23,2026-03-23T15:03:30+00:00
India Today,most_read,22,"Cristiano Ronaldo shares positive injury update, eases World Cup 2026 fears",https://www.indiatoday.in/sports/football/story/fifa-world-cup-2026-cristiano-ronaldo-injury-update-portugal-social-media-post-2886027-2026-03-23,2026-03-23T15:03:30+00:00
India Today,most_read,23,IndiGo appoints former Air India Express CEO Aloke Singh as Strategy Chief,https://www.indiatoday.in/business/story/indigo-appoints-former-air-india-express-ceo-aloke-singh-as-strategy-chief-2886024-2026-03-23,2026-03-23T15:03:30+00:00
India Today,most_read,24,4 London Jewish community body ambulances set on fire in suspected hate crime,https://www.indiatoday.in/world/story/london-jewish-community-ambulance-service-fire-antisemitic-hate-crime-police-2885722-2026-03-23,2026-03-23T15:03:30+00:00
India Today,most_read,25,"HDFC Bank share price falls 4%, hits 52-week low: Why is the stock down?",https://www.indiatoday.in/business/market/story/hdfc-bank-share-price-fall-today-52-week-low-2885726-2026-03-23,2026-03-23T15:03:30+00:00
India Today,most_read,26,"Salesforce CEO says engineers no longer required as AI takes over, company now making billions",https://www.indiatoday.in/jobs/story/salesforce-ceo-says-engineers-no-longer-required-as-ai-takes-over-helping-make-billions-tchc-2885794-2026-03-23,2026-03-23T15:03:30+00:00
India Today,most_read,27,"Shaheed Diwas 2026: Date, history and why India remembers martyrs",https://www.indiatoday.in/information/story/shaheed-diwas-2026-date-history-why-india-remembers-martyrs-2885739-2026-03-23,2026-03-23T15:03:30+00:00
India Today,most_read,28,"Delhi traffic advisory: Navratri rush, diverted routes near Jhandewalan",https://www.indiatoday.in/information/story/delhi-traffic-advisory-navratri-rush-diverted-routes-near-jhandewalan-2885792-2026-03-23,2026-03-23T15:03:30+00:00
India Today,most_read,29,"Not just missile threats, Middle East staring at heavy rains like never before",https://www.indiatoday.in/science/story/persian-gulf-heavy-rains-forecast-iran-war-flood-risk-dubai-abudhabi-western-disturbance-2885736-2026-03-23,2026-03-23T15:03:30+00:00
India Today,most_read,30,"KL Rahul will open in IPL 2026, confirms Delhi Capitals captain Axar Patel",https://www.indiatoday.in/sports/cricket/story/kl-rahul-opening-delhi-capitals-ipl-2885822-2026-03-23,2026-03-23T15:03:30+00:00
India Today,most_read,31,US-Israel-Iran War Live,https://www.indiatoday.in/world/story/us-israel-iran-war-live-updates-middle-east-conflict-donald-trump-netanyahu-strait-of-hormuz-lebanon-uae-dubai-gulf-iraq-west-asia-2885659-2026-03-23,2026-03-23T15:03:30+00:00
