source,section,rank,headline,link,collected_at_iso
India Today,trending,5,"Pune eatery blames 'orange-haired man' for LPG price hike, puts up notice",https://www.indiatoday.in/trending-news/story/pune-eatery-blames-orange-haired-man-donald-trump-for-lpg-price-hike-puts-up-notice-amid-us-iran-war-2885820-2026-03-23,2026-03-23T17:00:58+00:00
India Today,trending,6,"'Lizard' in food at Bhopal university canteen? Staff claims it's capsicum, eats it",https://www.indiatoday.in/trending-news/story/bhopal-university-rgpv-canteen-lizard-in-food-staff-claims-it-is-capsicum-eats-it-2885824-2026-03-23,2026-03-23T17:00:58+00:00
India Today,trending,7,Influencer recreates Ranveer Singh's Dhurandhar 2 entry with simple science,https://www.indiatoday.in/trending-news/story/ranveer-singh-dhurandhar-2-entry-scene-recreated-by-influencer-with-diy-science-2885790-2026-03-23,2026-03-23T17:00:58+00:00
India Today,trending,8,"Employee says 'toxic workplace broke me,' shares WhatsApp chat with boss",https://www.indiatoday.in/trending-news/story/employee-says-toxic-workplace-broke-me-shares-whatsapp-chat-with-boss-2885785-2026-03-23,2026-03-23T17:00:58+00:00
India Today,trending,9,"Bengaluru man keeps cool after scooter crashes into his car, checks on rider",https://www.indiatoday.in/trending-news/story/bengaluru-man-keeps-cool-after-scooter-crashes-into-his-car-checks-on-rider-video-viral-2885743-2026-03-23,2026-03-23T17:00:58+00:00
India Today,trending,10,"Indian Railways steps in as toddler falls ill on train, mother shares viral video",https://www.indiatoday.in/trending-news/story/indian-railways-steps-in-as-toddler-falls-ill-on-train-mother-shares-viral-video-2885570-2026-03-22,2026-03-23T17:00:58+00:00
India Today,trending,11,Man calls out fellow Indian tourists for littering Kazakhstan airport,https://www.indiatoday.in/trending-news/story/man-calls-out-fellow-indian-tourists-for-littering-kazakhstan-airport-2885555-2026-03-22,2026-03-23T17:00:58+00:00
India Today,trending,12,"From studying at naani's home to flying her, IndiGo pilot's story goes viral",https://www.indiatoday.in/trending-news/story/indigo-pilot-flies-grandmother-from-pune-to-delhi-in-emotional-moment-viral-video-2885534-2026-03-22,2026-03-23T17:00:58+00:00
India Today,trending,13,Video of Himachal bus driver stopping mid-route to feed hungry puppies goes viral,https://www.indiatoday.in/trending-news/story/video-of-himachal-bus-driver-stopping-mid-route-to-feed-hungry-puppies-goes-viral-2885523-2026-03-22,2026-03-23T17:00:58+00:00
India Today,trending,14,"Techie uses AI to simplify house hunting woes in Bengaluru, and it works",https://www.indiatoday.in/trending-news/story/techie-uses-ai-to-simplify-house-hunting-woes-in-bengaluru-and-it-works-2885498-2026-03-22,2026-03-23T17:00:58+00:00
India Today,trending,15,"Punjab's Jalandhar gets its own Statue of Liberty, courtesy one NRI",https://www.indiatoday.in/trending-news/story/punjabs-jalandhar-gets-its-own-statue-of-liberty-courtesy-one-nri-2885482-2026-03-22,2026-03-23T17:00:58+00:00
India Today,trending,16,Need a fan or charger? This premium auto has a price menu for that,https://www.indiatoday.in/trending-news/story/need-a-fan-or-charger-this-premium-auto-has-a-price-menu-for-that-2885471-2026-03-22,2026-03-23T17:00:58+00:00
India Today,trending,17,Bengaluru police respond after video of Lamborghini doing stunts goes viral,https://www.indiatoday.in/trending-news/story/bengaluru-police-respond-after-video-of-lamborghini-doing-stunts-goes-viralg-2885434-2026-03-22,2026-03-23T17:00:58+00:00
India Today,trending,18,Indian man finds a piece of home in London traffic as auto rickshaw cruises through,https://www.indiatoday.in/trending-news/story/indian-man-finds-a-piece-of-home-in-london-traffic-as-auto-rickshaw-cruises-through-2885228-2026-03-21,2026-03-23T17:00:58+00:00
India Today,trending,19,"Son finds his mother playing Spider-Man 2, internet asks for a gaming tutorial",https://www.indiatoday.in/trending-news/story/son-finds-his-mother-playing-spider-man-2-internet-asks-for-a-gaming-tutorial-2885212-2026-03-21,2026-03-23T17:00:58+00:00
India Today,trending,20,Emirates flight attendant graduates with toddler in matching uniform by her side,https://www.indiatoday.in/trending-news/story/emirates-flight-attendant-graduates-with-toddler-in-matching-uniform-by-her-side-2885195-2026-03-21,2026-03-23T17:00:58+00:00
India Today,trending,21,IPL 2026: KKR captain Ajinkya Rahane warns critics with rapid 58 in intra-squad clash,https://www.indiatoday.in/sports/cricket/story/ipl-2026-ajinkya-rahane-kkr-intra-squad-half-century-critics-warning-2886075-2026-03-23,2026-03-23T17:00:58+00:00
India Today,trending,22,Iran premieres Night Light as response to Israeli show Tehran amid war,https://www.indiatoday.in/movies/story/irans-night-light-drama-highlights-national-security-and-counter-espionage-during-nowruz-2886055-2026-03-23,2026-03-23T17:00:58+00:00
India Today,trending,23,"Islamabad emerges as possible venue for direct talks between US, Iran: Report",https://www.indiatoday.in/world/story/us-iran-conflict-direct-talks-islamabad-trump-pauses-strikes-2886058-2026-03-23,2026-03-23T17:00:58+00:00
India Today,trending,24,"Prakash Raj takes jibe at Allu Arjun, Jr NTR over Dhurandhar 2 praise",https://www.indiatoday.in/movies/celebrities/story/prakash-raj-takes-jibe-at-allu-arjun-jr-ntr-over-dhurandhar-2-praise-2884800-2026-03-20,2026-03-23T17:00:58+00:00
India Today,trending,25,"For Ravindra Kaushik, India's real Dhurandhar in Pakistan, it didn't end well",https://www.indiatoday.in/preview/story/2885605,2026-03-23T17:00:58+00:00
India Today,trending,26,"Sloth bear chases tigress at Pilibhit reserve, rare moment caught on video",https://www.indiatoday.in/trending-news/story/sloth-bear-chases-tigress-at-uttar-pradesh-pilibhit-reserve-rare-moment-caught-on-video-2883580-2026-03-18,2026-03-23T17:00:58+00:00
India Today,trending,27,"Couple's 'cinematic' pond pre-wedding shoot goes viral, gets brutally trolled",https://www.indiatoday.in/trending-news/story/couples-cinematic-pond-pre-wedding-shoot-goes-viral-gets-brutally-trolled-2883642-2026-03-18,2026-03-23T17:00:58+00:00
India Today,trending,28,"Celina Jaitly's brother says he doesn't want to speak to her, court closes case",https://www.indiatoday.in/india/story/celina-jaitly-plea-closed-by-delhi-high-court-after-brother-in-uae-refuses-to-communicate-declines-legal-aid-2883125-2026-03-17,2026-03-23T17:00:58+00:00
India Today,most_read,1,IND vs SA: Deepak Chahar likely to be ruled out of last 2 ODIs due to injury,https://www.indiatoday.in/sports/cricket/story/india-vs-south-africa-deepak-chahar-likely-to-be-ruled-out-of-last-2-odis-due-to-injury-2009550-2022-10-07,2026-03-23T17:00:58+00:00
India Today,most_read,2,Manchester City fined over pitch invasion to celebrate Premier League title win,https://www.indiatoday.in/sports/football/story/manchester-city-fined-by-fa-over-pitch-invasion-to-celebrate-premier-league-title-win-2009534-2022-10-07,2026-03-23T17:00:58+00:00
India Today,most_read,3,Chelsea manager Potter on first month in charge: We have made little bit of progress,https://www.indiatoday.in/sports/football/story/chelsea-manager-graham-potter-on-first-month-in-charge-we-have-made-little-bit-of-progress-2009531-2022-10-07,2026-03-23T17:00:58+00:00
India Today,most_read,4,'Travesty of justice’: Experts criticise errors in UN report on forced disappearances in Bangladesh,https://www.indiatoday.in/world/story/experts-criticise-error-un-report-on-forced-disappearances-in-bangladesh-2007495-2022-10-02,2026-03-23T17:00:58+00:00
India Today,most_read,5,"Fact Check: No alcohol, homosexuality? Conservative guidelines for FIFA World Cup NOT issued by Qatar govt",https://www.indiatoday.in/fact-check/story/fifa-world-cup-guidelines-fact-check-no-alcohol-homosexuality-conservative-guidelines-for-football-world-cup-not-issued-by-qatar-govt-2009495-2022-10-07,2026-03-23T17:00:58+00:00
India Today,most_read,6,"KGF star Yash meets F1 legend Lewis Hamilton, See pic",https://www.indiatoday.in/movies/regional-cinema/story/kgf-star-yash-meets-f1-legend-lewis-hamilton-see-pic-2009525-2022-10-07,2026-03-23T17:00:58+00:00
India Today,most_read,7,"IND vs PAK: Match against India brings out the best in Nida Dar, says Sana Mir",https://www.indiatoday.in/sports/cricket/story/india-vs-pakistan-match-against-india-brings-out-the-best-in-nida-dar-says-sana-mir-2009523-2022-10-07,2026-03-23T17:00:58+00:00
India Today,most_read,8,Women's Asia Cup: India coach Powar defends batting-order reshuffle in Pakistan loss,https://www.indiatoday.in/sports/cricket/story/women-s-asia-cup-india-coach-ramesh-powar-defends-batting-order-reshuffle-in-pakistan-defeat-2009522-2022-10-07,2026-03-23T17:00:58+00:00
India Today,most_read,9,"Gauri Sawant reacts to Sushmita Sen playing her in Taali, recalls their first meeting",https://www.indiatoday.in/entertainment/ott/story/gauri-sawant-reacts-to-sushmita-sen-playing-her-in-taali-recalls-their-first-meeting-2009520-2022-10-07,2026-03-23T17:00:58+00:00
India Today,most_read,10,"'We're all shattered': Loved ones, community hold vigil for slain Sikh family in US",https://www.indiatoday.in/india/story/community-loved-ones-hold-vigil-sikh-family-murder-us-merced-city-2009515-2022-10-07,2026-03-23T17:00:58+00:00
India Today,most_read,11,Richa Chadha wears dainty Bvlgari mangalsutra in stunning pics with husband Ali Fazal. Here’s the price,https://www.indiatoday.in/lifestyle/fashion/story/richa-chadha-wears-dainty-bvlgari-mangalsutra-in-stunning-pics-with-husband-ali-fazal-here-s-the-price-2009509-2022-10-07,2026-03-23T17:00:58+00:00
India Today,most_read,12,"What to watch on Netflix, Disney+ Hotstar and Amazon Prime Video this weekend",https://www.indiatoday.in/entertainment/ott/story/what-to-watch-on-netflix-disney-hotstar-and-amazon-prime-video-this-weekend-2009510-2022-10-07,2026-03-23T17:00:58+00:00
India Today,most_read,13,Karnataka govt to hike SC/ST reservation,https://www.indiatoday.in/india/story/karnataka-hike-sc-st-reservation-quota-justice-nagamohan-das-committee-report-2009505-2022-10-07,2026-03-23T17:00:58+00:00
India Today,most_read,14,"Delhi civic body identifies 250 mosquito breeding hotspots, launches drive",https://www.indiatoday.in/cities/delhi/story/delhi-civic-body-identifies-mosquito-breeding-hotspots-launches-drive-2009508-2022-10-07,2026-03-23T17:00:58+00:00
India Today,most_read,15,"Your weekly news quiz, October 7 | Play on",https://www.indiatoday.in/india/story/your-weekly-news-quiz-october-7-play-on-2009506-2022-10-07,2026-03-23T17:00:58+00:00
India Today,most_read,16,"Salman Khan was on Mohali RPG attacker's hitlist, says Delhi Police",https://www.indiatoday.in/india/story/delhi-police-arrest-mohali-rpg-attacker-salman-khan-was-on-hit-list-2009502-2022-10-07,2026-03-23T17:00:58+00:00
India Today,most_read,17,"Iran denies security forces killed 16-year-old, says she fell off roof",https://www.indiatoday.in/world/story/iran-security-forces-16-year-old-killed-protest-on-death-of-woman-in-police-custody-2009503-2022-10-07,2026-03-23T17:00:58+00:00
India Today,most_read,18,"Vande Bharat Express rams into cattle, suffers minor damage; 2nd incident in 2 days",https://www.indiatoday.in/india/story/vande-bharat-express-hits-cattle-suffers-minor-damage-gujarat-2009490-2022-10-07,2026-03-23T17:00:58+00:00
India Today,most_read,19,2 Madhya Pradesh Congress MLAs booked for harassing woman on train,https://www.indiatoday.in/crime/story/2-madhya-pradesh-congress-mlas-booked-for-harassing-woman-on-train-2009441-2022-10-07,2026-03-23T17:00:58+00:00
India Today,most_read,20,Rashmika Mandanna has no regrets for not being able to spend time with her sister. Here's why,https://www.indiatoday.in/movies/regional-cinema/story/rashmika-mandanna-has-no-regrets-for-not-being-able-to-spend-time-with-her-sister-here-s-why-2009492-2022-10-07,2026-03-23T17:00:58+00:00
India Today,most_read,21,"Islamabad emerges as possible venue for direct talks between US, Iran: Report",https://www.indiatoday.in/world/story/us-iran-conflict-direct-talks-islamabad-trump-pauses-strikes-2886058-2026-03-23,2026-03-23T17:00:58+00:00
India Today,most_read,22,"UP man, in relationship with dead friend’s wife, kills her over marriage pressure",https://www.indiatoday.in/india/story/up-man-in-relationship-with-dead-friends-wife-kills-her-over-marriage-pressure-bulandshahr-crime-2886050-2026-03-23,2026-03-23T17:00:58+00:00
India Today,most_read,23,From the India Today archives (2012) | Emraan Hashmi has finally gained artistic respectability,https://www.indiatoday.in/india-today-insight/story/from-the-india-today-archives-2012-emraan-hashmi-has-finally-gained-artistic-respectability-2886066-2026-03-23,2026-03-23T17:00:58+00:00
India Today,most_read,24,"Couple's 'cinematic' pond pre-wedding shoot goes viral, gets brutally trolled",https://www.indiatoday.in/trending-news/story/couples-cinematic-pond-pre-wedding-shoot-goes-viral-gets-brutally-trolled-2883642-2026-03-18,2026-03-23T17:00:58+00:00
India Today,most_read,25,"Theatres erupt as PM Modi appears in Dhurandhar 2, internet can't keep calm",https://www.indiatoday.in/movies/bollywood/story/theatres-erupt-as-pm-modi-appears-in-dhurandhar-2-internet-cant-keep-calm-2884132-2026-03-19,2026-03-23T17:00:58+00:00
India Today,most_read,26,"Celina Jaitly's brother says he doesn't want to speak to her, court closes case",https://www.indiatoday.in/india/story/celina-jaitly-plea-closed-by-delhi-high-court-after-brother-in-uae-refuses-to-communicate-declines-legal-aid-2883125-2026-03-17,2026-03-23T17:00:58+00:00
India Today,most_read,27,Son makes mother meet her childhood crush in epic surprise. Her happy tears say it all,https://www.indiatoday.in/trending-news/story/son-makes-mother-meet-her-childhood-crush-in-epic-surprise-her-happy-tears-say-it-all-2884788-2026-03-20,2026-03-23T17:00:58+00:00
India Today,most_read,28,Iran executes 19-year-old wrestler Saleh Mohammadi with two others in public hanging,https://www.indiatoday.in/world/story/who-were-the-three-men-hanged-in-iran-saleh-mohammadi-saeed-davodi-and-mehdi-ghasemi-2884452-2026-03-20,2026-03-23T17:00:58+00:00
India Today,most_read,29,"Prakash Raj takes jibe at Allu Arjun, Jr NTR over Dhurandhar 2 praise",https://www.indiatoday.in/movies/celebrities/story/prakash-raj-takes-jibe-at-allu-arjun-jr-ntr-over-dhurandhar-2-praise-2884800-2026-03-20,2026-03-23T17:00:58+00:00
India Today,most_read,30,"Odisha man gets trampled by angry elephant, stands up, walks away. Video is viral",https://www.indiatoday.in/trending-news/story/odisha-man-gets-trampled-by-angry-elephant-stands-up-walks-away-video-is-viral-2883680-2026-03-18,2026-03-23T17:00:58+00:00
India Today,most_read,31,US-Israel-Iran War Live,https://www.indiatoday.in/world/story/us-israel-iran-war-live-updates-middle-east-conflict-donald-trump-netanyahu-strait-of-hormuz-lebanon-uae-dubai-gulf-iraq-west-asia-2885659-2026-03-23,2026-03-23T17:00:58+00:00
