source,section,rank,headline,link,collected_at_iso
Times of India,trending,54,Allahabad High Court,https://timesofindia.indiatimes.com/articleshow/129810754.cms,2026-03-26T07:19:46+00:00
Times of India,trending,55,West Bengal Assembly Elections,https://timesofindia.indiatimes.com/articleshow/129814381.cms,2026-03-26T07:19:46+00:00
Times of India,trending,56,Mumbai Surat Local Trains,https://timesofindia.indiatimes.com/articleshow/129807270.cms,2026-03-26T07:19:46+00:00
Times of India,trending,57,Bengaluru Auto Driver News,https://timesofindia.indiatimes.com/articleshow/129808785.cms,2026-03-26T07:19:46+00:00
Times of India,trending,58,Gurgaon Pataudi Rewari Highway,https://timesofindia.indiatimes.com/articleshow/129810794.cms,2026-03-26T07:19:46+00:00
Times of India,trending,59,FIFA World Cup,https://timesofindia.indiatimes.com/articleshow/129811080.cms,2026-03-26T07:19:46+00:00
Times of India,trending,60,Perplexity Ceo Aravind Srinivas,https://timesofindia.indiatimes.com/articleshow/129791486.cms,2026-03-26T07:19:46+00:00
Times of India,trending,61,Social Media Addiction Trial,https://timesofindia.indiatimes.com/articleshow/129786054.cms,2026-03-26T07:19:46+00:00
Times of India,trending,62,Realme 16 5g,https://timesofindia.indiatimes.com/articleshow/129817526.cms,2026-03-26T07:19:46+00:00
Times of India,trending,63,"Queues, confusion and travel woes: Petrol panic grips Hyderabad",https://timesofindia.indiatimes.com/articleshow/129816547.cms,2026-03-26T07:19:46+00:00
Times of India,trending,64,'Always the villain in the story': Faf du Plessis' unique take on Gautam Gambhir,https://timesofindia.indiatimes.com/articleshow/129817855.cms,2026-03-26T07:19:46+00:00
Times of India,trending,65,‘Bridgerton Season 5’: Showrunner on how Francesca Bridgerton and Michaela Stirling’s romance is 'going to be about yearning',https://timesofindia.indiatimes.com/articleshow/129817800.cms,2026-03-26T07:19:46+00:00
Times of India,trending,66,A story that travels: “ITI: The Beginning” earns spotlight at Bengal Short Film Festival,https://timesofindia.indiatimes.com/articleshow/129817880.cms,2026-03-26T07:19:46+00:00
Times of India,trending,67,"Rajasthan Board declaring Class 9th, 11th result 2026 through offline mode: Check key details here",https://timesofindia.indiatimes.com/articleshow/129817653.cms,2026-03-26T07:19:46+00:00
Times of India,trending,68,"CGPSC SSE Pre 2025 result announced at psc.cg.gov.in, 3921 candidates qualify for May 2026 main examination",https://timesofindia.indiatimes.com/articleshow/129817561.cms,2026-03-26T07:19:46+00:00
Times of India,trending,69,Ananya Panday's fresh style attracts major eye balls; 'She looks like Dakota Johnson',https://timesofindia.indiatimes.com/articleshow/129817705.cms,2026-03-26T07:19:46+00:00
Times of India,trending,70,'Dhurandhar' showdown in Delhi assembly: BJP compares Arvind Kejriwal to 'Rahman Dakait'; AAP hits back with Rs 6 crore 'VVIP boat' jibe,https://timesofindia.indiatimes.com/articleshow/129817378.cms,2026-03-26T07:19:46+00:00
Times of India,trending,71,"Soft Power Comes from Within: Huma Qureshi on Identity, Craft and Creativity",https://timesofindia.indiatimes.com/articleshow/129817689.cms,2026-03-26T07:19:46+00:00
Times of India,trending,72,"‘Didn’t you say I love you?’: Bengaluru professor proposes to girl in classroom; student hits him with slipper, video goes viral",https://timesofindia.indiatimes.com/articleshow/129817447.cms,2026-03-26T07:19:46+00:00
Times of India,trending,73,‘Carmeni Selvam will resonate with those living away from home’,https://timesofindia.indiatimes.com/articleshow/129817459.cms,2026-03-26T07:19:46+00:00
Times of India,trending,74,"UP court awards death to man for sodomy, murder of 7-year-old",https://timesofindia.indiatimes.com/articleshow/129817536.cms,2026-03-26T07:19:46+00:00
Times of India,trending,75,"Royal Enfield Guerrilla 450 update teased: Launch tomorrow, what to expect",https://timesofindia.indiatimes.com/articleshow/129817460.cms,2026-03-26T07:19:46+00:00
Times of India,trending,76,Inclusive play gets a boost with autism-inclusive Barbie launch in India,https://timesofindia.indiatimes.com/articleshow/129817455.cms,2026-03-26T07:19:46+00:00
NDTV,most_read,1,"Hyderabad Girl, Lover Kill Mother, Body Found Buried In Home After A Year",https://www.ndtv.com/india-news/hyderabad-crime-news-hyderabad-girl-lover-kill-mother-body-found-buried-in-home-after-a-year-11268493,2026-03-26T07:19:46+00:00
NDTV,most_read,2,"Once Seen As Potential Allies, Congress, TVK Trade Barbs As Polls Approach",https://www.ndtv.com/india-news/tamil-nadu-assembly-election-vijay-once-seen-as-potential-allies-congress-tvk-trade-barbs-as-polls-approach-11268488,2026-03-26T07:19:46+00:00
NDTV,most_read,3,"Talking 'Peace', Moving Troops: What Does Trump Really Want From Iran?",https://www.ndtv.com/opinion/iran-israel-war-talking-peace-moving-troops-what-does-trump-really-want-from-iran-11268456,2026-03-26T07:19:46+00:00
NDTV,most_read,4,"How ""Wrath Of Snake"" Threat Gave Nashik 'Godman' Trip To 21 Nations, Mercedes",https://www.ndtv.com/india-news/ashok-kharat-astrologer-showed-snake-extorted-crores-mercedes-new-charge-against-nashik-godman-11268430,2026-03-26T07:19:46+00:00
NDTV,most_read,5,Video: Holiday Traffic Causes Massive Jam On Mumbai-Pune Expressway,https://www.ndtv.com/india-news/watch-mumbai-pune-expressway-faces-severe-gridlock-amid-ram-navami-holiday-travel-11268423,2026-03-26T07:19:46+00:00
NDTV,most_read,6,JNVST Result 2026: Class 9 And 11 Results Likely Out Soon,https://www.ndtv.com/education/jawahar-navodaya-vidyalaya-selection-test-jnvst-result-2026-class-9-and-11-results-likely-out-soon-11268406,2026-03-26T07:19:46+00:00
NDTV,most_read,7,NIOS Releases Date Sheet 2026 For Class 10 And 12 Theory Examinations,https://www.ndtv.com/education/national-institute-of-open-schooling-nios-date-sheet-2026-released-for-theory-exams-11268233,2026-03-26T07:19:46+00:00
NDTV,most_read,8,"Bihar Board Matric Result 2026: BSEB 10th Results Likely This Week, Know How To Check",https://www.ndtv.com/education/bihar-board-matric-result-2026-bseb-10th-results-likely-this-week-know-how-to-check-11267781,2026-03-26T07:19:46+00:00
NDTV,most_read,9,Bihar Board Inter Result 2026 Scrutiny: Apply Online For Rechecking At BSEB Before April,https://www.ndtv.com/education/bihar-board-inter-result-2026-scrutiny-apply-online-for-rechecking-at-bseb-before-april-2-11267650,2026-03-26T07:19:46+00:00
NDTV,most_read,10,"Government Rolls Out 15,000 AI Scholarships With Google And YouTube",https://www.ndtv.com/education/ministry-of-information-and-broadcasting-launches-15-000-ai-scholarships-with-google-youtube-to-boost-creative-sector-11267599,2026-03-26T07:19:46+00:00
NDTV,most_read,11,"India, 5 Others On Iran's ""Friendly Nation"" List For Safe Hormuz Passage",https://www.ndtv.com/world-news/iran-war-news-strait-of-hormuz-open-for-friend-india-iran-amid-global-oil-crisis-11268022,2026-03-26T07:19:46+00:00
NDTV,most_read,12,"India Speeds Up Oil, LPG Import Deals Amid Middle East Supply Shock",https://www.ndtv.com/india-news/iran-israel-war-strait-of-hormuz-crude-oil-prices-today-oil-shortage-india-speeds-up-oil-lpg-import-deals-amid-middle-east-supply-shock-11268336,2026-03-26T07:19:46+00:00
NDTV,most_read,13,"Iran Claims It Shot Down American F-18 Jet, Then A US Fact-Check",https://www.ndtv.com/world-news/iran-war-news-iran-claims-it-shotdown-american-f-18-jet-then-a-us-fact-check-11267637,2026-03-26T07:19:46+00:00
NDTV,most_read,14,"Iran Rejects US Proposal On Ending War, Lays Down 5 Conditions: Report",https://www.ndtv.com/world-news/iran-rejects-us-proposal-on-ending-war-lays-down-5-conditions-report-11266064,2026-03-26T07:19:46+00:00
NDTV,most_read,15,Leverage Reward vs Casualty Risk: Trump Faces Tough Kharg Island Choice,https://www.ndtv.com/world-news/iran-war-middle-east-war-kharg-island-iran-preps-for-island-warfare-amid-talk-of-us-ground-offensive-on-kharg-11268275,2026-03-26T07:19:46+00:00
NDTV,most_read,16,Iran Threatens To Block 4th Largest Shipping Route If US Escalates War,https://www.ndtv.com/world-news/iran-war-oil-crisis-after-hormuz-iran-threatens-to-block-strategic-bab-al-mandeb-strait-11268264,2026-03-26T07:19:46+00:00
NDTV,most_read,17,13 Dead After Bus Collided With Lorry And Caught Fire In Andhra Pradesh,https://www.ndtv.com/india-news/andhra-bus-fire-8-dead-after-bus-collided-with-lorry-and-caught-fire-in-andhra-pradesh-11267774,2026-03-26T07:19:46+00:00
NDTV,most_read,18,Did China Prepare Early For Iran? The Clue Lies In Its Oil Strategy,https://www.ndtv.com/world-news/iran-war-news-did-china-prepare-early-for-trumps-war-the-clue-lies-in-its-oil-strategy-11268028,2026-03-26T07:19:46+00:00
NDTV,most_read,19,"Kunal Kamra Shreds Ranveer Allahbadia For ""Milking"" India's Got Latent Row",https://www.ndtv.com/feature/stop-milking-this-kunal-kamra-shreds-ranveer-allahbadia-over-indias-got-latent-post-11267954,2026-03-26T07:19:46+00:00
NDTV,most_read,20,"""It Was Already Open"": Pak's Khawaja Asif Mocks US' Hormuz ""War Goal""",https://www.ndtv.com/world-news/iran-war-news-live-it-was-already-open-paks-khawaja-asif-mocks-us-hormuz-war-goal-11267874,2026-03-26T07:19:46+00:00
NDTV,most_read,21,"India Can Be ""Trusted"" Player In Reducing Middle East Tensions: Iran Envoy",https://www.ndtv.com/world-news/iran-war-news-india-can-be-trusted-player-in-reducing-middle-east-tensions-iran-envoy-amid-trumps-call-for-talks-11263670,2026-03-26T07:19:46+00:00
NDTV,most_read,22,"""I Have Non-Veg On Shivratri"": Siddaramaiah Counters Budget Timing Charge",https://www.ndtv.com/india-news/karnataka-assembly-budget-session-i-have-non-veg-on-shivratri-ugadi-siddaramaiah-counters-budget-timing-charge-11265694,2026-03-26T07:19:46+00:00
NDTV,most_read,23,Who Is Ananya Birla? All About New RCB Owner's Sister And Why She Is In News,https://www.ndtv.com/feature/who-is-ananya-birla-all-about-new-rcb-owners-sister-and-why-she-is-in-news-11266097,2026-03-26T07:19:46+00:00
NDTV,most_read,24,"""Negotiating With Yourselves?"" Why Iran Has Nothing To Lose, Trump Does",https://www.ndtv.com/world-news/iran-israel-us-war-middle-east-war-donald-trump-dont-call-defeat-agreement-trump-wants-peace-now-why-iran-may-fight-on-11263661,2026-03-26T07:19:46+00:00
NDTV,most_read,25,"India Does Not Have LPG Problem, It Has LOP Problem: Pralhad Joshi To NDTV",https://www.ndtv.com/india-news/india-does-not-have-lpg-problem-it-has-lop-problem-pralhad-joshi-to-ndtv-11266478,2026-03-26T07:19:46+00:00
NDTV,most_read,26,JD Vance May Travel To Pakistan For Iran War Talks Over Weekend: Report,https://www.ndtv.com/world-news/iran-war-news-jd-vance-may-travel-to-pakistan-for-iran-war-talks-over-weekend-report-11267773,2026-03-26T07:19:46+00:00
NDTV,most_read,27,"Badshah's Relationship Timeline: From First Marriage, To Divorce, And Second Wedding",https://www.ndtv.com/entertainment/badshahs-relationship-timeline-from-first-marriage-to-divorce-and-second-wedding-11263882,2026-03-26T07:19:46+00:00
NDTV,most_read,28,"On Camera, Speeding Car Rams Man And Daughter On Scooter In Coimbatore",https://www.ndtv.com/india-news/on-camera-speeding-car-rams-man-and-daughter-on-scooter-in-coimbatore-11265620,2026-03-26T07:19:46+00:00
NDTV,most_read,29,Pakistan's 1971 Blood Trail Mention In Tarique Rahman's Genocide Day Message,https://www.ndtv.com/world-news/pakistans-1971-blood-trail-mention-in-tarique-rahmans-genocide-day-message-11264268,2026-03-26T07:19:46+00:00
NDTV,most_read,30,"""He Tried To Touch Me"": Varanasi Student Records Alleged Harassment, Suspect Flees Mid-Journey",https://www.ndtv.com/india-news/he-tried-to-touch-me-varanasi-student-records-alleged-harassment-suspect-flees-mid-journey-11263802,2026-03-26T07:19:46+00:00
NDTV,most_read,31,"Bengaluru Driver Rams Autorickshaw Into Woman, Dumps Body On Way To Hospital",https://www.ndtv.com/bangalore-news/bengaluru-driver-rams-autorickshaw-into-woman-dumps-body-on-way-to-hospital-11267645,2026-03-26T07:19:46+00:00
NDTV,most_read,32,US Israel Iran War LIVE Updates,https://www.ndtv.com/world-news/us-israel-iran-war-live-updates-iran-rejects-15-point-us-president-donald-trump-proposal-issues-counterproposal-pakistan-mediation-strait-of-hormuz-11267700,2026-03-26T07:19:46+00:00
NDTV,trending,1,"Hyderabad Girl, Lover Kill Mother, Body Found Buried In Home After A Year",https://www.ndtv.com/india-news/hyderabad-crime-news-hyderabad-girl-lover-kill-mother-body-found-buried-in-home-after-a-year-11268493,2026-03-26T07:19:46+00:00
NDTV,trending,2,"Once Seen As Potential Allies, Congress, TVK Trade Barbs As Polls Approach",https://www.ndtv.com/india-news/tamil-nadu-assembly-election-vijay-once-seen-as-potential-allies-congress-tvk-trade-barbs-as-polls-approach-11268488,2026-03-26T07:19:46+00:00
NDTV,trending,3,"Talking 'Peace', Moving Troops: What Does Trump Really Want From Iran?",https://www.ndtv.com/opinion/iran-israel-war-talking-peace-moving-troops-what-does-trump-really-want-from-iran-11268456,2026-03-26T07:19:46+00:00
NDTV,trending,4,"How ""Wrath Of Snake"" Threat Gave Nashik 'Godman' Trip To 21 Nations, Mercedes",https://www.ndtv.com/india-news/ashok-kharat-astrologer-showed-snake-extorted-crores-mercedes-new-charge-against-nashik-godman-11268430,2026-03-26T07:19:46+00:00
NDTV,trending,5,Video: Holiday Traffic Causes Massive Jam On Mumbai-Pune Expressway,https://www.ndtv.com/india-news/watch-mumbai-pune-expressway-faces-severe-gridlock-amid-ram-navami-holiday-travel-11268423,2026-03-26T07:19:46+00:00
NDTV,trending,6,JNVST Result 2026: Class 9 And 11 Results Likely Out Soon,https://www.ndtv.com/education/jawahar-navodaya-vidyalaya-selection-test-jnvst-result-2026-class-9-and-11-results-likely-out-soon-11268406,2026-03-26T07:19:46+00:00
NDTV,trending,7,NIOS Releases Date Sheet 2026 For Class 10 And 12 Theory Examinations,https://www.ndtv.com/education/national-institute-of-open-schooling-nios-date-sheet-2026-released-for-theory-exams-11268233,2026-03-26T07:19:46+00:00
NDTV,trending,8,"Bihar Board Matric Result 2026: BSEB 10th Results Likely This Week, Know How To Check",https://www.ndtv.com/education/bihar-board-matric-result-2026-bseb-10th-results-likely-this-week-know-how-to-check-11267781,2026-03-26T07:19:46+00:00
NDTV,trending,9,Bihar Board Inter Result 2026 Scrutiny: Apply Online For Rechecking At BSEB Before April,https://www.ndtv.com/education/bihar-board-inter-result-2026-scrutiny-apply-online-for-rechecking-at-bseb-before-april-2-11267650,2026-03-26T07:19:46+00:00
NDTV,trending,10,"Government Rolls Out 15,000 AI Scholarships With Google And YouTube",https://www.ndtv.com/education/ministry-of-information-and-broadcasting-launches-15-000-ai-scholarships-with-google-youtube-to-boost-creative-sector-11267599,2026-03-26T07:19:46+00:00
NDTV,trending,11,"India, 5 Others On Iran's ""Friendly Nation"" List For Safe Hormuz Passage",https://www.ndtv.com/world-news/iran-war-news-strait-of-hormuz-open-for-friend-india-iran-amid-global-oil-crisis-11268022,2026-03-26T07:19:46+00:00
NDTV,trending,12,"India Speeds Up Oil, LPG Import Deals Amid Middle East Supply Shock",https://www.ndtv.com/india-news/iran-israel-war-strait-of-hormuz-crude-oil-prices-today-oil-shortage-india-speeds-up-oil-lpg-import-deals-amid-middle-east-supply-shock-11268336,2026-03-26T07:19:46+00:00
NDTV,trending,13,"Iran Claims It Shot Down American F-18 Jet, Then A US Fact-Check",https://www.ndtv.com/world-news/iran-war-news-iran-claims-it-shotdown-american-f-18-jet-then-a-us-fact-check-11267637,2026-03-26T07:19:46+00:00
NDTV,trending,14,"Iran Rejects US Proposal On Ending War, Lays Down 5 Conditions: Report",https://www.ndtv.com/world-news/iran-rejects-us-proposal-on-ending-war-lays-down-5-conditions-report-11266064,2026-03-26T07:19:46+00:00
NDTV,trending,15,'Where Were You When Iranians Were Dying?': Mandana Karimi Slams Boman Irani,https://www.ndtv.com/entertainment/where-were-you-when-iranians-were-dying-mandana-karimi-slams-boman-iranis-trump-roast-11268557,2026-03-26T07:19:46+00:00
NDTV,trending,16,Iran Threatens To Block 4th Largest Shipping Route If US Escalates War,https://www.ndtv.com/world-news/iran-war-oil-crisis-after-hormuz-iran-threatens-to-block-strategic-bab-al-mandeb-strait-11268264,2026-03-26T07:19:46+00:00
NDTV,trending,17,Leverage Reward vs Casualty Risk: Trump Faces Tough Kharg Island Choice,https://www.ndtv.com/world-news/iran-war-middle-east-war-kharg-island-iran-preps-for-island-warfare-amid-talk-of-us-ground-offensive-on-kharg-11268275,2026-03-26T07:19:46+00:00
NDTV,trending,18,"On Dhurandhar 2 Fake Poster Of Turbaned Ranveer Smoking, Aditya Dhar's Threat",https://www.ndtv.com/entertainment/aditya-dhar-threatens-firm-acts-against-dhurandhar-2-ai-poster-of-ranveer-singh-circulated-with-ulterior-motives-11268043,2026-03-26T07:19:46+00:00
NDTV,trending,19,13 Dead After Bus Collided With Lorry And Caught Fire In Andhra Pradesh,https://www.ndtv.com/india-news/andhra-bus-fire-8-dead-after-bus-collided-with-lorry-and-caught-fire-in-andhra-pradesh-11267774,2026-03-26T07:19:46+00:00
NDTV,trending,20,"Kunal Kamra Shreds Ranveer Allahbadia For ""Milking"" India's Got Latent Row",https://www.ndtv.com/feature/stop-milking-this-kunal-kamra-shreds-ranveer-allahbadia-over-indias-got-latent-post-11267954,2026-03-26T07:19:46+00:00
NDTV,trending,21,Did China Prepare Early For Iran? The Clue Lies In Its Oil Strategy,https://www.ndtv.com/world-news/iran-war-news-did-china-prepare-early-for-trumps-war-the-clue-lies-in-its-oil-strategy-11268028,2026-03-26T07:19:46+00:00
NDTV,trending,22,"Bengaluru Driver Rams Autorickshaw Into Woman, Dumps Body On Way To Hospital",https://www.ndtv.com/bangalore-news/bengaluru-driver-rams-autorickshaw-into-woman-dumps-body-on-way-to-hospital-11267645,2026-03-26T07:19:46+00:00
NDTV,trending,23,"In Bombshell Testimony, US Woman Says Doctor Husband Tried to Push Her Off Cliff, Beat Her With Rock",https://www.ndtv.com/world-news/i-started-screaming-in-bombshell-testimony-us-woman-says-husband-tried-to-push-her-off-cliff-beat-her-with-rock-11267737,2026-03-26T07:19:46+00:00
NDTV,trending,24,Who Is Ananya Birla? All About New RCB Owner's Sister And Why She Is In News,https://www.ndtv.com/feature/who-is-ananya-birla-all-about-new-rcb-owners-sister-and-why-she-is-in-news-11266097,2026-03-26T07:19:46+00:00
NDTV,trending,25,"On Camera, Speeding Car Rams Man And Daughter On Scooter In Coimbatore",https://www.ndtv.com/india-news/on-camera-speeding-car-rams-man-and-daughter-on-scooter-in-coimbatore-11265620,2026-03-26T07:19:46+00:00
NDTV,trending,26,"""He Tried To Touch Me"": Varanasi Student Records Alleged Harassment, Suspect Flees Mid-Journey",https://www.ndtv.com/india-news/he-tried-to-touch-me-varanasi-student-records-alleged-harassment-suspect-flees-mid-journey-11263802,2026-03-26T07:19:46+00:00
NDTV,trending,27,US Israel Iran War LIVE Updates,https://www.ndtv.com/world-news/us-israel-iran-war-live-updates-iran-rejects-15-point-us-president-donald-trump-proposal-issues-counterproposal-pakistan-mediation-strait-of-hormuz-11267700,2026-03-26T07:19:46+00:00
India Today,trending,1,"Vande Bharat passenger finds worms in food, IRCTC fined Rs 10 lakh after complaint",https://www.indiatoday.in/trending-news/story/vande-bharat-passenger-finds-worms-in-curd-food-irctc-fined-rs-10-lakh-after-complaint-video-2887260-2026-03-26,2026-03-26T07:19:46+00:00
India Today,trending,2,Gujarat forest officials rescue leopard that fell inside village well,https://www.indiatoday.in/trending-news/story/gujarat-forest-officials-rescue-leopard-that-fell-inside-village-well-2887075-2026-03-25,2026-03-26T07:19:46+00:00
India Today,trending,3,Dallas woman breaks down as date turns into dream proposal with family by her side,https://www.indiatoday.in/trending-news/story/dallas-woman-breaks-down-as-date-turns-into-dream-proposal-with-family-by-her-side-2887019-2026-03-25,2026-03-26T07:19:46+00:00
India Today,trending,4,"Auto driver watches reels while driving rashly, ignores woman's request to slow down",https://www.indiatoday.in/trending-news/story/bengaluru-auto-driver-watches-reels-while-driving-rashly-ignores-womans-request-to-slow-down-2886893-2026-03-25,2026-03-26T07:19:46+00:00
India Today,trending,5,"Bengaluru GenZ woman's Rs 25,000 personal expense list may trigger a millennial",https://www.indiatoday.in/trending-news/story/bengaluru-genz-womans-rs-25000-personal-expense-list-may-trigger-a-millennial-2886849-2026-03-25,2026-03-26T07:19:46+00:00
India Today,trending,6,London station staff's 'rude' tone with elderly woman instantly backfires on camera,https://www.indiatoday.in/trending-news/story/london-station-staff-rude-tone-with-elderly-woman-instantly-backfires-on-camera-2886847-2026-03-25,2026-03-26T07:19:46+00:00
India Today,trending,7,"Man climbs mobile tower, threatens suicide after woman refuses marriage",https://www.indiatoday.in/trending-news/story/chhattisgarh-man-climbs-mobile-tower-threatens-suicide-after-woman-refuses-marriage-2886798-2026-03-25,2026-03-26T07:19:46+00:00
India Today,trending,8,Mathura man's 'snake prank' at station leaves passengers in panic; Railways reacts,https://www.indiatoday.in/trending-news/story/mathura-man-snake-prank-at-station-leaves-passengers-in-panic-railways-reacts-to-viral-video-2886776-2026-03-25,2026-03-26T07:19:46+00:00
India Today,trending,9,"Bombay Shaving Company intern does pull-ups at work; CEO's blown away, you'll be too",https://www.indiatoday.in/trending-news/story/bombay-shaving-company-intern-does-pull-ups-at-work-video-ceo-is-blown-away-youll-be-too-2886764-2026-03-25,2026-03-26T07:19:46+00:00
India Today,trending,10,This 11-year-old can fly a plane better than most of us drive. Watch to believe,https://www.indiatoday.in/trending-news/story/this-11-year-old-can-fly-a-plane-better-than-most-of-us-drive-video-from-california-goes-viral-2886563-2026-03-24,2026-03-26T07:19:46+00:00
India Today,trending,11,Man washes potatoes with feet at Ghaziabad street stall. Video is viral,https://www.indiatoday.in/trending-news/story/man-washes-potatoes-with-feet-at-ghaziabad-street-stall-video-is-viral-2886506-2026-03-24,2026-03-26T07:19:46+00:00
India Today,trending,12,IIT Madras research scholar records wholesome video of deer feeding calf in middle of road,https://www.indiatoday.in/trending-news/story/iit-madras-research-scholar-records-wholesome-video-of-deer-feeding-calf-in-middle-of-road-2886425-2026-03-24,2026-03-26T07:19:46+00:00
India Today,trending,13,Tiger drags deer carcass after fresh hunt in Ranthambore; watch raw jungle moment,https://www.indiatoday.in/trending-news/story/tiger-drags-deer-carcass-after-fresh-hunt-in-ranthambore-watch-raw-jungle-moment-2886455-2026-03-24,2026-03-26T07:19:46+00:00
India Today,trending,14,"Street pianist meets his idol in streets of Paris, their epic performance is viral",https://www.indiatoday.in/trending-news/story/street-pianist-meets-his-idol-in-streets-of-paris-their-epic-performance-is-viral-2886318-2026-03-24,2026-03-26T07:19:46+00:00
India Today,trending,15,"Passengers put their feet up on seats in Chennai bus, authorities react to post",https://www.indiatoday.in/trending-news/story/man-flags-passengers-putting-feet-on-seats-in-chennai-bus-authorities-respond-2886287-2026-03-24,2026-03-26T07:19:46+00:00
India Today,trending,16,"Indian man claims he was denied entry with family in Vietnam eatery, alleges racism",https://www.indiatoday.in/trending-news/story/indian-man-claims-he-was-denied-entry-with-family-in-vietnam-eatery-alleges-racism-2886252-2026-03-24,2026-03-26T07:19:46+00:00
India Today,trending,17,Tamil Nadu activist stages mock funeral for LPG cylinder amid shortage. Watch,https://www.indiatoday.in/trending-news/story/tamil-nadu-salem-activist-stages-mock-funeral-for-lpg-cylinder-amid-shortage-video-goes-viral-2886250-2026-03-24,2026-03-26T07:19:46+00:00
India Today,trending,18,"Seven dogs escape meat traders in China, trek 17 km home in heartwarming video",https://www.indiatoday.in/trending-news/story/seven-stolen-dogs-escape-meat-traders-in-china-trek-17-km-home-in-heartwarming-video-2886207-2026-03-24,2026-03-26T07:19:46+00:00
India Today,trending,19,Bihar traffic constable saves CISF jawan with swift CPR on busy Patna road,https://www.indiatoday.in/trending-news/story/bihar-traffic-constable-saves-cisf-jawan-with-swift-cpr-on-busy-patna-road-2886054-2026-03-23,2026-03-26T07:19:46+00:00
India Today,trending,20,"Bengaluru woman walks 2.7 km daily to office to avoid traffic, shares experience",https://www.indiatoday.in/trending-news/story/bengaluru-woman-walks-27-km-daily-to-office-to-avoid-traffic-shares-experience-2886046-2026-03-23,2026-03-26T07:19:46+00:00
India Today,trending,21,"8th Pay Commission: Timeline clear, salary hike and arrears details explained",https://www.indiatoday.in/business/personal-finance/story/8th-pay-commission-timeline-clear-salary-hike-and-arrears-details-explained-2887280-2026-03-26,2026-03-26T07:19:46+00:00
India Today,trending,22,"Caught on CCTV: Businessman flung into air, killed after minor’s car rams his cycle",https://www.indiatoday.in/cities/story/thane-srinivas-tandale-accident-death-minor-driving-kills-businessman-cyclist-kalyan-video-2887274-2026-03-26,2026-03-26T07:19:46+00:00
India Today,trending,23,"Meta, YouTube found guilty in social media addiction case, ordered to pay $6 million",https://www.indiatoday.in/technology/news/story/meta-youtube-found-guilty-in-social-media-addiction-case-ordered-to-pay-6-million-2887277-2026-03-26,2026-03-26T07:19:46+00:00
India Today,trending,24,"Laxman Sivaramakrishnan says no BCCI, Jay Shah links to commentary exit",https://www.indiatoday.in/sports/cricket/story/laxman-sivaramakrishnan-bcci-jay-shah-commentary-exit-controversy-2885159-2026-03-21,2026-03-26T07:19:46+00:00
