source,section,rank,headline,link,collected_at_iso
Times of India,most_read,1,"Kerala Vaduthala house horror: Woman dresses kids in suits, makes them wear goggles before killing them; 5 found dead",https://timesofindia.indiatimes.com/articleshow/129728103.cms,2026-03-23T17:00:58+00:00
Times of India,most_read,2,"EXCLUSIVE: Less than a week before IPL starts, Mumbai Indians star Jasprit Bumrah reaches BCCI CoE",https://timesofindia.indiatimes.com/articleshow/129751567.cms,2026-03-23T17:00:58+00:00
Times of India,most_read,3,IAF civilian staffer held in Assam for leaking defence info to Pakistan,https://timesofindia.indiatimes.com/articleshow/129737876.cms,2026-03-23T17:00:58+00:00
Times of India,most_read,4,"‘They listened to music and killed’: 5 held in Kolkata RG Kar hospital lift tragedy; machine turned into murder tool, cops tell court",https://timesofindia.indiatimes.com/articleshow/129727386.cms,2026-03-23T17:00:58+00:00
Times of India,most_read,5,"Fragile footing: How India, China face sizeable economic damage from US-Iran war",https://timesofindia.indiatimes.com/articleshow/129753757.cms,2026-03-23T17:00:58+00:00
Times of India,most_read,6,Gen Z women are playing the ‘good bahu’ online. Is it pressure — or empowering?,https://timesofindia.indiatimes.com/articleshow/129720667.cms,2026-03-23T17:00:58+00:00
Times of India,most_read,7,"From 48-hr ultimatum to 5-day pause: Trump cites ‘productive’ US-Iran talks, halts infra strikes",https://timesofindia.indiatimes.com/articleshow/129751050.cms,2026-03-23T17:00:58+00:00
Times of India,most_read,8,'Vaibhav Sooryavanshi is not professional': RCB star’s stunning remark goes viral,https://timesofindia.indiatimes.com/articleshow/129748323.cms,2026-03-23T17:00:58+00:00
Times of India,most_read,9,Terror threat rocks Pakistan's PSL: Foreign players asked to 'withdraw immediately',https://timesofindia.indiatimes.com/articleshow/129749033.cms,2026-03-23T17:00:58+00:00
Times of India,most_read,10,"11+ hours for a pilot, Rs 1.8 lakh for a ticket: What the Iran war has done to flying from India",https://timesofindia.indiatimes.com/articleshow/129732107.cms,2026-03-23T17:00:58+00:00
Times of India,most_read,11,H-1B visa registration dip 30-50%: Here are the companies that are emerging as ‘favourites’,https://timesofindia.indiatimes.com/articleshow/129747330.cms,2026-03-23T17:00:58+00:00
Times of India,most_read,12,The 'buried' love stories: Lives lost in the name of ‘honour’,https://timesofindia.indiatimes.com/articleshow/129746040.cms,2026-03-23T17:00:58+00:00
Times of India,most_read,13,Jeff Bezos' ex-wife makes another 'record-setting gift of $42 million',https://timesofindia.indiatimes.com/articleshow/129729488.cms,2026-03-23T17:00:58+00:00
Times of India,most_read,14,'Everyone knows how he became captain': Ex-India captain's cryptic dig at Riyan Parag,https://timesofindia.indiatimes.com/articleshow/129749856.cms,2026-03-23T17:00:58+00:00
Times of India,most_read,15,Stock market today: Top gainers and losers on NSE and BSE - check full list,https://timesofindia.indiatimes.com/articleshow/129753612.cms,2026-03-23T17:00:58+00:00
Times of India,most_read,16,Humpy on candidates' pull-out: ‘Would FIDE hold tournaments in Kashmir?’,https://timesofindia.indiatimes.com/articleshow/129750302.cms,2026-03-23T17:00:58+00:00
Times of India,most_read,17,"If America strikes us, we should attack Indian cities like Delhi and Mumbai: Ex-Pak envoy",https://timesofindia.indiatimes.com/articleshow/129738177.cms,2026-03-23T17:00:58+00:00
Times of India,most_read,18,"‘Dhurandhar: The Revenge’ box office collection day 4: Ranveer Singh, Rakesh Bedi, Sanjay Dutt's film inches close to Rs 700 cr",https://timesofindia.indiatimes.com/articleshow/129740865.cms,2026-03-23T17:00:58+00:00
Times of India,most_read,19,"'Dhurandhar 2' actor Mustafa Ahmed who played Hamza's aide Rizwan, started his journey as a gym trainer earning Rs 10,000 a month",https://timesofindia.indiatimes.com/articleshow/129735121.cms,2026-03-23T17:00:58+00:00
Times of India,most_read,20,"'Situation worrisome': PM Modi clears India's stand on Iran war, flags impact of Hormuz disruption",https://timesofindia.indiatimes.com/articleshow/129747334.cms,2026-03-23T17:00:58+00:00
Times of India,most_read,21,"'Stop, stop, stop!': Cockpit audio captures final moments between pilot, co-pilot before Air Canada crash kills both",https://timesofindia.indiatimes.com/articleshow/129747504.cms,2026-03-23T17:00:58+00:00
Times of India,most_read,22,"Why did stock market crash today? Rs 14 lakh crore wiped out! BSE Sensex ends over 1,800 points down - top reasons for fall",https://timesofindia.indiatimes.com/articleshow/129742276.cms,2026-03-23T17:00:58+00:00
Times of India,most_read,23,'You’re fired': Iran’s IRGC mocks Donald Trump with his own catchphrase after his 48-hour ultimatum,https://timesofindia.indiatimes.com/articleshow/129741829.cms,2026-03-23T17:00:58+00:00
Times of India,most_read,24,"Ex-India star advises Hardik Pandya to step aside, ‘let Suryakumar Yadav lead’ at MI",https://timesofindia.indiatimes.com/articleshow/129734319.cms,2026-03-23T17:00:58+00:00
Times of India,most_read,25,Lamborghini stunt in Bengaluru leads police to underworld figure Muthappa Rai’s son,https://timesofindia.indiatimes.com/articleshow/129737885.cms,2026-03-23T17:00:58+00:00
Times of India,most_read,26,Iran war not to end soon? Treasury's Bessent says US has 'plenty of money to fund this war',https://timesofindia.indiatimes.com/articleshow/129737101.cms,2026-03-23T17:00:58+00:00
Times of India,most_read,27,'Khelega hi nahi': Ashwin's blunt verdict on Arjun Tendulkar at LSG,https://timesofindia.indiatimes.com/articleshow/129742177.cms,2026-03-23T17:00:58+00:00
Times of India,most_read,28,Iran’s supreme leader in the shadows: CIA hunts for signs of Mojtaba Khamenei,https://timesofindia.indiatimes.com/articleshow/129742966.cms,2026-03-23T17:00:58+00:00
Times of India,most_read,29,Ryan Gosling's 'Project Hail Mary' tops North America box office with USD 80.5 million haul; Ranveer Singh's 'Dhurandhar: The Revenge' ranks third with USD 10 million opening,https://timesofindia.indiatimes.com/articleshow/129738593.cms,2026-03-23T17:00:58+00:00
Times of India,most_read,30,"'Dhurandhar: The Revenge' box office collection day 5 [LIVE]: Ranveer Singh, Sanjay Dutt starrer targets Rs 700 crore worldwide",https://timesofindia.indiatimes.com/articleshow/129744544.cms,2026-03-23T17:00:58+00:00
Times of India,most_read,31,Bigger US strike on Iran today? Trump’s 'mild' warning as 48-hour deadline expires today,https://timesofindia.indiatimes.com/articleshow/129743011.cms,2026-03-23T17:00:58+00:00
Times of India,most_read,32,"'Drop these players': Gavaskar fumes at IPL no-shows, slams ‘taking for granted’ culture",https://timesofindia.indiatimes.com/articleshow/129735359.cms,2026-03-23T17:00:58+00:00
Times of India,most_read,33,"Gold price prediction today: Why are gold prices crashing? Key levels to watch out for March 23, 2026 week",https://timesofindia.indiatimes.com/articleshow/129744329.cms,2026-03-23T17:00:58+00:00
Times of India,most_read,34,"'Illegal, inhuman': Iran sticks Spanish PM's 'no war' message on missiles targeting Israel",https://timesofindia.indiatimes.com/articleshow/129742699.cms,2026-03-23T17:00:58+00:00
Times of India,most_read,35,Will Trump's 48-hour ultimatum to Iran leave him red-faced again?,https://timesofindia.indiatimes.com/articleshow/129734531.cms,2026-03-23T17:00:58+00:00
Times of India,most_read,36,LPG crisis: Argentina emerges as key alternative supplier; shipments more than double in just first three months of 2026,https://timesofindia.indiatimes.com/articleshow/129746836.cms,2026-03-23T17:00:58+00:00
Times of India,most_read,37,"Pilot, co-pilot killed in Air Canada jet collision with fire truck in New York",https://timesofindia.indiatimes.com/articleshow/129743277.cms,2026-03-23T17:00:58+00:00
Times of India,most_read,38,"After Trump's warning, Iran threatens to close the Strait of Hormuz",https://timesofindia.indiatimes.com/articleshow/129740969.cms,2026-03-23T17:00:58+00:00
Times of India,most_read,39,IPL over PSL: Players' 'pay hike' demands give Pakistan Cricket Board massive headache,https://timesofindia.indiatimes.com/articleshow/129748686.cms,2026-03-23T17:00:58+00:00
Times of India,most_read,40,"Gold prices crash: Yellow metal registers worst weekly fall in 40 years, what should investors do?",https://timesofindia.indiatimes.com/articleshow/129743153.cms,2026-03-23T17:00:58+00:00
Times of India,most_read,41,If Trump Puts Troops In Iran…,https://timesofindia.indiatimes.com/articleshow/129734562.cms,2026-03-23T17:00:58+00:00
Times of India,most_read,42,"Gold price today: How much 18K, 22K and 24K gold costs in your city? Check prices in Delhi, Mumbai, Chennai & more",https://timesofindia.indiatimes.com/articleshow/129745389.cms,2026-03-23T17:00:58+00:00
Times of India,most_read,43,Owaisi announces alliance for Bengal polls: AIMIM to contest with Humayun Kabir’s AJU party,https://timesofindia.indiatimes.com/articleshow/129735667.cms,2026-03-23T17:00:58+00:00
Times of India,most_read,44,WWE Raw tonight,https://timesofindia.indiatimes.com/articleshow/129746056.cms,2026-03-23T17:00:58+00:00
Times of India,most_read,45,BSEB 12th Result,https://timesofindia.indiatimes.com/articleshow/129746152.cms,2026-03-23T17:00:58+00:00
Times of India,most_read,46,HDFC Bank Share,https://timesofindia.indiatimes.com/articleshow/129744715.cms,2026-03-23T17:00:58+00:00
Times of India,most_read,47,Bihar Board Inter Science Toppers 2026,https://timesofindia.indiatimes.com/articleshow/129747808.cms,2026-03-23T17:00:58+00:00
Times of India,most_read,48,BSEB Bihar Board Inter Commerce Toppers 2026,https://timesofindia.indiatimes.com/articleshow/129748048.cms,2026-03-23T17:00:58+00:00
Times of India,most_read,49,MP Board Result 2026,https://timesofindia.indiatimes.com/articleshow/129744852.cms,2026-03-23T17:00:58+00:00
Times of India,most_read,50,Bihar Board Toppers,https://timesofindia.indiatimes.com/articleshow/129745664.cms,2026-03-23T17:00:58+00:00
Times of India,most_read,51,Rajasthan Board 10th Result,https://timesofindia.indiatimes.com/articleshow/129743754.cms,2026-03-23T17:00:58+00:00
Times of India,most_read,52,Bali Day of Silence Rule,https://timesofindia.indiatimes.com/articleshow/129729311.cms,2026-03-23T17:00:58+00:00
Times of India,most_read,53,The 50 Winner,https://timesofindia.indiatimes.com/articleshow/129735962.cms,2026-03-23T17:00:58+00:00
Times of India,most_read,54,Ustaad Bhagat Singh Collection,https://timesofindia.indiatimes.com/articleshow/129740703.cms,2026-03-23T17:00:58+00:00
Times of India,most_read,55,Flight Coconut Rules,https://timesofindia.indiatimes.com/articleshow/129682189.cms,2026-03-23T17:00:58+00:00
Times of India,most_read,56,Vande Bharat Sleeper Train,https://timesofindia.indiatimes.com/articleshow/129718156.cms,2026-03-23T17:00:58+00:00
Times of India,most_read,57,No Railway Connectivity State,https://timesofindia.indiatimes.com/articleshow/129728132.cms,2026-03-23T17:00:58+00:00
Times of India,most_read,58,Ahmedabad Monkey Man,https://timesofindia.indiatimes.com/articleshow/129724500.cms,2026-03-23T17:00:58+00:00
Times of India,most_read,59,Aadu 3 Box Office Collection,https://timesofindia.indiatimes.com/articleshow/129741043.cms,2026-03-23T17:00:58+00:00
Times of India,most_read,60,Dubai Airports Updates,https://timesofindia.indiatimes.com/articleshow/129743279.cms,2026-03-23T17:00:58+00:00
Times of India,most_read,61,Wechat Meets Openclaw,https://timesofindia.indiatimes.com/articleshow/129732303.cms,2026-03-23T17:00:58+00:00
Times of India,most_read,62,World Largest Network Botnets,https://timesofindia.indiatimes.com/articleshow/129697142.cms,2026-03-23T17:00:58+00:00
Times of India,most_read,63,Skoda Kushaq Facelift,https://timesofindia.indiatimes.com/articleshow/129743904.cms,2026-03-23T17:00:58+00:00
Times of India,most_read,64,Bihar Board 12th Result 2026,https://timesofindia.indiatimes.com/articleshow/129744782.cms,2026-03-23T17:00:58+00:00
Times of India,most_read,65,Delhi High Court,https://timesofindia.indiatimes.com/articleshow/129747018.cms,2026-03-23T17:00:58+00:00
Times of India,most_read,66,Lucknow Mother in law,https://timesofindia.indiatimes.com/articleshow/129738313.cms,2026-03-23T17:00:58+00:00
Times of India,most_read,67,CM Yogi Adityanath,https://timesofindia.indiatimes.com/articleshow/129737176.cms,2026-03-23T17:00:58+00:00
Times of India,most_read,68,Delhi Mathura Highway,https://timesofindia.indiatimes.com/articleshow/129736852.cms,2026-03-23T17:00:58+00:00
Times of India,most_read,69,Delhi Power Tariff,https://timesofindia.indiatimes.com/articleshow/129741337.cms,2026-03-23T17:00:58+00:00
Times of India,most_read,70,Bhubaneswar girl murder news,https://timesofindia.indiatimes.com/articleshow/129741387.cms,2026-03-23T17:00:58+00:00
Times of India,most_read,71,Raipur Sanjay Park,https://timesofindia.indiatimes.com/articleshow/129731693.cms,2026-03-23T17:00:58+00:00
Times of India,most_read,72,Bengal Assembly Election,https://timesofindia.indiatimes.com/articleshow/129736120.cms,2026-03-23T17:00:58+00:00
Times of India,most_read,73,Laljit Singh Bhullar,https://timesofindia.indiatimes.com/articleshow/129741740.cms,2026-03-23T17:00:58+00:00
Times of India,most_read,74,Assam Assembly Polls,https://timesofindia.indiatimes.com/articleshow/129737262.cms,2026-03-23T17:00:58+00:00
Times of India,most_read,75,Kolkata Gas Price,https://timesofindia.indiatimes.com/articleshow/129734512.cms,2026-03-23T17:00:58+00:00
Times of India,most_read,76,RG Kar Hospital,https://timesofindia.indiatimes.com/articleshow/129737394.cms,2026-03-23T17:00:58+00:00
Times of India,most_read,77,Delhi NCR Weather,https://timesofindia.indiatimes.com/articleshow/129742144.cms,2026-03-23T17:00:58+00:00
Times of India,most_read,78,Red Fort Suicide Blast,https://timesofindia.indiatimes.com/articleshow/129742610.cms,2026-03-23T17:00:58+00:00
Times of India,most_read,79,Openai Acquires Astral,https://timesofindia.indiatimes.com/articleshow/129683748.cms,2026-03-23T17:00:58+00:00
Times of India,most_read,80,Exclusive - Anupamaa actor Sachin Tyagi on daily soaps and a tiring work schedule: I try to find happiness wherever I go,https://timesofindia.indiatimes.com/articleshow/129753909.cms,2026-03-23T17:00:58+00:00
Times of India,most_read,81,Sameer Wankhede tells Bombay HC he never sought Rs 25 crore bribe from Shah Rukh Khan in Aryan Khan case,https://timesofindia.indiatimes.com/articleshow/129754240.cms,2026-03-23T17:00:58+00:00
Times of India,most_read,82,"Leonid Radvinsky, founder of OnlyFans, dies at 43 of cancer",https://timesofindia.indiatimes.com/articleshow/129754160.cms,2026-03-23T17:00:58+00:00
Times of India,most_read,83,Matthew Stafford’s Los Angeles Rams connected to $157 million New England Patriots wide receiver,https://timesofindia.indiatimes.com/articleshow/129752546.cms,2026-03-23T17:00:58+00:00
Times of India,most_read,84,Is India’s reliance on the Gulf becoming its biggest economic risk now?,https://timesofindia.indiatimes.com/articleshow/129751649.cms,2026-03-23T17:00:58+00:00
Times of India,most_read,85,NHL insider Elliotte Friedman reveals real reason behind light NHL suspensions in Anaheim Ducks and Florida Panthers incidents,https://timesofindia.indiatimes.com/articleshow/129753680.cms,2026-03-23T17:00:58+00:00
Times of India,most_read,86,"Floyd Mayweather Jr vs Manny Pacquiao rematch to break previous $600M ‘Fight of the Century’ record in Las Vegas, Jas Mathur opens up on fight’s preparations",https://timesofindia.indiatimes.com/articleshow/129753264.cms,2026-03-23T17:00:58+00:00
Times of India,most_read,87,"Ravi Kishan lauds Aditya Dhar's ‘Dhurandhar’: ‘Intense, compelling and unforgettable’",https://timesofindia.indiatimes.com/articleshow/129754112.cms,2026-03-23T17:00:58+00:00
Times of India,most_read,88,"SSC releases JE, CHSL Tier 2 exam city slip and admit card 2026 dates; check details here",https://timesofindia.indiatimes.com/articleshow/129753884.cms,2026-03-23T17:00:58+00:00
Times of India,most_read,89,Madhoo Shah hints at ‘Phool Aur Kaante 2’ with Ajay Devgn in viral 'Then vs Now' clip; ‘Even after 33 years..’,https://timesofindia.indiatimes.com/articleshow/129754033.cms,2026-03-23T17:00:58+00:00
Times of India,most_read,90,"Iran reportedly threatening to cut Red Sea cables: What it means for internet users across the world, including India",https://timesofindia.indiatimes.com/articleshow/129753685.cms,2026-03-23T17:00:58+00:00
Times of India,most_read,91,IBM Consulting VP Mohamad Ali: Biggest question in corporate strategy right now is how do you prepare for an AI world where …,https://timesofindia.indiatimes.com/articleshow/129753809.cms,2026-03-23T17:00:58+00:00
Times of India,most_read,92,"7 questions to ask before getting married, therapist reveals",https://timesofindia.indiatimes.com/articleshow/129753634.cms,2026-03-23T17:00:58+00:00
Times of India,most_read,93,"Man caught on camera urinating in front of Indian restaurant in Texas, says he could not hold it",https://timesofindia.indiatimes.com/articleshow/129753594.cms,2026-03-23T17:00:58+00:00
Times of India,most_read,94,‘His next conquest’? Tom Brady and Kay Adams’ viral clip has the internet doing too much,https://timesofindia.indiatimes.com/articleshow/129753686.cms,2026-03-23T17:00:58+00:00
Times of India,most_read,95,Shoba Chandrasekhar’s heartfelt words on Sangeetha and family go viral; Sanjay and Sasha’s sweet moments are recalled,https://timesofindia.indiatimes.com/articleshow/129753635.cms,2026-03-23T17:00:58+00:00
Times of India,most_read,96,Indian sports economy crosses $2 billion mark; cricket accounts for 89%,https://timesofindia.indiatimes.com/articleshow/129753506.cms,2026-03-23T17:00:58+00:00
Times of India,trending,1,"etimesViral video claims Pakistan on ‘Indian spy alert’ after Dhurandhar 2 - here’s the truthFollowing the success of Ranveer Singh's film 'Dhurandhar 2', a viral video of Pakistani police conducting street checks was falsely linked to the movie. The footage, actually from an older operation in Karachi, sparked online speculation of a spy hunt. This incident highlights how easily the internet can misinterpret events, creating a fictional narrative around real-life occurrences.",https://timesofindia.indiatimes.com/articleshow/129757676.cms,2026-03-23T17:00:58+00:00
Times of India,trending,2,etimes‘Better or worse isn’t the point’: Dutch mom breaks down 7 big parenting differences in India vs Netherlands,https://timesofindia.indiatimes.com/articleshow/129756222.cms,2026-03-23T17:00:58+00:00
Times of India,trending,3,"etimesVideo inside: Auto-rickshaw in London goes viral, reminds Indians of home instantly",https://timesofindia.indiatimes.com/articleshow/129754714.cms,2026-03-23T17:00:58+00:00
Times of India,trending,4,"etimesWatch: Viral video shows how robots are replacing delivery riders in DubaiA viral video from Dubai showcases a food delivery experience unlike any other, with a robot named Rover completing the entire process. An Indian man, Harish Kumar, documented how the robot autonomously delivered his order, with users controlling the lid via their phones. This technological advancement has sparked excitement about convenience and efficiency, alongside questions regarding safety and potential tampering.",https://timesofindia.indiatimes.com/articleshow/129753262.cms,2026-03-23T17:00:58+00:00
Times of India,trending,5,"etimesChepauk erupts as MS Dhoni walks in; female CSK fan breaks down in tears - viral moment melts heartsAt Chennai's ""Roar 2026"" event, MS Dhoni's appearance triggered an overwhelming emotional response, with one fan's tears capturing the deep personal connection fans share with him. This moment highlights that Dhoni's impact transcends cricket, representing a significant part of many fans' lives, making a future without him incredibly difficult to accept.",https://timesofindia.indiatimes.com/articleshow/129751206.cms,2026-03-23T17:00:58+00:00
Times of India,trending,6,Gold Price in Mumbai,https://timesofindia.indiatimes.com/articleshow/129745389.cms,2026-03-23T17:00:58+00:00
Times of India,trending,7,Trump Iran Talk,https://timesofindia.indiatimes.com/articleshow/129751050.cms,2026-03-23T17:00:58+00:00
Times of India,trending,8,Who is Nabeel Gabol? The alleged Pakistani politician behind Dhurandhar's character Jameel Jamali,https://timesofindia.indiatimes.com/articleshow/129748022.cms,2026-03-23T17:00:58+00:00
Times of India,trending,9,March 2026 rains: How will the Western Disturbance impact the standing Rabi crop? Is it beneficial or harmful?,https://timesofindia.indiatimes.com/articleshow/129748589.cms,2026-03-23T17:00:58+00:00
Times of India,trending,10,Taj ice cream parlour: Madhubala's favourite ice cream spot still runs today and follows a 138-year-old secret technique for the recipe,https://timesofindia.indiatimes.com/articleshow/129746582.cms,2026-03-23T17:00:58+00:00
Times of India,trending,11,'Going to be a Civil War': MAGA enraged as foreign doctors secure US residency slots on match day,https://timesofindia.indiatimes.com/articleshow/129751777.cms,2026-03-23T17:00:58+00:00
Times of India,trending,12,"From Germany to Ayodhya: Who is little Anjaneya, the devotional child winning hearts during his Ram Mandir visit?",https://timesofindia.indiatimes.com/articleshow/129745649.cms,2026-03-23T17:00:58+00:00
Times of India,trending,13,500-year-old Toronto seeds defy death! Ancient seeds sprout after a century underground,https://timesofindia.indiatimes.com/articleshow/129742937.cms,2026-03-23T17:00:58+00:00
Times of India,trending,14,'Far from being ghost town': Indian founder defends Dubai as panic over city's life circulates online,https://timesofindia.indiatimes.com/articleshow/129745079.cms,2026-03-23T17:00:58+00:00
Times of India,trending,15,'Where's the old man?': Karoline Leavitt’s baby shower photos spark frenzy over missing husband and age-gap marriage,https://timesofindia.indiatimes.com/articleshow/129744175.cms,2026-03-23T17:00:58+00:00
Times of India,trending,16,"'Wouldn't be in business today without India': Why Germany is ""desperate"" for millions of Indians to save its economy",https://timesofindia.indiatimes.com/articleshow/129743215.cms,2026-03-23T17:00:58+00:00
Times of India,trending,17,"He rapped about corruption, now set to run Nepal: Inside Balen Shah’s music",https://timesofindia.indiatimes.com/articleshow/129715855.cms,2026-03-23T17:00:58+00:00
Times of India,trending,18,'Bomb our little hearts out': Trump sets 5-day window for 15-point Iran deal — what he said,https://timesofindia.indiatimes.com/articleshow/129756818.cms,2026-03-23T17:00:58+00:00
Times of India,trending,19,Colombian military plane with 110 soldiers on board erupts in flames after crash — watch,https://timesofindia.indiatimes.com/articleshow/129757760.cms,2026-03-23T17:00:58+00:00
Times of India,trending,20,'PM Modi 100% under control of Trump': Rahul takes shot at Centre over Iran war,https://timesofindia.indiatimes.com/articleshow/129757130.cms,2026-03-23T17:00:58+00:00
Times of India,trending,21,'Surya not being captain is a concern': Ashwin’s blunt verdict on MI captaincy,https://timesofindia.indiatimes.com/articleshow/129749037.cms,2026-03-23T17:00:58+00:00
Times of India,trending,22,WWE Raw tonight,https://timesofindia.indiatimes.com/articleshow/129746056.cms,2026-03-23T17:00:58+00:00
Times of India,trending,23,BSEB 12th Result,https://timesofindia.indiatimes.com/articleshow/129746152.cms,2026-03-23T17:00:58+00:00
Times of India,trending,24,HDFC Bank Share,https://timesofindia.indiatimes.com/articleshow/129744715.cms,2026-03-23T17:00:58+00:00
Times of India,trending,25,Bihar Board Inter Science Toppers 2026,https://timesofindia.indiatimes.com/articleshow/129747808.cms,2026-03-23T17:00:58+00:00
Times of India,trending,26,Canada Plane Crash,https://timesofindia.indiatimes.com/articleshow/129747504.cms,2026-03-23T17:00:58+00:00
Times of India,trending,27,BSEB Bihar Board Inter Commerce Toppers 2026,https://timesofindia.indiatimes.com/articleshow/129748048.cms,2026-03-23T17:00:58+00:00
Times of India,trending,28,Stock Market Today,https://timesofindia.indiatimes.com/articleshow/129742276.cms,2026-03-23T17:00:58+00:00
Times of India,trending,29,MP Board Result 2026,https://timesofindia.indiatimes.com/articleshow/129744852.cms,2026-03-23T17:00:58+00:00
Times of India,trending,30,Gold prices crash,https://timesofindia.indiatimes.com/articleshow/129756525.cms,2026-03-23T17:00:58+00:00
Times of India,trending,31,US Stock Market Today,https://timesofindia.indiatimes.com/articleshow/129756850.cms,2026-03-23T17:00:58+00:00
Times of India,trending,32,UPSC provisional answer key,https://timesofindia.indiatimes.com/articleshow/129754510.cms,2026-03-23T17:00:58+00:00
Times of India,trending,33,APSSB recruitment 2026,https://timesofindia.indiatimes.com/articleshow/129754244.cms,2026-03-23T17:00:58+00:00
Times of India,trending,34,SSC JE scorecard,https://timesofindia.indiatimes.com/articleshow/129755999.cms,2026-03-23T17:00:58+00:00
Times of India,trending,35,KVS NVS Tier 2 admit card,https://timesofindia.indiatimes.com/articleshow/129756638.cms,2026-03-23T17:00:58+00:00
Times of India,trending,36,Bihar Board Toppers,https://timesofindia.indiatimes.com/articleshow/129745664.cms,2026-03-23T17:00:58+00:00
Times of India,trending,37,Rajasthan Board 10th Result,https://timesofindia.indiatimes.com/articleshow/129743754.cms,2026-03-23T17:00:58+00:00
Times of India,trending,38,Dhurandhar 2 Box Office Collection,https://timesofindia.indiatimes.com/articleshow/129744544.cms,2026-03-23T17:00:58+00:00
