source,rank,headline,link,collected_at_iso
TOI Viral News,95,"Kolkata team unveils fan mural at Rash Behari Avenue, celebrating city’s first love",https://timesofindia.indiatimes.com/articleshow/130059554.cms,2026-04-13T13:56:28+00:00
TOI Viral News,96,How US spread a lie to rescue a pilot of a jet shot down in Iran,https://timesofindia.indiatimes.com/articleshow/130058641.cms,2026-04-13T13:56:28+00:00
TOI Viral News,97,"Netflix unveils ‘VOID’, an AI model that can change a movie plot",https://timesofindia.indiatimes.com/articleshow/130058880.cms,2026-04-13T13:56:28+00:00
TOI Viral News,98,"AI data centers are causing 'stress' not just to tech companies, but also private insurers",https://timesofindia.indiatimes.com/articleshow/130058967.cms,2026-04-13T13:56:28+00:00
TOI Viral News,99,"""Trans women are....."": Clavicular’s viral moment with trans women sparks fresh conversation on internet culture",https://timesofindia.indiatimes.com/articleshow/130053479.cms,2026-04-13T13:56:28+00:00
NDTV,1,All India News,https://www.ndtv.com/india,2026-04-13T13:56:28+00:00
NDTV,2,"""Burnt Body To Remove Worms"": A Brother's Chilling Confession In Dhanbad",https://www.ndtv.com/india-news/burnt-body-to-remove-worms-a-brothers-chilling-confession-in-dhanbad-11351783,2026-04-13T13:56:28+00:00
NDTV,3,Green Corridor On Delhi-Dehradun Expressway Ensures Safe Wildlife Transit,https://www.ndtv.com/india-news/green-corridor-on-delhi-dehradun-expressway-ensures-safe-wildlife-transit-11351749,2026-04-13T13:56:28+00:00
NDTV,4,"Punjab Assembly Passes Strict Sacrilege Law, Amends 2008 Act",https://www.ndtv.com/india-news/punjab-assembly-passes-strict-sacrilege-law-amends-2008-act-11351643,2026-04-13T13:56:28+00:00
NDTV,5,Nitish Kumar's Successor Will Inherit A Bihar Drowning In Financial Debt,https://www.ndtv.com/india-news/nitish-kumars-successor-will-inherit-a-bihar-drowning-in-financial-debt-11351439,2026-04-13T13:56:28+00:00
NDTV,6,"Police Bust Illegal Entry Network In Assam, 4 Bangladeshi Nationals Detained",https://www.ndtv.com/india-news/police-bust-illegal-entry-network-in-assam-4-bangladeshi-nationals-detained-11351249,2026-04-13T13:56:28+00:00
NDTV,7,"Madhya Pradesh Board 10th, 12th Result Date 2026: How To Check",https://www.ndtv.com/education/mp-board-10th-12th-result-date-2026-how-to-download-mpbse-marksheet-11351746,2026-04-13T13:56:28+00:00
NDTV,8,National Testing Agency To Release NEET UG 2026 Admit Card Soon,https://www.ndtv.com/education/national-testing-agency-to-release-neet-ug-2026-admit-card-soon-exam-city-slip-out-11351498,2026-04-13T13:56:28+00:00
NDTV,9,NIT Trichy Admission Process Explained For 2026 Counselling,https://www.ndtv.com/education/nit-trichy-admission-2026-explained-courses-offered-counselling-details-11350805,2026-04-13T13:56:28+00:00
NDTV,10,"Intelligence Bureau MTS Result 2026: Out Shortly, Download Link Here",https://www.ndtv.com/education/intelligence-bureau-mts-result-2026-out-shortly-download-link-here-11350761,2026-04-13T13:56:28+00:00
NDTV,11,Jharkhand Excise Recruitment Exam: 159 Held Over Paper Leak Allegations,https://www.ndtv.com/education/jharkhand-excise-recruitment-exam-159-candidates-held-over-paper-leak-allegations-11350028,2026-04-13T13:56:28+00:00
NDTV,12,Assembly Elections 2026,https://www.ndtv.com/elections,2026-04-13T13:56:28+00:00
NDTV,13,"US Called Netanyahu From Islamabad. He Says, ""The Explosion Came From...""",https://www.ndtv.com/world-news/iran-us-war-benjamin-netanyahu-donald-trump-pakistan-high-above-skies-of-islamabad-a-call-was-made-to-netanyahu-what-was-said-11351724,2026-04-13T13:56:28+00:00
NDTV,14,"Pak Peace Talks Flop, Iran Jabs Trump, US With Ghost Of Obama Nuke Deal",https://www.ndtv.com/world-news/us-iran-war-us-iran-ceasefire-peace-talks-pakistan-islamabad-nuclear-deal-jcpoa-11351215,2026-04-13T13:56:28+00:00
NDTV,15,'Zero-Tolerance': TCS Suspends Nashik Employees Accused Of Harassment,https://www.ndtv.com/india-news/tcs-tata-consultancy-services-zero-tolerance-tcs-suspends-nashik-employees-accused-of-harassment-11350611,2026-04-13T13:56:28+00:00
NDTV,16,"While US-Iran Talked Peace In Pak, A Netanyahu Phone Call Changed Everything",https://www.ndtv.com/world-news/while-us-iran-talked-peace-in-pak-a-netanyahu-phone-call-changed-everything-11347738,2026-04-13T13:56:28+00:00
NDTV,17,US-Iran-Israel War LIVE: US To Begin Blockade Of All Iran Ports In Hormuz Today,https://www.ndtv.com/world-news/us-iran-israel-war-live-updates-us-blockade-iranian-ships-in-strait-of-hormuz-us-iran-failed-peace-talks-ghalibaf-jd-vance-trump-iran-war-israel-11348832,2026-04-13T13:56:28+00:00
NDTV,18,No Supreme Court Relief For Bengal Voters Deleted In SIR Process,https://www.ndtv.com/india-news/sir-hearing-in-supreme-court-west-bengal-elections-no-supreme-court-relief-for-bengal-voters-deleted-in-sir-process-11351035,2026-04-13T13:56:28+00:00
NDTV,19,"US-Iran Talks Failed ""Inches Away"" From Deal In Islamabad. Tehran Tells Why",https://www.ndtv.com/world-news/us-iran-talks-failed-inches-away-from-deal-in-islamabad-tehran-tells-why-11349024,2026-04-13T13:56:28+00:00
NDTV,20,"Trump Casts God As 'Co-Commander' In Iran War, Pope Says 'No'",https://www.ndtv.com/world-news/us-iran-war-president-donald-trump-vs-pope-leo-catholic-church-god-does-not-bless-holy-war-blood-on-hands-11350288,2026-04-13T13:56:28+00:00
NDTV,21,Islamic NATO Or Europe - Is Gulf Rethinking Its Options After Trump's 'Betrayal'?,https://www.ndtv.com/opinion/us-israel-iran-war-islamic-nato-or-europe-partnership-is-gulf-rethinking-its-options-11350872,2026-04-13T13:56:28+00:00
NDTV,22,"8-Hour Shifts, Rs 20,000 A Month: What Workers Protesting In Noida Want",https://www.ndtv.com/india-news/noida-protest-noida-workers-protest-we-cant-make-ends-meet-why-noida-workers-are-protesting-for-better-pay-11350198,2026-04-13T13:56:28+00:00
NDTV,23,US Man Dies After AI 'Wife' Urges Him To Join 'Her' In Digital World,https://www.ndtv.com/feature/us-man-dies-by-suicide-after-believing-ai-wife-asked-him-to-join-her-in-digital-world-im-ready-my-love-11349997,2026-04-13T13:56:28+00:00
NDTV,24,Viral Video: Mohammed Siraj Consoles Zanai Bhosle At Asha Bhosle's Funeral,https://www.ndtv.com/entertainment/viral-video-mohammed-siraj-consoles-zanai-bhosle-at-asha-bhosles-funeral-11351031,2026-04-13T13:56:28+00:00
NDTV,25,"'Give $1 Billion, Most Beautiful Woman As Wife': Uganda Army Chief To Turkey",https://www.ndtv.com/world-news/give-1-billion-most-beautiful-woman-as-wife-uganda-army-chief-to-turkey-11346435,2026-04-13T13:56:28+00:00
NDTV,26,Why World's Most Powerful Man Has Failed To Stop Netanyahu From Razing Lebanon,https://www.ndtv.com/opinion/us-israel-iran-war-why-netanyahu-may-be-both-the-happiest-and-the-most-scared-man-right-now-11350251,2026-04-13T13:56:28+00:00
NDTV,27,"Trump Threatens China With 50% Tariffs, Then A US, Venezuela Crude Offer",https://www.ndtv.com/world-news/us-iran-talks-middle-east-conflict-donald-trump-threatens-china-with-50-tariffs-then-a-us-venezuela-crude-offer-11350000,2026-04-13T13:56:28+00:00
NDTV,28,Indian-Origin Techie Drowns In US Waterfall During 26th Birthday Celebration,https://www.ndtv.com/world-news/indian-origin-techie-singireddy-sai-sriharikrishna-drowns-in-us-waterfall-during-26th-birthday-celebration-11349339,2026-04-13T13:56:28+00:00
NDTV,29,Katy Perry And Boyfriend Justin Trudeau's PDA-Filled Coachella Photos Go Viral,https://www.ndtv.com/entertainment/katy-perry-and-boyfriend-justin-trudeaus-pda-filled-coachella-photos-go-viral-11350257,2026-04-13T13:56:28+00:00
NDTV,30,"Gujarat Leader, Who Filed Poll Papers For 3 Parties, Chooses BJP Now",https://www.ndtv.com/india-news/gujarat-leader-bharat-singh-vakhala-who-filed-poll-papers-for-3-parties-chooses-bjp-now-11350735,2026-04-13T13:56:28+00:00
NDTV,31,"Family Of 8 Spends Rs 49 Lakh On Flight, KLM Denies Boarding At Bengaluru Airport",https://www.ndtv.com/travel/family-of-8-spends-rs-49-lakh-on-flights-klm-denies-boarding-at-bengaluru-airport-11351013,2026-04-13T13:56:28+00:00
NDTV,32,Latest News Today,https://www.ndtv.com/latest,2026-04-13T13:56:28+00:00
NDTV,33,Education News India,https://www.ndtv.com/education,2026-04-13T13:56:28+00:00
NDTV,34,Latest Business News,https://www.ndtv.com/business-news,2026-04-13T13:56:28+00:00
NDTV,35,Asha Bhosle Death News LIVE Updates,https://www.ndtv.com/entertainment/asha-bhosle-death-funeral-mumbai-live-updates-11346026,2026-04-13T13:56:28+00:00
NDTV,36,Noida Protest LIVE Update,https://www.ndtv.com/india-news/noida-factory-workers-protest-live-updates-workers-protest-over-wage-hike-turns-violent-in-noida-11349472,2026-04-13T13:56:28+00:00
NDTV,37,"CBSE Class 10, 12 Result",https://www.ndtv.com/education/cbse-10th-12th-results-2026-date-and-time-live-updates-class-10-result-in-april-official-websites-direct-download-link-here-11349008,2026-04-13T13:56:28+00:00
NDTV,38,Share Market Today,https://www.ndtv.com/india-news/stock-market-sensex-share-market-nifty-live-updates-today-13-april-us-iran-israel-war-oil-prices-donald-trump-11348859,2026-04-13T13:56:28+00:00
