source,rank,headline,link,collected_at_iso
Indian Express,1,Trending in India,https://indianexpress.com/section/trending/trending-in-india/,2026-04-03T05:44:33+00:00
Indian Express,2,This is Serious,https://indianexpress.com/section/trending/this-is-serious/,2026-04-03T05:44:33+00:00
Indian Express,3,Messi Ronaldo LEGO ad,https://indianexpress.com/article/trending/trending-globally/lionel-messi-cristiano-ronaldo-lego-ad-fifa-world-cup-2026-viral-video-10616682/,2026-04-03T05:44:33+00:00
Indian Express,4,Top 10 fastest-growing economies in the world in 2026,https://indianexpress.com/article/trending/top-10-listing/top-10-fastest-growing-economies-in-the-world-in-2026-10615680/,2026-04-03T05:44:33+00:00
Indian Express,5,Anand Mahindra coconut harvester Kerala video,https://indianexpress.com/article/trending/trending-in-india/anand-mahindra-viral-video-kerala-coconut-harvester-hello-nariyal-chhattisgarh-worker-10615651/,2026-04-03T05:44:33+00:00
Indian Express,6,Mount Everest insurance scam,https://indianexpress.com/article/trending/trending-globally/mount-everest-insurance-scam-20-million-helicopter-rescue-fraud-10615382/,2026-04-03T05:44:33+00:00
Indian Express,7,"Oracle employee’s calm layoff reaction goes viral amid 30,000 job cuts: ‘Its Oracle’s loss’",https://indianexpress.com/article/trending/trending-globally/oracle-layoffs-viral-linkedin-post-employee-reaction-10615091/,2026-04-03T05:44:33+00:00
Indian Express,8,war lockdown notice viral,https://indianexpress.com/article/trending/trending-in-india/war-lockdown-notice-viral-fake-india-lockdown-rumours-april-fool-prank-10614896/,2026-04-03T05:44:33+00:00
Indian Express,9,Top 10 countries with the highest water quality,https://indianexpress.com/article/trending/top-10-listing/top-10-countries-with-the-highest-water-quality-see-where-india-ranks-10613903/,2026-04-03T05:44:33+00:00
Indian Express,10,CBSE history paper QR code Orry,https://indianexpress.com/article/trending/trending-in-india/cbse-class-12-history-paper-qr-code-orry-viral-video-10613853/,2026-04-03T05:44:33+00:00
Indian Express,11,China dog kindergarten school cost,https://indianexpress.com/article/trending/trending-globally/china-woman-spends-1-6-lakh-monthly-on-pet-dog-school-kindergarten-10613580/,2026-04-03T05:44:33+00:00
Indian Express,12,"Yo Yo Honey Singh made a grand entry at his Mumbai concert in a Rolls-Royce Ghost, leaving fans stunned",https://indianexpress.com/article/trending/trending-in-india/yo-yo-honey-singh-mumbai-concert-rolls-royce-entry-10613254/,2026-04-03T05:44:33+00:00
Indian Express,13,Vande Bharat food complaint,https://indianexpress.com/article/trending/trending-in-india/vande-bharat-passenger-allergic-reaction-irctc-food-complaint-swollen-face-10613238/,2026-04-03T05:44:33+00:00
Indian Express,14,Oracle layoffs 2026,https://indianexpress.com/article/trending/trending-globally/oracle-layoffs-2026-ai-shift-sharat-chander-java-head-fired-10613068/,2026-04-03T05:44:33+00:00
Indian Express,15,Kerala Tourism and brands react humorously to the missing 4 lakh KitKat bars,https://indianexpress.com/article/trending/trending-in-india/kitkat-truck-theft-europe-kerala-tourism-viral-trend-10612931/,2026-04-03T05:44:33+00:00
Indian Express,16,Kevin Pietersen Mumbai air quality,https://indianexpress.com/article/trending/trending-globally/kevin-pietersen-mumbai-air-quality-aqi-tweet-controversy-ipl-2026-10611887/,2026-04-03T05:44:33+00:00
Indian Express,17,amy arora bengaluru budget,https://indianexpress.com/article/trending/trending-in-india/bengaluru-intern-amy-arora-viral-18000-monthly-budget-breakdown-sde-pg-life-10611810/,2026-04-03T05:44:33+00:00
Indian Express,18,Pune professor Mehbooba Mehbooba viral video,https://indianexpress.com/article/trending/trending-in-india/pune-professor-viral-video-singing-mehbooba-mehbooba-sri-balaji-university-10611549/,2026-04-03T05:44:33+00:00
Indian Express,19,Bihar engineer viral post,https://indianexpress.com/article/trending/trending-in-india/bihar-software-engineer-ananya-shaswat-intel-job-28-lpa-mother-viral-post-10611258/,2026-04-03T05:44:33+00:00
Indian Express,20,Bengaluru vs Delhi Metro,https://indianexpress.com/article/trending/trending-in-india/delhi-metro-vs-bengaluru-namma-metro-viral-x-post-civic-sense-connectivity-debate-10610961/,2026-04-03T05:44:33+00:00
Indian Express,21,"For a few seconds, the couple and those around them scrambled to find the missing ring",https://indianexpress.com/article/trending/trending-in-india/mumbai-indians-fan-heartfelt-proposal-nearly-ends-in-disaster-as-ring-disappears-in-stand-10610869/,2026-04-03T05:44:33+00:00
Indian Express,22,Brand Finance Top 10 Most Valuable Telecom Brands In The World 2026,https://indianexpress.com/article/trending/top-10-listing/brand-finance-most-valuable-telecom-brands-globally-2026-10610717/,2026-04-03T05:44:33+00:00
Indian Express,23,KitKat bars stolen in Europe have triggered widespread attention after Domino’s UK posted a viral response announcing a KitKat pizza,https://indianexpress.com/article/trending/trending-globally/kitkat-bars-stolen-europe-dominos-uk-viral-post-10610775/,2026-04-03T05:44:33+00:00
Indian Express,24,"In the viral photos, the model can be seen painted pink and posing on the elephant, which had been coloured the same hue",https://indianexpress.com/article/trending/trending-in-india/russian-artist-paints-elephant-pink-for-photoshoot-in-jaipur-sparks-outrage-10609761/,2026-04-03T05:44:33+00:00
Indian Express,25,"Sweeney's apology prompted a wave of reactions, with several users slamming him for his decision",https://indianexpress.com/article/trending/trending-globally/epic-games-layoffs-tim-sweeney-apology-cancer-employee-insurance-10609724/,2026-04-03T05:44:33+00:00
Indian Express,26,"Sharing the details of the incident, the CEO said he decided to get a rabies shot, despite the pet dog being vaccinated for the virus",https://indianexpress.com/article/trending/trending-in-india/india-vs-us-healthcare-ceo-gets-rabies-shot-in-10-minutes-post-goes-viral-10609617/,2026-04-03T05:44:33+00:00
Indian Express,27,Anand Mahindra shared a video of Bittu cleaning the polluted river,https://indianexpress.com/article/trending/trending-in-india/bittu-tabahi-river-cleaning-anand-mahindra-viral-video-10609189/,2026-04-03T05:44:33+00:00
LiveMint,1,What’s wrong with Tiger Woods? ‘Heartbreaking’ video leaves fans worried,https://www.livemint.com/us/trending/whats-wrong-with-tiger-woods-heartbreaking-video-after-dui-arrest-leaves-fans-worried-mental-health-is-real-11775191311157.html,2026-04-03T05:44:33+00:00
LiveMint,2,McDonald's drops new under $3 menu and $4 breakfast deal — Here’s what you get,https://www.livemint.com/us/trending/mcdonalds-drops-new-under-3-menu-and-4-breakfast-deal-here-s-what-you-can-get-11775157327207.html,2026-04-03T05:44:33+00:00
LiveMint,3,Rapper J. Cole joins China’s Nanjing Monkey Kings for pro basketball stint,https://www.livemint.com/us/trending/grammywinning-rapper-j-cole-joins-china-s-nanjing-monkey-kings-for-pro-basketball-stint-11775141367888.html,2026-04-03T05:44:33+00:00
LiveMint,4,April Fools’ Day 2026 deals: No-joke discounts from Dunkin' and more,https://www.livemint.com/us/trending/april-fools-day-2026-discounts-dunkin-checkers-rally-hooters-qdoba-artemis-ii-doughnut-11775054510320.html,2026-04-03T05:44:33+00:00
LiveMint,5,"Oracle employee, despite being laid off, remains positive: ‘It happens…'",https://www.livemint.com/us/trending/oracle-employee-despite-being-laid-off-remains-positive-it-happens-will-enjoy-sleeping-11775051244639.html,2026-04-03T05:44:33+00:00
LiveMint,6,Warren Buffett teams up with NBA star Stephen Curry for charity lunch auction,https://www.livemint.com/us/trending/warren-buffett-teams-up-with-nba-star-stephen-curry-for-charity-lunch-auction-berkshire-event-returns-in-2026-11774962320767.html,2026-04-03T05:44:33+00:00
LiveMint,7,Tiger Woods’ ex Kristin Smith breaks silence after ‘triggering’ DUI arrest,https://www.livemint.com/us/trending/tiger-woods-ex-kristin-smith-breaks-silence-after-triggering-dui-arrest-seeks-privacy-11774949316320.html,2026-04-03T05:44:33+00:00
LiveMint,8,"Sophie Turner injured, Tomb Raider series halts production temporarily",https://www.livemint.com/us/trending/sophie-turner-injured-tomb-raider-series-halts-production-temporarily-11774878671976.html,2026-04-03T05:44:33+00:00
LiveMint,9,Viral video of Kash Patel dancing? Here’s the truth behind the clip,https://www.livemint.com/us/trending/viral-video-of-kash-patel-dancing-here-s-the-truth-behind-the-clip-11774814955782.html,2026-04-03T05:44:33+00:00
LiveMint,10,"Arnold Schwarzenegger returns to gym—But this time, he’s coaching his son |Watch",https://www.livemint.com/us/trending/arnold-schwarzenegger-returns-to-gym-but-this-time-he-s-coaching-his-son-to-bodybuilding-glory-watch-11774816425352.html,2026-04-03T05:44:33+00:00
LiveMint,11,"Bachelorette star James McCoy Taylor arrested again, months after guilty plea",https://www.livemint.com/us/trending/bachelorette-star-james-mccoy-taylor-arrested-again-months-after-guilty-plea-11774189913536.html,2026-04-03T05:44:33+00:00
LiveMint,12,Comedian jokes about Jews’ expulsion: Social media reacts to viral video,https://www.livemint.com/us/trending/comedian-jokes-about-jews-expulsion-social-media-reacts-to-viral-video-using-antisemitic-talking-points-as-humor-11773998180773.html,2026-04-03T05:44:33+00:00
LiveMint,13,Who is Joseph Duggar? All about reality TV star arrested on abuse charges,https://www.livemint.com/us/trending/who-is-joseph-duggar-all-about-the-19-kids-and-counting-star-arrested-on-abuse-charges-11773894381944.html,2026-04-03T05:44:33+00:00
LiveMint,14,"St Patrick’s Day 2026: Date, history, meaning and traditions worldwide",https://www.livemint.com/us/trending/st-patrick-s-day-2026-date-history-meaning-and-traditions-worldwide-11773760629096.html,2026-04-03T05:44:33+00:00
LiveMint,15,Oscars 2026: What’s on the menu at official after-party for Hollywood A-listers?,https://www.livemint.com/us/trending/oscars-2026-what-s-on-the-menu-at-the-official-after-party-luxurious-food-desserts-and-drinks-for-hollywood-alisters-11773548247036.html,2026-04-03T05:44:33+00:00
LiveMint,16,"Meghan Markle: Harry’s wife faces backlash over $2,235 ticket for group photo",https://www.livemint.com/us/trending/meghan-markle-harry-s-wife-faces-backlash-over-2-235-vip-ticket-for-group-photo-she-s-a-nobody-who-tricked-a-prince-11773538916724.html,2026-04-03T05:44:33+00:00
LiveMint,17,Apple kicks off 50th anniversary with surprise performance by Alicia Keys in NY,https://www.livemint.com/us/trending/alicia-keys-turns-apples-grand-central-in-new-york-into-a-concert-venue-at-tech-giant-s-50th-anniversary-kickoff-11773508129097.html,2026-04-03T05:44:33+00:00
LiveMint,18,"Marco Rubio large shoe size stuns Internet, social media points to ‘sycophancy'",https://www.livemint.com/us/trending/marco-rubio-large-shoe-size-stuns-internet-social-media-points-to-sycophancy-idol-worship-among-trump-officials-11773470692943.html,2026-04-03T05:44:33+00:00
LiveMint,19,Was Bill Clinton about to push Hillary into running traffic? Watch viral video,https://www.livemint.com/us/trending/did-bill-clinton-almost-push-hillary-into-running-traffic-social-media-reacts-to-viral-video-hes-was-so-close-11773280988605.html,2026-04-03T05:44:33+00:00
LiveMint,20,"Dr Dre net worth: Inside his earnings, brands, cars and real estate",https://www.livemint.com/us/trending/dr-dre-net-worth-how-did-the-new-billionaire-make-his-fortune-inside-his-earnings-cars-mansions-and-brands-11773167989493.html,2026-04-03T05:44:33+00:00
LiveMint,21,Nike launches Air Jordan 4 Retro ‘Imperial Purple’ sneakers: Details,https://www.livemint.com/us/trending/nike-launches-air-jordan-4-retro-imperial-purple-sneakers-how-much-do-they-cost-where-to-buy-online-11772907741201.html,2026-04-03T05:44:33+00:00
LiveMint,22,Quote of the day by Robert T Kiyosaki on success: ‘Winners are not afraid of….',https://www.livemint.com/us/trending/quote-of-the-day-by-robert-t-kiyosaki-on-success-winners-are-not-afraid-of-losing-but-11772854894148.html,2026-04-03T05:44:33+00:00
LiveMint,23,Bodybuilder Jeff Nippard’s fiancé Stephanie Buttermore dies at 36,https://www.livemint.com/us/trending/bodybuilder-jeff-nippard-s-fianc-stephanie-buttermore-dies-at-36-a-look-at-the-late-fitness-stars-net-worth-11772860396173.html,2026-04-03T05:44:33+00:00
LiveMint,24,Toddler triggers airport alarms chasing a toy; what happened next surprised all,https://www.livemint.com/us/trending/toddler-triggers-airport-alarms-chasing-a-toy-what-happened-next-surprised-everyone-11772786934708.html,2026-04-03T05:44:33+00:00
LiveMint,25,Quote of the day by Abraham Lincoln: ‘We the people are rightful masters of…’,https://www.livemint.com/us/trending/quote-of-the-day-by-abraham-lincoln-we-the-people-are-rightful-masters-of-11772622098976.html,2026-04-03T05:44:33+00:00
LiveMint,26,Can AI really do your taxes? Elon Musk sparks massive online debate,https://www.livemint.com/us/trending/can-grok-help-you-cut-your-taxes-elon-musk-says-11772572363426.html,2026-04-03T05:44:33+00:00
LiveMint,27,Instagram to notify parents if teens repeatedly search for suicide or self-harm,https://www.livemint.com/us/trending/instagram-will-alert-parents-over-repeated-suicide-related-searches-by-teen-users-amid-global-push-for-sm-regulations-11772110629794.html,2026-04-03T05:44:33+00:00
LiveMint,28,‘Done with New Jersey’: US-based engineer’s rant goes viral,https://www.livemint.com/us/trending/done-with-new-jersey-us-based-engineer-gets-frustrated-over-property-tax-heavy-snow-ice-rant-goes-viral-11771923467675.html,2026-04-03T05:44:33+00:00
LiveMint,29,Last Week Tonight: John Oliver uses Nikhil Kamath podcast to mock Elon Musk,https://www.livemint.com/us/trending/watch-john-oliver-uses-nikhil-kamaths-podcast-to-mock-elon-musk-on-last-week-tonight-buffering-like-aol-in-1999-11771911124869.html,2026-04-03T05:44:33+00:00
LiveMint,30,"Trump's latest tariffs: Netizens rake up Epstein, jobs, and Iran",https://www.livemint.com/us/trending/trumps-latest-tariffs-netizens-rake-up-epstein-jobs-and-iran-as-white-house-says-keep-calm-and-tariff-on-11771643415503.html,2026-04-03T05:44:33+00:00
LiveMint,31,NRI influencer’s post on returning to India ignites family responsibility debate,https://www.livemint.com/us/trending/moving-back-to-india-from-the-us-to-raise-kids-or-care-for-parents-influencer-sparks-debate-11771617446170.html,2026-04-03T05:44:33+00:00
LiveMint,32,"Netizens in meme frenzy as Trump announces release of files on aliens, UFOs",https://www.livemint.com/us/trending/netizens-in-meme-frenzy-as-trump-announces-release-of-files-on-aliens-ufos-epstein-files-11771556439611.html,2026-04-03T05:44:33+00:00
LiveMint,33,"‘Satanic ritual’? Viral video shows blindfolded, shirtless men",https://www.livemint.com/us/trending/viral-video-iowa-university-blindfolded-shirtless-young-men-social-media-hazing-ritual-11771502449739.html,2026-04-03T05:44:33+00:00
LiveMint,34,When is Mardi Gras 2026? Why is it celebrated? What is Fat Tuesday?,https://www.livemint.com/us/trending/when-is-mardi-gras-2026-why-is-it-celebrated-what-is-fat-tuesday-also-the-rare-overlap-of-len-and-ramadan-this-year-11771340190144.html,2026-04-03T05:44:33+00:00
LiveMint,35,Stephen Colbert to release James Talarico’s interview after CBS’ refusal,https://www.livemint.com/us/trending/stephen-colbert-to-release-james-talarico-s-interview-on-youtube-as-cbs-refuses-to-air-it-for-financial-reasons-11771322377565.html,2026-04-03T05:44:33+00:00
LiveMint,36,Manchester Orchestra drummer Tim Very dies at 42: Rock band mourns loss,https://www.livemint.com/us/trending/manchester-orchestra-drummer-dies-at-42-rock-band-mourns-loss-tim-very-held-together-the-entire-mo-universe-11771126673065.html,2026-04-03T05:44:33+00:00
LiveMint,37,Quote of the Day | Valentine’s Day: Taylor Swift on love and perfection,https://www.livemint.com/us/trending/quote-of-the-day-valentine-s-day-special-taylor-swift-on-why-love-isn-t-meant-to-be-perfect-11770975532058.html,2026-04-03T05:44:33+00:00
LiveMint,38,Cardi B slams DHS over ‘drugs’ remark after criticizing ICE,https://www.livemint.com/us/trending/lets-talk-about-epstein-cardi-b-slams-dhs-over-drugs-remark-after-criticizing-ice-during-little-miss-drama-tour-11770943241509.html,2026-04-03T05:44:33+00:00
LiveMint,39,Quote of the day from Abraham Lincoln: ‘The ballot is stronger than the bullet’,https://www.livemint.com/us/trending/quote-of-the-day-from-abraham-lincoln-the-ballot-is-stronger-than-the-bullet-bangladesh-elections-polls-result-11770894713401.html,2026-04-03T05:44:33+00:00
LiveMint,40,Mark to Market,https://www.livemint.com/market/mark-to-market,2026-04-03T05:44:33+00:00
LiveMint,41,Sun Pharma share price in focus on Monday after Trump's tariff announcement,https://www.livemint.com/market/stock-market-news/sun-pharma-share-price-in-focus-on-monday-after-trumps-tariff-announcement-11775193814841.html,2026-04-03T05:44:33+00:00
LiveMint,42,Global brokerages slash Nifty 50 targets: Is a deeper correction likely?,https://www.livemint.com/market/stock-market-news/global-brokerages-goldman-sachs-nomura-slash-nifty-50-target-is-a-deeper-stock-market-crash-coming-11775190282887.html,2026-04-03T05:44:33+00:00
LiveMint,43,"Rajesh Palviya of Axis Sec suggests Voltamp Transformers, Shilpa Medicare, Persistent Systems shares to buy on April 6",https://www.livemint.com/market/stock-market-news/rajesh-palviya-of-axis-sec-suggests-voltamp-transformers-shilpa-medicare-persistent-systems-shares-to-buy-on-april-6-11775189087677.html,2026-04-03T05:44:33+00:00
LiveMint,44,Tata Motors PV share price in focus on Monday after JLR sales rebound in Q4 as production normalises,https://www.livemint.com/market/stock-market-news/tata-motors-pv-share-price-in-focus-on-monday-after-jlr-sales-rebound-in-q4-as-production-normalises-11775189179801.html,2026-04-03T05:44:33+00:00
LiveMint,45,"‘April could be gold’s best month since 1980,’ says Peter Schiff —next target may be $6,000",https://www.livemint.com/market/commodities/gold-price-prediction-april-may-be-gold-s-best-month-since-1980-peter-schiff-next-gold-price-target-may-be-6000-11775187211498.html,2026-04-03T05:44:33+00:00
LiveMint,46,"SBI Trustee releases pledged HDFC Bank, ICICI Bank shares linked to Sky Gold. Details here",https://www.livemint.com/market/stock-market-news/sbi-trustee-releases-pledged-hdfc-bank-icici-bank-shares-linked-to-sky-gold-details-here-11775126607562.html,2026-04-03T05:44:33+00:00
LiveMint,47,UN Security Council postpones vote on Strait of Hormuz; here's what happened,https://www.livemint.com/news/world/un-security-council-postponed-vote-on-strait-of-hormuz-heres-what-happened-11775189391091.html,2026-04-03T05:44:33+00:00
LiveMint,48,"Tejas Mk-1A engine delivery delay: HAL imposes penalty on GE Aerospace, chairman says jets to return to skies next week",https://www.livemint.com/news/india/tejas-mk-1a-engine-delivery-delay-hal-imposes-delay-on-ge-aerospace-chairman-says-jets-to-return-to-skies-next-week-11775186262696.html,2026-04-03T05:44:33+00:00
LiveMint,49,"PM Modi extends Good Friday greetings — ‘May this day deepen values of harmony, compassion, forgiveness’",https://www.livemint.com/news/india/pm-modi-extends-good-friday-greetings-may-this-day-deepen-values-of-harmony-compassion-forgiveness-11775187550809.html,2026-04-03T05:44:33+00:00
LiveMint,50,"US-Iran war: Trump threatens escalation amid reported talks — ‘bridges next, then electric powerplants’",https://www.livemint.com/news/us-news/usiran-war-trump-threatens-escalation-amid-reported-talks-bridges-next-then-electric-powerplants-11775185029124.html,2026-04-03T05:44:33+00:00
LiveMint,51,"Good Friday 2026: Schools, banks, offices, stock markets — What's open, what's closed?",https://www.livemint.com/news/india/good-friday-2026-schools-banks-offices-stock-markets-whats-open-whats-closed-11775182155100.html,2026-04-03T05:44:33+00:00
LiveMint,52,‘Only country to have lost mariners’: India flags human cost at high-level meet on Strait of Hormuz crisis amid Iran war,https://www.livemint.com/news/world/only-country-to-have-lost-mariners-india-flags-human-cost-at-high-level-meet-on-strait-of-hormuz-crisis-amid-iran-war-11775183590975.html,2026-04-03T05:44:33+00:00
LiveMint,53,"Microsoft plans $10 billion investment in Japan to grow AI, train 1 million workers by 2030",https://www.livemint.com/companies/news/microsoft-plans-10-billion-investment-in-japan-to-grow-ai-train-1-million-workers-by-2030-11775190635744.html,2026-04-03T05:44:33+00:00
LiveMint,54,Who is Sharon Pais? Flipkart executive likely to take over as Myntra CEO after Nandita Sinha exits,https://www.livemint.com/companies/news/who-is-sharon-pais-flipkart-executive-likely-to-take-over-as-myntra-ceo-after-nandita-sinha-exits-11775187528317.html,2026-04-03T05:44:33+00:00
LiveMint,55,OpenAI expands into media with TBPN acquisition — read Fidji Simo's full message to team,https://www.livemint.com/companies/news/sam-altmans-openai-buys-tech-news-talk-show-tbpn-agi-deployment-ceo-fidji-simo-full-memo-to-employees-11775190315066.html,2026-04-03T05:44:33+00:00
LiveMint,56,Faith tech firms chase growth in $35 billion market with product push,https://www.livemint.com/companies/faith-tech-firms-chase-growth-in-35-billion-market-with-product-push-vama-astrotalk-faith-religious-products-11775110778352.html,2026-04-03T05:44:33+00:00
LiveMint,57,The-US Iran war opens a rare sweet spot for India’s space startups,https://www.livemint.com/companies/start-ups/india-space-startups-capitalize-global-satellite-surveillance-demand-11775116568538.html,2026-04-03T05:44:33+00:00
LiveMint,58,"Exodus, revenue strain cloud Birlasoft CEO's Angan Guha’s turnaround plan",https://www.livemint.com/companies/news/exodus-revenue-strain-cloud-birlasoft-ceos-angan-guha-s-turnaround-plan-11775129269554.html,2026-04-03T05:44:33+00:00
LiveMint,59,Ask Mint Money,https://www.livemint.com/money/ask-mint-money,2026-04-03T05:44:33+00:00
LiveMint,60,"West Asia war poses no recession risk for India, but economic slowdown is on the cards: Madan Sabnavis",https://www.livemint.com/money/west-asia-war-india-recession-risk-economic-slowdown-madan-sabnavis-household-budgets-job-market-inflation-interest-rate-11775105443794.html,2026-04-03T05:44:33+00:00
LiveMint,61,₹13 crore digital arrest scam: Ex-Delhi judge says awareness is your strongest defence— 6 ways to protect yourself,https://www.livemint.com/money/personal-finance/13-crore-digital-arrest-scam-ex-delhi-judge-says-awareness-is-your-strongest-defence-6-ways-to-protect-yourself-11775142798863.html,2026-04-03T05:44:33+00:00
LiveMint,62,Income tax portal revamp: 7 key links every taxpayer must check now,https://www.livemint.com/money/personal-finance/income-tax-portal-revamp-7-key-links-every-taxpayer-must-check-now-11775126421850.html,2026-04-03T05:44:33+00:00
LiveMint,63,PAN card application rules changed from 1 April: List of documents you must submit now,https://www.livemint.com/money/personal-finance/pan-card-application-rules-changed-from-1-april-list-of-documents-you-must-submit-now-11775124363100.html,2026-04-03T05:44:33+00:00
LiveMint,64,Did you know EPF once offered 12%? A look back at historical returns as govt clarifies on interest rate hike demand,https://www.livemint.com/money/personal-finance/did-you-know-epf-once-offered-12-a-look-back-at-historical-returns-as-govt-clarifies-on-interest-rate-hike-demand-11775117321210.html,2026-04-03T05:44:33+00:00
LiveMint,65,Big change in gratuity rules: Eligibility cut to 1 year of service from 5 years — but there’s a catch,https://www.livemint.com/money/personal-finance/big-change-in-gratuity-rules-eligibility-cut-to-1-year-of-service-from-5-years-but-there-s-a-catch-11775120105154.html,2026-04-03T05:44:33+00:00
LiveMint,66,Trump administration appeals ruling that blocked Pentagon action against Anthropic over AI dispute,https://www.livemint.com/technology/trump-administration-appeals-ruling-that-blocked-pentagon-action-against-anthropic-over-ai-dispute-11775148233145.html,2026-04-03T05:44:33+00:00
LiveMint,67,Is X down? Thousands of users report issues with news feed in US: What we know,https://www.livemint.com/technology/is-x-down-hundreds-of-users-report-issues-with-news-feed-in-us-what-we-know-11775119112120.html,2026-04-03T05:44:33+00:00
LiveMint,68,"Realme 16 with iPhone Air like camera module and 7,000mAh battery launched in India, price starts at ₹31,999",https://www.livemint.com/technology/gadgets/realme-16-with-iphone-air-like-camera-module-and-7-000mah-battery-launched-in-india-price-starts-at-rs-31999-11775115281470.html,2026-04-03T05:44:33+00:00
LiveMint,69,"Vivo V70 FE with 200MP camera and 7,000mAh battery launched in India, price starts at ₹37,999",https://www.livemint.com/technology/gadgets/vivo-v70-fe-with-200mp-camera-and-7-000mah-battery-launched-in-india-price-starts-at-rs-40999-11775114083114.html,2026-04-03T05:44:33+00:00
LiveMint,70,What is OpenAI’s ‘Spud’? Greg Brockman teases new ChatGPT model built on years of research,https://www.livemint.com/technology/tech-news/what-is-openai-s-spud-greg-brockman-teases-new-chatgpt-model-build-on-years-of-research-11775105908398.html,2026-04-03T05:44:33+00:00
LiveMint,71,"Redmi Note 15 SE 5G with 6.77-inch AMOLED display and 5,800 mAH battery launched in India, price starts at…",https://www.livemint.com/technology/gadgets/redmi-note-15-se-5g-with-6-77-inch-amoled-display-and-5-800-mah-battery-launched-in-india-price-starts-at-11775112299774.html,2026-04-03T05:44:33+00:00
LiveMint,72,IPL 2026 Schedule,https://www.livemint.com/sports/cricket-news/ipl-schedule,2026-04-03T05:44:33+00:00
