source,rank,headline,link,collected_at_iso
LiveMint,75,IPL 2026 Points Table,https://www.livemint.com/sports/cricket-news/ipl-points-table,2026-04-03T02:54:19+00:00
LiveMint,76,IFSC Code Finder,https://www.livemint.com/ifsc-code,2026-04-03T02:54:19+00:00
LiveMint,77,Income Tax Calculator,https://www.livemint.com/tools-calculators/income-tax-calculator,2026-04-03T02:54:19+00:00
LiveMint,78,Gold Rate Today,https://www.livemint.com/gold-prices,2026-04-03T02:54:19+00:00
LiveMint,79,Gold Rate in Delhi,https://www.livemint.com/gold-prices/delhi,2026-04-03T02:54:19+00:00
LiveMint,80,Gold Rate Hyderabad,https://www.livemint.com/gold-prices/hyderabad,2026-04-03T02:54:19+00:00
LiveMint,81,Silver Rate Today,https://www.livemint.com/silver-prices,2026-04-03T02:54:19+00:00
LiveMint,82,Silver Rate in Delhi,https://www.livemint.com/silver-prices/delhi,2026-04-03T02:54:19+00:00
LiveMint,83,Silver Rate in Bangalore,https://www.livemint.com/silver-prices/bangalore,2026-04-03T02:54:19+00:00
LiveMint,84,US Stock Market,https://www.livemint.com/market/us-market,2026-04-03T02:54:19+00:00
LiveMint,85,Terms of Use,https://www.livemint.com/terms-of-use,2026-04-03T02:54:19+00:00
LiveMint,86,Code of ethics,https://www.livemint.com/code-of-ethics,2026-04-03T02:54:19+00:00
LiveMint,87,RBSE 12th Result 2026,https://www.livemint.com/education/rajasthan-rbse-board-result-updates/rbse-12th-result-2026-live-updates-rajasthan-board-class-12-result-march-31-rajresults-nic-in-scorecard-download-11774913893685.html,2026-04-03T02:54:19+00:00
LiveMint,88,MCX Gold Rate,https://www.livemint.com/market/market-stats/commodity-mcx-gold-price,2026-04-03T02:54:19+00:00
LiveMint,89,MCX Silver Price,https://www.livemint.com/market/market-stats/commodity-mcx-silver-price,2026-04-03T02:54:19+00:00
LiveMint,90,Gold Price in Mumbai,https://www.livemint.com/gold-prices/mumbai,2026-04-03T02:54:19+00:00
LiveMint,91,Gold Price in Chennai,https://www.livemint.com/gold-prices/chennai,2026-04-03T02:54:19+00:00
LiveMint,92,Gold Price in Kolkata,https://www.livemint.com/gold-prices/kolkata,2026-04-03T02:54:19+00:00
LiveMint,93,Silver Price in Mumbai,https://www.livemint.com/silver-prices/mumbai,2026-04-03T02:54:19+00:00
LiveMint,94,Silver Price in Chennai,https://www.livemint.com/silver-prices/chennai,2026-04-03T02:54:19+00:00
LiveMint,95,Silver Price in Hyderabad,https://www.livemint.com/silver-prices/hyderabad,2026-04-03T02:54:19+00:00
LiveMint,96,Silver Price in Kolkata,https://www.livemint.com/silver-prices/kolkata,2026-04-03T02:54:19+00:00
LiveMint,97,Latest News Today,https://www.livemint.com/news,2026-04-03T02:54:19+00:00
LiveMint,98,US News Today,https://www.livemint.com/news/us-news,2026-04-03T02:54:19+00:00
LiveMint,99,Top Company Leader,https://www.livemint.com/companies/people,2026-04-03T02:54:19+00:00
LiveMint,100,personal loan emi calculator,https://www.livemint.com/loans/personal-loan-emi-calculator,2026-04-03T02:54:19+00:00
LiveMint,101,Personal Loan Interest Rate,https://www.livemint.com/loans/personal-loan-interest-rates,2026-04-03T02:54:19+00:00
LiveMint,102,Personal Loan Eligibility,https://www.livemint.com/loans/personal-loan-eligibility,2026-04-03T02:54:19+00:00
LiveMint,103,Instant Personal Loan,https://www.livemint.com/loans/instant-personal-loan,2026-04-03T02:54:19+00:00
LiveMint,104,Home Loan EMI Calculator,https://www.livemint.com/tools-calculators/home-loan-emi-calculator,2026-04-03T02:54:19+00:00
LiveMint,105,Car Loan EMI,https://www.livemint.com/tools-calculators/car-loan-calculator,2026-04-03T02:54:19+00:00
India Today,1,"Laid off twice, woman restarts career at 39 after motherhood, finds success",https://www.indiatoday.in/trending-news/story/laid-off-twice-woman-restarts-career-at-39-after-motherhood-finds-success-2890838-2026-04-02,2026-04-03T02:54:19+00:00
India Today,2,US influencer's day trip to Taj Mahal from New York has internet worried about jet lag,https://www.indiatoday.in/trending-news/story/us-influencers-day-trip-to-taj-mahal-from-new-york-has-internet-worried-about-jet-lag-2890822-2026-04-02,2026-04-03T02:54:19+00:00
India Today,3,Bengaluru trip leads to foreigner's viral 'confession about India' video,https://www.indiatoday.in/trending-news/story/bengaluru-trip-leads-to-foreigner-viral-confession-about-india-video-2890820-2026-04-02,2026-04-03T02:54:19+00:00
India Today,4,Pune woman's Instamart scroll turns into a midnight impulse microwave buy,https://www.indiatoday.in/trending-news/story/pune-womans-instamart-scroll-turns-into-a-midnight-impulse-microwave-buy-2890753-2026-04-02,2026-04-03T02:54:19+00:00
India Today,5,Bride's pet dogs refuse to let her go during emotional vidaai,https://www.indiatoday.in/trending-news/story/brides-pet-dogs-refuse-to-let-her-go-during-emotional-vidaai-try-not-the-cry-2890770-2026-04-02,2026-04-03T02:54:19+00:00
India Today,6,Students break down in class as teacher announces her last day in emotional video,https://www.indiatoday.in/trending-news/story/students-break-down-in-class-as-teacher-announces-her-last-day-in-emotional-video-2890719-2026-04-02,2026-04-03T02:54:19+00:00
India Today,7,Mother refuses to take Rs 1 lakh glasses from son until he tells her this,https://www.indiatoday.in/trending-news/story/mother-refuses-to-take-rs-1-lakh-glasses-from-son-until-he-tells-her-this-2890669-2026-04-02,2026-04-03T02:54:19+00:00
India Today,8,"Indian man pays Rs 25,000 rent in Dubai for room that he can barely stand in",https://www.indiatoday.in/trending-news/story/indian-man-pays-rs-25000-rent-in-dubai-for-room-that-he-can-barely-stand-in-2890653-2026-04-02,2026-04-03T02:54:19+00:00
India Today,9,Delhi man's emotional story about flute seller will change how you view life,https://www.indiatoday.in/trending-news/story/delhi-mans-emotional-story-about-flute-seller-will-change-how-you-view-life-2890636-2026-04-02,2026-04-03T02:54:19+00:00
India Today,10,US woman finds out how son wins UNO every time,https://www.indiatoday.in/trending-news/story/us-woman-finds-out-how-son-wins-uno-every-time-heres-her-next-move-2890550-2026-04-02,2026-04-03T02:54:19+00:00
India Today,11,"UP women beat up man who broke into their home, internet cheers their bravery",https://www.indiatoday.in/trending-news/story/up-women-beat-up-man-who-broke-into-their-home-internet-cheers-their-bravery-2890561-2026-04-02,2026-04-03T02:54:19+00:00
India Today,12,"Like Uber, you can now 'book' a coconut harvester in Kerala. Anand Mahindra explains",https://www.indiatoday.in/trending-news/story/anand-mahindra-explains-like-uber-you-can-now-book-a-coconut-harvester-in-kerala-2890543-2026-04-02,2026-04-03T02:54:19+00:00
India Today,13,"Passengers dance, sing in train coach, disturb others; Railways reacts to video",https://www.indiatoday.in/trending-news/story/passengers-dance-sing-in-train-coach-disturb-others-railways-reacts-to-video-2890545-2026-04-02,2026-04-03T02:54:19+00:00
India Today,14,Crowd stops to watch two mice wrestle on roadside in Delhi,https://www.indiatoday.in/trending-news/story/crowd-stops-to-watch-two-mice-wrestle-on-roadside-in-delhi-popcorn-anyone-2890525-2026-04-02,2026-04-03T02:54:19+00:00
India Today,15,"Indore founder books father's first flight with window seat, he turns up in a suit",https://www.indiatoday.in/trending-news/story/indore-founder-books-fathers-first-flight-with-window-seat-he-turns-up-in-a-suit-2890536-2026-04-02,2026-04-03T02:54:19+00:00
India Today,16,Bengaluru man pays Rs 150 for 'gold-dusted fingers' at pub,https://www.indiatoday.in/trending-news/story/bengaluru-man-pays-rs-150-for-gold-dusted-fingers-at-pub-it-actually-is-2890488-2026-04-02,2026-04-03T02:54:19+00:00
India Today,17,Coconut seller's gentle gesture at IIT Madras brings out stories of her big heart,https://www.indiatoday.in/trending-news/story/coconut-sellers-gentle-gesture-with-deer-at-iit-madras-brings-out-stories-of-her-big-heart-2890287-2026-04-01,2026-04-03T02:54:19+00:00
India Today,18,"Daily wage worker celebrates children's success, shares sweets with entire village",https://www.indiatoday.in/trending-news/story/daily-wage-worker-celebrates-childrens-success-shares-sweets-with-entire-village-2890265-2026-04-01,2026-04-03T02:54:19+00:00
India Today,19,Mumbai's first woman BMC chief gets a shoutout from Anand Mahindra. See post,https://www.indiatoday.in/trending-news/story/mumbais-first-woman-bmc-chief-gets-a-shoutout-from-anand-mahindra-see-post-2890204-2026-04-01,2026-04-03T02:54:19+00:00
India Today,20,Crows rip out Rapuzel's hair mid-performance at Tokyo Disney park,https://www.indiatoday.in/trending-news/story/video-crows-rip-out-rapuzels-hair-mid-performance-at-tokyo-disney-park-2890174-2026-04-01,2026-04-03T02:54:19+00:00
India Today,21,SRH bowling not weak as you think: Nitish Reddy shuts critics after KKR win,https://www.indiatoday.in/sports/cricket/story/ipl-2026-kkr-vs-srh-nitish-kumar-reddy-bowling-unit-not-weak-eden-gardens-2890958-2026-04-03,2026-04-03T02:54:19+00:00
India Today,22,"Is Kash Patel, Tulsi Gabbard next in Trump's firing line?",https://www.indiatoday.in/world/story/kash-patel-tulsi-gabbard-trump-cabinet-reshuffle-iran-policy-pom-bondi-us-army-randy-george-trump-2890955-2026-04-03,2026-04-03T02:54:19+00:00
India Today,23,"India's tech hiring sees 2nd lowest start in 6 years, hiring down by 8% in April",https://www.indiatoday.in/jobs/story/indias-tech-hiring-april-2026-fy2027-begins-slow-as-active-tech-jobs-fall-by-8-educ-2890637-2026-04-03,2026-04-03T02:54:19+00:00
India Today,24,Remember these criminals: Iran names US officers behind deadly Minab school strike,https://www.indiatoday.in/world/story/iran-names-us-navy-officers-behind-minab-school-strike-middle-east-war-trump-2888627-2026-03-29,2026-04-03T02:54:19+00:00
India Today,25,Is Dhurandhar 2 propaganda or not? Wikipedia war so intense Jimmy Wales makes rare intervention,https://www.indiatoday.in/technology/news/story/is-dhurandhar-propaganda-or-not-wikipedia-war-so-intense-jimmy-wales-makes-rare-intervention-2887801-2026-03-27,2026-04-03T02:54:19+00:00
India Today,26,Is he Jasprit Bumrah's replacement? MI fans buzzing after ex-bowler spotted with squad,https://www.indiatoday.in/sports/cricket/story/mumbai-indians-akash-madhwal-training-ipl-2026-bumrah-workload-management-2888130-2026-03-27,2026-04-03T02:54:19+00:00
India Today,27,"Bibi sold it as easy: Vance questioned Netanyahu Iran war pitch, Axios reports",https://www.indiatoday.in/world/story/middle-east-war-vance-was-initially-sceptical-of-netanyahu-iran-war-pitch-says-report-2888160-2026-03-27,2026-04-03T02:54:19+00:00
India Today,28,Have to work from home: Nashik godman's victims's families upset as clips go viral,https://www.indiatoday.in/india/story/viral-videos-captain-ashok-kharat-distress-victims-families-authorities-act-2889300-2026-03-30,2026-04-03T02:54:19+00:00
TOI ETimes,1,Australian study finds heart cells can regenerate post-heart attack; India’s leading cardiologist calls it a ‘big step’,https://timesofindia.indiatimes.com/articleshow/127212793.cms,2026-04-03T02:54:19+00:00
TOI ETimes,2,Hold that bite: Doctor explains the post-workout mistake that could cost you your life,https://timesofindia.indiatimes.com/articleshow/127102424.cms,2026-04-03T02:54:19+00:00
TOI ETimes,3,When Anxiety Signals Brain Issues: Neurologist explains red flags,https://timesofindia.indiatimes.com/articleshow/127119929.cms,2026-04-03T02:54:19+00:00
TOI ETimes,4,Doctor's Advice On Common Traps: Dr Ankur Gahlot warns about hidden,https://timesofindia.indiatimes.com/articleshow/127111948.cms,2026-04-03T02:54:19+00:00
TOI ETimes,5,Knee care: Orthopaedic doctor approved tips that can delay joint replacement by 10 years,https://timesofindia.indiatimes.com/articleshow/127125728.cms,2026-04-03T02:54:19+00:00
TOI ETimes,6,Peace lily benefits: How this elegant plant cleans air and calms your mind,https://timesofindia.indiatimes.com/articleshow/127125253.cms,2026-04-03T02:54:19+00:00
TOI ETimes,7,"‘Dhurandhar: The Revenge’ inches close to Rs 1,500 cr in 15 days",https://timesofindia.indiatimes.com/articleshow/129991874.cms,2026-04-03T02:54:19+00:00
TOI ETimes,8,Sanjay Gupta REACTS to Ramayana makers' claims about VFX team,https://timesofindia.indiatimes.com/articleshow/129992418.cms,2026-04-03T02:54:19+00:00
TOI ETimes,9,Michael B. Jordan drops new film ‘Swapped’ trailer,https://timesofindia.indiatimes.com/articleshow/129992265.cms,2026-04-03T02:54:19+00:00
TOI ETimes,10,Hailee Steinfeld welcomes baby girl with husband Josh Allen,https://timesofindia.indiatimes.com/articleshow/129992156.cms,2026-04-03T02:54:19+00:00
TOI ETimes,11,R Madhavan secretly attends the 'Dhurandhar 2' screening,https://timesofindia.indiatimes.com/articleshow/129991853.cms,2026-04-03T02:54:19+00:00
TOI ETimes,12,All you need to know about rapper Gucci Mane,https://timesofindia.indiatimes.com/articleshow/129992070.cms,2026-04-03T02:54:19+00:00
TOI ETimes,13,Sunil Pal Recalls On-Stage Insult: says viral snub left him hurt,https://timesofindia.indiatimes.com/articleshow/129985099.cms,2026-04-03T02:54:19+00:00
TOI ETimes,14,Laughter Chefs 3: Mrunal calls Elvish Yadav 'cute daaku',https://timesofindia.indiatimes.com/articleshow/129986951.cms,2026-04-03T02:54:19+00:00
TOI ETimes,15,Divyanka On Garbha Sanskar: positive rituals to bond with unborn baby,https://timesofindia.indiatimes.com/articleshow/129983115.cms,2026-04-03T02:54:19+00:00
TOI ETimes,16,Rajat Dalal reacts to Monalisa’s outburst against him on 'The 50',https://timesofindia.indiatimes.com/articleshow/129975208.cms,2026-04-03T02:54:19+00:00
TOI ETimes,17,Soundous shares a cryptic post amid Splitsvilla X6 controversy,https://timesofindia.indiatimes.com/articleshow/129975337.cms,2026-04-03T02:54:19+00:00
TOI ETimes,18,Spider eggs: What they look like and where you might find them in your home,https://timesofindia.indiatimes.com/articleshow/129982826.cms,2026-04-03T02:54:19+00:00
TOI ETimes,19,Spot a liar in seconds: Psychopathy researcher shares smart psychology trick,https://timesofindia.indiatimes.com/articleshow/129987093.cms,2026-04-03T02:54:19+00:00
TOI ETimes,20,How to grow lemons in your balcony garden,https://timesofindia.indiatimes.com/articleshow/129986407.cms,2026-04-03T02:54:19+00:00
TOI ETimes,21,All about Taylor Swift and Travis Kelce's summer wedding: From chill bachelor party to star-studded guest list,https://timesofindia.indiatimes.com/articleshow/129982143.cms,2026-04-03T02:54:19+00:00
TOI ETimes,22,"GTA 6 leaks reveal something huge about NPCs, and it could change everything",https://timesofindia.indiatimes.com/articleshow/129988317.cms,2026-04-03T02:54:19+00:00
TOI ETimes,23,The ‘Thailand tattoo’ sounds like a trend until you know what it really is,https://timesofindia.indiatimes.com/articleshow/129987599.cms,2026-04-03T02:54:19+00:00
TOI ETimes,24,‘Like booking a cab’: Anand Mahindra shares video of on-demand coconut harvesting in Kerala,https://timesofindia.indiatimes.com/articleshow/129985522.cms,2026-04-03T02:54:19+00:00
TOI ETimes,25,He made me cry’: 4-year-old’s Dettol ad performance wins hearts; parents credit SRK for his acting skills,https://timesofindia.indiatimes.com/articleshow/129984176.cms,2026-04-03T02:54:19+00:00
TOI ETimes,26,"‘Feels like Mars, not Earth’: Greece’s haunting red sky goes viral– videos inside",https://timesofindia.indiatimes.com/articleshow/129983835.cms,2026-04-03T02:54:19+00:00
TOI ETimes,27,Viral video: Delhi street turns into spectacle as crowd gathers to watch two mice fight,https://timesofindia.indiatimes.com/articleshow/129981312.cms,2026-04-03T02:54:19+00:00
TOI ETimes,28,'Life Of A Showgirl' Lawsuit: Taylor Swift sued over title,https://timesofindia.indiatimes.com/articleshow/129914575.cms,2026-04-03T02:54:19+00:00
TOI ETimes,29,Celine Dion announces COMEBACK with Paris residency,https://timesofindia.indiatimes.com/articleshow/129913382.cms,2026-04-03T02:54:19+00:00
TOI ETimes,30,'Viva La Lisa': Lisa becomes first K-Pop star with Vegas residency,https://timesofindia.indiatimes.com/articleshow/129913024.cms,2026-04-03T02:54:19+00:00
TOI ETimes,31,Paul McCartney recalls ‘The Beatles’ first trip to America,https://timesofindia.indiatimes.com/articleshow/129894858.cms,2026-04-03T02:54:19+00:00
TOI ETimes,32,"Benson Boone announces ‘Wanted Man’ US tour after record-breaking global run - All about the dates, booking, and more",https://timesofindia.indiatimes.com/articleshow/129890937.cms,2026-04-03T02:54:19+00:00
TOI ETimes,33,Taylor Swift dodges ex John Mayer at Paul McCartney’s concert,https://timesofindia.indiatimes.com/articleshow/129890568.cms,2026-04-03T02:54:19+00:00
TOI ETimes,34,Beyond Ebooks: The charm of bookstores endures,https://timesofindia.indiatimes.com/articleshow/101098088.cms,2026-04-03T02:54:19+00:00
TOI ETimes,35,It’s a curtain call: Sania Mirza bids adieu to tennis with ‘happy tears’,https://timesofindia.indiatimes.com/articleshow/98440670.cms,2026-04-03T02:54:19+00:00
TOI ETimes,36,A magical makeover for 17th Century stepwell: From neglected ruins to a glorious piece of history,https://timesofindia.indiatimes.com/articleshow/96557955.cms,2026-04-03T02:54:19+00:00
TOI ETimes,37,The city comes alive with Christmas fervour,https://timesofindia.indiatimes.com/articleshow/96406573.cms,2026-04-03T02:54:19+00:00
TOI ETimes,38,#BringRioHome: Pet parents launch search to find their kidnapped cat,https://timesofindia.indiatimes.com/articleshow/96334809.cms,2026-04-03T02:54:19+00:00
TOI ETimes,39,Adil Hussain’s 'Mercy' release date OUT: Film's first look to be attached with Ranveer Singh's 'Dhurandhar: The Revenge',https://timesofindia.indiatimes.com/articleshow/129843424.cms,2026-04-03T02:54:19+00:00
TOI ETimes,40,It’s the best time to be doing theatre: Juhi Babbar Soni,https://timesofindia.indiatimes.com/articleshow/129826631.cms,2026-04-03T02:54:19+00:00
TOI ETimes,41,"Anu Malik steps into theatre with Anupam Kher’s play, Calls it his most exciting challenge yet",https://timesofindia.indiatimes.com/articleshow/129729335.cms,2026-04-03T02:54:19+00:00
TOI ETimes,42,'Wicked' musical director John Stefaniuk on live music on the stage: 'It is so exciting to hear the orchestra whisk us away',https://timesofindia.indiatimes.com/articleshow/129610267.cms,2026-04-03T02:54:19+00:00
TOI ETimes,43,"'Wicked' stars Rebekah Lowings and Eve Shanu-Wilson on Elphaba-Glinda's bond: 'Friends challenge you, not just cheer you on'",https://timesofindia.indiatimes.com/articleshow/129607673.cms,2026-04-03T02:54:19+00:00
TOI ETimes,44,"Vijay Crishna, Shah Rukh Khan’s on-screen father in ‘Devdas,’ passes away at 81: Tributes pour in for theatre stalwart",https://timesofindia.indiatimes.com/articleshow/129016007.cms,2026-04-03T02:54:19+00:00
TOI ETimes,45,Raj Kundra and Shilpa Shetty's 15th Wedding Anniversary,https://timesofindia.indiatimes.com/articleshow/115563990.cms,2026-04-03T02:54:19+00:00
TOI ETimes,46,​Bigg Boss winners list from season 1 to 17​,https://timesofindia.indiatimes.com/articleshow/114277426.cms,2026-04-03T02:54:19+00:00
TOI ETimes,47,​Discover the bird with a prehistoric roar​,https://timesofindia.indiatimes.com/articleshow/114244474.cms,2026-04-03T02:54:19+00:00
TOI ETimes,48,Dia Mirza's ethnic wear,https://timesofindia.indiatimes.com/articleshow/114243410.cms,2026-04-03T02:54:19+00:00
TOI ETimes,49,​Incredible facts about ants you won’t believe​,https://timesofindia.indiatimes.com/articleshow/114243248.cms,2026-04-03T02:54:19+00:00
TOI ETimes,50,'Bigg Boss Marathi 5' nears grand finale​,https://timesofindia.indiatimes.com/articleshow/113936459.cms,2026-04-03T02:54:19+00:00
TOI ETimes,51,"Thailand hotel room shocker: Cobra encounter leaves guests startled, raises safety questions",https://timesofindia.indiatimes.com/articleshow/129978809.cms,2026-04-03T02:54:19+00:00
TOI ETimes,52,Meet Maurice Ward: The hairdresser who invented a ‘nuclear-proof’ material and took its secret to the grave,https://timesofindia.indiatimes.com/articleshow/129988257.cms,2026-04-03T02:54:19+00:00
TOI ETimes,53,"Wife turns spy: Chinese woman risks life, clings to husband's truck trailer to catch him in the act",https://timesofindia.indiatimes.com/articleshow/129975959.cms,2026-04-03T02:54:19+00:00
TOI ETimes,54,"12 tonnes of KitKats stolen, brand says ‘not a prank’ - launches ‘stolen chocolates tracker’ to catch the thief",https://timesofindia.indiatimes.com/articleshow/129972589.cms,2026-04-03T02:54:19+00:00
TOI ETimes,55,Eight nuclear and space scientists behind America’s most classified secrets have vanished or died: Inside the mystery of the missing and the dead,https://timesofindia.indiatimes.com/articleshow/129982872.cms,2026-04-03T02:54:19+00:00
TOI ETimes,56,Viral video: Russian tourist choked by locals in Bali after allegedly touching and harassing women,https://timesofindia.indiatimes.com/articleshow/129983079.cms,2026-04-03T02:54:19+00:00
TOI ETimes,57,Who is Ryan Williams? Football player who gave up Australian passport to play for India,https://timesofindia.indiatimes.com/articleshow/129978589.cms,2026-04-03T02:54:19+00:00
TOI ETimes,58,"World's oldest tortoise Jonathan alive and kicking, fake death rumour sparks outrage: ‘This is a hoax’",https://timesofindia.indiatimes.com/articleshow/129978974.cms,2026-04-03T02:54:19+00:00
TOI ETimes,59,Meet Jeremy Hansen: The farm boy turned astronaut set to become the first Canadian to venture around the Moon,https://timesofindia.indiatimes.com/articleshow/129971593.cms,2026-04-03T02:54:19+00:00
TOI ETimes,60,From salmon sperm injections to bird droppings facials: The most bizarre skincare trends on social media - do they actually work?,https://timesofindia.indiatimes.com/articleshow/129971158.cms,2026-04-03T02:54:19+00:00
TOI ETimes,61,"Meet Bodhana Sivanandan: Indian-origin player, 11, makes history as Britain's top chess master",https://timesofindia.indiatimes.com/articleshow/129970844.cms,2026-04-03T02:54:19+00:00
TOI ETimes,62,"Who is Chef Padayal Sivakumar? The ‘no oil, no boil’ genius behind 2,500 fire-free recipes",https://timesofindia.indiatimes.com/articleshow/129967987.cms,2026-04-03T02:54:19+00:00
TOI ETimes,63,BSF jawan humorously roasts a Pakistan Ranger at the Attari-Wagah border: Watch viral video,https://timesofindia.indiatimes.com/articleshow/129967877.cms,2026-04-03T02:54:19+00:00
TOI ETimes,64,Meet John Sauer: The lawyer spearheading Donald Trump’s bold move to end birthright citizenship,https://timesofindia.indiatimes.com/articleshow/129966739.cms,2026-04-03T02:54:19+00:00
TOI ETimes,65,"Happy Hanuman Jayanti 2026 : Best Messages, Quotes, Wishes, Images, Pics And Greetings Crad To Share On Hanuman Janmotsav",https://timesofindia.indiatimes.com/articleshow/129959622.cms,2026-04-03T02:54:19+00:00
TOI ETimes,66,"IPL 2026: Proposal goes wrong at Wankhede as man drops ring, but still scores a 'Yes'",https://timesofindia.indiatimes.com/articleshow/129958777.cms,2026-04-03T02:54:19+00:00
TOI ETimes,67,From mythical to extinct: 5 national animals that tell unusual stories,https://timesofindia.indiatimes.com/articleshow/129958294.cms,2026-04-03T02:54:19+00:00
TOI ETimes,68,"Innocent man awarded $975,000 after being mistakenly held in psychiatric hospital for years",https://timesofindia.indiatimes.com/articleshow/129959417.cms,2026-04-03T02:54:19+00:00
TOI ETimes,69,Is your Gmail username too embarrassing to share? Now you can change it – here’s a step-by-step guide,https://timesofindia.indiatimes.com/articleshow/129958550.cms,2026-04-03T02:54:19+00:00
TOI ETimes,70,5 railway stations in India known for their unique design and beauty,https://timesofindia.indiatimes.com/articleshow/129956512.cms,2026-04-03T02:54:19+00:00
TOI ETimes,71,"Watch: Syrian President struggles to open water bottle during UK event as female host helps, video goes viral",https://timesofindia.indiatimes.com/articleshow/129957346.cms,2026-04-03T02:54:19+00:00
TOI ETimes,72,"They have feathers, they have claws, and in some cases they have venom – meet the deadliest birds on the planet",https://timesofindia.indiatimes.com/articleshow/129954849.cms,2026-04-03T02:54:19+00:00
TOI ETimes,73,"Happy Hanuman Jayanti 2026: Top 100+ Wishes, Messages, Quotes, Greetings Card and Images To Share With Your Family And Friends",https://timesofindia.indiatimes.com/articleshow/129954390.cms,2026-04-03T02:54:19+00:00
TOI ETimes,74,"According to science, this is what human body would have to look like to survive a car crash",https://timesofindia.indiatimes.com/articleshow/129952465.cms,2026-04-03T02:54:19+00:00
TOI ETimes,75,NASA’s Artemis-II is about to break a 50-year record: 10 facts that will blow your mind,https://timesofindia.indiatimes.com/articleshow/129954656.cms,2026-04-03T02:54:19+00:00
TOI ETimes,76,5 animals that ‘kidnap’ other animals’ babies and why it happens,https://timesofindia.indiatimes.com/articleshow/129953289.cms,2026-04-03T02:54:19+00:00
TOI ETimes,77,Why is Good Friday observed and not celebrated: The meaning behind the solemn day,https://timesofindia.indiatimes.com/articleshow/129949625.cms,2026-04-03T02:54:19+00:00
TOI ETimes,78,How Kris Jenner became China’s lucky charm: Why Chinese netizens are changing their profile pictures to the Kardashian matriarch,https://timesofindia.indiatimes.com/articleshow/129949409.cms,2026-04-03T02:54:19+00:00
TOI ETimes,79,LPG vs LNG vs PNG vs CNG: Decoding the different gaseous fuels that power India,https://timesofindia.indiatimes.com/articleshow/129948138.cms,2026-04-03T02:54:19+00:00
TOI ETimes,80,"Meet Palmer Luckey: He built a $2 billion company at 19, got...",https://timesofindia.indiatimes.com/articleshow/129907090.cms,2026-04-03T02:54:19+00:00
