source,rank,headline,link,collected_at_iso
TOI ETimes,80,"Meet Palmer Luckey: He built a $2 billion company at 19, got...",https://timesofindia.indiatimes.com/articleshow/129907090.cms,2026-04-03T05:44:33+00:00
TOI ETimes,81,Did you also get fooled by the viral 'war lockdown PDF' on A...,https://timesofindia.indiatimes.com/articleshow/129946583.cms,2026-04-03T05:44:33+00:00
TOI ETimes,82,Did the Shroud of Turin originate in India? DNA analysis rev...,https://timesofindia.indiatimes.com/articleshow/129944346.cms,2026-04-03T05:44:33+00:00
TOI ETimes,83,Meet Patrick Winston: MIT professor whose one-hour lecture s...,https://timesofindia.indiatimes.com/articleshow/129827810.cms,2026-04-03T05:44:33+00:00
TOI ETimes,84,A timeless bond: Japanese diver regularly meets and feeds th...,https://timesofindia.indiatimes.com/articleshow/129785510.cms,2026-04-03T05:44:33+00:00
TOI ETimes,85,LPG vs PNG explained: What is the difference between these f...,https://timesofindia.indiatimes.com/articleshow/129816327.cms,2026-04-03T05:44:33+00:00
TOI ETimes,86,"Mum who vanished without trace in 2001 found alive, meets da...",https://timesofindia.indiatimes.com/articleshow/129854308.cms,2026-04-03T05:44:33+00:00
TOI ETimes,87,"130+ Happy International Women's Day Messages, Greetings Car...",https://timesofindia.indiatimes.com/articleshow/129161916.cms,2026-04-03T05:44:33+00:00
TOI ETimes,88,"Happy Eid-ul-Fitr 2026: Eid Mubarak Wishes, Messages, Quotes...",https://timesofindia.indiatimes.com/articleshow/129680487.cms,2026-04-03T05:44:33+00:00
TOI ETimes,89,'Not a game at all': Canadian PM Mark Carney and Finland’s p...,https://timesofindia.indiatimes.com/articleshow/129641203.cms,2026-04-03T05:44:33+00:00
TOI ETimes,90,LPG vs LNG vs PNG vs CNG: Decoding the different gaseous fuels that power India,https://timesofindia.indiatimes.com/articleshow/129948138.cms,2026-04-03T05:44:33+00:00
TOI ETimes,91,Could the Shroud of Turin have been woven in India? New DNA study hints at a surprising link,https://timesofindia.indiatimes.com/articleshow/129945695.cms,2026-04-03T05:44:33+00:00
TOI ETimes,92,"Heard about 'LifeofPujaa'? Meet Pujarini Pradhan, the viral 'village girl' on Instagram with premium brand collabs, facing backlash for being 'too articulate'",https://timesofindia.indiatimes.com/articleshow/129942707.cms,2026-04-03T05:44:33+00:00
TOI ETimes,93,"Zendaya stuns bride by crashing dress shopping, buys her dream wedding gown: Netizens hail 'queen' behaviour",https://timesofindia.indiatimes.com/articleshow/129942134.cms,2026-04-03T05:44:33+00:00
TOI ETimes,94,"Why is Oracle trending? Tech giant joins 'layoff club', cuts 30,000 jobs in major restructuring",https://timesofindia.indiatimes.com/articleshow/129941597.cms,2026-04-03T05:44:33+00:00
TOI ETimes,95,Happy April Fool’s Day 2026: 20 Funny memes and jokes that perfectly sum up the spirit of 1st April,https://timesofindia.indiatimes.com/articleshow/129934212.cms,2026-04-03T05:44:33+00:00
TOI ETimes,96,April’s ‘Pink Moon’ is coming: When to catch it and everything you need to know about this week's lunar show,https://timesofindia.indiatimes.com/articleshow/129939894.cms,2026-04-03T05:44:33+00:00
TOI ETimes,97,5 smallest dogs with the biggest personalities,https://timesofindia.indiatimes.com/articleshow/129933049.cms,2026-04-03T05:44:33+00:00
TOI ETimes,98,April Fools' pranks 2026: Try these hilarious jokes and prank ideas to amaze your loved ones,https://timesofindia.indiatimes.com/articleshow/129932394.cms,2026-04-03T05:44:33+00:00
TOI ETimes,99,"Did Egypt really issue a passport to 3,000-year-old Ramesses II for 1974 flight to Paris? Fact or fiction?",https://timesofindia.indiatimes.com/articleshow/129935320.cms,2026-04-03T05:44:33+00:00
TOI ETimes,100,Woman reports severe allergy after consuming meal on Vande Bharat Express; IRCTC says ‘lunch on train was…’,https://timesofindia.indiatimes.com/articleshow/129934587.cms,2026-04-03T05:44:33+00:00
TOI ETimes,101,From king cobra to taipan: 5 of the world’s deadliest snakes and how they come close to humans,https://timesofindia.indiatimes.com/articleshow/129930907.cms,2026-04-03T05:44:33+00:00
TOI ETimes,102,Always short on money? 7 simple ways to save better,https://timesofindia.indiatimes.com/articleshow/129929838.cms,2026-04-03T05:44:33+00:00
TOI ETimes,103,Viral experiment: YouTuber grows real tomatoes from McDonald’s burger,https://timesofindia.indiatimes.com/articleshow/129928498.cms,2026-04-03T05:44:33+00:00
TOI ETimes,104,Shocking visuals: Goa parasailing video shows tourist falling after cable snaps mid-air,https://timesofindia.indiatimes.com/articleshow/129925376.cms,2026-04-03T05:44:33+00:00
TOI ETimes,105,‘Pure evil’: Piers Morgan names the most dangerous person he’s ever interviewed in 35-year career,https://timesofindia.indiatimes.com/articleshow/129923651.cms,2026-04-03T05:44:33+00:00
TOI ETimes,106,The ‘Caveman’ move explained: How R Praggnanandhaa stunned Anish Giri with a shock move,https://timesofindia.indiatimes.com/articleshow/129923567.cms,2026-04-03T05:44:33+00:00
TOI ETimes,107,US woman bags Rs 11.4 crore jackpot playing the exact same numbers for years - here's her incredible story,https://timesofindia.indiatimes.com/articleshow/129922355.cms,2026-04-03T05:44:33+00:00
TOI ETimes,108,Watch video: Windsurfer hits whale in ‘unbelievable’ mid-ride moment caught on camera,https://timesofindia.indiatimes.com/articleshow/129921854.cms,2026-04-03T05:44:33+00:00
TOI ETimes,109,Meet Bittu Tabahi: The Indian boy who single-handedly cleaned the heavily polluted Ajnar river,https://timesofindia.indiatimes.com/articleshow/129921945.cms,2026-04-03T05:44:33+00:00
TOI ETimes,110,"Covered in gold head-to-toe, ‘Dubai bride’ sparks massive online debate",https://timesofindia.indiatimes.com/articleshow/129919212.cms,2026-04-03T05:44:33+00:00
TOI ETimes,111,"Astronaut Shubhanshu Shukla revisits NDA, surprises Hunter Squadron Cadets with push-ups",https://timesofindia.indiatimes.com/articleshow/129916261.cms,2026-04-03T05:44:33+00:00
TOI ETimes,112,"Happy Mahavir Jayanti 2026: 30+ Messages, Images, WhatsApp Messages, Wishes, Status, Quotes, GIF Pics, Photos, Greetings, Wallpapers",https://timesofindia.indiatimes.com/articleshow/129906603.cms,2026-04-03T05:44:33+00:00
TOI ETimes,113,Not Kashmir! Pune wakes up to ‘snowfall’ scenes as hailstorm blankets Hinjewadi,https://timesofindia.indiatimes.com/articleshow/129914943.cms,2026-04-03T05:44:33+00:00
TOI ETimes,114,Meet the mango master Shri Kishan Suman: The genius farmer behind the unusual ‘Sadabahar’ mango that blooms 3 times a year,https://timesofindia.indiatimes.com/articleshow/129899583.cms,2026-04-03T05:44:33+00:00
TOI ETimes,115,5 Indian airports so stunning they feel like destinations themselves,https://timesofindia.indiatimes.com/articleshow/129909898.cms,2026-04-03T05:44:33+00:00
TOI ETimes,116,Meet the tiny titans of the ocean: 5 fish under 1 inch you won’t believe exist,https://timesofindia.indiatimes.com/articleshow/129908301.cms,2026-04-03T05:44:33+00:00
TOI ETimes,117,From Ferraris to faith: Hardik Pandya’s SECRET source of strength is winning hearts,https://timesofindia.indiatimes.com/articleshow/129907203.cms,2026-04-03T05:44:33+00:00
TOI ETimes,118,Why this city is called the ‘Biryani Capital of India’ – the story behind the title,https://timesofindia.indiatimes.com/articleshow/129905647.cms,2026-04-03T05:44:33+00:00
TOI ETimes,119,"Happy Mahavir Jayanti 2026: Best wishes, messages, quotes, greetings card and images to share with your family and friends",https://timesofindia.indiatimes.com/articleshow/129904942.cms,2026-04-03T05:44:33+00:00
TOI ETimes,120,Entirely shot in India with Bollywood classics: Russian film ‘Persimmon of My Love’ goes viral ahead of April 1 release,https://timesofindia.indiatimes.com/articleshow/129904175.cms,2026-04-03T05:44:33+00:00
TOI ETimes,121,Mosquitoes at home? 6 natural ways to keep them away without chemicals,https://timesofindia.indiatimes.com/articleshow/129903876.cms,2026-04-03T05:44:33+00:00
TOI ETimes,122,"‘He ate’, ‘he’s cooked’, ‘NPC behaviour’: The new language taking over your feed in 2026",https://timesofindia.indiatimes.com/articleshow/129901978.cms,2026-04-03T05:44:33+00:00
TOI ETimes,123,"Workers dug a ditch, found ancient Gold: This reclining Buddha statue hid 1300-year-old Gold treasures",https://timesofindia.indiatimes.com/articleshow/129899388.cms,2026-04-03T05:44:33+00:00
TOI ETimes,124,"Viral video: Can you survive in Bengaluru on Rs 18,000? This 22-year-old intern says 'yes'",https://timesofindia.indiatimes.com/articleshow/129899197.cms,2026-04-03T05:44:33+00:00
TOI ETimes,125,"Anangpur Bandh: The incredible story of India’s 1,100-year-old ‘smart dam’ at the edge of the Aravallis",https://timesofindia.indiatimes.com/articleshow/129899235.cms,2026-04-03T05:44:33+00:00
TOI ETimes,126,"Mahavir Jayanti 2026: When Is Mahavir Jayanti? Know the Correct Date, Trayodashi Tithi, History and Significance",https://timesofindia.indiatimes.com/articleshow/129895327.cms,2026-04-03T05:44:33+00:00
TOI ETimes,127,"Big 4 employee refuses weekend work, roasts boss on Reddit: ‘Pray to your client at home’",https://timesofindia.indiatimes.com/articleshow/129897451.cms,2026-04-03T05:44:33+00:00
TOI ETimes,128,'STOP abusing animals': Russian photographer trolled in Jaipur for painting elephant pink for photoshoot,https://timesofindia.indiatimes.com/articleshow/129897548.cms,2026-04-03T05:44:33+00:00
TOI ETimes,129,"Journalist Abby Hornacek was body-slammed by 22-year-old wrestler Kennedy Blades: Who is this young Olympian, and what exactly happened?",https://timesofindia.indiatimes.com/articleshow/129896075.cms,2026-04-03T05:44:33+00:00
TOI ETimes,130,"'Nobody gets a break': 12 tonnes of KitKat stolen in transit across Europe, social media lights up with memes",https://timesofindia.indiatimes.com/articleshow/129895771.cms,2026-04-03T05:44:33+00:00
TOI ETimes,131,Memes rage on social media after Europe’s chocolatiest crime: 12 tonnes of KitKat chocolates stolen while in transit,https://timesofindia.indiatimes.com/articleshow/129893643.cms,2026-04-03T05:44:33+00:00
TOI ETimes,132,Did Akbar look 'South Asian' or 'Mongolian'? Internet debates Mughal Emperor's features through historical portraits,https://timesofindia.indiatimes.com/articleshow/129892697.cms,2026-04-03T05:44:33+00:00
TOI ETimes,133,Is that FBI boss Kash Patel dancing barefoot to a Bollywood song? Truth behind viral video,https://timesofindia.indiatimes.com/articleshow/129891337.cms,2026-04-03T05:44:33+00:00
TOI ETimes,134,How ‘ghost taxi drivers’ in China tricked customers into paying without rides,https://timesofindia.indiatimes.com/articleshow/129884105.cms,2026-04-03T05:44:33+00:00
TOI ETimes,135,AI expert drops brutal truth about kids' future: 'Save money for them',https://timesofindia.indiatimes.com/articleshow/129881126.cms,2026-04-03T05:44:33+00:00
TOI ETimes,136,Why restaurants place bottled water on your table without asking: Mumbai man's viral post explains,https://timesofindia.indiatimes.com/articleshow/129879663.cms,2026-04-03T05:44:33+00:00
TOI ETimes,137,Watch here: Entertainment turns scary as dancing robot slaps child during public show,https://timesofindia.indiatimes.com/articleshow/129878670.cms,2026-04-03T05:44:33+00:00
TOI ETimes,138,"Watch: Flier walks through airport wearing cat like a hat, video goes viral",https://timesofindia.indiatimes.com/articleshow/129877985.cms,2026-04-03T05:44:33+00:00
TOI ETimes,139,Software developer turns down call from IITian CEO publicly over AI-written email: “I definitely won’t have time if…”,https://timesofindia.indiatimes.com/articleshow/129877890.cms,2026-04-03T05:44:33+00:00
TOI ETimes,140,This isn’t what you expect on a college campus: What happened at IIT Madras has people talking,https://timesofindia.indiatimes.com/articleshow/129876963.cms,2026-04-03T05:44:33+00:00
TOI ETimes,141,"Using only her teeth, woman creates detailed sculptures including the Great Wall of China",https://timesofindia.indiatimes.com/articleshow/129875936.cms,2026-04-03T05:44:33+00:00
TOI ETimes,142,All hell breaks loose at Lucknow cinema after parents demand child’s entry into ‘Dhurandhar 2’,https://timesofindia.indiatimes.com/articleshow/129875158.cms,2026-04-03T05:44:33+00:00
TOI ETimes,143,Family says ‘no’ to $26 million offer to build AI data center on their ‘priceless’ generational farm,https://timesofindia.indiatimes.com/articleshow/129869813.cms,2026-04-03T05:44:33+00:00
TOI ETimes,144,‘Only in India’: French woman shocked by early morning movie + full food menu at mall,https://timesofindia.indiatimes.com/articleshow/129867095.cms,2026-04-03T05:44:33+00:00
TOI ETimes,145,"British ‘Bengali Jamai’ touches 89-year-old grandmother’s feet, internet calls it ‘pure love’",https://timesofindia.indiatimes.com/articleshow/129866315.cms,2026-04-03T05:44:33+00:00
TOI ETimes,146,Who is Shay Taylor-Allen? Yale janitor who became a doctor in the same hospital over a decade-long journey,https://timesofindia.indiatimes.com/articleshow/129866798.cms,2026-04-03T05:44:33+00:00
TOI ETimes,147,Claude AI says ‘Yes’ to killing a human - Elon Musk calls it ‘Troubling’,https://timesofindia.indiatimes.com/articleshow/129865001.cms,2026-04-03T05:44:33+00:00
TOI ETimes,148,Why haven't Gold prices risen considerably despite geopolitical unrest and rising crude oil prices?,https://timesofindia.indiatimes.com/articleshow/129862838.cms,2026-04-03T05:44:33+00:00
TOI ETimes,149,"""The prices shocked me.."" Foreign traveller Faria appreciates Indian pharmacy prices, says, ""I’m moving here!""",https://timesofindia.indiatimes.com/articleshow/129862729.cms,2026-04-03T05:44:33+00:00
TOI ETimes,150,Why do some dead bodies move on their own? Study reveals chilling science behind it,https://timesofindia.indiatimes.com/articleshow/129862339.cms,2026-04-03T05:44:33+00:00
TOI ETimes,151,"Brace for a cold shock: Snowfall, rain return to Shimla and Kullu; IMD sounds yellow alert",https://timesofindia.indiatimes.com/articleshow/129861305.cms,2026-04-03T05:44:33+00:00
TOI ETimes,152,"Pakistan man claims Ranveer Singh shot Dhurandhar 2 in Lyari at 4 AM, 'jab awaam so jaati thi'; Indian netizens share hilarious reactions",https://timesofindia.indiatimes.com/articleshow/129860781.cms,2026-04-03T05:44:33+00:00
TOI ETimes,153,"Who is Sabina Kafle? Meet Nepal PM Balen Shah’s wife, a poet, his strength and anchor",https://timesofindia.indiatimes.com/articleshow/129859739.cms,2026-04-03T05:44:33+00:00
TOI ETimes,154,Meet Luisa Laemmel: The stunning model dating Orlando Bloom after his breakup with Katy Perry,https://timesofindia.indiatimes.com/articleshow/129858490.cms,2026-04-03T05:44:33+00:00
TOI ETimes,155,Internet reacts to HBO's Harry Potter series casting Ghanaian actor Paapa Essiedu as Severus Snape,https://timesofindia.indiatimes.com/articleshow/129854273.cms,2026-04-03T05:44:33+00:00
TOI ETimes,156,From PS1 to PS5: 91-year-old Chinese man has finished 200 games and still plays 3 hours daily,https://timesofindia.indiatimes.com/articleshow/129854115.cms,2026-04-03T05:44:33+00:00
TOI ETimes,157,Meet Spencer Stone: US Airman who stopped a terrorist with bare hands on a moving train in France,https://timesofindia.indiatimes.com/articleshow/129853726.cms,2026-04-03T05:44:33+00:00
TOI ETimes,158,2026 crash coming? ‘Rich Dad Poor Dad’ author Robert Kiyosaki reveals where he’s putting his money,https://timesofindia.indiatimes.com/articleshow/129853328.cms,2026-04-03T05:44:33+00:00
TOI ETimes,159,Got ‘LPG charges’ on your restaurant bill? Here’s what you can do right now,https://timesofindia.indiatimes.com/articleshow/129852944.cms,2026-04-03T05:44:33+00:00
TOI ETimes,160,"Meet Chesney: Kangaroo in denim diaper on the run, zoo says ‘he is not mean or dangerous’",https://timesofindia.indiatimes.com/articleshow/129851469.cms,2026-04-03T05:44:33+00:00
TOI ETimes,161,"'Specialists missed it for 25 years, AI found it in just one conversation': Man claims he uncovered a hidden sleep disorder using Claude",https://timesofindia.indiatimes.com/articleshow/129851148.cms,2026-04-03T05:44:33+00:00
TOI ETimes,162,Meet the 103-year-old tea seller quietly taking over social media – here’s her surprising story,https://timesofindia.indiatimes.com/articleshow/129850758.cms,2026-04-03T05:44:33+00:00
TOI ETimes,163,‘Better than English airports’: British traveller praises Lucknow Airport in viral video,https://timesofindia.indiatimes.com/articleshow/129850280.cms,2026-04-03T05:44:33+00:00
TOI ETimes,164,"Child calls ras malai ‘doodh wale kabab’, internet can’t get enough",https://timesofindia.indiatimes.com/articleshow/129847794.cms,2026-04-03T05:44:33+00:00
TOI ETimes,165,Content creator claims pani puri stall makes ₹10.8 lakh a year; internet reacts to the viral video,https://timesofindia.indiatimes.com/articleshow/129843905.cms,2026-04-03T05:44:33+00:00
TOI ETimes,166,‘My family couldn’t visit me’: ‘Hot Felon’ opens up about how viral fame turned his jail life upside down,https://timesofindia.indiatimes.com/articleshow/129839463.cms,2026-04-03T05:44:33+00:00
TOI ETimes,167,Pro athlete who lost all four limbs charged after allegedly shooting and dumping victim’s body,https://timesofindia.indiatimes.com/articleshow/129833692.cms,2026-04-03T05:44:33+00:00
TOI ETimes,168,"Unable to afford rent, a couple saves Rs. 1 lakh annually by living in a Florida hotel room",https://timesofindia.indiatimes.com/articleshow/129843754.cms,2026-04-03T05:44:33+00:00
TOI ETimes,169,Waiting for GTA 6? Now you can play it months before the launch as a Rockstar Games tester; know how and where to apply,https://timesofindia.indiatimes.com/articleshow/129843481.cms,2026-04-03T05:44:33+00:00
TOI ETimes,170,Intoxicated or a glitch? Viral video shows an allegedly 'intoxicated' delivery worker standing for hours in Chandigarh,https://timesofindia.indiatimes.com/articleshow/129841958.cms,2026-04-03T05:44:33+00:00
TOI ETimes,171,Social media turns into a meme fest as LPG shortage fears flood feeds; memes inside,https://timesofindia.indiatimes.com/articleshow/129841804.cms,2026-04-03T05:44:33+00:00
TOI ETimes,172,"Ram Navami Surya Tilak to be performed on Ram Lalla idol at Ayodhya Ram Mandir: Timings, muhurat, visiting slots, and more",https://timesofindia.indiatimes.com/articleshow/129839438.cms,2026-04-03T05:44:33+00:00
TOI ETimes,173,2026 hurricane season forecast: List of US states most at risk this hurricane season,https://timesofindia.indiatimes.com/articleshow/129838655.cms,2026-04-03T05:44:33+00:00
TOI ETimes,174,"Happy Ram Navami 2026: 30+ messages, wishes, images, and greetings to share on the last day of Chaitra Navratri",https://timesofindia.indiatimes.com/articleshow/129785162.cms,2026-04-03T05:44:33+00:00
TOI ETimes,175,‘Can India ever have safe cycle tracks?’ Viral video from Washington sparks fierce debate,https://timesofindia.indiatimes.com/articleshow/129835772.cms,2026-04-03T05:44:33+00:00
TOI ETimes,176,Meet Samba: The 9-month-old capybara on the run after escaping an England zoo,https://timesofindia.indiatimes.com/articleshow/129830614.cms,2026-04-03T05:44:33+00:00
TOI ETimes,177,Who is Anthony Grove? Convicted child killer and parole violator arrested at a Florida spring break beach,https://timesofindia.indiatimes.com/articleshow/129822577.cms,2026-04-03T05:44:33+00:00
TOI ETimes,178,"Anurag Dobhal health update: UK07 rider posts “some bad news” after post-crash physiotherapy video, says ""kabhi chal payuga ya nahi""",https://timesofindia.indiatimes.com/articleshow/129822287.cms,2026-04-03T05:44:33+00:00
TOI ETimes,179,"Who is Avichal Ojha? The man who began with a college project on scooty is helping 10,000 homes grow healthier plants in his plant care business",https://timesofindia.indiatimes.com/articleshow/129821053.cms,2026-04-03T05:44:33+00:00
TOI ETimes,180,‘Harry Potter’ show trolled for ‘race swapping’ Snape: ‘Harry is now suspicious his dad bullied a Black kid’,https://timesofindia.indiatimes.com/articleshow/129820859.cms,2026-04-03T05:44:33+00:00
TOI ETimes,181,Explained: What is the Artemis II mission that will take astronauts around the Moon after half a century?,https://timesofindia.indiatimes.com/articleshow/129820829.cms,2026-04-03T05:44:33+00:00
TOI ETimes,182,"Himachal Pradesh to see fresh rain and snow spell from March 26, says IMD; here are the places likely to see snowfall",https://timesofindia.indiatimes.com/articleshow/129819180.cms,2026-04-03T05:44:33+00:00
TOI ETimes,183,"Ram Navami 2026: Importance, greetings, quotes, whatsapp messages, status updates, and images to celebrate the occasion with joy",https://timesofindia.indiatimes.com/articleshow/129772691.cms,2026-04-03T05:44:33+00:00
TOI ETimes,184,‘Dhurandhar: The Revenge’ actor Aditya Uppal says real Omar checked his Instagram; reveals he received death threats from Pakistan over his role,https://timesofindia.indiatimes.com/articleshow/129817327.cms,2026-04-03T05:44:33+00:00
TOI ETimes,185,Watch: Tiny grey squirrel caught ‘vaping’ in viral video – internet can’t stop reacting,https://timesofindia.indiatimes.com/articleshow/129811109.cms,2026-04-03T05:44:33+00:00
TOI ETimes,186,"Husband left her, but she kept going: Maharashtra woman drives auto with toddler by her side to make a living",https://timesofindia.indiatimes.com/articleshow/129810624.cms,2026-04-03T05:44:33+00:00
TOI ETimes,187,"Happy Ram Navami 2026: Best Messages, Quotes, Wishes, and Images to share on Sri Ram Navami",https://timesofindia.indiatimes.com/articleshow/129784258.cms,2026-04-03T05:44:33+00:00
TOI ETimes,188,Meet Meg Avon: The woman who ‘married’ a river to protect it and celebrate her anniversary,https://timesofindia.indiatimes.com/articleshow/129810883.cms,2026-04-03T05:44:33+00:00
TOI ETimes,189,‘9–10 hours chatting with AI chatbots’: NEET aspirant’s disturbing habit alarms younger brother; internet reacts,https://timesofindia.indiatimes.com/articleshow/129809754.cms,2026-04-03T05:44:33+00:00
TOI ETimes,190,"The sinner and the saviour: The story of Rasputin, a mystic who once shook the Russian empire",https://timesofindia.indiatimes.com/articleshow/129807514.cms,2026-04-03T05:44:33+00:00
TOI ETimes,191,Viral video! ‘Marry or dad turns into a helpless spirit’: Kolkata mom’s unusual warning to daughter,https://timesofindia.indiatimes.com/articleshow/129807052.cms,2026-04-03T05:44:33+00:00
TOI ETimes,192,Ranthambore tiger video shows deer carcass dragged post-hunt; watch the raw action,https://timesofindia.indiatimes.com/articleshow/129804840.cms,2026-04-03T05:44:33+00:00
TOI ETimes,193,Is this the world’s oldest tweet? Viral X post in Japanese shows impossible 1992 timestamp,https://timesofindia.indiatimes.com/articleshow/129804409.cms,2026-04-03T05:44:33+00:00
TOI ETimes,194,Massive rhino on Nepal street? UK traveller stunned by jaw-dropping sight – video inside,https://timesofindia.indiatimes.com/articleshow/129804673.cms,2026-04-03T05:44:33+00:00
TOI ETimes,195,UPI in 2026 isn’t just scan and pay: 4 surprising new features you should know,https://timesofindia.indiatimes.com/articleshow/129804158.cms,2026-04-03T05:44:33+00:00
TOI ETimes,196,“I asked a Pakistani about Dhurandhar”: Social media creator’s Dhurandhar review from Pakistani viewer goes viral,https://timesofindia.indiatimes.com/articleshow/129797184.cms,2026-04-03T05:44:33+00:00
TOI ETimes,197,"“No relocation, no network abroad”: Indian techie shares the viral 12-week plan that landed him a Rs 1.8 crore international job",https://timesofindia.indiatimes.com/articleshow/129796969.cms,2026-04-03T05:44:33+00:00
TOI ETimes,198,Only 2 trains per year? Internet is surprised by a Punjab railway station that functions only on two special days every year!,https://timesofindia.indiatimes.com/articleshow/129796481.cms,2026-04-03T05:44:33+00:00
TOI ETimes,199,Tarun Mishra Story,https://timesofindia.indiatimes.com/articleshow/129943704.cms,2026-04-03T05:44:33+00:00
TOI ETimes,200,Chef Sanjeev Kapoor,https://timesofindia.indiatimes.com/articleshow/129943579.cms,2026-04-03T05:44:33+00:00
TOI ETimes,201,Raghav Chadha Home,https://timesofindia.indiatimes.com/articleshow/129974795.cms,2026-04-03T05:44:33+00:00
TOI ETimes,202,Game Of Thrones,https://timesofindia.indiatimes.com/articleshow/129963850.cms,2026-04-03T05:44:33+00:00
TOI ETimes,203,Ustaad Bhagat Singh Collection,https://timesofindia.indiatimes.com/articleshow/129991923.cms,2026-04-03T05:44:33+00:00
TOI ETimes,204,Nithya Menen Home,https://timesofindia.indiatimes.com/articleshow/129964231.cms,2026-04-03T05:44:33+00:00
TOI ETimes,205,Dhurandhar 2 Collection,https://timesofindia.indiatimes.com/articleshow/129971469.cms,2026-04-03T05:44:33+00:00
TOI ETimes,206,Aadu 3 Box Office Collection,https://timesofindia.indiatimes.com/articleshow/129964488.cms,2026-04-03T05:44:33+00:00
TOI ETimes,207,Indian Railways New Rules,https://timesofindia.indiatimes.com/articleshow/129977942.cms,2026-04-03T05:44:33+00:00
TOI ETimes,208,Apple iPhone 18 Pro,https://timesofindia.indiatimes.com/articleshow/129918026.cms,2026-04-03T05:44:33+00:00
TOI ETimes,209,Artemis II Toilet Trouble,https://timesofindia.indiatimes.com/articleshow/129970353.cms,2026-04-03T05:44:33+00:00
TOI ETimes,210,Garena Free Fire MAX Redeem Codes,https://timesofindia.indiatimes.com/articleshow/129966376.cms,2026-04-03T05:44:33+00:00
TOI ETimes,211,Basketball Zero Codes,https://timesofindia.indiatimes.com/articleshow/129802738.cms,2026-04-03T05:44:33+00:00
TOI ETimes,212,MCA starts process for new stadium in Navi Mumbai with 1 lakh capacity,https://timesofindia.indiatimes.com/articleshow/129994790.cms,2026-04-03T05:44:33+00:00
