source,rank,headline,link,collected_at_iso
Indian Express,1,Trending in India,https://indianexpress.com/section/trending/trending-in-india/,2026-04-13T13:56:28+00:00
Indian Express,2,This is Serious,https://indianexpress.com/section/trending/this-is-serious/,2026-04-13T13:56:28+00:00
Indian Express,3,Christina Koch dog reunion video goes viral after Artemis II mission,https://indianexpress.com/article/trending/trending-globally/christina-koch-dog-reunion-artemis-ii-viral-video-10634203/,2026-04-13T13:56:28+00:00
Indian Express,4,2/10 for Delhi: Netizens agree as Russian tourist’s safety ratings for Indian cities go viral,https://indianexpress.com/article/trending/trending-in-india/russian-tourist-safety-rating-india-delhi-viral-video-10634030/,2026-04-13T13:56:28+00:00
Indian Express,5,The viral video captures the critical moment when the athletes were sprinting at full speed,https://indianexpress.com/article/trending/trending-in-india/athletics-federation-slammed-after-man-walks-onto-running-track-in-delhi-during-200m-final-10633569/,2026-04-13T13:56:28+00:00
Indian Express,6,Asha Bhosle sand art tribute,https://indianexpress.com/article/trending/trending-in-india/asha-bhosle-death-tribute-sudarsan-pattnaik-sand-art-10633428/,2026-04-13T13:56:28+00:00
Indian Express,7,"CEO texted employee on wedding day, triggers backlash",https://indianexpress.com/article/trending/trending-globally/us-ceo-issues-public-apology-after-messaging-employee-on-his-wedding-day-10632972/,2026-04-13T13:56:28+00:00
Indian Express,8,Boss sends mangoes to his employee,https://indianexpress.com/article/trending/trending-in-india/london-boss-sends-surprise-gift-to-mumbai-woman-who-missed-good-quality-mangoes-10632704/,2026-04-13T13:56:28+00:00
Indian Express,9,Parakeet Bebe snorkelling video,https://indianexpress.com/article/trending/trending-globally/meet-bebe-world-first-snorkelling-parakeet-viral-bird-10632480/,2026-04-13T13:56:28+00:00
Indian Express,10,Digital arrest scam in UP,https://indianexpress.com/article/trending/trending-in-india/digital-arrest-scam-bareilly-student-saves-parents-10632297/,2026-04-13T13:56:28+00:00
Indian Express,11,She shared that lunchtime proved to be the toughest part due to steep prices.,https://indianexpress.com/article/trending/trending-in-india/bengaluru-500-day-challenge-budget-survival-10632231/,2026-04-13T13:56:28+00:00
Indian Express,12,Most Valuable Banks in India in 2026,https://indianexpress.com/article/trending/top-10-listing/top-10-most-valuable-banks-in-india-in-2026-10631398/,2026-04-13T13:56:28+00:00
Indian Express,13,Shantanu Naidu viral video,https://indianexpress.com/article/trending/trending-in-india/shantanu-naidu-viral-video-horse-cruelty-indian-weddings-baraat-10631327/,2026-04-13T13:56:28+00:00
Indian Express,14,Ichiro Suzuki statue broken bay,https://indianexpress.com/article/trending/trending-globally/watch-ichiro-suzuki-statue-reveal-broken-bat-seattle-mariners-video-10631296/,2026-04-13T13:56:28+00:00
Indian Express,15,Gen Z work culture,https://indianexpress.com/article/trending/trending-in-india/gen-z-work-culture-linkedin-post-workplace-boundaries-debate-overtime-pay-burnout-10631091/,2026-04-13T13:56:28+00:00
Indian Express,16,Kunal Kamra apology row,https://indianexpress.com/article/trending/trending-in-india/kunal-kamra-refuses-apology-maharashtra-privileges-committee-eknath-shinde-parody-song-10630923/,2026-04-13T13:56:28+00:00
Indian Express,17,Bangkok to India flight dirty video,https://indianexpress.com/article/trending/trending-in-india/bangkok-india-flight-dirty-video-indian-passenger-civic-sense-10630788/,2026-04-13T13:56:28+00:00
Indian Express,18,Top 10 most valuable power companies in the world,https://indianexpress.com/article/trending/top-10-listing/top-10-most-valuable-power-companies-in-the-world-2026-10629824/,2026-04-13T13:56:28+00:00
Indian Express,19,Kerala voting controversy,https://indianexpress.com/article/trending/trending-in-india/kerala-voting-controversy-thrissur-woman-bandaged-finger-indelible-ink-row-10629778/,2026-04-13T13:56:28+00:00
Indian Express,20,Gurgaon founder firing employee,https://indianexpress.com/article/trending/trending-in-india/gurgaon-founder-fires-employee-over-text-no-notice-period-startup-work-culture-debate-10629584/,2026-04-13T13:56:28+00:00
Indian Express,21,Sanju Samson gifts phone to fan,https://indianexpress.com/article/trending/trending-in-india/sanju-samson-gifts-new-phone-fan-palakkad-kerala-ipl-2026-csk-10629238/,2026-04-13T13:56:28+00:00
Indian Express,22,Anant Ambani birthday,https://indianexpress.com/article/trending/trending-in-india/anant-ambani-31st-birthday-bandra-worli-sea-link-tribute-viral-video-10629005/,2026-04-13T13:56:28+00:00
Indian Express,23,Top 10 export countries in the world,https://indianexpress.com/article/trending/top-10-listing/top-10-export-countries-in-the-world-2025-26-10628094/,2026-04-13T13:56:28+00:00
Indian Express,24,KitKat chocolate heist,https://indianexpress.com/article/trending/trending-globally/kitkat-canada-chocolate-heist-convoy-security-viral-video-10628022/,2026-04-13T13:56:28+00:00
Indian Express,25,Narmada River milk ritual video,https://indianexpress.com/article/trending/trending-in-india/11000-litres-milk-poured-narmada-river-video-viral-religious-ritual-outrage-10627861/,2026-04-13T13:56:28+00:00
Indian Express,26,Hachiko Statue Tokyo viral video,https://indianexpress.com/article/trending/trending-globally/viral-video-tokyo-hachiko-statue-indian-tourists-queue-jumping-social-media-backlash-civic-sense-10627605/,2026-04-13T13:56:28+00:00
Indian Express,27,deaf Uber driver blind passenger,https://indianexpress.com/article/trending/trending-in-india/blind-passenger-deaf-uber-driver-viral-linkedin-post-aishwarya-pillai-10627371/,2026-04-13T13:56:28+00:00
LiveMint,1,Giannis Antetokounmpo and Bucks enter pivotal offseason as Doc Rivers steps down,https://www.livemint.com/us/trending/giannis-antetokounmpo-milwaukee-bucks-enter-pivotal-offseason-as-doc-rivers-steps-down-after-50-loss-season-nba-11776082651467.html,2026-04-13T13:56:28+00:00
LiveMint,2,Sinner beats Alcaraz in Monte Carlo Masters final to reclaim world No. 1 ranking,https://www.livemint.com/us/trending/jannik-sinner-beats-carlos-alcaraz-in-monte-carlo-masters-final-to-reclaim-world-no-1-ranking-11776019107875.html,2026-04-13T13:56:28+00:00
LiveMint,3,Dallas Cowboys safety Markquese Bell arrested on felony drug charge,https://www.livemint.com/us/trending/markquese-bell-arrested-on-felony-drug-charge-and-marijuana-possession-dallas-cowboys-safety-11775932691814.html,2026-04-13T13:56:28+00:00
LiveMint,4,Coachella 2026 kicks off with Sabrina Carpenter's performance,https://www.livemint.com/us/trending/coachella-2026-kicks-off-with-sabrina-carpenters-performance-from-justin-bieber-to-karol-g-check-weekend-schedule-11775875804562.html,2026-04-13T13:56:28+00:00
LiveMint,5,Apple Pay scam spreading fast in the US—Are you at risk?,https://www.livemint.com/us/trending/apple-pay-users-hit-by-scam-wave-across-the-us-here-s-how-victims-are-losing-their-money-11775768345740.html,2026-04-13T13:56:28+00:00
LiveMint,6,Afrika Bambaataa death: Hip-hop pioneer-DJ dies at 67 after cancer complications,https://www.livemint.com/us/trending/afrika-bambaataa-death-hip-hop-pioneer-and-dj-dies-at-67-after-cancer-complications-11775767596687.html,2026-04-13T13:56:28+00:00
LiveMint,7,"DOJ antitrust probe into NFL media rights: What it means for streaming, and more",https://www.livemint.com/us/trending/doj-antitrust-probe-into-nfl-media-rights-what-it-means-for-fans-streaming-and-tv-deals-11775760586179.html,2026-04-13T13:56:28+00:00
LiveMint,8,"Daniil Medvedev smashes racquet in shocking 6-0, 6-0 loss at Monte Carlo Masters",https://www.livemint.com/us/trending/daniil-medvedev-racquet-video-in-shocking-6-0-6-0-clay-defeat-to-matteo-berrettini-at-monte-carlo-masters-11775674478886.html,2026-04-13T13:56:28+00:00
LiveMint,9,"Konnor Griffin signs 9-year, $140 million contract extension with Pirates",https://www.livemint.com/us/trending/konnor-griffin-signs-record-9-year-140-million-contract-extension-with-pittsburgh-pirates-mlb-baseball-11775653782727.html,2026-04-13T13:56:28+00:00
LiveMint,10,JD Vance’s awkward moment: Trump sends call to voicemail during live rally,https://www.livemint.com/us/trending/jd-vance-s-awkward-moment-trump-sends-call-to-voicemail-during-live-rally-in-hungary-watch-11775589348677.html,2026-04-13T13:56:28+00:00
LiveMint,11,"Islanders fire Patrick Roy, hire Peter DeBoer as head coach amid playoff push",https://www.livemint.com/us/trending/patrick-roy-fired-by-new-york-islanders-hire-peter-deboer-as-head-coach-amid-playoff-push-nhl-hockey-11775415170584.html,2026-04-13T13:56:28+00:00
LiveMint,12,Geno Auriemma apologizes to South Carolina after outburst in women's Final Four,https://www.livemint.com/us/trending/geno-auriemma-apologizes-to-south-carolina-after-emotional-outburst-vs-dawn-staley-in-womens-final-four-11775394255637.html,2026-04-13T13:56:28+00:00
LiveMint,13,NCAA Final Four 2026: UConn vs Illinois and Michigan vs Arizona results,https://www.livemint.com/us/trending/ncaa-final-four-2026-results-what-happened-in-uconn-vs-illinois-and-michigan-vs-arizona-march-madness-semifinals-11775390782036.html,2026-04-13T13:56:28+00:00
LiveMint,14,NASA’s Artemis II astronauts face toilet problem; social media reacts with memes,https://www.livemint.com/us/trending/nasas-artemis-ii-astronauts-faces-toilet-problem-in-space-social-media-reacts-with-jokes-memes-blame-ice-for-this-to-11775363905958.html,2026-04-13T13:56:28+00:00
LiveMint,15,Man City thrash Liverpool 4-0 while Chelsea crush Port Vale 7-0 in FA Cup QFs,https://www.livemint.com/us/trending/manchester-city-vs-liverpool-4-0-chelsea-vs-port-vale-7-0-fa-cup-quarterfinals-11775328419465.html,2026-04-13T13:56:28+00:00
LiveMint,16,Juan Soto calf injury: Mets star to undergo MRI after early exit vs Giants,https://www.livemint.com/us/trending/juan-soto-calf-injury-new-york-mets-star-to-undergo-mri-after-early-exit-vs-san-francisco-giants-11775306968287.html,2026-04-13T13:56:28+00:00
LiveMint,17,New York teacher earning $90K turns to $55/hour side gig to repay student loans,https://www.livemint.com/us/trending/new-york-teacher-earning-90k-turns-to-55-hour-side-gig-to-repay-student-loans-11775314789062.html,2026-04-13T13:56:28+00:00
LiveMint,18,NCAA men's Final Four matchups: Schedule and key details,https://www.livemint.com/us/trending/uconn-vs-illinois-and-arizona-vs-michigan-2026-ncaa-mens-final-four-matchups-schedule-and-key-details-11775243799182.html,2026-04-13T13:56:28+00:00
LiveMint,19,Gennaro Gattuso steps down as Italy manager after 2026 World Cup qualifier,https://www.livemint.com/us/trending/gennaro-gattuso-steps-down-as-italy-manager-after-2026-world-cup-qualifier-heartbreak-11775221292115.html,2026-04-13T13:56:28+00:00
LiveMint,20,"Vanessa Trump frustrated with Tiger Woods’ behavior, puts him on notice",https://www.livemint.com/us/trending/vanessa-trump-frustrated-with-tiger-woods-behavior-puts-him-on-notice-stop-acting-like-a-teenager-grow-up-11775209989597.html,2026-04-13T13:56:28+00:00
LiveMint,21,What’s wrong with Tiger Woods? ‘Heartbreaking’ video leaves fans worried,https://www.livemint.com/us/trending/whats-wrong-with-tiger-woods-heartbreaking-video-after-dui-arrest-leaves-fans-worried-mental-health-is-real-11775191311157.html,2026-04-13T13:56:28+00:00
LiveMint,22,McDonald's drops new under $3 menu and $4 breakfast deal — Here’s what you get,https://www.livemint.com/us/trending/mcdonalds-drops-new-under-3-menu-and-4-breakfast-deal-here-s-what-you-can-get-11775157327207.html,2026-04-13T13:56:28+00:00
LiveMint,23,Rapper J. Cole joins China’s Nanjing Monkey Kings for pro basketball stint,https://www.livemint.com/us/trending/grammywinning-rapper-j-cole-joins-china-s-nanjing-monkey-kings-for-pro-basketball-stint-11775141367888.html,2026-04-13T13:56:28+00:00
LiveMint,24,April Fools’ Day 2026 deals: No-joke discounts from Dunkin' and more,https://www.livemint.com/us/trending/april-fools-day-2026-discounts-dunkin-checkers-rally-hooters-qdoba-artemis-ii-doughnut-11775054510320.html,2026-04-13T13:56:28+00:00
LiveMint,25,"Oracle employee, despite being laid off, remains positive: ‘It happens…'",https://www.livemint.com/us/trending/oracle-employee-despite-being-laid-off-remains-positive-it-happens-will-enjoy-sleeping-11775051244639.html,2026-04-13T13:56:28+00:00
LiveMint,26,Warren Buffett teams up with NBA star Stephen Curry for charity lunch auction,https://www.livemint.com/us/trending/warren-buffett-teams-up-with-nba-star-stephen-curry-for-charity-lunch-auction-berkshire-event-returns-in-2026-11774962320767.html,2026-04-13T13:56:28+00:00
LiveMint,27,Tiger Woods’ ex Kristin Smith breaks silence after ‘triggering’ DUI arrest,https://www.livemint.com/us/trending/tiger-woods-ex-kristin-smith-breaks-silence-after-triggering-dui-arrest-seeks-privacy-11774949316320.html,2026-04-13T13:56:28+00:00
LiveMint,28,"Sophie Turner injured, Tomb Raider series halts production temporarily",https://www.livemint.com/us/trending/sophie-turner-injured-tomb-raider-series-halts-production-temporarily-11774878671976.html,2026-04-13T13:56:28+00:00
LiveMint,29,Viral video of Kash Patel dancing? Here’s the truth behind the clip,https://www.livemint.com/us/trending/viral-video-of-kash-patel-dancing-here-s-the-truth-behind-the-clip-11774814955782.html,2026-04-13T13:56:28+00:00
LiveMint,30,"Arnold Schwarzenegger returns to gym—But this time, he’s coaching his son |Watch",https://www.livemint.com/us/trending/arnold-schwarzenegger-returns-to-gym-but-this-time-he-s-coaching-his-son-to-bodybuilding-glory-watch-11774816425352.html,2026-04-13T13:56:28+00:00
LiveMint,31,"Bachelorette star James McCoy Taylor arrested again, months after guilty plea",https://www.livemint.com/us/trending/bachelorette-star-james-mccoy-taylor-arrested-again-months-after-guilty-plea-11774189913536.html,2026-04-13T13:56:28+00:00
LiveMint,32,Comedian jokes about Jews’ expulsion: Social media reacts to viral video,https://www.livemint.com/us/trending/comedian-jokes-about-jews-expulsion-social-media-reacts-to-viral-video-using-antisemitic-talking-points-as-humor-11773998180773.html,2026-04-13T13:56:28+00:00
LiveMint,33,Who is Joseph Duggar? All about reality TV star arrested on abuse charges,https://www.livemint.com/us/trending/who-is-joseph-duggar-all-about-the-19-kids-and-counting-star-arrested-on-abuse-charges-11773894381944.html,2026-04-13T13:56:28+00:00
LiveMint,34,"St Patrick’s Day 2026: Date, history, meaning and traditions worldwide",https://www.livemint.com/us/trending/st-patrick-s-day-2026-date-history-meaning-and-traditions-worldwide-11773760629096.html,2026-04-13T13:56:28+00:00
LiveMint,35,Oscars 2026: What’s on the menu at official after-party for Hollywood A-listers?,https://www.livemint.com/us/trending/oscars-2026-what-s-on-the-menu-at-the-official-after-party-luxurious-food-desserts-and-drinks-for-hollywood-alisters-11773548247036.html,2026-04-13T13:56:28+00:00
LiveMint,36,"Meghan Markle: Harry’s wife faces backlash over $2,235 ticket for group photo",https://www.livemint.com/us/trending/meghan-markle-harry-s-wife-faces-backlash-over-2-235-vip-ticket-for-group-photo-she-s-a-nobody-who-tricked-a-prince-11773538916724.html,2026-04-13T13:56:28+00:00
LiveMint,37,Apple kicks off 50th anniversary with surprise performance by Alicia Keys in NY,https://www.livemint.com/us/trending/alicia-keys-turns-apples-grand-central-in-new-york-into-a-concert-venue-at-tech-giant-s-50th-anniversary-kickoff-11773508129097.html,2026-04-13T13:56:28+00:00
LiveMint,38,"Marco Rubio large shoe size stuns Internet, social media points to ‘sycophancy'",https://www.livemint.com/us/trending/marco-rubio-large-shoe-size-stuns-internet-social-media-points-to-sycophancy-idol-worship-among-trump-officials-11773470692943.html,2026-04-13T13:56:28+00:00
LiveMint,39,Was Bill Clinton about to push Hillary into running traffic? Watch viral video,https://www.livemint.com/us/trending/did-bill-clinton-almost-push-hillary-into-running-traffic-social-media-reacts-to-viral-video-hes-was-so-close-11773280988605.html,2026-04-13T13:56:28+00:00
LiveMint,40,Mark to Market,https://www.livemint.com/market/mark-to-market,2026-04-13T13:56:28+00:00
LiveMint,41,"Om Power Transmission IPO: Issue subscribed 3.3x on Day 03; NII portion sees strong demand, GMP signals flat listing",https://www.livemint.com/market/ipo/om-power-transmission-ipo-issue-subscribed-3-3x-on-day-03-nii-portion-sees-strong-demand-gmp-signals-flat-listing-11776084872485.html,2026-04-13T13:56:28+00:00
LiveMint,42,US stock market: Dow Jones futures drop 1% in after Trump’s Strait of Hormuz blockade warning,https://www.livemint.com/market/stock-market-news/us-stock-market-dow-jones-dips-1-in-pre-open-session-after-trumps-blockade-of-the-strait-of-hormuz-11776079817946.html,2026-04-13T13:56:28+00:00
LiveMint,43,GIFT wrapped: The unexpected second purpose of Gujarat's financial hub,https://www.livemint.com/market/gift-city-international-investments-lrs-nifty-11776076566568.html,2026-04-13T13:56:28+00:00
LiveMint,44,Patanjali Foods board to meet on this date to consider 2nd interim dividend for FY26. Check details,https://www.livemint.com/market/stock-market-news/patanjali-board-to-meet-on-this-date-to-consider-q4fy26-results-interim-dividend-check-details-11776078511861.html,2026-04-13T13:56:28+00:00
LiveMint,45,Embassy Developments shares hit lower circuit after finding no sellers for the six straight sessions,https://www.livemint.com/market/stock-market-news/embassy-developments-shares-hit-lower-circuit-after-finding-no-sellers-for-the-six-straight-sessions-11776076761671.html,2026-04-13T13:56:28+00:00
LiveMint,46,HPCL vs BPCL vs IOC: How will US-Iran war impact OMCs' profit & which stock to buy ahead of Q4 results?,https://www.livemint.com/market/stock-market-news/hpcl-vs-bpcl-vs-ioc-how-will-us-iran-war-impact-oil-psu-stocks-earnings-which-psu-oil-stock-to-buy-ahead-of-q4-11776076720775.html,2026-04-13T13:56:28+00:00
LiveMint,47,GT vs CSK IPL 2026 fixtures swapped: Know reason behind venue and timing changes for April 26 and May 21 matches,https://www.livemint.com/news/trends/gt-vs-csk-ipl-2026-fixtures-swapped-know-reason-behind-venue-and-timing-changes-for-april-26-and-may-21-matches-11776085774085.html,2026-04-13T13:56:28+00:00
LiveMint,48,"Quote of the day by Marilyn Monroe: ‘Imperfection is beauty, madness is genius…’",https://www.livemint.com/news/us-news/quote-of-the-day-by-marilyn-monroe-imperfection-is-beauty-madness-is-genius-11776085775694.html,2026-04-13T13:56:28+00:00
LiveMint,49,Kejriwal says he won’t get justice if same judge hears CBI plea against his release - ‘Was almost declared guilty’,https://www.livemint.com/news/kejriwal-says-he-won-t-get-justice-if-same-judge-hears-cbi-plea-against-his-release-was-almost-declared-guilty-11776085944941.html,2026-04-13T13:56:28+00:00
LiveMint,50,"Epstein survivor Juliette Bryant responds to Melania’s call for victim testimony, calls for Trump couple to testify",https://www.livemint.com/news/us-news/epstein-survivor-juliette-bryant-responds-to-melania-trum-s-call-for-victim-testimony-calls-for-trump-couple-to-testify-11776085648766.html,2026-04-13T13:56:28+00:00
LiveMint,51,‘Not in a complete deadlock': Mediators rush to revive US-Iran talks ahead of ceasefire deadline — report,https://www.livemint.com/news/world/not-in-a-complete-deadlock-mediators-rush-to-revive-us-iran-talks-ahead-of-ceasefire-deadline-report-11776083122122.html,2026-04-13T13:56:28+00:00
LiveMint,52,"Centre reassures domestic LPG supply normal, says online booking reached almost 99% amid Middle East tensions",https://www.livemint.com/news/india/centre-reassures-domestic-lpg-supply-normal-says-online-booking-reached-almost-99-amid-middle-east-tensions-11776081292709.html,2026-04-13T13:56:28+00:00
LiveMint,53,Salary Impact Tracker,https://www.livemint.com/tools-calculators/salary-impact-tracker,2026-04-13T13:56:28+00:00
LiveMint,54,"Nigerian ex-oil minister denies taking bribes for government contracts, during a trial in London",https://www.livemint.com/companies/nigerian-ex-oil-minister-denies-taking-bribes-for-government-contracts-during-a-trial-in-london-11776088351534.html,2026-04-13T13:56:28+00:00
LiveMint,55,"SpiceJet warns of ‘collapse’ in Delhi high court, seeks relief from ₹144.5 cr deposit in Maran dispute",https://www.livemint.com/companies/news/spicejet-collapse-warning-delhi-high-court-relief-from-deposit-maran-dispute-payment-deadline-11776065514032.html,2026-04-13T13:56:28+00:00
LiveMint,56,Humyn Labs expands data collection for physical AI with $20 mn push,https://www.livemint.com/companies/ai-training-data-firm-humyn-commits-20-mn-to-expand-operations-eyes-100-mn-arr-by-2026end-11776063431258.html,2026-04-13T13:56:28+00:00
LiveMint,57,Mint Explainer | How the West Asia conflict and tariff hike delays could affect telecom operators,https://www.livemint.com/companies/west-asia-conflict-tariff-hike-delays-indian-telecom-operators-higher-fuel-costs-diesel-prices-telecom-towers-earnings-11776061392503.html,2026-04-13T13:56:28+00:00
LiveMint,58,Q4 preview: earnings remain fragile as margins crack under cost pressures,https://www.livemint.com/companies/india-inc-q4-preview-earnings-remain-fragile-margins-crack-under-cost-pressures-11776058789063.html,2026-04-13T13:56:28+00:00
LiveMint,59,"Mint Explainer | Why India Inc.'s climate pledges rise, but execution and credibility lag",https://www.livemint.com/industry/india-inc-climate-pledges-rise-execution-credibility-net-zero-emissions-carbon-neutrality-11776055718615.html,2026-04-13T13:56:28+00:00
LiveMint,60,Ask Mint Money,https://www.livemint.com/money/ask-mint-money,2026-04-13T13:56:28+00:00
LiveMint,61,Zero tax liability? 5 reasons filing nil income tax return in FY 2025-26 is a smart move,https://www.livemint.com/money/personal-finance/zero-tax-liability-5-reasons-filing-nil-income-tax-return-in-fy-2025-26-is-a-smart-move-11776080505380.html,2026-04-13T13:56:28+00:00
LiveMint,62,New labour laws: Do changes impact your in-hand salary and tax regime? We ask experts…,https://www.livemint.com/money/personal-finance/new-labour-laws-2025-do-codes-change-impact-your-in-hand-salary-and-tax-regime-ask-experts-faqs-retirement-savings-money-11776078687330.html,2026-04-13T13:56:28+00:00
LiveMint,63,"Car loan interest in April 2026: Compare latest rates of SBI, HDFC, ICICI and PNB, processing fees, EMIs and more",https://www.livemint.com/money/personal-finance/car-loan-interest-in-april-2026-compare-latest-rates-of-sbi-hdfc-icici-and-pnb-processing-charges-emis-and-more-11776073076118.html,2026-04-13T13:56:28+00:00
LiveMint,64,A car lease in CTC helps reduce your tax outgo. Here's how,https://www.livemint.com/money/personal-finance/car-lease-ctc-new-tax-regime-india-hra-lta-variable-pay-salary-11776066640829.html,2026-04-13T13:56:28+00:00
LiveMint,65,Public Provident Fund: How many times can you extend your PPF account after maturity?,https://www.livemint.com/money/personal-finance/public-provident-fund-how-many-times-can-you-extend-your-ppf-account-after-maturity-15-year-tenure-extension-5-yr-blocks-11776071694573.html,2026-04-13T13:56:28+00:00
LiveMint,66,"Short-term pain, long-term gain: what the numbers say",https://www.livemint.com/money/personal-finance/short-term-pain-long-term-gain-what-the-numbers-say-11776061586808.html,2026-04-13T13:56:28+00:00
LiveMint,67,Humanoid robots show off their language and boxing skills in Hong Kong,https://www.livemint.com/technology/humanoid-robots-show-off-their-language-and-boxing-skills-in-hong-kong-11776084135171.html,2026-04-13T13:56:28+00:00
LiveMint,68,"How to use ChatGPT, Gemini and Claude as your personal finance assistant? Check exact AI prompts",https://www.livemint.com/technology/tech-news/how-to-use-chatgpt-gemini-and-claude-as-your-personal-finance-assistant-cexact-ai-prompts-you-need-to-slash-your-month-11776071992347.html,2026-04-13T13:56:28+00:00
LiveMint,69,Meta is building a 3D AI clone of Mark Zuckerberg so employees feel more connected to the CEO: Report,https://www.livemint.com/technology/tech-news/meta-is-building-a-3d-ai-clone-of-mark-zuckerberg-so-employees-feel-more-connected-to-the-ceo-report-11776066622528.html,2026-04-13T13:56:28+00:00
LiveMint,70,"Redmi A7 Pro 5G with 120Hz display and 6300 mAh battery launched in India, price starts at ₹12,499",https://www.livemint.com/technology/gadgets/redmi-a7-pro-5g-with-120hz-display-and-6300-mah-battery-launched-in-india-price-starts-at-rs-12499-11776063558374.html,2026-04-13T13:56:28+00:00
LiveMint,71,India unveils new security standards for its digital payments system to drive global adoption,https://www.livemint.com/economy/india-new-standards-digital-payments-biometric-authentication-qr-code-payments-digital-currency-security-global-push-11776055169444.html,2026-04-13T13:56:28+00:00
LiveMint,72,"Infinix Note 60 Pro with Active Matrix Display and 6,500mAh battery launched in India, price starts at ₹31,999",https://www.livemint.com/technology/gadgets/infinix-note-60-pro-with-active-matrix-display-and-6-500mah-battery-launched-in-india-price-starts-at-rs-31999-11776055906880.html,2026-04-13T13:56:28+00:00
LiveMint,73,IPL 2026 Schedule,https://www.livemint.com/sports/cricket-news/ipl-schedule,2026-04-13T13:56:28+00:00
LiveMint,74,Orange Cap in IPL 2026,https://www.livemint.com/sports/cricket-news/ipl-orange-cap,2026-04-13T13:56:28+00:00
LiveMint,75,Purple Cap in IPL 2026,https://www.livemint.com/sports/cricket-news/ipl-purple-cap,2026-04-13T13:56:28+00:00
LiveMint,76,IPL 2026 Points Table,https://www.livemint.com/sports/cricket-news/ipl-points-table,2026-04-13T13:56:28+00:00
