source,rank,headline,link,collected_at_iso
Indian Express,1,Trending in India,https://indianexpress.com/section/trending/trending-in-india/,2026-04-14T06:04:36+00:00
Indian Express,2,This is Serious,https://indianexpress.com/section/trending/this-is-serious/,2026-04-14T06:04:36+00:00
Indian Express,3,Praful Hinge IPL debut Instrgam followers,https://indianexpress.com/article/trending/trending-in-india/praful-hinge-4-wickets-srh-vs-rr-ipl-debut-instagram-followers-viral-video-10635334/,2026-04-14T06:04:36+00:00
Indian Express,4,"Vijay immediately got off the bicycle, and security personnel came running towards him within moments",https://indianexpress.com/article/trending/trending-in-india/tvk-chief-vijay-jumps-off-bicycle-during-kanyakumari-election-rally-man-throws-flower-ball-viral-video-10635332/,2026-04-14T06:04:36+00:00
Indian Express,5,Arijit Singh concert HCL Group 50 year-celebration,https://indianexpress.com/article/trending/trending-in-india/hcl-50th-anniversary-arijit-singh-concert-free-metro-10634721/,2026-04-14T06:04:36+00:00
Indian Express,6,Christina Koch dog reunion video goes viral after Artemis II mission,https://indianexpress.com/article/trending/trending-globally/christina-koch-dog-reunion-artemis-ii-viral-video-10634203/,2026-04-14T06:04:36+00:00
Indian Express,7,2/10 for Delhi: Netizens agree as Russian tourist’s safety ratings for Indian cities go viral,https://indianexpress.com/article/trending/trending-in-india/russian-tourist-safety-rating-india-delhi-viral-video-10634030/,2026-04-14T06:04:36+00:00
Indian Express,8,The viral video captures the critical moment when the athletes were sprinting at full speed,https://indianexpress.com/article/trending/trending-in-india/athletics-federation-slammed-after-man-walks-onto-running-track-in-delhi-during-200m-final-10633569/,2026-04-14T06:04:36+00:00
Indian Express,9,Asha Bhosle sand art tribute,https://indianexpress.com/article/trending/trending-in-india/asha-bhosle-death-tribute-sudarsan-pattnaik-sand-art-10633428/,2026-04-14T06:04:36+00:00
Indian Express,10,"CEO texted employee on wedding day, triggers backlash",https://indianexpress.com/article/trending/trending-globally/us-ceo-issues-public-apology-after-messaging-employee-on-his-wedding-day-10632972/,2026-04-14T06:04:36+00:00
Indian Express,11,Boss sends mangoes to his employee,https://indianexpress.com/article/trending/trending-in-india/london-boss-sends-surprise-gift-to-mumbai-woman-who-missed-good-quality-mangoes-10632704/,2026-04-14T06:04:36+00:00
Indian Express,12,Parakeet Bebe snorkelling video,https://indianexpress.com/article/trending/trending-globally/meet-bebe-world-first-snorkelling-parakeet-viral-bird-10632480/,2026-04-14T06:04:36+00:00
Indian Express,13,Digital arrest scam in UP,https://indianexpress.com/article/trending/trending-in-india/digital-arrest-scam-bareilly-student-saves-parents-10632297/,2026-04-14T06:04:36+00:00
Indian Express,14,She shared that lunchtime proved to be the toughest part due to steep prices.,https://indianexpress.com/article/trending/trending-in-india/bengaluru-500-day-challenge-budget-survival-10632231/,2026-04-14T06:04:36+00:00
Indian Express,15,Most Valuable Banks in India in 2026,https://indianexpress.com/article/trending/top-10-listing/top-10-most-valuable-banks-in-india-in-2026-10631398/,2026-04-14T06:04:36+00:00
Indian Express,16,Shantanu Naidu viral video,https://indianexpress.com/article/trending/trending-in-india/shantanu-naidu-viral-video-horse-cruelty-indian-weddings-baraat-10631327/,2026-04-14T06:04:36+00:00
Indian Express,17,Ichiro Suzuki statue broken bay,https://indianexpress.com/article/trending/trending-globally/watch-ichiro-suzuki-statue-reveal-broken-bat-seattle-mariners-video-10631296/,2026-04-14T06:04:36+00:00
Indian Express,18,Gen Z work culture,https://indianexpress.com/article/trending/trending-in-india/gen-z-work-culture-linkedin-post-workplace-boundaries-debate-overtime-pay-burnout-10631091/,2026-04-14T06:04:36+00:00
Indian Express,19,Kunal Kamra apology row,https://indianexpress.com/article/trending/trending-in-india/kunal-kamra-refuses-apology-maharashtra-privileges-committee-eknath-shinde-parody-song-10630923/,2026-04-14T06:04:36+00:00
Indian Express,20,Bangkok to India flight dirty video,https://indianexpress.com/article/trending/trending-in-india/bangkok-india-flight-dirty-video-indian-passenger-civic-sense-10630788/,2026-04-14T06:04:36+00:00
Indian Express,21,Top 10 most valuable power companies in the world,https://indianexpress.com/article/trending/top-10-listing/top-10-most-valuable-power-companies-in-the-world-2026-10629824/,2026-04-14T06:04:36+00:00
Indian Express,22,Kerala voting controversy,https://indianexpress.com/article/trending/trending-in-india/kerala-voting-controversy-thrissur-woman-bandaged-finger-indelible-ink-row-10629778/,2026-04-14T06:04:36+00:00
Indian Express,23,Gurgaon founder firing employee,https://indianexpress.com/article/trending/trending-in-india/gurgaon-founder-fires-employee-over-text-no-notice-period-startup-work-culture-debate-10629584/,2026-04-14T06:04:36+00:00
Indian Express,24,Sanju Samson gifts phone to fan,https://indianexpress.com/article/trending/trending-in-india/sanju-samson-gifts-new-phone-fan-palakkad-kerala-ipl-2026-csk-10629238/,2026-04-14T06:04:36+00:00
Indian Express,25,Anant Ambani birthday,https://indianexpress.com/article/trending/trending-in-india/anant-ambani-31st-birthday-bandra-worli-sea-link-tribute-viral-video-10629005/,2026-04-14T06:04:36+00:00
Indian Express,26,Top 10 export countries in the world,https://indianexpress.com/article/trending/top-10-listing/top-10-export-countries-in-the-world-2025-26-10628094/,2026-04-14T06:04:36+00:00
Indian Express,27,KitKat chocolate heist,https://indianexpress.com/article/trending/trending-globally/kitkat-canada-chocolate-heist-convoy-security-viral-video-10628022/,2026-04-14T06:04:36+00:00
LiveMint,1,Jonathan Quick retirement: Rangers veteran goaltender to make final NHL start,https://www.livemint.com/us/trending/jonathan-quick-retirement-new-york-rangers-veteran-goaltender-to-make-final-nhl-start-against-florida-panthers-11776101712321.html,2026-04-14T06:04:36+00:00
LiveMint,2,"NFL Draft 2026: Dates, location, top prospects, order and other details",https://www.livemint.com/us/trending/nfl-draft-2026-dates-location-top-prospects-order-heres-everything-you-need-to-know-11776088776110.html,2026-04-14T06:04:36+00:00
LiveMint,3,Giannis Antetokounmpo and Bucks enter pivotal offseason as Doc Rivers steps down,https://www.livemint.com/us/trending/giannis-antetokounmpo-milwaukee-bucks-enter-pivotal-offseason-as-doc-rivers-steps-down-after-50-loss-season-nba-11776082651467.html,2026-04-14T06:04:36+00:00
LiveMint,4,Sinner beats Alcaraz in Monte Carlo Masters final to reclaim world No. 1 ranking,https://www.livemint.com/us/trending/jannik-sinner-beats-carlos-alcaraz-in-monte-carlo-masters-final-to-reclaim-world-no-1-ranking-11776019107875.html,2026-04-14T06:04:36+00:00
LiveMint,5,Dallas Cowboys safety Markquese Bell arrested on felony drug charge,https://www.livemint.com/us/trending/markquese-bell-arrested-on-felony-drug-charge-and-marijuana-possession-dallas-cowboys-safety-11775932691814.html,2026-04-14T06:04:36+00:00
LiveMint,6,Coachella 2026 kicks off with Sabrina Carpenter's performance,https://www.livemint.com/us/trending/coachella-2026-kicks-off-with-sabrina-carpenters-performance-from-justin-bieber-to-karol-g-check-weekend-schedule-11775875804562.html,2026-04-14T06:04:36+00:00
LiveMint,7,Apple Pay scam spreading fast in the US—Are you at risk?,https://www.livemint.com/us/trending/apple-pay-users-hit-by-scam-wave-across-the-us-here-s-how-victims-are-losing-their-money-11775768345740.html,2026-04-14T06:04:36+00:00
LiveMint,8,Afrika Bambaataa death: Hip-hop pioneer-DJ dies at 67 after cancer complications,https://www.livemint.com/us/trending/afrika-bambaataa-death-hip-hop-pioneer-and-dj-dies-at-67-after-cancer-complications-11775767596687.html,2026-04-14T06:04:36+00:00
LiveMint,9,"DOJ antitrust probe into NFL media rights: What it means for streaming, and more",https://www.livemint.com/us/trending/doj-antitrust-probe-into-nfl-media-rights-what-it-means-for-fans-streaming-and-tv-deals-11775760586179.html,2026-04-14T06:04:36+00:00
LiveMint,10,"Daniil Medvedev smashes racquet in shocking 6-0, 6-0 loss at Monte Carlo Masters",https://www.livemint.com/us/trending/daniil-medvedev-racquet-video-in-shocking-6-0-6-0-clay-defeat-to-matteo-berrettini-at-monte-carlo-masters-11775674478886.html,2026-04-14T06:04:36+00:00
LiveMint,11,"Konnor Griffin signs 9-year, $140 million contract extension with Pirates",https://www.livemint.com/us/trending/konnor-griffin-signs-record-9-year-140-million-contract-extension-with-pittsburgh-pirates-mlb-baseball-11775653782727.html,2026-04-14T06:04:36+00:00
LiveMint,12,JD Vance’s awkward moment: Trump sends call to voicemail during live rally,https://www.livemint.com/us/trending/jd-vance-s-awkward-moment-trump-sends-call-to-voicemail-during-live-rally-in-hungary-watch-11775589348677.html,2026-04-14T06:04:36+00:00
LiveMint,13,"Islanders fire Patrick Roy, hire Peter DeBoer as head coach amid playoff push",https://www.livemint.com/us/trending/patrick-roy-fired-by-new-york-islanders-hire-peter-deboer-as-head-coach-amid-playoff-push-nhl-hockey-11775415170584.html,2026-04-14T06:04:36+00:00
LiveMint,14,Geno Auriemma apologizes to South Carolina after outburst in women's Final Four,https://www.livemint.com/us/trending/geno-auriemma-apologizes-to-south-carolina-after-emotional-outburst-vs-dawn-staley-in-womens-final-four-11775394255637.html,2026-04-14T06:04:36+00:00
LiveMint,15,NCAA Final Four 2026: UConn vs Illinois and Michigan vs Arizona results,https://www.livemint.com/us/trending/ncaa-final-four-2026-results-what-happened-in-uconn-vs-illinois-and-michigan-vs-arizona-march-madness-semifinals-11775390782036.html,2026-04-14T06:04:36+00:00
LiveMint,16,NASA’s Artemis II astronauts face toilet problem; social media reacts with memes,https://www.livemint.com/us/trending/nasas-artemis-ii-astronauts-faces-toilet-problem-in-space-social-media-reacts-with-jokes-memes-blame-ice-for-this-to-11775363905958.html,2026-04-14T06:04:36+00:00
LiveMint,17,Man City thrash Liverpool 4-0 while Chelsea crush Port Vale 7-0 in FA Cup QFs,https://www.livemint.com/us/trending/manchester-city-vs-liverpool-4-0-chelsea-vs-port-vale-7-0-fa-cup-quarterfinals-11775328419465.html,2026-04-14T06:04:36+00:00
LiveMint,18,Juan Soto calf injury: Mets star to undergo MRI after early exit vs Giants,https://www.livemint.com/us/trending/juan-soto-calf-injury-new-york-mets-star-to-undergo-mri-after-early-exit-vs-san-francisco-giants-11775306968287.html,2026-04-14T06:04:36+00:00
LiveMint,19,New York teacher earning $90K turns to $55/hour side gig to repay student loans,https://www.livemint.com/us/trending/new-york-teacher-earning-90k-turns-to-55-hour-side-gig-to-repay-student-loans-11775314789062.html,2026-04-14T06:04:36+00:00
LiveMint,20,NCAA men's Final Four matchups: Schedule and key details,https://www.livemint.com/us/trending/uconn-vs-illinois-and-arizona-vs-michigan-2026-ncaa-mens-final-four-matchups-schedule-and-key-details-11775243799182.html,2026-04-14T06:04:36+00:00
LiveMint,21,Gennaro Gattuso steps down as Italy manager after 2026 World Cup qualifier,https://www.livemint.com/us/trending/gennaro-gattuso-steps-down-as-italy-manager-after-2026-world-cup-qualifier-heartbreak-11775221292115.html,2026-04-14T06:04:36+00:00
LiveMint,22,"Vanessa Trump frustrated with Tiger Woods’ behavior, puts him on notice",https://www.livemint.com/us/trending/vanessa-trump-frustrated-with-tiger-woods-behavior-puts-him-on-notice-stop-acting-like-a-teenager-grow-up-11775209989597.html,2026-04-14T06:04:36+00:00
LiveMint,23,What’s wrong with Tiger Woods? ‘Heartbreaking’ video leaves fans worried,https://www.livemint.com/us/trending/whats-wrong-with-tiger-woods-heartbreaking-video-after-dui-arrest-leaves-fans-worried-mental-health-is-real-11775191311157.html,2026-04-14T06:04:36+00:00
LiveMint,24,McDonald's drops new under $3 menu and $4 breakfast deal — Here’s what you get,https://www.livemint.com/us/trending/mcdonalds-drops-new-under-3-menu-and-4-breakfast-deal-here-s-what-you-can-get-11775157327207.html,2026-04-14T06:04:36+00:00
LiveMint,25,Rapper J. Cole joins China’s Nanjing Monkey Kings for pro basketball stint,https://www.livemint.com/us/trending/grammywinning-rapper-j-cole-joins-china-s-nanjing-monkey-kings-for-pro-basketball-stint-11775141367888.html,2026-04-14T06:04:36+00:00
LiveMint,26,April Fools’ Day 2026 deals: No-joke discounts from Dunkin' and more,https://www.livemint.com/us/trending/april-fools-day-2026-discounts-dunkin-checkers-rally-hooters-qdoba-artemis-ii-doughnut-11775054510320.html,2026-04-14T06:04:36+00:00
LiveMint,27,"Oracle employee, despite being laid off, remains positive: ‘It happens…'",https://www.livemint.com/us/trending/oracle-employee-despite-being-laid-off-remains-positive-it-happens-will-enjoy-sleeping-11775051244639.html,2026-04-14T06:04:36+00:00
LiveMint,28,Warren Buffett teams up with NBA star Stephen Curry for charity lunch auction,https://www.livemint.com/us/trending/warren-buffett-teams-up-with-nba-star-stephen-curry-for-charity-lunch-auction-berkshire-event-returns-in-2026-11774962320767.html,2026-04-14T06:04:36+00:00
LiveMint,29,Tiger Woods’ ex Kristin Smith breaks silence after ‘triggering’ DUI arrest,https://www.livemint.com/us/trending/tiger-woods-ex-kristin-smith-breaks-silence-after-triggering-dui-arrest-seeks-privacy-11774949316320.html,2026-04-14T06:04:36+00:00
LiveMint,30,"Sophie Turner injured, Tomb Raider series halts production temporarily",https://www.livemint.com/us/trending/sophie-turner-injured-tomb-raider-series-halts-production-temporarily-11774878671976.html,2026-04-14T06:04:36+00:00
LiveMint,31,Viral video of Kash Patel dancing? Here’s the truth behind the clip,https://www.livemint.com/us/trending/viral-video-of-kash-patel-dancing-here-s-the-truth-behind-the-clip-11774814955782.html,2026-04-14T06:04:36+00:00
LiveMint,32,"Arnold Schwarzenegger returns to gym—But this time, he’s coaching his son |Watch",https://www.livemint.com/us/trending/arnold-schwarzenegger-returns-to-gym-but-this-time-he-s-coaching-his-son-to-bodybuilding-glory-watch-11774816425352.html,2026-04-14T06:04:36+00:00
LiveMint,33,"Bachelorette star James McCoy Taylor arrested again, months after guilty plea",https://www.livemint.com/us/trending/bachelorette-star-james-mccoy-taylor-arrested-again-months-after-guilty-plea-11774189913536.html,2026-04-14T06:04:36+00:00
LiveMint,34,Comedian jokes about Jews’ expulsion: Social media reacts to viral video,https://www.livemint.com/us/trending/comedian-jokes-about-jews-expulsion-social-media-reacts-to-viral-video-using-antisemitic-talking-points-as-humor-11773998180773.html,2026-04-14T06:04:36+00:00
LiveMint,35,Who is Joseph Duggar? All about reality TV star arrested on abuse charges,https://www.livemint.com/us/trending/who-is-joseph-duggar-all-about-the-19-kids-and-counting-star-arrested-on-abuse-charges-11773894381944.html,2026-04-14T06:04:36+00:00
LiveMint,36,"St Patrick’s Day 2026: Date, history, meaning and traditions worldwide",https://www.livemint.com/us/trending/st-patrick-s-day-2026-date-history-meaning-and-traditions-worldwide-11773760629096.html,2026-04-14T06:04:36+00:00
LiveMint,37,Oscars 2026: What’s on the menu at official after-party for Hollywood A-listers?,https://www.livemint.com/us/trending/oscars-2026-what-s-on-the-menu-at-the-official-after-party-luxurious-food-desserts-and-drinks-for-hollywood-alisters-11773548247036.html,2026-04-14T06:04:36+00:00
LiveMint,38,"Meghan Markle: Harry’s wife faces backlash over $2,235 ticket for group photo",https://www.livemint.com/us/trending/meghan-markle-harry-s-wife-faces-backlash-over-2-235-vip-ticket-for-group-photo-she-s-a-nobody-who-tricked-a-prince-11773538916724.html,2026-04-14T06:04:36+00:00
LiveMint,39,Apple kicks off 50th anniversary with surprise performance by Alicia Keys in NY,https://www.livemint.com/us/trending/alicia-keys-turns-apples-grand-central-in-new-york-into-a-concert-venue-at-tech-giant-s-50th-anniversary-kickoff-11773508129097.html,2026-04-14T06:04:36+00:00
LiveMint,40,Mark to Market,https://www.livemint.com/market/mark-to-market,2026-04-14T06:04:36+00:00
LiveMint,41,Stock Market Crash: Is it the right time for long-term investors to get greedy?,https://www.livemint.com/market/stock-market-news/stock-market-crash-is-it-the-right-time-for-long-term-investors-to-get-greedy-11776075247457.html,2026-04-14T06:04:36+00:00
LiveMint,42,Shares to buy or sell: Chandan Taparia of Motilal Oswal recommends three stocks to buy tomorrow - 15 April 2026,https://www.livemint.com/market/stock-market-news/shares-to-buy-or-sell-chandan-taparia-of-motilal-oswal-recommends-three-stocks-to-buy-tomorrow-15-april-2026-11776142855110.html,2026-04-14T06:04:36+00:00
LiveMint,43,"From National Aluminium, Hind Copper to MCX: 7 Nifty 500 stocks surge over 150% in 1 year despite market volatility",https://www.livemint.com/market/stock-market-news/from-national-aluminium-hindustan-copper-to-mcx-7-nifty-500-stocks-surge-150-in-1-year-despite-market-volatility-11776138755081.html,2026-04-14T06:04:36+00:00
LiveMint,44,Silver price crash alert! White metal cracks ₹2 lakh from peak: How should investors approach this dip?,https://www.livemint.com/market/commodities/silver-price-crash-alert-white-metal-cracks-rs-2-lakh-from-peak-how-should-investors-approach-this-dip-buy-or-sell-11776138347286.html,2026-04-14T06:04:36+00:00
LiveMint,45,"Gold, silver prices today: Check retail rates of 24K, 22K gold, 999 silver on 14 April in Delhi, Mumbai, Pune, others",https://www.livemint.com/market/commodities/gold-silver-prices-today-check-retail-rates-of-24k-22k-gold-999-silver-on-14-april-in-delhi-mumbai-pune-kolkata-11776139237285.html,2026-04-14T06:04:36+00:00
LiveMint,46,Bitcoin hits four-week high on US-Iran ceasefire hopes. Where is crypto headed?,https://www.livemint.com/market/cryptocurrency/bitcoin-rises-to-a-four-week-high-on-renewed-hopes-of-us-iran-ceasefire-talks-where-is-crypto-headed-11776138875242.html,2026-04-14T06:04:36+00:00
LiveMint,47,"Quote of the Day by Jennifer Lawrence, a different take on motivation: ‘I jumped out the back of a bus because…’",https://www.livemint.com/news/us-news/quote-of-the-day-14-april-2026-jennifer-lawrence-life-success-motivation-11776145565281.html,2026-04-14T06:04:36+00:00
LiveMint,48,"Petrol, diesel prices on 14 April in your city: Fuel rates today in Delhi, Mumbai, Chennai, Kolkata, Bengaluru",https://www.livemint.com/news/india/petrol-diesel-prices-on-14-april-in-your-city-fuel-rates-today-in-delhi-mumbai-chennai-kolkata-bengaluru-11776142588435.html,2026-04-14T06:04:36+00:00
LiveMint,49,Pay cuts forced him out of a 30-year journalism career — his next job pays 3x more; All you need to know,https://www.livemint.com/news/trends/pay-cuts-forced-him-out-of-a-30-year-journalism-career-his-next-job-pays-3x-more-all-you-need-to-know-11776135648852.html,2026-04-14T06:04:36+00:00
LiveMint,50,Uttar Pradesh approves 21% wage hike for Noida & Ghaziabad workers after violent protests,https://www.livemint.com/news/india/uttar-pradesh-approves-21-per-cent-wage-hike-for-noida-ghaziabad-worker-after-violent-protests-11776142123990.html,2026-04-14T06:04:36+00:00
LiveMint,51,"Praful Hinge’s fairytale IPL debut sparks 9,900% Instagram surge, opens doors to brand deals worth lakhs",https://www.livemint.com/news/trends/praful-hinge-s-fairytale-ipl-debut-sparks-9-900-instagram-surge-opens-doors-to-brand-deals-worth-lakhs-11776139156949.html,2026-04-14T06:04:36+00:00
LiveMint,52,Salary Impact Tracker,https://www.livemint.com/tools-calculators/salary-impact-tracker,2026-04-14T06:04:36+00:00
LiveMint,53,"BharatPe co-founder, Shashvat Nakrani steps back to build something new",https://www.livemint.com/companies/news/bharatpe-co-founder-shashvat-nakrani-steps-away-from-day-to-day-operations-to-explore-new-ideas-and-ventures-11776139659547.html,2026-04-14T06:04:36+00:00
LiveMint,54,Amazon worker dies on warehouse floor; colleagues continue working around his body – ‘Let’s get back to work’,https://www.livemint.com/companies/amazon-worker-died-on-warehouse-floor-as-his-colleagues-kept-working-for-over-an-hour-11776137787662.html,2026-04-14T06:04:36+00:00
LiveMint,55,JSW Group’s auto debut gains traction as India-China business ties thaw,https://www.livemint.com/companies/jsw-mg-motor-india-china-ties-press-note-3-auto-venture-11776071225893.html,2026-04-14T06:04:36+00:00
LiveMint,56,GRB bets beyond ghee as value-added dairy heats up competition,https://www.livemint.com/companies/news/after-42-years-of-ghee-grb-looks-for-its-next-growth-engine-11776064416176.html,2026-04-14T06:04:36+00:00
LiveMint,57,"Nodwin Gaming eyes IPO momentum, inducts Manish Agarwal to board",https://www.livemint.com/companies/nodwin-gaming-eyes-ipo-momentum-inducts-manish-agarwal-board-11776066788697.html,2026-04-14T06:04:36+00:00
LiveMint,58,World Liberty investor Justin Sun claims Trump crypto venture secretly installed tool to freeze user holdings,https://www.livemint.com/companies/world-liberty-investor-justin-sun-claims-trump-crypto-venture-secretly-installed-tool-to-freeze-user-holdings-11776108040066.html,2026-04-14T06:04:36+00:00
LiveMint,59,Ask Mint Money,https://www.livemint.com/money/ask-mint-money,2026-04-14T06:04:36+00:00
LiveMint,60,The great FPI exit: Why this may be a long-term opportunity,https://www.livemint.com/money/personal-finance/the-great-fpi-exit-long-term-opportunity-indian-equities-west-asia-war-11776089592810.html,2026-04-14T06:04:36+00:00
LiveMint,61,"TDS, TCS changes explained: What NRIs, students, travellers and investors should know in FY 2026",https://www.livemint.com/money/personal-finance/tds-tcs-changes-explained-what-nris-students-travellers-and-investors-should-know-in-fy-2026-11776133443096.html,2026-04-14T06:04:36+00:00
LiveMint,62,Overseas equity mutual funds outperform as Indian stock market slumps,https://www.livemint.com/money/personal-finance/overseas-equity-mutual-funds-outperform-as-indian-stock-market-slumps-11776135933225.html,2026-04-14T06:04:36+00:00
LiveMint,63,"ITR Filing 2026: Who pays tax on property, gifts and asset transfers in India? Key rules explained",https://www.livemint.com/money/personal-finance/itr-filing-2026-who-pays-tax-on-property-gifts-and-asset-transfers-in-india-key-rules-explained-11776128849264.html,2026-04-14T06:04:36+00:00
LiveMint,64,"How to ensure your retirement savings sustain you through inflation, risk and other uncertainties",https://www.livemint.com/money/personal-finance/how-ensure-your-retirement-savings-sustain-through-medical-inflation-lifestyle-risks-cost-of-living-financial-planning-11776085019184.html,2026-04-14T06:04:36+00:00
LiveMint,65,SIP and SWP: From auto-debits to regular deposits — Here's what investors should know,https://www.livemint.com/money/personal-finance/sip-swp-mutual-fund-investment-auto-debit-regular-deposit-what-investors-should-know-systematic-investment-plan-withdraw-11776084230077.html,2026-04-14T06:04:36+00:00
LiveMint,66,Hackers breach Booking.com as Dutch travel giant warns users over stolen data,https://www.livemint.com/technology/tech-news/hackers-breach-booking-com-as-dutch-travel-giant-warns-users-over-stolen-data-11776138951940.html,2026-04-14T06:04:36+00:00
LiveMint,67,"OpenAI leaked memo slams Anthropic: ChatGPT maker accuses rival of ‘fear-based’ AI approach, reveals report",https://www.livemint.com/technology/tech-news/openai-leaked-memo-slams-anthropic-chatgpt-maker-accuses-rival-of-fear-based-ai-approach-reveals-report-11776136226214.html,2026-04-14T06:04:36+00:00
LiveMint,68,"Motorola teases Edge 70 Pro India launch teased: Expected specs, price, and release timeline",https://www.livemint.com/technology/gadgets/motorola-teases-edge-70-pro-india-launch-teased-expected-specs-price-and-release-timeline-11776129951039.html,2026-04-14T06:04:36+00:00
LiveMint,69,"Anthropic talking to the Trump administration about its next AI model, co-founder says",https://www.livemint.com/technology/anthropic-talking-to-the-trump-administration-about-its-next-ai-model-co-founder-says-11776107367663.html,2026-04-14T06:04:36+00:00
LiveMint,70,Humanoid robots show off their language and boxing skills in Hong Kong,https://www.livemint.com/technology/humanoid-robots-show-off-their-language-and-boxing-skills-in-hong-kong-11776084135171.html,2026-04-14T06:04:36+00:00
LiveMint,71,"How to use ChatGPT, Gemini and Claude as your personal finance assistant? Check exact AI prompts",https://www.livemint.com/technology/tech-news/how-to-use-chatgpt-gemini-and-claude-as-your-personal-finance-assistant-cexact-ai-prompts-you-need-to-slash-your-month-11776071992347.html,2026-04-14T06:04:36+00:00
LiveMint,72,IPL 2026 Schedule,https://www.livemint.com/sports/cricket-news/ipl-schedule,2026-04-14T06:04:36+00:00
LiveMint,73,Orange Cap in IPL 2026,https://www.livemint.com/sports/cricket-news/ipl-orange-cap,2026-04-14T06:04:36+00:00
LiveMint,74,Purple Cap in IPL 2026,https://www.livemint.com/sports/cricket-news/ipl-purple-cap,2026-04-14T06:04:36+00:00
LiveMint,75,IPL 2026 Points Table,https://www.livemint.com/sports/cricket-news/ipl-points-table,2026-04-14T06:04:36+00:00
LiveMint,76,IFSC Code Finder,https://www.livemint.com/ifsc-code,2026-04-14T06:04:36+00:00
LiveMint,77,Income Tax Calculator,https://www.livemint.com/tools-calculators/income-tax-calculator,2026-04-14T06:04:36+00:00
LiveMint,78,Gold Rate Today,https://www.livemint.com/gold-prices,2026-04-14T06:04:36+00:00
LiveMint,79,Gold Rate in Delhi,https://www.livemint.com/gold-prices/delhi,2026-04-14T06:04:36+00:00
