source,rank,headline,link,collected_at_iso
Indian Express,1,Trending in India,https://indianexpress.com/section/trending/trending-in-india/,2026-04-03T02:54:19+00:00
Indian Express,2,This is Serious,https://indianexpress.com/section/trending/this-is-serious/,2026-04-03T02:54:19+00:00
Indian Express,3,Top 10 fastest-growing economies in the world in 2026,https://indianexpress.com/article/trending/top-10-listing/top-10-fastest-growing-economies-in-the-world-in-2026-10615680/,2026-04-03T02:54:19+00:00
Indian Express,4,Anand Mahindra coconut harvester Kerala video,https://indianexpress.com/article/trending/trending-in-india/anand-mahindra-viral-video-kerala-coconut-harvester-hello-nariyal-chhattisgarh-worker-10615651/,2026-04-03T02:54:19+00:00
Indian Express,5,Mount Everest insurance scam,https://indianexpress.com/article/trending/trending-globally/mount-everest-insurance-scam-20-million-helicopter-rescue-fraud-10615382/,2026-04-03T02:54:19+00:00
Indian Express,6,"Oracle employee’s calm layoff reaction goes viral amid 30,000 job cuts: ‘Its Oracle’s loss’",https://indianexpress.com/article/trending/trending-globally/oracle-layoffs-viral-linkedin-post-employee-reaction-10615091/,2026-04-03T02:54:19+00:00
Indian Express,7,war lockdown notice viral,https://indianexpress.com/article/trending/trending-in-india/war-lockdown-notice-viral-fake-india-lockdown-rumours-april-fool-prank-10614896/,2026-04-03T02:54:19+00:00
Indian Express,8,Top 10 countries with the highest water quality,https://indianexpress.com/article/trending/top-10-listing/top-10-countries-with-the-highest-water-quality-see-where-india-ranks-10613903/,2026-04-03T02:54:19+00:00
Indian Express,9,CBSE history paper QR code Orry,https://indianexpress.com/article/trending/trending-in-india/cbse-class-12-history-paper-qr-code-orry-viral-video-10613853/,2026-04-03T02:54:19+00:00
Indian Express,10,China dog kindergarten school cost,https://indianexpress.com/article/trending/trending-globally/china-woman-spends-1-6-lakh-monthly-on-pet-dog-school-kindergarten-10613580/,2026-04-03T02:54:19+00:00
Indian Express,11,"Yo Yo Honey Singh made a grand entry at his Mumbai concert in a Rolls-Royce Ghost, leaving fans stunned",https://indianexpress.com/article/trending/trending-in-india/yo-yo-honey-singh-mumbai-concert-rolls-royce-entry-10613254/,2026-04-03T02:54:19+00:00
Indian Express,12,Vande Bharat food complaint,https://indianexpress.com/article/trending/trending-in-india/vande-bharat-passenger-allergic-reaction-irctc-food-complaint-swollen-face-10613238/,2026-04-03T02:54:19+00:00
Indian Express,13,Oracle layoffs 2026,https://indianexpress.com/article/trending/trending-globally/oracle-layoffs-2026-ai-shift-sharat-chander-java-head-fired-10613068/,2026-04-03T02:54:19+00:00
Indian Express,14,Kerala Tourism and brands react humorously to the missing 4 lakh KitKat bars,https://indianexpress.com/article/trending/trending-in-india/kitkat-truck-theft-europe-kerala-tourism-viral-trend-10612931/,2026-04-03T02:54:19+00:00
Indian Express,15,Kevin Pietersen Mumbai air quality,https://indianexpress.com/article/trending/trending-globally/kevin-pietersen-mumbai-air-quality-aqi-tweet-controversy-ipl-2026-10611887/,2026-04-03T02:54:19+00:00
Indian Express,16,amy arora bengaluru budget,https://indianexpress.com/article/trending/trending-in-india/bengaluru-intern-amy-arora-viral-18000-monthly-budget-breakdown-sde-pg-life-10611810/,2026-04-03T02:54:19+00:00
Indian Express,17,Pune professor Mehbooba Mehbooba viral video,https://indianexpress.com/article/trending/trending-in-india/pune-professor-viral-video-singing-mehbooba-mehbooba-sri-balaji-university-10611549/,2026-04-03T02:54:19+00:00
Indian Express,18,Bihar engineer viral post,https://indianexpress.com/article/trending/trending-in-india/bihar-software-engineer-ananya-shaswat-intel-job-28-lpa-mother-viral-post-10611258/,2026-04-03T02:54:19+00:00
Indian Express,19,Bengaluru vs Delhi Metro,https://indianexpress.com/article/trending/trending-in-india/delhi-metro-vs-bengaluru-namma-metro-viral-x-post-civic-sense-connectivity-debate-10610961/,2026-04-03T02:54:19+00:00
Indian Express,20,"For a few seconds, the couple and those around them scrambled to find the missing ring",https://indianexpress.com/article/trending/trending-in-india/mumbai-indians-fan-heartfelt-proposal-nearly-ends-in-disaster-as-ring-disappears-in-stand-10610869/,2026-04-03T02:54:19+00:00
Indian Express,21,Brand Finance Top 10 Most Valuable Telecom Brands In The World 2026,https://indianexpress.com/article/trending/top-10-listing/brand-finance-most-valuable-telecom-brands-globally-2026-10610717/,2026-04-03T02:54:19+00:00
Indian Express,22,KitKat bars stolen in Europe have triggered widespread attention after Domino’s UK posted a viral response announcing a KitKat pizza,https://indianexpress.com/article/trending/trending-globally/kitkat-bars-stolen-europe-dominos-uk-viral-post-10610775/,2026-04-03T02:54:19+00:00
Indian Express,23,"In the viral photos, the model can be seen painted pink and posing on the elephant, which had been coloured the same hue",https://indianexpress.com/article/trending/trending-in-india/russian-artist-paints-elephant-pink-for-photoshoot-in-jaipur-sparks-outrage-10609761/,2026-04-03T02:54:19+00:00
Indian Express,24,"Sweeney's apology prompted a wave of reactions, with several users slamming him for his decision",https://indianexpress.com/article/trending/trending-globally/epic-games-layoffs-tim-sweeney-apology-cancer-employee-insurance-10609724/,2026-04-03T02:54:19+00:00
Indian Express,25,"Sharing the details of the incident, the CEO said he decided to get a rabies shot, despite the pet dog being vaccinated for the virus",https://indianexpress.com/article/trending/trending-in-india/india-vs-us-healthcare-ceo-gets-rabies-shot-in-10-minutes-post-goes-viral-10609617/,2026-04-03T02:54:19+00:00
Indian Express,26,Anand Mahindra shared a video of Bittu cleaning the polluted river,https://indianexpress.com/article/trending/trending-in-india/bittu-tabahi-river-cleaning-anand-mahindra-viral-video-10609189/,2026-04-03T02:54:19+00:00
Indian Express,27,Arpit Bala controversy erupted after a viral video showed the rapper allegedly spitting at a fan during a Hyderabad concert,https://indianexpress.com/article/trending/trending-in-india/who-is-arpit-bala-controversy-hyderabad-concert-spitting-fan-10609122/,2026-04-03T02:54:19+00:00
LiveMint,1,McDonald's drops new under $3 menu and $4 breakfast deal — Here’s what you get,https://www.livemint.com/us/trending/mcdonalds-drops-new-under-3-menu-and-4-breakfast-deal-here-s-what-you-can-get-11775157327207.html,2026-04-03T02:54:19+00:00
LiveMint,2,Rapper J. Cole joins China’s Nanjing Monkey Kings for pro basketball stint,https://www.livemint.com/us/trending/grammywinning-rapper-j-cole-joins-china-s-nanjing-monkey-kings-for-pro-basketball-stint-11775141367888.html,2026-04-03T02:54:19+00:00
LiveMint,3,April Fools’ Day 2026 deals: No-joke discounts from Dunkin' and more,https://www.livemint.com/us/trending/april-fools-day-2026-discounts-dunkin-checkers-rally-hooters-qdoba-artemis-ii-doughnut-11775054510320.html,2026-04-03T02:54:19+00:00
LiveMint,4,"Oracle employee, despite being laid off, remains positive: ‘It happens…'",https://www.livemint.com/us/trending/oracle-employee-despite-being-laid-off-remains-positive-it-happens-will-enjoy-sleeping-11775051244639.html,2026-04-03T02:54:19+00:00
LiveMint,5,Warren Buffett teams up with NBA star Stephen Curry for charity lunch auction,https://www.livemint.com/us/trending/warren-buffett-teams-up-with-nba-star-stephen-curry-for-charity-lunch-auction-berkshire-event-returns-in-2026-11774962320767.html,2026-04-03T02:54:19+00:00
LiveMint,6,Tiger Woods’ ex Kristin Smith breaks silence after ‘triggering’ DUI arrest,https://www.livemint.com/us/trending/tiger-woods-ex-kristin-smith-breaks-silence-after-triggering-dui-arrest-seeks-privacy-11774949316320.html,2026-04-03T02:54:19+00:00
LiveMint,7,"Sophie Turner injured, Tomb Raider series halts production temporarily",https://www.livemint.com/us/trending/sophie-turner-injured-tomb-raider-series-halts-production-temporarily-11774878671976.html,2026-04-03T02:54:19+00:00
LiveMint,8,Viral video of Kash Patel dancing? Here’s the truth behind the clip,https://www.livemint.com/us/trending/viral-video-of-kash-patel-dancing-here-s-the-truth-behind-the-clip-11774814955782.html,2026-04-03T02:54:19+00:00
LiveMint,9,"Arnold Schwarzenegger returns to gym—But this time, he’s coaching his son |Watch",https://www.livemint.com/us/trending/arnold-schwarzenegger-returns-to-gym-but-this-time-he-s-coaching-his-son-to-bodybuilding-glory-watch-11774816425352.html,2026-04-03T02:54:19+00:00
LiveMint,10,"Bachelorette star James McCoy Taylor arrested again, months after guilty plea",https://www.livemint.com/us/trending/bachelorette-star-james-mccoy-taylor-arrested-again-months-after-guilty-plea-11774189913536.html,2026-04-03T02:54:19+00:00
LiveMint,11,Comedian jokes about Jews’ expulsion: Social media reacts to viral video,https://www.livemint.com/us/trending/comedian-jokes-about-jews-expulsion-social-media-reacts-to-viral-video-using-antisemitic-talking-points-as-humor-11773998180773.html,2026-04-03T02:54:19+00:00
LiveMint,12,Who is Joseph Duggar? All about reality TV star arrested on abuse charges,https://www.livemint.com/us/trending/who-is-joseph-duggar-all-about-the-19-kids-and-counting-star-arrested-on-abuse-charges-11773894381944.html,2026-04-03T02:54:19+00:00
LiveMint,13,"St Patrick’s Day 2026: Date, history, meaning and traditions worldwide",https://www.livemint.com/us/trending/st-patrick-s-day-2026-date-history-meaning-and-traditions-worldwide-11773760629096.html,2026-04-03T02:54:19+00:00
LiveMint,14,Oscars 2026: What’s on the menu at official after-party for Hollywood A-listers?,https://www.livemint.com/us/trending/oscars-2026-what-s-on-the-menu-at-the-official-after-party-luxurious-food-desserts-and-drinks-for-hollywood-alisters-11773548247036.html,2026-04-03T02:54:19+00:00
LiveMint,15,"Meghan Markle: Harry’s wife faces backlash over $2,235 ticket for group photo",https://www.livemint.com/us/trending/meghan-markle-harry-s-wife-faces-backlash-over-2-235-vip-ticket-for-group-photo-she-s-a-nobody-who-tricked-a-prince-11773538916724.html,2026-04-03T02:54:19+00:00
LiveMint,16,Apple kicks off 50th anniversary with surprise performance by Alicia Keys in NY,https://www.livemint.com/us/trending/alicia-keys-turns-apples-grand-central-in-new-york-into-a-concert-venue-at-tech-giant-s-50th-anniversary-kickoff-11773508129097.html,2026-04-03T02:54:19+00:00
LiveMint,17,"Marco Rubio large shoe size stuns Internet, social media points to ‘sycophancy'",https://www.livemint.com/us/trending/marco-rubio-large-shoe-size-stuns-internet-social-media-points-to-sycophancy-idol-worship-among-trump-officials-11773470692943.html,2026-04-03T02:54:19+00:00
LiveMint,18,Was Bill Clinton about to push Hillary into running traffic? Watch viral video,https://www.livemint.com/us/trending/did-bill-clinton-almost-push-hillary-into-running-traffic-social-media-reacts-to-viral-video-hes-was-so-close-11773280988605.html,2026-04-03T02:54:19+00:00
LiveMint,19,"Dr Dre net worth: Inside his earnings, brands, cars and real estate",https://www.livemint.com/us/trending/dr-dre-net-worth-how-did-the-new-billionaire-make-his-fortune-inside-his-earnings-cars-mansions-and-brands-11773167989493.html,2026-04-03T02:54:19+00:00
LiveMint,20,Nike launches Air Jordan 4 Retro ‘Imperial Purple’ sneakers: Details,https://www.livemint.com/us/trending/nike-launches-air-jordan-4-retro-imperial-purple-sneakers-how-much-do-they-cost-where-to-buy-online-11772907741201.html,2026-04-03T02:54:19+00:00
LiveMint,21,Quote of the day by Robert T Kiyosaki on success: ‘Winners are not afraid of….',https://www.livemint.com/us/trending/quote-of-the-day-by-robert-t-kiyosaki-on-success-winners-are-not-afraid-of-losing-but-11772854894148.html,2026-04-03T02:54:19+00:00
LiveMint,22,Bodybuilder Jeff Nippard’s fiancé Stephanie Buttermore dies at 36,https://www.livemint.com/us/trending/bodybuilder-jeff-nippard-s-fianc-stephanie-buttermore-dies-at-36-a-look-at-the-late-fitness-stars-net-worth-11772860396173.html,2026-04-03T02:54:19+00:00
LiveMint,23,Toddler triggers airport alarms chasing a toy; what happened next surprised all,https://www.livemint.com/us/trending/toddler-triggers-airport-alarms-chasing-a-toy-what-happened-next-surprised-everyone-11772786934708.html,2026-04-03T02:54:19+00:00
LiveMint,24,Quote of the day by Abraham Lincoln: ‘We the people are rightful masters of…’,https://www.livemint.com/us/trending/quote-of-the-day-by-abraham-lincoln-we-the-people-are-rightful-masters-of-11772622098976.html,2026-04-03T02:54:19+00:00
LiveMint,25,Can AI really do your taxes? Elon Musk sparks massive online debate,https://www.livemint.com/us/trending/can-grok-help-you-cut-your-taxes-elon-musk-says-11772572363426.html,2026-04-03T02:54:19+00:00
LiveMint,26,Instagram to notify parents if teens repeatedly search for suicide or self-harm,https://www.livemint.com/us/trending/instagram-will-alert-parents-over-repeated-suicide-related-searches-by-teen-users-amid-global-push-for-sm-regulations-11772110629794.html,2026-04-03T02:54:19+00:00
LiveMint,27,‘Done with New Jersey’: US-based engineer’s rant goes viral,https://www.livemint.com/us/trending/done-with-new-jersey-us-based-engineer-gets-frustrated-over-property-tax-heavy-snow-ice-rant-goes-viral-11771923467675.html,2026-04-03T02:54:19+00:00
LiveMint,28,Last Week Tonight: John Oliver uses Nikhil Kamath podcast to mock Elon Musk,https://www.livemint.com/us/trending/watch-john-oliver-uses-nikhil-kamaths-podcast-to-mock-elon-musk-on-last-week-tonight-buffering-like-aol-in-1999-11771911124869.html,2026-04-03T02:54:19+00:00
LiveMint,29,"Trump's latest tariffs: Netizens rake up Epstein, jobs, and Iran",https://www.livemint.com/us/trending/trumps-latest-tariffs-netizens-rake-up-epstein-jobs-and-iran-as-white-house-says-keep-calm-and-tariff-on-11771643415503.html,2026-04-03T02:54:19+00:00
LiveMint,30,NRI influencer’s post on returning to India ignites family responsibility debate,https://www.livemint.com/us/trending/moving-back-to-india-from-the-us-to-raise-kids-or-care-for-parents-influencer-sparks-debate-11771617446170.html,2026-04-03T02:54:19+00:00
LiveMint,31,"Netizens in meme frenzy as Trump announces release of files on aliens, UFOs",https://www.livemint.com/us/trending/netizens-in-meme-frenzy-as-trump-announces-release-of-files-on-aliens-ufos-epstein-files-11771556439611.html,2026-04-03T02:54:19+00:00
LiveMint,32,"‘Satanic ritual’? Viral video shows blindfolded, shirtless men",https://www.livemint.com/us/trending/viral-video-iowa-university-blindfolded-shirtless-young-men-social-media-hazing-ritual-11771502449739.html,2026-04-03T02:54:19+00:00
LiveMint,33,When is Mardi Gras 2026? Why is it celebrated? What is Fat Tuesday?,https://www.livemint.com/us/trending/when-is-mardi-gras-2026-why-is-it-celebrated-what-is-fat-tuesday-also-the-rare-overlap-of-len-and-ramadan-this-year-11771340190144.html,2026-04-03T02:54:19+00:00
LiveMint,34,Stephen Colbert to release James Talarico’s interview after CBS’ refusal,https://www.livemint.com/us/trending/stephen-colbert-to-release-james-talarico-s-interview-on-youtube-as-cbs-refuses-to-air-it-for-financial-reasons-11771322377565.html,2026-04-03T02:54:19+00:00
LiveMint,35,Manchester Orchestra drummer Tim Very dies at 42: Rock band mourns loss,https://www.livemint.com/us/trending/manchester-orchestra-drummer-dies-at-42-rock-band-mourns-loss-tim-very-held-together-the-entire-mo-universe-11771126673065.html,2026-04-03T02:54:19+00:00
LiveMint,36,Quote of the Day | Valentine’s Day: Taylor Swift on love and perfection,https://www.livemint.com/us/trending/quote-of-the-day-valentine-s-day-special-taylor-swift-on-why-love-isn-t-meant-to-be-perfect-11770975532058.html,2026-04-03T02:54:19+00:00
LiveMint,37,Cardi B slams DHS over ‘drugs’ remark after criticizing ICE,https://www.livemint.com/us/trending/lets-talk-about-epstein-cardi-b-slams-dhs-over-drugs-remark-after-criticizing-ice-during-little-miss-drama-tour-11770943241509.html,2026-04-03T02:54:19+00:00
LiveMint,38,Quote of the day from Abraham Lincoln: ‘The ballot is stronger than the bullet’,https://www.livemint.com/us/trending/quote-of-the-day-from-abraham-lincoln-the-ballot-is-stronger-than-the-bullet-bangladesh-elections-polls-result-11770894713401.html,2026-04-03T02:54:19+00:00
LiveMint,39,Quote of the day from Paul Graham: ‘Do you want to become like these people?’,https://www.livemint.com/us/trending/quote-of-the-day-from-paul-graham-youll-become-like-whoever-you-work-with-do-you-want-to-become-like-these-people-11770887177070.html,2026-04-03T02:54:19+00:00
LiveMint,40,Mark to Market,https://www.livemint.com/market/mark-to-market,2026-04-03T02:54:19+00:00
LiveMint,41,Four top oil exploration stocks to watch as crude jumps 85% in 2026,https://www.livemint.com/market/stock-market-news/four-top-oil-exploration-stocks-to-watch-as-crude-jumps-85-in-2026-11775119253191.html,2026-04-03T02:54:19+00:00
LiveMint,42,"Asian markets gain; Kospi jumps over 3%, Nikkei up 1%; Hong Kong, Singapore markets closed for Good Friday holiday",https://www.livemint.com/market/stock-market-news/asian-markets-gain-kospi-jumps-over-3-nikkei-up-1-hong-kong-singapore-markets-closed-for-good-friday-holiday-11775181100451.html,2026-04-03T02:54:19+00:00
LiveMint,43,"Stock market holiday: Are BSE, NSE closed today for Good Friday 2026?",https://www.livemint.com/market/stock-market-news/stock-market-holiday-are-bse-nse-closed-today-for-good-friday-2026-11775178165258.html,2026-04-03T02:54:19+00:00
LiveMint,44,Bitcoin Lingers Near Lower Bound of Trading Range Amid Conflict,https://www.livemint.com/market/bitcoin-lingers-near-lower-bound-of-trading-range-amid-conflict-11775163860878.html,2026-04-03T02:54:19+00:00
LiveMint,45,Dollar rises against peers on renewed concerns about Middle East conflict,https://www.livemint.com/market/dollar-rises-against-peers-on-renewed-concerns-about-middle-east-conflict-11775159036992.html,2026-04-03T02:54:19+00:00
LiveMint,46,"Oil prices surge, as stocks tumble on Iran war worry",https://www.livemint.com/market/oil-prices-surge-as-stocks-tumble-on-iran-war-worry-11775157551306.html,2026-04-03T02:54:19+00:00
LiveMint,47,‘Only country to have lost mariners’: India flags human cost at high-level meet on Strait of Hormuz crisis amid Iran war,https://www.livemint.com/news/world/only-country-to-have-lost-mariners-india-flags-human-cost-at-high-level-meet-on-strait-of-hormuz-crisis-amid-iran-war-11775183590975.html,2026-04-03T02:54:19+00:00
LiveMint,48,"Delhi weather today: National capital wakes up to dust storm, haze — check IMD forecast for Friday, 3 April 2026",https://www.livemint.com/news/india/delhi-weather-today-national-capital-wakes-up-to-dust-storm-haze-check-imd-forecast-for-friday-3-april-2026-11775182529271.html,2026-04-03T02:54:19+00:00
LiveMint,49,Iran US war LIVE Updates: US claims it ‘always open to diplomacy’ but will ensure objectives are fulfilled in Iran,https://www.livemint.com/news/world/iran-us-war-news-live-updates-april-3-strait-of-hormuz-donald-trump-netanyahu-araghchi-brent-crude-oil-prices-gold-11775180285895.html,2026-04-03T02:54:19+00:00
LiveMint,50,"Watch: Plane nosedives, crashes into ground in Mexico after takeoff; at least four killed",https://www.livemint.com/news/world/watch-video-plane-nosedives-crashes-into-ground-in-mexico-after-takeoff-at-least-four-killed-11775181241304.html,2026-04-03T02:54:19+00:00
LiveMint,51,"FBI chief Kash Patel to be sacked by Trump after Pam Bondi, Kristi Noem, Randy George? Report claims discussions ongoing",https://www.livemint.com/news/us-news/fbi-chief-kash-patel-to-be-sacked-by-trump-after-pam-bondi-kristi-noem-randy-george-report-claims-discussions-ongoing-11775179664515.html,2026-04-03T02:54:19+00:00
LiveMint,52,Who is General Randy George? US Army Chief of Staff sacked by Pete Hegseth as war with Iran drags on,https://www.livemint.com/news/us-news/who-is-general-randy-george-us-army-chief-of-staff-sacked-by-pete-hegseth-as-war-with-iran-drags-on-11775175467567.html,2026-04-03T02:54:19+00:00
LiveMint,53,Faith tech firms chase growth in $35 billion market with product push,https://www.livemint.com/companies/faith-tech-firms-chase-growth-in-35-billion-market-with-product-push-vama-astrotalk-faith-religious-products-11775110778352.html,2026-04-03T02:54:19+00:00
LiveMint,54,The-US Iran war opens a rare sweet spot for India’s space startups,https://www.livemint.com/companies/start-ups/india-space-startups-capitalize-global-satellite-surveillance-demand-11775116568538.html,2026-04-03T02:54:19+00:00
LiveMint,55,"Exodus, revenue strain cloud Birlasoft CEO's Angan Guha’s turnaround plan",https://www.livemint.com/companies/news/exodus-revenue-strain-cloud-birlasoft-ceos-angan-guha-s-turnaround-plan-11775129269554.html,2026-04-03T02:54:19+00:00
LiveMint,56,"In a shifting world, this is India’s leadership moment, says McKinsey global chief",https://www.livemint.com/companies/news/india-leadership-moment-mckinsey-global-md-sternfels-ai-trade-11775130730085.html,2026-04-03T02:54:19+00:00
LiveMint,57,Ex-Centerview Banker Gets Deal to End US Insider-Trading Case,https://www.livemint.com/companies/excenterview-banker-gets-deal-to-end-us-insider-trading-case-11775158175582.html,2026-04-03T02:54:19+00:00
LiveMint,58,"Emami to acquire 100% stake in Axiom Ayurveda, maker of Alofrut flavoured drink: Here are the details",https://www.livemint.com/companies/news/emami-to-acquire-100-stake-in-axiom-ayurveda-maker-of-alofrut-flavoured-drink-here-are-the-details-11775140297055.html,2026-04-03T02:54:19+00:00
LiveMint,59,Ask Mint Money,https://www.livemint.com/money/ask-mint-money,2026-04-03T02:54:19+00:00
LiveMint,60,"West Asia war poses no recession risk for India, but economic slowdown is on the cards: Madan Sabnavis",https://www.livemint.com/money/west-asia-war-india-recession-risk-economic-slowdown-madan-sabnavis-household-budgets-job-market-inflation-interest-rate-11775105443794.html,2026-04-03T02:54:19+00:00
LiveMint,61,₹13 crore digital arrest scam: Ex-Delhi judge says awareness is your strongest defence— 6 ways to protect yourself,https://www.livemint.com/money/personal-finance/13-crore-digital-arrest-scam-ex-delhi-judge-says-awareness-is-your-strongest-defence-6-ways-to-protect-yourself-11775142798863.html,2026-04-03T02:54:19+00:00
LiveMint,62,Income tax portal revamp: 7 key links every taxpayer must check now,https://www.livemint.com/money/personal-finance/income-tax-portal-revamp-7-key-links-every-taxpayer-must-check-now-11775126421850.html,2026-04-03T02:54:19+00:00
LiveMint,63,PAN card application rules changed from 1 April: List of documents you must submit now,https://www.livemint.com/money/personal-finance/pan-card-application-rules-changed-from-1-april-list-of-documents-you-must-submit-now-11775124363100.html,2026-04-03T02:54:19+00:00
LiveMint,64,Did you know EPF once offered 12%? A look back at historical returns as govt clarifies on interest rate hike demand,https://www.livemint.com/money/personal-finance/did-you-know-epf-once-offered-12-a-look-back-at-historical-returns-as-govt-clarifies-on-interest-rate-hike-demand-11775117321210.html,2026-04-03T02:54:19+00:00
LiveMint,65,Big change in gratuity rules: Eligibility cut to 1 year of service from 5 years — but there’s a catch,https://www.livemint.com/money/personal-finance/big-change-in-gratuity-rules-eligibility-cut-to-1-year-of-service-from-5-years-but-there-s-a-catch-11775120105154.html,2026-04-03T02:54:19+00:00
LiveMint,66,Trump administration appeals ruling that blocked Pentagon action against Anthropic over AI dispute,https://www.livemint.com/technology/trump-administration-appeals-ruling-that-blocked-pentagon-action-against-anthropic-over-ai-dispute-11775148233145.html,2026-04-03T02:54:19+00:00
LiveMint,67,Is X down? Thousands of users report issues with news feed in US: What we know,https://www.livemint.com/technology/is-x-down-hundreds-of-users-report-issues-with-news-feed-in-us-what-we-know-11775119112120.html,2026-04-03T02:54:19+00:00
LiveMint,68,"Realme 16 with iPhone Air like camera module and 7,000mAh battery launched in India, price starts at ₹31,999",https://www.livemint.com/technology/gadgets/realme-16-with-iphone-air-like-camera-module-and-7-000mah-battery-launched-in-india-price-starts-at-rs-31999-11775115281470.html,2026-04-03T02:54:19+00:00
LiveMint,69,"Vivo V70 FE with 200MP camera and 7,000mAh battery launched in India, price starts at ₹37,999",https://www.livemint.com/technology/gadgets/vivo-v70-fe-with-200mp-camera-and-7-000mah-battery-launched-in-india-price-starts-at-rs-40999-11775114083114.html,2026-04-03T02:54:19+00:00
LiveMint,70,What is OpenAI’s ‘Spud’? Greg Brockman teases new ChatGPT model built on years of research,https://www.livemint.com/technology/tech-news/what-is-openai-s-spud-greg-brockman-teases-new-chatgpt-model-build-on-years-of-research-11775105908398.html,2026-04-03T02:54:19+00:00
LiveMint,71,"Redmi Note 15 SE 5G with 6.77-inch AMOLED display and 5,800 mAH battery launched in India, price starts at…",https://www.livemint.com/technology/gadgets/redmi-note-15-se-5g-with-6-77-inch-amoled-display-and-5-800-mah-battery-launched-in-india-price-starts-at-11775112299774.html,2026-04-03T02:54:19+00:00
LiveMint,72,IPL 2026 Schedule,https://www.livemint.com/sports/cricket-news/ipl-schedule,2026-04-03T02:54:19+00:00
LiveMint,73,Orange Cap in IPL 2026,https://www.livemint.com/sports/cricket-news/ipl-orange-cap,2026-04-03T02:54:19+00:00
LiveMint,74,Purple Cap in IPL 2026,https://www.livemint.com/sports/cricket-news/ipl-purple-cap,2026-04-03T02:54:19+00:00
