source,rank,headline,link,collected_at_iso
LiveMint,80,Gold Rate in Delhi,https://www.livemint.com/gold-prices/delhi,2026-04-17T06:08:09+00:00
LiveMint,81,Gold Rate Hyderabad,https://www.livemint.com/gold-prices/hyderabad,2026-04-17T06:08:09+00:00
LiveMint,82,Silver Rate Today,https://www.livemint.com/silver-prices,2026-04-17T06:08:09+00:00
LiveMint,83,Silver Rate in Delhi,https://www.livemint.com/silver-prices/delhi,2026-04-17T06:08:09+00:00
LiveMint,84,Silver Rate in Bangalore,https://www.livemint.com/silver-prices/bangalore,2026-04-17T06:08:09+00:00
LiveMint,85,US Stock Market,https://www.livemint.com/market/us-market,2026-04-17T06:08:09+00:00
LiveMint,86,Terms of Use,https://www.livemint.com/terms-of-use,2026-04-17T06:08:09+00:00
LiveMint,87,Code of ethics,https://www.livemint.com/code-of-ethics,2026-04-17T06:08:09+00:00
LiveMint,88,Stock Market Today,https://www.livemint.com/market/stock-market-news/stock-market-today-sensex-today-nifty-gold-rate-today-silver-rate-today-crude-oil-prices-us-iran-war-trump-7-april-2026-11775527434110.html,2026-04-17T06:08:09+00:00
LiveMint,89,MCX Gold Rate,https://www.livemint.com/market/market-stats/commodity-mcx-gold-price,2026-04-17T06:08:09+00:00
LiveMint,90,MCX Silver Price,https://www.livemint.com/market/market-stats/commodity-mcx-silver-price,2026-04-17T06:08:09+00:00
LiveMint,91,Gold Price in Mumbai,https://www.livemint.com/gold-prices/mumbai,2026-04-17T06:08:09+00:00
LiveMint,92,Gold Price in Chennai,https://www.livemint.com/gold-prices/chennai,2026-04-17T06:08:09+00:00
LiveMint,93,Gold Price in Kolkata,https://www.livemint.com/gold-prices/kolkata,2026-04-17T06:08:09+00:00
LiveMint,94,Silver Price in Mumbai,https://www.livemint.com/silver-prices/mumbai,2026-04-17T06:08:09+00:00
LiveMint,95,Silver Price in Chennai,https://www.livemint.com/silver-prices/chennai,2026-04-17T06:08:09+00:00
LiveMint,96,Silver Price in Hyderabad,https://www.livemint.com/silver-prices/hyderabad,2026-04-17T06:08:09+00:00
LiveMint,97,Silver Price in Kolkata,https://www.livemint.com/silver-prices/kolkata,2026-04-17T06:08:09+00:00
LiveMint,98,Latest News Today,https://www.livemint.com/news,2026-04-17T06:08:09+00:00
LiveMint,99,US News Today,https://www.livemint.com/news/us-news,2026-04-17T06:08:09+00:00
LiveMint,100,Top Company Leader,https://www.livemint.com/companies/people,2026-04-17T06:08:09+00:00
LiveMint,101,personal loan emi calculator,https://www.livemint.com/loans/personal-loan-emi-calculator,2026-04-17T06:08:09+00:00
LiveMint,102,Personal Loan Interest Rate,https://www.livemint.com/loans/personal-loan-interest-rates,2026-04-17T06:08:09+00:00
LiveMint,103,Personal Loan Eligibility,https://www.livemint.com/loans/personal-loan-eligibility,2026-04-17T06:08:09+00:00
LiveMint,104,Instant Personal Loan,https://www.livemint.com/loans/instant-personal-loan,2026-04-17T06:08:09+00:00
LiveMint,105,Home Loan EMI Calculator,https://www.livemint.com/tools-calculators/home-loan-emi-calculator,2026-04-17T06:08:09+00:00
LiveMint,106,Car Loan EMI,https://www.livemint.com/tools-calculators/car-loan-calculator,2026-04-17T06:08:09+00:00
India Today,1,Mosquitoes force Hyderabad security guard to cover himself with net on night duty,https://www.indiatoday.in/trending-news/story/hyderabad-security-guard-covers-himself-with-mosquito-net-night-duty-viral-video-2897502-2026-04-17,2026-04-17T06:08:09+00:00
India Today,2,Man's rant about soul-crushing Gurgaon traffic is a hard relate for many,https://www.indiatoday.in/trending-news/story/mans-rant-about-soul-crushing-gurgaon-traffic-is-a-hard-relate-for-many-2897320-2026-04-16,2026-04-17T06:08:09+00:00
India Today,3,Woman says 6 months in Bengaluru is enough to change you. Internet relates,https://www.indiatoday.in/trending-news/story/woman-says-6-months-in-bengaluru-is-enough-to-change-you-internet-relates-2897317-2026-04-16,2026-04-17T06:08:09+00:00
India Today,4,"Luxury chai in a Rolls-Royce? Viral idea draws crowds, not profit",https://www.indiatoday.in/trending-news/story/luxury-chai-in-a-rolls-royce-viral-idea-draws-crowds-not-profit-2897307-2026-04-16,2026-04-17T06:08:09+00:00
India Today,5,"Christian priest steps in as Hindu bride's father in Kerala, performs kanyadaan",https://www.indiatoday.in/trending-news/story/christian-priest-steps-in-as-hindu-brides-father-in-kerala-performs-kanyadaan-2897283-2026-04-16,2026-04-17T06:08:09+00:00
India Today,6,US man builds submarine for parakeet's snorkeling adventure,https://www.indiatoday.in/trending-news/story/us-man-submarine-parakeet-snorkeling-bahamas-2897263-2026-04-16,2026-04-17T06:08:09+00:00
India Today,7,Indian man claims one day's pay in Australia equals his monthly salary back home,https://www.indiatoday.in/trending-news/story/indian-man-claims-one-days-pay-in-australia-equals-his-monthly-salary-back-home-2897141-2026-04-16,2026-04-17T06:08:09+00:00
India Today,8,"DU student alleges bias at event over sleeveless suit; not true, claim attendees",https://www.indiatoday.in/trending-news/story/du-student-alleges-bias-at-event-over-sleeveless-suit-not-true-claim-attendees-2897219-2026-04-16,2026-04-17T06:08:09+00:00
India Today,9,"Gurugram founder questions Gen Z employee over 7pm log-off, his reply hits hard",https://www.indiatoday.in/trending-news/story/gurugram-founder-questions-gen-z-employee-over-7pm-log-off-his-reply-hits-hard-2897092-2026-04-16,2026-04-17T06:08:09+00:00
India Today,10,Kolkata man expresses 7 emotions through eyes in Hum Tere Pyaar Mein lip-sync,https://www.indiatoday.in/trending-news/story/kolkata-man-expresses-7-emotions-through-eyes-in-hum-tere-pyaar-mein-saara-aalam-lip-sync-2897090-2026-04-16,2026-04-17T06:08:09+00:00
India Today,11,"Chennai man records city's pink blossoms on roadside, this is too stunning to miss",https://www.indiatoday.in/trending-news/story/chennai-man-records-citys-pink-blossoms-on-roadside-this-is-too-stunning-to-miss-2897054-2026-04-16,2026-04-17T06:08:09+00:00
India Today,12,"Bengaluru techie's high pay, low show-off lifestyle on Rs 50 LPA salary is viral",https://www.indiatoday.in/trending-news/story/bengaluru-techies-high-pay-low-show-off-lifestyle-on-rs-50-lpa-salary-is-viral-2897062-2026-04-16,2026-04-17T06:08:09+00:00
India Today,13,"Ticketless woman blames RPF, TTE for missing train, internet cries 'victim card'",https://www.indiatoday.in/trending-news/story/ticketless-woman-blames-rpf-tte-for-missing-train-internet-cries-victim-card-2896975-2026-04-16,2026-04-17T06:08:09+00:00
India Today,14,US kicks off Freedom250 celebrations in India with Trump's face on auto rickshaws,https://www.indiatoday.in/trending-news/story/us-kicks-off-freedom250-celebrations-in-india-with-trumps-face-on-auto-rickshaws-2896936-2026-04-16,2026-04-17T06:08:09+00:00
India Today,15,Internet chokes up over video of disabled girl smiling as her friends play,https://www.indiatoday.in/trending-news/story/physically-disabled-girl-watches-friends-play-her-smile-breaks-internets-heart-2896916-2026-04-16,2026-04-17T06:08:09+00:00
India Today,16,Student's sketch of Ranveer Singh's Hamza from Dhurandhar 2 amuses Internet,https://www.indiatoday.in/trending-news/story/students-sketch-of-ranveer-singhs-hamza-from-dhurandhar-2-amuses-internet-2896770-2026-04-15,2026-04-17T06:08:09+00:00
India Today,17,Amazon techie captures father reading offer letter. Internet calls it priceless,https://www.indiatoday.in/trending-news/story/amazon-employee-offer-letter-father-emotional-reaction-viral-2896765-2026-04-15,2026-04-17T06:08:09+00:00
India Today,18,"IIIT Delhi graduate quits Rs 17 LPA job over no sick leaves, 15-minute lunch break",https://www.indiatoday.in/trending-news/story/iit-delhi-graduate-quits-rs-17-lpa-job-over-no-sick-leaves-15-minute-lunch-break-2896752-2026-04-15,2026-04-17T06:08:09+00:00
India Today,19,"Mother elephant refuses to let go of lifeless calf, leaves internet heartbroken",https://www.indiatoday.in/trending-news/story/mother-elephant-refuses-to-let-go-of-lifeless-calf-leaves-internet-heartbroken-2896527-2026-04-15,2026-04-17T06:08:09+00:00
India Today,20,Americans can't get enough of this Pak air defence system,https://www.indiatoday.in/trending-news/story/americans-cant-get-enough-of-this-pakistan-air-defence-system-us-iran-war-2896723-2026-04-15,2026-04-17T06:08:09+00:00
India Today,21,"Vijay couldn't protect Jana Nayagan, claims he can protect Tamil Nadu: Rajya Sabha MP",https://www.indiatoday.in/movies/regional-cinema/story/vijay-couldnt-protect-jana-nayagan-claims-he-can-protect-tamil-nadu-rajya-sabha-mp-2897506-2026-04-17,2026-04-17T06:08:09+00:00
India Today,22,Elon Musk says everyone should get free money from government because robots will work,https://www.indiatoday.in/technology/news/story/elon-musk-says-everyone-should-get-free-money-from-government-because-robots-will-work-2897500-2026-04-17,2026-04-17T06:08:09+00:00
India Today,23,How Arshdeep snapped back to form vs MI: Ponting reveals chat behind the scenes,https://www.indiatoday.in/sports/cricket/story/ipl-2026-mi-vs-pbks-arshdeep-singh-back-in-form-ricky-ponting-chat-behind-the-scenes-2897504-2026-04-17,2026-04-17T06:08:09+00:00
India Today,24,"Jobs cut, AI rolled out: Company forced remaining employees to use AI system, later blamed them for shoddy work",https://www.indiatoday.in/jobs/story/jobs-cut-ai-rolled-out-company-forced-remaining-employees-to-use-ai-system-later-blamed-them-for-shoddy-work-tchc-2897109-2026-04-16,2026-04-17T06:08:09+00:00
India Today,25,Shraddha Kapoor in talks for Mahavatar with Vicky Kaushal: Reports,https://www.indiatoday.in/movies/bollywood/story/shraddha-kapoor-in-talks-for-mahavatar-with-vicky-kaushal-2894415-2026-04-10,2026-04-17T06:08:09+00:00
India Today,26,Can Ranbir Kapoor's Ramayana usher Bollywood's Avatar era with VFX blitz?,https://www.indiatoday.in/movies/bollywood/story/can-ranbir-kapoors-ramayana-usher-bollywoods-avatar-era-with-vfx-blitz-2893738-2026-04-11,2026-04-17T06:08:09+00:00
India Today,27,"VinFast launches 7-seater MPV, the VF MPV 7 at Rs 24.49 lakh",https://www.indiatoday.in/auto/cars/story/vinfast-launches-7-seater-mpv-the-vf-mpv-7-at-rs-2449-lakh-2896493-2026-04-15,2026-04-17T06:08:09+00:00
TOI ETimes,1,Kareena stuns in red Valentino as Saif can’t take eyes off her,https://timesofindia.indiatimes.com/articleshow/130209251.cms,2026-04-17T06:08:09+00:00
TOI ETimes,2,Inside Rajasthan’s push for meaningful baby names: What you name your child matters more than you think,https://timesofindia.indiatimes.com/articleshow/130161079.cms,2026-04-17T06:08:09+00:00
TOI ETimes,3,"Quote of the day by Claude Shannon, the eponym of Claude AI: Information is the resolution of uncertainty",https://timesofindia.indiatimes.com/articleshow/130164653.cms,2026-04-17T06:08:09+00:00
TOI ETimes,4,Indian and American parenting and parental care: Viral social media clip highlights cultural differences,https://timesofindia.indiatimes.com/articleshow/130167532.cms,2026-04-17T06:08:09+00:00
TOI ETimes,5,When “first day of school” feels like a big goodbye: A viral video every parent will relate to,https://timesofindia.indiatimes.com/articleshow/130167652.cms,2026-04-17T06:08:09+00:00
TOI ETimes,6,Not your usual ID check: School video showcases students’ hilarious ‘ID card emotions’,https://timesofindia.indiatimes.com/articleshow/130169206.cms,2026-04-17T06:08:09+00:00
TOI ETimes,7,'Dhurandhar 2' FAILS to break 'Dhurandhar' week 4 record,https://timesofindia.indiatimes.com/articleshow/130320148.cms,2026-04-17T06:08:09+00:00
TOI ETimes,8,Yash opens up about Ravana costume and 10-head portrayal,https://timesofindia.indiatimes.com/articleshow/130323346.cms,2026-04-17T06:08:09+00:00
TOI ETimes,9,BIGBANG’s G-Dragon and BLACKPINK Jennie may be dating?,https://timesofindia.indiatimes.com/articleshow/130324285.cms,2026-04-17T06:08:09+00:00
TOI ETimes,10,Meghan Trainor cancels 2026 tour,https://timesofindia.indiatimes.com/articleshow/130324135.cms,2026-04-17T06:08:09+00:00
TOI ETimes,11,What happened at the end of Lee Cronin’s ‘The Mummy’,https://timesofindia.indiatimes.com/articleshow/130324035.cms,2026-04-17T06:08:09+00:00
TOI ETimes,12,Virat Kohli's alleged Instagram like on influencer Lizlaz's photo sparks online frenzy: 'Cheeku bhai private id banalo' - Report,https://timesofindia.indiatimes.com/articleshow/130324022.cms,2026-04-17T06:08:09+00:00
TOI ETimes,13,Akshay Kumar gets emotional about Mumbai; recalls childhood struggles in chawl,https://timesofindia.indiatimes.com/articleshow/130324129.cms,2026-04-17T06:08:09+00:00
TOI ETimes,14,'Dhurandhar's Sara Arjun pens emotional tribute to father Raj Arjun; Actress shares father’s poetry video,https://timesofindia.indiatimes.com/articleshow/130323441.cms,2026-04-17T06:08:09+00:00
TOI ETimes,15,Shilpa Shetty visits Tripurasundari Shaktipeeth; offers prayers at Tripura temple,https://timesofindia.indiatimes.com/articleshow/130323968.cms,2026-04-17T06:08:09+00:00
TOI ETimes,16,Rajkummar Rao opens up on Patralekhaa’s motherhood journey; Calls transformation 'beautiful',https://timesofindia.indiatimes.com/articleshow/130323747.cms,2026-04-17T06:08:09+00:00
TOI ETimes,17,'Bhooth Bangla' eyes Rs 15 crore box office opening,https://timesofindia.indiatimes.com/articleshow/130321718.cms,2026-04-17T06:08:09+00:00
TOI ETimes,18,"'Dhurandhar 2' BO day 29 [LIVE]: Ranveer Singh film marches past Rs. 1,100 crore milestone",https://timesofindia.indiatimes.com/articleshow/130301791.cms,2026-04-17T06:08:09+00:00
TOI ETimes,19,"‘Dhurandhar 2’ misses Rs 1,100 mark by a whisker ahead of week 5",https://timesofindia.indiatimes.com/articleshow/130295423.cms,2026-04-17T06:08:09+00:00
TOI ETimes,20,'Dhurandhar 2' BO day 28 [LIVE]: Ranveer Singh film eyes Rs. 1100 crore,https://timesofindia.indiatimes.com/articleshow/130276049.cms,2026-04-17T06:08:09+00:00
TOI ETimes,21,‘Dhurandhar 2’ marches to beat ‘Pushpa 2’ in week 4,https://timesofindia.indiatimes.com/articleshow/130270673.cms,2026-04-17T06:08:09+00:00
TOI ETimes,22,Animal Preview: Ranbir Kapoor and Sandeep Reddy Vanga are set to shake up the box office hierarchy,https://timesofindia.indiatimes.com/articleshow/105615612.cms,2026-04-17T06:08:09+00:00
TOI ETimes,23,Tu Jhoothi Main Makkaar,https://timesofindia.indiatimes.com/articleshow/98272134.cms,2026-04-17T06:08:09+00:00
TOI ETimes,24,Avneet recalls how her parents left their life in Punjab for her acting career,https://timesofindia.indiatimes.com/articleshow/130322724.cms,2026-04-17T06:08:09+00:00
TOI ETimes,25,Splitsvilla X6: Sadhaaf bashes Akanksha for ‘gaining sympathy’,https://timesofindia.indiatimes.com/articleshow/130323619.cms,2026-04-17T06:08:09+00:00
TOI ETimes,26,Smriti enjoys Bengali Sweets: Actor shares playful ‘mishti’ post,https://timesofindia.indiatimes.com/articleshow/130309081.cms,2026-04-17T06:08:09+00:00
TOI ETimes,27,Gulki Calls It Full Circle: TV star romances Iqbal Khan on screen,https://timesofindia.indiatimes.com/articleshow/130311781.cms,2026-04-17T06:08:09+00:00
TOI ETimes,28,Ankita Lokhande warns of her X account hacked,https://timesofindia.indiatimes.com/articleshow/130307218.cms,2026-04-17T06:08:09+00:00
TOI ETimes,29,"Success quote of the day by Elon Musk: ""When something is important enough, you do it even if the odds are not in your favor""",https://timesofindia.indiatimes.com/articleshow/130316459.cms,2026-04-17T06:08:09+00:00
TOI ETimes,30,Reverse male pattern baldness with home remedies,https://timesofindia.indiatimes.com/articleshow/130322297.cms,2026-04-17T06:08:09+00:00
TOI ETimes,31,"Dubai just revealed world’s first air-taxi station near Dubai International Airport (DBX); promises faster, traffic-free travel across the city",https://timesofindia.indiatimes.com/articleshow/130321711.cms,2026-04-17T06:08:09+00:00
TOI ETimes,32,The invisible strain: How tight bends are killing your EV charging cable,https://timesofindia.indiatimes.com/articleshow/130303135.cms,2026-04-17T06:08:09+00:00
TOI ETimes,33,The secret ‘twist’ to keeping your curtains dust-free without constant washing,https://timesofindia.indiatimes.com/articleshow/130303136.cms,2026-04-17T06:08:09+00:00
TOI ETimes,34,Stop forcing it! The simple cleaning hack for stubborn kitchen cabinets,https://timesofindia.indiatimes.com/articleshow/130302791.cms,2026-04-17T06:08:09+00:00
TOI ETimes,35,"'No more 2:00 AM flights, no more missing birthdays and festivals and meals': Cabin crew woman’s emotional goodbye goes viral",https://timesofindia.indiatimes.com/articleshow/130321657.cms,2026-04-17T06:08:09+00:00
TOI ETimes,36,"Navy SEAL, then Harvard doctor, then NASA astronaut: Meet the man who changed careers three times and succeeded in all of them",https://timesofindia.indiatimes.com/articleshow/130317658.cms,2026-04-17T06:08:09+00:00
TOI ETimes,37,From Pitbulls to Rottweilers: 5 ferocious dog breeds that could be dangerous if not trained well,https://timesofindia.indiatimes.com/articleshow/130316277.cms,2026-04-17T06:08:09+00:00
TOI ETimes,38,"Meghan Markle says she was 'the most trolled person in the world', urges people to be stronger against cruelty",https://timesofindia.indiatimes.com/articleshow/130315929.cms,2026-04-17T06:08:09+00:00
TOI ETimes,39,Veteran journalist claims WNBA pressured reporters to ignore Fudd–Bueckers relationship in draft coverage,https://timesofindia.indiatimes.com/articleshow/130314031.cms,2026-04-17T06:08:09+00:00
TOI ETimes,40,Raising kids in India > USA? Meet Kelsey- the expat mon who reveals top 5 reasons why India is better for raising kids than America,https://timesofindia.indiatimes.com/articleshow/130313232.cms,2026-04-17T06:08:09+00:00
TOI ETimes,41,D4vd Arrested: Singer held without bail in murder of 14-year-old,https://timesofindia.indiatimes.com/articleshow/130320407.cms,2026-04-17T06:08:09+00:00
TOI ETimes,42,Katy Perry's 2010 videos resurface amid investigation,https://timesofindia.indiatimes.com/articleshow/130295279.cms,2026-04-17T06:08:09+00:00
TOI ETimes,43,"After UK, Kanye West to be banned in France?",https://timesofindia.indiatimes.com/articleshow/130268434.cms,2026-04-17T06:08:09+00:00
TOI ETimes,44,Offset shooting case: Suspects tried to rob rapper's watch,https://timesofindia.indiatimes.com/articleshow/130268437.cms,2026-04-17T06:08:09+00:00
TOI ETimes,45,‘Gaate gaate hi chali jau’: Asha Bhosle’s heartfelt wish to embrace her final note while singing,https://timesofindia.indiatimes.com/articleshow/130229352.cms,2026-04-17T06:08:09+00:00
TOI ETimes,46,Juggy D: ‘Asha ji will forever be the definition of Indian music industry’ - Exclusive,https://timesofindia.indiatimes.com/articleshow/130228380.cms,2026-04-17T06:08:09+00:00
TOI ETimes,47,Beyond Ebooks: The charm of bookstores endures,https://timesofindia.indiatimes.com/articleshow/101098088.cms,2026-04-17T06:08:09+00:00
TOI ETimes,48,It’s a curtain call: Sania Mirza bids adieu to tennis with ‘happy tears’,https://timesofindia.indiatimes.com/articleshow/98440670.cms,2026-04-17T06:08:09+00:00
TOI ETimes,49,A magical makeover for 17th Century stepwell: From neglected ruins to a glorious piece of history,https://timesofindia.indiatimes.com/articleshow/96557955.cms,2026-04-17T06:08:09+00:00
TOI ETimes,50,The city comes alive with Christmas fervour,https://timesofindia.indiatimes.com/articleshow/96406573.cms,2026-04-17T06:08:09+00:00
TOI ETimes,51,#BringRioHome: Pet parents launch search to find their kidnapped cat,https://timesofindia.indiatimes.com/articleshow/96334809.cms,2026-04-17T06:08:09+00:00
TOI ETimes,52,Adil Hussain’s 'Mercy' release date OUT: Film's first look to be attached with Ranveer Singh's 'Dhurandhar: The Revenge',https://timesofindia.indiatimes.com/articleshow/129843424.cms,2026-04-17T06:08:09+00:00
TOI ETimes,53,It’s the best time to be doing theatre: Juhi Babbar Soni,https://timesofindia.indiatimes.com/articleshow/129826631.cms,2026-04-17T06:08:09+00:00
TOI ETimes,54,"Anu Malik steps into theatre with Anupam Kher’s play, Calls it his most exciting challenge yet",https://timesofindia.indiatimes.com/articleshow/129729335.cms,2026-04-17T06:08:09+00:00
TOI ETimes,55,'Wicked' musical director John Stefaniuk on live music on the stage: 'It is so exciting to hear the orchestra whisk us away',https://timesofindia.indiatimes.com/articleshow/129610267.cms,2026-04-17T06:08:09+00:00
TOI ETimes,56,"'Wicked' stars Rebekah Lowings and Eve Shanu-Wilson on Elphaba-Glinda's bond: 'Friends challenge you, not just cheer you on'",https://timesofindia.indiatimes.com/articleshow/129607673.cms,2026-04-17T06:08:09+00:00
TOI ETimes,57,"Vijay Crishna, Shah Rukh Khan’s on-screen father in ‘Devdas,’ passes away at 81: Tributes pour in for theatre stalwart",https://timesofindia.indiatimes.com/articleshow/129016007.cms,2026-04-17T06:08:09+00:00
TOI ETimes,58,Raj Kundra and Shilpa Shetty's 15th Wedding Anniversary,https://timesofindia.indiatimes.com/articleshow/115563990.cms,2026-04-17T06:08:09+00:00
TOI ETimes,59,​Bigg Boss winners list from season 1 to 17​,https://timesofindia.indiatimes.com/articleshow/114277426.cms,2026-04-17T06:08:09+00:00
TOI ETimes,60,​Discover the bird with a prehistoric roar​,https://timesofindia.indiatimes.com/articleshow/114244474.cms,2026-04-17T06:08:09+00:00
TOI ETimes,61,Dia Mirza's ethnic wear,https://timesofindia.indiatimes.com/articleshow/114243410.cms,2026-04-17T06:08:09+00:00
TOI ETimes,62,​Incredible facts about ants you won’t believe​,https://timesofindia.indiatimes.com/articleshow/114243248.cms,2026-04-17T06:08:09+00:00
TOI ETimes,63,'Bigg Boss Marathi 5' nears grand finale​,https://timesofindia.indiatimes.com/articleshow/113936459.cms,2026-04-17T06:08:09+00:00
TOI ETimes,64,Say goodbye to lizards naturally: 5 plants whose smell keeps them away!,https://timesofindia.indiatimes.com/articleshow/130308673.cms,2026-04-17T06:08:09+00:00
TOI ETimes,65,Cranes or storks? How to differentiate between these 2 graceful white birds,https://timesofindia.indiatimes.com/articleshow/130308569.cms,2026-04-17T06:08:09+00:00
TOI ETimes,66,IIT Delhi grad ditches ₹17 LPA banking job over 15-min lunch breaks and 'nightmare' sick leaves,https://timesofindia.indiatimes.com/articleshow/130308446.cms,2026-04-17T06:08:09+00:00
TOI ETimes,67,Chris Paul trolls Clippers with 'Hater’s Funeral' meme in savage viral post after play-in loss to Warriors,https://timesofindia.indiatimes.com/articleshow/130310013.cms,2026-04-17T06:08:09+00:00
TOI ETimes,68,"Meet the Ice Age survivor: The rotifer that cheated death for 24,000 years and started reproducing after coming back to life",https://timesofindia.indiatimes.com/articleshow/130311156.cms,2026-04-17T06:08:09+00:00
TOI ETimes,69,'Fake Christian': US Secretary of War Pete Hegseth trolled for quoting a 'Bible verse' from Pulp Fiction,https://timesofindia.indiatimes.com/articleshow/130306055.cms,2026-04-17T06:08:09+00:00
TOI ETimes,70,He holds 138 degrees at 55: Rajasthan ex-Army man sets 11 world records – his inspiring story,https://timesofindia.indiatimes.com/articleshow/130305419.cms,2026-04-17T06:08:09+00:00
TOI ETimes,71,Who is Bita Hemmati? Know the Iranian woman set to face execution in her homeland - What are the charges?,https://timesofindia.indiatimes.com/articleshow/130305942.cms,2026-04-17T06:08:09+00:00
TOI ETimes,72,Who was Savitha Shan? Parents launch scholarship for low-income family students in memory of UT student killed in March shooting,https://timesofindia.indiatimes.com/articleshow/130302311.cms,2026-04-17T06:08:09+00:00
TOI ETimes,73,"Black hijab and turban allowed but no bindi, chooda or tilak? Lenskart office policy making netizens furious - Peyush Bansal responds",https://timesofindia.indiatimes.com/articleshow/130300518.cms,2026-04-17T06:08:09+00:00
TOI ETimes,74,"Who is Vaishali Rameshbabu? Indian chess grandmaster set to challenge world champion Ju Wenjun for €300,000 title",https://timesofindia.indiatimes.com/articleshow/130299641.cms,2026-04-17T06:08:09+00:00
TOI ETimes,75,'You touched me without my permission’: Internet outraged as old Pakistan interview resurfaces showing man touching reporter mid-interview,https://timesofindia.indiatimes.com/articleshow/130298608.cms,2026-04-17T06:08:09+00:00
TOI ETimes,76,Punjabi dhaba owner in Kochi speaks Malayalam like a local – but how? Viral video gets Shashi Tharoor’s attention,https://timesofindia.indiatimes.com/articleshow/130297383.cms,2026-04-17T06:08:09+00:00
TOI ETimes,77,Pune’s 169-year-old bakery serves an iconic bread once loved by Indira Gandhi and Dilip Kumar,https://timesofindia.indiatimes.com/articleshow/130296506.cms,2026-04-17T06:08:09+00:00
TOI ETimes,78,Meet Arjun Singh: Indian-origin Gradescope co-founder wins prestigious Mark Bingham Award for Excellence in Achievement,https://timesofindia.indiatimes.com/articleshow/130293030.cms,2026-04-17T06:08:09+00:00
TOI ETimes,79,"""Experiences > objects"": Bengaluru techie with 50 LPA salary sets example by investing in house and travel over iPhones and Zara clothing",https://timesofindia.indiatimes.com/articleshow/130292147.cms,2026-04-17T06:08:09+00:00
TOI ETimes,80,"Woman sues ChatGPT, alleges AI helped ex-boyfriend stalk her despite red flags",https://timesofindia.indiatimes.com/articleshow/130291183.cms,2026-04-17T06:08:09+00:00
TOI ETimes,81,What are dark factories in China that work without any human intervention?,https://timesofindia.indiatimes.com/articleshow/130290333.cms,2026-04-17T06:08:09+00:00
TOI ETimes,82,Why do we have fingerprints? Study reveals unexpected reasons why this trait evolved,https://timesofindia.indiatimes.com/articleshow/130288560.cms,2026-04-17T06:08:09+00:00
TOI ETimes,83,"Who is Jeffrey Scruggs, the Obama lookalike Joe Biden hilariously called out at his Law school event?",https://timesofindia.indiatimes.com/articleshow/130285430.cms,2026-04-17T06:08:09+00:00
