source,rank,headline,link,collected_at_iso
LiveMint,77,IFSC Code Finder,https://www.livemint.com/ifsc-code,2026-04-13T13:56:28+00:00
LiveMint,78,Income Tax Calculator,https://www.livemint.com/tools-calculators/income-tax-calculator,2026-04-13T13:56:28+00:00
LiveMint,79,Gold Rate Today,https://www.livemint.com/gold-prices,2026-04-13T13:56:28+00:00
LiveMint,80,Gold Rate in Delhi,https://www.livemint.com/gold-prices/delhi,2026-04-13T13:56:28+00:00
LiveMint,81,Gold Rate Hyderabad,https://www.livemint.com/gold-prices/hyderabad,2026-04-13T13:56:28+00:00
LiveMint,82,Silver Rate Today,https://www.livemint.com/silver-prices,2026-04-13T13:56:28+00:00
LiveMint,83,Silver Rate in Delhi,https://www.livemint.com/silver-prices/delhi,2026-04-13T13:56:28+00:00
LiveMint,84,Silver Rate in Bangalore,https://www.livemint.com/silver-prices/bangalore,2026-04-13T13:56:28+00:00
LiveMint,85,US Stock Market,https://www.livemint.com/market/us-market,2026-04-13T13:56:28+00:00
LiveMint,86,Terms of Use,https://www.livemint.com/terms-of-use,2026-04-13T13:56:28+00:00
LiveMint,87,Code of ethics,https://www.livemint.com/code-of-ethics,2026-04-13T13:56:28+00:00
LiveMint,88,Stock Market Today,https://www.livemint.com/market/stock-market-news/stock-market-today-sensex-today-nifty-gold-rate-today-silver-rate-today-crude-oil-prices-us-iran-war-trump-7-april-2026-11775527434110.html,2026-04-13T13:56:28+00:00
LiveMint,89,MCX Gold Rate,https://www.livemint.com/market/market-stats/commodity-mcx-gold-price,2026-04-13T13:56:28+00:00
LiveMint,90,MCX Silver Price,https://www.livemint.com/market/market-stats/commodity-mcx-silver-price,2026-04-13T13:56:28+00:00
LiveMint,91,Gold Price in Mumbai,https://www.livemint.com/gold-prices/mumbai,2026-04-13T13:56:28+00:00
LiveMint,92,Gold Price in Chennai,https://www.livemint.com/gold-prices/chennai,2026-04-13T13:56:28+00:00
LiveMint,93,Gold Price in Kolkata,https://www.livemint.com/gold-prices/kolkata,2026-04-13T13:56:28+00:00
LiveMint,94,Silver Price in Mumbai,https://www.livemint.com/silver-prices/mumbai,2026-04-13T13:56:28+00:00
LiveMint,95,Silver Price in Chennai,https://www.livemint.com/silver-prices/chennai,2026-04-13T13:56:28+00:00
LiveMint,96,Silver Price in Hyderabad,https://www.livemint.com/silver-prices/hyderabad,2026-04-13T13:56:28+00:00
LiveMint,97,Silver Price in Kolkata,https://www.livemint.com/silver-prices/kolkata,2026-04-13T13:56:28+00:00
LiveMint,98,Latest News Today,https://www.livemint.com/news,2026-04-13T13:56:28+00:00
LiveMint,99,US News Today,https://www.livemint.com/news/us-news,2026-04-13T13:56:28+00:00
LiveMint,100,Top Company Leader,https://www.livemint.com/companies/people,2026-04-13T13:56:28+00:00
LiveMint,101,personal loan emi calculator,https://www.livemint.com/loans/personal-loan-emi-calculator,2026-04-13T13:56:28+00:00
LiveMint,102,Personal Loan Interest Rate,https://www.livemint.com/loans/personal-loan-interest-rates,2026-04-13T13:56:28+00:00
LiveMint,103,Personal Loan Eligibility,https://www.livemint.com/loans/personal-loan-eligibility,2026-04-13T13:56:28+00:00
LiveMint,104,Instant Personal Loan,https://www.livemint.com/loans/instant-personal-loan,2026-04-13T13:56:28+00:00
LiveMint,105,Home Loan EMI Calculator,https://www.livemint.com/tools-calculators/home-loan-emi-calculator,2026-04-13T13:56:28+00:00
LiveMint,106,Car Loan EMI,https://www.livemint.com/tools-calculators/car-loan-calculator,2026-04-13T13:56:28+00:00
India Today,1,Bengaluru founder blames pedestrians for traffic jam. Internet has thoughts,https://www.indiatoday.in/trending-news/story/bengaluru-founder-blames-pedestrians-for-traffic-jam-internet-has-thoughts-2895578-2026-04-13,2026-04-13T13:56:28+00:00
India Today,2,"Red panda cute, Hungrypanda not: Zohran Mamdani's zoo announcement goes viral",https://www.indiatoday.in/trending-news/story/zohran-mamdanis-zoo-announcement-goes-viral-in-new-york-city-food-delivery-app-hungrypanda-settlement-2895546-2026-04-13,2026-04-13T13:56:28+00:00
India Today,3,"After Arijit Singh concert, HCL employees discover an unexpected metro perk",https://www.indiatoday.in/trending-news/story/after-arijit-singh-concert-hcl-employees-discover-an-unexpected-delhi-metro-perk-2895486-2026-04-13,2026-04-13T13:56:28+00:00
India Today,4,How this engineer made classroom trigonometry click for the internet,https://www.indiatoday.in/trending-news/story/how-this-engineer-made-classroom-trigonometry-click-for-the-internet-2895416-2026-04-13,2026-04-13T13:56:28+00:00
India Today,5,"Anand Mahindra mourns Asha Bhosle, recalls her 'bold, experimental' style",https://www.indiatoday.in/trending-news/story/anand-mahindra-mourns-asha-bhosle-recalls-her-bold-experimental-style-2895418-2026-04-13,2026-04-13T13:56:28+00:00
India Today,6,Mumbai entrepreneur's hiring decision after candidate said he was fired goes viral,https://www.indiatoday.in/trending-news/story/mumbai-entrepreneur-hiring-decision-after-candidate-said-he-was-fired-from-last-job-goes-viral-2895366-2026-04-13,2026-04-13T13:56:28+00:00
India Today,7,Startup advisor shares how 'well-timed' chat with Deepinder Goyal shaped his purpose,https://www.indiatoday.in/trending-news/story/startup-advisor-shares-how-well-timed-chat-with-deepinder-goyal-shaped-his-purpose-2895308-2026-04-13,2026-04-13T13:56:28+00:00
India Today,8,Paytm founder praises man's fun take on trigonometric formulas. Must watch,https://www.indiatoday.in/trending-news/story/mechanical-engineers-fun-take-on-trigonometric-formulas-goes-viral-paytm-founder-shares-post-2895157-2026-04-12,2026-04-13T13:56:28+00:00
India Today,9,Thief gets trapped in shutter while trying to break into UP clinic. Video is viral,https://www.indiatoday.in/trending-news/story/thief-gets-trapped-in-shutter-while-trying-to-break-into-up-clinic-video-is-viral-2895148-2026-04-12,2026-04-13T13:56:28+00:00
India Today,10,"Woman misses bus despite being on time, gets refund after video goes viral",https://www.indiatoday.in/trending-news/story/woman-misses-bus-despite-being-on-time-gets-refund-after-video-goes-viral-2895138-2026-04-12,2026-04-13T13:56:28+00:00
India Today,11,Founder flags 'not my problem' mindset after co-passenger litters IndiGo flight,https://www.indiatoday.in/trending-news/story/founder-flags-not-my-problem-mindset-after-co-passenger-litters-indigo-flight-2895124-2026-04-12,2026-04-13T13:56:28+00:00
India Today,12,Family gifts air cooler to house help. Her priceless reaction has internet's heart,https://www.indiatoday.in/trending-news/story/family-gifts-air-cooler-to-house-help-her-priceless-reaction-has-internets-heart-2895052-2026-04-12,2026-04-13T13:56:28+00:00
India Today,13,This video of a paralysed auto driver offering prayers will stop you mid-scroll,https://www.indiatoday.in/trending-news/story/this-video-of-a-paralysed-auto-driver-offering-prayers-will-stop-you-mid-scroll-2895049-2026-04-12,2026-04-13T13:56:28+00:00
India Today,14,Railway staff dumps garbage from moving train. Viral video raises questions,https://www.indiatoday.in/trending-news/story/railway-staff-dumps-garbage-from-moving-train-viral-video-raises-questions-2895036-2026-04-12,2026-04-13T13:56:28+00:00
India Today,15,Russian woman rates Indian cities on safety. Guess how much Delhi got,https://www.indiatoday.in/trending-news/story/russian-woman-rates-indian-cities-on-safety-in-viral-video-guess-how-much-delhi-got-2895029-2026-04-12,2026-04-13T13:56:28+00:00
India Today,16,Rs 500 for a day in Bengaluru? Woman's budget challenge goes viral,https://www.indiatoday.in/trending-news/story/rs-500-for-a-day-in-bengaluru-womans-budget-challenge-goes-viral-2895015-2026-04-12,2026-04-13T13:56:28+00:00
India Today,17,"Woman fired for 'no work' gets rehired to train replacements, internet goes huh?",https://www.indiatoday.in/trending-news/story/woman-fired-for-no-work-gets-rehired-to-train-replacements-internet-goes-huh-2894811-2026-04-11,2026-04-13T13:56:28+00:00
India Today,18,Mumbai woman shares how her boss sent mangoes after she mentioned missing them,https://www.indiatoday.in/trending-news/story/mumbai-woman-shares-how-her-boss-sent-mangoes-after-she-mentioned-missing-them-2894796-2026-04-11,2026-04-13T13:56:28+00:00
India Today,19,"Little girl proudly shows her medal on cycle ride with father, you'll definitely smile",https://www.indiatoday.in/trending-news/story/little-girl-proudly-shows-her-medal-on-cycle-ride-with-father-youll-definitely-smile-2894771-2026-04-11,2026-04-13T13:56:28+00:00
India Today,20,"Korean woman unboxes RCB jersey, her reaction is just too adorable to miss",https://www.indiatoday.in/trending-news/story/korean-woman-unboxes-rcb-jersey-her-reaction-is-just-too-adorable-to-miss-2894721-2026-04-11,2026-04-13T13:56:28+00:00
India Today,21,Will Varun be ready for CSK clash? KKR provides update ahead of Chepauk tie,https://www.indiatoday.in/sports/cricket/story/ipl-2026-csk-vs-kkr-varun-chakravarthy-return-chepauk-matheesha-pathirana-2895610-2026-04-13,2026-04-13T13:56:28+00:00
India Today,22,Apple iPhone 18 launch: List of 6 upgrades it is likely to receive,https://www.indiatoday.in/technology/features/story/apple-iphone-18-launch-list-of-6-upgrades-it-is-likely-to-receive-2895448-2026-04-13,2026-04-13T13:56:28+00:00
India Today,23,Oppo F33 series key features revealed ahead of April 15 debut,https://www.indiatoday.in/technology/news/story/oppo-f33-series-key-features-revealed-ahead-of-april-15-debut-2895608-2026-04-13,2026-04-13T13:56:28+00:00
India Today,24,Ginny Wedss Sunny 2 trailer: Avinash Tiwary-Medha Shankr star in chaotic love story,https://www.indiatoday.in/movies/bollywood/story/ginny-wedss-sunny-2-trailer-avinash-tiwary-medha-shankr-star-in-chaotic-love-story-2893669-2026-04-09,2026-04-13T13:56:28+00:00
India Today,25,The scientific genius of India's tabla and mridangam,https://www.indiatoday.in/science/story/tabla-physics-syahi-cv-raman-indian-drums-science-harmonic-series-2894868-2026-04-11,2026-04-13T13:56:28+00:00
India Today,26,"Man beats neighbour's dog with stick for barking at wife, attack caught on CCTV",https://www.indiatoday.in/cities/bengaluru/story/bengaluru-man-beats-neighbour-dog-barking-at-wife-cctv-attack-2895524-2026-04-13,2026-04-13T13:56:28+00:00
India Today,27,Kareena Kapoor skips queue at airport. Security drill or celebrity perk?,https://www.indiatoday.in/movies/celebrities/story/kareena-kapoor-airport-entry-stirs-debate-security-drill-or-celebrity-perk-2895309-2026-04-13,2026-04-13T13:56:28+00:00
TOI ETimes,1,Kareena stuns in red Valentino as Saif can’t take eyes off her,https://timesofindia.indiatimes.com/articleshow/130209251.cms,2026-04-13T13:56:28+00:00
TOI ETimes,2,Inside Rajasthan’s push for meaningful baby names: What you name your child matters more than you think,https://timesofindia.indiatimes.com/articleshow/130161079.cms,2026-04-13T13:56:28+00:00
TOI ETimes,3,"Quote of the day by Claude Shannon, the eponym of Claude AI: Information is the resolution of uncertainty",https://timesofindia.indiatimes.com/articleshow/130164653.cms,2026-04-13T13:56:28+00:00
TOI ETimes,4,Indian and American parenting and parental care: Viral social media clip highlights cultural differences,https://timesofindia.indiatimes.com/articleshow/130167532.cms,2026-04-13T13:56:28+00:00
TOI ETimes,5,When “first day of school” feels like a big goodbye: A viral video every parent will relate to,https://timesofindia.indiatimes.com/articleshow/130167652.cms,2026-04-13T13:56:28+00:00
TOI ETimes,6,Not your usual ID check: School video showcases students’ hilarious ‘ID card emotions’,https://timesofindia.indiatimes.com/articleshow/130169206.cms,2026-04-13T13:56:28+00:00
TOI ETimes,7,Aditya Uppal confesses he grew up watching Sanjay on VCR,https://timesofindia.indiatimes.com/articleshow/130238545.cms,2026-04-13T13:56:28+00:00
TOI ETimes,8,Asha Bhosle cremated with full state honours in Mumbai,https://timesofindia.indiatimes.com/articleshow/130238228.cms,2026-04-13T13:56:28+00:00
TOI ETimes,9,"'Dhurandhar 2' now first Hindi film to cross Rs 1,700 cr",https://timesofindia.indiatimes.com/articleshow/130222386.cms,2026-04-13T13:56:28+00:00
TOI ETimes,10,"DC Studios 2026 slate: A diverse lineup from ‘Supergirl,’ ‘Lanterns’ to ‘Clayface’",https://timesofindia.indiatimes.com/articleshow/130238145.cms,2026-04-13T13:56:28+00:00
TOI ETimes,11,Nicole Kidman plans a career shift as she trains as a death doula,https://timesofindia.indiatimes.com/articleshow/130237139.cms,2026-04-13T13:56:28+00:00
TOI ETimes,12,"Zeenat Aman remembers Asha Bhosle; says, 'she gifted me the soundtrack to my success'",https://timesofindia.indiatimes.com/articleshow/130236734.cms,2026-04-13T13:56:28+00:00
TOI ETimes,13,Jaya Prada mourns Asha Bhosle; calls her voice 'eternal and unforgettable',https://timesofindia.indiatimes.com/articleshow/130236639.cms,2026-04-13T13:56:28+00:00
TOI ETimes,14,Ranveer Singh consoles a tearful Zanai Bhosle with an emotional embrace at Asha Bhosle's funeral,https://timesofindia.indiatimes.com/articleshow/130236314.cms,2026-04-13T13:56:28+00:00
TOI ETimes,15,Sukhwinder Singh recalls his final conversation with Asha Bhosle: ‘I spoke to her on phone 10 days before…’,https://timesofindia.indiatimes.com/articleshow/130236165.cms,2026-04-13T13:56:28+00:00
TOI ETimes,16,'Dhurandhar 2' BO day 26 [LIVE]: Ranveer Singh film chases Rs. 1100 crore,https://timesofindia.indiatimes.com/articleshow/130230475.cms,2026-04-13T13:56:28+00:00
TOI ETimes,17,'Super Mario Galaxy' crowned highest-grossing film of 2026,https://timesofindia.indiatimes.com/articleshow/130220558.cms,2026-04-13T13:56:28+00:00
TOI ETimes,18,'Dhurandhar 2' box office Day 25 [LIVE]: Film is set to cross Rs 1080 cr today,https://timesofindia.indiatimes.com/articleshow/130204010.cms,2026-04-13T13:56:28+00:00
TOI ETimes,19,"‘Dhurandhar 2’ inches closer to Rs 1,700 cr worldwide in 24 days",https://timesofindia.indiatimes.com/articleshow/130201201.cms,2026-04-13T13:56:28+00:00
TOI ETimes,20,'Dhurandhar 2' box office day 24 [LIVE]: Film inches towards Rs 1100 cr,https://timesofindia.indiatimes.com/articleshow/130185972.cms,2026-04-13T13:56:28+00:00
TOI ETimes,21,Animal Preview: Ranbir Kapoor and Sandeep Reddy Vanga are set to shake up the box office hierarchy,https://timesofindia.indiatimes.com/articleshow/105615612.cms,2026-04-13T13:56:28+00:00
TOI ETimes,22,Tu Jhoothi Main Makkaar,https://timesofindia.indiatimes.com/articleshow/98272134.cms,2026-04-13T13:56:28+00:00
TOI ETimes,23,Apeksha: I believe that with persistence and passion,https://timesofindia.indiatimes.com/articleshow/130232667.cms,2026-04-13T13:56:28+00:00
TOI ETimes,24,Ankita mourns legendary singer Asha Bhosle’s demise,https://timesofindia.indiatimes.com/articleshow/130231989.cms,2026-04-13T13:56:28+00:00
TOI ETimes,25,Rashami Desai: I feel my journey has shaped,https://timesofindia.indiatimes.com/articleshow/130231851.cms,2026-04-13T13:56:28+00:00
TOI ETimes,26,Young singers learn from her work: Parleen on Asha,https://timesofindia.indiatimes.com/articleshow/130231616.cms,2026-04-13T13:56:28+00:00
TOI ETimes,27,"For me, acting is about feeling, not just performing: Adrija",https://timesofindia.indiatimes.com/articleshow/130231547.cms,2026-04-13T13:56:28+00:00
TOI ETimes,28,Did Ranveer Allahbadia of BeerBiceps casually confirm his romance with Juhi Bhatt at IPL? Who is she?,https://timesofindia.indiatimes.com/articleshow/130237474.cms,2026-04-13T13:56:28+00:00
TOI ETimes,29,The golden healer: Why your kitchen honey is the ultimate garden first aid hack,https://timesofindia.indiatimes.com/articleshow/130230412.cms,2026-04-13T13:56:28+00:00
TOI ETimes,30,Should you close the toilet lid before flushing: The right way to maintain toilet hygiene,https://timesofindia.indiatimes.com/articleshow/130232710.cms,2026-04-13T13:56:28+00:00
TOI ETimes,31,Elon Musk’s daily reading habit for career growth: Why reading can help you get better jobs,https://timesofindia.indiatimes.com/articleshow/130229306.cms,2026-04-13T13:56:28+00:00
TOI ETimes,32,"2-year-old starved to death, ate drywall and diapers in horror home; parents arrested",https://timesofindia.indiatimes.com/articleshow/130236870.cms,2026-04-13T13:56:28+00:00
TOI ETimes,33,"Inside Jeff Bezos and Lauren Sanchez’s daily routine: No phones, sunrise coffee, and a ‘Billionaire Bunker’",https://timesofindia.indiatimes.com/articleshow/130235132.cms,2026-04-13T13:56:28+00:00
TOI ETimes,34,What is ‘Katychella 2027’? Katy Perry’s viral comment on Justin Bieber at Coachella explained,https://timesofindia.indiatimes.com/articleshow/130233387.cms,2026-04-13T13:56:28+00:00
TOI ETimes,35,Ankur Warikoo’s post on parents is hitting everyone right in the heart,https://timesofindia.indiatimes.com/articleshow/130231910.cms,2026-04-13T13:56:28+00:00
TOI ETimes,36,Who is Richard Maza? YouTuber arrested after pepper spray clash; lawsuit crosses $1 million,https://timesofindia.indiatimes.com/articleshow/130231139.cms,2026-04-13T13:56:28+00:00
TOI ETimes,37,What is Bixonimania? How AI treated a fake illness as a real medical condition,https://timesofindia.indiatimes.com/articleshow/130230032.cms,2026-04-13T13:56:28+00:00
TOI ETimes,38,‘Gaate gaate hi chali jau’: Asha Bhosle’s heartfelt wish to embrace her final note while singing,https://timesofindia.indiatimes.com/articleshow/130229352.cms,2026-04-13T13:56:28+00:00
TOI ETimes,39,Juggy D: ‘Asha ji will forever be the definition of Indian music industry’ - Exclusive,https://timesofindia.indiatimes.com/articleshow/130228380.cms,2026-04-13T13:56:28+00:00
TOI ETimes,40,Shreya Ghoshal pays tribute to Asha Bhosle at her London concert: 'You are gonna be eternal',https://timesofindia.indiatimes.com/articleshow/130225605.cms,2026-04-13T13:56:28+00:00
TOI ETimes,41,Usha Uthup remembers Asha Bhosle,https://timesofindia.indiatimes.com/articleshow/130225773.cms,2026-04-13T13:56:28+00:00
TOI ETimes,42,Anup Jalota pays tribute: calls Asha Bhosle pillar of playback,https://timesofindia.indiatimes.com/articleshow/130225517.cms,2026-04-13T13:56:28+00:00
TOI ETimes,43,Dia Mirza remembers Asha Bhosle: Actor recalls first meeting and shoot,https://timesofindia.indiatimes.com/articleshow/130224700.cms,2026-04-13T13:56:28+00:00
TOI ETimes,44,Beyond Ebooks: The charm of bookstores endures,https://timesofindia.indiatimes.com/articleshow/101098088.cms,2026-04-13T13:56:28+00:00
TOI ETimes,45,It’s a curtain call: Sania Mirza bids adieu to tennis with ‘happy tears’,https://timesofindia.indiatimes.com/articleshow/98440670.cms,2026-04-13T13:56:28+00:00
TOI ETimes,46,A magical makeover for 17th Century stepwell: From neglected ruins to a glorious piece of history,https://timesofindia.indiatimes.com/articleshow/96557955.cms,2026-04-13T13:56:28+00:00
TOI ETimes,47,The city comes alive with Christmas fervour,https://timesofindia.indiatimes.com/articleshow/96406573.cms,2026-04-13T13:56:28+00:00
TOI ETimes,48,#BringRioHome: Pet parents launch search to find their kidnapped cat,https://timesofindia.indiatimes.com/articleshow/96334809.cms,2026-04-13T13:56:28+00:00
TOI ETimes,49,Adil Hussain’s 'Mercy' release date OUT: Film's first look to be attached with Ranveer Singh's 'Dhurandhar: The Revenge',https://timesofindia.indiatimes.com/articleshow/129843424.cms,2026-04-13T13:56:28+00:00
TOI ETimes,50,It’s the best time to be doing theatre: Juhi Babbar Soni,https://timesofindia.indiatimes.com/articleshow/129826631.cms,2026-04-13T13:56:28+00:00
TOI ETimes,51,"Anu Malik steps into theatre with Anupam Kher’s play, Calls it his most exciting challenge yet",https://timesofindia.indiatimes.com/articleshow/129729335.cms,2026-04-13T13:56:28+00:00
TOI ETimes,52,'Wicked' musical director John Stefaniuk on live music on the stage: 'It is so exciting to hear the orchestra whisk us away',https://timesofindia.indiatimes.com/articleshow/129610267.cms,2026-04-13T13:56:28+00:00
TOI ETimes,53,"'Wicked' stars Rebekah Lowings and Eve Shanu-Wilson on Elphaba-Glinda's bond: 'Friends challenge you, not just cheer you on'",https://timesofindia.indiatimes.com/articleshow/129607673.cms,2026-04-13T13:56:28+00:00
TOI ETimes,54,"Vijay Crishna, Shah Rukh Khan’s on-screen father in ‘Devdas,’ passes away at 81: Tributes pour in for theatre stalwart",https://timesofindia.indiatimes.com/articleshow/129016007.cms,2026-04-13T13:56:28+00:00
TOI ETimes,55,Raj Kundra and Shilpa Shetty's 15th Wedding Anniversary,https://timesofindia.indiatimes.com/articleshow/115563990.cms,2026-04-13T13:56:28+00:00
TOI ETimes,56,​Bigg Boss winners list from season 1 to 17​,https://timesofindia.indiatimes.com/articleshow/114277426.cms,2026-04-13T13:56:28+00:00
TOI ETimes,57,​Discover the bird with a prehistoric roar​,https://timesofindia.indiatimes.com/articleshow/114244474.cms,2026-04-13T13:56:28+00:00
TOI ETimes,58,Dia Mirza's ethnic wear,https://timesofindia.indiatimes.com/articleshow/114243410.cms,2026-04-13T13:56:28+00:00
TOI ETimes,59,​Incredible facts about ants you won’t believe​,https://timesofindia.indiatimes.com/articleshow/114243248.cms,2026-04-13T13:56:28+00:00
TOI ETimes,60,'Bigg Boss Marathi 5' nears grand finale​,https://timesofindia.indiatimes.com/articleshow/113936459.cms,2026-04-13T13:56:28+00:00
TOI ETimes,61,‘Priorities clear’: Hilarious KKR vs LSG clip shows husband glued to match as wife walks away mid-argument,https://timesofindia.indiatimes.com/articleshow/130225505.cms,2026-04-13T13:56:28+00:00
TOI ETimes,62,Foreign woman rates Indian cities; Delhi’s shocking score doesn’t surprise many,https://timesofindia.indiatimes.com/articleshow/130224421.cms,2026-04-13T13:56:28+00:00
TOI ETimes,63,'Indian doctors leaving the NHS': Is visa insecurity behind the sudden decrease of staff in UK healthcare?,https://timesofindia.indiatimes.com/articleshow/130229193.cms,2026-04-13T13:56:28+00:00
TOI ETimes,64,'Severe form of slavery': Indians filming AI training videos spark backlash online,https://timesofindia.indiatimes.com/articleshow/130235359.cms,2026-04-13T13:56:28+00:00
TOI ETimes,65,"Happy Baisakhi 2026: Best Messages, Quotes, Wishes and Images to share on Baisakhi",https://timesofindia.indiatimes.com/articleshow/130209908.cms,2026-04-13T13:56:28+00:00
TOI ETimes,66,From sleeping on streets to giving shelter to others: NYC restaurant owner builds refuge for the homeless,https://timesofindia.indiatimes.com/articleshow/130232214.cms,2026-04-13T13:56:28+00:00
TOI ETimes,67,'This is evil': AI tool charging $2 per minute to talk with Jesus faces massive backlash online,https://timesofindia.indiatimes.com/articleshow/130226073.cms,2026-04-13T13:56:28+00:00
TOI ETimes,68,Meet Mike Egan: Marine veteran who lost his legs in a blast completes 110 miles outlasting 117 athletes in a brutal 27-hour race,https://timesofindia.indiatimes.com/articleshow/130220469.cms,2026-04-13T13:56:28+00:00
TOI ETimes,69,"Famous 'tape guy' who secretly recorded 10,000 live concerts is now putting them online for free",https://timesofindia.indiatimes.com/articleshow/130219497.cms,2026-04-13T13:56:28+00:00
TOI ETimes,70,"Happy Baisakhi 2026: Top 85 Wishes, Messages and Quotes to share with your loved ones",https://timesofindia.indiatimes.com/articleshow/130208136.cms,2026-04-13T13:56:28+00:00
TOI ETimes,71,5 viral home remedies to kill termites (deemak) without harsh chemicals,https://timesofindia.indiatimes.com/articleshow/130207052.cms,2026-04-13T13:56:28+00:00
TOI ETimes,72,‘Is it anyone’s job to check for sharks?’ NASA responds after Artemis II splashdown,https://timesofindia.indiatimes.com/articleshow/130207133.cms,2026-04-13T13:56:28+00:00
TOI ETimes,73,'I alone eat 150-200 mangoes': Indians react as internet fumes over India eating 50% of global mango supply,https://timesofindia.indiatimes.com/articleshow/130206271.cms,2026-04-13T13:56:28+00:00
TOI ETimes,74,"No AC, no problem: These 5 easy home hacks actually work",https://timesofindia.indiatimes.com/articleshow/130205555.cms,2026-04-13T13:56:28+00:00
TOI ETimes,75,When Tom Cruise fell for Asha Bhosle’s Chicken Tikka Masala: A story that says all about her love for food,https://timesofindia.indiatimes.com/articleshow/130205671.cms,2026-04-13T13:56:28+00:00
TOI ETimes,76,‘It breaks my heart every time’: Bengaluru dad torn between job and 1-year-old son,https://timesofindia.indiatimes.com/articleshow/130204512.cms,2026-04-13T13:56:28+00:00
TOI ETimes,77,'Very isolating': Elon Musk's estranged trans daughter Vivian Wilson opens up about painful childhood with billionaire dad,https://timesofindia.indiatimes.com/articleshow/130204255.cms,2026-04-13T13:56:28+00:00
TOI ETimes,78,Happy Baisakhi 2026: Significance of Baisakhi for Sikhs,https://timesofindia.indiatimes.com/articleshow/130203814.cms,2026-04-13T13:56:28+00:00
TOI ETimes,79,‘This is dangerous’: Internet reacts to toddler’s balcony jump video,https://timesofindia.indiatimes.com/articleshow/130202672.cms,2026-04-13T13:56:28+00:00
TOI ETimes,80,14-year-old boy selling postcards outside Angkor Wat who spoke 12 languages is now living an entirely different life,https://timesofindia.indiatimes.com/articleshow/130197303.cms,2026-04-13T13:56:28+00:00
TOI ETimes,81,Indian-origin MBA student Anaheez Patel breaks silence after viral clash with billionaire Nikhil Kamath: 'I grew up with privilege...',https://timesofindia.indiatimes.com/articleshow/130193502.cms,2026-04-13T13:56:28+00:00
TOI ETimes,82,Arriving on a horse for your baraat? Shantanu Naidu's viral video raises questions about animal cruelty in Indian weddings,https://timesofindia.indiatimes.com/articleshow/130189433.cms,2026-04-13T13:56:28+00:00
TOI ETimes,83,Who was Sawai Madho Singh II? The Maharaja who carried his own water to the United Kingdom in the world's largest silverware,https://timesofindia.indiatimes.com/articleshow/130190590.cms,2026-04-13T13:56:28+00:00
