source,rank,headline,link,collected_at_iso
NDTV,16,Oracle Office In Dubai Hit In Iran Strikes? What UAE Said,https://www.ndtv.com/world-news/iran-war-news-did-iran-attack-tech-firm-oracles-office-in-dubai-what-uae-said-11304947,2026-04-03T02:54:19+00:00
NDTV,17,Pete Hegseth Asks US Army Chief Of Staff To Step Down,https://www.ndtv.com/world-news/pete-hegseth-asks-us-army-chief-gen-randy-george-of-staff-to-step-down-11304613,2026-04-03T02:54:19+00:00
NDTV,18,"On Middle East Crisis And LPG, 2 Top Congress Leaders Ditch Party Line",https://www.ndtv.com/india-news/on-middle-east-crisis-and-lpg-2-top-congress-leaders-ditch-party-line-11304241,2026-04-03T02:54:19+00:00
NDTV,19,"""You Shouldn't Talk Every Day"": Macron Slams Trump For Iran War U-Turns",https://www.ndtv.com/world-news/iran-war-news-you-shouldnt-talk-every-day-emmanuel-macron-slams-donald-trump-for-iran-war-u-turns-11303480,2026-04-03T02:54:19+00:00
NDTV,20,Indian-American Lawyer Challenges Trump's Birthright Citizenship Order,https://www.ndtv.com/world-news/indian-american-lawyer-smita-ghosh-challenges-donald-trumps-birthright-citizenship-order-11303354,2026-04-03T02:54:19+00:00
NDTV,21,"Live: Iran, Allies Trade Fire With Israel, US As War Shows No Signs Of Easing",https://www.ndtv.com/world-news/donald-trumps-address-on-us-iran-war-live-updates-big-speech-on-iran-war-middle-east-conflict-oil-crisis-strait-of-hormuz-11299579,2026-04-03T02:54:19+00:00
NDTV,22,Inside Oracle's India Layoffs: What Employees Received As Severance Package,https://www.ndtv.com/feature/inside-oracles-india-layoffs-what-employees-say-they-received-as-severance-package-11300670,2026-04-03T02:54:19+00:00
NDTV,23,"""Bid To Silence,"" Say Sources As AAP Demotes Raghav Chadha In Parliament",https://www.ndtv.com/india-news/raghav-chadha-arvind-kejriwal-aap-drops-raghav-chadha-once-its-key-face-as-rajya-sabha-deputy-leader-11301426,2026-04-03T02:54:19+00:00
NDTV,24,"""Our Indian Friends In Safe Hands, No Worries"": Iran On Hormuz Blockade",https://www.ndtv.com/world-news/iran-on-strait-of-hormuz-blockade-amid-war-with-israel-us-our-indian-friends-in-safe-hands-no-worries-11301272,2026-04-03T02:54:19+00:00
NDTV,25,"On Camera, Iran's Shahed Drone Chased By US F-15 Jet Over Iraq",https://www.ndtv.com/world-news/iran-war-news-video-shows-us-f-15-trying-to-chase-irans-shahed-drone-over-iraq-11300262,2026-04-03T02:54:19+00:00
NDTV,26,'Doesn't Merit Response': Emmanuel Macron On Trump's Marriage Jibe,https://www.ndtv.com/world-news/doesnt-merit-response-emmanuel-macron-on-trump-marriage-jibe-11302308,2026-04-03T02:54:19+00:00
NDTV,27,Sandeep Rai Rathore Appointed As Tamil Nadu Top Cop Ahead Of Polls,https://www.ndtv.com/india-news/2026-tamil-nadu-elections-sandeep-rai-rathore-appointed-as-tamil-nadu-top-cop-ahead-of-polls-11303816,2026-04-03T02:54:19+00:00
NDTV,28,Gen-Z Voters Signal A Shift In Tamil Nadu Elections,https://www.ndtv.com/india-news/2026-tamil-nadu-assembly-elections-gen-z-voters-signal-a-shift-in-tamil-nadu-elections-11302244,2026-04-03T02:54:19+00:00
NDTV,29,"Man Enters UP Home, Women Residents Calmly Corner And Beat Him Up",https://www.ndtv.com/india-news/man-enters-up-home-women-residents-calmly-corner-and-beat-him-up-11301579,2026-04-03T02:54:19+00:00
NDTV,30,Latest News Today,https://www.ndtv.com/latest,2026-04-03T02:54:19+00:00
NDTV,31,Education News India,https://www.ndtv.com/education,2026-04-03T02:54:19+00:00
NDTV,32,Latest Business News,https://www.ndtv.com/business-news,2026-04-03T02:54:19+00:00
NDTV,33,Rajnath Singh warns Pakistan,https://www.ndtv.com/india-news/any-misadventure-from-pakistan-will-invite-unprecedented-action-rajnath-singh-11302766,2026-04-03T02:54:19+00:00
