source,rank,headline,link,collected_at_iso
TOI ETimes,85,‘Is it anyone’s job to check for sharks?’ NASA responds after Artemis II splashdown,https://timesofindia.indiatimes.com/articleshow/130207133.cms,2026-04-14T06:04:36+00:00
TOI ETimes,86,'I alone eat 150-200 mangoes': Indians react as internet fumes over India eating 50% of global mango supply,https://timesofindia.indiatimes.com/articleshow/130206271.cms,2026-04-14T06:04:36+00:00
TOI ETimes,87,"No AC, no problem: These 5 easy home hacks actually work",https://timesofindia.indiatimes.com/articleshow/130205555.cms,2026-04-14T06:04:36+00:00
TOI ETimes,88,When Tom Cruise fell for Asha Bhosle’s Chicken Tikka Masala: A story that says all about her love for food,https://timesofindia.indiatimes.com/articleshow/130205671.cms,2026-04-14T06:04:36+00:00
TOI ETimes,89,‘It breaks my heart every time’: Bengaluru dad torn between job and 1-year-old son,https://timesofindia.indiatimes.com/articleshow/130204512.cms,2026-04-14T06:04:36+00:00
TOI ETimes,90,'Very isolating': Elon Musk's estranged trans daughter Vivian Wilson opens up about painful childhood with billionaire dad,https://timesofindia.indiatimes.com/articleshow/130204255.cms,2026-04-14T06:04:36+00:00
TOI ETimes,91,Happy Baisakhi 2026: Significance of Baisakhi for Sikhs,https://timesofindia.indiatimes.com/articleshow/130203814.cms,2026-04-14T06:04:36+00:00
TOI ETimes,92,‘This is dangerous’: Internet reacts to toddler’s balcony jump video,https://timesofindia.indiatimes.com/articleshow/130202672.cms,2026-04-14T06:04:36+00:00
TOI ETimes,93,14-year-old boy selling postcards outside Angkor Wat who spo...,https://timesofindia.indiatimes.com/articleshow/130197303.cms,2026-04-14T06:04:36+00:00
TOI ETimes,94,Who was Sawai Madho Singh II? The Maharaja who carried his o...,https://timesofindia.indiatimes.com/articleshow/130190590.cms,2026-04-14T06:04:36+00:00
TOI ETimes,95,Indian-origin MBA student Anaheez Patel breaks silence after...,https://timesofindia.indiatimes.com/articleshow/130193502.cms,2026-04-14T06:04:36+00:00
TOI ETimes,96,Who is Venkatraman Ramakrishnan? The scientist who could not...,https://timesofindia.indiatimes.com/articleshow/130175981.cms,2026-04-14T06:04:36+00:00
TOI ETimes,97,Meet Harshita Arora: Indian-origin founder of $700M startup ...,https://timesofindia.indiatimes.com/articleshow/130122853.cms,2026-04-14T06:04:36+00:00
TOI ETimes,98,Viral video: Russian tourist choked by locals in Bali after ...,https://timesofindia.indiatimes.com/articleshow/129983079.cms,2026-04-14T06:04:36+00:00
TOI ETimes,99,"Meet Palmer Luckey: He built a $2 billion company at 19, got...",https://timesofindia.indiatimes.com/articleshow/129907090.cms,2026-04-14T06:04:36+00:00
TOI ETimes,100,"Happy Eid-ul-Fitr 2026: Eid Mubarak Wishes, Messages, Quotes...",https://timesofindia.indiatimes.com/articleshow/129680487.cms,2026-04-14T06:04:36+00:00
TOI ETimes,101,Meet Patrick Winston: MIT professor whose one-hour lecture s...,https://timesofindia.indiatimes.com/articleshow/129827810.cms,2026-04-14T06:04:36+00:00
TOI ETimes,102,Arriving on a horse for your baraat? Shantanu Naidu's viral video raises questions about animal cruelty in Indian weddings,https://timesofindia.indiatimes.com/articleshow/130189433.cms,2026-04-14T06:04:36+00:00
TOI ETimes,103,"Which Raja Ravi Varma painting is now India’s most expensive ever, and why can’t it leave the country?",https://timesofindia.indiatimes.com/articleshow/130188686.cms,2026-04-14T06:04:36+00:00
TOI ETimes,104,"The Sahara desert was once green and full of lakes and rivers: Cave reveals secrets from 8,000 years ago!",https://timesofindia.indiatimes.com/articleshow/130188418.cms,2026-04-14T06:04:36+00:00
TOI ETimes,105,What is the viral 'anxiety bag' and how it’s helping stressed Gen Z stay calm?,https://timesofindia.indiatimes.com/articleshow/130186848.cms,2026-04-14T06:04:36+00:00
TOI ETimes,106,"ChatGPT’s Sam Altman home attacked with Molotov cocktail: CEO shares family photo, says, “I love them more than anything”",https://timesofindia.indiatimes.com/articleshow/130186660.cms,2026-04-14T06:04:36+00:00
TOI ETimes,107,What is Amanda Ungaro's link to Melania Trump? Meet the Brazilian model who has a connection with Epstein and claims to 'expose' everything she knows about the US First Lady,https://timesofindia.indiatimes.com/articleshow/130184673.cms,2026-04-14T06:04:36+00:00
TOI ETimes,108,"Who is Doreen Romel Shamow? ""Iraq's power queen"" and volleyball player going viral online for her adorable looks",https://timesofindia.indiatimes.com/articleshow/130176488.cms,2026-04-14T06:04:36+00:00
TOI ETimes,109,"Meet Nathan Byrd: The 18-year-old who dashed into a smoke-filled home, saved family and a dog",https://timesofindia.indiatimes.com/articleshow/130175208.cms,2026-04-14T06:04:36+00:00
TOI ETimes,110,Rare solar eclipse spotted on the never-before-seen side of the Moon: What unique phenomenon did Artemis II astronauts observe during their flyby beyond the Moon?,https://timesofindia.indiatimes.com/articleshow/130174023.cms,2026-04-14T06:04:36+00:00
TOI ETimes,111,What is Buzz Lightyear’s Space Ranger Spin? Iconic 90s Disney ride reopens with a facelift before Toy Story 5 release,https://timesofindia.indiatimes.com/articleshow/130173849.cms,2026-04-14T06:04:36+00:00
TOI ETimes,112,"He was 229 kg, his friend sent him fat-shaming texts for weeks, then he lost 130 kg",https://timesofindia.indiatimes.com/articleshow/130170915.cms,2026-04-14T06:04:36+00:00
TOI ETimes,113,Who is Jason Howe? The 26-year-old high school coach accused of assault after student’s brave complaint,https://timesofindia.indiatimes.com/articleshow/130170573.cms,2026-04-14T06:04:36+00:00
TOI ETimes,114,"Who is Rao Inderjeet Yadav? From luxury lifestyle posts to Dubai arrest claim, what we know so far",https://timesofindia.indiatimes.com/articleshow/130165704.cms,2026-04-14T06:04:36+00:00
TOI ETimes,115,"Watch here: 11,000 litres of milk poured into Narmada river during MP temple ritual, video sparks debate",https://timesofindia.indiatimes.com/articleshow/130163631.cms,2026-04-14T06:04:36+00:00
TOI ETimes,116,Watch here: Cockroach in biryani? Birthday celebration at Barbeque Nation Gorakhpur sparks outrage,https://timesofindia.indiatimes.com/articleshow/130163142.cms,2026-04-14T06:04:36+00:00
TOI ETimes,117,"'Colourist, classist, garbage': Hollywood actresses Maitreyi Ramakrishnan and Supriya Ganesh hit back at 'maid phenotype' labels online",https://timesofindia.indiatimes.com/articleshow/130160652.cms,2026-04-14T06:04:36+00:00
TOI ETimes,118,What is ‘MMIWG2SLGBTQQIA+’? Canadian MP’s remark goes viral; Elon Musk reacts,https://timesofindia.indiatimes.com/articleshow/130160287.cms,2026-04-14T06:04:36+00:00
TOI ETimes,119,‘I have blacklisted your company’: Job seeker’s shocking reply leaves recruiter speechless,https://timesofindia.indiatimes.com/articleshow/130158695.cms,2026-04-14T06:04:36+00:00
TOI ETimes,120,Peaky Blinders: Uncovering the truth behind Tommy Shelby’s empire; what’s real and what’s fiction?,https://timesofindia.indiatimes.com/articleshow/130152544.cms,2026-04-14T06:04:36+00:00
TOI ETimes,121,Watch Noida shocker: Dog tied and thrashed on balcony; pet rescued after video goes viral,https://timesofindia.indiatimes.com/articleshow/130152017.cms,2026-04-14T06:04:36+00:00
TOI ETimes,122,Major update in fatal MRI incident: Lawsuit filed after man gets pulled into machine with metal chain,https://timesofindia.indiatimes.com/articleshow/130147240.cms,2026-04-14T06:04:36+00:00
TOI ETimes,123,‘Poor kid got exhausted…’: Viral video of student fanning teacher in MP government school sparks outrage,https://timesofindia.indiatimes.com/articleshow/130148991.cms,2026-04-14T06:04:36+00:00
TOI ETimes,124,"Watch: 12-year-old’s violent reaction to ‘no more food’ goes viral, debate on parenting begins",https://timesofindia.indiatimes.com/articleshow/130147878.cms,2026-04-14T06:04:36+00:00
TOI ETimes,125,Samay Raina's challenge goes viral: ‘Still Alive’ reels show sons saying ‘I love you’ to dads,https://timesofindia.indiatimes.com/articleshow/130146175.cms,2026-04-14T06:04:36+00:00
TOI ETimes,126,One of psychology’s darkest human experiments: ‘Little Albert’ terrified for science in infamous 1920 study,https://timesofindia.indiatimes.com/articleshow/130142929.cms,2026-04-14T06:04:36+00:00
TOI ETimes,127,No aloo in samosa? This 500-year-old recipe from Akbar’s era is going viral,https://timesofindia.indiatimes.com/articleshow/130142851.cms,2026-04-14T06:04:36+00:00
TOI ETimes,128,Meet Gauri M? The 19‑year‑old Indian woman who landed a marketing job at BMW without a degree,https://timesofindia.indiatimes.com/articleshow/130140303.cms,2026-04-14T06:04:36+00:00
TOI ETimes,129,British pastor charged with manslaughter after man drowns during his own ‘born again’ baptism,https://timesofindia.indiatimes.com/articleshow/130139073.cms,2026-04-14T06:04:36+00:00
TOI ETimes,130,‘Chef is a big Emraan Hashmi fan!’: What is the viral ‘Chef’s Kiss’ dessert everyone’s talking about?,https://timesofindia.indiatimes.com/articleshow/130138249.cms,2026-04-14T06:04:36+00:00
TOI ETimes,131,From Kashmir to Edinburgh: Who is Dr Zarak Bhat - Kashmir scholar lands prestigious AI role at Edinburgh University,https://timesofindia.indiatimes.com/articleshow/130135692.cms,2026-04-14T06:04:36+00:00
TOI ETimes,132,"30 kg school bags & ₹9,000 for class 2 books: Parents call out ‘Education Scam’ in viral videos",https://timesofindia.indiatimes.com/articleshow/130131060.cms,2026-04-14T06:04:36+00:00
TOI ETimes,133,"Just days before Chardham Yatra 2026, Kedarnath Dham covered in 5 feet snow - Internet reacts to viral videos",https://timesofindia.indiatimes.com/articleshow/130129107.cms,2026-04-14T06:04:36+00:00
TOI ETimes,134,Zoho’s Sridhar Vembu says ‘Go back to villages’ - Netizens are divided,https://timesofindia.indiatimes.com/articleshow/130128299.cms,2026-04-14T06:04:36+00:00
TOI ETimes,135,Watch: Man frozen on Bengaluru street fuels shocking ‘zombie drug’ claims online,https://timesofindia.indiatimes.com/articleshow/130122834.cms,2026-04-14T06:04:36+00:00
TOI ETimes,136,Is El Niño coming back? Here’s what it could mean for 2026 weather,https://timesofindia.indiatimes.com/articleshow/130122893.cms,2026-04-14T06:04:36+00:00
TOI ETimes,137,7-Eleven video of Indian worker sparks H-1B debate in US; congressman calls it a ‘scam’,https://timesofindia.indiatimes.com/articleshow/130117948.cms,2026-04-14T06:04:36+00:00
TOI ETimes,138,"Who is Abhijay Arora? Failed JEE, faced ₹1 crore debt and 90-day job deadline, then cracked Google",https://timesofindia.indiatimes.com/articleshow/130117745.cms,2026-04-14T06:04:36+00:00
TOI ETimes,139,"College backlog to big tech offers: How this Indian engineer grabbed job offers from Google, Microsoft, Meta and Uber",https://timesofindia.indiatimes.com/articleshow/130114672.cms,2026-04-14T06:04:36+00:00
TOI ETimes,140,This viral 'Rambaan' fertiliser recipe is making plants explode with flowers in weeks,https://timesofindia.indiatimes.com/articleshow/130109256.cms,2026-04-14T06:04:36+00:00
TOI ETimes,141,Who is ‘Ketamine Queen’ Jasveen Sangha? The woman now at the centre of the Matthew Perry drug overdose case,https://timesofindia.indiatimes.com/articleshow/130110198.cms,2026-04-14T06:04:36+00:00
TOI ETimes,142,No LPG or cylinder required for cooking: What is the 'plug-and-play' Hydrogen cooking stove that produces gas through water electrolysis?,https://timesofindia.indiatimes.com/articleshow/130109070.cms,2026-04-14T06:04:36+00:00
TOI ETimes,143,Keralite reveals being punished for speaking mother tongue in school: Viral Reddit post shares story of 30-year-old who lost his language in English-only system,https://timesofindia.indiatimes.com/articleshow/130106790.cms,2026-04-14T06:04:36+00:00
TOI ETimes,144,"Petrol shock in Pakistan! After outrage over ₹152/L, government slashes fuel rates - check latest prices",https://timesofindia.indiatimes.com/articleshow/130104650.cms,2026-04-14T06:04:36+00:00
TOI ETimes,145,Erratic rainfalls in March impact Mango crop: How to ripen raw Mangoes rightly with grandma's newspaper hack using quick commerce paper bags,https://timesofindia.indiatimes.com/articleshow/130083166.cms,2026-04-14T06:04:36+00:00
TOI ETimes,146,‘Did he just fart?’ US Defense Secretary Pete Hegseth’s serious briefing turns into viral moment,https://timesofindia.indiatimes.com/articleshow/130101919.cms,2026-04-14T06:04:36+00:00
TOI ETimes,147,Meet Shirli Ling: The social media influencer and chicken hotpot boss who became a grandmother at 34,https://timesofindia.indiatimes.com/articleshow/130101855.cms,2026-04-14T06:04:36+00:00
TOI ETimes,148,Meet ‘Chaya Chechi’: Her dreamy chai-on-a-boat experience is going viral– here’s why,https://timesofindia.indiatimes.com/articleshow/130094820.cms,2026-04-14T06:04:36+00:00
TOI ETimes,149,Love teddy bears? These 5 dog breeds look just like them,https://timesofindia.indiatimes.com/articleshow/130093314.cms,2026-04-14T06:04:36+00:00
TOI ETimes,150,We’re running out of Earth: Study warns current lifestyle needs 2 planets,https://timesofindia.indiatimes.com/articleshow/130092316.cms,2026-04-14T06:04:36+00:00
TOI ETimes,151,Inside the row over Pippa Middleton’s countryside home: Why are locals upset with Kate Middleton’s sister,https://timesofindia.indiatimes.com/articleshow/130091068.cms,2026-04-14T06:04:36+00:00
TOI ETimes,152,Did you know NYC once flew helicopters from skyscraper rooftops to airports in 1965? Here’s how it all went wrong,https://timesofindia.indiatimes.com/articleshow/130085042.cms,2026-04-14T06:04:36+00:00
TOI ETimes,153,Inside Gaurav Taneja’s Rs 10 crore Gurugram farmhouse: Where 200 cows power a desi food venture,https://timesofindia.indiatimes.com/articleshow/130089447.cms,2026-04-14T06:04:36+00:00
TOI ETimes,154,"After 'Dhurandhar' made Lyari in Pakistan viral, ‘Lyari in India’ is trending online - All about the hidden gem of Gujarat",https://timesofindia.indiatimes.com/articleshow/130087039.cms,2026-04-14T06:04:36+00:00
TOI ETimes,155,"Macaulay's children are triggered because Pujarini Pradhan, from Medinipur, didn’t ask for permission to think, and speak English",https://timesofindia.indiatimes.com/articleshow/130085029.cms,2026-04-14T06:04:36+00:00
TOI ETimes,156,"Rs 200 sapling to Rs 60,000 tree: The mahogany farming secret turning Indian farmers into crorepatis",https://timesofindia.indiatimes.com/articleshow/130085813.cms,2026-04-14T06:04:36+00:00
TOI ETimes,157,"Meet Africa’s richest king: How King Mohammed VI’s ₹6,200 crore gold bet is changing the gold game",https://timesofindia.indiatimes.com/articleshow/130084007.cms,2026-04-14T06:04:36+00:00
TOI ETimes,158,India's unstoppable daughter: Who is Payal Nag - World’s first quadruple amputee archer,https://timesofindia.indiatimes.com/articleshow/130082222.cms,2026-04-14T06:04:36+00:00
TOI ETimes,159,Who is Divya Singh? A 28-year-old teacher and the first Indian woman to cycle to Everest Base Camp,https://timesofindia.indiatimes.com/articleshow/130079771.cms,2026-04-14T06:04:36+00:00
TOI ETimes,160,Mid-air shock! Sydney-Dallas Qantas flight dumps fuel over ocean after sudden emergency - here’s what happened,https://timesofindia.indiatimes.com/articleshow/130077596.cms,2026-04-14T06:04:36+00:00
TOI ETimes,161,'IITian Baba' Abhey Singh gets married: Who is his wife Pratika?,https://timesofindia.indiatimes.com/articleshow/130076066.cms,2026-04-14T06:04:36+00:00
TOI ETimes,162,He made JEE history with 360/360: From IIT topper to singer-songwriter? Kalpit Veerwal’s journey is anything but typical,https://timesofindia.indiatimes.com/articleshow/130074916.cms,2026-04-14T06:04:36+00:00
TOI ETimes,163,Struggling with self-appraisal? 5 simple ways to make your boss notice your work,https://timesofindia.indiatimes.com/articleshow/130069343.cms,2026-04-14T06:04:36+00:00
TOI ETimes,164,"Researchers create QR code thinner than a human hair, set world record",https://timesofindia.indiatimes.com/articleshow/130068978.cms,2026-04-14T06:04:36+00:00
TOI ETimes,165,Viral: Walking at 2:30 am ‘without fear’? Gurugram couple’s clip gets people talking,https://timesofindia.indiatimes.com/articleshow/130066968.cms,2026-04-14T06:04:36+00:00
TOI ETimes,166,"Video: Young doctor quits on first day, alleges patients were kept in ICU unnecessarily for profit: ‘Keep them for…’",https://timesofindia.indiatimes.com/articleshow/130065115.cms,2026-04-14T06:04:36+00:00
TOI ETimes,167,Watch here: Dog goes on attacking spree in seconds; viral video triggers fear online,https://timesofindia.indiatimes.com/articleshow/130063159.cms,2026-04-14T06:04:36+00:00
TOI ETimes,168,Beloved Indian gulab jamun stuffed in a croissant? ‘Cromun’ leaves internet furious over new food experiment,https://timesofindia.indiatimes.com/articleshow/130061664.cms,2026-04-14T06:04:36+00:00
TOI ETimes,169,"Rare pair eclipse in August 2026: When and where to watch, timings, and what does it mean?",https://timesofindia.indiatimes.com/articleshow/130058133.cms,2026-04-14T06:04:36+00:00
TOI ETimes,170,PowerWash Simulator 2: The oddly satisfying ‘boring’ yet viral game people are playing for 24 hours straight,https://timesofindia.indiatimes.com/articleshow/130056751.cms,2026-04-14T06:04:36+00:00
TOI ETimes,171,Viral dance party on rails: Marwari family books entire train coach for wedding; watch video,https://timesofindia.indiatimes.com/articleshow/130056945.cms,2026-04-14T06:04:36+00:00
TOI ETimes,172,Who was Kasey Grelle? ‘Brilliant and selfless’ CEO mom killed in tragic resort truck crash in Nicaragua,https://timesofindia.indiatimes.com/articleshow/130056642.cms,2026-04-14T06:04:36+00:00
TOI ETimes,173,Too expensive to have a respectful funeral? What is China's burial crisis that is forcing people to store ashes in 'new' apartments,https://timesofindia.indiatimes.com/articleshow/130053917.cms,2026-04-14T06:04:36+00:00
TOI ETimes,174,"Detroit bakery’s ‘creepy lamb cake’ prank goes viral, sparks reactions and real orders",https://timesofindia.indiatimes.com/articleshow/130052880.cms,2026-04-14T06:04:36+00:00
TOI ETimes,175,Who is Disha Sharma? Famous media personality's daughter who tied the knot in a 2-states styled wedding with Bengaluru-based lawyer Sudarshan MJ,https://timesofindia.indiatimes.com/articleshow/130052454.cms,2026-04-14T06:04:36+00:00
TOI ETimes,176,"Artemis II astronauts lose contact with Earth for 40 minutes in space: Why will this happen, and what will the crew do during this time?",https://timesofindia.indiatimes.com/articleshow/130050721.cms,2026-04-14T06:04:36+00:00
TOI ETimes,177,Who is Kashmira Pardeshi? The ‘mystery girl’ and PBKS fan from IPL stands everyone can’t stop talking about,https://timesofindia.indiatimes.com/articleshow/130049862.cms,2026-04-14T06:04:36+00:00
TOI ETimes,178,‘How is that comedy?’: SNL UK faces backlash over crude joke referencing Mark Zuckerberg and Adolf Hitler,https://timesofindia.indiatimes.com/articleshow/130046367.cms,2026-04-14T06:04:36+00:00
TOI ETimes,179,Who is Priya Patel? Indian-origin pro-MAGA influencer sparks massive row over viral immigration video,https://timesofindia.indiatimes.com/articleshow/130041982.cms,2026-04-14T06:04:36+00:00
TOI ETimes,180,From Daya to Jethalal: This family’s Taarak Mehta Ka Ooltah Chashmah-themed birthday party is going viral,https://timesofindia.indiatimes.com/articleshow/130041622.cms,2026-04-14T06:04:36+00:00
TOI ETimes,181,"'My duty to keep her happy’: Retired judge welcomes divorced daughter home with dhol, dance, and pride",https://timesofindia.indiatimes.com/articleshow/130038650.cms,2026-04-14T06:04:36+00:00
TOI ETimes,182,No more Gutkha spits on roads! Meet the young innovators who have found an innovative and bio-friendly device for India's spitting problem,https://timesofindia.indiatimes.com/articleshow/130038404.cms,2026-04-14T06:04:36+00:00
TOI ETimes,183,Venus has a hidden volcano cave! Astronomers spot a giant lava tube beneath 'Nyx Mons',https://timesofindia.indiatimes.com/articleshow/130038058.cms,2026-04-14T06:04:36+00:00
TOI ETimes,184,What is the net worth of Kash Patel? Everything you should know about the Indian-origin FBI director and why he is in news,https://timesofindia.indiatimes.com/articleshow/130037613.cms,2026-04-14T06:04:36+00:00
TOI ETimes,185,No cash or card needed from bazaars to temples: German traveller appreciates the “Real Digi‑India” for cashless payments,https://timesofindia.indiatimes.com/articleshow/130036993.cms,2026-04-14T06:04:36+00:00
TOI ETimes,186,"From sugar‑filled mornings to a bittersweet exit: After 15 years of sweet cravings, this beloved doughnut chain is quietly exiting India",https://timesofindia.indiatimes.com/articleshow/130035309.cms,2026-04-14T06:04:36+00:00
TOI ETimes,187,"Who is Kai Trump? US President Donald Trump's granddaughter, influencer and golfer who is receiving backlash for her dream job reveal",https://timesofindia.indiatimes.com/articleshow/130034216.cms,2026-04-14T06:04:36+00:00
TOI ETimes,188,"Happy Easter Sunday 2026: Best Messages, Quotes, Wishes, Greetings and Images to share on Easter Sunday",https://timesofindia.indiatimes.com/articleshow/130025228.cms,2026-04-14T06:04:36+00:00
TOI ETimes,189,‘It changed me’: British traveller’s raw take on India is winning hearts online,https://timesofindia.indiatimes.com/articleshow/130033290.cms,2026-04-14T06:04:36+00:00
TOI ETimes,190,"Happy Easter Sunday 2026: Images, Quotes, Wishes, Messages, Images, Cards, Greetings, Pictures and GIFs",https://timesofindia.indiatimes.com/articleshow/130001252.cms,2026-04-14T06:04:36+00:00
TOI ETimes,191,"‘Not Kashmir!’ Bikaner looks snow-white after rare hailstorm, internet can’t believe it",https://timesofindia.indiatimes.com/articleshow/130024752.cms,2026-04-14T06:04:36+00:00
TOI ETimes,192,"Happy Easter Sunday 2026: Top 70 Wishes, Messages, Greetings Card and Quotes to share with your family and friends",https://timesofindia.indiatimes.com/articleshow/130004282.cms,2026-04-14T06:04:36+00:00
TOI ETimes,193,Europe’s first total solar eclipse in 27 years is coming and this country is the best place to watch it,https://timesofindia.indiatimes.com/articleshow/130020939.cms,2026-04-14T06:04:36+00:00
TOI ETimes,194,Kenyan man sells honey with his swollen face on the label and it turns out to be a marketing masterstroke,https://timesofindia.indiatimes.com/articleshow/130020924.cms,2026-04-14T06:04:36+00:00
TOI ETimes,195,Sunday Reset trend explained: Why people are romanticising mundane rituals as ‘Hot Girl Walk’ of home,https://timesofindia.indiatimes.com/articleshow/129997465.cms,2026-04-14T06:04:36+00:00
TOI ETimes,196,GTA 6 leaks reveal a mind-blowing AI upgrade - and a locked-in release date,https://timesofindia.indiatimes.com/articleshow/130017265.cms,2026-04-14T06:04:36+00:00
TOI ETimes,197,Bareilly thief swallows stolen bracelet during arrest; cops recover it after a bizarre 2-day operation,https://timesofindia.indiatimes.com/articleshow/130015071.cms,2026-04-14T06:04:36+00:00
TOI ETimes,198,Blind runner set to make history using AI glasses at marathon - this is truly next level,https://timesofindia.indiatimes.com/articleshow/130014563.cms,2026-04-14T06:04:36+00:00
TOI ETimes,199,"""Not just dirt and traffic"": Foreign vlogger’s viral ‘confession’ about India is breaking the internet",https://timesofindia.indiatimes.com/articleshow/130012157.cms,2026-04-14T06:04:36+00:00
TOI ETimes,200,‘Sustainable wedding’: Couple marries at a busy Netherlands railway station in second-hand outfits as commuters look on,https://timesofindia.indiatimes.com/articleshow/130012071.cms,2026-04-14T06:04:36+00:00
TOI ETimes,201,"‘$3,000 to feel like a man?’: Inside the extreme masculinity camps where men sign up for pain and discipline",https://timesofindia.indiatimes.com/articleshow/130011497.cms,2026-04-14T06:04:36+00:00
TOI ETimes,202,"Earthquake felt in Delhi, social media erupts",https://timesofindia.indiatimes.com/articleshow/130006113.cms,2026-04-14T06:04:36+00:00
TOI ETimes,203,A Dehradun bride’s Vidai is making the internet cry because her dogs just wouldn’t let her leave,https://timesofindia.indiatimes.com/articleshow/130005696.cms,2026-04-14T06:04:36+00:00
TOI ETimes,204,"Kindness rewarded: 68-year-old delivery driver bought a Coke with his own money and strangers raised $32,000 to thank him",https://timesofindia.indiatimes.com/articleshow/130003217.cms,2026-04-14T06:04:36+00:00
TOI ETimes,205,"₹10 chai, ₹20 samosas at UDAN Yatri Café now at these 24 Indian airports: Flyers finally get relief from overpriced food",https://timesofindia.indiatimes.com/articleshow/130001262.cms,2026-04-14T06:04:36+00:00
TOI ETimes,206,Who is Shreesh Jhadav? The brilliant IITian-turned monk who secured 2nd rank in the IIT-JEE entrance exam,https://timesofindia.indiatimes.com/articleshow/130000982.cms,2026-04-14T06:04:36+00:00
TOI ETimes,207,"Boy claims he was a woman who died in a fire, details later match real case from decades ago",https://timesofindia.indiatimes.com/articleshow/129994758.cms,2026-04-14T06:04:36+00:00
TOI ETimes,208,Cub says 'hello' to the camera! Rare Bornean clouded leopard family spotted on trail cam,https://timesofindia.indiatimes.com/articleshow/129999981.cms,2026-04-14T06:04:36+00:00
TOI ETimes,209,‘First in 36 years’: Indian-origin student wins elite Churchill Scholarship to Cambridge,https://timesofindia.indiatimes.com/articleshow/129998588.cms,2026-04-14T06:04:36+00:00
