source,rank,headline,link,collected_at_iso
Indian Express,1,Trending in India,https://indianexpress.com/section/trending/trending-in-india/,2026-04-17T06:08:09+00:00
Indian Express,2,This is Serious,https://indianexpress.com/section/trending/this-is-serious/,2026-04-17T06:08:09+00:00
Indian Express,3,China woman throws money,https://indianexpress.com/article/trending/trending-globally/china-woman-throws-money-from-balcony-after-fight-with-husband-viral-video-10640211/,2026-04-17T06:08:09+00:00
Indian Express,4,Top 10 most influential CEOs in the world,https://indianexpress.com/article/trending/top-10-listing/top-10-most-influential-ceo-in-the-world-in-2026-10640113/,2026-04-17T06:08:09+00:00
Indian Express,5,Mumbai auto driver singing Taylor Swift,https://indianexpress.com/article/trending/trending-in-india/mumbai-auto-driver-singing-taylor-swift-blank-space-viral-video-10639890/,2026-04-17T06:08:09+00:00
Indian Express,6,viral groundhog video,https://indianexpress.com/article/trending/trending-globally/viral-video-dramatic-groundhog-nail-trimming-reaction-31-million-views-10639559/,2026-04-17T06:08:09+00:00
Indian Express,7,Israel bee swarm alert,https://indianexpress.com/article/trending/trending-globally/massive-bee-swarms-shut-down-shops-trigger-urgent-alerts-across-israel-10639551/,2026-04-17T06:08:09+00:00
Indian Express,8,journalism career change,https://indianexpress.com/article/trending/trending-globally/us-sports-reporter-quit-30-years-of-journalism-turns-mail-carrier-career-switch-salary-hike-burnout-10639446/,2026-04-17T06:08:09+00:00
Indian Express,9,Peyush Bansal on religious policy row,https://indianexpress.com/article/trending/trending-in-india/lenskart-grooming-policy-controversy-peyush-bansal-clarification-10639292/,2026-04-17T06:08:09+00:00
Indian Express,10,World’s Busiest Airports Ranking in 2025,https://indianexpress.com/article/trending/top-10-listing/top-10-busiest-airports-by-total-passengers-in-2025-10638415/,2026-04-17T06:08:09+00:00
Indian Express,11,AI solves math conjecture,https://indianexpress.com/article/trending/trending-globally/chinese-ai-solves-2014-math-problem-peking-university-10638358/,2026-04-17T06:08:09+00:00
Indian Express,12,Unitree G1 robot wild boars Warsaw,https://indianexpress.com/article/trending/trending-globally/edward-warchocki-unitree-g1-humanoid-robot-wild-boars-warsaw-viral-video-10637978/,2026-04-17T06:08:09+00:00
Indian Express,13,Duolingo CEO talks about use of AI,https://indianexpress.com/article/trending/trending-globally/duolingo-ceo-ai-performance-reviews-results-not-usage-10637728/,2026-04-17T06:08:09+00:00
Indian Express,14,Bengaluru cat dispute,https://indianexpress.com/article/trending/trending-in-india/bengaluru-cat-dispute-seshadripuram-police-kitten-row-10637673/,2026-04-17T06:08:09+00:00
Indian Express,15,HYROX Bengaluru price debate,https://indianexpress.com/article/trending/trending-in-india/hyrox-bengaluru-pricing-debate-fitness-events-viral-post-marathon-fees-india-10637570/,2026-04-17T06:08:09+00:00
Indian Express,16,The situation escalated when her manager found her asleep,https://indianexpress.com/article/trending/trending-globally/chinese-employee-takes-5-hour-office-nap-to-protest-low-salary-steals-boss-snack-10637434/,2026-04-17T06:08:09+00:00
Indian Express,17,Top 10 most educated countries in the world,https://indianexpress.com/article/trending/top-10-listing/top-10-most-educated-countries-in-the-world-2026-10636368/,2026-04-17T06:08:09+00:00
Indian Express,18,Hungary politician Zsolt Hegedus dance video,https://indianexpress.com/article/trending/trending-globally/hungary-election-celebrations-politician-zsolt-hegedus-dance-viral-video-10636279/,2026-04-17T06:08:09+00:00
Indian Express,19,Praful Hinge IPL debut parents reaction,https://indianexpress.com/article/trending/trending-in-india/praful-hinge-ipl-debut-3-wickets-first-over-srh-rr-parents-video-10635822/,2026-04-17T06:08:09+00:00
Indian Express,20,Pakistani traveller Mumbai airport layover,https://indianexpress.com/article/trending/trending-in-india/pakistani-traveller-10-hour-mumbai-airport-layover-experience-video-viral-10635610/,2026-04-17T06:08:09+00:00
Indian Express,21,Iran mocks US President Trump,https://indianexpress.com/article/trending/trending-globally/iran-strait-of-hormuz-trump-shah-rukh-khan-dialogue-viral-post-10635383/,2026-04-17T06:08:09+00:00
Indian Express,22,Praful Hinge IPL debut Instrgam followers,https://indianexpress.com/article/trending/trending-in-india/praful-hinge-4-wickets-srh-vs-rr-ipl-debut-instagram-followers-viral-video-10635334/,2026-04-17T06:08:09+00:00
Indian Express,23,"Vijay immediately got off the bicycle, and security personnel came running towards him within moments",https://indianexpress.com/article/trending/trending-in-india/tvk-chief-vijay-jumps-off-bicycle-during-kanyakumari-election-rally-man-throws-flower-ball-viral-video-10635332/,2026-04-17T06:08:09+00:00
Indian Express,24,Arijit Singh concert HCL Group 50 year-celebration,https://indianexpress.com/article/trending/trending-in-india/hcl-50th-anniversary-arijit-singh-concert-free-metro-10634721/,2026-04-17T06:08:09+00:00
Indian Express,25,Christina Koch dog reunion video goes viral after Artemis II mission,https://indianexpress.com/article/trending/trending-globally/christina-koch-dog-reunion-artemis-ii-viral-video-10634203/,2026-04-17T06:08:09+00:00
Indian Express,26,2/10 for Delhi: Netizens agree as Russian tourist’s safety ratings for Indian cities go viral,https://indianexpress.com/article/trending/trending-in-india/russian-tourist-safety-rating-india-delhi-viral-video-10634030/,2026-04-17T06:08:09+00:00
Indian Express,27,The viral video captures the critical moment when the athletes were sprinting at full speed,https://indianexpress.com/article/trending/trending-in-india/athletics-federation-slammed-after-man-walks-onto-running-track-in-delhi-during-200m-final-10633569/,2026-04-17T06:08:09+00:00
LiveMint,1,Donald Trump breaks silence after viral $100 tip to DoorDash Grandma,https://www.livemint.com/us/trending/donald-trump-breaks-silence-after-viral-100-tip-to-doordash-grandma-on-mcdonald-delivery-11776388215903.html,2026-04-17T06:08:09+00:00
LiveMint,2,American Pie star Shannon Elizabeth joins OnlyFans: ‘This is the future',https://www.livemint.com/us/trending/shannon-elizabeth-of-american-pie-to-join-onlyfans-hollywood-controlled-my-career-11776371145744.html,2026-04-17T06:08:09+00:00
LiveMint,3,‘Most trolled person in the world’: Meghan Markle on facing online abuse,https://www.livemint.com/us/trending/most-trolled-person-in-the-world-meghan-markle-on-facing-online-abuse-for-a-decade-11776367137558.html,2026-04-17T06:08:09+00:00
LiveMint,4,"Alex Manninger, former Arsenal goalkeeper passes way at 48 in Salzburg train col",https://www.livemint.com/us/trending/alex-manninger-death-former-arsenal-goalkeeper-passes-way-at-48-in-salzburg-train-collision-11776354419788.html,2026-04-17T06:08:09+00:00
LiveMint,5,‘What the…?’ Jon Stewart reacts to Trump’s controversial Jesus-themed AI image,https://www.livemint.com/us/trending/comedian-jon-stewart-mocks-trump-s-jesus-meme-jokes-about-resembling-sick-man-in-viral-image-11776199220897.html,2026-04-17T06:08:09+00:00
LiveMint,6,"Yellowstone volcano near eruption? New study sparks buzz, scientists urge cautio",https://www.livemint.com/us/trending/is-yellowstone-volcano-near-eruption-new-study-sparks-buzz-scientists-urge-caution-11776196907903.html,2026-04-17T06:08:09+00:00
LiveMint,7,Jonathan Quick retirement: Rangers veteran goaltender to make final NHL start,https://www.livemint.com/us/trending/jonathan-quick-retirement-new-york-rangers-veteran-goaltender-to-make-final-nhl-start-against-florida-panthers-11776101712321.html,2026-04-17T06:08:09+00:00
LiveMint,8,"NFL Draft 2026: Dates, location, top prospects, order and other details",https://www.livemint.com/us/trending/nfl-draft-2026-dates-location-top-prospects-order-heres-everything-you-need-to-know-11776088776110.html,2026-04-17T06:08:09+00:00
LiveMint,9,Giannis Antetokounmpo and Bucks enter pivotal offseason as Doc Rivers steps down,https://www.livemint.com/us/trending/giannis-antetokounmpo-milwaukee-bucks-enter-pivotal-offseason-as-doc-rivers-steps-down-after-50-loss-season-nba-11776082651467.html,2026-04-17T06:08:09+00:00
LiveMint,10,Sinner beats Alcaraz in Monte Carlo Masters final to reclaim world No. 1 ranking,https://www.livemint.com/us/trending/jannik-sinner-beats-carlos-alcaraz-in-monte-carlo-masters-final-to-reclaim-world-no-1-ranking-11776019107875.html,2026-04-17T06:08:09+00:00
LiveMint,11,Dallas Cowboys safety Markquese Bell arrested on felony drug charge,https://www.livemint.com/us/trending/markquese-bell-arrested-on-felony-drug-charge-and-marijuana-possession-dallas-cowboys-safety-11775932691814.html,2026-04-17T06:08:09+00:00
LiveMint,12,Coachella 2026 kicks off with Sabrina Carpenter's performance,https://www.livemint.com/us/trending/coachella-2026-kicks-off-with-sabrina-carpenters-performance-from-justin-bieber-to-karol-g-check-weekend-schedule-11775875804562.html,2026-04-17T06:08:09+00:00
LiveMint,13,Apple Pay scam spreading fast in the US—Are you at risk?,https://www.livemint.com/us/trending/apple-pay-users-hit-by-scam-wave-across-the-us-here-s-how-victims-are-losing-their-money-11775768345740.html,2026-04-17T06:08:09+00:00
LiveMint,14,Afrika Bambaataa death: Hip-hop pioneer-DJ dies at 67 after cancer complications,https://www.livemint.com/us/trending/afrika-bambaataa-death-hip-hop-pioneer-and-dj-dies-at-67-after-cancer-complications-11775767596687.html,2026-04-17T06:08:09+00:00
LiveMint,15,"DOJ antitrust probe into NFL media rights: What it means for streaming, and more",https://www.livemint.com/us/trending/doj-antitrust-probe-into-nfl-media-rights-what-it-means-for-fans-streaming-and-tv-deals-11775760586179.html,2026-04-17T06:08:09+00:00
LiveMint,16,"Daniil Medvedev smashes racquet in shocking 6-0, 6-0 loss at Monte Carlo Masters",https://www.livemint.com/us/trending/daniil-medvedev-racquet-video-in-shocking-6-0-6-0-clay-defeat-to-matteo-berrettini-at-monte-carlo-masters-11775674478886.html,2026-04-17T06:08:09+00:00
LiveMint,17,"Konnor Griffin signs 9-year, $140 million contract extension with Pirates",https://www.livemint.com/us/trending/konnor-griffin-signs-record-9-year-140-million-contract-extension-with-pittsburgh-pirates-mlb-baseball-11775653782727.html,2026-04-17T06:08:09+00:00
LiveMint,18,JD Vance’s awkward moment: Trump sends call to voicemail during live rally,https://www.livemint.com/us/trending/jd-vance-s-awkward-moment-trump-sends-call-to-voicemail-during-live-rally-in-hungary-watch-11775589348677.html,2026-04-17T06:08:09+00:00
LiveMint,19,"Islanders fire Patrick Roy, hire Peter DeBoer as head coach amid playoff push",https://www.livemint.com/us/trending/patrick-roy-fired-by-new-york-islanders-hire-peter-deboer-as-head-coach-amid-playoff-push-nhl-hockey-11775415170584.html,2026-04-17T06:08:09+00:00
LiveMint,20,Geno Auriemma apologizes to South Carolina after outburst in women's Final Four,https://www.livemint.com/us/trending/geno-auriemma-apologizes-to-south-carolina-after-emotional-outburst-vs-dawn-staley-in-womens-final-four-11775394255637.html,2026-04-17T06:08:09+00:00
LiveMint,21,NCAA Final Four 2026: UConn vs Illinois and Michigan vs Arizona results,https://www.livemint.com/us/trending/ncaa-final-four-2026-results-what-happened-in-uconn-vs-illinois-and-michigan-vs-arizona-march-madness-semifinals-11775390782036.html,2026-04-17T06:08:09+00:00
LiveMint,22,NASA’s Artemis II astronauts face toilet problem; social media reacts with memes,https://www.livemint.com/us/trending/nasas-artemis-ii-astronauts-faces-toilet-problem-in-space-social-media-reacts-with-jokes-memes-blame-ice-for-this-to-11775363905958.html,2026-04-17T06:08:09+00:00
LiveMint,23,Man City thrash Liverpool 4-0 while Chelsea crush Port Vale 7-0 in FA Cup QFs,https://www.livemint.com/us/trending/manchester-city-vs-liverpool-4-0-chelsea-vs-port-vale-7-0-fa-cup-quarterfinals-11775328419465.html,2026-04-17T06:08:09+00:00
LiveMint,24,Juan Soto calf injury: Mets star to undergo MRI after early exit vs Giants,https://www.livemint.com/us/trending/juan-soto-calf-injury-new-york-mets-star-to-undergo-mri-after-early-exit-vs-san-francisco-giants-11775306968287.html,2026-04-17T06:08:09+00:00
LiveMint,25,New York teacher earning $90K turns to $55/hour side gig to repay student loans,https://www.livemint.com/us/trending/new-york-teacher-earning-90k-turns-to-55-hour-side-gig-to-repay-student-loans-11775314789062.html,2026-04-17T06:08:09+00:00
LiveMint,26,NCAA men's Final Four matchups: Schedule and key details,https://www.livemint.com/us/trending/uconn-vs-illinois-and-arizona-vs-michigan-2026-ncaa-mens-final-four-matchups-schedule-and-key-details-11775243799182.html,2026-04-17T06:08:09+00:00
LiveMint,27,Gennaro Gattuso steps down as Italy manager after 2026 World Cup qualifier,https://www.livemint.com/us/trending/gennaro-gattuso-steps-down-as-italy-manager-after-2026-world-cup-qualifier-heartbreak-11775221292115.html,2026-04-17T06:08:09+00:00
LiveMint,28,"Vanessa Trump frustrated with Tiger Woods’ behavior, puts him on notice",https://www.livemint.com/us/trending/vanessa-trump-frustrated-with-tiger-woods-behavior-puts-him-on-notice-stop-acting-like-a-teenager-grow-up-11775209989597.html,2026-04-17T06:08:09+00:00
LiveMint,29,What’s wrong with Tiger Woods? ‘Heartbreaking’ video leaves fans worried,https://www.livemint.com/us/trending/whats-wrong-with-tiger-woods-heartbreaking-video-after-dui-arrest-leaves-fans-worried-mental-health-is-real-11775191311157.html,2026-04-17T06:08:09+00:00
LiveMint,30,McDonald's drops new under $3 menu and $4 breakfast deal — Here’s what you get,https://www.livemint.com/us/trending/mcdonalds-drops-new-under-3-menu-and-4-breakfast-deal-here-s-what-you-can-get-11775157327207.html,2026-04-17T06:08:09+00:00
LiveMint,31,Rapper J. Cole joins China’s Nanjing Monkey Kings for pro basketball stint,https://www.livemint.com/us/trending/grammywinning-rapper-j-cole-joins-china-s-nanjing-monkey-kings-for-pro-basketball-stint-11775141367888.html,2026-04-17T06:08:09+00:00
LiveMint,32,April Fools’ Day 2026 deals: No-joke discounts from Dunkin' and more,https://www.livemint.com/us/trending/april-fools-day-2026-discounts-dunkin-checkers-rally-hooters-qdoba-artemis-ii-doughnut-11775054510320.html,2026-04-17T06:08:09+00:00
LiveMint,33,"Oracle employee, despite being laid off, remains positive: ‘It happens…'",https://www.livemint.com/us/trending/oracle-employee-despite-being-laid-off-remains-positive-it-happens-will-enjoy-sleeping-11775051244639.html,2026-04-17T06:08:09+00:00
LiveMint,34,Warren Buffett teams up with NBA star Stephen Curry for charity lunch auction,https://www.livemint.com/us/trending/warren-buffett-teams-up-with-nba-star-stephen-curry-for-charity-lunch-auction-berkshire-event-returns-in-2026-11774962320767.html,2026-04-17T06:08:09+00:00
LiveMint,35,Tiger Woods’ ex Kristin Smith breaks silence after ‘triggering’ DUI arrest,https://www.livemint.com/us/trending/tiger-woods-ex-kristin-smith-breaks-silence-after-triggering-dui-arrest-seeks-privacy-11774949316320.html,2026-04-17T06:08:09+00:00
LiveMint,36,"Sophie Turner injured, Tomb Raider series halts production temporarily",https://www.livemint.com/us/trending/sophie-turner-injured-tomb-raider-series-halts-production-temporarily-11774878671976.html,2026-04-17T06:08:09+00:00
LiveMint,37,Viral video of Kash Patel dancing? Here’s the truth behind the clip,https://www.livemint.com/us/trending/viral-video-of-kash-patel-dancing-here-s-the-truth-behind-the-clip-11774814955782.html,2026-04-17T06:08:09+00:00
LiveMint,38,"Arnold Schwarzenegger returns to gym—But this time, he’s coaching his son |Watch",https://www.livemint.com/us/trending/arnold-schwarzenegger-returns-to-gym-but-this-time-he-s-coaching-his-son-to-bodybuilding-glory-watch-11774816425352.html,2026-04-17T06:08:09+00:00
LiveMint,39,"Bachelorette star James McCoy Taylor arrested again, months after guilty plea",https://www.livemint.com/us/trending/bachelorette-star-james-mccoy-taylor-arrested-again-months-after-guilty-plea-11774189913536.html,2026-04-17T06:08:09+00:00
LiveMint,40,Mark to Market,https://www.livemint.com/market/mark-to-market,2026-04-17T06:08:09+00:00
LiveMint,41,"Gold, silver price today, 17 April: Check rates of 24 kt, 22 kt gold and 999 silver in Delhi, Mumbai, other cities",https://www.livemint.com/market/commodities/gold-silver-price-today-17-april-check-rates-of-24-kt-22-kt-gold-and-999-silver-in-delhi-mumbai-other-cities-11776398412406.html,2026-04-17T06:08:09+00:00
LiveMint,42,Wheat Rallies on Weather Woes and Iran-Linked Fertilizer Crunch,https://www.livemint.com/market/wheat-rallies-on-weather-woes-and-iran-linked-fertilizer-crunch-11776403154678.html,2026-04-17T06:08:09+00:00
LiveMint,43,Akshaya Tritiya 2026: These two Nifty 50 stocks’ one-year returns outshine gold returns,https://www.livemint.com/market/stock-market-news/akshaya-tritiya-2026-these-two-nifty-50-stocks-one-year-returns-outshine-gold-returns-11776400782453.html,2026-04-17T06:08:09+00:00
LiveMint,44,China’s Surging Tech Stock Index Faces Rising Concentration Risk,https://www.livemint.com/market/chinas-surging-tech-stock-index-faces-rising-concentration-risk-11776402500220.html,2026-04-17T06:08:09+00:00
LiveMint,45,Waaree Renewable Technologies shares jump over 13% after strong Q4 results,https://www.livemint.com/market/stock-market-news/waaree-renewable-technologies-shares-jump-over-13-after-strong-q4-results-11776401760450.html,2026-04-17T06:08:09+00:00
LiveMint,46,NMDC share price: PSU stock hits 52-week high on strong Q4 results 2026 hopes. Should you buy?,https://www.livemint.com/market/nmdc-share-price-psu-stock-hits-52-week-high-on-strong-q4-results-2026-hopes-should-you-buy-11776399087685.html,2026-04-17T06:08:09+00:00
LiveMint,47,"Petrol, diesel prices on 17 April: Fuel rates today in Delhi, Mumbai, Bengaluru, Chennai, Kolkata and other cities",https://www.livemint.com/news/india/petrol-diesel-rates-on-16-april-check-fuel-prices-today-in-delhi-mumbai-chennai-kolkata-bengaluru-other-cit-11776400160967.html,2026-04-17T06:08:09+00:00
LiveMint,48,ED raids Punjab's AAP minister Sanjeev Arora's residence and other locations,https://www.livemint.com/news/ed-raids-punjabs-aap-minister-sanjeev-aroras-residence-and-other-locations-11776401305367.html,2026-04-17T06:08:09+00:00
LiveMint,49,"Parliament special session: Lok Sabha to consider Delimitation Bill, Amendments to Women Reservation Bill for passing",https://www.livemint.com/news/india/parliament-special-session-lok-sabha-to-consider-delimitation-bill-amendments-to-women-reservation-bill-for-passing-11776396221681.html,2026-04-17T06:08:09+00:00
LiveMint,50,Parliament Special Session LIVE: ‘Are you going to bulldoze the Demiliation Commission also?’ asks DMK leader Kanimozhi,https://www.livemint.com/news/india/parliament-special-session-live-india-bloc-delimitation-bill-women-reservation-lok-sabha-seats-amit-shah-pm-modi-bjp-11776399656057.html,2026-04-17T06:08:09+00:00
LiveMint,51,Quote of the day by Jeff Bezos on brand image: ‘A brand for a company is like a reputation for….’,https://www.livemint.com/news/us-news/quote-of-the-day-by-jeff-bezos-on-brand-image-a-brand-for-a-company-is-like-a-reputation-for-11776396859819.html,2026-04-17T06:08:09+00:00
LiveMint,52,"LPG cylinder price on April 17: Check domestic and commercial gas rates in Delhi, Bengaluru, Mumbai, Kolkata today",https://www.livemint.com/news/india/lpg-cylinder-price-on-april-17-check-domestic-and-commercial-gas-rates-in-delhi-bengaluru-mumbai-kolkata-today-11776397772515.html,2026-04-17T06:08:09+00:00
LiveMint,53,Salary Impact Tracker,https://www.livemint.com/tools-calculators/salary-impact-tracker,2026-04-17T06:08:09+00:00
LiveMint,54,"Orkla India eyes acquisitions, bets on convenience foods to drive growth",https://www.livemint.com/companies/news/orkla-india-eyes-acquisitions-bets-on-convenience-foods-to-drive-growth-11776400656637.html,2026-04-17T06:08:09+00:00
LiveMint,55,LIV CEO claims business as usual amid reports of demise,https://www.livemint.com/companies/liv-ceo-claims-business-as-usual-amid-reports-of-demise-11776389475109.html,2026-04-17T06:08:09+00:00
LiveMint,56,"India is one of our fastest-growing markets in Asia, says CTO of analytics platform Clickhouse",https://www.livemint.com/companies/news/analytics-platform-clickhouse-co-founder-and-chief-technology-officer-alexey-milovidov-database-startup-new-age-tech-11776347493139.html,2026-04-17T06:08:09+00:00
LiveMint,57,"HDFC Bank, ICICI Bank likely to post steady Q4; focus on commentary",https://www.livemint.com/companies/company-results/hdfc-bank-icici-bank-q4-earnings-commentary-margins-growth-outlook-11776329114906.html,2026-04-17T06:08:09+00:00
LiveMint,58,"New York loses nearly $74 million for not revoking 33,000 illegal licenses for immigrant truckers",https://www.livemint.com/companies/new-york-loses-nearly-74-million-for-not-revoking-33-000-illegal-licenses-for-immigrant-truckers-11776373346222.html,2026-04-17T06:08:09+00:00
LiveMint,59,Trump Weighs Appointing Michael Murray to Lead Antitrust at DOJ,https://www.livemint.com/companies/trump-weighs-appointing-michael-murray-to-lead-antitrust-at-doj-11776364574067.html,2026-04-17T06:08:09+00:00
LiveMint,60,Ask Mint Money,https://www.livemint.com/money/ask-mint-money,2026-04-17T06:08:09+00:00
LiveMint,61,"PPF vs ELSS vs NPS: Where does ₹5,000/month grow the most? 15-year returns compared",https://www.livemint.com/money/personal-finance/ppf-vs-elss-vs-nps-where-does-5-000-month-grow-the-most-15-year-returns-compared-11776387233643.html,2026-04-17T06:08:09+00:00
LiveMint,62,"Trump accounts explained: Eligibility, contribution limits, tax benefits for parents",https://www.livemint.com/money/personal-finance/trump-accounts-explained-eligibility-contribution-limits-tax-benefits-for-parents-11776388205154.html,2026-04-17T06:08:09+00:00
LiveMint,63,"Sukanya Samriddhi, provident fund, bank deposits, mutual funds: Compare investments for your child's future",https://www.livemint.com/money/personal-finance/sukanya-samriddhi-scheme-public-provident-fund-ppf-bank-deposit-fd-rd-mutual-funds-your-child-future-compare-investments-11776352274556.html,2026-04-17T06:08:09+00:00
LiveMint,64,"₹50 lakh retirement corpus: How to invest in SCSS, mutual funds, equities and other assets — CA offers tips",https://www.livemint.com/money/personal-finance/50-lakh-retirement-corpus-how-to-invest-in-scss-mutual-funds-equities-and-other-assets-ca-explains-11776349045820.html,2026-04-17T06:08:09+00:00
LiveMint,65,"Asset allocation explained: How to split your investments between PPF, equity and gold for optimal returns",https://www.livemint.com/money/personal-finance/asset-allocation-explained-how-to-split-your-investments-between-ppf-equity-and-gold-for-optimal-returns-11776324958596.html,2026-04-17T06:08:09+00:00
LiveMint,66,6 reasons why first-time borrowers find it tough to maintain a healthy credit score,https://www.livemint.com/money/personal-finance/6-reasons-why-first-time-borrowers-find-it-tough-to-maintain-a-healthy-credit-score-11776339637759.html,2026-04-17T06:08:09+00:00
LiveMint,67,"Former Meta contractor Sama to lay off more than 1,000 workers in Kenya",https://www.livemint.com/technology/former-meta-contractor-sama-to-lay-off-more-than-1-000-workers-in-kenya-11776356987123.html,2026-04-17T06:08:09+00:00
LiveMint,68,"AI is a gold mine for spammers and scammers, but Google is using it as a tool to fight back",https://www.livemint.com/technology/ai-is-a-gold-mine-for-spammers-and-scammers-but-google-is-using-it-as-a-tool-to-fight-back-11776351750379.html,2026-04-17T06:08:09+00:00
LiveMint,69,Bluesky down in US and UK? Thousands of users report outages - Check current status,https://www.livemint.com/technology/tech-news/bluesky-down-is-us-and-uk-thousands-of-users-report-outages-check-current-status-11776336194944.html,2026-04-17T06:08:09+00:00
LiveMint,70,"OnePlus Pad 4 India launch confirmed: Check display, processor, battery, launch date and features",https://www.livemint.com/technology/gadgets/oneplus-pad-4-india-launch-confirmed-check-display-processor-battery-launch-date-and-features-11776331369043.html,2026-04-17T06:08:09+00:00
LiveMint,71,Inditex data breach: Zara owner Inditex reports major data breach exposing customer transaction records,https://www.livemint.com/technology/tech-news/inditex-data-breach-zara-owner-inditex-reports-major-data-breach-exposing-customer-transaction-records-11776324988084.html,2026-04-17T06:08:09+00:00
LiveMint,72,Meet Happy Oyster: Alibaba launches new AI video model that turns text prompts into playable 3D worlds,https://www.livemint.com/technology/tech-news/meet-happy-oyster-alibaba-launches-new-ai-video-model-that-turns-text-prompts-into-playable-3d-worlds-11776321902774.html,2026-04-17T06:08:09+00:00
LiveMint,73,IPL 2026 Schedule,https://www.livemint.com/sports/cricket-news/ipl-schedule,2026-04-17T06:08:09+00:00
LiveMint,74,Orange Cap in IPL 2026,https://www.livemint.com/sports/cricket-news/ipl-orange-cap,2026-04-17T06:08:09+00:00
LiveMint,75,Purple Cap in IPL 2026,https://www.livemint.com/sports/cricket-news/ipl-purple-cap,2026-04-17T06:08:09+00:00
LiveMint,76,IPL 2026 Points Table,https://www.livemint.com/sports/cricket-news/ipl-points-table,2026-04-17T06:08:09+00:00
LiveMint,77,IFSC Code Finder,https://www.livemint.com/ifsc-code,2026-04-17T06:08:09+00:00
LiveMint,78,Income Tax Calculator,https://www.livemint.com/tools-calculators/income-tax-calculator,2026-04-17T06:08:09+00:00
LiveMint,79,Gold Rate Today,https://www.livemint.com/gold-prices,2026-04-17T06:08:09+00:00
