source,rank,headline,link,collected_at_iso
TOI ETimes,213,Word of the Day: Rouleaux,https://timesofindia.indiatimes.com/articleshow/129994764.cms,2026-04-03T05:44:33+00:00
TOI ETimes,214,'Can't expect pre-war rules …': Iran plans to 'monitor' Hormuz with Oman as tensions continue to soar,https://timesofindia.indiatimes.com/articleshow/129994751.cms,2026-04-03T05:44:33+00:00
TOI ETimes,215,From cookies to green tea: What Nasa Artemis II astronauts have in their moon mission menu,https://timesofindia.indiatimes.com/articleshow/129994327.cms,2026-04-03T05:44:33+00:00
TOI ETimes,216,How Sameer Rizvi embraced Axar Patel’s ‘challenge’ and seized his moment,https://timesofindia.indiatimes.com/articleshow/129994600.cms,2026-04-03T05:44:33+00:00
TOI ETimes,217,Air India tanks up for return flight to Myanmar at home now; all international routes under lens after ATF hike,https://timesofindia.indiatimes.com/articleshow/129994597.cms,2026-04-03T05:44:33+00:00
TOI ETimes,218,"EXIM Bank MT Call Letter 2026 released at eximbankindia.in: Check direct link, more details",https://timesofindia.indiatimes.com/articleshow/129994651.cms,2026-04-03T05:44:33+00:00
TOI ETimes,219,India set to get 3rd nuclear-powered ballistic missile submarine INS Aridhaman; Rajnath drops hint,https://timesofindia.indiatimes.com/articleshow/129994282.cms,2026-04-03T05:44:33+00:00
TOI ETimes,220,CSK vs PBKS: Ruturaj Gaikwad hopes opening combo with Sanju Samson clicks,https://timesofindia.indiatimes.com/articleshow/129994654.cms,2026-04-03T05:44:33+00:00
TOI ETimes,221,Malda Gherao Case: Alleged mastermind Mofakkarul Islam arrested at Bagdogra Airport,https://timesofindia.indiatimes.com/articleshow/129994568.cms,2026-04-03T05:44:33+00:00
TOI ETimes,222,"Bank holiday on Good Friday: Where are banks closed today, on April 3, 2026? Check state-wise list",https://timesofindia.indiatimes.com/articleshow/129994436.cms,2026-04-03T05:44:33+00:00
TOI ETimes,223,IGPL unveiled: 10 franchises to feature in new golf league,https://timesofindia.indiatimes.com/articleshow/129994492.cms,2026-04-03T05:44:33+00:00
TOI ETimes,224,"Numerology horoscope today, April 03, 2026: What your name's first letter reveals today",https://timesofindia.indiatimes.com/articleshow/129985572.cms,2026-04-03T05:44:33+00:00
TOI ETimes,225,Congress MLA Rajendra Bharti disqualified from Madhya Pradesh assembly after conviction in cheating case,https://timesofindia.indiatimes.com/articleshow/129994374.cms,2026-04-03T05:44:33+00:00
TOI ETimes,226,'Deeper collaboration for regional peace': Upendra Dwivedi meets Bangladesh high commissioner Riaz Hamidullah,https://timesofindia.indiatimes.com/articleshow/129993609.cms,2026-04-03T05:44:33+00:00
TOI ETimes,227,Ginni Chatrath pens adorable birthday wish for husband Kapil Sharma,https://timesofindia.indiatimes.com/articleshow/129994298.cms,2026-04-03T05:44:33+00:00
TOI ETimes,228,Murder case filed a day after police stop kin from burying girl in Delhi’s Hari Nagar; post-mortem confirms she was smothered,https://timesofindia.indiatimes.com/articleshow/129993881.cms,2026-04-03T05:44:33+00:00
TOI Viral News,1,"Watch: Hardeep Singh Puri reunites with old friend from Delhi University, video melts hearts",https://timesofindia.indiatimes.com/articleshow/108418522.cms,2026-04-03T05:44:33+00:00
TOI Viral News,2,Narayana Murthy and daughter Akshata enjoy 'Corner House' ice cream in Bengaluru,https://timesofindia.indiatimes.com/articleshow/107659138.cms,2026-04-03T05:44:33+00:00
TOI Viral News,3,Taylor Swift cheers boyfriend Travis Kelce at the Super Bowl,https://timesofindia.indiatimes.com/articleshow/107613344.cms,2026-04-03T05:44:33+00:00
TOI Viral News,4,'He Nitished me' to 'Paltu Chacha': Nitish Kumar's 'swing politics' sparks humour fest,https://timesofindia.indiatimes.com/articleshow/107236114.cms,2026-04-03T05:44:33+00:00
TOI Viral News,5,"Flyer hits IndiGo Pilot announcing flight delay due to dense fog conditions, video goes viral",https://timesofindia.indiatimes.com/articleshow/106851189.cms,2026-04-03T05:44:33+00:00
TOI Viral News,6,"New Zealand's youngest MP performs native 'war cry' in Parliament, video goes viral",https://timesofindia.indiatimes.com/articleshow/106572179.cms,2026-04-03T05:44:33+00:00
TOI Viral News,7,"NASA unveils stunning image of 'evil eye' galaxy, sparking internet awe",https://timesofindia.indiatimes.com/articleshow/105570940.cms,2026-04-03T05:44:33+00:00
TOI Viral News,8,Millennials bemoan lackluster Black Friday deals in social media uproar,https://timesofindia.indiatimes.com/articleshow/105475777.cms,2026-04-03T05:44:33+00:00
TOI Viral News,9,'At least they'll not lose to India in semis': Memes erupt with Pakistan all but out of World Cup,https://timesofindia.indiatimes.com/articleshow/105122539.cms,2026-04-03T05:44:33+00:00
TOI Viral News,10,Brazilian influencer Vanessa Mancini dies at 41 from massive heart attack,https://timesofindia.indiatimes.com/articleshow/105110853.cms,2026-04-03T05:44:33+00:00
TOI Viral News,11,Memes erupt as Angelo Mathews becomes first international cricketer to be timed out,https://timesofindia.indiatimes.com/articleshow/105016656.cms,2026-04-03T05:44:33+00:00
TOI Viral News,12,Mia Khalifa posts Amy Schumer's heated exchange with Asia Jackson over Israel-Palestine conflict,https://timesofindia.indiatimes.com/articleshow/104947696.cms,2026-04-03T05:44:33+00:00
TOI Viral News,13,Fans troll Pakistan as Proteas beat Kiwis to keep Pak's semi-final hopes alive,https://timesofindia.indiatimes.com/articleshow/104912338.cms,2026-04-03T05:44:33+00:00
TOI Viral News,14,Mark Zuckerberg and family's Halloween transformation into Hogwarts icons warms hearts,https://timesofindia.indiatimes.com/articleshow/104888586.cms,2026-04-03T05:44:33+00:00
TOI Viral News,15,'Bore hone ka chance-ich nahi' as auto driver sings & entertains people stuck in Andheri traffic,https://timesofindia.indiatimes.com/articleshow/104886091.cms,2026-04-03T05:44:33+00:00
TOI Viral News,16,Escaped monkey 'Momo' captured after it drinks beer and runs riot in Indianapolis,https://timesofindia.indiatimes.com/articleshow/104208644.cms,2026-04-03T05:44:33+00:00
TOI Viral News,17,"Animal smuggling: Otter, rat and 28 turtles cause chaos on Bangkok to Taipei flight",https://timesofindia.indiatimes.com/articleshow/104208771.cms,2026-04-03T05:44:33+00:00
TOI Viral News,18,Alligator ally oops! Phillies fan denied entry with emotional support gator,https://timesofindia.indiatimes.com/articleshow/104043227.cms,2026-04-03T05:44:33+00:00
TOI Viral News,19,'Qualified for Karachi station': Pakistan's exit from Asia Cup sparks memefest,https://timesofindia.indiatimes.com/articleshow/103687163.cms,2026-04-03T05:44:33+00:00
TOI Viral News,20,"'Racist bigots': Arabic restaurant in US refuses to serve cops in uniform, faces fury",https://timesofindia.indiatimes.com/articleshow/103285144.cms,2026-04-03T05:44:33+00:00
TOI Viral News,21,Watch: Pakistani wedding in UK descends into mass brawl as guests hurl chairs at each other,https://timesofindia.indiatimes.com/articleshow/103245258.cms,2026-04-03T05:44:33+00:00
TOI Viral News,22,Memes abuzz as Neeraj Chopra makes history with first gold for India in World Championship,https://timesofindia.indiatimes.com/articleshow/103138499.cms,2026-04-03T05:44:33+00:00
TOI Viral News,23,Boyfriend held in murder of Instagram influencer Beauty Couch in Georgia,https://timesofindia.indiatimes.com/articleshow/103125550.cms,2026-04-03T05:44:33+00:00
TOI Viral News,24,Why internet is suddenly talking about Donald Trump’s weight,https://timesofindia.indiatimes.com/articleshow/103058329.cms,2026-04-03T05:44:33+00:00
TOI Viral News,25,'Don is back': Trump's mug shot triggers memefest,https://timesofindia.indiatimes.com/articleshow/103047943.cms,2026-04-03T05:44:33+00:00
TOI Viral News,26,"Hurricane Hilary unleashes fury on Southern California, visuals viral",https://timesofindia.indiatimes.com/articleshow/102906246.cms,2026-04-03T05:44:33+00:00
TOI Viral News,27,'Shameless': Prakash Raj blasted by netizens for mocking India's moon mission,https://timesofindia.indiatimes.com/articleshow/102902284.cms,2026-04-03T05:44:33+00:00
TOI Viral News,28,'Me during WFH': Photo of Selena Gomez wrapped in 'shawl' stirs memefest,https://timesofindia.indiatimes.com/articleshow/102799584.cms,2026-04-03T05:44:33+00:00
TOI Viral News,29,'Mission impossible': Memes erupt as people find it hard to return to office after long weekend,https://timesofindia.indiatimes.com/articleshow/102768800.cms,2026-04-03T05:44:33+00:00
TOI Viral News,30,‘Paisa hi paisa hoga’: Memes erupt as Indian creators receive massive payout from Twitter,https://timesofindia.indiatimes.com/articleshow/102576219.cms,2026-04-03T05:44:33+00:00
TOI Viral News,31,"AAP removes Raghav Chadha as party's Rajya Sabha deputy leader, asks House not to allot him speaking time",https://timesofindia.indiatimes.com/articleshow/129971489.cms,2026-04-03T05:44:33+00:00
TOI Viral News,32,Bengaluru IBM techie jumps to death from 17th floor after finding husband dead inside locked room,https://timesofindia.indiatimes.com/articleshow/129919868.cms,2026-04-03T05:44:33+00:00
TOI Viral News,33,‘Bengaluru techie lost US job due to AI’: How interfaith couple’s final moments unfolded in 20 minutes,https://timesofindia.indiatimes.com/articleshow/129939145.cms,2026-04-03T05:44:33+00:00
TOI Viral News,34,Check-in to courtroom: Hotel guest told to pay over Rs 16 lakh for not paying dues,https://timesofindia.indiatimes.com/articleshow/129935288.cms,2026-04-03T05:44:33+00:00
TOI Viral News,35,Hyderabad Techie Suicide,https://timesofindia.indiatimes.com/articleshow/129992190.cms,2026-04-03T05:44:33+00:00
TOI Viral News,36,Karnataka doctor Suicide,https://timesofindia.indiatimes.com/articleshow/129992445.cms,2026-04-03T05:44:33+00:00
TOI Viral News,37,Stock Market Today,https://timesofindia.indiatimes.com/articleshow/129992985.cms,2026-04-03T05:44:33+00:00
TOI Viral News,38,Bombay High Court,https://timesofindia.indiatimes.com/articleshow/129993591.cms,2026-04-03T05:44:33+00:00
TOI Viral News,39,Pakistan Fuel Crisis,https://timesofindia.indiatimes.com/articleshow/129992549.cms,2026-04-03T05:44:33+00:00
TOI Viral News,40,BPSC AEDO Admit Card 2026,https://timesofindia.indiatimes.com/articleshow/129992439.cms,2026-04-03T05:44:33+00:00
TOI Viral News,41,Good Friday 2026,https://timesofindia.indiatimes.com/articleshow/129983174.cms,2026-04-03T05:44:33+00:00
TOI Viral News,42,IPL Match Today,https://timesofindia.indiatimes.com/articleshow/129993818.cms,2026-04-03T05:44:33+00:00
TOI Viral News,43,CSK vs PBKS Preview,https://timesofindia.indiatimes.com/articleshow/129993104.cms,2026-04-03T05:44:33+00:00
TOI Viral News,44,Bank Holiday on Good Friday,https://timesofindia.indiatimes.com/articleshow/129994436.cms,2026-04-03T05:44:33+00:00
TOI Viral News,45,Pam Bondi next role,https://timesofindia.indiatimes.com/articleshow/129988583.cms,2026-04-03T05:44:33+00:00
TOI Viral News,46,Pam Bondi exit,https://timesofindia.indiatimes.com/articleshow/129988080.cms,2026-04-03T05:44:33+00:00
TOI Viral News,47,IPL Schedule 2026,https://timesofindia.indiatimes.com/articleshow/129838168.cms,2026-04-03T05:44:33+00:00
TOI Viral News,48,Friday OTT releases of the week,https://timesofindia.indiatimes.com/articleshow/129993911.cms,2026-04-03T05:44:33+00:00
TOI Viral News,49,Dhurandhar 2 Box Office Collection,https://timesofindia.indiatimes.com/articleshow/129991874.cms,2026-04-03T05:44:33+00:00
TOI Viral News,50,Tarun Mishra Story,https://timesofindia.indiatimes.com/articleshow/129943704.cms,2026-04-03T05:44:33+00:00
TOI Viral News,51,Chef Sanjeev Kapoor,https://timesofindia.indiatimes.com/articleshow/129943579.cms,2026-04-03T05:44:33+00:00
TOI Viral News,52,Nuclear And Space Scientists,https://timesofindia.indiatimes.com/articleshow/129982872.cms,2026-04-03T05:44:33+00:00
TOI Viral News,53,Raghav Chadha Home,https://timesofindia.indiatimes.com/articleshow/129974795.cms,2026-04-03T05:44:33+00:00
TOI Viral News,54,Game Of Thrones,https://timesofindia.indiatimes.com/articleshow/129963850.cms,2026-04-03T05:44:33+00:00
TOI Viral News,55,Ustaad Bhagat Singh Collection,https://timesofindia.indiatimes.com/articleshow/129991923.cms,2026-04-03T05:44:33+00:00
TOI Viral News,56,Nithya Menen Home,https://timesofindia.indiatimes.com/articleshow/129964231.cms,2026-04-03T05:44:33+00:00
TOI Viral News,57,Dhurandhar 2 Collection,https://timesofindia.indiatimes.com/articleshow/129971469.cms,2026-04-03T05:44:33+00:00
TOI Viral News,58,Aadu 3 Box Office Collection,https://timesofindia.indiatimes.com/articleshow/129964488.cms,2026-04-03T05:44:33+00:00
TOI Viral News,59,Indian Railways New Rules,https://timesofindia.indiatimes.com/articleshow/129977942.cms,2026-04-03T05:44:33+00:00
TOI Viral News,60,Apple iPhone 18 Pro,https://timesofindia.indiatimes.com/articleshow/129918026.cms,2026-04-03T05:44:33+00:00
TOI Viral News,61,Artemis II Toilet Trouble,https://timesofindia.indiatimes.com/articleshow/129970353.cms,2026-04-03T05:44:33+00:00
TOI Viral News,62,Garena Free Fire MAX Redeem Codes,https://timesofindia.indiatimes.com/articleshow/129966376.cms,2026-04-03T05:44:33+00:00
TOI Viral News,63,Basketball Zero Codes,https://timesofindia.indiatimes.com/articleshow/129802738.cms,2026-04-03T05:44:33+00:00
TOI Viral News,64,Athletics Federation of India,https://timesofindia.indiatimes.com/articleshow/129993476.cms,2026-04-03T05:44:33+00:00
TOI Viral News,65,Kansas City Chiefs,https://timesofindia.indiatimes.com/articleshow/129988796.cms,2026-04-03T05:44:33+00:00
TOI Viral News,66,Las Vegas Raiders,https://timesofindia.indiatimes.com/articleshow/129961918.cms,2026-04-03T05:44:33+00:00
TOI Viral News,67,Vinfast Mpv 7,https://timesofindia.indiatimes.com/articleshow/129967204.cms,2026-04-03T05:44:33+00:00
TOI Viral News,68,Claude Source Code Leaks,https://timesofindia.indiatimes.com/articleshow/129925824.cms,2026-04-03T05:44:33+00:00
TOI Viral News,69,‘Rakasa’ Twitter review: Niharika Konidela’s film gets mixed talk; comedy works for many,https://timesofindia.indiatimes.com/articleshow/129994747.cms,2026-04-03T05:44:33+00:00
TOI Viral News,70,MCA starts process for new stadium in Navi Mumbai with 1 lakh capacity,https://timesofindia.indiatimes.com/articleshow/129994790.cms,2026-04-03T05:44:33+00:00
TOI Viral News,71,Word of the Day: Rouleaux,https://timesofindia.indiatimes.com/articleshow/129994764.cms,2026-04-03T05:44:33+00:00
TOI Viral News,72,'Can't expect pre-war rules …': Iran plans to 'monitor' Hormuz with Oman as tensions continue to soar,https://timesofindia.indiatimes.com/articleshow/129994751.cms,2026-04-03T05:44:33+00:00
TOI Viral News,73,From cookies to green tea: What Nasa Artemis II astronauts have in their moon mission menu,https://timesofindia.indiatimes.com/articleshow/129994327.cms,2026-04-03T05:44:33+00:00
TOI Viral News,74,How Sameer Rizvi embraced Axar Patel’s ‘challenge’ and seized his moment,https://timesofindia.indiatimes.com/articleshow/129994600.cms,2026-04-03T05:44:33+00:00
TOI Viral News,75,Air India tanks up for return flight to Myanmar at home now; all international routes under lens after ATF hike,https://timesofindia.indiatimes.com/articleshow/129994597.cms,2026-04-03T05:44:33+00:00
TOI Viral News,76,"EXIM Bank MT Call Letter 2026 released at eximbankindia.in: Check direct link, more details",https://timesofindia.indiatimes.com/articleshow/129994651.cms,2026-04-03T05:44:33+00:00
TOI Viral News,77,India set to get 3rd nuclear-powered ballistic missile submarine INS Aridhaman; Rajnath drops hint,https://timesofindia.indiatimes.com/articleshow/129994282.cms,2026-04-03T05:44:33+00:00
TOI Viral News,78,CSK vs PBKS: Ruturaj Gaikwad hopes opening combo with Sanju Samson clicks,https://timesofindia.indiatimes.com/articleshow/129994654.cms,2026-04-03T05:44:33+00:00
TOI Viral News,79,Malda Gherao Case: Alleged mastermind Mofakkarul Islam arrested at Bagdogra Airport,https://timesofindia.indiatimes.com/articleshow/129994568.cms,2026-04-03T05:44:33+00:00
TOI Viral News,80,IGPL unveiled: 10 franchises to feature in new golf league,https://timesofindia.indiatimes.com/articleshow/129994492.cms,2026-04-03T05:44:33+00:00
TOI Viral News,81,"Numerology horoscope today, April 03, 2026: What your name's first letter reveals today",https://timesofindia.indiatimes.com/articleshow/129985572.cms,2026-04-03T05:44:33+00:00
TOI Viral News,82,Congress MLA Rajendra Bharti disqualified from Madhya Pradesh assembly after conviction in cheating case,https://timesofindia.indiatimes.com/articleshow/129994374.cms,2026-04-03T05:44:33+00:00
TOI Viral News,83,'Deeper collaboration for regional peace': Upendra Dwivedi meets Bangladesh high commissioner Riaz Hamidullah,https://timesofindia.indiatimes.com/articleshow/129993609.cms,2026-04-03T05:44:33+00:00
TOI Viral News,84,Ginni Chatrath pens adorable birthday wish for husband Kapil Sharma,https://timesofindia.indiatimes.com/articleshow/129994298.cms,2026-04-03T05:44:33+00:00
TOI Viral News,85,Murder case filed a day after police stop kin from burying girl in Delhi’s Hari Nagar; post-mortem confirms she was smothered,https://timesofindia.indiatimes.com/articleshow/129993881.cms,2026-04-03T05:44:33+00:00
NDTV,1,All India News,https://www.ndtv.com/india,2026-04-03T05:44:33+00:00
NDTV,2,"""Silenced, Not Defeated"": Raghav Chadha Posts Video Message For 'Aam Aadmi'",https://www.ndtv.com/india-news/raghav-chadha-vs-aap-silenced-not-defeated-raghav-chadha-posts-video-message-for-aam-aadmi-11305239,2026-04-03T05:44:33+00:00
NDTV,3,"Fish, Identity, Votes: Bengal's Favourite Food Becomes A Key Symbol In Polls",https://www.ndtv.com/india-news/west-bengal-assembly-elections-fish-identity-votes-bengals-favourite-food-becomes-a-key-symbol-in-polls-11305187,2026-04-03T05:44:33+00:00
NDTV,4,India AI Startup Sarvam Raises Funds At $1.5 Billion Valuation,https://www.ndtv.com/india-news/india-ai-startup-sarvam-raises-funds-at-1-5-billion-valuation-11305042,2026-04-03T05:44:33+00:00
NDTV,5,Iran War Shock: Why 'Diversified' Portfolios May Still Lose Money in 2026,https://www.ndtv.com/india-news/iran-war-stock-market-investment-bonds-gold-diversified-portfolios-sector-asset-allocation-returns-11305024,2026-04-03T05:44:33+00:00
NDTV,6,Record 2.4 Lakh CAPF Personnel Deployed In Bengal Ahead Of Assembly Polls,https://www.ndtv.com/india-news/west-bengal-assembly-election-2026-election-commission-deploys-record-2-4-lakh-capf-personnel-in-west-bengal-11304883,2026-04-03T05:44:33+00:00
NDTV,7,NCERT Enters Higher Education Space With Deemed University Tag,https://www.ndtv.com/education/ncert-enters-higher-education-space-with-deemed-university-tag-11305215,2026-04-03T05:44:33+00:00
NDTV,8,BPSC AEDO Admit Card 2026 Released: Download Link Here; Exam From April 14,https://www.ndtv.com/education/bpsc-aedo-admit-card-2026-out-heres-direct-link-to-download-exam-from-april-14-11305121,2026-04-03T05:44:33+00:00
NDTV,9,CBSE Issues Advisory On QR Codes In Question Papers Amid Viral Online Claims,https://www.ndtv.com/education/misleading-online-behaviour-cbse-says-qr-codes-in-papers-are-only-for-internal-authentication-11305014,2026-04-03T05:44:33+00:00
NDTV,10,"School Assembly News Headlines (April 03): Top National, World, Sports Updates",https://www.ndtv.com/education/school-assembly-news-headlines-april-03-top-national-world-sports-updates-11303490,2026-04-03T05:44:33+00:00
NDTV,11,"UPSC Releases Admit Cards For Defence Exams, Scheduled On April 12",https://www.ndtv.com/education/union-public-service-commission-releases-nda-and-cds-admit-cards-2026-exam-on-april-12-11303316,2026-04-03T05:44:33+00:00
NDTV,12,Assembly Elections 2026,https://www.ndtv.com/elections,2026-04-03T05:44:33+00:00
NDTV,13,Tehran's 'Hit-List' Of 8 Gulf Bridges After US Destroys The Biggest In Iran,https://www.ndtv.com/world-news/iran-war-news-tehrans-hit-lit-of-8-gulf-bridges-after-us-destroys-the-biggest-in-iran-11305136,2026-04-03T05:44:33+00:00
NDTV,14,"""We Lost Mariners At Hormuz"": India Call For De-escalation In Iran",https://www.ndtv.com/world-news/iran-war-news-were-only-nation-to-lose-mariners-at-hormuz-india-at-iran-war-talks-11304867,2026-04-03T05:44:33+00:00
NDTV,15,Pete Hegseth Asks US Army Chief Of Staff To Step Down,https://www.ndtv.com/world-news/pete-hegseth-asks-us-army-chief-gen-randy-george-of-staff-to-step-down-11304613,2026-04-03T05:44:33+00:00
NDTV,16,Oracle Office In Dubai Hit In Iran Strikes? What UAE Said,https://www.ndtv.com/world-news/iran-war-news-did-iran-attack-tech-firm-oracles-office-in-dubai-what-uae-said-11304947,2026-04-03T05:44:33+00:00
NDTV,17,"Pak Minister's ""Calibrated"" Response Warning Before Pahalgam Anniversary",https://www.ndtv.com/world-news/pakistans-khawaja-asifs-calibrated-response-warning-before-pahalgam-anniversary-11305369,2026-04-03T05:44:33+00:00
NDTV,18,"Live: Iran, Allies Trade Fire With Israel, US As War Shows No Signs Of Easing",https://www.ndtv.com/world-news/donald-trumps-address-on-us-iran-war-live-updates-big-speech-on-iran-war-middle-east-conflict-oil-crisis-strait-of-hormuz-11299579,2026-04-03T05:44:33+00:00
NDTV,19,US Allies Work On Plan B For Hormuz Strait If Trump Walks Away,https://www.ndtv.com/world-news/us-allies-work-on-plan-b-for-hormuz-strait-if-trump-walks-away-11305029,2026-04-03T05:44:33+00:00
NDTV,20,"Iran's Biggest Bridge Collapses After Strikes, Trump Says 'More To Follow'",https://www.ndtv.com/world-news/iran-war-news-irans-biggest-bridge-collapses-after-strikes-donald-trump-says-more-to-follow-11304028,2026-04-03T05:44:33+00:00
NDTV,21,"After AAP Demotion, Raghav Chadha Posts Video Of Issues Raised In Parliament",https://www.ndtv.com/india-news/raghav-chadha-after-aap-demotion-raghav-chadha-posts-video-of-issues-raised-in-parliament-11303373,2026-04-03T05:44:33+00:00
NDTV,22,Indian-American Lawyer Challenges Trump's Birthright Citizenship Order,https://www.ndtv.com/world-news/indian-american-lawyer-smita-ghosh-challenges-donald-trumps-birthright-citizenship-order-11303354,2026-04-03T05:44:33+00:00
NDTV,23,"On Middle East Crisis And LPG, 2 Top Congress Leaders Ditch Party Line",https://www.ndtv.com/india-news/on-middle-east-crisis-and-lpg-2-top-congress-leaders-ditch-party-line-11304241,2026-04-03T05:44:33+00:00
NDTV,24,"Telangana Woman, Daughters Found Dead In Pool, Husband Says 'Drowned'",https://www.ndtv.com/telangana-news/telangana-woman-daughters-found-dead-in-swimming-pool-husband-says-slipped-drowned-11305180,2026-04-03T05:44:33+00:00
NDTV,25,Ranbir's Great-Grandfather Played Lord Ram 93 Years Before Nitesh's Ramayana,https://www.ndtv.com/entertainment/ranbir-kapoors-great-grandfather-prithviraj-kapoor-played-lord-ram-93-years-before-nitesh-tiwaris-ramayana-11305119,2026-04-03T05:44:33+00:00
NDTV,26,Viral Video: Actress Alleges Weird Behaviour By Passenger On Flight Despite Crew Warning,https://www.ndtv.com/travel/viral-video-actress-alleges-weird-behaviour-by-passenger-on-flight-despite-crew-warning-11300817,2026-04-03T05:44:33+00:00
NDTV,27,Sandeep Rai Rathore Appointed As Tamil Nadu Top Cop Ahead Of Polls,https://www.ndtv.com/india-news/2026-tamil-nadu-elections-sandeep-rai-rathore-appointed-as-tamil-nadu-top-cop-ahead-of-polls-11303816,2026-04-03T05:44:33+00:00
NDTV,28,Gen-Z Voters Signal A Shift In Tamil Nadu Elections,https://www.ndtv.com/india-news/2026-tamil-nadu-assembly-elections-gen-z-voters-signal-a-shift-in-tamil-nadu-elections-11302244,2026-04-03T05:44:33+00:00
NDTV,29,"Bengaluru Techie Kills Self After Child Drowns, Note Says 'I Am Responsible'",https://www.ndtv.com/india-news/bengaluru-techie-kills-self-after-child-drowns-note-says-i-am-responsible-11300717,2026-04-03T05:44:33+00:00
NDTV,30,"Distressed Over Affair With Professor Rumours, Karnataka Student Kills Self",https://www.ndtv.com/india-news/karnataka-medical-student-dies-by-suicide-over-affair-with-professor-rumours-11301500,2026-04-03T05:44:33+00:00
NDTV,31,"Man Enters UP Home, Women Residents Calmly Corner And Beat Him Up",https://www.ndtv.com/india-news/man-enters-up-home-women-residents-calmly-corner-and-beat-him-up-11301579,2026-04-03T05:44:33+00:00
NDTV,32,"Bengaluru Builder Steps On Wife's Neck And Kills Her, Arrested",https://www.ndtv.com/india-news/bengaluru-man-steps-on-wifes-neck-and-kills-her-arrested-11303224,2026-04-03T05:44:33+00:00
NDTV,33,Latest News Today,https://www.ndtv.com/latest,2026-04-03T05:44:33+00:00
NDTV,34,Education News India,https://www.ndtv.com/education,2026-04-03T05:44:33+00:00
NDTV,35,Latest Business News,https://www.ndtv.com/business-news,2026-04-03T05:44:33+00:00
NDTV,36,Rajnath Singh warns Pakistan,https://www.ndtv.com/india-news/any-misadventure-from-pakistan-will-invite-unprecedented-action-rajnath-singh-11302766,2026-04-03T05:44:33+00:00
