source,rank,headline,link,collected_at_iso
TOI ETimes,84,"Which Raja Ravi Varma painting is now India’s most expensive ever, and why can’t it leave the country?",https://timesofindia.indiatimes.com/articleshow/130188686.cms,2026-04-13T13:56:28+00:00
TOI ETimes,85,"The Sahara desert was once green and full of lakes and rivers: Cave reveals secrets from 8,000 years ago!",https://timesofindia.indiatimes.com/articleshow/130188418.cms,2026-04-13T13:56:28+00:00
TOI ETimes,86,What is the viral 'anxiety bag' and how it’s helping stressed Gen Z stay calm?,https://timesofindia.indiatimes.com/articleshow/130186848.cms,2026-04-13T13:56:28+00:00
TOI ETimes,87,"ChatGPT’s Sam Altman home attacked with Molotov cocktail: CEO shares family photo, says, “I love them more than anything”",https://timesofindia.indiatimes.com/articleshow/130186660.cms,2026-04-13T13:56:28+00:00
TOI ETimes,88,What is Amanda Ungaro's link to Melania Trump? Meet the Brazilian model who has a connection with Epstein and claims to 'expose' everything she knows about the US First Lady,https://timesofindia.indiatimes.com/articleshow/130184673.cms,2026-04-13T13:56:28+00:00
TOI ETimes,89,"Who is Doreen Romel Shamow? ""Iraq's power queen"" and volleyball player going viral online for her adorable looks",https://timesofindia.indiatimes.com/articleshow/130176488.cms,2026-04-13T13:56:28+00:00
TOI ETimes,90,Who is Venkatraman Ramakrishnan? The scientist who could not...,https://timesofindia.indiatimes.com/articleshow/130175981.cms,2026-04-13T13:56:28+00:00
TOI ETimes,91,Viral video: Russian tourist choked by locals in Bali after ...,https://timesofindia.indiatimes.com/articleshow/129983079.cms,2026-04-13T13:56:28+00:00
TOI ETimes,92,Meet Harshita Arora: Indian-origin founder of $700M startup ...,https://timesofindia.indiatimes.com/articleshow/130122853.cms,2026-04-13T13:56:28+00:00
TOI ETimes,93,"Meet Palmer Luckey: He built a $2 billion company at 19, got...",https://timesofindia.indiatimes.com/articleshow/129907090.cms,2026-04-13T13:56:28+00:00
TOI ETimes,94,"Happy Eid-ul-Fitr 2026: Eid Mubarak Wishes, Messages, Quotes...",https://timesofindia.indiatimes.com/articleshow/129680487.cms,2026-04-13T13:56:28+00:00
TOI ETimes,95,Meet Patrick Winston: MIT professor whose one-hour lecture s...,https://timesofindia.indiatimes.com/articleshow/129827810.cms,2026-04-13T13:56:28+00:00
TOI ETimes,96,'Not a game at all': Canadian PM Mark Carney and Finland’s p...,https://timesofindia.indiatimes.com/articleshow/129641203.cms,2026-04-13T13:56:28+00:00
TOI ETimes,97,"Meet Nathan Byrd: The 18-year-old who dashed into a smoke-filled home, saved family and a dog",https://timesofindia.indiatimes.com/articleshow/130175208.cms,2026-04-13T13:56:28+00:00
TOI ETimes,98,Rare solar eclipse spotted on the never-before-seen side of the Moon: What unique phenomenon did Artemis II astronauts observe during their flyby beyond the Moon?,https://timesofindia.indiatimes.com/articleshow/130174023.cms,2026-04-13T13:56:28+00:00
TOI ETimes,99,What is Buzz Lightyear’s Space Ranger Spin? Iconic 90s Disney ride reopens with a facelift before Toy Story 5 release,https://timesofindia.indiatimes.com/articleshow/130173849.cms,2026-04-13T13:56:28+00:00
TOI ETimes,100,"He was 229 kg, his friend sent him fat-shaming texts for weeks, then he lost 130 kg",https://timesofindia.indiatimes.com/articleshow/130170915.cms,2026-04-13T13:56:28+00:00
TOI ETimes,101,Who is Jason Howe? The 26-year-old high school coach accused of assault after student’s brave complaint,https://timesofindia.indiatimes.com/articleshow/130170573.cms,2026-04-13T13:56:28+00:00
TOI ETimes,102,"Who is Rao Inderjeet Yadav? From luxury lifestyle posts to Dubai arrest claim, what we know so far",https://timesofindia.indiatimes.com/articleshow/130165704.cms,2026-04-13T13:56:28+00:00
TOI ETimes,103,"Watch here: 11,000 litres of milk poured into Narmada river during MP temple ritual, video sparks debate",https://timesofindia.indiatimes.com/articleshow/130163631.cms,2026-04-13T13:56:28+00:00
TOI ETimes,104,Watch here: Cockroach in biryani? Birthday celebration at Barbeque Nation Gorakhpur sparks outrage,https://timesofindia.indiatimes.com/articleshow/130163142.cms,2026-04-13T13:56:28+00:00
TOI ETimes,105,"'Colourist, classist, garbage': Hollywood actresses Maitreyi Ramakrishnan and Supriya Ganesh hit back at 'maid phenotype' labels online",https://timesofindia.indiatimes.com/articleshow/130160652.cms,2026-04-13T13:56:28+00:00
TOI ETimes,106,What is ‘MMIWG2SLGBTQQIA+’? Canadian MP’s remark goes viral; Elon Musk reacts,https://timesofindia.indiatimes.com/articleshow/130160287.cms,2026-04-13T13:56:28+00:00
TOI ETimes,107,‘I have blacklisted your company’: Job seeker’s shocking reply leaves recruiter speechless,https://timesofindia.indiatimes.com/articleshow/130158695.cms,2026-04-13T13:56:28+00:00
TOI ETimes,108,Peaky Blinders: Uncovering the truth behind Tommy Shelby’s empire; what’s real and what’s fiction?,https://timesofindia.indiatimes.com/articleshow/130152544.cms,2026-04-13T13:56:28+00:00
TOI ETimes,109,Watch Noida shocker: Dog tied and thrashed on balcony; pet rescued after video goes viral,https://timesofindia.indiatimes.com/articleshow/130152017.cms,2026-04-13T13:56:28+00:00
TOI ETimes,110,Major update in fatal MRI incident: Lawsuit filed after man gets pulled into machine with metal chain,https://timesofindia.indiatimes.com/articleshow/130147240.cms,2026-04-13T13:56:28+00:00
TOI ETimes,111,Asha Bhosle Death News,https://timesofindia.indiatimes.com/articleshow/130204281.cms,2026-04-13T13:56:28+00:00
TOI ETimes,112,Dacoit Box Office Collection,https://timesofindia.indiatimes.com/articleshow/130224440.cms,2026-04-13T13:56:28+00:00
TOI ETimes,113,Ahmedabad Dosa Batter Tragedy,https://timesofindia.indiatimes.com/articleshow/130089214.cms,2026-04-13T13:56:28+00:00
TOI ETimes,114,Highest GDP Countries,https://timesofindia.indiatimes.com/articleshow/130205069.cms,2026-04-13T13:56:28+00:00
TOI ETimes,115,Clay Pot Roofs,https://timesofindia.indiatimes.com/articleshow/130134579.cms,2026-04-13T13:56:28+00:00
TOI ETimes,116,Viral Child Lunch,https://timesofindia.indiatimes.com/articleshow/130110517.cms,2026-04-13T13:56:28+00:00
TOI ETimes,117,Hydrogen Cooking Stove,https://timesofindia.indiatimes.com/articleshow/130224357.cms,2026-04-13T13:56:28+00:00
TOI ETimes,118,Healthy Hair Growth,https://timesofindia.indiatimes.com/articleshow/130173421.cms,2026-04-13T13:56:28+00:00
TOI ETimes,119,IAS Savita Pradhan,https://timesofindia.indiatimes.com/articleshow/130223882.cms,2026-04-13T13:56:28+00:00
TOI ETimes,120,Kareena Kapoor Khan,https://timesofindia.indiatimes.com/articleshow/130220454.cms,2026-04-13T13:56:28+00:00
TOI ETimes,121,Garena Free Fire Max Redeem Codes,https://timesofindia.indiatimes.com/articleshow/130201793.cms,2026-04-13T13:56:28+00:00
TOI ETimes,122,Hamster Kombat Combo Code,https://timesofindia.indiatimes.com/articleshow/130201569.cms,2026-04-13T13:56:28+00:00
TOI ETimes,123,Quote Of The Day By Aristotle,https://timesofindia.indiatimes.com/articleshow/130179215.cms,2026-04-13T13:56:28+00:00
TOI ETimes,124,Basketball Zero Codes,https://timesofindia.indiatimes.com/articleshow/129802738.cms,2026-04-13T13:56:28+00:00
TOI ETimes,125,Hazaribag man drowns while fishing in lake,https://timesofindia.indiatimes.com/articleshow/130060093.cms,2026-04-13T13:56:28+00:00
TOI ETimes,126,"""Behen Darr Gayi!"": Fans relive ‘Bhagam Bhag’ era after watching Akshay Kumar's 'Bhooth Bangla' trailer",https://timesofindia.indiatimes.com/articleshow/130060027.cms,2026-04-13T13:56:28+00:00
TOI ETimes,127,MBOSE HSLC result 2026 to release tomorrow: Check details here,https://timesofindia.indiatimes.com/articleshow/130059814.cms,2026-04-13T13:56:28+00:00
TOI ETimes,128,"Iran war risk: JPMorgan CEO Jamie Dimon warns of oil shocks, sticky inflation and higher interest rates",https://timesofindia.indiatimes.com/articleshow/130059993.cms,2026-04-13T13:56:28+00:00
TOI ETimes,129,Make your clutch last longer with these easy driving tips,https://timesofindia.indiatimes.com/articleshow/130052232.cms,2026-04-13T13:56:28+00:00
TOI ETimes,130,“Three-against-one situation”: El Rubius opens up on being “targeted” in MrBeast’s viral $1M challenge,https://timesofindia.indiatimes.com/articleshow/130054402.cms,2026-04-13T13:56:28+00:00
TOI ETimes,131,Bihar BTSC lab assistant notification released for 1091 posts at btsc.bihar.gov.in; apply here,https://timesofindia.indiatimes.com/articleshow/130059322.cms,2026-04-13T13:56:28+00:00
TOI ETimes,132,IPL craze costs techie Rs 1.46 lakh in fake RCB vs CSK ticket scam,https://timesofindia.indiatimes.com/articleshow/130059549.cms,2026-04-13T13:56:28+00:00
TOI ETimes,133,Raising “robot-proof” kids: Why creativity and curiosity matter more than ever,https://timesofindia.indiatimes.com/articleshow/130057342.cms,2026-04-13T13:56:28+00:00
TOI ETimes,134,Inside ‘Satguru Sharan’: Exploring Saif Ali Khan and Kareena Kapoor Khan’s Rs 100 crore Bandra home,https://timesofindia.indiatimes.com/articleshow/130059584.cms,2026-04-13T13:56:28+00:00
TOI ETimes,135,How selling Alaska in 1867 was a costly mistake for Russia,https://timesofindia.indiatimes.com/articleshow/130057081.cms,2026-04-13T13:56:28+00:00
TOI ETimes,136,'Hera Pheri 3 is coming': Paresh Rawal dismisses delay reports and reveals he will 'start shooting soon',https://timesofindia.indiatimes.com/articleshow/130059421.cms,2026-04-13T13:56:28+00:00
TOI ETimes,137,"US-Iran War: A daring rescue Hollywood blockbuster is on its way. Till then, pick your favourite from these 10 films on bringing someone home against all odds",https://timesofindia.indiatimes.com/articleshow/130059208.cms,2026-04-13T13:56:28+00:00
TOI ETimes,138,"Kolkata team unveils fan mural at Rash Behari Avenue, celebrating city’s first love",https://timesofindia.indiatimes.com/articleshow/130059554.cms,2026-04-13T13:56:28+00:00
TOI ETimes,139,How US spread a lie to rescue a pilot of a jet shot down in Iran,https://timesofindia.indiatimes.com/articleshow/130058641.cms,2026-04-13T13:56:28+00:00
TOI ETimes,140,"Netflix unveils ‘VOID’, an AI model that can change a movie plot",https://timesofindia.indiatimes.com/articleshow/130058880.cms,2026-04-13T13:56:28+00:00
TOI ETimes,141,"AI data centers are causing 'stress' not just to tech companies, but also private insurers",https://timesofindia.indiatimes.com/articleshow/130058967.cms,2026-04-13T13:56:28+00:00
TOI ETimes,142,"""Trans women are....."": Clavicular’s viral moment with trans women sparks fresh conversation on internet culture",https://timesofindia.indiatimes.com/articleshow/130053479.cms,2026-04-13T13:56:28+00:00
TOI Viral News,1,"Watch: Hardeep Singh Puri reunites with old friend from Delhi University, video melts hearts",https://timesofindia.indiatimes.com/articleshow/108418522.cms,2026-04-13T13:56:28+00:00
TOI Viral News,2,Narayana Murthy and daughter Akshata enjoy 'Corner House' ice cream in Bengaluru,https://timesofindia.indiatimes.com/articleshow/107659138.cms,2026-04-13T13:56:28+00:00
TOI Viral News,3,Taylor Swift cheers boyfriend Travis Kelce at the Super Bowl,https://timesofindia.indiatimes.com/articleshow/107613344.cms,2026-04-13T13:56:28+00:00
TOI Viral News,4,'He Nitished me' to 'Paltu Chacha': Nitish Kumar's 'swing politics' sparks humour fest,https://timesofindia.indiatimes.com/articleshow/107236114.cms,2026-04-13T13:56:28+00:00
TOI Viral News,5,"Flyer hits IndiGo Pilot announcing flight delay due to dense fog conditions, video goes viral",https://timesofindia.indiatimes.com/articleshow/106851189.cms,2026-04-13T13:56:28+00:00
TOI Viral News,6,"New Zealand's youngest MP performs native 'war cry' in Parliament, video goes viral",https://timesofindia.indiatimes.com/articleshow/106572179.cms,2026-04-13T13:56:28+00:00
TOI Viral News,7,"NASA unveils stunning image of 'evil eye' galaxy, sparking internet awe",https://timesofindia.indiatimes.com/articleshow/105570940.cms,2026-04-13T13:56:28+00:00
TOI Viral News,8,Millennials bemoan lackluster Black Friday deals in social media uproar,https://timesofindia.indiatimes.com/articleshow/105475777.cms,2026-04-13T13:56:28+00:00
TOI Viral News,9,'At least they'll not lose to India in semis': Memes erupt with Pakistan all but out of World Cup,https://timesofindia.indiatimes.com/articleshow/105122539.cms,2026-04-13T13:56:28+00:00
TOI Viral News,10,Brazilian influencer Vanessa Mancini dies at 41 from massive heart attack,https://timesofindia.indiatimes.com/articleshow/105110853.cms,2026-04-13T13:56:28+00:00
TOI Viral News,11,Memes erupt as Angelo Mathews becomes first international cricketer to be timed out,https://timesofindia.indiatimes.com/articleshow/105016656.cms,2026-04-13T13:56:28+00:00
TOI Viral News,12,Mia Khalifa posts Amy Schumer's heated exchange with Asia Jackson over Israel-Palestine conflict,https://timesofindia.indiatimes.com/articleshow/104947696.cms,2026-04-13T13:56:28+00:00
TOI Viral News,13,Fans troll Pakistan as Proteas beat Kiwis to keep Pak's semi-final hopes alive,https://timesofindia.indiatimes.com/articleshow/104912338.cms,2026-04-13T13:56:28+00:00
TOI Viral News,14,Mark Zuckerberg and family's Halloween transformation into Hogwarts icons warms hearts,https://timesofindia.indiatimes.com/articleshow/104888586.cms,2026-04-13T13:56:28+00:00
TOI Viral News,15,'Bore hone ka chance-ich nahi' as auto driver sings & entertains people stuck in Andheri traffic,https://timesofindia.indiatimes.com/articleshow/104886091.cms,2026-04-13T13:56:28+00:00
TOI Viral News,16,Escaped monkey 'Momo' captured after it drinks beer and runs riot in Indianapolis,https://timesofindia.indiatimes.com/articleshow/104208644.cms,2026-04-13T13:56:28+00:00
TOI Viral News,17,"Animal smuggling: Otter, rat and 28 turtles cause chaos on Bangkok to Taipei flight",https://timesofindia.indiatimes.com/articleshow/104208771.cms,2026-04-13T13:56:28+00:00
TOI Viral News,18,Alligator ally oops! Phillies fan denied entry with emotional support gator,https://timesofindia.indiatimes.com/articleshow/104043227.cms,2026-04-13T13:56:28+00:00
TOI Viral News,19,'Qualified for Karachi station': Pakistan's exit from Asia Cup sparks memefest,https://timesofindia.indiatimes.com/articleshow/103687163.cms,2026-04-13T13:56:28+00:00
TOI Viral News,20,"'Racist bigots': Arabic restaurant in US refuses to serve cops in uniform, faces fury",https://timesofindia.indiatimes.com/articleshow/103285144.cms,2026-04-13T13:56:28+00:00
TOI Viral News,21,Watch: Pakistani wedding in UK descends into mass brawl as guests hurl chairs at each other,https://timesofindia.indiatimes.com/articleshow/103245258.cms,2026-04-13T13:56:28+00:00
TOI Viral News,22,Memes abuzz as Neeraj Chopra makes history with first gold for India in World Championship,https://timesofindia.indiatimes.com/articleshow/103138499.cms,2026-04-13T13:56:28+00:00
TOI Viral News,23,Boyfriend held in murder of Instagram influencer Beauty Couch in Georgia,https://timesofindia.indiatimes.com/articleshow/103125550.cms,2026-04-13T13:56:28+00:00
TOI Viral News,24,Why internet is suddenly talking about Donald Trump’s weight,https://timesofindia.indiatimes.com/articleshow/103058329.cms,2026-04-13T13:56:28+00:00
TOI Viral News,25,'Don is back': Trump's mug shot triggers memefest,https://timesofindia.indiatimes.com/articleshow/103047943.cms,2026-04-13T13:56:28+00:00
TOI Viral News,26,"Hurricane Hilary unleashes fury on Southern California, visuals viral",https://timesofindia.indiatimes.com/articleshow/102906246.cms,2026-04-13T13:56:28+00:00
TOI Viral News,27,'Shameless': Prakash Raj blasted by netizens for mocking India's moon mission,https://timesofindia.indiatimes.com/articleshow/102902284.cms,2026-04-13T13:56:28+00:00
TOI Viral News,28,'Me during WFH': Photo of Selena Gomez wrapped in 'shawl' stirs memefest,https://timesofindia.indiatimes.com/articleshow/102799584.cms,2026-04-13T13:56:28+00:00
TOI Viral News,29,'Mission impossible': Memes erupt as people find it hard to return to office after long weekend,https://timesofindia.indiatimes.com/articleshow/102768800.cms,2026-04-13T13:56:28+00:00
TOI Viral News,30,‘Paisa hi paisa hoga’: Memes erupt as Indian creators receive massive payout from Twitter,https://timesofindia.indiatimes.com/articleshow/102576219.cms,2026-04-13T13:56:28+00:00
TOI Viral News,31,"‘Victims allegedly forced to offer namaz, eat beef, sexually harassed’: What we know about Nashik IT firm case",https://timesofindia.indiatimes.com/articleshow/130187754.cms,2026-04-13T13:56:28+00:00
TOI Viral News,32,"'Tum kaale ho, mujhe deserve nahi karte': Wife plots husband murder with lover; chilling details emerge",https://timesofindia.indiatimes.com/articleshow/130161342.cms,2026-04-13T13:56:28+00:00
TOI Viral News,33,Delhi Police bust ISI-backed spy module; 10 operatives arrested in major crackdown,https://timesofindia.indiatimes.com/articleshow/130160651.cms,2026-04-13T13:56:28+00:00
TOI Viral News,34,Caught on cam: UP lawyer shot dead during morning walk in full public view in Mirzapur,https://timesofindia.indiatimes.com/articleshow/130184774.cms,2026-04-13T13:56:28+00:00
TOI Viral News,35,NEET UG Exam City Intimation Slip,https://timesofindia.indiatimes.com/articleshow/130223167.cms,2026-04-13T13:56:28+00:00
TOI Viral News,36,Noida Workers Protest,https://timesofindia.indiatimes.com/articleshow/130233464.cms,2026-04-13T13:56:28+00:00
TOI Viral News,37,Kick Streamer Clavicular,https://timesofindia.indiatimes.com/articleshow/130229882.cms,2026-04-13T13:56:28+00:00
TOI Viral News,38,IB MTS result 2026,https://timesofindia.indiatimes.com/articleshow/130236329.cms,2026-04-13T13:56:28+00:00
TOI Viral News,39,Nashik TCS Sexual Harassment Case,https://timesofindia.indiatimes.com/articleshow/130224298.cms,2026-04-13T13:56:28+00:00
TOI Viral News,40,Blockade of Hormuz,https://timesofindia.indiatimes.com/articleshow/130209249.cms,2026-04-13T13:56:28+00:00
TOI Viral News,41,JEE Main Anser Way,https://timesofindia.indiatimes.com/articleshow/130224887.cms,2026-04-13T13:56:28+00:00
TOI Viral News,42,Bengaluru Student Death,https://timesofindia.indiatimes.com/articleshow/130216801.cms,2026-04-13T13:56:28+00:00
TOI Viral News,43,Pakistan Coast Guard Personnel Attack,https://timesofindia.indiatimes.com/articleshow/130223060.cms,2026-04-13T13:56:28+00:00
TOI Viral News,44,Assam HS 12th Result,https://timesofindia.indiatimes.com/articleshow/130224285.cms,2026-04-13T13:56:28+00:00
TOI Viral News,45,IPL Match Today,https://timesofindia.indiatimes.com/articleshow/130225155.cms,2026-04-13T13:56:28+00:00
TOI Viral News,46,IPL Schedule 2026,https://timesofindia.indiatimes.com/articleshow/130051892.cms,2026-04-13T13:56:28+00:00
TOI Viral News,47,Asha Bhosle Death News,https://timesofindia.indiatimes.com/articleshow/130204281.cms,2026-04-13T13:56:28+00:00
TOI Viral News,48,Dacoit Box Office Collection,https://timesofindia.indiatimes.com/articleshow/130224440.cms,2026-04-13T13:56:28+00:00
TOI Viral News,49,Ahmedabad Dosa Batter Tragedy,https://timesofindia.indiatimes.com/articleshow/130089214.cms,2026-04-13T13:56:28+00:00
TOI Viral News,50,Sawai Madho Singh II,https://timesofindia.indiatimes.com/articleshow/130190590.cms,2026-04-13T13:56:28+00:00
TOI Viral News,51,Highest GDP Countries,https://timesofindia.indiatimes.com/articleshow/130205069.cms,2026-04-13T13:56:28+00:00
TOI Viral News,52,Dhurandhar 2 Box Office Collection,https://timesofindia.indiatimes.com/articleshow/130222386.cms,2026-04-13T13:56:28+00:00
TOI Viral News,53,Clay Pot Roofs,https://timesofindia.indiatimes.com/articleshow/130134579.cms,2026-04-13T13:56:28+00:00
TOI Viral News,54,Asha Bhosle Restaurant,https://timesofindia.indiatimes.com/articleshow/130226437.cms,2026-04-13T13:56:28+00:00
TOI Viral News,55,Viral Child Lunch,https://timesofindia.indiatimes.com/articleshow/130110517.cms,2026-04-13T13:56:28+00:00
TOI Viral News,56,Hydrogen Cooking Stove,https://timesofindia.indiatimes.com/articleshow/130224357.cms,2026-04-13T13:56:28+00:00
TOI Viral News,57,Healthy Hair Growth,https://timesofindia.indiatimes.com/articleshow/130173421.cms,2026-04-13T13:56:28+00:00
TOI Viral News,58,IAS Savita Pradhan,https://timesofindia.indiatimes.com/articleshow/130223882.cms,2026-04-13T13:56:28+00:00
TOI Viral News,59,Kareena Kapoor Khan,https://timesofindia.indiatimes.com/articleshow/130220454.cms,2026-04-13T13:56:28+00:00
TOI Viral News,60,Dhurandhar 2 Collection,https://timesofindia.indiatimes.com/articleshow/130230475.cms,2026-04-13T13:56:28+00:00
TOI Viral News,61,Garena Free Fire Max Redeem Codes,https://timesofindia.indiatimes.com/articleshow/130201793.cms,2026-04-13T13:56:28+00:00
TOI Viral News,62,Hamster Kombat Combo Code,https://timesofindia.indiatimes.com/articleshow/130201569.cms,2026-04-13T13:56:28+00:00
TOI Viral News,63,Quote Of The Day By Aristotle,https://timesofindia.indiatimes.com/articleshow/130179215.cms,2026-04-13T13:56:28+00:00
TOI Viral News,64,Basketball Zero Codes,https://timesofindia.indiatimes.com/articleshow/129802738.cms,2026-04-13T13:56:28+00:00
TOI Viral News,65,Stock Market Today,https://timesofindia.indiatimes.com/articleshow/130223298.cms,2026-04-13T13:56:28+00:00
TOI Viral News,66,Bengaluru Bodybuilder Suicide,https://timesofindia.indiatimes.com/articleshow/130224614.cms,2026-04-13T13:56:28+00:00
TOI Viral News,67,Bengaluru Murder News,https://timesofindia.indiatimes.com/articleshow/130217683.cms,2026-04-13T13:56:28+00:00
TOI Viral News,68,Kerala Student Death,https://timesofindia.indiatimes.com/articleshow/130224854.cms,2026-04-13T13:56:28+00:00
TOI Viral News,69,Mumbai Vande Bharat,https://timesofindia.indiatimes.com/articleshow/130192908.cms,2026-04-13T13:56:28+00:00
TOI Viral News,70,Ghaziabad Rape and Murder,https://timesofindia.indiatimes.com/articleshow/130222355.cms,2026-04-13T13:56:28+00:00
TOI Viral News,71,Pune Student Suicide,https://timesofindia.indiatimes.com/articleshow/130218029.cms,2026-04-13T13:56:28+00:00
TOI Viral News,72,Jaipur Woman Molestation,https://timesofindia.indiatimes.com/articleshow/130224193.cms,2026-04-13T13:56:28+00:00
TOI Viral News,73,Top Stock Recommendations,https://timesofindia.indiatimes.com/articleshow/130223147.cms,2026-04-13T13:56:28+00:00
TOI Viral News,74,US Military Draft 2026,https://timesofindia.indiatimes.com/articleshow/130153165.cms,2026-04-13T13:56:28+00:00
TOI Viral News,75,Cape Air door opens,https://timesofindia.indiatimes.com/articleshow/130152412.cms,2026-04-13T13:56:28+00:00
TOI Viral News,76,Frisco racism speech,https://timesofindia.indiatimes.com/articleshow/130150563.cms,2026-04-13T13:56:28+00:00
TOI Viral News,77,US pastor abuse,https://timesofindia.indiatimes.com/articleshow/130149252.cms,2026-04-13T13:56:28+00:00
TOI Viral News,78,BITSAT Admit Card 2026,https://timesofindia.indiatimes.com/articleshow/130177574.cms,2026-04-13T13:56:28+00:00
TOI Viral News,79,PSEB Class 8th result,https://timesofindia.indiatimes.com/articleshow/130175614.cms,2026-04-13T13:56:28+00:00
TOI Viral News,80,RR Vs SRH Live Streaming,https://timesofindia.indiatimes.com/articleshow/130236540.cms,2026-04-13T13:56:28+00:00
TOI Viral News,81,Mega Laser Beam Signal,https://timesofindia.indiatimes.com/articleshow/130218711.cms,2026-04-13T13:56:28+00:00
TOI Viral News,82,Hazaribag man drowns while fishing in lake,https://timesofindia.indiatimes.com/articleshow/130060093.cms,2026-04-13T13:56:28+00:00
TOI Viral News,83,"""Behen Darr Gayi!"": Fans relive ‘Bhagam Bhag’ era after watching Akshay Kumar's 'Bhooth Bangla' trailer",https://timesofindia.indiatimes.com/articleshow/130060027.cms,2026-04-13T13:56:28+00:00
TOI Viral News,84,MBOSE HSLC result 2026 to release tomorrow: Check details here,https://timesofindia.indiatimes.com/articleshow/130059814.cms,2026-04-13T13:56:28+00:00
TOI Viral News,85,"Iran war risk: JPMorgan CEO Jamie Dimon warns of oil shocks, sticky inflation and higher interest rates",https://timesofindia.indiatimes.com/articleshow/130059993.cms,2026-04-13T13:56:28+00:00
TOI Viral News,86,Make your clutch last longer with these easy driving tips,https://timesofindia.indiatimes.com/articleshow/130052232.cms,2026-04-13T13:56:28+00:00
TOI Viral News,87,“Three-against-one situation”: El Rubius opens up on being “targeted” in MrBeast’s viral $1M challenge,https://timesofindia.indiatimes.com/articleshow/130054402.cms,2026-04-13T13:56:28+00:00
TOI Viral News,88,Bihar BTSC lab assistant notification released for 1091 posts at btsc.bihar.gov.in; apply here,https://timesofindia.indiatimes.com/articleshow/130059322.cms,2026-04-13T13:56:28+00:00
TOI Viral News,89,IPL craze costs techie Rs 1.46 lakh in fake RCB vs CSK ticket scam,https://timesofindia.indiatimes.com/articleshow/130059549.cms,2026-04-13T13:56:28+00:00
TOI Viral News,90,Raising “robot-proof” kids: Why creativity and curiosity matter more than ever,https://timesofindia.indiatimes.com/articleshow/130057342.cms,2026-04-13T13:56:28+00:00
TOI Viral News,91,Inside ‘Satguru Sharan’: Exploring Saif Ali Khan and Kareena Kapoor Khan’s Rs 100 crore Bandra home,https://timesofindia.indiatimes.com/articleshow/130059584.cms,2026-04-13T13:56:28+00:00
TOI Viral News,92,How selling Alaska in 1867 was a costly mistake for Russia,https://timesofindia.indiatimes.com/articleshow/130057081.cms,2026-04-13T13:56:28+00:00
TOI Viral News,93,'Hera Pheri 3 is coming': Paresh Rawal dismisses delay reports and reveals he will 'start shooting soon',https://timesofindia.indiatimes.com/articleshow/130059421.cms,2026-04-13T13:56:28+00:00
TOI Viral News,94,"US-Iran War: A daring rescue Hollywood blockbuster is on its way. Till then, pick your favourite from these 10 films on bringing someone home against all odds",https://timesofindia.indiatimes.com/articleshow/130059208.cms,2026-04-13T13:56:28+00:00
