source,rank,headline,link,collected_at_iso
LiveMint,80,Gold Rate Hyderabad,https://www.livemint.com/gold-prices/hyderabad,2026-04-14T06:04:36+00:00
LiveMint,81,Silver Rate Today,https://www.livemint.com/silver-prices,2026-04-14T06:04:36+00:00
LiveMint,82,Silver Rate in Delhi,https://www.livemint.com/silver-prices/delhi,2026-04-14T06:04:36+00:00
LiveMint,83,Silver Rate in Bangalore,https://www.livemint.com/silver-prices/bangalore,2026-04-14T06:04:36+00:00
LiveMint,84,US Stock Market,https://www.livemint.com/market/us-market,2026-04-14T06:04:36+00:00
LiveMint,85,Terms of Use,https://www.livemint.com/terms-of-use,2026-04-14T06:04:36+00:00
LiveMint,86,Code of ethics,https://www.livemint.com/code-of-ethics,2026-04-14T06:04:36+00:00
LiveMint,87,Stock Market Today,https://www.livemint.com/market/stock-market-news/stock-market-today-sensex-today-nifty-gold-rate-today-silver-rate-today-crude-oil-prices-us-iran-war-trump-7-april-2026-11775527434110.html,2026-04-14T06:04:36+00:00
LiveMint,88,MCX Gold Rate,https://www.livemint.com/market/market-stats/commodity-mcx-gold-price,2026-04-14T06:04:36+00:00
LiveMint,89,MCX Silver Price,https://www.livemint.com/market/market-stats/commodity-mcx-silver-price,2026-04-14T06:04:36+00:00
LiveMint,90,Gold Price in Mumbai,https://www.livemint.com/gold-prices/mumbai,2026-04-14T06:04:36+00:00
LiveMint,91,Gold Price in Chennai,https://www.livemint.com/gold-prices/chennai,2026-04-14T06:04:36+00:00
LiveMint,92,Gold Price in Kolkata,https://www.livemint.com/gold-prices/kolkata,2026-04-14T06:04:36+00:00
LiveMint,93,Silver Price in Mumbai,https://www.livemint.com/silver-prices/mumbai,2026-04-14T06:04:36+00:00
LiveMint,94,Silver Price in Chennai,https://www.livemint.com/silver-prices/chennai,2026-04-14T06:04:36+00:00
LiveMint,95,Silver Price in Hyderabad,https://www.livemint.com/silver-prices/hyderabad,2026-04-14T06:04:36+00:00
LiveMint,96,Silver Price in Kolkata,https://www.livemint.com/silver-prices/kolkata,2026-04-14T06:04:36+00:00
LiveMint,97,Latest News Today,https://www.livemint.com/news,2026-04-14T06:04:36+00:00
LiveMint,98,US News Today,https://www.livemint.com/news/us-news,2026-04-14T06:04:36+00:00
LiveMint,99,Top Company Leader,https://www.livemint.com/companies/people,2026-04-14T06:04:36+00:00
LiveMint,100,personal loan emi calculator,https://www.livemint.com/loans/personal-loan-emi-calculator,2026-04-14T06:04:36+00:00
LiveMint,101,Personal Loan Interest Rate,https://www.livemint.com/loans/personal-loan-interest-rates,2026-04-14T06:04:36+00:00
LiveMint,102,Personal Loan Eligibility,https://www.livemint.com/loans/personal-loan-eligibility,2026-04-14T06:04:36+00:00
LiveMint,103,Instant Personal Loan,https://www.livemint.com/loans/instant-personal-loan,2026-04-14T06:04:36+00:00
LiveMint,104,Home Loan EMI Calculator,https://www.livemint.com/tools-calculators/home-loan-emi-calculator,2026-04-14T06:04:36+00:00
LiveMint,105,Car Loan EMI,https://www.livemint.com/tools-calculators/car-loan-calculator,2026-04-14T06:04:36+00:00
India Today,1,"Mamata Banerjee spotted wearing 3 fitness trackers, here's why it's not unusual",https://www.indiatoday.in/trending-news/story/mamata-banerjee-spotted-wearing-3-fitness-trackers-heres-why-its-not-unusual-2895773-2026-04-14,2026-04-14T06:04:36+00:00
India Today,2,CISF's quick action helps German passenger retrieve bag at Delhi airport,https://www.indiatoday.in/trending-news/story/cisfs-quick-action-helps-german-passenger-retrieve-bag-at-delhi-airport-2895654-2026-04-13,2026-04-14T06:04:36+00:00
India Today,3,Lion pulled to safety after hour-long rescue in Gujarat. Deputy CM shares video,https://www.indiatoday.in/trending-news/story/lion-pulled-to-safety-after-hour-long-rescue-in-gujarat-deputy-cm-shares-video-2895635-2026-04-13,2026-04-14T06:04:36+00:00
India Today,4,Bengaluru founder blames pedestrians for traffic jam. Internet has thoughts,https://www.indiatoday.in/trending-news/story/bengaluru-founder-blames-pedestrians-for-traffic-jam-internet-has-thoughts-2895578-2026-04-13,2026-04-14T06:04:36+00:00
India Today,5,"Red panda cute, Hungrypanda not: Zohran Mamdani's zoo announcement goes viral",https://www.indiatoday.in/trending-news/story/zohran-mamdanis-zoo-announcement-goes-viral-in-new-york-city-food-delivery-app-hungrypanda-settlement-2895546-2026-04-13,2026-04-14T06:04:36+00:00
India Today,6,"After Arijit Singh concert, HCL employees discover an unexpected metro perk",https://www.indiatoday.in/trending-news/story/after-arijit-singh-concert-hcl-employees-discover-an-unexpected-delhi-metro-perk-2895486-2026-04-13,2026-04-14T06:04:36+00:00
India Today,7,How this engineer made classroom trigonometry click for the internet,https://www.indiatoday.in/trending-news/story/how-this-engineer-made-classroom-trigonometry-click-for-the-internet-2895416-2026-04-13,2026-04-14T06:04:36+00:00
India Today,8,"Anand Mahindra mourns Asha Bhosle, recalls her 'bold, experimental' style",https://www.indiatoday.in/trending-news/story/anand-mahindra-mourns-asha-bhosle-recalls-her-bold-experimental-style-2895418-2026-04-13,2026-04-14T06:04:36+00:00
India Today,9,Mumbai entrepreneur's hiring decision after candidate said he was fired goes viral,https://www.indiatoday.in/trending-news/story/mumbai-entrepreneur-hiring-decision-after-candidate-said-he-was-fired-from-last-job-goes-viral-2895366-2026-04-13,2026-04-14T06:04:36+00:00
India Today,10,Startup advisor shares how 'well-timed' chat with Deepinder Goyal shaped his purpose,https://www.indiatoday.in/trending-news/story/startup-advisor-shares-how-well-timed-chat-with-deepinder-goyal-shaped-his-purpose-2895308-2026-04-13,2026-04-14T06:04:36+00:00
India Today,11,Paytm founder praises man's fun take on trigonometric formulas. Must watch,https://www.indiatoday.in/trending-news/story/mechanical-engineers-fun-take-on-trigonometric-formulas-goes-viral-paytm-founder-shares-post-2895157-2026-04-12,2026-04-14T06:04:36+00:00
India Today,12,Thief gets trapped in shutter while trying to break into UP clinic. Video is viral,https://www.indiatoday.in/trending-news/story/thief-gets-trapped-in-shutter-while-trying-to-break-into-up-clinic-video-is-viral-2895148-2026-04-12,2026-04-14T06:04:36+00:00
India Today,13,"Woman misses bus despite being on time, gets refund after video goes viral",https://www.indiatoday.in/trending-news/story/woman-misses-bus-despite-being-on-time-gets-refund-after-video-goes-viral-2895138-2026-04-12,2026-04-14T06:04:36+00:00
India Today,14,Founder flags 'not my problem' mindset after co-passenger litters IndiGo flight,https://www.indiatoday.in/trending-news/story/founder-flags-not-my-problem-mindset-after-co-passenger-litters-indigo-flight-2895124-2026-04-12,2026-04-14T06:04:36+00:00
India Today,15,Family gifts air cooler to house help. Her priceless reaction has internet's heart,https://www.indiatoday.in/trending-news/story/family-gifts-air-cooler-to-house-help-her-priceless-reaction-has-internets-heart-2895052-2026-04-12,2026-04-14T06:04:36+00:00
India Today,16,This video of a paralysed auto driver offering prayers will stop you mid-scroll,https://www.indiatoday.in/trending-news/story/this-video-of-a-paralysed-auto-driver-offering-prayers-will-stop-you-mid-scroll-2895049-2026-04-12,2026-04-14T06:04:36+00:00
India Today,17,Railway staff dumps garbage from moving train. Viral video raises questions,https://www.indiatoday.in/trending-news/story/railway-staff-dumps-garbage-from-moving-train-viral-video-raises-questions-2895036-2026-04-12,2026-04-14T06:04:36+00:00
India Today,18,Russian woman rates Indian cities on safety. Guess how much Delhi got,https://www.indiatoday.in/trending-news/story/russian-woman-rates-indian-cities-on-safety-in-viral-video-guess-how-much-delhi-got-2895029-2026-04-12,2026-04-14T06:04:36+00:00
India Today,19,Rs 500 for a day in Bengaluru? Woman's budget challenge goes viral,https://www.indiatoday.in/trending-news/story/rs-500-for-a-day-in-bengaluru-womans-budget-challenge-goes-viral-2895015-2026-04-12,2026-04-14T06:04:36+00:00
India Today,20,"Woman fired for 'no work' gets rehired to train replacements, internet goes huh?",https://www.indiatoday.in/trending-news/story/woman-fired-for-no-work-gets-rehired-to-train-replacements-internet-goes-huh-2894811-2026-04-11,2026-04-14T06:04:36+00:00
India Today,21,"LinkedIn is paying up to Rs 14,000 per hour for people to train AI on coding and other roles",https://www.indiatoday.in/jobs/story/linkedin-is-paying-up-to-rs-14000-per-hour-for-people-to-train-ai-on-coding-and-other-roles-tchc-2895818-2026-04-14,2026-04-14T06:04:36+00:00
India Today,22,Earn Rs 12 lakh or Rs 30 lakh? See how your gratuity changes with 50% basic pay,https://www.indiatoday.in/business/personal-finance/story/earn-rs-12-lakh-or-rs-30-lakh-see-how-your-gratuity-changes-with-50-basic-pay-2895814-2026-04-14,2026-04-14T06:04:36+00:00
India Today,23,PawPal Mode in eSUVs aims to make pet travel in cars safer and easier,https://www.indiatoday.in/information/story/pawpal-mode-esuvs-pet-travel-safety-convenience-2895811-2026-04-14,2026-04-14T06:04:36+00:00
India Today,24,IPL 2026 Play Of The Day: MI's big guns fail to replicate Jaiswal-Sooryavanshi blitz,https://www.indiatoday.in/sports/cricket/story/ipl-2026-rr-vs-mi-vaibhav-sooryavanshi-yashasvi-jaiswal-blitz-jasprit-bumrah-2893028-2026-04-08,2026-04-14T06:04:36+00:00
India Today,25,"Dhoni my wicketkeeping inspiration, Impact Sub rule good for youngsters: Prabhsimran",https://www.indiatoday.in/sports/cricket/story/prabhsimran-dhoni-wicketkeeping-inspiration-impact-sub-rule-ipl-youngsters-pbks-2893850-2026-04-09,2026-04-14T06:04:36+00:00
India Today,26,"YouTube now automatically adjust playback speed, changes control if you are walking",https://www.indiatoday.in/technology/news/story/youtube-now-automatically-adjust-playback-speed-changes-control-if-you-are-walking-2893747-2026-04-09,2026-04-14T06:04:36+00:00
India Today,27,"Who negotiates for Iran now, with its top leadership gone?",https://www.indiatoday.in/world/story/who-negotiates-for-iran-now-with-its-top-leadership-gone-2893874-2026-04-09,2026-04-14T06:04:36+00:00
India Today,28,Saudi League is rigged for Ronaldo: Fans call out horrible refereeing,https://www.indiatoday.in/sports/football/story/saudi-pro-league-referee-cheating-cristiano-ronaldo-2893849-2026-04-09,2026-04-14T06:04:36+00:00
TOI ETimes,1,Kareena stuns in red Valentino as Saif can’t take eyes off her,https://timesofindia.indiatimes.com/articleshow/130209251.cms,2026-04-14T06:04:36+00:00
TOI ETimes,2,Inside Rajasthan’s push for meaningful baby names: What you name your child matters more than you think,https://timesofindia.indiatimes.com/articleshow/130161079.cms,2026-04-14T06:04:36+00:00
TOI ETimes,3,"Quote of the day by Claude Shannon, the eponym of Claude AI: Information is the resolution of uncertainty",https://timesofindia.indiatimes.com/articleshow/130164653.cms,2026-04-14T06:04:36+00:00
TOI ETimes,4,Indian and American parenting and parental care: Viral social media clip highlights cultural differences,https://timesofindia.indiatimes.com/articleshow/130167532.cms,2026-04-14T06:04:36+00:00
TOI ETimes,5,When “first day of school” feels like a big goodbye: A viral video every parent will relate to,https://timesofindia.indiatimes.com/articleshow/130167652.cms,2026-04-14T06:04:36+00:00
TOI ETimes,6,Not your usual ID check: School video showcases students’ hilarious ‘ID card emotions’,https://timesofindia.indiatimes.com/articleshow/130169206.cms,2026-04-14T06:04:36+00:00
TOI ETimes,7,'Dhurandhar 2’ BEATS ‘Jawan’ and ‘Stree 2’ in week 4,https://timesofindia.indiatimes.com/articleshow/130249009.cms,2026-04-14T06:04:36+00:00
TOI ETimes,8,Tom Holland teases 'emotional' Spider-Man plot,https://timesofindia.indiatimes.com/articleshow/130251831.cms,2026-04-14T06:04:36+00:00
TOI ETimes,9,Alec Baldwin wants to quit acting after ‘Rust’ fallout,https://timesofindia.indiatimes.com/articleshow/130251054.cms,2026-04-14T06:04:36+00:00
TOI ETimes,10,Zayn Malik picks SRK's 'Main Hoon Na' as his favourite film,https://timesofindia.indiatimes.com/articleshow/130250372.cms,2026-04-14T06:04:36+00:00
TOI ETimes,11,Zanai Bhosle expresses gratitude for honoring Asha Bhosle,https://timesofindia.indiatimes.com/articleshow/130250809.cms,2026-04-14T06:04:36+00:00
TOI ETimes,12,Hailey Bieber shares post after Justin’s Coachella set,https://timesofindia.indiatimes.com/articleshow/130250487.cms,2026-04-14T06:04:36+00:00
TOI ETimes,13,"Pakistan's news channel reports late Asha Bhosle's demise, lands in legal trouble for running 'Indian content- Report",https://timesofindia.indiatimes.com/articleshow/130252102.cms,2026-04-14T06:04:36+00:00
TOI ETimes,14,Milind Soman visits Mahakaleshwar temple with wife Ankita Konwar; Fitness icon participates in Bhasma Aarti,https://timesofindia.indiatimes.com/articleshow/130252069.cms,2026-04-14T06:04:36+00:00
TOI ETimes,15,"Piyush Mishra talks about Anurag Kashyap, saying, 'zabardast virodh hai usse'; shares his rocky equation with Naseeruddin Shah",https://timesofindia.indiatimes.com/articleshow/130250276.cms,2026-04-14T06:04:36+00:00
TOI ETimes,16,Priyanka Chopra reacts with love to John Cena’s tribute to Asha Bhosle; calls the late icon ‘Queen’,https://timesofindia.indiatimes.com/articleshow/130249995.cms,2026-04-14T06:04:36+00:00
TOI ETimes,17,'Dhurandhar 2' BO day 26 [LIVE]: Ranveer Singh film chases Rs. 1100 crore,https://timesofindia.indiatimes.com/articleshow/130230475.cms,2026-04-14T06:04:36+00:00
TOI ETimes,18,"'Dhurandhar 2' now first Hindi film to cross Rs 1,700 cr",https://timesofindia.indiatimes.com/articleshow/130222386.cms,2026-04-14T06:04:36+00:00
TOI ETimes,19,'Super Mario Galaxy' crowned highest-grossing film of 2026,https://timesofindia.indiatimes.com/articleshow/130220558.cms,2026-04-14T06:04:36+00:00
TOI ETimes,20,'Dhurandhar 2' box office Day 25 [LIVE]: Film is set to cross Rs 1080 cr today,https://timesofindia.indiatimes.com/articleshow/130204010.cms,2026-04-14T06:04:36+00:00
TOI ETimes,21,"‘Dhurandhar 2’ inches closer to Rs 1,700 cr worldwide in 24 days",https://timesofindia.indiatimes.com/articleshow/130201201.cms,2026-04-14T06:04:36+00:00
TOI ETimes,22,Animal Preview: Ranbir Kapoor and Sandeep Reddy Vanga are set to shake up the box office hierarchy,https://timesofindia.indiatimes.com/articleshow/105615612.cms,2026-04-14T06:04:36+00:00
TOI ETimes,23,Tu Jhoothi Main Makkaar,https://timesofindia.indiatimes.com/articleshow/98272134.cms,2026-04-14T06:04:36+00:00
TOI ETimes,24,Apeksha: I believe that with persistence and passion,https://timesofindia.indiatimes.com/articleshow/130232667.cms,2026-04-14T06:04:36+00:00
TOI ETimes,25,Ankita mourns legendary singer Asha Bhosle’s demise,https://timesofindia.indiatimes.com/articleshow/130231989.cms,2026-04-14T06:04:36+00:00
TOI ETimes,26,Rashami Desai: I feel my journey has shaped,https://timesofindia.indiatimes.com/articleshow/130231851.cms,2026-04-14T06:04:36+00:00
TOI ETimes,27,Young singers learn from her work: Parleen on Asha,https://timesofindia.indiatimes.com/articleshow/130231616.cms,2026-04-14T06:04:36+00:00
TOI ETimes,28,"For me, acting is about feeling, not just performing: Adrija",https://timesofindia.indiatimes.com/articleshow/130231547.cms,2026-04-14T06:04:36+00:00
TOI ETimes,29,Success quote of the day by Jim Carrey - 'You can fail at...',https://timesofindia.indiatimes.com/articleshow/130251529.cms,2026-04-14T06:04:36+00:00
TOI ETimes,30,How a wet towel keeps your cutting board safe and steady,https://timesofindia.indiatimes.com/articleshow/130230426.cms,2026-04-14T06:04:36+00:00
TOI ETimes,31,The cross-ventilation trick: How to position your fans like a pro this summer,https://timesofindia.indiatimes.com/articleshow/130234416.cms,2026-04-14T06:04:36+00:00
TOI ETimes,32,The pantry rescue: How this kitchen flour saves your clothes from oil stains,https://timesofindia.indiatimes.com/articleshow/130230423.cms,2026-04-14T06:04:36+00:00
TOI ETimes,33,The morning mirror hack: How a dab of shaving foam can end your post-shower fog frustration,https://timesofindia.indiatimes.com/articleshow/130234837.cms,2026-04-14T06:04:36+00:00
TOI ETimes,34,Don't toss those wilted greens! The 20-minute kitchen trick that restores their crunch,https://timesofindia.indiatimes.com/articleshow/130230419.cms,2026-04-14T06:04:36+00:00
TOI ETimes,35,Video: She tried living on ₹500 in Bengaluru for a day – what happened next surprised many,https://timesofindia.indiatimes.com/articleshow/130250878.cms,2026-04-14T06:04:36+00:00
TOI ETimes,36,What really happened during her 10-hour Mumbai layover? Pakistani traveller’s India video goes viral,https://timesofindia.indiatimes.com/articleshow/130250806.cms,2026-04-14T06:04:36+00:00
TOI ETimes,37,"Ambedkar Jayanti 2026: Images, Quotes, Wishes, Messages, Cards, Greetings, and GIFs",https://timesofindia.indiatimes.com/articleshow/130242222.cms,2026-04-14T06:04:36+00:00
TOI ETimes,38,"Hyderabad shocker: Drunk BMW driver uses gadget to switch number plate in seconds, lands in police custody",https://timesofindia.indiatimes.com/articleshow/130243920.cms,2026-04-14T06:04:36+00:00
TOI ETimes,39,From silver rice to pampered chickens: 5 most royal yet peculiar cuisine practices of Emperor Akbar,https://timesofindia.indiatimes.com/articleshow/130243768.cms,2026-04-14T06:04:36+00:00
TOI ETimes,40,Beauty Queen to Army Officer: The inspiring journey of Lt. Kashish Methwani will give you goosebumps,https://timesofindia.indiatimes.com/articleshow/130242847.cms,2026-04-14T06:04:36+00:00
TOI ETimes,41,‘Gaate gaate hi chali jau’: Asha Bhosle’s heartfelt wish to embrace her final note while singing,https://timesofindia.indiatimes.com/articleshow/130229352.cms,2026-04-14T06:04:36+00:00
TOI ETimes,42,Juggy D: ‘Asha ji will forever be the definition of Indian music industry’ - Exclusive,https://timesofindia.indiatimes.com/articleshow/130228380.cms,2026-04-14T06:04:36+00:00
TOI ETimes,43,Shreya Ghoshal pays tribute to Asha Bhosle at her London concert: 'You are gonna be eternal',https://timesofindia.indiatimes.com/articleshow/130225605.cms,2026-04-14T06:04:36+00:00
TOI ETimes,44,Usha Uthup remembers Asha Bhosle,https://timesofindia.indiatimes.com/articleshow/130225773.cms,2026-04-14T06:04:36+00:00
TOI ETimes,45,Anup Jalota pays tribute: calls Asha Bhosle pillar of playback,https://timesofindia.indiatimes.com/articleshow/130225517.cms,2026-04-14T06:04:36+00:00
TOI ETimes,46,Dia Mirza remembers Asha Bhosle: Actor recalls first meeting and shoot,https://timesofindia.indiatimes.com/articleshow/130224700.cms,2026-04-14T06:04:36+00:00
TOI ETimes,47,Beyond Ebooks: The charm of bookstores endures,https://timesofindia.indiatimes.com/articleshow/101098088.cms,2026-04-14T06:04:36+00:00
TOI ETimes,48,It’s a curtain call: Sania Mirza bids adieu to tennis with ‘happy tears’,https://timesofindia.indiatimes.com/articleshow/98440670.cms,2026-04-14T06:04:36+00:00
TOI ETimes,49,A magical makeover for 17th Century stepwell: From neglected ruins to a glorious piece of history,https://timesofindia.indiatimes.com/articleshow/96557955.cms,2026-04-14T06:04:36+00:00
TOI ETimes,50,The city comes alive with Christmas fervour,https://timesofindia.indiatimes.com/articleshow/96406573.cms,2026-04-14T06:04:36+00:00
TOI ETimes,51,#BringRioHome: Pet parents launch search to find their kidnapped cat,https://timesofindia.indiatimes.com/articleshow/96334809.cms,2026-04-14T06:04:36+00:00
TOI ETimes,52,Adil Hussain’s 'Mercy' release date OUT: Film's first look to be attached with Ranveer Singh's 'Dhurandhar: The Revenge',https://timesofindia.indiatimes.com/articleshow/129843424.cms,2026-04-14T06:04:36+00:00
TOI ETimes,53,It’s the best time to be doing theatre: Juhi Babbar Soni,https://timesofindia.indiatimes.com/articleshow/129826631.cms,2026-04-14T06:04:36+00:00
TOI ETimes,54,"Anu Malik steps into theatre with Anupam Kher’s play, Calls it his most exciting challenge yet",https://timesofindia.indiatimes.com/articleshow/129729335.cms,2026-04-14T06:04:36+00:00
TOI ETimes,55,'Wicked' musical director John Stefaniuk on live music on the stage: 'It is so exciting to hear the orchestra whisk us away',https://timesofindia.indiatimes.com/articleshow/129610267.cms,2026-04-14T06:04:36+00:00
TOI ETimes,56,"'Wicked' stars Rebekah Lowings and Eve Shanu-Wilson on Elphaba-Glinda's bond: 'Friends challenge you, not just cheer you on'",https://timesofindia.indiatimes.com/articleshow/129607673.cms,2026-04-14T06:04:36+00:00
TOI ETimes,57,"Vijay Crishna, Shah Rukh Khan’s on-screen father in ‘Devdas,’ passes away at 81: Tributes pour in for theatre stalwart",https://timesofindia.indiatimes.com/articleshow/129016007.cms,2026-04-14T06:04:36+00:00
TOI ETimes,58,Raj Kundra and Shilpa Shetty's 15th Wedding Anniversary,https://timesofindia.indiatimes.com/articleshow/115563990.cms,2026-04-14T06:04:36+00:00
TOI ETimes,59,​Bigg Boss winners list from season 1 to 17​,https://timesofindia.indiatimes.com/articleshow/114277426.cms,2026-04-14T06:04:36+00:00
TOI ETimes,60,​Discover the bird with a prehistoric roar​,https://timesofindia.indiatimes.com/articleshow/114244474.cms,2026-04-14T06:04:36+00:00
TOI ETimes,61,Dia Mirza's ethnic wear,https://timesofindia.indiatimes.com/articleshow/114243410.cms,2026-04-14T06:04:36+00:00
TOI ETimes,62,​Incredible facts about ants you won’t believe​,https://timesofindia.indiatimes.com/articleshow/114243248.cms,2026-04-14T06:04:36+00:00
TOI ETimes,63,'Bigg Boss Marathi 5' nears grand finale​,https://timesofindia.indiatimes.com/articleshow/113936459.cms,2026-04-14T06:04:36+00:00
TOI ETimes,64,Viral: Hyderabad wedding cook reveals 4 secret ingredients behind perfect biryani,https://timesofindia.indiatimes.com/articleshow/130242045.cms,2026-04-14T06:04:36+00:00
TOI ETimes,65,"Meet Zeeshan Bakhrani: Fired twice, now making ₹1.3 crore a month from his Manhattan food venture",https://timesofindia.indiatimes.com/articleshow/130240704.cms,2026-04-14T06:04:36+00:00
TOI ETimes,66,"2-year-old starved to death, ate drywall and diapers in horror home; parents arrested",https://timesofindia.indiatimes.com/articleshow/130236870.cms,2026-04-14T06:04:36+00:00
TOI ETimes,67,Who is Angad Daryani? Indian-origin engineer who dropped out of school now spearheading air purification innovation,https://timesofindia.indiatimes.com/articleshow/130238967.cms,2026-04-14T06:04:36+00:00
TOI ETimes,68,"Happy Rongali Bihu 2026: Best Messages, Quotes, Wishes and Images to share on Assamese New Year",https://timesofindia.indiatimes.com/articleshow/130243736.cms,2026-04-14T06:04:36+00:00
TOI ETimes,69,"Happy Vishu 2026: Wishes, Greetings Card, Messages, WhatsApp Status And Images To Share",https://timesofindia.indiatimes.com/articleshow/130236318.cms,2026-04-14T06:04:36+00:00
TOI ETimes,70,‘Training their own replacements’: Indians filming AI training videos spark backlash online,https://timesofindia.indiatimes.com/articleshow/130235359.cms,2026-04-14T06:04:36+00:00
TOI ETimes,71,"Inside Jeff Bezos and Lauren Sanchez’s daily routine: No phones, sunrise coffee, and a ‘Billionaire Bunker’",https://timesofindia.indiatimes.com/articleshow/130235132.cms,2026-04-14T06:04:36+00:00
TOI ETimes,72,"Happy Baisakhi 2026: Best Messages, Quotes, Wishes and Images to share on Baisakhi",https://timesofindia.indiatimes.com/articleshow/130209908.cms,2026-04-14T06:04:36+00:00
TOI ETimes,73,What is ‘Katychella 2027’? Katy Perry’s viral comment on Justin Bieber at Coachella explained,https://timesofindia.indiatimes.com/articleshow/130233387.cms,2026-04-14T06:04:36+00:00
TOI ETimes,74,From sleeping on streets to giving shelter to others: NYC restaurant owner builds refuge for the homeless,https://timesofindia.indiatimes.com/articleshow/130232214.cms,2026-04-14T06:04:36+00:00
TOI ETimes,75,Ankur Warikoo’s post on ageing parents is hitting everyone right in the heart - here's why!,https://timesofindia.indiatimes.com/articleshow/130231910.cms,2026-04-14T06:04:36+00:00
TOI ETimes,76,Who is Richard Maza? YouTuber arrested after pepper spray clash; lawsuit crosses $1 million,https://timesofindia.indiatimes.com/articleshow/130231139.cms,2026-04-14T06:04:36+00:00
TOI ETimes,77,What is Bixonimania? How AI treated a fake illness as a real medical condition,https://timesofindia.indiatimes.com/articleshow/130230032.cms,2026-04-14T06:04:36+00:00
TOI ETimes,78,'This is evil': AI tool charging $2 per minute to talk with Jesus faces massive backlash online,https://timesofindia.indiatimes.com/articleshow/130226073.cms,2026-04-14T06:04:36+00:00
TOI ETimes,79,‘Priorities clear’: Hilarious KKR vs LSG clip shows husband glued to match as wife walks away mid-argument,https://timesofindia.indiatimes.com/articleshow/130225505.cms,2026-04-14T06:04:36+00:00
TOI ETimes,80,Foreign woman rates Indian cities; Delhi’s shocking score doesn’t surprise many,https://timesofindia.indiatimes.com/articleshow/130224421.cms,2026-04-14T06:04:36+00:00
TOI ETimes,81,Meet Mike Egan: Marine veteran who lost his legs in a blast completes 110 miles outlasting 117 athletes in a brutal 27-hour race,https://timesofindia.indiatimes.com/articleshow/130220469.cms,2026-04-14T06:04:36+00:00
TOI ETimes,82,"Famous 'tape guy' who secretly recorded 10,000 live concerts is now putting them online for free",https://timesofindia.indiatimes.com/articleshow/130219497.cms,2026-04-14T06:04:36+00:00
TOI ETimes,83,"Happy Baisakhi 2026: Top 100 Wishes, Messages and Quotes to share with your loved ones",https://timesofindia.indiatimes.com/articleshow/130208136.cms,2026-04-14T06:04:36+00:00
TOI ETimes,84,5 viral home remedies to kill termites (deemak) without harsh chemicals,https://timesofindia.indiatimes.com/articleshow/130207052.cms,2026-04-14T06:04:36+00:00
